"EA-Type"	"EA-Package"	"EA-Name"	"EA-GUID"	"EA-Parent"	"EA-Domain"	"EA-Domain-GUID"	"EA-Range"	"label"	"definition"	"usage"	"ap-label-nl"	"ap-definition-nl"	"ap-usageNote-nl"	"ap-codelist"	"external term"	"namespace"	"localname"	"type"	"domain"	"range"	"parent"	"min card"	"max card"
"Package"	""	"OSLO-Signalisatie"	"{3F9DEFCA-1236-481d-B8D3-AFFA9FFA8C13}"	""	""	""	""	""	""	""	""	""	""	""	""	"http://"	"fixme.com"	"http://www.w3.org/2002/07/owl#Ontology"	""	""	""	""	""
"CLASS"	"OSLO-Onderdeel"	"Verankeringsmassief"	"{56AC1BE5-7F47-4188-9BAA-B7D5B0621BEE}"	""	""	""	""	"verankeringsmassief"	"Een fundering waarin ankers zijn aangebracht en die zorgen voor bevestiging en stabilisatie van een object."	""	"verankeringsmassief"	"Een fundering waarin ankers zijn aangebracht en die zorgen voor bevestiging en stabilisatie van een object."	""	""	"true"	"https://wegenenverkeer-test.data.vlaanderen.be/ns/onderdeel#"	"Verankeringsmassief"	"http://www.w3.org/2000/01/rdf-schema#Class"	""	""	"https://wegenenverkeer-test.data.vlaanderen.be/ns/abstracten#Betonfundering"	""	""
"CLASS"	"OSLO-Onderdeel"	"Funderingsmassief"	"{9AEFFBA6-9203-4938-A99F-9D0BF6011245}"	""	""	""	""	"funderingsmassief"	"Een fundering waarop een object geplaatst wordt of er (in principe) onlosmakelijk in vastgezet wordt."	""	"funderingsmassief"	"Een fundering waarop een object geplaatst wordt of er (in principe) onlosmakelijk in vastgezet wordt."	""	""	"true"	"https://wegenenverkeer-test.data.vlaanderen.be/ns/onderdeel#"	"Funderingsmassief"	"http://www.w3.org/2000/01/rdf-schema#Class"	""	""	"https://wegenenverkeer-test.data.vlaanderen.be/ns/abstracten#Fundering"	""	""
"CLASS"	"OSLO-Abstracten"	"LEDBord"	"{F187537E-709C-46c3-BAB7-0F8CEE2BC9F4}"	"Verkeersbord"	""	""	""	"LED-bord"	"Abstracte klasse die de gemeenschappelijke eigenschappen van verschillende types dynamische verkeersborden groepeert."	""	"LED-bord"	"Abstracte klasse die de gemeenschappelijke eigenschappen van verschillende types dynamische verkeersborden groepeert."	""	""	"true"	"https://wegenenverkeer-test.data.vlaanderen.be/ns/abstracten#"	"LEDBord"	"http://www.w3.org/2000/01/rdf-schema#Class"	""	""	"https://wegenenverkeer-test.data.vlaanderen.be/ns/implementatieelement#AIMNaamObject, https://wegenenverkeer-test.data.vlaanderen.be/ns/abstracten#Verkeersbord"	""	""
"CLASS"	"OSLO-Onderdeel"	"RetroreflecterendeFolie"	"{6FF9C6D2-7395-4ab5-A9C0-F39F1456CC2C}"	""	""	""	""	"Retroreflecterende folie"	"Retroreflecterend bekledingsmateriaal,bijvoorbeeld van een divergentiepuntbebakeningselement,retroreflecterende koker,of het beeldvlak van een retroreflecterend verkeersbord."	""	"Retroreflecterende folie"	"Retroreflecterend bekledingsmateriaal,bijvoorbeeld van een divergentiepuntbebakeningselement,retroreflecterende koker,of het beeldvlak van een retroreflecterend verkeersbord."	""	""	"true"	"https://wegenenverkeer-test.data.vlaanderen.be/ns/onderdeel#"	"RetroreflecterendeFolie"	"http://www.w3.org/2000/01/rdf-schema#Class"	""	""	"https://wegenenverkeer-test.data.vlaanderen.be/ns/implementatieelement#AIMObject"	""	""
"CLASS"	"OSLO-Abstracten"	"Verkeersbord"	"{1C34AFBE-AAAE-4db2-901C-11FD30255EB1}"	""	""	""	""	"Verkeersbord"	"Abstracte klasse voor borden die een fysieke drager van verkeerstekens kunnen zijn waarvan de betekenis bepaald wordt door een verkeersbordconcept."	""	"Verkeersbord"	"Abstracte klasse voor borden die een fysieke drager van verkeerstekens kunnen zijn waarvan de betekenis bepaald wordt door een verkeersbordconcept."	""	""	"true"	"https://wegenenverkeer-test.data.vlaanderen.be/ns/abstracten#"	"Verkeersbord"	"http://www.w3.org/2000/01/rdf-schema#Class"	""	""	""	""	""
"CLASS"	"OSLO-Abstracten"	"Kantopsluiting"	"{F9C4C786-FE87-4741-AF74-E700228CA681}"	""	""	""	""	"Kantopsluiting"	"Abstracte voor de gemeenschappelijke eigenschappen en relaties voor de kantopsluiting."	""	"Kantopsluiting"	"Abstracte voor de gemeenschappelijke eigenschappen en relaties voor de kantopsluiting."	""	""	"true"	"https://wegenenverkeer-test.data.vlaanderen.be/ns/abstracten#"	"Kantopsluiting"	"http://www.w3.org/2000/01/rdf-schema#Class"	""	""	"https://wegenenverkeer-test.data.vlaanderen.be/ns/abstracten#LijnvormigElement"	""	""
"CLASS"	"OSLO-Onderdeel"	"Divergentiepuntbebakeningselement"	"{9209B4BD-4FBA-4293-A859-30D722787D26}"	"Signalisatie"	""	""	""	"Divergentiepuntbebakeningselement"	"Een constructie met als doel de zichtbaarheid van het divergentiepunt te vergroten."	""	"Divergentiepuntbebakeningselement"	"Een constructie met als doel de zichtbaarheid van het divergentiepunt te vergroten."	""	""	"true"	"https://wegenenverkeer-test.data.vlaanderen.be/ns/onderdeel#"	"Divergentiepuntbebakeningselement"	"http://www.w3.org/2000/01/rdf-schema#Class"	""	""	"https://wegenenverkeer-test.data.vlaanderen.be/ns/implementatieelement#AIMObject, https://wegenenverkeer-test.data.vlaanderen.be/ns/abstracten#Signalisatie"	""	""
"CLASS"	"OSLO-Onderdeel"	"BitumineuzeLaag"	"{F805CC8C-5250-4e0f-BF8B-C8483210D79B}"	""	""	""	""	"Bitumineuze laag"	"Flexibele verharding die meestal uit bitumineus gebonden materialen (asfalt of gietasfalt) bestaat en laagsgewijs wordt aangelegd."	""	"Bitumineuze laag"	"Flexibele verharding die meestal uit bitumineus gebonden materialen (asfalt of gietasfalt) bestaat en laagsgewijs wordt aangelegd."	""	""	"true"	"https://wegenenverkeer-test.data.vlaanderen.be/ns/onderdeel#"	"BitumineuzeLaag"	"http://www.w3.org/2000/01/rdf-schema#Class"	""	""	"https://wegenenverkeer-test.data.vlaanderen.be/ns/abstracten#LaagBouwklasse"	""	""
"CLASS"	"OSLO-Onderdeel"	"Cementbetonverharding"	"{88CAE559-640D-4dd8-B455-0272FE56FAE3}"	""	""	""	""	"Cementbetonverharding"	"Stijve verharding met of zonder wapening verkregen door cementbeton te spreiden en mechanisch te verdichten."	""	"Cementbetonverharding"	"Stijve verharding met of zonder wapening verkregen door cementbeton te spreiden en mechanisch te verdichten."	""	""	"true"	"https://wegenenverkeer-test.data.vlaanderen.be/ns/onderdeel#"	"Cementbetonverharding"	"http://www.w3.org/2000/01/rdf-schema#Class"	""	""	"https://wegenenverkeer-test.data.vlaanderen.be/ns/abstracten#LaagBouwklasse"	""	""
"CLASS"	"OSLO-Abstracten"	"AfschermendeConstructie"	"{0B8AEA3E-11F9-4c16-A842-09CF25827667}"	""	""	""	""	"Afschermende constructie"	"Abstracte die,een lijn- of puntvormige constructie geïnstalleerd langs de weg om een kerend vermogen te bieden aan een dwalend voertuig,samenvat."	""	"Afschermende constructie"	"Abstracte die,een lijn- of puntvormige constructie geïnstalleerd langs de weg om een kerend vermogen te bieden aan een dwalend voertuig,samenvat."	""	""	"true"	"https://wegenenverkeer-test.data.vlaanderen.be/ns/abstracten#"	"AfschermendeConstructie"	"http://www.w3.org/2000/01/rdf-schema#Class"	""	""	"https://wegenenverkeer-test.data.vlaanderen.be/ns/abstracten#LijnvormigElement"	""	""
"CLASS"	"OSLO-Onderdeel"	"DwarseMarkeringVerschuind"	"{0A8DC460-6CF4-4228-AE31-E90186096B93}"	"DwarseMarkeringToegang"	""	""	""	"Dwarse markering verschuind"	"Een schuine markering dwars op de weg aangebracht om het verkeer te waarschuwen,informeren of regelen."	""	"Dwarse markering verschuind"	"Een schuine markering dwars op de weg aangebracht om het verkeer te waarschuwen,informeren of regelen."	""	""	"true"	"https://wegenenverkeer-test.data.vlaanderen.be/ns/onderdeel#"	"DwarseMarkeringVerschuind"	"http://www.w3.org/2000/01/rdf-schema#Class"	""	""	"https://wegenenverkeer-test.data.vlaanderen.be/ns/abstracten#DwarseMarkeringToegang"	""	""
"CLASS"	"OSLO-Abstracten"	"DwarseMarkeringToegang"	"{34A9677D-4055-469d-A123-DB55E25B149E}"	"AOWSType, Markering"	""	""	""	"dwarse markering toegang"	"Abstracte als toegang tot de verschillende soorten dwarse markeringen."	""	"dwarse markering toegang"	"Abstracte als toegang tot de verschillende soorten dwarse markeringen."	""	""	"true"	"https://wegenenverkeer-test.data.vlaanderen.be/ns/abstracten#"	"DwarseMarkeringToegang"	"http://www.w3.org/2000/01/rdf-schema#Class"	""	""	"https://wegenenverkeer-test.data.vlaanderen.be/ns/abstracten#Markering, https://wegenenverkeer-test.data.vlaanderen.be/ns/abstracten#AOWSType"	""	""
"CLASS"	"OSLO-Onderdeel"	"FiguratieMarkeringVerschuind"	"{AB612452-99D8-425a-A474-52720090F37D}"	"FiguratieMarkeringToegang"	""	""	""	"Figuratie markering verschuind"	"Een schuine markering als figuratie op de weg aangebracht om het verkeer te waarschuwen,informeren of regelen."	""	"Figuratie markering verschuind"	"Een schuine markering als figuratie op de weg aangebracht om het verkeer te waarschuwen,informeren of regelen."	""	""	"true"	"https://wegenenverkeer-test.data.vlaanderen.be/ns/onderdeel#"	"FiguratieMarkeringVerschuind"	"http://www.w3.org/2000/01/rdf-schema#Class"	""	""	"https://wegenenverkeer-test.data.vlaanderen.be/ns/abstracten#FiguratieMarkeringToegang"	""	""
"CLASS"	"OSLO-Onderdeel"	"LetterMarkeringVerschaald"	"{E11C3F46-4C58-4cb7-8229-BB60695ABBF5}"	"FiguratieMarkeringToegang"	""	""	""	"Verschaalde letter markering"	"Een markering bestaande uit letters die een verschaling ondergaat zoals een vergroting en/of een verkleining."	""	"Verschaalde letter markering"	"Een markering bestaande uit letters die een verschaling ondergaat zoals een vergroting en/of een verkleining."	""	""	"true"	"https://wegenenverkeer-test.data.vlaanderen.be/ns/onderdeel#"	"LetterMarkeringVerschaald"	"http://www.w3.org/2000/01/rdf-schema#Class"	""	""	"https://wegenenverkeer-test.data.vlaanderen.be/ns/abstracten#FiguratieMarkeringToegang"	""	""
"CLASS"	"OSLO-Onderdeel"	"LetterCijferMarkering"	"{56CC8A70-F36E-4200-BD37-330B508B34C3}"	"FiguratieMarkeringToegang"	""	""	""	"Letter-cijfer markering"	"Een markering bestaande uit individuele letters en/of cijfers."	""	"Letter-cijfer markering"	"Een markering bestaande uit individuele letters en/of cijfers."	""	""	"true"	"https://wegenenverkeer-test.data.vlaanderen.be/ns/onderdeel#"	"LetterCijferMarkering"	"http://www.w3.org/2000/01/rdf-schema#Class"	""	""	"https://wegenenverkeer-test.data.vlaanderen.be/ns/abstracten#FiguratieMarkeringToegang"	""	""
"CLASS"	"OSLO-Abstracten"	"FiguratieMarkeringToegang"	"{5CD5BE3D-B199-4093-816D-2512560F035F}"	"AOWSType, Markering"	""	""	""	"Figuratiemarkering toegang"	"Abstracte als toegang tot de verschillende soorten figuratiemarkeringen."	""	"Figuratiemarkering toegang"	"Abstracte als toegang tot de verschillende soorten figuratiemarkeringen."	""	""	"true"	"https://wegenenverkeer-test.data.vlaanderen.be/ns/abstracten#"	"FiguratieMarkeringToegang"	"http://www.w3.org/2000/01/rdf-schema#Class"	""	""	"https://wegenenverkeer-test.data.vlaanderen.be/ns/abstracten#Markering, https://wegenenverkeer-test.data.vlaanderen.be/ns/abstracten#AOWSType"	""	""
"CLASS"	"OSLO-Installatie"	"Onderbord"	"{E923B6E9-27AF-485a-89FF-AF2A8C979D5F}"	"RetroreflecterendVerkeersbord"	""	""	""	"Onderbord"	"Een bord met een verkeersteken dat als toevoeging onder een verkeersbord is gehangen."	""	"Onderbord"	"Een bord met een verkeersteken dat als toevoeging onder een verkeersbord is gehangen."	""	""	"true"	"https://wegenenverkeer-test.data.vlaanderen.be/ns/installatie#"	"Onderbord"	"http://www.w3.org/2000/01/rdf-schema#Class"	""	""	"https://wegenenverkeer-test.data.vlaanderen.be/ns/onderdeel#RetroreflecterendVerkeersbord"	""	""
"CLASS"	"OSLO-Onderdeel"	"Verkeersbordsteun"	"{EB8FCA5F-29ED-4723-9FF2-510E8A4B51D0}"	"Draagconstructie"	""	""	""	"Verkeersbordsteun"	"Draagconstructie voor een verkeersbord in de vorm van één of meer steunpalen,vakwerksteunen of seinbruggen."	""	"Verkeersbordsteun"	"Draagconstructie voor een verkeersbord in de vorm van één of meer steunpalen,vakwerksteunen of seinbruggen."	""	""	"true"	"https://wegenenverkeer-test.data.vlaanderen.be/ns/onderdeel#"	"Verkeersbordsteun"	"http://www.w3.org/2000/01/rdf-schema#Class"	""	""	"https://wegenenverkeer-test.data.vlaanderen.be/ns/implementatieelement#AIMNaamObject, https://wegenenverkeer-test.data.vlaanderen.be/ns/abstracten#Draagconstructie"	""	""
"CLASS"	"OSLO-Onderdeel"	"CalamiteitsBord"	"{B2CD90D6-915B-44e4-BCA6-AB3306B61174}"	"RetroreflecterendVerkeersbord"	""	""	""	"Calamiteitsbord"	"De aanwijzingsborden ter plaatse van een startpunt,een aantakpunt,een wissel- of koppelpunt van een
omleggingsroute bij calamiteiten zijn geïntegreerd in een één-bordsysteem met een scharnierende
plaat."	""	"Calamiteitsbord"	"De aanwijzingsborden ter plaatse van een startpunt,een aantakpunt,een wissel- of koppelpunt van een
omleggingsroute bij calamiteiten zijn geïntegreerd in een één-bordsysteem met een scharnierende
plaat."	""	""	"true"	"https://wegenenverkeer-test.data.vlaanderen.be/ns/onderdeel#"	"CalamiteitsBord"	"http://www.w3.org/2000/01/rdf-schema#Class"	""	""	"https://wegenenverkeer-test.data.vlaanderen.be/ns/onderdeel#RetroreflecterendVerkeersbord"	""	""
"CLASS"	"OSLO-Onderdeel"	"Bevestigingsbeugel"	"{DDD9E20F-88DD-457d-8D56-FA8D66981075}"	""	""	""	""	"Bevestigingsbeugel"	"Verbindingsstuk waarmee een object kan vastgemaakt worden aan een steun of oppervlak"	""	"Bevestigingsbeugel"	"Verbindingsstuk waarmee een object kan vastgemaakt worden aan een steun of oppervlak"	""	""	"true"	"https://wegenenverkeer-test.data.vlaanderen.be/ns/onderdeel#"	"Bevestigingsbeugel"	"http://www.w3.org/2000/01/rdf-schema#Class"	""	""	"https://wegenenverkeer-test.data.vlaanderen.be/ns/implementatieelement#AIMNaamObject"	""	""
"CLASS"	"OSLO-Installatie"	"VerkeersbordVerkeersteken"	"{B244D154-FE72-4604-8084-0E1E9388C20B}"	"Verkeersteken"	""	""	""	"Verkeersbord - verkeersteken"	"De voorstelling door middel van een verkeersbord van een aanwijzing ten behoeve van de weggebruikers die verbonden wordt aan het aankondigen of opleggen van een bepaalde verkeersmaatregel zoals bepaald in de wegcode."	""	"Verkeersbord - verkeersteken"	"De voorstelling door middel van een verkeersbord van een aanwijzing ten behoeve van de weggebruikers die verbonden wordt aan het aankondigen of opleggen van een bepaalde verkeersmaatregel zoals bepaald in de wegcode."	""	""	"true"	"https://wegenenverkeer-test.data.vlaanderen.be/ns/installatie#"	"VerkeersbordVerkeersteken"	"http://www.w3.org/2000/01/rdf-schema#Class"	""	""	"https://wegenenverkeer-test.data.vlaanderen.be/ns/abstracten#Verkeersteken"	""	""
"CLASS"	"OSLO-Onderdeel"	"Pictogram"	"{0884439B-86E5-4ac2-A1E2-639268BDB0DB}"	""	""	""	""	"Pictogram"	"Een bord dat een symbool of afbeelding bevat dat de plaats inneemt van een tekst."	""	"Pictogram"	"Een bord dat een symbool of afbeelding bevat dat de plaats inneemt van een tekst."	""	""	"true"	"https://wegenenverkeer-test.data.vlaanderen.be/ns/onderdeel#"	"Pictogram"	"http://www.w3.org/2000/01/rdf-schema#Class"	""	""	"https://wegenenverkeer-test.data.vlaanderen.be/ns/implementatieelement#AIMObject"	""	""
"CLASS"	"OSLO-Installatie"	"VerkeersbordConcept"	"{41EC3BB8-269D-49b8-BAC6-C5ED1D48BF6A}"	""	""	""	""	"Verkeersbordconcept"	"Inhoudelijke definitie van de betekenis van een verkeersbord zoals opgenomen in de wegcode."	""	"Verkeersbordconcept"	"Inhoudelijke definitie van de betekenis van een verkeersbord zoals opgenomen in de wegcode."	""	""	"true"	"https://wegenenverkeer-test.data.vlaanderen.be/ns/installatie#"	"VerkeersbordConcept"	"http://www.w3.org/2000/01/rdf-schema#Class"	""	""	"https://wegenenverkeer-test.data.vlaanderen.be/ns/implementatieelement#AIMObject"	""	""
"CLASS"	"OSLO-Abstracten"	"Verkeersteken"	"{E2F36CDB-1558-4418-9D9F-E206118EA2D3}"	""	""	""	""	"Verkeersteken"	"Abstracte klasse voor aanwijzingen ten behoeve van de weggebruikers die verbonden wordt aan het aankondigen of opleggen van een bepaalde verkeersmaatregel zoals bepaald in de wegcode."	""	"Verkeersteken"	"Abstracte klasse voor aanwijzingen ten behoeve van de weggebruikers die verbonden wordt aan het aankondigen of opleggen van een bepaalde verkeersmaatregel zoals bepaald in de wegcode."	""	""	"true"	"https://wegenenverkeer-test.data.vlaanderen.be/ns/abstracten#"	"Verkeersteken"	"http://www.w3.org/2000/01/rdf-schema#Class"	""	""	"https://wegenenverkeer-test.data.vlaanderen.be/ns/implementatieelement#AIMObject"	""	""
"CLASS"	"OSLO-Onderdeel"	"RetroreflecterendVerkeersbord"	"{8A6AF192-1B53-4e20-B0BC-3B5682BBD9C0}"	"Verkeersbord"	""	""	""	"Retroreflecterend verkeersbord"	"Verkeersbord met op het beeldvlak een tekening en/of tekst die worden weergegeven met een geëigend bekledingsmateriaal."	""	"Retroreflecterend verkeersbord"	"Verkeersbord met op het beeldvlak een tekening en/of tekst die worden weergegeven met een geëigend bekledingsmateriaal."	""	""	"true"	"https://wegenenverkeer-test.data.vlaanderen.be/ns/onderdeel#"	"RetroreflecterendVerkeersbord"	"http://www.w3.org/2000/01/rdf-schema#Class"	""	""	"https://wegenenverkeer-test.data.vlaanderen.be/ns/implementatieelement#AIMObject, https://wegenenverkeer-test.data.vlaanderen.be/ns/abstracten#Verkeersbord"	""	""
"CLASS"	"OSLO-Installatie"	"GroepDwarseMarkeringEnFiguratie"	"{C0F9786E-C8A5-4d76-ADEF-F73E060D76E8}"	""	""	""	""	"Groep dwarse- en figuratiemarkering"	"Groepering van de dwarse- en figuratiemarkering."	""	"Groep dwarse- en figuratiemarkering"	"Groepering van de dwarse- en figuratiemarkering."	""	""	"true"	"https://wegenenverkeer-test.data.vlaanderen.be/ns/installatie#"	"GroepDwarseMarkeringEnFiguratie"	"http://www.w3.org/2000/01/rdf-schema#Class"	""	""	"https://wegenenverkeer-test.data.vlaanderen.be/ns/implementatieelement#AIMObject"	""	""
"CLASS"	"OSLO-Abstracten"	"LijnvormigElement"	"{F80F07D9-D885-4584-B981-9B36ADE89777}"	""	""	""	""	"Lijnvormig element"	"Abstracte voor de gemeenschappelijke eigenschappen en relaties van lijnvormige elementen."	""	"Lijnvormig element"	"Abstracte voor de gemeenschappelijke eigenschappen en relaties van lijnvormige elementen."	""	""	"true"	"https://wegenenverkeer-test.data.vlaanderen.be/ns/abstracten#"	"LijnvormigElement"	"http://www.w3.org/2000/01/rdf-schema#Class"	""	""	"https://wegenenverkeer-test.data.vlaanderen.be/ns/implementatieelement#AIMObject"	""	""
"CLASS"	"OSLO-Abstracten"	"Laag"	"{4A6F35DE-CCD7-4c83-8697-FD9F366D973E}"	""	""	""	""	"Laag"	"Abstracte voor de gemeenschappelijke eigenschappen van de onderliggende verhardings- en funderings-onderdelen."	""	"Laag"	"Abstracte voor de gemeenschappelijke eigenschappen van de onderliggende verhardings- en funderings-onderdelen."	""	""	"true"	"https://wegenenverkeer-test.data.vlaanderen.be/ns/abstracten#"	"Laag"	"http://www.w3.org/2000/01/rdf-schema#Class"	""	""	"https://wegenenverkeer-test.data.vlaanderen.be/ns/implementatieelement#AIMObject"	""	""
"CLASS"	"OSLO-Onderdeel"	"OverlangseMarkering"	"{A55DD335-A526-4349-9024-2389D5ED2A89}"	"AOWSType, Markering"	""	""	""	"Overlangse markering"	"Een markering overlangs op de weg aangebracht om het verkeer te waarschuwen,informeren of regelen."	""	"Overlangse markering"	"Een markering overlangs op de weg aangebracht om het verkeer te waarschuwen,informeren of regelen."	""	""	"true"	"https://wegenenverkeer-test.data.vlaanderen.be/ns/onderdeel#"	"OverlangseMarkering"	"http://www.w3.org/2000/01/rdf-schema#Class"	""	""	"https://wegenenverkeer-test.data.vlaanderen.be/ns/abstracten#Markering, https://wegenenverkeer-test.data.vlaanderen.be/ns/abstracten#AOWSType"	""	""
"CLASS"	"OSLO-Onderdeel"	"GekleurdWegvlakMarkering"	"{936560B0-BB67-42be-826D-E04EC6C22148}"	"AOWSType, Markering"	""	""	""	"Gekleurd wegvlak markering"	"Een markering van een wegdeel aangebracht om het verkeer te waarschuwen,informeren of regelen."	""	"Gekleurd wegvlak markering"	"Een markering van een wegdeel aangebracht om het verkeer te waarschuwen,informeren of regelen."	""	""	"true"	"https://wegenenverkeer-test.data.vlaanderen.be/ns/onderdeel#"	"GekleurdWegvlakMarkering"	"http://www.w3.org/2000/01/rdf-schema#Class"	""	""	"https://wegenenverkeer-test.data.vlaanderen.be/ns/abstracten#Markering, https://wegenenverkeer-test.data.vlaanderen.be/ns/abstracten#AOWSType"	""	""
"CLASS"	"OSLO-Onderdeel"	"DwarseMarkering"	"{8D14BC4A-BCB6-4adb-9121-566DE17C09C1}"	"DwarseMarkeringToegang"	""	""	""	"Dwarse markering"	"Een markering dwars op de weg aangebracht om het verkeer te waarschuwen,informeren of regelen."	""	"Dwarse markering"	"Een markering dwars op de weg aangebracht om het verkeer te waarschuwen,informeren of regelen."	""	""	"true"	"https://wegenenverkeer-test.data.vlaanderen.be/ns/onderdeel#"	"DwarseMarkering"	"http://www.w3.org/2000/01/rdf-schema#Class"	""	""	"https://wegenenverkeer-test.data.vlaanderen.be/ns/abstracten#DwarseMarkeringToegang"	""	""
"CLASS"	"OSLO-Onderdeel"	"LijnvormigElementMarkering"	"{478D9667-BAD0-4e4b-8B12-C75EC1948E7D}"	"AOWSType, Markering"	""	""	""	"Lijnvormig element markering"	"Een markering van een lijnvormig element om de zichtbaarheid te verhogen om het verkeer te waarschuwen,informeren of regelen."	""	"Lijnvormig element markering"	"Een markering van een lijnvormig element om de zichtbaarheid te verhogen om het verkeer te waarschuwen,informeren of regelen."	""	""	"true"	"https://wegenenverkeer-test.data.vlaanderen.be/ns/onderdeel#"	"LijnvormigElementMarkering"	"http://www.w3.org/2000/01/rdf-schema#Class"	""	""	"https://wegenenverkeer-test.data.vlaanderen.be/ns/abstracten#Markering, https://wegenenverkeer-test.data.vlaanderen.be/ns/abstracten#AOWSType"	""	""
"CLASS"	"OSLO-Installatie"	"GroepMarkering"	"{1C44DC9B-8691-4a4c-B3DE-ADC2F0616C51}"	""	""	""	""	"Groepering alle soorten markering"	"Groepering om alle soorten markeringen te groeperen."	""	"Groepering alle soorten markering"	"Groepering om alle soorten markeringen te groeperen."	""	""	"true"	"https://wegenenverkeer-test.data.vlaanderen.be/ns/installatie#"	"GroepMarkering"	"http://www.w3.org/2000/01/rdf-schema#Class"	""	""	"https://wegenenverkeer-test.data.vlaanderen.be/ns/implementatieelement#AIMObject"	""	""
"CLASS"	"OSLO-Abstracten"	"AOWSType"	"{29081A42-AB2D-4568-8E14-A38C8C932612}"	""	""	""	""	"AOWS type"	"Abstracte om alle eigenschappen en relaties van AOWS type onder 1 noemer te houden."	""	"AOWS type"	"Abstracte om alle eigenschappen en relaties van AOWS type onder 1 noemer te houden."	""	""	"true"	"https://wegenenverkeer-test.data.vlaanderen.be/ns/abstracten#"	"AOWSType"	"http://www.w3.org/2000/01/rdf-schema#Class"	""	""	""	""	""
"CLASS"	"OSLO-Onderdeel"	"FiguratieMarkering"	"{AB747744-DCA4-42f8-856A-76866EF5FD26}"	"FiguratieMarkeringToegang"	""	""	""	"Figuratiemarkering"	"Een markering als figuratie op de weg aangebracht om het verkeer te waarschuwen,informeren of regelen."	""	"Figuratiemarkering"	"Een markering als figuratie op de weg aangebracht om het verkeer te waarschuwen,informeren of regelen."	""	""	"true"	"https://wegenenverkeer-test.data.vlaanderen.be/ns/onderdeel#"	"FiguratieMarkering"	"http://www.w3.org/2000/01/rdf-schema#Class"	""	""	"https://wegenenverkeer-test.data.vlaanderen.be/ns/abstracten#FiguratieMarkeringToegang"	""	""
"CLASS"	"OSLO-Onderdeel"	"Wegreflector"	"{F0746563-C651-4959-B060-093E81A715D1}"	"Bebakening"	""	""	""	"Wegreflector"	"Heeft als doel de zichtbaarheid van verkeerseilanden te verhogen en geleiding van de weggebruiker langs de weg."	""	"Wegreflector"	"Heeft als doel de zichtbaarheid van verkeerseilanden te verhogen en geleiding van de weggebruiker langs de weg."	""	""	"true"	"https://wegenenverkeer-test.data.vlaanderen.be/ns/onderdeel#"	"Wegreflector"	"http://www.w3.org/2000/01/rdf-schema#Class"	""	""	"https://wegenenverkeer-test.data.vlaanderen.be/ns/abstracten#Bebakening"	""	""
"CLASS"	"OSLO-Onderdeel"	"Reflectorpaal"	"{03F2BA52-CA82-46b8-8214-4BBC42091C61}"	"Bebakening"	""	""	""	"Reflectorpaal"	"Een kunstoffen paal met reflector om het verkeer te geleiden."	""	"Reflectorpaal"	"Een kunstoffen paal met reflector om het verkeer te geleiden."	""	""	"true"	"https://wegenenverkeer-test.data.vlaanderen.be/ns/onderdeel#"	"Reflectorpaal"	"http://www.w3.org/2000/01/rdf-schema#Class"	""	""	"https://wegenenverkeer-test.data.vlaanderen.be/ns/abstracten#Bebakening"	""	""
"CLASS"	"OSLO-Onderdeel"	"WegbebakeningAfschermendeConstructies"	"{53234644-AB60-4826-9167-331D612826B5}"	"Bebakening"	""	""	""	"Wegbebakening afschermende constructie"	"Een houder met reflector op een constructie met als doel het verkeer te geleiden."	""	"Wegbebakening afschermende constructie"	"Een houder met reflector op een constructie met als doel het verkeer te geleiden."	""	""	"true"	"https://wegenenverkeer-test.data.vlaanderen.be/ns/onderdeel#"	"WegbebakeningAfschermendeConstructies"	"http://www.w3.org/2000/01/rdf-schema#Class"	""	""	"https://wegenenverkeer-test.data.vlaanderen.be/ns/abstracten#Bebakening"	""	""
"CLASS"	"OSLO-Onderdeel"	"ReflectorInLijnvormigElement"	"{274D5879-D1FB-4ea4-B1C9-3468657C8CC3}"	"Bebakening"	""	""	""	"Reflector in lijnvormig element"	"Een reflector dat deel uitmaakt van een constructie met als doel de zichtbaarheid van deze constructie te verhogen."	""	"Reflector in lijnvormig element"	"Een reflector dat deel uitmaakt van een constructie met als doel de zichtbaarheid van deze constructie te verhogen."	""	""	"true"	"https://wegenenverkeer-test.data.vlaanderen.be/ns/onderdeel#"	"ReflectorInLijnvormigElement"	"http://www.w3.org/2000/01/rdf-schema#Class"	""	""	"https://wegenenverkeer-test.data.vlaanderen.be/ns/abstracten#Bebakening"	""	""
"CLASS"	"OSLO-Abstracten"	"Draagconstructie"	"{1B8EB7BF-697E-437c-ABCE-562585071F6D}"	""	""	""	""	"Draagconstructie"	"Abstracte voor alle draagconstructies."	""	"Draagconstructie"	"Abstracte voor alle draagconstructies."	""	""	"true"	"https://wegenenverkeer-test.data.vlaanderen.be/ns/abstracten#"	"Draagconstructie"	"http://www.w3.org/2000/01/rdf-schema#Class"	""	""	""	""	""
"CLASS"	"OSLO-Onderdeel"	"OmegaElement"	"{62650413-0622-4232-AEEA-970C4CF6A499}"	"Straatmeubilair"	""	""	""	"Omega element"	"Een voetgangersafsluiting met als doel om de voetgangers te geleiden."	""	"Omega element"	"Een voetgangersafsluiting met als doel om de voetgangers te geleiden."	""	""	"true"	"https://wegenenverkeer-test.data.vlaanderen.be/ns/onderdeel#"	"OmegaElement"	"http://www.w3.org/2000/01/rdf-schema#Class"	""	""	"https://wegenenverkeer-test.data.vlaanderen.be/ns/abstracten#Straatmeubilair"	""	""
