"EA-Type"	"EA-Package"	"EA-Name"	"EA-GUID"	"EA-Parent"	"EA-Domain"	"EA-Domain-GUID"	"EA-Range"	"label"	"definition"	"usage"	"ap-label-nl"	"ap-definition-nl"	"ap-usageNote-nl"	"ap-codelist"	"external term"	"namespace"	"localname"	"type"	"domain"	"range"	"parent"	"min card"	"max card"
"attribute"	"OSLO-OTL-LijnvormigeElementen"	"lengte"	"{B8DFD560-A82C-4723-9877-2D6A70AE4202}"	""	"GestandariseerdeKantopsluitingType"	"{2AD102A8-DADB-4299-98B8-8E62C0B5FD1F}"	"Centimeter"	"lengte"	"De lengte van de kantopsluiting in centimeter"	""	"lengte"	"De lengte van de kantopsluiting in centimeter"	""	""	"false"	"http://fixme.com#"	"lengte"	"http://www.w3.org/2002/07/owl#ObjectProperty"	"http://fixme.com#GestandariseerdeKantopsluitingType"	"http://fixme.com#Centimeter"	""	"1"	"1"
"attribute"	"OSLO-OTL-LijnvormigeElementen"	"soort"	"{2FACB2C4-0574-4ddd-9861-F57351FC6907}"	""	"GestandariseerdeKantopsluitingType"	"{2AD102A8-DADB-4299-98B8-8E62C0B5FD1F}"	"LEKantopsluitingSoort"	"soort"	"Keuzelijst om de soort van kantopsluiting te bepalen"	""	"soort"	"Keuzelijst om de soort van kantopsluiting te bepalen"	""	""	"false"	"http://fixme.com#"	"soort"	"http://www.w3.org/2002/07/owl#ObjectProperty"	"http://fixme.com#GestandariseerdeKantopsluitingType"	"http://fixme.com#LEKantopsluitingSoort"	""	"1"	"1"
"attribute"	"OSLO-OTL-LijnvormigeElementen"	"aantalRijenBetonstraatsteen"	"{BFC94C08-DB08-499c-9AA9-267883832E6A}"	""	"WatergreppelAfw"	"{1455340D-C3E8-4667-B99E-1F8291404695}"	"GeheelGetal"	"aantalRijenBetonstraatsteen"	"Het aantal rijen betonstraatsteen waaruit de watergreppel is opgebouwd."	""	"aantalRijenBetonstraatsteen"	"Het aantal rijen betonstraatsteen waaruit de watergreppel is opgebouwd."	""	""	"false"	"http://fixme.com#"	"aantalRijenBetonstraatsteen"	"http://www.w3.org/2002/07/owl#ObjectProperty"	"http://fixme.com#WatergreppelAfw"	"http://fixme.com#GeheelGetal"	""	"1"	"1"
"attribute"	"OSLO-OTL-LijnvormigeElementen"	"aantalRijenBetonstraatsteen"	"{E5F65C72-8925-4e5a-8A2B-CE311EEF3D5B}"	""	"KantstrookAfw"	"{AA4FF97F-F25D-4673-9FB3-60629AC48646}"	"GeheelGetal"	"aantalRijenBetonstraatsteen"	"Het aantal rijen betonstraatsteen waaruit de kantstrook is opgebouwd."	""	"aantalRijenBetonstraatsteen"	"Het aantal rijen betonstraatsteen waaruit de kantstrook is opgebouwd."	""	""	"false"	"http://fixme.com#"	"aantalRijenBetonstraatsteen"	"http://www.w3.org/2002/07/owl#ObjectProperty"	"http://fixme.com#KantstrookAfw"	"http://fixme.com#GeheelGetal"	""	"1"	"1"
"attribute"	"OSLO-OTL-LijnvormigeElementen"	"breedte"	"{40BCED07-C726-4d20-AD5B-E75766E4F524}"	""	"SchampkantStdType"	"{2D0CDEA7-5803-4329-9F91-0F3405EBF290}"	"Centimeter"	"breedte"	"De breedte van de schampkant in centimeter."	""	"breedte"	"De breedte van de schampkant in centimeter."	""	""	"false"	"http://fixme.com#"	"breedte"	"http://www.w3.org/2002/07/owl#ObjectProperty"	"http://fixme.com#SchampkantStdType"	"http://fixme.com#Centimeter"	""	"1"	"1"
"attribute"	"OSLO-OTL-LijnvormigeElementen"	"dikte"	"{A3354FD9-1297-4e94-B96E-9351055BC076}"	""	"SchampkantStdType"	"{2D0CDEA7-5803-4329-9F91-0F3405EBF290}"	"Centimeter"	"dikte"	"De dikte van de schampkant in centimeter."	""	"dikte"	"De dikte van de schampkant in centimeter."	""	""	"false"	"http://fixme.com#"	"dikte"	"http://www.w3.org/2002/07/owl#ObjectProperty"	"http://fixme.com#SchampkantStdType"	"http://fixme.com#Centimeter"	""	"1"	"1"
"attribute"	"OSLO-OTL-LijnvormigeElementen"	"norm"	"{E1821FA2-3284-4fc9-A7CA-77768E06186F}"	""	"SchampkantStdType"	"{2D0CDEA7-5803-4329-9F91-0F3405EBF290}"	"LENorm"	"norm"	"Keuzelijst voor het bepalen van de norm van de schampkant"	""	"norm"	"Keuzelijst voor het bepalen van de norm van de schampkant"	""	""	"false"	"http://fixme.com#"	"norm"	"http://www.w3.org/2002/07/owl#ObjectProperty"	"http://fixme.com#SchampkantStdType"	"http://fixme.com#LENorm"	""	"1"	"1"
"attribute"	"OSLO-OTL-LijnvormigeElementen"	"type"	"{A9CE904E-248C-430d-9932-C830B06D748F}"	""	"SchampkantStdType"	"{2D0CDEA7-5803-4329-9F91-0F3405EBF290}"	"LESchampkantType"	"type"	"Keuzelijst voor het bepalen van het type van schampkant"	""	"type"	"Keuzelijst voor het bepalen van het type van schampkant"	""	""	"false"	"http://fixme.com#"	"type"	"http://www.w3.org/2002/07/owl#ObjectProperty"	"http://fixme.com#SchampkantStdType"	"http://fixme.com#LESchampkantType"	""	"1"	"1"
"attribute"	"OSLO-OTL-LijnvormigeElementen"	"breedte"	"{1B2E7923-A5DD-4d0a-953F-48FA09CC5DAF}"	""	"KantstrookStdType"	"{12BDFC88-187F-4f55-AC9D-ADA4D54EE8A5}"	"Centimeter"	"breedte"	"De breedte van de kantstrook in centimeter."	""	"breedte"	"De breedte van de kantstrook in centimeter."	""	""	"false"	"http://fixme.com#"	"breedte"	"http://www.w3.org/2002/07/owl#ObjectProperty"	"http://fixme.com#KantstrookStdType"	"http://fixme.com#Centimeter"	""	"1"	"1"
"attribute"	"OSLO-OTL-LijnvormigeElementen"	"dikte"	"{786291DD-AC41-4593-A0E2-1DE08CED31D8}"	""	"KantstrookStdType"	"{12BDFC88-187F-4f55-AC9D-ADA4D54EE8A5}"	"Centimeter"	"dikte"	"De dikte van de kantstrook in centimeter"	""	"dikte"	"De dikte van de kantstrook in centimeter"	""	""	"false"	"http://fixme.com#"	"dikte"	"http://www.w3.org/2002/07/owl#ObjectProperty"	"http://fixme.com#KantstrookStdType"	"http://fixme.com#Centimeter"	""	"1"	"1"
"attribute"	"OSLO-OTL-LijnvormigeElementen"	"norm"	"{9A0F4CC7-37D4-49e7-A0F2-BFD4984C61F0}"	""	"KantstrookStdType"	"{12BDFC88-187F-4f55-AC9D-ADA4D54EE8A5}"	"LENorm"	"norm"	"Keuzelijst voor het bepalen van de norm van de kantstrook"	""	"norm"	"Keuzelijst voor het bepalen van de norm van de kantstrook"	""	""	"false"	"http://fixme.com#"	"norm"	"http://www.w3.org/2002/07/owl#ObjectProperty"	"http://fixme.com#KantstrookStdType"	"http://fixme.com#LENorm"	""	"1"	"1"
"attribute"	"OSLO-OTL-LijnvormigeElementen"	"type"	"{9971FC38-CC57-47ce-82AC-A476E1329CA6}"	""	"KantstrookStdType"	"{12BDFC88-187F-4f55-AC9D-ADA4D54EE8A5}"	"LEKantstrookType"	"type"	"Keuzelijst voor het bepalen van het type van kantstrook"	""	"type"	"Keuzelijst voor het bepalen van het type van kantstrook"	""	""	"false"	"http://fixme.com#"	"type"	"http://www.w3.org/2002/07/owl#ObjectProperty"	"http://fixme.com#KantstrookStdType"	"http://fixme.com#LEKantstrookType"	""	"1"	"1"
"attribute"	"OSLO-OTL-LijnvormigeElementen"	"norm"	"{5FE47804-15D3-406b-A979-AB8E6EE983C7}"	""	"TrottoirbandWatergreppelStdType"	"{938FDC76-692D-473c-A41E-C38C325BBA9C}"	"LENorm"	"norm"	"Keuzelijst voor het bepalen van de norm van de trottoirband_watergreppel"	""	"norm"	"Keuzelijst voor het bepalen van de norm van de trottoirband_watergreppel"	""	""	"false"	"http://fixme.com#"	"norm"	"http://www.w3.org/2002/07/owl#ObjectProperty"	"http://fixme.com#TrottoirbandWatergreppelStdType"	"http://fixme.com#LENorm"	""	"1"	"1"
"attribute"	"OSLO-OTL-LijnvormigeElementen"	"type"	"{55589F48-52C3-43ad-9FCE-178254CEFFBC}"	""	"TrottoirbandWatergreppelStdType"	"{938FDC76-692D-473c-A41E-C38C325BBA9C}"	"LETrottoirbandWatergreppelType"	"type"	"Keuzelijst voor het bepalen van het type van trottoirband_watergreppel"	""	"type"	"Keuzelijst voor het bepalen van het type van trottoirband_watergreppel"	""	""	"false"	"http://fixme.com#"	"type"	"http://www.w3.org/2002/07/owl#ObjectProperty"	"http://fixme.com#TrottoirbandWatergreppelStdType"	"http://fixme.com#LETrottoirbandWatergreppelType"	""	"1"	"1"
"attribute"	"OSLO-OTL-LijnvormigeElementen"	"vorm"	"{317EA84A-91B3-4352-9837-BB44340F495D}"	""	"TrottoirbandWatergreppelStdType"	"{938FDC76-692D-473c-A41E-C38C325BBA9C}"	"TrottoirbandVorm"	"vorm"	"Bepaling van de vorm van de trottoirband_watergreppel"	""	"vorm"	"Bepaling van de vorm van de trottoirband_watergreppel"	""	""	"false"	"http://fixme.com#"	"vorm"	"http://www.w3.org/2002/07/owl#ObjectProperty"	"http://fixme.com#TrottoirbandWatergreppelStdType"	"http://fixme.com#TrottoirbandVorm"	""	"1"	"1"
"attribute"	"OSLO-OTL-LijnvormigeElementen"	"norm"	"{96EA91BB-A1FA-4fc9-9BFF-2CF318753B83}"	""	"WatergreppelStdType"	"{74826583-7C71-4cab-91CB-00051DC8E836}"	"LENorm"	"norm"	"Keuzelijst voor het bepalen van de norm van de watergreppel"	""	"norm"	"Keuzelijst voor het bepalen van de norm van de watergreppel"	""	""	"false"	"http://fixme.com#"	"norm"	"http://www.w3.org/2002/07/owl#ObjectProperty"	"http://fixme.com#WatergreppelStdType"	"http://fixme.com#LENorm"	""	"1"	"1"
"attribute"	"OSLO-OTL-LijnvormigeElementen"	"type"	"{9DF422CE-6124-4d84-B1F4-6BEDA79B4086}"	""	"WatergreppelStdType"	"{74826583-7C71-4cab-91CB-00051DC8E836}"	"LEWatergreppelType"	"type"	"Keuzelijst voor het bepalen van het type van watergreppel"	""	"type"	"Keuzelijst voor het bepalen van het type van watergreppel"	""	""	"false"	"http://fixme.com#"	"type"	"http://www.w3.org/2002/07/owl#ObjectProperty"	"http://fixme.com#WatergreppelStdType"	"http://fixme.com#LEWatergreppelType"	""	"1"	"1"
"attribute"	"OSLO-OTL-LijnvormigeElementen"	"vorm"	"{6505FA23-6E36-49d0-813A-DA1634CC880A}"	""	"WatergreppelStdType"	"{74826583-7C71-4cab-91CB-00051DC8E836}"	"TrottoirbandVorm"	"vorm"	"Bepaling van de vorm van de watergreppel"	""	"vorm"	"Bepaling van de vorm van de watergreppel"	""	""	"false"	"http://fixme.com#"	"vorm"	"http://www.w3.org/2002/07/owl#ObjectProperty"	"http://fixme.com#WatergreppelStdType"	"http://fixme.com#TrottoirbandVorm"	""	"1"	"1"
"attribute"	"OSLO-OTL-LijnvormigeElementen"	"norm"	"{28FB5B9D-3907-485c-BCC4-509436946343}"	""	"TrottoirbandStdType"	"{68C08F9A-31E6-4fbd-8E53-5A26F16EFCD5}"	"LENorm"	"norm"	"Keuzelijst voor het bepalen van de norm van de trottoirband"	""	"norm"	"Keuzelijst voor het bepalen van de norm van de trottoirband"	""	""	"false"	"http://fixme.com#"	"norm"	"http://www.w3.org/2002/07/owl#ObjectProperty"	"http://fixme.com#TrottoirbandStdType"	"http://fixme.com#LENorm"	""	"1"	"1"
"attribute"	"OSLO-OTL-LijnvormigeElementen"	"type"	"{45C08694-4C77-493f-B7A9-4B0372AAA5F6}"	""	"TrottoirbandStdType"	"{68C08F9A-31E6-4fbd-8E53-5A26F16EFCD5}"	"LETrottoirbandType"	"type"	"Keuzelijst voor het bepalen van het type van trottoirband"	""	"type"	"Keuzelijst voor het bepalen van het type van trottoirband"	""	""	"false"	"http://fixme.com#"	"type"	"http://www.w3.org/2002/07/owl#ObjectProperty"	"http://fixme.com#TrottoirbandStdType"	"http://fixme.com#LETrottoirbandType"	""	"1"	"1"
"attribute"	"OSLO-OTL-LijnvormigeElementen"	"vorm"	"{55CFA9E5-568B-47ff-9154-54425BE86B86}"	""	"TrottoirbandStdType"	"{68C08F9A-31E6-4fbd-8E53-5A26F16EFCD5}"	"TrottoirbandVorm"	"vorm"	"Bepaling van de vorm van de trottoirband"	""	"vorm"	"Bepaling van de vorm van de trottoirband"	""	""	"false"	"http://fixme.com#"	"vorm"	"http://www.w3.org/2002/07/owl#ObjectProperty"	"http://fixme.com#TrottoirbandStdType"	"http://fixme.com#TrottoirbandVorm"	""	"1"	"1"
"attribute"	"OSLO-OTL-LijnvormigeElementen"	"geluidskarakteristiek"	"{046256C8-8712-4b62-B93E-5CCB5533A1E1}"	""	"GCMateriaalKarakteristiek"	"{B9A9B255-F2CB-4711-8241-E9F25F63453D}"	"LEGCGeluidskarakteristiek"	"geluidskarakteristiek"	"Het geluidskarakteristiek van de geluidswerende constructie door middel van een keuzelijst."	""	"geluidskarakteristiek"	"Het geluidskarakteristiek van de geluidswerende constructie door middel van een keuzelijst."	""	""	"false"	"http://fixme.com#"	"geluidskarakteristiek"	"http://www.w3.org/2002/07/owl#ObjectProperty"	"http://fixme.com#GCMateriaalKarakteristiek"	"http://fixme.com#LEGCGeluidskarakteristiek"	""	"1"	"1"
"attribute"	"OSLO-OTL-LijnvormigeElementen"	"materiaal"	"{7F37E40A-DFB8-4a4b-83B8-7A10CDE6BA35}"	""	"GCMateriaalKarakteristiek"	"{B9A9B255-F2CB-4711-8241-E9F25F63453D}"	"LEGCMateriaal"	"materiaal"	"Het materiaal van de geluidswerende constructie door middel van een keuzelijst."	""	"materiaal"	"Het materiaal van de geluidswerende constructie door middel van een keuzelijst."	""	""	"false"	"http://fixme.com#"	"materiaal"	"http://www.w3.org/2002/07/owl#ObjectProperty"	"http://fixme.com#GCMateriaalKarakteristiek"	"http://fixme.com#LEGCMateriaal"	""	"1"	"1"
"attribute"	"OSLO-OTL-LijnvormigeElementen"	"aantalLopendeMeter"	"{472D1653-BBB1-41ad-8964-1931655E0C2F}"	""	"OverzichtSchermhoogte"	"{7F4E5A53-BBB3-47c2-91B8-90B6BF9A93EF}"	"Meter"	"aantalLopendeMeter"	"Het aantal lopende meter scherm."	""	"aantalLopendeMeter"	"Het aantal lopende meter scherm."	""	""	"false"	"http://fixme.com#"	"aantalLopendeMeter"	"http://www.w3.org/2002/07/owl#ObjectProperty"	"http://fixme.com#OverzichtSchermhoogte"	"http://fixme.com#Meter"	""	"1"	"1"
"attribute"	"OSLO-OTL-LijnvormigeElementen"	"hoogte"	"{5A3F1146-91FE-4b0c-886C-2E13DDF73AE3}"	""	"OverzichtSchermhoogte"	"{7F4E5A53-BBB3-47c2-91B8-90B6BF9A93EF}"	"Meter"	"hoogte"	"De hoogte van het scherm in meter."	""	"hoogte"	"De hoogte van het scherm in meter."	""	""	"false"	"http://fixme.com#"	"hoogte"	"http://www.w3.org/2002/07/owl#ObjectProperty"	"http://fixme.com#OverzichtSchermhoogte"	"http://fixme.com#Meter"	""	"1"	"1"
"attribute"	"OSLO-OTL-Vegetatie"	"hoogte"	"{24AC56EA-8EA6-4338-AF1B-42D60B32644B}"	""	"VegetatieElement"	"{AD10D488-167D-4022-B9E1-B9F509DED2DA}"	"VegetatieelementHoogte"	"hoogte"	"De hoogte van het object zelf, in meter."	""	"hoogte"	"De hoogte van het object zelf, in meter."	""	""	"true"	"http://fixme.com#"	"hoogte"	"http://www.w3.org/2002/07/owl#ObjectProperty"	"http://fixme.com#VegetatieElement"	"http://fixme.com#VegetatieelementHoogte"	""	"1"	"1"
"attribute"	"OSLO-OTL-Vegetatie"	"nauwkeurigheid"	"{C791A1CD-6F41-4629-8FFF-03E3627D37AE}"	""	"VegetatieElement"	"{AD10D488-167D-4022-B9E1-B9F509DED2DA}"	"OSLONauwkeurigheid"	"nauwkeurigheid"	"De precisie waarmee de plant opgemeten wordt."	""	"nauwkeurigheid"	"De precisie waarmee de plant opgemeten wordt."	""	""	"true"	"http://fixme.com#"	"nauwkeurigheid"	"http://www.w3.org/2002/07/owl#ObjectProperty"	"http://fixme.com#VegetatieElement"	"http://fixme.com#OSLONauwkeurigheid"	""	"1"	"1"
"attribute"	"OSLO-OTL-Vegetatie"	"niveau"	"{61459A8C-8E73-4bb3-B690-5445FBD87B88}"	""	"VegetatieElement"	"{AD10D488-167D-4022-B9E1-B9F509DED2DA}"	"DecimaalGetal"	"niveau"	"Het niveau waarop het object zich bevindt, relatief ten opzichte van andere objecten. Negatieve waarden worden geassocieerd met ondergronds en positieve waarden met bovengronds. Nul wordt beschouwd als een absolute waarde om het maaiveld aan te duiden."	""	"niveau"	"Het niveau waarop het object zich bevindt, relatief ten opzichte van andere objecten. Negatieve waarden worden geassocieerd met ondergronds en positieve waarden met bovengronds. Nul wordt beschouwd als een absolute waarde om het maaiveld aan te duiden."	""	""	"true"	"http://fixme.com#"	"niveau"	"http://www.w3.org/2002/07/owl#ObjectProperty"	"http://fixme.com#VegetatieElement"	"http://fixme.com#DecimaalGetal"	""	"1"	"1"
"attribute"	"OSLO-OTL-Vegetatie"	"plantdatum"	"{38027332-9C53-4c60-A4B7-ACF8CED2EE43}"	""	"VegetatieElement"	"{AD10D488-167D-4022-B9E1-B9F509DED2DA}"	"Datum"	"plantdatum"	"De datum waarop het vegetatie element werd geplant."	""	"plantdatum"	"De datum waarop het vegetatie element werd geplant."	""	""	"true"	"http://fixme.com#"	"plantdatum"	"http://www.w3.org/2002/07/owl#ObjectProperty"	"http://fixme.com#VegetatieElement"	"http://fixme.com#Datum"	""	"1"	"1"
"attribute"	"OSLO-OTL-Vegetatie"	"soortnaam"	"{B83D8D06-60EC-4e52-87E5-BC1ACBD74AAA}"	""	"VegetatieElement"	"{AD10D488-167D-4022-B9E1-B9F509DED2DA}"	"VegetatieSoortnaam"	"soortnaam"	"De naam van de plantensoort"	""	"soortnaam"	"De naam van de plantensoort"	""	""	"true"	"http://fixme.com#"	"soortnaam"	"http://www.w3.org/2002/07/owl#ObjectProperty"	"http://fixme.com#VegetatieElement"	"http://fixme.com#VegetatieSoortnaam"	""	"1"	"1"
"attribute"	"OSLO-OTL-LijnvormigeElementen"	"breedte"	"{D1DD4C1C-C000-4549-A183-3CFF1D70F44C}"	""	"TrottoirbandVorm"	"{706DCB6C-DEA9-42ec-88FC-792FD565899A}"	"Centimeter"	"breedte"	"De breedte van de trottoirband"	""	"breedte"	"De breedte van de trottoirband"	""	""	"false"	"http://fixme.com#"	"breedte"	"http://www.w3.org/2002/07/owl#ObjectProperty"	"http://fixme.com#TrottoirbandVorm"	"http://fixme.com#Centimeter"	""	"1"	"1"
"attribute"	"OSLO-OTL-LijnvormigeElementen"	"dikte"	"{D112BAC1-D7C7-4f4a-B8F0-14BFA050061C}"	""	"TrottoirbandVorm"	"{706DCB6C-DEA9-42ec-88FC-792FD565899A}"	"Centimeter"	"dikte"	"De dikte van de trottoirband"	""	"dikte"	"De dikte van de trottoirband"	""	""	"false"	"http://fixme.com#"	"dikte"	"http://www.w3.org/2002/07/owl#ObjectProperty"	"http://fixme.com#TrottoirbandVorm"	"http://fixme.com#Centimeter"	""	"1"	"1"
"attribute"	"OSLO-OTL-LijnvormigeElementen"	"vorm"	"{F713E20A-A5FF-4534-A4A9-67F044644553}"	""	"TrottoirbandVorm"	"{706DCB6C-DEA9-42ec-88FC-792FD565899A}"	"LETrottoirbandVorm"	"vorm"	"Keuzelijst voor het bepalen van de vorm van de trottoirband"	""	"vorm"	"Keuzelijst voor het bepalen van de vorm van de trottoirband"	""	""	"false"	"http://fixme.com#"	"vorm"	"http://www.w3.org/2002/07/owl#ObjectProperty"	"http://fixme.com#TrottoirbandVorm"	"http://fixme.com#LETrottoirbandVorm"	""	"1"	"1"
"attribute"	"OSLO-OTL-LijnvormigeElementen"	"snelheidsklasse"	"{4BAA9031-A85F-4de8-BF04-C9AE50CB4DAB}"	""	"Motorvangplank"	"{DFADA3BC-AD0E-485f-811E-039F7C168A25}"	"LEACSnelheidsklasse"	"snelheidsklasse"	"De snelheid waarmee de testen uitgevoerd worden en of deze plaatsvinden op een continu of discontinu (niet in gebruik bij AWV) systeem"	""	"snelheidsklasse"	"De snelheid waarmee de testen uitgevoerd worden en of deze plaatsvinden op een continu of discontinu (niet in gebruik bij AWV) systeem"	""	""	"false"	"http://fixme.com#"	"snelheidsklasse"	"http://www.w3.org/2002/07/owl#ObjectProperty"	"http://fixme.com#Motorvangplank"	"http://fixme.com#LEACSnelheidsklasse"	""	"1"	"1"
"attribute"	"OSLO-OTL-LijnvormigeElementen"	"werkingsbreedteMvpwd"	"{3E4ED86C-68DB-44c9-9663-D777521731CE}"	""	"Motorvangplank"	"{DFADA3BC-AD0E-485f-811E-039F7C168A25}"	"Meter"	"werkingsbreedteMvpwd"	"De afstand tussen de voorkant van het onvervormd systeem tot de maximale dynamische laterale positie van elk onderdeel van het systeem."	""	"werkingsbreedteMvpwd"	"De afstand tussen de voorkant van het onvervormd systeem tot de maximale dynamische laterale positie van elk onderdeel van het systeem."	""	""	"false"	"http://fixme.com#"	"werkingsbreedteMvpwd"	"http://www.w3.org/2002/07/owl#ObjectProperty"	"http://fixme.com#Motorvangplank"	"http://fixme.com#Meter"	""	"1"	"1"
"attribute"	"OSLO-OTL-LijnvormigeElementen"	"uitbuigingstype"	"{795DB1D5-541B-49b8-AA9A-F0880A273C24}"	""	"NietGetestBeginstuk"	"{AEAE1D71-CC25-4a1b-9ED6-0219428A8939}"	"LEACUitbuigingstype"	"uitbuigingstype"	"Niet getest beginstuk dat uitbuigt weg van de weg in grondplan. (Lijstje met 2 types)"	""	"uitbuigingstype"	"Niet getest beginstuk dat uitbuigt weg van de weg in grondplan. (Lijstje met 2 types)"	""	""	"false"	"http://fixme.com#"	"uitbuigingstype"	"http://www.w3.org/2002/07/owl#ObjectProperty"	"http://fixme.com#NietGetestBeginstuk"	"http://fixme.com#LEACUitbuigingstype"	""	"1"	"1"
"attribute"	"OSLO-OTL-LijnvormigeElementen"	"werkingsbreedte"	"{FE7C4BF3-B416-4016-8A4E-177F8DCD3F46}"	""	"Geleideconstructie"	"{B7DF148E-8EC0-4b49-ABDB-7E51205C281D}"	"LEACWerkingsbreedte"	"werkingsbreedte"	"Op het voorvlak van een geleideconstructie en loodrecht op de as van de weg gemeten afstand tussen de voorkant van de geleideconstructie in normale positie en de plaats van het verst uitwijkend onderdeel aan de achterzijde van de geleideconstructie bij aanrijding."	""	"werkingsbreedte"	"Op het voorvlak van een geleideconstructie en loodrecht op de as van de weg gemeten afstand tussen de voorkant van de geleideconstructie in normale positie en de plaats van het verst uitwijkend onderdeel aan de achterzijde van de geleideconstructie bij aanrijding."	""	""	"false"	"http://fixme.com#"	"werkingsbreedte"	"http://www.w3.org/2002/07/owl#ObjectProperty"	"http://fixme.com#Geleideconstructie"	"http://fixme.com#LEACWerkingsbreedte"	""	"1"	"1"
"attribute"	"OSLO-OTL-LijnvormigeElementen"	"type"	"{DF5FF5A0-F59E-49e6-9C86-9B2D16ADDFEB}"	""	"Eindstuk"	"{1DA79099-63C3-4756-8A8F-9F77D3B8EA2F}"	"LEACTypeEindstuk"	"type"	"De vorm van het eindstuk"	""	"type"	"De vorm van het eindstuk"	""	""	"false"	"http://fixme.com#"	"type"	"http://www.w3.org/2002/07/owl#ObjectProperty"	"http://fixme.com#Eindstuk"	"http://fixme.com#LEACTypeEindstuk"	""	"1"	"1"
"attribute"	"OSLO-OTL-LijnvormigeElementen"	"type"	"{82337B39-029D-49f3-A054-C5EAF5280F9D}"	""	"Obstakelbeveiliger"	"{73227334-B898-4b76-96A8-22B2D938AC67}"	"LEACObstakelbeveiligerType"	"type"	"De functie die de obstakelbeveiliger vervult"	""	"type"	"De functie die de obstakelbeveiliger vervult"	""	""	"false"	"http://fixme.com#"	"type"	"http://www.w3.org/2002/07/owl#ObjectProperty"	"http://fixme.com#Obstakelbeveiliger"	"http://fixme.com#LEACObstakelbeveiligerType"	""	"1"	"1"
"attribute"	"OSLO-OTL-Proeven"	"geluidsabsorptieReflectie"	"{1C1405B1-94B6-481b-BC48-6CEE44F75180}"	""	"GeluidstestRapport"	"{B2BF9ACF-E5A1-44ba-8557-135C743616DF}"	"GeheelGetal"	"geluidsabsorptieReflectie"	"De absorptie- of reflectiewaarde van het geluidsscherm als geheel getal."	""	"geluidsabsorptieReflectie"	"De absorptie- of reflectiewaarde van het geluidsscherm als geheel getal."	""	""	"true"	"http://fixme.com#"	"geluidsabsorptieReflectie"	"http://www.w3.org/2002/07/owl#ObjectProperty"	"http://fixme.com#GeluidstestRapport"	"http://fixme.com#GeheelGetal"	""	"1"	"1"
"attribute"	"OSLO-OTL-Proeven"	"gemetenWaarde"	"{FFBDD9EC-E2F3-4227-A390-CBE261D15D10}"	""	"GeluidstestRapport"	"{B2BF9ACF-E5A1-44ba-8557-135C743616DF}"	"GeheelGetal"	"gemetenWaarde"	"Getal in dB"	""	"gemetenWaarde"	"Getal in dB"	""	""	"true"	"http://fixme.com#"	"gemetenWaarde"	"http://www.w3.org/2002/07/owl#ObjectProperty"	"http://fixme.com#GeluidstestRapport"	"http://fixme.com#GeheelGetal"	""	"1"	"1"
"attribute"	"OSLO-OTL-Proeven"	"locatieInSitulabo"	"{077F1294-B168-4003-8DD1-2E966B53B7D8}"	""	"GeluidstestRapport"	"{B2BF9ACF-E5A1-44ba-8557-135C743616DF}"	"GCMeetMethode"	"locatieInSitulabo"	"Locatie waar de geluidstest is uitgevoer (terrein of labo)."	""	"locatieInSitulabo"	"Locatie waar de geluidstest is uitgevoer (terrein of labo)."	""	""	"true"	"http://fixme.com#"	"locatieInSitulabo"	"http://www.w3.org/2002/07/owl#ObjectProperty"	"http://fixme.com#GeluidstestRapport"	"http://fixme.com#GCMeetMethode"	""	"1"	"1"
"attribute"	"OSLO-OTL-Proeven"	"luchtgeluidsisolatie"	"{DA698EBB-4938-457b-890D-3A936E3C32AE}"	""	"GeluidstestRapport"	"{B2BF9ACF-E5A1-44ba-8557-135C743616DF}"	"GeheelGetal"	"luchtgeluidsisolatie"	"Geheel getal voor de luchtgeluidsisiolatie van het geluidsscherm."	""	"luchtgeluidsisolatie"	"Geheel getal voor de luchtgeluidsisiolatie van het geluidsscherm."	""	""	"true"	"http://fixme.com#"	"luchtgeluidsisolatie"	"http://www.w3.org/2002/07/owl#ObjectProperty"	"http://fixme.com#GeluidstestRapport"	"http://fixme.com#GeheelGetal"	""	"1"	"1"
"attribute"	"OSLO-OTL-Proeven"	"norm"	"{BE73F8B8-D2F1-4af2-9D6C-2B9397172985}"	""	"GeluidstestRapport"	"{B2BF9ACF-E5A1-44ba-8557-135C743616DF}"	"LEGCNorm"	"norm"	"De proef volgens norm uit de keuzelijst"	""	"norm"	"De proef volgens norm uit de keuzelijst"	""	""	"true"	"http://fixme.com#"	"norm"	"http://www.w3.org/2002/07/owl#ObjectProperty"	"http://fixme.com#GeluidstestRapport"	"http://fixme.com#LEGCNorm"	""	"1"	"1"
"attribute"	"OSLO-OTL-Proeven"	"testrapport"	"{1DDFAD54-E0B4-4cd7-8BA2-1E9A910C7864}"	""	"GeluidstestRapport"	"{B2BF9ACF-E5A1-44ba-8557-135C743616DF}"	"AlgDocumenttype"	"testrapport"	"Document bijlage met de resultaten van de test"	""	"testrapport"	"Document bijlage met de resultaten van de test"	""	""	"true"	"http://fixme.com#"	"testrapport"	"http://www.w3.org/2002/07/owl#ObjectProperty"	"http://fixme.com#GeluidstestRapport"	"http://fixme.com#AlgDocumenttype"	""	"1"	"1"
"attribute"	"OSLO-OTL-Proeven"	"type"	"{F49E8372-B846-4445-A19B-59DE18E23AA5}"	""	"GeluidstestRapport"	"{B2BF9ACF-E5A1-44ba-8557-135C743616DF}"	"LEGCTestType"	"type"	"Het type van de geluidstest."	""	"type"	"Het type van de geluidstest."	""	""	"true"	"http://fixme.com#"	"type"	"http://www.w3.org/2002/07/owl#ObjectProperty"	"http://fixme.com#GeluidstestRapport"	"http://fixme.com#LEGCTestType"	""	"1"	"1"
"attribute"	"OSLO-OTL-Installaties"	"merk"	"{F6EE58A4-D05B-42dc-AE4C-D07DCD23F11C}"	""	"Zonnepaneel"	"{AA295A49-DA4F-4de1-889A-151AFBE2BAF4}"	"ZonnepaneelMerk"	"merk"	"Merk van het zonnepaneel"	""	"merk"	"Merk van het zonnepaneel"	""	""	"true"	"http://fixme.com#"	"merk"	"http://www.w3.org/2002/07/owl#ObjectProperty"	"http://fixme.com#Zonnepaneel"	"http://fixme.com#ZonnepaneelMerk"	""	"1"	"1"
"attribute"	"OSLO-OTL-Installaties"	"type"	"{4AD5296C-DBDE-4234-9185-19CDBD3F7A6E}"	""	"Zonnepaneel"	"{AA295A49-DA4F-4de1-889A-151AFBE2BAF4}"	"ZonnepaneelType"	"type"	"Type zonnepaneel"	""	"type"	"Type zonnepaneel"	""	""	"true"	"http://fixme.com#"	"type"	"http://www.w3.org/2002/07/owl#ObjectProperty"	"http://fixme.com#Zonnepaneel"	"http://fixme.com#ZonnepaneelType"	""	"1"	"1"
"attribute"	"OSLO-OTL-Installaties"	"vermogen"	"{D1DFED2B-DBD7-4388-B980-0D4C502C9434}"	""	"Zonnepaneel"	"{AA295A49-DA4F-4de1-889A-151AFBE2BAF4}"	"Watt"	"vermogen"	"Vermogen zonnepaneel in Watt"	""	"vermogen"	"Vermogen zonnepaneel in Watt"	""	""	"true"	"http://fixme.com#"	"vermogen"	"http://www.w3.org/2002/07/owl#ObjectProperty"	"http://fixme.com#Zonnepaneel"	"http://fixme.com#Watt"	""	"1"	"1"
"attribute"	"OSLO-OTL-Signalisatie"	"nalichtingstijd"	"{C1432610-E1BC-44c3-9C6F-1EF042D1C7F0}"	""	"Pictogram"	"{7C88131E-C34D-40ba-BEC9-48F64B96DABB}"	"Minuut"	"nalichtingstijd"	"De tijd dat het opgeslagen licht (bij bv. Fosforen) in een andere lichtfrekwentie ( met minder energie ) weer wordt uitgezonden."	""	"nalichtingstijd"	"De tijd dat het opgeslagen licht (bij bv. Fosforen) in een andere lichtfrekwentie ( met minder energie ) weer wordt uitgezonden."	""	""	"true"	"http://fixme.com#"	"nalichtingstijd"	"http://www.w3.org/2002/07/owl#ObjectProperty"	"http://fixme.com#Pictogram"	"http://fixme.com#Minuut"	""	"1"	"1"
