"EA-Type"	"EA-Package"	"EA-Name"	"EA-GUID"	"EA-Parent"	"EA-Domain"	"EA-Domain-GUID"	"EA-Range"	"label"	"definition"	"usage"	"ap-label-nl"	"ap-definition-nl"	"ap-usageNote-nl"	"ap-codelist"	"external term"	"namespace"	"localname"	"type"	"domain"	"range"	"parent"	"min card"	"max card"
"attribute"	"OSLO-OTL-Signalisatie"	"opschrift"	"{AE93C412-1B3E-4ab1-9F50-74FC300F702E}"	""	"Pictogram"	"{7C88131E-C34D-40ba-BEC9-48F64B96DABB}"	"Tekstregel"	"opschrift"	"Eventueel begeleidende tekst bij het symbool."	""	"opschrift"	"Eventueel begeleidende tekst bij het symbool."	""	""	"true"	"http://fixme.com#"	"opschrift"	"http://www.w3.org/2002/07/owl#ObjectProperty"	"http://fixme.com#Pictogram"	"http://fixme.com#Tekstregel"	""	"1"	"1"
"attribute"	"OSLO-OTL-Signalisatie"	"symbool"	"{37F58A73-C06A-4eea-93A2-B20465769253}"	""	"Pictogram"	"{7C88131E-C34D-40ba-BEC9-48F64B96DABB}"	"PictogramSymbool"	"symbool"	"Het symbool op het pictogram."	""	"symbool"	"Het symbool op het pictogram."	""	""	"true"	"http://fixme.com#"	"symbool"	"http://www.w3.org/2002/07/owl#ObjectProperty"	"http://fixme.com#Pictogram"	"http://fixme.com#PictogramSymbool"	""	"1"	"1"
"attribute"	"OSLO-OTL-LijnvormigeElementen"	"aanlegdatum"	"{C2E11634-8470-45ce-9814-2175728FE0A8}"	""	"LijnvormigeElementen"	"{728C6382-F0D6-4b33-BC97-8F490C8702E0}"	"Datum"	"aanlegdatum"	"De datum van aanleg van de lijnvormige elementen"	""	"aanlegdatum"	"De datum van aanleg van de lijnvormige elementen"	""	""	"false"	"http://fixme.com#"	"aanlegdatum"	"http://www.w3.org/2002/07/owl#ObjectProperty"	"http://fixme.com#LijnvormigeElementen"	"http://fixme.com#Datum"	""	"1"	"1"
"attribute"	"OSLO-OTL-LijnvormigeElementen"	"technischeFiche"	"{F5C4B71A-0DA8-4a08-B5A7-DA81DFE52029}"	""	"LijnvormigeElementen"	"{728C6382-F0D6-4b33-BC97-8F490C8702E0}"	"AlgDocumenttype"	"technischeFiche"	"De technische fiche van de lijnvormige elementen"	""	"technischeFiche"	"De technische fiche van de lijnvormige elementen"	""	""	"false"	"http://fixme.com#"	"technischeFiche"	"http://www.w3.org/2002/07/owl#ObjectProperty"	"http://fixme.com#LijnvormigeElementen"	"http://fixme.com#AlgDocumenttype"	""	"1"	"Q"
"attribute"	"OSLO-OTL-LijnvormigeElementen"	"type"	"{3260151F-0D21-447c-9341-0B5557E60A01}"	""	"Opening"	"{423974A6-E842-405d-BFFF-9B6647EA8DDB}"	"LEGCOpeningType"	"type"	"Keuzelijst die het type van doorgang bepalen (sas, nooddeur) (voorlopig opgenomen in figuur 8-4-1)"	""	"type"	"Keuzelijst die het type van doorgang bepalen (sas, nooddeur) (voorlopig opgenomen in figuur 8-4-1)"	""	""	"false"	"http://fixme.com#"	"type"	"http://www.w3.org/2002/07/owl#ObjectProperty"	"http://fixme.com#Opening"	"http://fixme.com#LEGCOpeningType"	""	"1"	"1"
"attribute"	"OSLO-OTL-LijnvormigeElementen"	"afdeklatten"	"{AE6AC007-662B-4637-98EF-94C10CE7CD2A}"	""	"GeluidswerendeConstructie"	"{F1533883-16B7-43df-A48D-1ED1050AA0F5}"	"Boolean"	"afdeklatten"	"Boolean om te bepalen of er boven- of onderaan latten gebruikt worden om de geluidswerende constructie te laten aansluiten op de tunnel."	""	"afdeklatten"	"Boolean om te bepalen of er boven- of onderaan latten gebruikt worden om de geluidswerende constructie te laten aansluiten op de tunnel."	""	""	"false"	"http://fixme.com#"	"afdeklatten"	"http://www.w3.org/2002/07/owl#DatatypeProperty"	"http://fixme.com#GeluidswerendeConstructie"	"http://www.w3.org/2001/XMLSchema#boolean"	""	"1"	"1"
"attribute"	"OSLO-OTL-LijnvormigeElementen"	"detailplan3dAsbuilt"	"{F2334E8D-C878-4ec0-8150-7C9799021B4C}"	""	"GeluidswerendeConstructie"	"{F1533883-16B7-43df-A48D-1ED1050AA0F5}"	"AlgDocumenttype"	"detailplan3dAsbuilt"	"detailplan als document bijlage (3D as-built DWG of DXF bestand)"	""	"detailplan3dAsbuilt"	"detailplan als document bijlage (3D as-built DWG of DXF bestand)"	""	""	"false"	"http://fixme.com#"	"detailplan3dAsbuilt"	"http://www.w3.org/2002/07/owl#ObjectProperty"	"http://fixme.com#GeluidswerendeConstructie"	"http://fixme.com#AlgDocumenttype"	""	"1"	"1"
"attribute"	"OSLO-OTL-LijnvormigeElementen"	"fundering"	"{6755A132-ED2B-44e6-93CB-A7683AEEFE31}"	""	"GeluidswerendeConstructie"	"{F1533883-16B7-43df-A48D-1ED1050AA0F5}"	"LEGCFundering"	"fundering"	"Keuzelijst attribuut om fundering op staal of palen te bepalen"	""	"fundering"	"Keuzelijst attribuut om fundering op staal of palen te bepalen"	""	""	"false"	"http://fixme.com#"	"fundering"	"http://www.w3.org/2002/07/owl#ObjectProperty"	"http://fixme.com#GeluidswerendeConstructie"	"http://fixme.com#LEGCFundering"	""	"1"	"1"
"attribute"	"OSLO-OTL-LijnvormigeElementen"	"horizontaalRuimteBeslag"	"{7C073BCE-A291-4dcb-8F03-B21D6C43D52F}"	""	"GeluidswerendeConstructie"	"{F1533883-16B7-43df-A48D-1ED1050AA0F5}"	"Meter"	"horizontaalRuimteBeslag"	"De horizontale ruimte die wordt ingenomen door de geluidswerende constructie"	""	"horizontaalRuimteBeslag"	"De horizontale ruimte die wordt ingenomen door de geluidswerende constructie"	""	""	"false"	"http://fixme.com#"	"horizontaalRuimteBeslag"	"http://www.w3.org/2002/07/owl#ObjectProperty"	"http://fixme.com#GeluidswerendeConstructie"	"http://fixme.com#Meter"	""	"1"	"1"
"attribute"	"OSLO-OTL-LijnvormigeElementen"	"individueleLengteSchermelement"	"{F75767CA-6A2F-4fb8-80D2-90AAC8253C63}"	""	"GeluidswerendeConstructie"	"{F1533883-16B7-43df-A48D-1ED1050AA0F5}"	"Centimeter"	"individueleLengteSchermelement"	"De lengte van het schermelement."	""	"individueleLengteSchermelement"	"De lengte van het schermelement."	""	""	"false"	"http://fixme.com#"	"individueleLengteSchermelement"	"http://www.w3.org/2002/07/owl#ObjectProperty"	"http://fixme.com#GeluidswerendeConstructie"	"http://fixme.com#Centimeter"	""	"1"	"1"
"attribute"	"OSLO-OTL-LijnvormigeElementen"	"kleur"	"{BFCEBD0D-DB8C-473d-ACAC-079D2D62F9D6}"	""	"GeluidswerendeConstructie"	"{F1533883-16B7-43df-A48D-1ED1050AA0F5}"	"KleurRAL"	"kleur"	"De kleur van de geluidswerende constructie."	""	"kleur"	"De kleur van de geluidswerende constructie."	""	""	"false"	"http://fixme.com#"	"kleur"	"http://www.w3.org/2002/07/owl#ObjectProperty"	"http://fixme.com#GeluidswerendeConstructie"	"http://fixme.com#KleurRAL"	""	"1"	"1"
"attribute"	"OSLO-OTL-LijnvormigeElementen"	"materiaalKarakteristiek"	"{E1610EB4-DE28-414d-B5BF-1DEAD4EA171E}"	""	"GeluidswerendeConstructie"	"{F1533883-16B7-43df-A48D-1ED1050AA0F5}"	"GCMateriaalKarakteristiek"	"materiaalKarakteristiek"	"Het materiaal van de geluidswerende constructie en het geluidskarakterisitiek van het materiaal."	""	"materiaalKarakteristiek"	"Het materiaal van de geluidswerende constructie en het geluidskarakterisitiek van het materiaal."	""	""	"false"	"http://fixme.com#"	"materiaalKarakteristiek"	"http://www.w3.org/2002/07/owl#ObjectProperty"	"http://fixme.com#GeluidswerendeConstructie"	"http://fixme.com#GCMateriaalKarakteristiek"	""	"1"	"Q"
"attribute"	"OSLO-OTL-LijnvormigeElementen"	"minimaleDikteSchermelement"	"{7041E698-4C45-4d45-9680-6FC37538BC3F}"	""	"GeluidswerendeConstructie"	"{F1533883-16B7-43df-A48D-1ED1050AA0F5}"	"Centimeter"	"minimaleDikteSchermelement"	"De minimale dikte van het schermelement."	""	"minimaleDikteSchermelement"	"De minimale dikte van het schermelement."	""	""	"false"	"http://fixme.com#"	"minimaleDikteSchermelement"	"http://www.w3.org/2002/07/owl#ObjectProperty"	"http://fixme.com#GeluidswerendeConstructie"	"http://fixme.com#Centimeter"	""	"1"	"1"
"attribute"	"OSLO-OTL-LijnvormigeElementen"	"opstelling"	"{8D93958E-2DA7-4861-82C9-7025080AF518}"	""	"GeluidswerendeConstructie"	"{F1533883-16B7-43df-A48D-1ED1050AA0F5}"	"LEGCOpstelling"	"opstelling"	"De wijze waarop de geluidswerende constructie is geplaatst ten opzichte van de weg."	""	"opstelling"	"De wijze waarop de geluidswerende constructie is geplaatst ten opzichte van de weg."	""	""	"false"	"http://fixme.com#"	"opstelling"	"http://www.w3.org/2002/07/owl#ObjectProperty"	"http://fixme.com#GeluidswerendeConstructie"	"http://fixme.com#LEGCOpstelling"	""	"1"	"1"
"attribute"	"OSLO-OTL-LijnvormigeElementen"	"overzichtSchermhoogte"	"{F1F2D1B9-4073-42b6-9698-CC0D9CD6537B}"	""	"GeluidswerendeConstructie"	"{F1533883-16B7-43df-A48D-1ED1050AA0F5}"	"OverzichtSchermhoogte"	"overzichtSchermhoogte"	"De meest voorkomende schermhoogte volgens bestek"	""	"overzichtSchermhoogte"	"De meest voorkomende schermhoogte volgens bestek"	""	""	"false"	"http://fixme.com#"	"overzichtSchermhoogte"	"http://www.w3.org/2002/07/owl#ObjectProperty"	"http://fixme.com#GeluidswerendeConstructie"	"http://fixme.com#OverzichtSchermhoogte"	""	"1"	"1"
"attribute"	"OSLO-OTL-LijnvormigeElementen"	"schermelement"	"{A385E03C-9573-461b-9938-3277CD73FF60}"	""	"GeluidswerendeConstructie"	"{F1533883-16B7-43df-A48D-1ED1050AA0F5}"	"LEGCSchermelementType"	"schermelement"	"Keuzelijst attribuut om het type van schermelement te bepalen"	""	"schermelement"	"Keuzelijst attribuut om het type van schermelement te bepalen"	""	""	"false"	"http://fixme.com#"	"schermelement"	"http://www.w3.org/2002/07/owl#ObjectProperty"	"http://fixme.com#GeluidswerendeConstructie"	"http://fixme.com#LEGCSchermelementType"	""	"1"	"Q"
"attribute"	"OSLO-OTL-LijnvormigeElementen"	"schermtype"	"{8E56C207-A600-4d99-90E5-653CEA1113EB}"	""	"GeluidswerendeConstructie"	"{F1533883-16B7-43df-A48D-1ED1050AA0F5}"	"LEGCSchermtype"	"schermtype"	"Keuzelijst attribuut om vlak of niet-vlak te bepalen van het scherm. Een vlak scherm zijn alle schermtypes die getest kunnen worden volgens de normen NBN EN 1793-1 NBN EN 1793-2.
De niet-vlakke schermen zijn de schermen die niet kunnen getest worden volgens de normen NBN EN 1793-1 NBN EN 1793-2."	""	"schermtype"	"Keuzelijst attribuut om vlak of niet-vlak te bepalen van het scherm. Een vlak scherm zijn alle schermtypes die getest kunnen worden volgens de normen NBN EN 1793-1 NBN EN 1793-2.
De niet-vlakke schermen zijn de schermen die niet kunnen getest worden volgens de normen NBN EN 1793-1 NBN EN 1793-2."	""	""	"false"	"http://fixme.com#"	"schermtype"	"http://www.w3.org/2002/07/owl#ObjectProperty"	"http://fixme.com#GeluidswerendeConstructie"	"http://fixme.com#LEGCSchermtype"	""	"1"	"Q"
"attribute"	"OSLO-OTL-LijnvormigeElementen"	"statischeBelasting"	"{ED2C07F8-6FB7-44b5-A783-3CEC956B2D91}"	""	"GeluidswerendeConstructie"	"{F1533883-16B7-43df-A48D-1ED1050AA0F5}"	"GeheelGetal"	"statischeBelasting"	"Geheel getal voor de aanduiding van de belasting zonder dynamisch effect, bv. eigengewicht"	""	"statischeBelasting"	"Geheel getal voor de aanduiding van de belasting zonder dynamisch effect, bv. eigengewicht"	""	""	"false"	"http://fixme.com#"	"statischeBelasting"	"http://www.w3.org/2002/07/owl#ObjectProperty"	"http://fixme.com#GeluidswerendeConstructie"	"http://fixme.com#GeheelGetal"	""	"1"	"1"
"attribute"	"OSLO-OTL-LijnvormigeElementen"	"totaleLengte"	"{63CE420F-E116-4394-A3AA-10CF68A02A08}"	""	"GeluidswerendeConstructie"	"{F1533883-16B7-43df-A48D-1ED1050AA0F5}"	"Meter"	"totaleLengte"	"De totale lengte van de geluidswerende constructie in meter"	""	"totaleLengte"	"De totale lengte van de geluidswerende constructie in meter"	""	""	"false"	"http://fixme.com#"	"totaleLengte"	"http://www.w3.org/2002/07/owl#ObjectProperty"	"http://fixme.com#GeluidswerendeConstructie"	"http://fixme.com#Meter"	""	"1"	"1"
"attribute"	"OSLO-OTL-LijnvormigeElementen"	"windbelasting"	"{B6BC2E83-5843-4b65-8531-347175F337ED}"	""	"GeluidswerendeConstructie"	"{F1533883-16B7-43df-A48D-1ED1050AA0F5}"	"GeheelGetal"	"windbelasting"	"Geheel getal voor de aanduiding van de belasting door de wind volgens de norm NBN EN 1994-1-4"	""	"windbelasting"	"Geheel getal voor de aanduiding van de belasting door de wind volgens de norm NBN EN 1994-1-4"	""	""	"false"	"http://fixme.com#"	"windbelasting"	"http://www.w3.org/2002/07/owl#ObjectProperty"	"http://fixme.com#GeluidswerendeConstructie"	"http://fixme.com#GeheelGetal"	""	"1"	"1"
"attribute"	"OSLO-OTL-LijnvormigeElementen"	"breedte"	"{55CC48D8-1F4F-43dd-AE84-DED51D3BFB04}"	""	"AfwijkendeKantopsluiting"	"{E6B81AC2-63A3-4bc3-97F7-0142D136327D}"	"Centimeter"	"breedte"	"De breedte van de afwijkende kantopsluiting in centimeter
"	""	"breedte"	"De breedte van de afwijkende kantopsluiting in centimeter
"	""	""	"false"	"http://fixme.com#"	"breedte"	"http://www.w3.org/2002/07/owl#ObjectProperty"	"http://fixme.com#AfwijkendeKantopsluiting"	"http://fixme.com#Centimeter"	""	"1"	"1"
"attribute"	"OSLO-OTL-LijnvormigeElementen"	"dikte"	"{F3235E44-A025-4d69-8EB6-64D66E57ECC1}"	""	"AfwijkendeKantopsluiting"	"{E6B81AC2-63A3-4bc3-97F7-0142D136327D}"	"Centimeter"	"dikte"	"De dikte van de afwijkende kantopsluiting in centimeter
"	""	"dikte"	"De dikte van de afwijkende kantopsluiting in centimeter
"	""	""	"false"	"http://fixme.com#"	"dikte"	"http://www.w3.org/2002/07/owl#ObjectProperty"	"http://fixme.com#AfwijkendeKantopsluiting"	"http://fixme.com#Centimeter"	""	"1"	"1"
"attribute"	"OSLO-OTL-LijnvormigeElementen"	"geprefabriceerd"	"{0B2C1344-56B6-42a8-8948-CBFDE49ACC1C}"	""	"AfwijkendeKantopsluiting"	"{E6B81AC2-63A3-4bc3-97F7-0142D136327D}"	"Boolean"	"geprefabriceerd"	"Aanduiding of de kantopsluiting al dan niet is geprefabriceerd."	""	"geprefabriceerd"	"Aanduiding of de kantopsluiting al dan niet is geprefabriceerd."	""	""	"false"	"http://fixme.com#"	"geprefabriceerd"	"http://www.w3.org/2002/07/owl#DatatypeProperty"	"http://fixme.com#AfwijkendeKantopsluiting"	"http://www.w3.org/2001/XMLSchema#boolean"	""	"1"	"1"
"attribute"	"OSLO-OTL-LijnvormigeElementen"	"kleur"	"{D3C60297-D342-4de8-BEF8-584FB6F6B4A2}"	""	"AfwijkendeKantopsluiting"	"{E6B81AC2-63A3-4bc3-97F7-0142D136327D}"	"LEKantopsluitingKleur"	"kleur"	"De kleur van de afwijkende kantopsluiting"	""	"kleur"	"De kleur van de afwijkende kantopsluiting"	""	""	"false"	"http://fixme.com#"	"kleur"	"http://www.w3.org/2002/07/owl#ObjectProperty"	"http://fixme.com#AfwijkendeKantopsluiting"	"http://fixme.com#LEKantopsluitingKleur"	""	"1"	"1"
"attribute"	"OSLO-OTL-LijnvormigeElementen"	"lengte"	"{98E482FA-6BA2-44bb-967C-66D65E5D8909}"	""	"AfwijkendeKantopsluiting"	"{E6B81AC2-63A3-4bc3-97F7-0142D136327D}"	"Centimeter"	"lengte"	"De lengte van de afwijkende kantopsluiting in centimeter
"	""	"lengte"	"De lengte van de afwijkende kantopsluiting in centimeter
"	""	""	"false"	"http://fixme.com#"	"lengte"	"http://www.w3.org/2002/07/owl#ObjectProperty"	"http://fixme.com#AfwijkendeKantopsluiting"	"http://fixme.com#Centimeter"	""	"1"	"1"
"attribute"	"OSLO-OTL-LijnvormigeElementen"	"oppervlaktebehandeling"	"{95B8D47D-4C36-4489-A65F-03D85B20DE6E}"	""	"AfwijkendeKantopsluiting"	"{E6B81AC2-63A3-4bc3-97F7-0142D136327D}"	"Boolean"	"oppervlaktebehandeling"	"Bepaling of er een oppervlaktebehandeling is uitgevoerd op de afwijkende kantopsluiting
"	""	"oppervlaktebehandeling"	"Bepaling of er een oppervlaktebehandeling is uitgevoerd op de afwijkende kantopsluiting
"	""	""	"false"	"http://fixme.com#"	"oppervlaktebehandeling"	"http://www.w3.org/2002/07/owl#DatatypeProperty"	"http://fixme.com#AfwijkendeKantopsluiting"	"http://www.w3.org/2001/XMLSchema#boolean"	""	"1"	"1"
"attribute"	"OSLO-OTL-LijnvormigeElementen"	"soort"	"{E21B646E-C291-4566-891E-9B427B93A586}"	""	"AfwijkendeKantopsluiting"	"{E6B81AC2-63A3-4bc3-97F7-0142D136327D}"	"LEKantopsluitingSoort"	"soort"	"Keuzelijst voor het bepalen van de afwijkende kantopsluiting soort"	""	"soort"	"Keuzelijst voor het bepalen van de afwijkende kantopsluiting soort"	""	""	"false"	"http://fixme.com#"	"soort"	"http://www.w3.org/2002/07/owl#ObjectProperty"	"http://fixme.com#AfwijkendeKantopsluiting"	"http://fixme.com#LEKantopsluitingSoort"	""	"1"	"1"
"attribute"	"OSLO-OTL-LijnvormigeElementen"	"tfAfwijking"	"{0D6440C8-35EB-47e7-BDC8-AB9C810A500B}"	""	"AfwijkendeKantopsluiting"	"{E6B81AC2-63A3-4bc3-97F7-0142D136327D}"	"AlgDocumenttype"	"tfAfwijking"	"De technische fiche van de afwijkende kantopsluiting"	""	"tfAfwijking"	"De technische fiche van de afwijkende kantopsluiting"	""	""	"false"	"http://fixme.com#"	"tfAfwijking"	"http://www.w3.org/2002/07/owl#ObjectProperty"	"http://fixme.com#AfwijkendeKantopsluiting"	"http://fixme.com#AlgDocumenttype"	""	"1"	"1"
"attribute"	"OSLO-OTL-VerhardingFundering"	"breedte"	"{B1B6FB14-B0BF-4d8e-94BF-3AC5CCC7D360}"	""	"Laag"	"{58E7E3BD-A9A9-4e04-957D-942F897D7ED8}"	"Meter"	"breedte"	"De breedte van de laag in meter"	""	"breedte"	"De breedte van de laag in meter"	""	""	"true"	"http://fixme.com#"	"breedte"	"http://www.w3.org/2002/07/owl#ObjectProperty"	"http://fixme.com#Laag"	"http://fixme.com#Meter"	""	"1"	"1"
"attribute"	"OSLO-OTL-VerhardingFundering"	"laagRol"	"{33674684-62D6-4803-BB1B-B97DB1D918FF}"	""	"Laag"	"{58E7E3BD-A9A9-4e04-957D-942F897D7ED8}"	"LaagRol"	"laagRol"	"Keuzelijst voor het bepalen van de rol van de laag."	""	"laagRol"	"Keuzelijst voor het bepalen van de rol van de laag."	""	""	"true"	"http://fixme.com#"	"laagRol"	"http://www.w3.org/2002/07/owl#ObjectProperty"	"http://fixme.com#Laag"	"http://fixme.com#LaagRol"	""	"1"	"1"
"attribute"	"OSLO-OTL-VerhardingFundering"	"lengte"	"{FA08A6B6-30C4-403d-889C-CC68626FB900}"	""	"Laag"	"{58E7E3BD-A9A9-4e04-957D-942F897D7ED8}"	"Meter"	"lengte"	"De lengte van de laag in meter"	""	"lengte"	"De lengte van de laag in meter"	""	""	"true"	"http://fixme.com#"	"lengte"	"http://www.w3.org/2002/07/owl#ObjectProperty"	"http://fixme.com#Laag"	"http://fixme.com#Meter"	""	"1"	"1"
"attribute"	"OSLO-OTL-VerhardingFundering"	"oppervlakte"	"{8CAD8483-C674-4d8c-9D55-DAE3BA4C9B67}"	""	"Laag"	"{58E7E3BD-A9A9-4e04-957D-942F897D7ED8}"	"VierkanteMeter"	"oppervlakte"	"De oppervlakte van de laag in m&#178;."	""	"oppervlakte"	"De oppervlakte van de laag in m&#178;."	""	""	"true"	"http://fixme.com#"	"oppervlakte"	"http://www.w3.org/2002/07/owl#ObjectProperty"	"http://fixme.com#Laag"	"http://fixme.com#VierkanteMeter"	""	"1"	"1"
"attribute"	"OSLO-OTL-LijnvormigeElementen"	"certificaathouder"	"{7FD30A11-0345-4dc0-8E76-41EC38DA5228}"	""	"AfschermendeConstructie"	"{4B0764F9-6532-4c7a-BA45-17608719C789}"	"Tekstregel"	"certificaathouder"	"De houder van het uitvoeringscertificaat."	""	"certificaathouder"	"De houder van het uitvoeringscertificaat."	""	""	"false"	"http://fixme.com#"	"certificaathouder"	"http://www.w3.org/2002/07/owl#ObjectProperty"	"http://fixme.com#AfschermendeConstructie"	"http://fixme.com#Tekstregel"	""	"1"	"1"
"attribute"	"OSLO-OTL-LijnvormigeElementen"	"funderingswijze"	"{493DD753-E3B3-41ad-B953-53166A4F9A67}"	""	"AfschermendeConstructie"	"{4B0764F9-6532-4c7a-BA45-17608719C789}"	"LEACFunderingswijze"	"funderingswijze"	"De manier waarop de afschermende constructie gemonteerd wordt."	""	"funderingswijze"	"De manier waarop de afschermende constructie gemonteerd wordt."	""	""	"false"	"http://fixme.com#"	"funderingswijze"	"http://www.w3.org/2002/07/owl#ObjectProperty"	"http://fixme.com#AfschermendeConstructie"	"http://fixme.com#LEACFunderingswijze"	""	"1"	"1"
"attribute"	"OSLO-OTL-LijnvormigeElementen"	"materiaal"	"{BB9F1D5E-8A2F-4a95-97CA-F31D90EEACA3}"	""	"AfschermendeConstructie"	"{4B0764F9-6532-4c7a-BA45-17608719C789}"	"LEACMateriaal"	"materiaal"	"Het gebruikte materiaal voor de afschermende constructie"	""	"materiaal"	"Het gebruikte materiaal voor de afschermende constructie"	""	""	"false"	"http://fixme.com#"	"materiaal"	"http://www.w3.org/2002/07/owl#ObjectProperty"	"http://fixme.com#AfschermendeConstructie"	"http://fixme.com#LEACMateriaal"	""	"1"	"1"
"attribute"	"OSLO-OTL-LijnvormigeElementen"	"permanent"	"{359EB0CE-509B-447e-8AAB-2139E255D1C0}"	""	"AfschermendeConstructie"	"{4B0764F9-6532-4c7a-BA45-17608719C789}"	"Boolean"	"permanent"	"Vermelding of de afschermende constructie al dan niet van permanente aard is."	""	"permanent"	"Vermelding of de afschermende constructie al dan niet van permanente aard is."	""	""	"false"	"http://fixme.com#"	"permanent"	"http://www.w3.org/2002/07/owl#DatatypeProperty"	"http://fixme.com#AfschermendeConstructie"	"http://www.w3.org/2001/XMLSchema#boolean"	""	"1"	"1"
"attribute"	"OSLO-OTL-LijnvormigeElementen"	"productidentificatiecode"	"{A6BCB7F8-0220-44bd-AAE3-B1AD48796FC9}"	""	"AfschermendeConstructie"	"{4B0764F9-6532-4c7a-BA45-17608719C789}"	"Productidentificatiecode"	"productidentificatiecode"	"De productidentificatiecode als keuzelijst voor het bepalen van de code van het gebruikte product (COPRO)."	""	"productidentificatiecode"	"De productidentificatiecode als keuzelijst voor het bepalen van de code van het gebruikte product (COPRO)."	""	""	"false"	"http://fixme.com#"	"productidentificatiecode"	"http://www.w3.org/2002/07/owl#ObjectProperty"	"http://fixme.com#AfschermendeConstructie"	"http://fixme.com#Productidentificatiecode"	""	"1"	"1"
"attribute"	"OSLO-OTL-LijnvormigeElementen"	"uitvoeringscertificatie"	"{AF210BF7-0A35-4e20-945F-BB13DA3ABADA}"	""	"AfschermendeConstructie"	"{4B0764F9-6532-4c7a-BA45-17608719C789}"	"AlgDocumenttype"	"uitvoeringscertificatie"	"Documentatie van het certificaat"	""	"uitvoeringscertificatie"	"Documentatie van het certificaat"	""	""	"false"	"http://fixme.com#"	"uitvoeringscertificatie"	"http://www.w3.org/2002/07/owl#ObjectProperty"	"http://fixme.com#AfschermendeConstructie"	"http://fixme.com#AlgDocumenttype"	""	"1"	"1"
"attribute"	"OSLO-OTL-LijnvormigeElementen"	"video"	"{E2C2B6DC-461B-486e-BE30-DEC6A1B6DEB8}"	""	"AfschermendeConstructie"	"{4B0764F9-6532-4c7a-BA45-17608719C789}"	"AlgDocumenttype"	"video"	"Video van de testen op afschermende constructies"	""	"video"	"Video van de testen op afschermende constructies"	""	""	"false"	"http://fixme.com#"	"video"	"http://www.w3.org/2002/07/owl#ObjectProperty"	"http://fixme.com#AfschermendeConstructie"	"http://fixme.com#AlgDocumenttype"	""	"1"	"Q"
