"EA-Type"	"EA-Package"	"EA-Name"	"EA-GUID"	"EA-Parent"	"EA-Domain"	"EA-Domain-GUID"	"EA-Range"	"label"	"definition"	"usage"	"ap-label-nl"	"ap-definition-nl"	"ap-usageNote-nl"	"ap-codelist"	"external term"	"namespace"	"localname"	"type"	"domain"	"range"	"parent"	"min card"	"max card"
"Package"	""	"OSLO-OTL-LijnvormigeElementen"	"{C73C6925-D88A-49c0-84F2-409BB9A573F1}"	""	""	""	""	""	""	""	""	""	""	""	""	"http://"	"fixme.com"	"http://www.w3.org/2002/07/owl#Ontology"	""	""	""	""	""
"CLASS"	"OSLO-OTL-LijnvormigeElementen"	"GestandariseerdeKantopsluitingType"	"{2AD102A8-DADB-4299-98B8-8E62C0B5FD1F}"	""	""	""	""	"GestandariseerdeKantopsluitingType"	"abstracte/verzameling van de gemeenschappelijke eigenschappen voor de gestandariseerde kantopsluiting types"	""	"GestandariseerdeKantopsluitingType"	"abstracte/verzameling van de gemeenschappelijke eigenschappen voor de gestandariseerde kantopsluiting types"	""	""	"false"	"http://fixme.com#"	"GestandariseerdeKantopsluitingType"	"http://www.w3.org/2000/01/rdf-schema#Class"	""	""	""	""	""
"CLASS"	"OSLO-OTL-LijnvormigeElementen"	"TrottoirbandAfw"	"{519FE46D-7161-46f7-AC03-841D9E827E50}"	"AfwijkendeKantopsluiting"	""	""	""	"TrottoirbandAfw"	"Kantopsluiting bestemd om de rand van de verharding te beschermen en te versterken."	""	"TrottoirbandAfw"	"Kantopsluiting bestemd om de rand van de verharding te beschermen en te versterken."	""	""	"false"	"http://fixme.com#"	"TrottoirbandAfw"	"http://www.w3.org/2000/01/rdf-schema#Class"	""	""	"http://fixme.com#AfwijkendeKantopsluiting"	""	""
"CLASS"	"OSLO-OTL-LijnvormigeElementen"	"WatergreppelAfw"	"{1455340D-C3E8-4667-B99E-1F8291404695}"	"AfwijkendeKantopsluiting"	""	""	""	"WatergreppelAfw"	"Kantopsluiting bestemd om water van de verharding op te vangen en af te voeren."	""	"WatergreppelAfw"	"Kantopsluiting bestemd om water van de verharding op te vangen en af te voeren."	""	""	"false"	"http://fixme.com#"	"WatergreppelAfw"	"http://www.w3.org/2000/01/rdf-schema#Class"	""	""	"http://fixme.com#AfwijkendeKantopsluiting"	""	""
"CLASS"	"OSLO-OTL-LijnvormigeElementen"	"TrottoirbandWatergreppelAfw"	"{5E3CD29C-631F-4a5b-9820-4B7E09BA6686}"	"AfwijkendeKantopsluiting"	""	""	""	"TrottoirbandWatergreppelAfw"	"Kantopsluiting die een trottoirband en een watergreppel combineert in een geheel."	""	"TrottoirbandWatergreppelAfw"	"Kantopsluiting die een trottoirband en een watergreppel combineert in een geheel."	""	""	"false"	"http://fixme.com#"	"TrottoirbandWatergreppelAfw"	"http://www.w3.org/2000/01/rdf-schema#Class"	""	""	"http://fixme.com#AfwijkendeKantopsluiting"	""	""
"CLASS"	"OSLO-OTL-LijnvormigeElementen"	"KantstrookAfw"	"{AA4FF97F-F25D-4673-9FB3-60629AC48646}"	"AfwijkendeKantopsluiting"	""	""	""	"KantstrookAfw"	"Kantopsluiting bestemd om de verharding steun te geven."	""	"KantstrookAfw"	"Kantopsluiting bestemd om de verharding steun te geven."	""	""	"false"	"http://fixme.com#"	"KantstrookAfw"	"http://www.w3.org/2000/01/rdf-schema#Class"	""	""	"http://fixme.com#AfwijkendeKantopsluiting"	""	""
"CLASS"	"OSLO-OTL-LijnvormigeElementen"	"SchampkantAfw"	"{848EBDAB-D754-457f-BD5B-0A43CBB016A3}"	"AfwijkendeKantopsluiting"	""	""	""	"SchampkantAfw"	"Kantopsluiting die zones van voertuigenverkeer onderling of voertuigenzones van andere
verkeerszones scheidt en de overschrijding door voertuigen bemoeilijkt maar geen voertuigkerende
functie heeft."	""	"SchampkantAfw"	"Kantopsluiting die zones van voertuigenverkeer onderling of voertuigenzones van andere
verkeerszones scheidt en de overschrijding door voertuigen bemoeilijkt maar geen voertuigkerende
functie heeft."	""	""	"false"	"http://fixme.com#"	"SchampkantAfw"	"http://www.w3.org/2000/01/rdf-schema#Class"	""	""	"http://fixme.com#AfwijkendeKantopsluiting"	""	""
"CLASS"	"OSLO-OTL-LijnvormigeElementen"	"SchampkantStdType"	"{2D0CDEA7-5803-4329-9F91-0F3405EBF290}"	"GestandariseerdeKantopsluitingType"	""	""	""	"SchampkantStdType"	"Type object voor gestandardiseerde schampkant"	""	"SchampkantStdType"	"Type object voor gestandardiseerde schampkant"	""	""	"false"	"http://fixme.com#"	"SchampkantStdType"	"http://www.w3.org/2000/01/rdf-schema#Class"	""	""	"http://fixme.com#GestandariseerdeKantopsluitingType"	""	""
"CLASS"	"OSLO-OTL-LijnvormigeElementen"	"KantstrookStdType"	"{12BDFC88-187F-4f55-AC9D-ADA4D54EE8A5}"	"GestandariseerdeKantopsluitingType"	""	""	""	"KantstrookStdType"	"Type object voor gestandardiseerde kantstrook"	""	"KantstrookStdType"	"Type object voor gestandardiseerde kantstrook"	""	""	"false"	"http://fixme.com#"	"KantstrookStdType"	"http://www.w3.org/2000/01/rdf-schema#Class"	""	""	"http://fixme.com#GestandariseerdeKantopsluitingType"	""	""
"CLASS"	"OSLO-OTL-LijnvormigeElementen"	"TrottoirbandWatergreppelStdType"	"{938FDC76-692D-473c-A41E-C38C325BBA9C}"	"GestandariseerdeKantopsluitingType"	""	""	""	"TrottoirbandWatergreppelStdType"	"Type object voor gestandardiseerde trottoirband_watergreppel"	""	"TrottoirbandWatergreppelStdType"	"Type object voor gestandardiseerde trottoirband_watergreppel"	""	""	"false"	"http://fixme.com#"	"TrottoirbandWatergreppelStdType"	"http://www.w3.org/2000/01/rdf-schema#Class"	""	""	"http://fixme.com#GestandariseerdeKantopsluitingType"	""	""
"CLASS"	"OSLO-OTL-LijnvormigeElementen"	"WatergreppelStdType"	"{74826583-7C71-4cab-91CB-00051DC8E836}"	"GestandariseerdeKantopsluitingType"	""	""	""	"WatergreppelStdType"	"Type object voor gestandardiseerde watergreppel"	""	"WatergreppelStdType"	"Type object voor gestandardiseerde watergreppel"	""	""	"false"	"http://fixme.com#"	"WatergreppelStdType"	"http://www.w3.org/2000/01/rdf-schema#Class"	""	""	"http://fixme.com#GestandariseerdeKantopsluitingType"	""	""
"CLASS"	"OSLO-OTL-LijnvormigeElementen"	"TrottoirbandStdType"	"{68C08F9A-31E6-4fbd-8E53-5A26F16EFCD5}"	"GestandariseerdeKantopsluitingType"	""	""	""	"TrottoirbandStdType"	"Type object voor gestandardiseerde trottoirband"	""	"TrottoirbandStdType"	"Type object voor gestandardiseerde trottoirband"	""	""	"false"	"http://fixme.com#"	"TrottoirbandStdType"	"http://www.w3.org/2000/01/rdf-schema#Class"	""	""	"http://fixme.com#GestandariseerdeKantopsluitingType"	""	""
"CLASS"	"OSLO-OTL-LijnvormigeElementen"	"TrottoirbandWatergreppelStd"	"{7832E442-3AB4-433a-9EAB-BC97220B629B}"	"GestandaardiseerdeKantopsluiting"	""	""	""	"TrottoirbandWatergreppelStd"	"Kantopsluiting die een trottoirband en een watergreppel combineert in een geheel."	""	"TrottoirbandWatergreppelStd"	"Kantopsluiting die een trottoirband en een watergreppel combineert in een geheel."	""	""	"false"	"http://fixme.com#"	"TrottoirbandWatergreppelStd"	"http://www.w3.org/2000/01/rdf-schema#Class"	""	""	"http://fixme.com#GestandaardiseerdeKantopsluiting"	""	""
"CLASS"	"OSLO-OTL-LijnvormigeElementen"	"SchampkantStd"	"{0D076C20-7666-4afc-9ED9-5DE78D58D296}"	"GestandaardiseerdeKantopsluiting"	""	""	""	"SchampkantStd"	"Kantopsluiting die zones van voertuigenverkeer onderling of voertuigenzones van andere
verkeerszones scheidt en de overschrijding door voertuigen bemoeilijkt maar geen voertuigkerende
functie heeft."	""	"SchampkantStd"	"Kantopsluiting die zones van voertuigenverkeer onderling of voertuigenzones van andere
verkeerszones scheidt en de overschrijding door voertuigen bemoeilijkt maar geen voertuigkerende
functie heeft."	""	""	"false"	"http://fixme.com#"	"SchampkantStd"	"http://www.w3.org/2000/01/rdf-schema#Class"	""	""	"http://fixme.com#GestandaardiseerdeKantopsluiting"	""	""
"CLASS"	"OSLO-OTL-LijnvormigeElementen"	"KantstrookStd"	"{7CC57DCE-6CF7-4a2d-AB91-871448B40312}"	"GestandaardiseerdeKantopsluiting"	""	""	""	"KantstrookStd"	"Kantopsluiting bestemd om de verharding steun te geven."	""	"KantstrookStd"	"Kantopsluiting bestemd om de verharding steun te geven."	""	""	"false"	"http://fixme.com#"	"KantstrookStd"	"http://www.w3.org/2000/01/rdf-schema#Class"	""	""	"http://fixme.com#GestandaardiseerdeKantopsluiting"	""	""
"CLASS"	"OSLO-OTL-LijnvormigeElementen"	"WatergreppelStd"	"{30579EB6-6BEA-4e5b-A866-F60F55931C61}"	"GestandaardiseerdeKantopsluiting"	""	""	""	"WatergreppelStd"	"Kantopsluiting bestemd om water van de verharding op te vangen en af te voeren."	""	"WatergreppelStd"	"Kantopsluiting bestemd om water van de verharding op te vangen en af te voeren."	""	""	"false"	"http://fixme.com#"	"WatergreppelStd"	"http://www.w3.org/2000/01/rdf-schema#Class"	""	""	"http://fixme.com#GestandaardiseerdeKantopsluiting"	""	""
"CLASS"	"OSLO-OTL-LijnvormigeElementen"	"TrottoirbandStd"	"{BC5D8392-95AC-4118-B47A-FD497C000E5A}"	"GestandaardiseerdeKantopsluiting"	""	""	""	"TrottoirbandStd"	"Kantopsluiting bestemd om de rand van de verharding te beschermen en te versterken."	""	"TrottoirbandStd"	"Kantopsluiting bestemd om de rand van de verharding te beschermen en te versterken."	""	""	"false"	"http://fixme.com#"	"TrottoirbandStd"	"http://www.w3.org/2000/01/rdf-schema#Class"	""	""	"http://fixme.com#GestandaardiseerdeKantopsluiting"	""	""
"DATATYPE"	"OSLO-OTL-LijnvormigeElementen"	"GCMateriaalKarakteristiek"	"{B9A9B255-F2CB-4711-8241-E9F25F63453D}"	""	""	""	""	""	""	""	""	"TODO"	""	""	"false"	"http://fixme.com#"	"GCMateriaalKarakteristiek"	"http://www.w3.org/2000/01/rdf-schema#Class"	""	""	""	""	""
"DATATYPE"	"OSLO-OTL-LijnvormigeElementen"	"OverzichtSchermhoogte"	"{7F4E5A53-BBB3-47c2-91B8-90B6BF9A93EF}"	""	""	""	""	""	""	""	""	"TODO"	""	""	"false"	"http://fixme.com#"	"OverzichtSchermhoogte"	"http://www.w3.org/2000/01/rdf-schema#Class"	""	""	""	""	""
"CLASS"	"OSLO-OTL-LijnvormigeElementen"	"ACAansluitendeConstructies"	"{0F7919D1-997B-45a5-973A-482A6E5131AA}"	"AfschermendeConstructie"	""	""	""	"ACAansluitendeConstructies"	"Abstracte die alle aansluitende constructies samenbundelt"	""	"ACAansluitendeConstructies"	"Abstracte die alle aansluitende constructies samenbundelt"	""	""	"false"	"http://fixme.com#"	"ACAansluitendeConstructies"	"http://www.w3.org/2000/01/rdf-schema#Class"	""	""	"http://fixme.com#AfschermendeConstructie"	""	""
"CLASS"	"OSLO-OTL-Vegetatie"	"VegetatieElement"	"{AD10D488-167D-4022-B9E1-B9F509DED2DA}"	""	""	""	""	"VegetatieElement"	"Solitaire plant in de ruimte."	""	"VegetatieElement"	"Solitaire plant in de ruimte."	""	""	"true"	"http://fixme.com#"	"VegetatieElement"	"http://www.w3.org/2000/01/rdf-schema#Class"	""	""	""	""	""
"DATATYPE"	"OSLO-OTL-LijnvormigeElementen"	"TrottoirbandVorm"	"{706DCB6C-DEA9-42ec-88FC-792FD565899A}"	""	""	""	""	""	""	""	""	"TODO"	""	""	"false"	"http://fixme.com#"	"TrottoirbandVorm"	"http://www.w3.org/2000/01/rdf-schema#Class"	""	""	""	""	""
"CLASS"	"OSLO-OTL-LijnvormigeElementen"	"Motorvangplank"	"{DFADA3BC-AD0E-485f-811E-039F7C168A25}"	""	""	""	""	"Motorvangplank"	"Een constructie geïnstalleerd aan een geleideconstructie of in de onmiddellijke omgeving ervan, met als doel de ernst van een botsing van een motorrijder met de geleideconstructie te reduceren."	""	"Motorvangplank"	"Een constructie geïnstalleerd aan een geleideconstructie of in de onmiddellijke omgeving ervan, met als doel de ernst van een botsing van een motorrijder met de geleideconstructie te reduceren."	""	""	"false"	"http://fixme.com#"	"Motorvangplank"	"http://www.w3.org/2000/01/rdf-schema#Class"	""	""	"http://fixme.com#ProefAPrioriMotorvangplank"	""	""
"CLASS"	"OSLO-OTL-LijnvormigeElementen"	"GetesteBeginconstructie"	"{D500834E-DD9F-4c86-A3A2-AEF0A4C8EC3C}"	"Beginstuk"	""	""	""	"GetesteBeginconstructie"	"Een gecertficeerd begin aan een geleideconstructie, met als doel de ernst van een frontale botsing te reduceren aan de stroomopwaartse zijde ten opzichte van de meest nabij gelegen rijstrook."	""	"GetesteBeginconstructie"	"Een gecertficeerd begin aan een geleideconstructie, met als doel de ernst van een frontale botsing te reduceren aan de stroomopwaartse zijde ten opzichte van de meest nabij gelegen rijstrook."	""	""	"false"	"http://fixme.com#"	"GetesteBeginconstructie"	"http://www.w3.org/2000/01/rdf-schema#Class"	""	""	"http://fixme.com#ProefAPrioriGetesteBeginconstructie, http://fixme.com#Beginstuk"	""	""
"CLASS"	"OSLO-OTL-LijnvormigeElementen"	"NietGetestBeginstuk"	"{AEAE1D71-CC25-4a1b-9ED6-0219428A8939}"	"Beginstuk"	""	""	""	"NietGetestBeginstuk"	"Een niet-gecertificeerd begin aan een geleideconstructie, aan de stroomopwaartse zijde ten opzichte van de meest nabij gelegen rijstrook."	""	"NietGetestBeginstuk"	"Een niet-gecertificeerd begin aan een geleideconstructie, aan de stroomopwaartse zijde ten opzichte van de meest nabij gelegen rijstrook."	""	""	"false"	"http://fixme.com#"	"NietGetestBeginstuk"	"http://www.w3.org/2000/01/rdf-schema#Class"	""	""	"http://fixme.com#Beginstuk"	""	""
"CLASS"	"OSLO-OTL-LijnvormigeElementen"	"Beginstuk"	"{D5C3A2EA-E02C-4121-B6CE-2909E6135BE4}"	"ACAansluitendeConstructies"	""	""	""	"Beginstuk"	"(abstracte): Een stuk aan het uiteinde van een geleideconstructie, met als doel een frontale botsing te reduceren gericht naar het naderende verkeer."	""	"Beginstuk"	"(abstracte): Een stuk aan het uiteinde van een geleideconstructie, met als doel een frontale botsing te reduceren gericht naar het naderende verkeer."	""	""	"false"	"http://fixme.com#"	"Beginstuk"	"http://www.w3.org/2000/01/rdf-schema#Class"	""	""	"http://fixme.com#ACAansluitendeConstructies"	""	""
"CLASS"	"OSLO-OTL-LijnvormigeElementen"	"Overgangsconstructie"	"{CA188375-2276-4ff1-9CEF-C79A0837DC8B}"	"ACAansluitendeConstructies"	""	""	""	"Overgangsconstructie"	"Verbinding tussen twee afschermende constructies voor wegen van verschillende ontwerpen en/of prestatiekenmerken."	""	"Overgangsconstructie"	"Verbinding tussen twee afschermende constructies voor wegen van verschillende ontwerpen en/of prestatiekenmerken."	""	""	"false"	"http://fixme.com#"	"Overgangsconstructie"	"http://www.w3.org/2000/01/rdf-schema#Class"	""	""	"http://fixme.com#ProefAPrioriOvergangsconstructie, http://fixme.com#ACAansluitendeConstructies"	""	""
"CLASS"	"OSLO-OTL-LijnvormigeElementen"	"Geleideconstructie"	"{B7DF148E-8EC0-4b49-ABDB-7E51205C281D}"	"ACAansluitendeConstructies"	""	""	""	"Geleideconstructie"	"Een doorlopende afschermende constructie voor voertuigen geïnstalleerd langs de weg of in de middenberm."	""	"Geleideconstructie"	"Een doorlopende afschermende constructie voor voertuigen geïnstalleerd langs de weg of in de middenberm."	""	""	"false"	"http://fixme.com#"	"Geleideconstructie"	"http://www.w3.org/2000/01/rdf-schema#Class"	""	""	"http://fixme.com#ProefAPrioriGeleideConstructie, http://fixme.com#ACAansluitendeConstructies"	""	""
"CLASS"	"OSLO-OTL-LijnvormigeElementen"	"Eindstuk"	"{1DA79099-63C3-4756-8A8F-9F77D3B8EA2F}"	"AfschermendeConstructie"	""	""	""	"Eindstuk"	"Een niet-gecertificeerd einde aan een geleideconstructie, aan de stroomafwaartse zijde ten opzichte van de meest nabij gelegen rijstrook."	""	"Eindstuk"	"Een niet-gecertificeerd einde aan een geleideconstructie, aan de stroomafwaartse zijde ten opzichte van de meest nabij gelegen rijstrook."	""	""	"false"	"http://fixme.com#"	"Eindstuk"	"http://www.w3.org/2000/01/rdf-schema#Class"	""	""	"http://fixme.com#AfschermendeConstructie"	""	""
"CLASS"	"OSLO-OTL-LijnvormigeElementen"	"Obstakelbeveiliger"	"{73227334-B898-4b76-96A8-22B2D938AC67}"	"ACAansluitendeConstructies"	""	""	""	"Obstakelbeveiliger"	"Een energie-absorberende constructie voor voertuigen, geïnstalleerd vóór één of meerdere obstakels, met als doel de ernst van een botsing te reduceren."	""	"Obstakelbeveiliger"	"Een energie-absorberende constructie voor voertuigen, geïnstalleerd vóór één of meerdere obstakels, met als doel de ernst van een botsing te reduceren."	""	""	"false"	"http://fixme.com#"	"Obstakelbeveiliger"	"http://www.w3.org/2000/01/rdf-schema#Class"	""	""	"http://fixme.com#ProefAPrioriObstakelbeveiliger, http://fixme.com#ACAansluitendeConstructies"	""	""
"DATATYPE"	"OSLO-OTL-Proeven"	"GeluidstestRapport"	"{B2BF9ACF-E5A1-44ba-8557-135C743616DF}"	""	""	""	""	""	""	""	""	"TODO"	""	""	"true"	"http://fixme.com#"	"GeluidstestRapport"	"http://www.w3.org/2000/01/rdf-schema#Class"	""	""	""	""	""
"CLASS"	"OSLO-OTL-Installaties"	"Zonnepaneel"	"{AA295A49-DA4F-4de1-889A-151AFBE2BAF4}"	""	""	""	""	"Zonnepaneel"	"Ook wel fotovoltaïsche cellen of zonnecellen.
Toestel om elektrische energie op te wekken uit zonlicht met als doel het voeden van een installatie."	""	"Zonnepaneel"	"Ook wel fotovoltaïsche cellen of zonnecellen.
Toestel om elektrische energie op te wekken uit zonlicht met als doel het voeden van een installatie."	""	""	"true"	"http://fixme.com#"	"Zonnepaneel"	"http://www.w3.org/2000/01/rdf-schema#Class"	""	""	"http://fixme.com#Voedingspunt, http://fixme.com#AWVObject, http://fixme.com#TypenaamObject"	""	""
"CLASS"	"OSLO-OTL-Signalisatie"	"Pictogram"	"{7C88131E-C34D-40ba-BEC9-48F64B96DABB}"	""	""	""	""	"Pictogram"	"Is een bord dat een symbool of afbeelding bevat dat de plaats inneemt van een tekst."	""	"Pictogram"	"Is een bord dat een symbool of afbeelding bevat dat de plaats inneemt van een tekst."	""	""	"true"	"http://fixme.com#"	"Pictogram"	"http://www.w3.org/2000/01/rdf-schema#Class"	""	""	""	""	""
"CLASS"	"OSLO-OTL-LijnvormigeElementen"	"LijnvormigeElementen"	"{728C6382-F0D6-4b33-BC97-8F490C8702E0}"	""	""	""	""	"LijnvormigeElementen"	"abstracte als verzameling voor de gemeenschappelijke eigenschappen van lijnvormige elementen"	""	"LijnvormigeElementen"	"abstracte als verzameling voor de gemeenschappelijke eigenschappen van lijnvormige elementen"	""	""	"false"	"http://fixme.com#"	"LijnvormigeElementen"	"http://www.w3.org/2000/01/rdf-schema#Class"	""	""	""	""	""
"CLASS"	"OSLO-OTL-LijnvormigeElementen"	"Opening"	"{423974A6-E842-405d-BFFF-9B6647EA8DDB}"	""	""	""	""	"Opening"	"Doorgangen voorzien als vluchtmogelijkheid met dezelfde akoestische kwaliteitseisen als de voorgestelde schermen bezitten"	""	"Opening"	"Doorgangen voorzien als vluchtmogelijkheid met dezelfde akoestische kwaliteitseisen als de voorgestelde schermen bezitten"	""	""	"false"	"http://fixme.com#"	"Opening"	"http://www.w3.org/2000/01/rdf-schema#Class"	""	""	""	""	""
"CLASS"	"OSLO-OTL-LijnvormigeElementen"	"GeluidswerendeConstructie"	"{F1533883-16B7-43df-A48D-1ED1050AA0F5}"	"LijnvormigeElementen"	""	""	""	"GeluidswerendeConstructie"	"een geluidswerende wandvormige constructie bestaande uit een desgevallend geluidsisolerend materiaal en/of geluidsabsorberend materiaal en voorzien van de nodige structuren om de bouwkundige stabiliteit te verzekeren.
"	""	"GeluidswerendeConstructie"	"een geluidswerende wandvormige constructie bestaande uit een desgevallend geluidsisolerend materiaal en/of geluidsabsorberend materiaal en voorzien van de nodige structuren om de bouwkundige stabiliteit te verzekeren.
"	""	""	"false"	"http://fixme.com#"	"GeluidswerendeConstructie"	"http://www.w3.org/2000/01/rdf-schema#Class"	""	""	"http://fixme.com#ProefAPrioriGeluidswerendeConstructie, http://fixme.com#ProefAPosterioriGeluidswerendeConstructie, http://fixme.com#LijnvormigeElementen"	""	""
"CLASS"	"OSLO-OTL-LijnvormigeElementen"	"GestandaardiseerdeKantopsluiting"	"{2D14D96A-5311-422b-8C59-9402D4EE71DA}"	"Kantopsluiting"	""	""	""	"GestandaardiseerdeKantopsluiting"	"Abstracte voor een kantopsluiting dat voldoet aan een bepaalde standaard"	""	"GestandaardiseerdeKantopsluiting"	"Abstracte voor een kantopsluiting dat voldoet aan een bepaalde standaard"	""	""	"false"	"http://fixme.com#"	"GestandaardiseerdeKantopsluiting"	"http://www.w3.org/2000/01/rdf-schema#Class"	""	""	"http://fixme.com#Kantopsluiting"	""	""
"CLASS"	"OSLO-OTL-LijnvormigeElementen"	"AfwijkendeKantopsluiting"	"{E6B81AC2-63A3-4bc3-97F7-0142D136327D}"	"Kantopsluiting"	""	""	""	"AfwijkendeKantopsluiting"	"Abstracte voor een lijnvormig element dat niet voldoet aan een bepaalde standaard"	""	"AfwijkendeKantopsluiting"	"Abstracte voor een lijnvormig element dat niet voldoet aan een bepaalde standaard"	""	""	"false"	"http://fixme.com#"	"AfwijkendeKantopsluiting"	"http://www.w3.org/2000/01/rdf-schema#Class"	""	""	"http://fixme.com#Kantopsluiting"	""	""
"CLASS"	"OSLO-OTL-VerhardingFundering"	"Laag"	"{58E7E3BD-A9A9-4e04-957D-942F897D7ED8}"	""	""	""	""	"Laag"	"abstracte '_Laag' die de gemeenschappelijke eigenschappen van de onderliggende objecten bevat"	""	"Laag"	"abstracte '_Laag' die de gemeenschappelijke eigenschappen van de onderliggende objecten bevat"	""	""	"true"	"http://fixme.com#"	"Laag"	"http://www.w3.org/2000/01/rdf-schema#Class"	""	""	""	""	""
"CLASS"	"OSLO-OTL-LijnvormigeElementen"	"AfschermendeConstructie"	"{4B0764F9-6532-4c7a-BA45-17608719C789}"	"LijnvormigeElementen"	""	""	""	"AfschermendeConstructie"	"Abstracte die een lijn- of puntvormige constructie ge&#239;nstalleerd langs de weg om een kerend vermogen te bieden aan een dwalend voertuig samenvat"	""	"AfschermendeConstructie"	"Abstracte die een lijn- of puntvormige constructie ge&#239;nstalleerd langs de weg om een kerend vermogen te bieden aan een dwalend voertuig samenvat"	""	""	"false"	"http://fixme.com#"	"AfschermendeConstructie"	"http://www.w3.org/2000/01/rdf-schema#Class"	""	""	"http://fixme.com#ProefAPrioriAfschermendeConstructie, http://fixme.com#LijnvormigeElementen"	""	""
"CLASS"	"OSLO-OTL-LijnvormigeElementen"	"Kantopsluiting"	"{F6568495-D4F3-4550-8B8F-767D857FD503}"	"LijnvormigeElementen"	""	""	""	"Kantopsluiting"	"Abstracte als verzameling van de eigenschappen voor kantopsluiting
"	""	"Kantopsluiting"	"Abstracte als verzameling van de eigenschappen voor kantopsluiting
"	""	""	"false"	"http://fixme.com#"	"Kantopsluiting"	"http://www.w3.org/2000/01/rdf-schema#Class"	""	""	"http://fixme.com#ProefTijdensTKW, http://fixme.com#ProefAPosterioriTKW, http://fixme.com#LijnvormigeElementen"	""	""
"connector"	""	"TypeVan"	"{364C1DF6-3FC7-4267-8C50-3DC8DCCD7BA2}"	""	""	""	""	"TypeVan"	""	""	"TypeVan"	"TODO"	""	""	"false"	"http://fixme.com#"	"TypeVan"	"http://www.w3.org/2002/07/owl#ObjectProperty"	""	""	""	""	""
"connector"	""	"Bevestigd"	"{EA7740BC-3239-4b6b-B739-B4967037A66D}"	""	""	""	""	"Bevestigd"	""	""	"Bevestigd"	"TODO"	""	""	"false"	"http://fixme.com#"	"Bevestigd"	"http://www.w3.org/2002/07/owl#ObjectProperty"	""	""	""	""	""
"connector"	""	"TypeVan"	"{80CC9859-8E53-460d-9370-669C7FC0E108}"	""	""	""	""	"TypeVan"	""	""	"TypeVan"	"TODO"	""	""	"false"	"http://fixme.com#"	"TypeVan"	"http://www.w3.org/2002/07/owl#ObjectProperty"	""	""	""	""	""
"connector"	""	"SluitAanOp"	"{1C0268AD-9F6F-4a26-9175-089C3320277A}"	""	""	""	""	"SluitAanOp"	""	""	"SluitAanOp"	"TODO"	""	""	"false"	"http://fixme.com#"	"SluitAanOp"	"http://www.w3.org/2002/07/owl#ObjectProperty"	""	""	""	""	""
"connector"	""	"LigtOp"	"{5708B703-59EA-462f-91B2-18814108F691}"	""	"GeluidswerendeConstructie"	"{F1533883-16B7-43df-A48D-1ED1050AA0F5}"	"AfschermendeConstructie"	"LigtOp"	""	""	"LigtOp"	"TODO"	""	""	"false"	"http://fixme.com#"	"LigtOp"	"http://www.w3.org/2002/07/owl#ObjectProperty"	"http://fixme.com#GeluidswerendeConstructie"	"http://fixme.com#AfschermendeConstructie"	""	""	""
"connector"	""	"Bevestigd"	"{7FA43364-AB2D-4e85-9061-0D23611B58AB}"	""	""	""	""	"Bevestigd"	""	""	"Bevestigd"	"TODO"	""	""	"false"	"http://fixme.com#"	"Bevestigd"	"http://www.w3.org/2002/07/owl#ObjectProperty"	""	""	""	""	""
"connector"	""	"TypeVan"	"{5B8EF789-498A-4089-AFA9-EF6FADE87572}"	""	""	""	""	"TypeVan"	""	""	"TypeVan"	"TODO"	""	""	"false"	"http://fixme.com#"	"TypeVan"	"http://www.w3.org/2002/07/owl#ObjectProperty"	""	""	""	""	""
"connector"	""	"LigtOp"	"{E8BB17EF-B240-4a70-AA2B-64B12DE1BA50}"	""	"Laag"	"{58E7E3BD-A9A9-4e04-957D-942F897D7ED8}"	"Laag"	"LigtOp"	""	""	"LigtOp"	"TODO"	""	""	"true"	"http://fixme.com#"	"LigtOp"	"http://www.w3.org/2002/07/owl#ObjectProperty"	"http://fixme.com#Laag"	"http://fixme.com#Laag"	""	""	""
"connector"	""	"SluitAanOp"	"{8CAE6C13-4A10-41a5-AC76-06FC33DC58AA}"	""	"Geleideconstructie"	"{B7DF148E-8EC0-4b49-ABDB-7E51205C281D}"	"Eindstuk"	"SluitAanOp"	""	""	"SluitAanOp"	"TODO"	""	""	"false"	"http://fixme.com#"	"SluitAanOp"	"http://www.w3.org/2002/07/owl#ObjectProperty"	"http://fixme.com#Geleideconstructie"	"http://fixme.com#Eindstuk"	""	""	""
"connector"	""	"TypeVan"	"{FD54CB71-1337-4029-898E-2D57D6CA28D9}"	""	""	""	""	"TypeVan"	""	""	"TypeVan"	"TODO"	""	""	"false"	"http://fixme.com#"	"TypeVan"	"http://www.w3.org/2002/07/owl#ObjectProperty"	""	""	""	""	""
"connector"	""	"TypeVan"	"{8942C88F-4187-4b68-912B-4A3607A0A3E8}"	""	""	""	""	"TypeVan"	""	""	"TypeVan"	"TODO"	""	""	"false"	"http://fixme.com#"	"TypeVan"	"http://www.w3.org/2002/07/owl#ObjectProperty"	""	""	""	""	""
"attribute"	"OSLO-OTL-LijnvormigeElementen"	"bijkomendeParameter"	"{A20CDC38-B7F7-4e7b-A315-20DABB053D3E}"	""	"GestandariseerdeKantopsluitingType"	"{2AD102A8-DADB-4299-98B8-8E62C0B5FD1F}"	"LEKantopsluitingBijkomendeParameter"	"bijkomendeParameter"	"Keuzelijst voor gedetailleerder typeren van de kantopsluiting
"	""	"bijkomendeParameter"	"Keuzelijst voor gedetailleerder typeren van de kantopsluiting
"	""	""	"false"	"http://fixme.com#"	"bijkomendeParameter"	"http://www.w3.org/2002/07/owl#ObjectProperty"	"http://fixme.com#GestandariseerdeKantopsluitingType"	"http://fixme.com#LEKantopsluitingBijkomendeParameter"	""	"1"	"1"
"attribute"	"OSLO-OTL-LijnvormigeElementen"	"geprefabriceerd"	"{2F6227C6-5772-4297-81B9-2C3AD6F53C02}"	""	"GestandariseerdeKantopsluitingType"	"{2AD102A8-DADB-4299-98B8-8E62C0B5FD1F}"	"Boolean"	"geprefabriceerd"	"Aanduiding of de kantopsluiting al dan niet is geprefabriceerd."	""	"geprefabriceerd"	"Aanduiding of de kantopsluiting al dan niet is geprefabriceerd."	""	""	"false"	"http://fixme.com#"	"geprefabriceerd"	"http://www.w3.org/2002/07/owl#DatatypeProperty"	"http://fixme.com#GestandariseerdeKantopsluitingType"	"http://www.w3.org/2001/XMLSchema#boolean"	""	"1"	"1"
"attribute"	"OSLO-OTL-LijnvormigeElementen"	"kleur"	"{1BCC39EE-1E9E-417e-874B-7ADDDF53BA9A}"	""	"GestandariseerdeKantopsluitingType"	"{2AD102A8-DADB-4299-98B8-8E62C0B5FD1F}"	"LEKantopsluitingKleur"	"kleur"	"Keuzelijst om de kleur van kantopsluiting te bepalen"	""	"kleur"	"Keuzelijst om de kleur van kantopsluiting te bepalen"	""	""	"false"	"http://fixme.com#"	"kleur"	"http://www.w3.org/2002/07/owl#ObjectProperty"	"http://fixme.com#GestandariseerdeKantopsluitingType"	"http://fixme.com#LEKantopsluitingKleur"	""	"1"	"1"
