"EA-Type"	"EA-Package"	"EA-Name"	"EA-GUID"	"EA-Parent"	"EA-Domain"	"EA-Domain-GUID"	"EA-Range"	"label"	"definition"	"usage"	"ap-label-nl"	"ap-definition-nl"	"ap-usageNote-nl"	"ap-codelist"	"external term"	"namespace"	"localname"	"type"	"domain"	"range"	"parent"	"min card"	"max card"
"attribute"	"OSLO-Vegetatie"	"boomplaat"	"{426A6A28-A069-4110-A759-318897125AAC}"	""	"DtcHoutigeAanleg"	"{6DEFDE50-304C-4764-891E-57F35C17C9BB}"	"Boolean"	"boomplaat"	"Boomplaten worden aangebracht rond de stam van bomen, bosgoed en heesters en eventueel vastgezet met piketten. Ze hebben een centrale opening en een rechte snede, zodat ze op eenvoudige wijze rond de planten kunnen aangebracht worden."	""	"boomplaat"	"Boomplaten worden aangebracht rond de stam van bomen, bosgoed en heesters en eventueel vastgezet met piketten. Ze hebben een centrale opening en een rechte snede, zodat ze op eenvoudige wijze rond de planten kunnen aangebracht worden."	""	""	"true"	"https://wegenenverkeer.data.vlaanderen.be/doc/implementatiemodel/vegetatie/ontwerpdocument/alt#"	"boomplaat"	"http://www.w3.org/2002/07/owl#DatatypeProperty"	"https://wegenenverkeer.data.vlaanderen.be/doc/implementatiemodel/vegetatie/ontwerpdocument/alt#DtcHoutigeAanleg"	"http://www.w3.org/2001/XMLSchema#boolean"	""	"1"	"1"
"attribute"	"OSLO-Vegetatie"	"haagsteun"	"{B834F7B0-E2CA-43fe-A15B-E0854E262FA8}"	""	"DtcHoutigeAanleg"	"{6DEFDE50-304C-4764-891E-57F35C17C9BB}"	"Boolean"	"haagsteun"	"Duidt op de aanezigheid van een constructie van palen en bedrading die haagbeplanting ondersteunt."	""	"haagsteun"	"Duidt op de aanezigheid van een constructie van palen en bedrading die haagbeplanting ondersteunt."	""	""	"true"	"https://wegenenverkeer.data.vlaanderen.be/doc/implementatiemodel/vegetatie/ontwerpdocument/alt#"	"haagsteun"	"http://www.w3.org/2002/07/owl#DatatypeProperty"	"https://wegenenverkeer.data.vlaanderen.be/doc/implementatiemodel/vegetatie/ontwerpdocument/alt#DtcHoutigeAanleg"	"http://www.w3.org/2001/XMLSchema#boolean"	""	"1"	"1"
"attribute"	"OSLO-Vegetatie"	"plantafstand"	"{D25329D1-F778-49b5-9603-34514D0D805B}"	""	"DtcHoutigeAanleg"	"{6DEFDE50-304C-4764-891E-57F35C17C9BB}"	"NonNegativeInteger"	"plantafstand"	"Aantal planten per lopende meter."	""	"plantafstand"	"Aantal planten per lopende meter."	""	""	"true"	"https://wegenenverkeer.data.vlaanderen.be/doc/implementatiemodel/vegetatie/ontwerpdocument/alt#"	"plantafstand"	"http://www.w3.org/2002/07/owl#ObjectProperty"	"https://wegenenverkeer.data.vlaanderen.be/doc/implementatiemodel/vegetatie/ontwerpdocument/alt#DtcHoutigeAanleg"	"http://www.w3.org/2001/XMLSchema#nonNegativeInteger"	""	"1"	"1"
"attribute"	"OSLO-Vegetatie"	"plantdichtheid"	"{EC5C0E34-E540-40d5-AACF-54DD9923F289}"	""	"DtcHoutigeAanleg"	"{6DEFDE50-304C-4764-891E-57F35C17C9BB}"	"NonNegativeInteger"	"plantdichtheid"	"Aantal planten per vierkante meter."	""	"plantdichtheid"	"Aantal planten per vierkante meter."	""	""	"true"	"https://wegenenverkeer.data.vlaanderen.be/doc/implementatiemodel/vegetatie/ontwerpdocument/alt#"	"plantdichtheid"	"http://www.w3.org/2002/07/owl#ObjectProperty"	"https://wegenenverkeer.data.vlaanderen.be/doc/implementatiemodel/vegetatie/ontwerpdocument/alt#DtcHoutigeAanleg"	"http://www.w3.org/2001/XMLSchema#nonNegativeInteger"	""	"1"	"1"
"attribute"	"OSLO-Vegetatie"	"plantmaat"	"{B8AB0035-23F3-4d83-BBA6-10A7862FC8B5}"	""	"DtcHoutigeAanleg"	"{6DEFDE50-304C-4764-891E-57F35C17C9BB}"	"KlHoutigePlantmaat"	"plantmaat"	"De hoogte van de plant in cm gemeten tussen een minimum en maximum waarde."	""	"plantmaat"	"De hoogte van de plant in cm gemeten tussen een minimum en maximum waarde."	""	""	"true"	"https://wegenenverkeer.data.vlaanderen.be/doc/implementatiemodel/vegetatie/ontwerpdocument/alt#"	"plantmaat"	"http://www.w3.org/2002/07/owl#ObjectProperty"	"https://wegenenverkeer.data.vlaanderen.be/doc/implementatiemodel/vegetatie/ontwerpdocument/alt#DtcHoutigeAanleg"	"http://www.w3.org/2004/02/skos/core#Concept"	""	"1"	"1"
"attribute"	"OSLO-Vegetatie"	"plantverband"	"{F8EE1106-D59E-4ca0-A7CF-28D5638079E6}"	""	"DtcHoutigeAanleg"	"{6DEFDE50-304C-4764-891E-57F35C17C9BB}"	"KlVegetatiePlantverband"	"plantverband"	"De wijze waarop de planten zijn geschikt."	""	"plantverband"	"De wijze waarop de planten zijn geschikt."	""	""	"true"	"https://wegenenverkeer.data.vlaanderen.be/doc/implementatiemodel/vegetatie/ontwerpdocument/alt#"	"plantverband"	"http://www.w3.org/2002/07/owl#ObjectProperty"	"https://wegenenverkeer.data.vlaanderen.be/doc/implementatiemodel/vegetatie/ontwerpdocument/alt#DtcHoutigeAanleg"	"http://www.w3.org/2004/02/skos/core#Concept"	""	"1"	"1"
"attribute"	"OSLO-Vegetatie"	"wortel"	"{45E5AAF1-BFE0-4f74-88AB-F83461290CB6}"	""	"DtcHoutigeAanleg"	"{6DEFDE50-304C-4764-891E-57F35C17C9BB}"	"KlVegetatieWortel"	"wortel"	"De manier van levering en aanplanting van het wortelgestel van de boom of plant."	""	"wortel"	"De manier van levering en aanplanting van het wortelgestel van de boom of plant."	""	""	"true"	"https://wegenenverkeer.data.vlaanderen.be/doc/implementatiemodel/vegetatie/ontwerpdocument/alt#"	"wortel"	"http://www.w3.org/2002/07/owl#ObjectProperty"	"https://wegenenverkeer.data.vlaanderen.be/doc/implementatiemodel/vegetatie/ontwerpdocument/alt#DtcHoutigeAanleg"	"http://www.w3.org/2004/02/skos/core#Concept"	""	"1"	"1"
"attribute"	"OSLO-Vegetatie"	"wortelgeleidingwortelwering"	"{185062C1-C78E-4117-9835-2395F5C767C9}"	""	"DtcHoutigeAanleg"	"{6DEFDE50-304C-4764-891E-57F35C17C9BB}"	"Boolean"	"wortelgeleiding-wortelwering"	"Wortelgeleiding en wering moet voorkomen dat boomwortels het trottoir, de middenberm, het fietspad, de rijweg, andere wegverhardingen en leidingstelsels beschadigen. Het heeft als doel om boomwortels naar beneden te leiden, waar ze onder een obstakel verder kunnen groeien."	""	"wortelgeleiding-wortelwering"	"Wortelgeleiding en wering moet voorkomen dat boomwortels het trottoir, de middenberm, het fietspad, de rijweg, andere wegverhardingen en leidingstelsels beschadigen. Het heeft als doel om boomwortels naar beneden te leiden, waar ze onder een obstakel verder kunnen groeien."	""	""	"true"	"https://wegenenverkeer.data.vlaanderen.be/doc/implementatiemodel/vegetatie/ontwerpdocument/alt#"	"wortelgeleidingwortelwering"	"http://www.w3.org/2002/07/owl#DatatypeProperty"	"https://wegenenverkeer.data.vlaanderen.be/doc/implementatiemodel/vegetatie/ontwerpdocument/alt#DtcHoutigeAanleg"	"http://www.w3.org/2001/XMLSchema#boolean"	""	"1"	"1"
"attribute"	"OSLO-Vegetatie"	"adviesmaatregelBoomgebrek"	"{EBE4F664-BEE3-4ea9-9456-86835E8FB2CB}"	""	"DtcBoomtoestand"	"{4CAF736F-DA20-4245-BC08-463B541BF157}"	"DtcAWVDocument"	"adviesmaatregel boomgebrek"	"Adviesmaatregel die kan genomen worden om het boomgebrek aan te pakken."	"Bestanden van het type xlsx of pdf."	"adviesmaatregel boomgebrek"	"Adviesmaatregel die kan genomen worden om het boomgebrek aan te pakken."	""	""	"true"	"https://wegenenverkeer.data.vlaanderen.be/doc/implementatiemodel/vegetatie/ontwerpdocument/alt#"	"adviesmaatregelBoomgebrek"	"http://www.w3.org/2002/07/owl#ObjectProperty"	"https://wegenenverkeer.data.vlaanderen.be/doc/implementatiemodel/vegetatie/ontwerpdocument/alt#DtcBoomtoestand"	"https://wegenenverkeer.data.vlaanderen.be/doc/implementatiemodel/complexe-datatypes/ontwerpdocument/alt#DtcAWVDocument"	""	"1"	"*"
"attribute"	"OSLO-Vegetatie"	"adviesmaatregelGroeiplaats"	"{6DA340E0-65F7-4253-8D35-8A4CCE61ABBF}"	""	"DtcBoomtoestand"	"{4CAF736F-DA20-4245-BC08-463B541BF157}"	"DtcAWVDocument"	"adviesmaatregel groeiplaats"	"Adviesmaatregel die kan genomen worden om de groeiplaats te verbeteren."	"Bestanden van het type xlsx of pdf."	"adviesmaatregel groeiplaats"	"Adviesmaatregel die kan genomen worden om de groeiplaats te verbeteren."	""	""	"true"	"https://wegenenverkeer.data.vlaanderen.be/doc/implementatiemodel/vegetatie/ontwerpdocument/alt#"	"adviesmaatregelGroeiplaats"	"http://www.w3.org/2002/07/owl#ObjectProperty"	"https://wegenenverkeer.data.vlaanderen.be/doc/implementatiemodel/vegetatie/ontwerpdocument/alt#DtcBoomtoestand"	"https://wegenenverkeer.data.vlaanderen.be/doc/implementatiemodel/complexe-datatypes/ontwerpdocument/alt#DtcAWVDocument"	""	"1"	"*"
"attribute"	"OSLO-Vegetatie"	"basiswaarde"	"{BC12B01F-EDD0-40bc-8792-7CD9695CB929}"	""	"DtcBoomtoestand"	"{4CAF736F-DA20-4245-BC08-463B541BF157}"	"KwantWrdInEuro"	"basiswaarde"	"Wordt berekend met de formule B = Opp × E waarbij de oppervlakte(Opp) de stamdoorsnede is, uitgedrukt in cm² en E de eenheidsprijs, uitgedrukt in EUR/cm²."	""	"basiswaarde"	"Wordt berekend met de formule B = Opp × E waarbij de oppervlakte(Opp) de stamdoorsnede is, uitgedrukt in cm² en E de eenheidsprijs, uitgedrukt in EUR/cm²."	""	""	"true"	"https://wegenenverkeer.data.vlaanderen.be/doc/implementatiemodel/vegetatie/ontwerpdocument/alt#"	"basiswaarde"	"http://www.w3.org/2002/07/owl#ObjectProperty"	"https://wegenenverkeer.data.vlaanderen.be/doc/implementatiemodel/vegetatie/ontwerpdocument/alt#DtcBoomtoestand"	"https://wegenenverkeer.data.vlaanderen.be/doc/implementatiemodel/complexe-datatypes/ontwerpdocument/alt#KwantWrdInEuro"	""	"1"	"1"
"attribute"	"OSLO-Vegetatie"	"conditiebeoordeling"	"{0FA34980-5DCF-4f76-9B70-D29653C13D9E}"	""	"DtcBoomtoestand"	"{4CAF736F-DA20-4245-BC08-463B541BF157}"	"KlBoomConditiebeoordeling"	"conditiebeoordeling"	"De conditie beoordeeld volgens de kronenstructuur van Dr. A. Roloff, gelet op de scheutlengte ontwikkeling en vorming van dood hout."	""	"conditiebeoordeling"	"De conditie beoordeeld volgens de kronenstructuur van Dr. A. Roloff, gelet op de scheutlengte ontwikkeling en vorming van dood hout."	""	""	"true"	"https://wegenenverkeer.data.vlaanderen.be/doc/implementatiemodel/vegetatie/ontwerpdocument/alt#"	"conditiebeoordeling"	"http://www.w3.org/2002/07/owl#ObjectProperty"	"https://wegenenverkeer.data.vlaanderen.be/doc/implementatiemodel/vegetatie/ontwerpdocument/alt#DtcBoomtoestand"	"http://www.w3.org/2004/02/skos/core#Concept"	""	"1"	"1"
"attribute"	"OSLO-Vegetatie"	"conditiewaarde"	"{0BD33BD0-2F76-4b34-9CA3-71A3E613006A}"	""	"DtcBoomtoestand"	"{4CAF736F-DA20-4245-BC08-463B541BF157}"	"KlBoomConditiewaarde"	"conditiewaarde"	"Een coëfficiënt die iets vertelt over de gezondheidstoestand (vitaliteit, conditie) en de levensverwachting van een boom."	""	"conditiewaarde"	"Een coëfficiënt die iets vertelt over de gezondheidstoestand (vitaliteit, conditie) en de levensverwachting van een boom."	""	""	"true"	"https://wegenenverkeer.data.vlaanderen.be/doc/implementatiemodel/vegetatie/ontwerpdocument/alt#"	"conditiewaarde"	"http://www.w3.org/2002/07/owl#ObjectProperty"	"https://wegenenverkeer.data.vlaanderen.be/doc/implementatiemodel/vegetatie/ontwerpdocument/alt#DtcBoomtoestand"	"http://www.w3.org/2004/02/skos/core#Concept"	""	"1"	"1"
"attribute"	"OSLO-Vegetatie"	"conflicten"	"{3923469E-B281-407a-A166-6D4920093FE0}"	""	"DtcBoomtoestand"	"{4CAF736F-DA20-4245-BC08-463B541BF157}"	"KlBoomConflicten"	"conflicten"	"Mogelijke standplaatsconflicten die de condities of structuur van de boom negatief kunnen beïnvloeden."	""	"conflicten"	"Mogelijke standplaatsconflicten die de condities of structuur van de boom negatief kunnen beïnvloeden."	""	""	"true"	"https://wegenenverkeer.data.vlaanderen.be/doc/implementatiemodel/vegetatie/ontwerpdocument/alt#"	"conflicten"	"http://www.w3.org/2002/07/owl#ObjectProperty"	"https://wegenenverkeer.data.vlaanderen.be/doc/implementatiemodel/vegetatie/ontwerpdocument/alt#DtcBoomtoestand"	"http://www.w3.org/2004/02/skos/core#Concept"	""	"1"	"1"
"attribute"	"OSLO-Vegetatie"	"gebreken"	"{1AC2E4E1-5752-4416-B1D6-D63D9A755BF5}"	""	"DtcBoomtoestand"	"{4CAF736F-DA20-4245-BC08-463B541BF157}"	"KlBoomGebreken"	"gebreken"	"Een visueel defect aan een boom wat dient gemonitord te worden."	""	"gebreken"	"Een visueel defect aan een boom wat dient gemonitord te worden."	""	""	"true"	"https://wegenenverkeer.data.vlaanderen.be/doc/implementatiemodel/vegetatie/ontwerpdocument/alt#"	"gebreken"	"http://www.w3.org/2002/07/owl#ObjectProperty"	"https://wegenenverkeer.data.vlaanderen.be/doc/implementatiemodel/vegetatie/ontwerpdocument/alt#DtcBoomtoestand"	"http://www.w3.org/2004/02/skos/core#Concept"	""	"1"	"*"
"attribute"	"OSLO-Vegetatie"	"meerwaarde"	"{1CE5287B-B40D-4068-8874-70B1D4565DDF}"	""	"DtcBoomtoestand"	"{4CAF736F-DA20-4245-BC08-463B541BF157}"	"KlBoomtoestandMeerwaardefactor"	"meerwaarde"	"Mogelijkheid om de boom een waarde toe te kennen op basis van hun uitzonderlijke ecologische of erfgoedwaarde ."	""	"meerwaarde"	"Mogelijkheid om de boom een waarde toe te kennen op basis van hun uitzonderlijke ecologische of erfgoedwaarde ."	""	""	"true"	"https://wegenenverkeer.data.vlaanderen.be/doc/implementatiemodel/vegetatie/ontwerpdocument/alt#"	"meerwaarde"	"http://www.w3.org/2002/07/owl#ObjectProperty"	"https://wegenenverkeer.data.vlaanderen.be/doc/implementatiemodel/vegetatie/ontwerpdocument/alt#DtcBoomtoestand"	"http://www.w3.org/2004/02/skos/core#Concept"	""	"1"	"1"
"attribute"	"OSLO-Vegetatie"	"onderhoudstoestand"	"{C49D7BCE-696C-44ad-A8BF-9E517A93BDC1}"	""	"DtcBoomtoestand"	"{4CAF736F-DA20-4245-BC08-463B541BF157}"	"KlBoomOnderhoudstoestand"	"onderhoudstoestand"	"De snoeitoestand."	""	"onderhoudstoestand"	"De snoeitoestand."	""	""	"true"	"https://wegenenverkeer.data.vlaanderen.be/doc/implementatiemodel/vegetatie/ontwerpdocument/alt#"	"onderhoudstoestand"	"http://www.w3.org/2002/07/owl#ObjectProperty"	"https://wegenenverkeer.data.vlaanderen.be/doc/implementatiemodel/vegetatie/ontwerpdocument/alt#DtcBoomtoestand"	"http://www.w3.org/2004/02/skos/core#Concept"	""	"1"	"1"
"attribute"	"OSLO-Vegetatie"	"plantwijzewaarde"	"{967C4321-387E-4575-8468-75DAD1D96967}"	""	"DtcBoomtoestand"	"{4CAF736F-DA20-4245-BC08-463B541BF157}"	"KlBoomPlantwijzewaarde"	"plantwijzewaarde"	"Een factor die de ontwikkeling van het uiterlijk (de habitus) van een boom relateert met de manier waarop hij geplant wordt."	""	"plantwijzewaarde"	"Een factor die de ontwikkeling van het uiterlijk (de habitus) van een boom relateert met de manier waarop hij geplant wordt."	""	""	"true"	"https://wegenenverkeer.data.vlaanderen.be/doc/implementatiemodel/vegetatie/ontwerpdocument/alt#"	"plantwijzewaarde"	"http://www.w3.org/2002/07/owl#ObjectProperty"	"https://wegenenverkeer.data.vlaanderen.be/doc/implementatiemodel/vegetatie/ontwerpdocument/alt#DtcBoomtoestand"	"http://www.w3.org/2004/02/skos/core#Concept"	""	"1"	"1"
"attribute"	"OSLO-Vegetatie"	"soortwaarde"	"{47547EEC-DD0F-4ca1-A86A-C050C2481324}"	""	"DtcBoomtoestand"	"{4CAF736F-DA20-4245-BC08-463B541BF157}"	"Decimal"	"soortwaarde"	"Geeft voor een bepaalde boomsoort of -variëteit de verhouding weer tussen de prijs per cm² van die soort en de eenheidsprijs."	""	"soortwaarde"	"Geeft voor een bepaalde boomsoort of -variëteit de verhouding weer tussen de prijs per cm² van die soort en de eenheidsprijs."	""	""	"true"	"https://wegenenverkeer.data.vlaanderen.be/doc/implementatiemodel/vegetatie/ontwerpdocument/alt#"	"soortwaarde"	"http://www.w3.org/2002/07/owl#ObjectProperty"	"https://wegenenverkeer.data.vlaanderen.be/doc/implementatiemodel/vegetatie/ontwerpdocument/alt#DtcBoomtoestand"	"http://www.w3.org/2001/XMLSchema#decimal"	""	"1"	"1"
"attribute"	"OSLO-Vegetatie"	"stamomtrek"	"{97234B0A-D2EB-490f-98AF-346885043A65}"	""	"DtcBoomtoestand"	"{4CAF736F-DA20-4245-BC08-463B541BF157}"	"KwantWrdInCentimeter"	"stamomtrek"	"Omtrek van de stam van de boom in cm, gemeten op 1 meter boven de grond."	""	"stamomtrek"	"Omtrek van de stam van de boom in cm, gemeten op 1 meter boven de grond."	""	""	"true"	"https://wegenenverkeer.data.vlaanderen.be/doc/implementatiemodel/vegetatie/ontwerpdocument/alt#"	"stamomtrek"	"http://www.w3.org/2002/07/owl#ObjectProperty"	"https://wegenenverkeer.data.vlaanderen.be/doc/implementatiemodel/vegetatie/ontwerpdocument/alt#DtcBoomtoestand"	"https://wegenenverkeer.data.vlaanderen.be/doc/implementatiemodel/complexe-datatypes/ontwerpdocument/alt#KwantWrdInCentimeter"	""	"1"	"1"
"attribute"	"OSLO-Vegetatie"	"standplaatswaarde"	"{022DBF1D-BC33-4d11-A067-4804EDF23ACD}"	""	"DtcBoomtoestand"	"{4CAF736F-DA20-4245-BC08-463B541BF157}"	"KlBoomStandplaatswaarde"	"standplaatswaarde"	"De waarde van de boom afhankelijk van de bebouwingsdichtheid en de aanplantingsmogelijkheden rondom en voor de boom."	""	"standplaatswaarde"	"De waarde van de boom afhankelijk van de bebouwingsdichtheid en de aanplantingsmogelijkheden rondom en voor de boom."	""	""	"true"	"https://wegenenverkeer.data.vlaanderen.be/doc/implementatiemodel/vegetatie/ontwerpdocument/alt#"	"standplaatswaarde"	"http://www.w3.org/2002/07/owl#ObjectProperty"	"https://wegenenverkeer.data.vlaanderen.be/doc/implementatiemodel/vegetatie/ontwerpdocument/alt#DtcBoomtoestand"	"http://www.w3.org/2004/02/skos/core#Concept"	""	"1"	"1"
"attribute"	"OSLO-Vegetatie"	"containermaat"	"{91FBD8DB-DAAB-4655-A67B-1F8C6AD2A799}"	""	"DtcSierbeplAanleg"	"{B5B62DE7-18C8-423e-87C2-C61EB9CD5220}"	"KlSierbeplContainer"	"containermaat"	"De grootte van de pot of container waarin de plant wordt geleverd. De P staat voor pot, de C voor container. Het getal geeft de grootte weer in centimeter."	""	"containermaat"	"De grootte van de pot of container waarin de plant wordt geleverd. De P staat voor pot, de C voor container. Het getal geeft de grootte weer in centimeter."	""	""	"true"	"https://wegenenverkeer.data.vlaanderen.be/doc/implementatiemodel/vegetatie/ontwerpdocument/alt#"	"containermaat"	"http://www.w3.org/2002/07/owl#ObjectProperty"	"https://wegenenverkeer.data.vlaanderen.be/doc/implementatiemodel/vegetatie/ontwerpdocument/alt#DtcSierbeplAanleg"	"http://www.w3.org/2004/02/skos/core#Concept"	""	"1"	"1"
"attribute"	"OSLO-Vegetatie"	"plantdichtheid"	"{F1A51485-FD57-402e-8508-FA2ED429307E}"	""	"DtcSierbeplAanleg"	"{B5B62DE7-18C8-423e-87C2-C61EB9CD5220}"	"NonNegativeInteger"	"plantdichtheid"	"Aantal planten per vierkante meter."	""	"plantdichtheid"	"Aantal planten per vierkante meter."	""	""	"true"	"https://wegenenverkeer.data.vlaanderen.be/doc/implementatiemodel/vegetatie/ontwerpdocument/alt#"	"plantdichtheid"	"http://www.w3.org/2002/07/owl#ObjectProperty"	"https://wegenenverkeer.data.vlaanderen.be/doc/implementatiemodel/vegetatie/ontwerpdocument/alt#DtcSierbeplAanleg"	"http://www.w3.org/2001/XMLSchema#nonNegativeInteger"	""	"1"	"1"
"attribute"	"OSLO-Vegetatie"	"plantmaat"	"{E275FDB8-4F06-492e-876B-BFE1986CBDA2}"	""	"DtcSierbeplAanleg"	"{B5B62DE7-18C8-423e-87C2-C61EB9CD5220}"	"KlSierbeplPlantmaat"	"plantmaat"	"De hoogte van de plant in cm gemeten tussen een minimum en maximum waarde."	""	"plantmaat"	"De hoogte van de plant in cm gemeten tussen een minimum en maximum waarde."	""	""	"true"	"https://wegenenverkeer.data.vlaanderen.be/doc/implementatiemodel/vegetatie/ontwerpdocument/alt#"	"plantmaat"	"http://www.w3.org/2002/07/owl#ObjectProperty"	"https://wegenenverkeer.data.vlaanderen.be/doc/implementatiemodel/vegetatie/ontwerpdocument/alt#DtcSierbeplAanleg"	"http://www.w3.org/2004/02/skos/core#Concept"	""	"1"	"1"
"attribute"	"OSLO-Vegetatie"	"plantverband"	"{325A5FBF-73A2-4bb6-B98A-496BD8D0304D}"	""	"DtcSierbeplAanleg"	"{B5B62DE7-18C8-423e-87C2-C61EB9CD5220}"	"KlVegetatiePlantverband"	"plantverband"	"De wijze waarop de planten zijn geschikt."	""	"plantverband"	"De wijze waarop de planten zijn geschikt."	""	""	"true"	"https://wegenenverkeer.data.vlaanderen.be/doc/implementatiemodel/vegetatie/ontwerpdocument/alt#"	"plantverband"	"http://www.w3.org/2002/07/owl#ObjectProperty"	"https://wegenenverkeer.data.vlaanderen.be/doc/implementatiemodel/vegetatie/ontwerpdocument/alt#DtcSierbeplAanleg"	"http://www.w3.org/2004/02/skos/core#Concept"	""	"1"	"1"
"attribute"	"OSLO-Signalisatie"	"onderbroken"	"{553F307C-3E6C-4c0f-9070-86CF5AF7E899}"	""	"DtcOverlangsemarkeringOnderbroken"	"{83C21A58-8C5D-40c8-BBA9-CC94A8367BA0}"	"String"	"onderbroken"	"Een niet-doorlopende overlangse markering."	""	"onderbroken"	"Een niet-doorlopende overlangse markering."	""	""	"true"	"https://wegenenverkeer.data.vlaanderen.be/doc/implementatiemodel/signalisatie/ontwerpdocument/alt#"	"onderbroken"	"http://www.w3.org/2002/07/owl#DatatypeProperty"	"https://wegenenverkeer.data.vlaanderen.be/doc/implementatiemodel/signalisatie/ontwerpdocument/alt#DtcOverlangsemarkeringOnderbroken"	"http://www.w3.org/2001/XMLSchema#string"	""	"1"	"1"
"attribute"	"OSLO-Signalisatie"	"streepLengte"	"{87B9B342-9BFE-40f5-A4EA-A89D8C3C393A}"	""	"DtcOverlangsemarkeringOnderbroken"	"{83C21A58-8C5D-40c8-BBA9-CC94A8367BA0}"	"KwantWrdInMeter"	"streep lengte"	"De streep lengte van een overlangse onderbroken markering."	""	"streep lengte"	"De streep lengte van een overlangse onderbroken markering."	""	""	"true"	"https://wegenenverkeer.data.vlaanderen.be/doc/implementatiemodel/signalisatie/ontwerpdocument/alt#"	"streepLengte"	"http://www.w3.org/2002/07/owl#ObjectProperty"	"https://wegenenverkeer.data.vlaanderen.be/doc/implementatiemodel/signalisatie/ontwerpdocument/alt#DtcOverlangsemarkeringOnderbroken"	"https://wegenenverkeer.data.vlaanderen.be/doc/implementatiemodel/complexe-datatypes/ontwerpdocument/alt#KwantWrdInMeter"	""	"1"	"1"
"attribute"	"OSLO-Signalisatie"	"tussenruimte"	"{CDF280F9-0F33-4f54-A0B7-6A15C23D74C9}"	""	"DtcOverlangsemarkeringOnderbroken"	"{83C21A58-8C5D-40c8-BBA9-CC94A8367BA0}"	"KwantWrdInMeter"	"tussenruimte"	"De niet gemarkeerde afstand tussen 2 markeringen in meter van een overlangse onderbroken markering."	""	"tussenruimte"	"De niet gemarkeerde afstand tussen 2 markeringen in meter van een overlangse onderbroken markering."	""	""	"true"	"https://wegenenverkeer.data.vlaanderen.be/doc/implementatiemodel/signalisatie/ontwerpdocument/alt#"	"tussenruimte"	"http://www.w3.org/2002/07/owl#ObjectProperty"	"https://wegenenverkeer.data.vlaanderen.be/doc/implementatiemodel/signalisatie/ontwerpdocument/alt#DtcOverlangsemarkeringOnderbroken"	"https://wegenenverkeer.data.vlaanderen.be/doc/implementatiemodel/complexe-datatypes/ontwerpdocument/alt#KwantWrdInMeter"	""	"1"	"1"
"attribute"	"OSLO-Signalisatie"	"doorlopend"	"{2D88DC30-C681-4d21-A9EC-2A1C358A081E}"	""	"DtcOverlangsemarkeringDoorlopend"	"{0EB8B25B-B3F6-4fc7-BD85-4C1F9AE30925}"	"String"	"doorlopend"	"Een niet-onderbroken overlangse markering."	""	"doorlopend"	"Een niet-onderbroken overlangse markering."	""	""	"true"	"https://wegenenverkeer.data.vlaanderen.be/doc/implementatiemodel/signalisatie/ontwerpdocument/alt#"	"doorlopend"	"http://www.w3.org/2002/07/owl#DatatypeProperty"	"https://wegenenverkeer.data.vlaanderen.be/doc/implementatiemodel/signalisatie/ontwerpdocument/alt#DtcOverlangsemarkeringDoorlopend"	"http://www.w3.org/2001/XMLSchema#string"	""	"1"	"1"
"attribute"	"OSLO-Signalisatie"	"materiaal"	"{B0FA039F-E519-4d8e-AB0B-10EB3FF0A654}"	""	"DtcDiamantkoppaal"	"{09537EF1-4583-4be6-B386-3894BB373104}"	"KlAntiparkeerpaalMateriaal"	"materiaal"	"Het materiaal van de diamantkoppaal."	""	"materiaal"	"Het materiaal van de diamantkoppaal."	""	""	"true"	"https://wegenenverkeer.data.vlaanderen.be/doc/implementatiemodel/signalisatie/ontwerpdocument/alt#"	"materiaal"	"http://www.w3.org/2002/07/owl#ObjectProperty"	"https://wegenenverkeer.data.vlaanderen.be/doc/implementatiemodel/signalisatie/ontwerpdocument/alt#DtcDiamantkoppaal"	"http://www.w3.org/2004/02/skos/core#Concept"	""	"1"	"1"
"attribute"	"OSLO-Signalisatie"	"materiaal"	"{0C7642C5-1625-4be5-8FD5-1032114D7BF8}"	""	"DtcAmsterdammer"	"{75DEC256-5F4B-48b3-9476-F970E1E5E7BF}"	"KlAntiparkeerpaalMateriaal"	"materiaal"	"Het materiaal van de Amsterdammer."	""	"materiaal"	"Het materiaal van de Amsterdammer."	""	""	"true"	"https://wegenenverkeer.data.vlaanderen.be/doc/implementatiemodel/signalisatie/ontwerpdocument/alt#"	"materiaal"	"http://www.w3.org/2002/07/owl#ObjectProperty"	"https://wegenenverkeer.data.vlaanderen.be/doc/implementatiemodel/signalisatie/ontwerpdocument/alt#DtcAmsterdammer"	"http://www.w3.org/2004/02/skos/core#Concept"	""	"1"	"1"
"attribute"	"OSLO-Lijnvormige-elementen"	"breedte"	"{D1DD4C1C-C000-4549-A183-3CFF1D70F44C}"	""	"DtcTrottoirbandVorm"	"{706DCB6C-DEA9-42ec-88FC-792FD565899A}"	"KwantWrdInCentimeter"	"breedte"	"De breedte van de trottoirband."	""	"breedte"	"De breedte van de trottoirband."	""	""	"true"	"https://wegenenverkeer.data.vlaanderen.be/doc/implementatiemodel/lijnvormige-elementen/ontwerpdocument/alt#"	"breedte"	"http://www.w3.org/2002/07/owl#ObjectProperty"	"https://wegenenverkeer.data.vlaanderen.be/doc/implementatiemodel/lijnvormige-elementen/ontwerpdocument/alt#DtcTrottoirbandVorm"	"https://wegenenverkeer.data.vlaanderen.be/doc/implementatiemodel/complexe-datatypes/ontwerpdocument/alt#KwantWrdInCentimeter"	""	"1"	"1"
"attribute"	"OSLO-Lijnvormige-elementen"	"dikte"	"{D112BAC1-D7C7-4f4a-B8F0-14BFA050061C}"	""	"DtcTrottoirbandVorm"	"{706DCB6C-DEA9-42ec-88FC-792FD565899A}"	"KwantWrdInCentimeter"	"dikte"	"De dikte van de trottoirband."	""	"dikte"	"De dikte van de trottoirband."	""	""	"true"	"https://wegenenverkeer.data.vlaanderen.be/doc/implementatiemodel/lijnvormige-elementen/ontwerpdocument/alt#"	"dikte"	"http://www.w3.org/2002/07/owl#ObjectProperty"	"https://wegenenverkeer.data.vlaanderen.be/doc/implementatiemodel/lijnvormige-elementen/ontwerpdocument/alt#DtcTrottoirbandVorm"	"https://wegenenverkeer.data.vlaanderen.be/doc/implementatiemodel/complexe-datatypes/ontwerpdocument/alt#KwantWrdInCentimeter"	""	"1"	"1"
"attribute"	"OSLO-Lijnvormige-elementen"	"vorm"	"{F713E20A-A5FF-4534-A4A9-67F044644553}"	""	"DtcTrottoirbandVorm"	"{706DCB6C-DEA9-42ec-88FC-792FD565899A}"	"KlLETrottoirbandVorm"	"vorm"	"De vorm van de trottoirband."	""	"vorm"	"De vorm van de trottoirband."	""	""	"true"	"https://wegenenverkeer.data.vlaanderen.be/doc/implementatiemodel/lijnvormige-elementen/ontwerpdocument/alt#"	"vorm"	"http://www.w3.org/2002/07/owl#ObjectProperty"	"https://wegenenverkeer.data.vlaanderen.be/doc/implementatiemodel/lijnvormige-elementen/ontwerpdocument/alt#DtcTrottoirbandVorm"	"http://www.w3.org/2004/02/skos/core#Concept"	""	"1"	"1"
