"EA-Type"	"EA-Package"	"EA-Name"	"EA-GUID"	"EA-Parent"	"EA-Domain"	"EA-Domain-GUID"	"EA-Range"	"label"	"definition"	"usage"	"ap-label-nl"	"ap-definition-nl"	"ap-usageNote-nl"	"ap-codelist"	"external term"	"namespace"	"localname"	"type"	"domain"	"range"	"parent"	"min card"	"max card"
"Package"	""	"OSLO-Complexe-datatypes"	"{063EBBB9-B445-47ba-A5B8-1C3328834A62}"	""	""	""	""	""	""	""	""	""	""	""	""	"https://wegenenverkeer.data.vlaanderen.be/doc/implementatiemodel/complexe-datatypes/ontwerpdocument/"	"alt"	"http://www.w3.org/2002/07/owl#Ontology"	""	""	""	""	""
"DATATYPE"	"OSLO²-Generiek"	"DtcKwantitatieveWaarde"	"{8A625681-DAB0-4668-B9DA-E3C6F3051773}"	""	""	""	""	"Kwantitatieve waarde"	"Complex datatype voor kwantitatieve waarde. Bij kwantitatieve waarden gaat het om meetbare gegevens, zoals bv.temperatuur, snelheid of gewicht."	""	"Kwantitatieve waarde"	"Complex datatype voor kwantitatieve waarde. Bij kwantitatieve waarden gaat het om meetbare gegevens, zoals bv.temperatuur, snelheid of gewicht."	""	""	"true"	"https://data.vlaanderen.be/ns/generiek#"	"KwantitatieveWaarde"	"http://www.w3.org/2000/01/rdf-schema#Class"	""	""	""	""	""
"DATATYPE"	"OSLO-Waterlopen"	"DtcBetuiningHout"	"{84FB40D4-1069-40d5-A349-3C53672AB793}"	""	""	""	""	"Plankenbetuining hout"	"Complex datatype voor een houten plankenbetuining of damwandbetuining."	""	"Plankenbetuining hout"	"Complex datatype voor een houten plankenbetuining of damwandbetuining."	""	""	"true"	"https://wegenenverkeer.data.vlaanderen.be/doc/implementatiemodel/waterlopen/ontwerpdocument/alt#"	"DtcBetuiningHout"	"http://www.w3.org/2000/01/rdf-schema#Class"	""	""	""	""	""
"DATATYPE"	"OSLO-Waterlopen"	"DtcBetuiningGerecycleerd"	"{CDDA3D77-BCD3-4ae6-9070-C8D314D0FDB8}"	""	""	""	""	"Plankenbetuining gerecycleerd"	"Complex datatype voor een gerecycleerde plankenbetuining of damwandbetuining."	""	"Plankenbetuining gerecycleerd"	"Complex datatype voor een gerecycleerde plankenbetuining of damwandbetuining."	""	""	"true"	"https://wegenenverkeer.data.vlaanderen.be/doc/implementatiemodel/waterlopen/ontwerpdocument/alt#"	"DtcBetuiningGerecycleerd"	"http://www.w3.org/2000/01/rdf-schema#Class"	""	""	""	""	""
"DATATYPE"	"OSLO-Waterlopen"	"DtcBetuiningBeton"	"{A306ECFE-9719-4cbd-B447-9A05DD983FA4}"	""	""	""	""	"Betuining van beton"	"Complex datatype voor een betonnen plankenbetuining of damwandbetuing."	""	"Betuining van beton"	"Complex datatype voor een betonnen plankenbetuining of damwandbetuing."	""	""	"true"	"https://wegenenverkeer.data.vlaanderen.be/doc/implementatiemodel/waterlopen/ontwerpdocument/alt#"	"DtcBetuiningBeton"	"http://www.w3.org/2000/01/rdf-schema#Class"	""	""	""	""	""
"DATATYPE"	"OSLO-Verhardingen-funderingen"	"DtcProfileerlaag"	"{4156EA7B-58B0-4543-A5B0-810355CC6011}"	""	""	""	""	"Profileerlaag"	"Complex datatype om extra informatie te capteren van de profilerende laag."	""	"Profileerlaag"	"Complex datatype om extra informatie te capteren van de profilerende laag."	""	""	"true"	"https://wegenenverkeer.data.vlaanderen.be/doc/implementatiemodel/verhardingen-funderingen/ontwerpdocument/alt#"	"DtcProfileerlaag"	"http://www.w3.org/2000/01/rdf-schema#Class"	""	""	""	""	""
"DATATYPE"	"OSLO-Vegetatie"	"DtcVegetatieSoortnaam"	"{10C9D2C4-EA68-4094-B41F-5421A8B495FB}"	""	""	""	""	"Vegetatie soortnaam"	"Complex datatype voor de soortnaam van een begroeiing."	""	"Vegetatie soortnaam"	"Complex datatype voor de soortnaam van een begroeiing."	""	""	"true"	"https://wegenenverkeer.data.vlaanderen.be/doc/implementatiemodel/vegetatie/ontwerpdocument/alt#"	"DtcVegetatieSoortnaam"	"http://www.w3.org/2000/01/rdf-schema#Class"	""	""	""	""	""
"DATATYPE"	"OSLO-Vegetatie"	"DtcHoutigeAanleg"	"{6DEFDE50-304C-4764-891E-57F35C17C9BB}"	""	""	""	""	"Houtige aanleg"	"De eigenschappen als complex datatype die de aanleg van houtige vegetatie beschrijft."	""	"Houtige aanleg"	"De eigenschappen als complex datatype die de aanleg van houtige vegetatie beschrijft."	""	""	"true"	"https://wegenenverkeer.data.vlaanderen.be/doc/implementatiemodel/vegetatie/ontwerpdocument/alt#"	"DtcHoutigeAanleg"	"http://www.w3.org/2000/01/rdf-schema#Class"	""	""	""	""	""
"DATATYPE"	"OSLO-Vegetatie"	"DtcBoomtoestand"	"{4CAF736F-DA20-4245-BC08-463B541BF157}"	""	""	""	""	"Boomtoestand"	"De toestand als complex datatype van een boom."	""	"Boomtoestand"	"De toestand als complex datatype van een boom."	""	""	"true"	"https://wegenenverkeer.data.vlaanderen.be/doc/implementatiemodel/vegetatie/ontwerpdocument/alt#"	"DtcBoomtoestand"	"http://www.w3.org/2000/01/rdf-schema#Class"	""	""	"https://wegenenverkeer.data.vlaanderen.be/doc/implementatiemodel/proeven-metingen/ontwerpdocument/alt#ProefBoomtoestand"	""	""
"DATATYPE"	"OSLO-Vegetatie"	"DtcSierbeplAanleg"	"{B5B62DE7-18C8-423e-87C2-C61EB9CD5220}"	""	""	""	""	"Sierbeplanting aanleg"	"De eigenschappen als complex datatype die de aanleg van sierbeplanting beschrijft."	""	"Sierbeplanting aanleg"	"De eigenschappen als complex datatype die de aanleg van sierbeplanting beschrijft."	""	""	"true"	"https://wegenenverkeer.data.vlaanderen.be/doc/implementatiemodel/vegetatie/ontwerpdocument/alt#"	"DtcSierbeplAanleg"	"http://www.w3.org/2000/01/rdf-schema#Class"	""	""	""	""	""
"DATATYPE"	"OSLO-Signalisatie"	"DtcOverlangsemarkeringOnderbroken"	"{83C21A58-8C5D-40c8-BBA9-CC94A8367BA0}"	""	""	""	""	"Overlangsemarkering onderbroken"	"Complex datatype voor een onderbroken overlangse markering."	""	"Overlangsemarkering onderbroken"	"Complex datatype voor een onderbroken overlangse markering."	""	""	"true"	"https://wegenenverkeer.data.vlaanderen.be/doc/implementatiemodel/signalisatie/ontwerpdocument/alt#"	"DtcOverlangsemarkeringOnderbroken"	"http://www.w3.org/2000/01/rdf-schema#Class"	""	""	""	""	""
"DATATYPE"	"OSLO-Signalisatie"	"DtcOverlangsemarkeringDoorlopend"	"{0EB8B25B-B3F6-4fc7-BD85-4C1F9AE30925}"	""	""	""	""	"Overlangsemarkering doorlopend"	"Complex datatype voor een doorlopende overlangse markering."	""	"Overlangsemarkering doorlopend"	"Complex datatype voor een doorlopende overlangse markering."	""	""	"true"	"https://wegenenverkeer.data.vlaanderen.be/doc/implementatiemodel/signalisatie/ontwerpdocument/alt#"	"DtcOverlangsemarkeringDoorlopend"	"http://www.w3.org/2000/01/rdf-schema#Class"	""	""	""	""	""
"DATATYPE"	"OSLO-Signalisatie"	"DtcDiamantkoppaal"	"{09537EF1-4583-4be6-B386-3894BB373104}"	""	""	""	""	"Diamantkoppaal"	"Complex datatype voor een diamantkoppaal."	""	"Diamantkoppaal"	"Complex datatype voor een diamantkoppaal."	""	""	"true"	"https://wegenenverkeer.data.vlaanderen.be/doc/implementatiemodel/signalisatie/ontwerpdocument/alt#"	"DtcDiamantkoppaal"	"http://www.w3.org/2000/01/rdf-schema#Class"	""	""	""	""	""
"DATATYPE"	"OSLO-Signalisatie"	"DtcAmsterdammer"	"{75DEC256-5F4B-48b3-9476-F970E1E5E7BF}"	""	""	""	""	"Amsterdammer"	"Complex datatype voor antiparkeerpaal Amsterdammer."	""	"Amsterdammer"	"Complex datatype voor antiparkeerpaal Amsterdammer."	""	""	"true"	"https://wegenenverkeer.data.vlaanderen.be/doc/implementatiemodel/signalisatie/ontwerpdocument/alt#"	"DtcAmsterdammer"	"http://www.w3.org/2000/01/rdf-schema#Class"	""	""	""	""	""
"DATATYPE"	"OSLO-Lijnvormige-elementen"	"DtcTrottoirbandVorm"	"{706DCB6C-DEA9-42ec-88FC-792FD565899A}"	""	""	""	""	"Trottoirband vorm"	"Complex datatype voor de vorm van een trotoirband."	""	"Trottoirband vorm"	"Complex datatype voor de vorm van een trotoirband."	""	""	"true"	"https://wegenenverkeer.data.vlaanderen.be/doc/implementatiemodel/lijnvormige-elementen/ontwerpdocument/alt#"	"DtcTrottoirbandVorm"	"http://www.w3.org/2000/01/rdf-schema#Class"	""	""	""	""	""
"DATATYPE"	"OSLO-Lijnvormige-elementen"	"DtcOverzichtSchermhoogte"	"{7F4E5A53-BBB3-47c2-91B8-90B6BF9A93EF}"	""	""	""	""	"Overzicht schermhoogte"	"Complex datatype voor het overzicht met betrekking tot de  schermhoogte."	""	"Overzicht schermhoogte"	"Complex datatype voor het overzicht met betrekking tot de  schermhoogte."	""	""	"true"	"https://wegenenverkeer.data.vlaanderen.be/doc/implementatiemodel/lijnvormige-elementen/ontwerpdocument/alt#"	"DtcOverzichtSchermhoogte"	"http://www.w3.org/2000/01/rdf-schema#Class"	""	""	""	""	""
"DATATYPE"	"OSLO-Lijnvormige-elementen"	"DtcLENorm"	"{469680E8-3C9B-4270-89F2-D96E811C665F}"	""	""	""	""	"Norm van het lijnvormig element."	"Complex datatype voor de norm van het lijnvormig element."	""	"Norm van het lijnvormig element."	"Complex datatype voor de norm van het lijnvormig element."	""	""	"true"	"https://wegenenverkeer.data.vlaanderen.be/doc/implementatiemodel/lijnvormige-elementen/ontwerpdocument/alt#"	"DtcLENorm"	"http://www.w3.org/2000/01/rdf-schema#Class"	""	""	""	""	""
"DATATYPE"	"OSLO-Lijnvormige-elementen"	"DtcGCMateriaalKarakteristiek"	"{B9A9B255-F2CB-4711-8241-E9F25F63453D}"	""	""	""	""	"Materiaal karakteristiek"	"Complex datatype voor het materiaal en zijn geluidskarakteristiek van de geluidswerende constructie."	""	"Materiaal karakteristiek"	"Complex datatype voor het materiaal en zijn geluidskarakteristiek van de geluidswerende constructie."	""	""	"true"	"https://wegenenverkeer.data.vlaanderen.be/doc/implementatiemodel/lijnvormige-elementen/ontwerpdocument/alt#"	"DtcGCMateriaalKarakteristiek"	"http://www.w3.org/2000/01/rdf-schema#Class"	""	""	""	""	""
"DATATYPE"	"OSLO-Grondwerken"	"DtcGrondsoort"	"{02A3E994-84B7-4455-A23D-D3D589E21DDF}"	""	""	""	""	"Grondsoort"	"Complex datatype om het soort grond te bepalen."	""	"Grondsoort"	"Complex datatype om het soort grond te bepalen."	""	""	"true"	"https://wegenenverkeer.data.vlaanderen.be/doc/implementatiemodel/grondwerken/ontwerpdocument/alt#"	"DtcGrondsoort"	"http://www.w3.org/2000/01/rdf-schema#Class"	""	""	""	""	""
"DATATYPE"	"OSLO-Grondwerken"	"DtcGrondophoging"	"{0CE5453B-23F5-49bf-9BF9-CA3D03034AD4}"	""	""	""	""	"Grondophoging"	"Complex datatype om extra informatie van ophoging van grond te capteren."	""	"Grondophoging"	"Complex datatype om extra informatie van ophoging van grond te capteren."	""	""	"true"	"https://wegenenverkeer.data.vlaanderen.be/doc/implementatiemodel/grondwerken/ontwerpdocument/alt#"	"DtcGrondophoging"	"http://www.w3.org/2000/01/rdf-schema#Class"	""	""	""	""	""
"DATATYPE"	"OSLO-Grondwerken"	"DtcGrondbijmenging"	"{EEECED90-0B07-49b8-BE07-D836559D4372}"	""	""	""	""	"Grondbijmenging"	"Complex datatype om extra informatie van de bijmenging van grond te capteren."	""	"Grondbijmenging"	"Complex datatype om extra informatie van de bijmenging van grond te capteren."	""	""	"true"	"https://wegenenverkeer.data.vlaanderen.be/doc/implementatiemodel/grondwerken/ontwerpdocument/alt#"	"DtcGrondbijmenging"	"http://www.w3.org/2000/01/rdf-schema#Class"	""	""	""	""	""
"DATATYPE"	"OSLO-Grondwerken"	"DtcGrondAfgravinguitgraving"	"{A8BD9015-EAF5-4147-8F17-9AAD0E2C2C5D}"	""	""	""	""	"Grondafgraving en gronduitgraving"	"Complex datatype voor de afgraving of uitgraving van grond."	""	"Grondafgraving en gronduitgraving"	"Complex datatype voor de afgraving of uitgraving van grond."	""	""	"true"	"https://wegenenverkeer.data.vlaanderen.be/doc/implementatiemodel/grondwerken/ontwerpdocument/alt#"	"DtcGrondAfgravinguitgraving"	"http://www.w3.org/2000/01/rdf-schema#Class"	""	""	""	""	""
"DATATYPE"	"OSLO-Grondwerken"	"DtcGrondafdekking"	"{9AD39FF0-9248-4b30-8BD6-A241B9961693}"	""	""	""	""	"Grondafdekking"	"Complex datatype om extra informatie van de afdekking van grond te capteren."	""	"Grondafdekking"	"Complex datatype om extra informatie van de afdekking van grond te capteren."	""	""	"true"	"https://wegenenverkeer.data.vlaanderen.be/doc/implementatiemodel/grondwerken/ontwerpdocument/alt#"	"DtcGrondafdekking"	"http://www.w3.org/2000/01/rdf-schema#Class"	""	""	""	""	""
"DATATYPE"	"OSLO-Complexe-datatypes"	"DtcAfmetingZijde"	"{7BD7B9ED-4392-49c8-9C11-3BCCE9EFCF3D}"	""	""	""	""	"Afmeting zijde"	"De afmeting van een zijde."	""	"Afmeting zijde"	"De afmeting van een zijde."	""	""	"false"	"https://wegenenverkeer.data.vlaanderen.be/doc/implementatiemodel/complexe-datatypes/ontwerpdocument/alt#"	"DtcAfmetingZijde"	"http://www.w3.org/2000/01/rdf-schema#Class"	""	""	""	""	""
"DATATYPE"	"OSLO-Complexe-datatypes"	"DtcAfmetingDiameter"	"{A4E9EF18-BBDC-4b53-B4AB-6C95DDD83985}"	""	""	""	""	"Afmeting diameter"	"De afmeting van een diameter."	""	"Afmeting diameter"	"De afmeting van een diameter."	""	""	"false"	"https://wegenenverkeer.data.vlaanderen.be/doc/implementatiemodel/complexe-datatypes/ontwerpdocument/alt#"	"DtcAfmetingDiameter"	"http://www.w3.org/2000/01/rdf-schema#Class"	""	""	""	""	""
"DATATYPE"	"OSLO-Complexe-datatypes"	"DtcAfmetingBxlxh"	"{B5A50111-A7AF-47dd-9425-B2B1D2D3F925}"	""	""	""	""	"Afmeting bxlxh"	"De afmeting van de breedte, de lengte en hoogte in meter."	""	"Afmeting bxlxh"	"De afmeting van de breedte, de lengte en hoogte in meter."	""	""	"false"	"https://wegenenverkeer.data.vlaanderen.be/doc/implementatiemodel/complexe-datatypes/ontwerpdocument/alt#"	"DtcAfmetingBxlxh"	"http://www.w3.org/2000/01/rdf-schema#Class"	""	""	""	""	""
"DATATYPE"	"OSLO-Complexe-datatypes"	"DtcAfmetingBxh"	"{B1D8888A-C7D8-46f9-9E15-26BF83B0726B}"	""	""	""	""	"Afmeting bxh"	"De afmeting van de breedte en hoogte in meter."	""	"Afmeting bxh"	"De afmeting van de breedte en hoogte in meter."	""	""	"false"	"https://wegenenverkeer.data.vlaanderen.be/doc/implementatiemodel/complexe-datatypes/ontwerpdocument/alt#"	"DtcAfmetingBxh"	"http://www.w3.org/2000/01/rdf-schema#Class"	""	""	""	""	""
"DATATYPE"	"OSLO-Complexe-datatypes"	"DtcAfmetingBxl"	"{4CAB9328-30C1-4a48-8482-E31CC8398A0D}"	""	""	""	""	"Afmeting bxl"	"De afmeting van de breedte en de lengte in meter."	""	"Afmeting bxl"	"De afmeting van de breedte en de lengte in meter."	""	""	"false"	"https://wegenenverkeer.data.vlaanderen.be/doc/implementatiemodel/complexe-datatypes/ontwerpdocument/alt#"	"DtcAfmetingBxl"	"http://www.w3.org/2000/01/rdf-schema#Class"	""	""	""	""	""
"DATATYPE"	"OSLO-Complexe-datatypes"	"DtcCoordWGS84"	"{AA33E1A7-F194-42c1-AC3D-A92069448D19}"	""	""	""	""	"Coördinaat WGS84"	"Complex datatype voor coördinatenreferentiesysteem WGS84."	""	"Coördinaat WGS84"	"Complex datatype voor coördinatenreferentiesysteem WGS84."	""	""	"false"	"https://wegenenverkeer.data.vlaanderen.be/doc/implementatiemodel/complexe-datatypes/ontwerpdocument/alt#"	"DtcCoordWGS84"	"http://www.w3.org/2000/01/rdf-schema#Class"	""	""	""	""	""
"DATATYPE"	"OSLO-Complexe-datatypes"	"DtcCoordLambert72"	"{73A65FAF-52A4-4d56-BF2F-EECB2D03C4F8}"	""	""	""	""	"Coördinaat Lambert72"	"Complex datatype, beschrijft een locatie volgens het Lambert72 coördinatenstelsel."	""	"Coördinaat Lambert72"	"Complex datatype, beschrijft een locatie volgens het Lambert72 coördinatenstelsel."	""	""	"false"	"https://wegenenverkeer.data.vlaanderen.be/doc/implementatiemodel/complexe-datatypes/ontwerpdocument/alt#"	"DtcCoordLambert72"	"http://www.w3.org/2000/01/rdf-schema#Class"	""	""	""	""	""
"DATATYPE"	"OSLO-Complexe-datatypes"	"DtcAWVDocument"	"{441527E2-4B20-4bca-899E-9DC151A2A981}"	""	""	""	""	"Bestandsbijlage"	"Complex datatype voor alle bestandsbijlages"	""	"Bestandsbijlage"	"Complex datatype voor alle bestandsbijlages"	""	""	"false"	"https://wegenenverkeer.data.vlaanderen.be/doc/implementatiemodel/complexe-datatypes/ontwerpdocument/alt#"	"DtcAWVDocument"	"http://www.w3.org/2000/01/rdf-schema#Class"	""	""	""	""	""
"DATATYPE"	"OSLO-Complexe-datatypes"	"DtcAWVIdentificator"	"{0A270AE5-3C56-44b7-8B06-DBC66BD6EB66}"	""	""	""	""	"AWV-identificator"	"Complex datatype voor de identifictor van het AWV-object."	""	"AWV-identificator"	"Complex datatype voor de identifictor van het AWV-object."	""	""	"false"	"https://wegenenverkeer.data.vlaanderen.be/doc/implementatiemodel/complexe-datatypes/ontwerpdocument/alt#"	"DtcAWVIdentificator"	"http://www.w3.org/2000/01/rdf-schema#Class"	""	""	""	""	""
"DATATYPE"	"OSLO-Complexe-datatypes"	"DtcTijdsduur"	"{2A0CAEDB-E50D-45df-B793-21B87BBB4590}"	""	""	""	""	"Tijdsduur"	"Complex datatype voor de instelling van een tijdsbepaling."	""	"Tijdsduur"	"Complex datatype voor de instelling van een tijdsbepaling."	""	""	"false"	"https://wegenenverkeer.data.vlaanderen.be/doc/implementatiemodel/complexe-datatypes/ontwerpdocument/alt#"	"DtcTijdsduur"	"http://www.w3.org/2000/01/rdf-schema#Class"	""	""	""	""	""
"DATATYPE"	"OSLO-Verhardingen-funderingen"	"DtcSupplementenCBV"	"{68006917-79AD-4413-BAF4-4534ED53DA9A}"	""	""	""	""	"Supplementen CBV"	"Complex datatype voor de supplementen van de CBV."	""	"Supplementen CBV"	"Complex datatype voor de supplementen van de CBV."	""	""	"true"	"https://wegenenverkeer.data.vlaanderen.be/doc/implementatiemodel/verhardingen-funderingen/ontwerpdocument/alt#"	"DtcSupplementenCBV"	"http://www.w3.org/2000/01/rdf-schema#Class"	""	""	""	""	""
"DATATYPE"	"OSLO-Complexe-datatypes"	"DtcProductidentificatiecode"	"{DF43B202-DE7C-4eda-9167-220E7A7B4CEC}"	""	""	""	""	"Productidentificatiecode"	"Complex data type dat alle nodige informatie van het product capteert."	""	"Productidentificatiecode"	"Complex data type dat alle nodige informatie van het product capteert."	""	""	"false"	"https://wegenenverkeer.data.vlaanderen.be/doc/implementatiemodel/complexe-datatypes/ontwerpdocument/alt#"	"DtcProductidentificatiecode"	"http://www.w3.org/2000/01/rdf-schema#Class"	""	""	""	""	""
"attribute"	"OSLO²-Generiek"	"standaardEenheid"	"{1AA1AF20-D31A-44cf-B319-90060935968D}"	""	"DtcKwantitatieveWaarde"	"{8A625681-DAB0-4668-B9DA-E3C6F3051773}"	"Literal"	"standaardeenheid"	"De standaard eenheid waarin de kwantitatieve waarde is uitgedrukt."	""	"standaardeenheid"	"De standaard eenheid waarin de kwantitatieve waarde is uitgedrukt."	""	""	"true"	"https://data.vlaanderen.be/ns/generiek#"	"KwantitatieveWaarde.standaardEenheid"	"http://www.w3.org/2002/07/owl#DatatypeProperty"	"https://data.vlaanderen.be/ns/generiek#KwantitatieveWaarde"	"http://www.w3.org/2000/01/rdf-schema#Literal"	""	"1"	"1"
"attribute"	"OSLO²-Generiek"	"waarde"	"{86DAA08E-5BAB-4149-98EC-A839EA5037F9}"	""	"DtcKwantitatieveWaarde"	"{8A625681-DAB0-4668-B9DA-E3C6F3051773}"	"Getal"	"waarde"	"De waarde uitgedrukt in een getal."	""	"waarde"	"De waarde uitgedrukt in een getal."	""	""	"true"	"https://data.vlaanderen.be/ns/generiek#"	"KwantitatieveWaarde.waarde"	"http://www.w3.org/2002/07/owl#ObjectProperty"	"https://data.vlaanderen.be/ns/generiek#KwantitatieveWaarde"	"https://data.vlaanderen.be/ns/generiek#Getal"	""	"1"	"1"
"attribute"	"OSLO-Waterlopen"	"duurzaamheidsklasse"	"{9E798695-CDED-4284-8A27-9C2AD94D5169}"	""	"DtcBetuiningHout"	"{84FB40D4-1069-40d5-A349-3C53672AB793}"	"KlPaalDuurzaamheidsklasse"	"duurzaamheidsklasse"	"De aanduiding dat de duurzaamheid weergeeft van een houten plankenbetuining."	""	"duurzaamheidsklasse"	"De aanduiding dat de duurzaamheid weergeeft van een houten plankenbetuining."	""	""	"true"	"https://wegenenverkeer.data.vlaanderen.be/doc/implementatiemodel/waterlopen/ontwerpdocument/alt#"	"duurzaamheidsklasse"	"http://www.w3.org/2002/07/owl#ObjectProperty"	"https://wegenenverkeer.data.vlaanderen.be/doc/implementatiemodel/waterlopen/ontwerpdocument/alt#DtcBetuiningHout"	"http://www.w3.org/2004/02/skos/core#Concept"	""	"1"	"1"
"attribute"	"OSLO-Waterlopen"	"tekst"	"{C8542098-9736-47c1-BA65-824045288DDA}"	""	"DtcBetuiningHout"	"{84FB40D4-1069-40d5-A349-3C53672AB793}"	"KlPlankbetuiningMateriaal"	"tekst"	"Het materiaal voor de houten paal of plankenbetuining."	""	"tekst"	"Het materiaal voor de houten paal of plankenbetuining."	""	""	"true"	"https://wegenenverkeer.data.vlaanderen.be/doc/implementatiemodel/waterlopen/ontwerpdocument/alt#"	"tekst"	"http://www.w3.org/2002/07/owl#ObjectProperty"	"https://wegenenverkeer.data.vlaanderen.be/doc/implementatiemodel/waterlopen/ontwerpdocument/alt#DtcBetuiningHout"	"http://www.w3.org/2004/02/skos/core#Concept"	""	"1"	"1"
"attribute"	"OSLO-Waterlopen"	"tekst"	"{63A2A210-5CD6-442c-ACE7-EF0EF24FAFD6}"	""	"DtcBetuiningGerecycleerd"	"{CDDA3D77-BCD3-4ae6-9070-C8D314D0FDB8}"	"KlPlankbetuiningMateriaal"	"tekst"	"Het materiaal voor de gerecycleerde paal of plankenbetuining."	""	"tekst"	"Het materiaal voor de gerecycleerde paal of plankenbetuining."	""	""	"true"	"https://wegenenverkeer.data.vlaanderen.be/doc/implementatiemodel/waterlopen/ontwerpdocument/alt#"	"tekst"	"http://www.w3.org/2002/07/owl#ObjectProperty"	"https://wegenenverkeer.data.vlaanderen.be/doc/implementatiemodel/waterlopen/ontwerpdocument/alt#DtcBetuiningGerecycleerd"	"http://www.w3.org/2004/02/skos/core#Concept"	""	"1"	"1"
"attribute"	"OSLO-Waterlopen"	"tekst"	"{64CF4C9B-F974-44b8-AAC5-DDAFF00C4CBE}"	""	"DtcBetuiningBeton"	"{A306ECFE-9719-4cbd-B447-9A05DD983FA4}"	"KlPlankbetuiningMateriaal"	"tekst"	"Het materiaal voor de betonnen paal of plankenbetuining."	""	"tekst"	"Het materiaal voor de betonnen paal of plankenbetuining."	""	""	"true"	"https://wegenenverkeer.data.vlaanderen.be/doc/implementatiemodel/waterlopen/ontwerpdocument/alt#"	"tekst"	"http://www.w3.org/2002/07/owl#ObjectProperty"	"https://wegenenverkeer.data.vlaanderen.be/doc/implementatiemodel/waterlopen/ontwerpdocument/alt#DtcBetuiningBeton"	"http://www.w3.org/2004/02/skos/core#Concept"	""	"1"	"1"
"attribute"	"OSLO-Verhardingen-funderingen"	"gewicht"	"{0A539B51-6C2D-43bb-AE8B-F9263FECD031}"	""	"DtcProfileerlaag"	"{4156EA7B-58B0-4543-A5B0-810355CC6011}"	"KwantWrdInTon"	"gewicht"	"Het gewicht van de profileerlaag in ton."	""	"gewicht"	"Het gewicht van de profileerlaag in ton."	""	""	"true"	"https://wegenenverkeer.data.vlaanderen.be/doc/implementatiemodel/verhardingen-funderingen/ontwerpdocument/alt#"	"gewicht"	"http://www.w3.org/2002/07/owl#ObjectProperty"	"https://wegenenverkeer.data.vlaanderen.be/doc/implementatiemodel/verhardingen-funderingen/ontwerpdocument/alt#DtcProfileerlaag"	"https://wegenenverkeer.data.vlaanderen.be/doc/implementatiemodel/complexe-datatypes/ontwerpdocument/alt#KwantWrdInTon"	""	"1"	"1"
"attribute"	"OSLO-Verhardingen-funderingen"	"laagtype"	"{919160FE-52AD-4e31-9C56-359E1487F529}"	""	"DtcProfileerlaag"	"{4156EA7B-58B0-4543-A5B0-810355CC6011}"	"KlBVLaagtype"	"laagtype"	"Het type van de butimineuze verharding."	""	"laagtype"	"Het type van de butimineuze verharding."	""	""	"true"	"https://wegenenverkeer.data.vlaanderen.be/doc/implementatiemodel/verhardingen-funderingen/ontwerpdocument/alt#"	"laagtype"	"http://www.w3.org/2002/07/owl#ObjectProperty"	"https://wegenenverkeer.data.vlaanderen.be/doc/implementatiemodel/verhardingen-funderingen/ontwerpdocument/alt#DtcProfileerlaag"	"http://www.w3.org/2004/02/skos/core#Concept"	""	"1"	"1"
"attribute"	"OSLO-Vegetatie"	"code"	"{6F3A2819-1A63-4844-AD4A-A7D1EB5F0829}"	""	"DtcVegetatieSoortnaam"	"{10C9D2C4-EA68-4094-B41F-5421A8B495FB}"	"String"	"code"	"De GBIF key, een unieke identificator voor de soort van het vegetatie-element."	""	"code"	"De GBIF key, een unieke identificator voor de soort van het vegetatie-element."	""	""	"true"	"https://wegenenverkeer.data.vlaanderen.be/doc/implementatiemodel/vegetatie/ontwerpdocument/alt#"	"code"	"http://www.w3.org/2002/07/owl#DatatypeProperty"	"https://wegenenverkeer.data.vlaanderen.be/doc/implementatiemodel/vegetatie/ontwerpdocument/alt#DtcVegetatieSoortnaam"	"http://www.w3.org/2001/XMLSchema#string"	""	"1"	"1"
"attribute"	"OSLO-Vegetatie"	"soortnaamNederlands"	"{7E38C7D1-A5D0-440a-81E5-27B2B7095A93}"	""	"DtcVegetatieSoortnaam"	"{10C9D2C4-EA68-4094-B41F-5421A8B495FB}"	"String"	"soortnaam nederlands"	"De Nederlandse soortnaam van de beplanting."	""	"soortnaam nederlands"	"De Nederlandse soortnaam van de beplanting."	""	""	"true"	"https://wegenenverkeer.data.vlaanderen.be/doc/implementatiemodel/vegetatie/ontwerpdocument/alt#"	"soortnaamNederlands"	"http://www.w3.org/2002/07/owl#DatatypeProperty"	"https://wegenenverkeer.data.vlaanderen.be/doc/implementatiemodel/vegetatie/ontwerpdocument/alt#DtcVegetatieSoortnaam"	"http://www.w3.org/2001/XMLSchema#string"	""	"1"	"1"
"attribute"	"OSLO-Vegetatie"	"soortnaamWetenschappelijk"	"{2F408F1C-78FC-44ba-ADD4-5E3F7DA44828}"	""	"DtcVegetatieSoortnaam"	"{10C9D2C4-EA68-4094-B41F-5421A8B495FB}"	"String"	"soortnaam wetenschappelijk"	"De wetenschappelijke soortnaam van de beplanting."	""	"soortnaam wetenschappelijk"	"De wetenschappelijke soortnaam van de beplanting."	""	""	"true"	"https://wegenenverkeer.data.vlaanderen.be/doc/implementatiemodel/vegetatie/ontwerpdocument/alt#"	"soortnaamWetenschappelijk"	"http://www.w3.org/2002/07/owl#DatatypeProperty"	"https://wegenenverkeer.data.vlaanderen.be/doc/implementatiemodel/vegetatie/ontwerpdocument/alt#DtcVegetatieSoortnaam"	"http://www.w3.org/2001/XMLSchema#string"	""	"1"	"1"
"attribute"	"OSLO-Vegetatie"	"beschermingWildvraat"	"{09FE2BB7-5C2F-4263-A957-BBF89DFD8E71}"	""	"DtcHoutigeAanleg"	"{6DEFDE50-304C-4764-891E-57F35C17C9BB}"	"Boolean"	"bescherming wildvraat"	"Geeft aan of er al dan niet bescherming tegen wildvraat is rond de stam van de plant."	""	"bescherming wildvraat"	"Geeft aan of er al dan niet bescherming tegen wildvraat is rond de stam van de plant."	""	""	"true"	"https://wegenenverkeer.data.vlaanderen.be/doc/implementatiemodel/vegetatie/ontwerpdocument/alt#"	"beschermingWildvraat"	"http://www.w3.org/2002/07/owl#DatatypeProperty"	"https://wegenenverkeer.data.vlaanderen.be/doc/implementatiemodel/vegetatie/ontwerpdocument/alt#DtcHoutigeAanleg"	"http://www.w3.org/2001/XMLSchema#boolean"	""	"1"	"1"
