"EA-Type"	"EA-Package"	"EA-Name"	"EA-GUID"	"EA-Parent"	"EA-Domain"	"EA-Domain-GUID"	"EA-Range"	"label"	"definition"	"usage"	"ap-label-nl"	"ap-definition-nl"	"ap-usageNote-nl"	"ap-codelist"	"external term"	"namespace"	"localname"	"type"	"domain"	"range"	"parent"	"min card"	"max card"
"Package"	""	"OSLO-Union-datatypes"	"{19EC3ABF-F45C-425b-9037-0421023BBBCA}"	""	""	""	""	""	""	""	""	""	""	""	""	"http://"	"fixme.com"	"http://www.w3.org/2002/07/owl#Ontology"	""	""	""	""	""
"DATATYPE"	"OSLO-Implementatieelement"	"DtuHellingsSchoorhoek"	"{28275030-2F06-49d6-AB6C-ABD80F1211FF}"	""	""	""	""	"Hellings- of schoorhoek"	"Union datatype voor de hellings- of de schoorhoek."	""	"Hellings- of schoorhoek"	"Union datatype voor de hellings- of de schoorhoek."	""	""	"true"	"https://wegenenverkeer.data.vlaanderen.be/ns/implementatieelement#"	"DtuHellingsSchoorhoek"	"http://www.w3.org/2000/01/rdf-schema#Class"	""	""	""	""	""
"DATATYPE"	"OSLO-Implementatieelement"	"DtuDwarsafmetingen"	"{C8D6ED49-5DCD-48e5-8C91-A014D1075DB4}"	""	""	""	""	"Dwarsafmetingen"	"Union datatype voor de dwarsafmetingen van een object volgens zijn vorm."	""	"Dwarsafmetingen"	"Union datatype voor de dwarsafmetingen van een object volgens zijn vorm."	""	""	"true"	"https://wegenenverkeer.data.vlaanderen.be/ns/implementatieelement#"	"DtuDwarsafmetingen"	"http://www.w3.org/2000/01/rdf-schema#Class"	""	""	""	""	""
"DATATYPE"	"OSLO-Onderdeel"	"DtuAfmetingGrondvlak"	"{3B05E1AA-56E9-4ec2-9F89-0DB2E7A27644}"	""	""	""	""	"afmeting grondvlak"	"Datatype voor de afmeting van een (grond)vlak volgens zijn vorm."	""	"afmeting grondvlak"	"Datatype voor de afmeting van een (grond)vlak volgens zijn vorm."	""	""	"true"	"https://wegenenverkeer.data.vlaanderen.be/ns/onderdeel#"	"DtuAfmetingGrondvlak"	"http://www.w3.org/2000/01/rdf-schema#Class"	""	""	""	""	""
"DATATYPE"	"OSLO-Onderdeel"	"DtuAfmetingVerkeersbord"	"{8E3AF2AC-AEA7-498f-A01C-25FE190F2270}"	""	""	""	""	"Afmeting verkeersbord"	"Union datatype voor de afmeting van het verkeersbord."	""	"Afmeting verkeersbord"	"Union datatype voor de afmeting van het verkeersbord."	""	""	"true"	"https://wegenenverkeer.data.vlaanderen.be/ns/onderdeel#"	"DtuAfmetingVerkeersbord"	"http://www.w3.org/2000/01/rdf-schema#Class"	""	""	""	""	""
"DATATYPE"	"OSLO-Onderdeel"	"DtuBVLaagtypes"	"{A70DB281-AEFD-4b04-A551-5E71C814599E}"	""	""	""	""	"Laagtype van de bitumineuze verharding"	"Union datatype voor een laagtype anders dan de profileerlaag. Bij een profileerlaag kan men het gewicht toelichten."	""	"Laagtype van de bitumineuze verharding"	"Union datatype voor een laagtype anders dan de profileerlaag. Bij een profileerlaag kan men het gewicht toelichten."	""	""	"true"	"https://wegenenverkeer.data.vlaanderen.be/ns/onderdeel#"	"DtuBVLaagtypes"	"http://www.w3.org/2000/01/rdf-schema#Class"	""	""	""	""	""
"DATATYPE"	"OSLO-Onderdeel"	"DtuWvLichtmastBevsToestelMethode"	"{3DB75C31-054C-497d-8284-43688661562E}"	""	""	""	""	"Bevestiging wegverlichtingstoestel"	"Union datatype voor de wijze waarop verlichtingstoestellen bevestigd zijn op een lichtmast, indien dit een standaard methode is dan kan deze geselecteerd worden uit een keuzelijst. Bij afwijkende methode kan de methode toegelicht worden."	""	"Bevestiging wegverlichtingstoestel"	"Union datatype voor de wijze waarop verlichtingstoestellen bevestigd zijn op een lichtmast, indien dit een standaard methode is dan kan deze geselecteerd worden uit een keuzelijst. Bij afwijkende methode kan de methode toegelicht worden."	""	""	"true"	"https://wegenenverkeer.data.vlaanderen.be/ns/onderdeel#"	"DtuWvLichtmastBevsToestelMethode"	"http://www.w3.org/2000/01/rdf-schema#Class"	""	""	""	""	""
"DATATYPE"	"OSLO-Onderdeel"	"DtuLichtmastMasthoogte"	"{A69FB6E7-FCC7-48f1-9EFA-E5A22D2A493E}"	""	""	""	""	"Masthoogte"	"Union datatype om een standaard of afwijkende masthoogte te bepalen."	""	"Masthoogte"	"Union datatype om een standaard of afwijkende masthoogte te bepalen."	""	""	"true"	"https://wegenenverkeer.data.vlaanderen.be/ns/onderdeel#"	"DtuLichtmastMasthoogte"	"http://www.w3.org/2000/01/rdf-schema#Class"	""	""	""	""	""
"DATATYPE"	"OSLO-Implementatieelement"	"KwantWrdInDecimaleGraden"	"{FBFF6E63-A790-4d41-952F-A17A04508A52}"	""	""	""	""	"Kwantitatieve waarde in decimale graden"	"Een kwantitatieve waarde die een getal in decimale graden uitdrukt."	""	"Kwantitatieve waarde in decimale graden"	"Een kwantitatieve waarde die een getal in decimale graden uitdrukt."	""	""	"true"	"https://wegenenverkeer.data.vlaanderen.be/ns/implementatieelement#"	"KwantWrdInDecimaleGraden"	"http://www.w3.org/2000/01/rdf-schema#Class"	""	""	""	""	""
"DATATYPE"	"W3-RDF-Schema"	"Literal"	"{FBE7CE2F-907F-4558-A0CE-70C0A8A6AA32}"	""	""	""	""	"Literal"	"Beschrijft een constante."	"http://www.w3.org/2000/01/rdf-schema#Literal"	"Literal"	"Beschrijft een constante."	""	""	"true"	"http://www.w3.org/2000/01/rdf-schema#"	"Literal"	"http://www.w3.org/2000/01/rdf-schema#Class"	""	""	""	""	""
"DATATYPE"	"W3-XML-Schema"	"Decimal"	"{3300D9AD-B706-43fe-B750-0EB2D8679F90}"	""	""	""	""	"Decimaal getal"	"Beschrijft een decimaal getal volgens http://www.w3.org/2001/XMLSchema#decimal."	"https://www.w3.org/TR/xmlschema-2/#decimal"	"Decimaal getal"	"Beschrijft een decimaal getal volgens http://www.w3.org/2001/XMLSchema#decimal."	""	""	"true"	"http://www.w3.org/2001/XMLSchema#"	"decimal"	"http://www.w3.org/2000/01/rdf-schema#Class"	""	""	""	""	""
"DATATYPE"	"OSLO-Implementatieelement"	"DtcAfmetingBxlxhInMm"	"{F8BB44E1-1583-4e03-B656-7E52894DE726}"	""	""	""	""	"Afmeting bxlxh in millimeter"	"Complex datatype voor de afmeting van de breedte,de lengte en hoogte in millimeter."	""	"Afmeting bxlxh in millimeter"	"Complex datatype voor de afmeting van de breedte,de lengte en hoogte in millimeter."	""	""	"true"	"https://wegenenverkeer.data.vlaanderen.be/ns/implementatieelement#"	"DtcAfmetingBxlxhInMm"	"http://www.w3.org/2000/01/rdf-schema#Class"	""	""	""	""	""
"DATATYPE"	"OSLO-Implementatieelement"	"KwantWrdInMillimeter"	"{AE04A0C4-258A-4401-B823-305832B572AC}"	""	""	""	""	"Kwantitatieve waarde in millimeter"	"Een kwantitatieve waarde die een getal in millimeter uitdrukt."	""	"Kwantitatieve waarde in millimeter"	"Een kwantitatieve waarde die een getal in millimeter uitdrukt."	""	""	"true"	"https://wegenenverkeer.data.vlaanderen.be/ns/implementatieelement#"	"KwantWrdInMillimeter"	"http://www.w3.org/2000/01/rdf-schema#Class"	""	""	""	""	""
"DATATYPE"	"OSLO-Implementatieelement"	"DtcAfmetingDiameterInMm"	"{A4E9EF18-BBDC-4b53-B4AB-6C95DDD83985}"	""	""	""	""	"Afmeting diameter in millimeter"	"Complex datatype voor de afmeting van een diameter in millimeter."	""	"Afmeting diameter in millimeter"	"Complex datatype voor de afmeting van een diameter in millimeter."	""	""	"true"	"https://wegenenverkeer.data.vlaanderen.be/ns/implementatieelement#"	"DtcAfmetingDiameterInMm"	"http://www.w3.org/2000/01/rdf-schema#Class"	""	""	""	""	""
"DATATYPE"	"OSLO-Implementatieelement"	"DtcAfmetingBxlInCm"	"{8E305E94-041F-4dd0-BAFA-28E1058A6C98}"	""	""	""	""	"Afmeting bxl in centimeter"	"Complex datatype voor de afmeting van de breedte en de lengte in centimeter."	""	"Afmeting bxl in centimeter"	"Complex datatype voor de afmeting van de breedte en de lengte in centimeter."	""	""	"true"	"https://wegenenverkeer.data.vlaanderen.be/ns/implementatieelement#"	"DtcAfmetingBxlInCm"	"http://www.w3.org/2000/01/rdf-schema#Class"	""	""	""	""	""
"DATATYPE"	"OSLO-Implementatieelement"	"KwantWrdInCentimeter"	"{4EDCC34B-4D09-4eac-9B1C-78B67973D1B1}"	""	""	""	""	"Kwantitatieve waarde in centimeter"	"Een kwantitatieve waarde die een getal in centimeter uitdrukt."	""	"Kwantitatieve waarde in centimeter"	"Een kwantitatieve waarde die een getal in centimeter uitdrukt."	""	""	"true"	"https://wegenenverkeer.data.vlaanderen.be/ns/implementatieelement#"	"KwantWrdInCentimeter"	"http://www.w3.org/2000/01/rdf-schema#Class"	""	""	""	""	""
"DATATYPE"	"OSLO-Implementatieelement"	"DtcAfmetingDiameterInCm"	"{9CA66282-7034-40ae-B3D9-1B28433C430A}"	""	""	""	""	"Afmeting diameter in centimeter"	"Complex datatype voor de afmeting van een diameter in centimeter."	""	"Afmeting diameter in centimeter"	"Complex datatype voor de afmeting van een diameter in centimeter."	""	""	"true"	"https://wegenenverkeer.data.vlaanderen.be/ns/implementatieelement#"	"DtcAfmetingDiameterInCm"	"http://www.w3.org/2000/01/rdf-schema#Class"	""	""	""	""	""
"DATATYPE"	"OSLO-Implementatieelement"	"DtcAfmetingZijdeInMm"	"{7BD7B9ED-4392-49c8-9C11-3BCCE9EFCF3D}"	""	""	""	""	"Afmeting zijde in millimeter"	"Complex datatype voor de afmeting van een zijde in millimeter."	""	"Afmeting zijde in millimeter"	"Complex datatype voor de afmeting van een zijde in millimeter."	""	""	"true"	"https://wegenenverkeer.data.vlaanderen.be/ns/implementatieelement#"	"DtcAfmetingZijdeInMm"	"http://www.w3.org/2000/01/rdf-schema#Class"	""	""	""	""	""
"DATATYPE"	"OSLO-Implementatieelement"	"DtcAfmetingBxhInMm"	"{A4B2131F-B6B7-4a93-844C-936D7DC4C61E}"	""	""	""	""	"Afmeting bxh in millimeter"	"Complex datatype voor de afmeting van de breedte en hoogte in millimeter."	""	"Afmeting bxh in millimeter"	"Complex datatype voor de afmeting van de breedte en hoogte in millimeter."	""	""	"true"	"https://wegenenverkeer.data.vlaanderen.be/ns/implementatieelement#"	"DtcAfmetingBxhInMm"	"http://www.w3.org/2000/01/rdf-schema#Class"	""	""	""	""	""
"DATATYPE"	"OSLO-Onderdeel"	"DtcProfileerlaag"	"{4156EA7B-58B0-4543-A5B0-810355CC6011}"	""	""	""	""	"Profileerlaag"	"Complex datatype om extra informatie te capteren van de profilerende laag."	""	"Profileerlaag"	"Complex datatype om extra informatie te capteren van de profilerende laag."	""	""	"true"	"https://wegenenverkeer.data.vlaanderen.be/ns/onderdeel#"	"DtcProfileerlaag"	"http://www.w3.org/2000/01/rdf-schema#Class"	""	""	""	""	""
"DATATYPE"	"OSLO-Implementatieelement"	"KwantWrdInTon"	"{F6DAC347-51C7-4425-8B3C-45053AC164EC}"	""	""	""	""	"Kwantitatieve waarde in ton"	"Een kwantitatieve waarde die een getal in ton uitdrukt."	""	"Kwantitatieve waarde in ton"	"Een kwantitatieve waarde die een getal in ton uitdrukt."	""	""	"true"	"https://wegenenverkeer.data.vlaanderen.be/ns/implementatieelement#"	"KwantWrdInTon"	"http://www.w3.org/2000/01/rdf-schema#Class"	""	""	""	""	""
"DATATYPE"	"W3-XML-Schema"	"String"	"{9154C721-7D7C-4c11-8FBF-C56FAEF9A4DA}"	""	""	""	""	"String"	"Beschrijft een tekstregel volgens http://www.w3.org/2001/XMLSchema#string."	"https://www.w3.org/TR/xmlschema-2/#string"	"String"	"Beschrijft een tekstregel volgens http://www.w3.org/2001/XMLSchema#string."	""	""	"true"	"http://www.w3.org/2001/XMLSchema#"	"string"	"http://www.w3.org/2000/01/rdf-schema#Class"	""	""	""	""	""
"DATATYPE"	"OSLO-Implementatieelement"	"KwantWrdInMeter"	"{30A575B2-90E9-4879-A70F-2DE16F53B112}"	""	""	""	""	"Kwantitatieve waarde in meter"	"Een kwantitatieve waarde die een getal in meter uitdrukt."	""	"Kwantitatieve waarde in meter"	"Een kwantitatieve waarde die een getal in meter uitdrukt."	""	""	"true"	"https://wegenenverkeer.data.vlaanderen.be/ns/implementatieelement#"	"KwantWrdInMeter"	"http://www.w3.org/2000/01/rdf-schema#Class"	""	""	""	""	""
"ENUMERATION"	"OSLO-Implementatieelement"	"KlSchoorhoek"	"{4D830116-865E-484d-A17E-70B72249A938}"	""	""	""	""	"Schoorhoek"	"De schoorhoek van het object, uitgedrukt in 1 op x (vb.: 1/4)."	""	"Schoorhoek"	"De schoorhoek van het object, uitgedrukt in 1 op x (vb.: 1/4)."	""	"https://wegenenverkeer.data.vlaanderen.be/id/conceptscheme/KlSchoorhoek"	"true"	"http://www.w3.org/2004/02/skos/core#"	"Concept"	"http://www.w3.org/2000/01/rdf-schema#Class"	""	""	""	""	""
"ENUMERATION"	"OSLO-Onderdeel"	"KlBVLaagtype"	"{74984964-44E2-450f-9843-D84E2EC7FD87}"	""	""	""	""	"BV laagtype"	"Laagtypes van de bitumineuze verharding."	""	"BV laagtype"	"Laagtypes van de bitumineuze verharding."	""	"https://wegenenverkeer.data.vlaanderen.be/id/conceptscheme/KlBVLaagtype"	"true"	"http://www.w3.org/2004/02/skos/core#"	"Concept"	"http://www.w3.org/2000/01/rdf-schema#Class"	""	""	""	""	""
"ENUMERATION"	"OSLO-Onderdeel"	"KlWvLichtmastBevsToestel"	"{67904C92-9A23-43cf-B800-F60D2F96C50C}"	""	""	""	""	"Bevestiging voor wegverlichtingstoestellen"	"De standaard bevestigingen van verlichtingstoestellen aan lichtmasten."	""	"Bevestiging voor wegverlichtingstoestellen"	"De standaard bevestigingen van verlichtingstoestellen aan lichtmasten."	""	"https://wegenenverkeer.data.vlaanderen.be/id/conceptscheme/KlWvLichtmastBevsToestel"	"true"	"http://www.w3.org/2004/02/skos/core#"	"Concept"	"http://www.w3.org/2000/01/rdf-schema#Class"	""	""	""	""	""
"ENUMERATION"	"OSLO-Onderdeel"	"KlLichtmastMasthoogte"	"{A55A31C7-8487-4226-A46F-758954C4DB19}"	""	""	""	""	"Wv masthoogte"	"De standaard masthoogten."	""	"Wv masthoogte"	"De standaard masthoogten."	""	"https://wegenenverkeer.data.vlaanderen.be/id/conceptscheme/KlLichtmastMasthoogte"	"true"	"http://www.w3.org/2004/02/skos/core#"	"Concept"	"http://www.w3.org/2000/01/rdf-schema#Class"	""	""	""	""	""
"attribute"	"OSLO-Implementatieelement"	"hellingshoek"	"{7906D351-0B58-43c1-AB2F-ED2C0D2F4E24}"	""	"DtuHellingsSchoorhoek"	"{28275030-2F06-49d6-AB6C-ABD80F1211FF}"	"KwantWrdInDecimaleGraden"	"hellingshoek"	"Hoek die het object maakt ten opzichte van de verticale, uitgedrukt in decimale graden."	""	"hellingshoek"	"Hoek die het object maakt ten opzichte van de verticale, uitgedrukt in decimale graden."	""	""	"true"	"https://wegenenverkeer.data.vlaanderen.be/ns/implementatieelement#"	"DtuHellingsSchoorhoek.hellingshoek"	"http://www.w3.org/2002/07/owl#ObjectProperty"	"https://wegenenverkeer.data.vlaanderen.be/ns/implementatieelement#DtuHellingsSchoorhoek"	"https://wegenenverkeer.data.vlaanderen.be/ns/implementatieelement#KwantWrdInDecimaleGraden"	""	"1"	"1"
"attribute"	"OSLO-Implementatieelement"	"schoorhoek"	"{104997E6-DF7C-4d3a-B4E3-CB897EA9583F}"	""	"DtuHellingsSchoorhoek"	"{28275030-2F06-49d6-AB6C-ABD80F1211FF}"	"KlSchoorhoek"	"schoorhoek"	"Hoek die het object maakt ten opzichte van de verticale, uitgedrukt in 1 op x (vb.: 1/4)."	""	"schoorhoek"	"Hoek die het object maakt ten opzichte van de verticale, uitgedrukt in 1 op x (vb.: 1/4)."	""	""	"true"	"https://wegenenverkeer.data.vlaanderen.be/ns/implementatieelement#"	"DtuHellingsSchoorhoek.schoorhoek"	"http://www.w3.org/2002/07/owl#ObjectProperty"	"https://wegenenverkeer.data.vlaanderen.be/ns/implementatieelement#DtuHellingsSchoorhoek"	"http://www.w3.org/2004/02/skos/core#Concept"	""	"1"	"1"
"attribute"	"OSLO-Implementatieelement"	"rechthoekig"	"{6972C6A4-1EB3-410a-9BA4-CE5260B3AFDA}"	""	"DtuDwarsafmetingen"	"{C8D6ED49-5DCD-48e5-8C91-A014D1075DB4}"	"DtcAfmetingBxlxhInMm"	"rechthoekig"	"Afmetingen voor breedte, lengte en hoogte van een rechthoekig object."	""	"rechthoekig"	"Afmetingen voor breedte, lengte en hoogte van een rechthoekig object."	""	""	"true"	"https://wegenenverkeer.data.vlaanderen.be/ns/implementatieelement#"	"DtuDwarsafmetingen.rechthoekig"	"http://www.w3.org/2002/07/owl#ObjectProperty"	"https://wegenenverkeer.data.vlaanderen.be/ns/implementatieelement#DtuDwarsafmetingen"	"https://wegenenverkeer.data.vlaanderen.be/ns/implementatieelement#DtcAfmetingBxlxhInMm"	""	"1"	"1"
"attribute"	"OSLO-Implementatieelement"	"rond"	"{368088B1-8D39-48e7-A563-DE03F0699F53}"	""	"DtuDwarsafmetingen"	"{C8D6ED49-5DCD-48e5-8C91-A014D1075DB4}"	"DtcAfmetingDiameterInMm"	"rond"	"Afmeting van de diameter in milimeter van een rond object."	""	"rond"	"Afmeting van de diameter in milimeter van een rond object."	""	""	"true"	"https://wegenenverkeer.data.vlaanderen.be/ns/implementatieelement#"	"DtuDwarsafmetingen.rond"	"http://www.w3.org/2002/07/owl#ObjectProperty"	"https://wegenenverkeer.data.vlaanderen.be/ns/implementatieelement#DtuDwarsafmetingen"	"https://wegenenverkeer.data.vlaanderen.be/ns/implementatieelement#DtcAfmetingDiameterInMm"	""	"1"	"1"
"attribute"	"OSLO-Onderdeel"	"rechthoekig"	"{81FBEB13-EB61-44e3-B917-8201BB744FDB}"	""	"DtuAfmetingGrondvlak"	"{3B05E1AA-56E9-4ec2-9F89-0DB2E7A27644}"	"DtcAfmetingBxlInCm"	"rechthoekig"	"Afmetingen voor breedte en lengte of diepte. De breedte meet van links naar rechts in vooraanzicht, de lengte van voor naar achter."	""	"rechthoekig"	"Afmetingen voor breedte en lengte of diepte. De breedte meet van links naar rechts in vooraanzicht, de lengte van voor naar achter."	""	""	"true"	"https://wegenenverkeer.data.vlaanderen.be/ns/onderdeel#"	"DtuAfmetingGrondvlak.rechthoekig"	"http://www.w3.org/2002/07/owl#ObjectProperty"	"https://wegenenverkeer.data.vlaanderen.be/ns/onderdeel#DtuAfmetingGrondvlak"	"https://wegenenverkeer.data.vlaanderen.be/ns/implementatieelement#DtcAfmetingBxlInCm"	""	"1"	"1"
"attribute"	"OSLO-Onderdeel"	"rond"	"{31577E44-75DF-4981-9927-B10E574CCF72}"	""	"DtuAfmetingGrondvlak"	"{3B05E1AA-56E9-4ec2-9F89-0DB2E7A27644}"	"DtcAfmetingDiameterInCm"	"rond"	"Afmeting van de diameter in centimeter van een rond (grond)vlak."	""	"rond"	"Afmeting van de diameter in centimeter van een rond (grond)vlak."	""	""	"true"	"https://wegenenverkeer.data.vlaanderen.be/ns/onderdeel#"	"DtuAfmetingGrondvlak.rond"	"http://www.w3.org/2002/07/owl#ObjectProperty"	"https://wegenenverkeer.data.vlaanderen.be/ns/onderdeel#DtuAfmetingGrondvlak"	"https://wegenenverkeer.data.vlaanderen.be/ns/implementatieelement#DtcAfmetingDiameterInCm"	""	"1"	"1"
"attribute"	"OSLO-Onderdeel"	"achthoekig"	"{0438735D-63FA-4090-A49F-3DBFCF66F2DA}"	""	"DtuAfmetingVerkeersbord"	"{8E3AF2AC-AEA7-498f-A01C-25FE190F2270}"	"DtcAfmetingZijdeInMm"	"achthoekig"	"De afmeting voor een achthoekig verkeersbord (zijde in millimeter)."	""	"achthoekig"	"De afmeting voor een achthoekig verkeersbord (zijde in millimeter)."	""	""	"true"	"https://wegenenverkeer.data.vlaanderen.be/ns/onderdeel#"	"DtuAfmetingVerkeersbord.achthoekig"	"http://www.w3.org/2002/07/owl#ObjectProperty"	"https://wegenenverkeer.data.vlaanderen.be/ns/onderdeel#DtuAfmetingVerkeersbord"	"https://wegenenverkeer.data.vlaanderen.be/ns/implementatieelement#DtcAfmetingZijdeInMm"	""	"0"	"1"
"attribute"	"OSLO-Onderdeel"	"driehoekig"	"{FFA00223-E8D9-4d7f-9C68-DE95EE29418F}"	""	"DtuAfmetingVerkeersbord"	"{8E3AF2AC-AEA7-498f-A01C-25FE190F2270}"	"DtcAfmetingZijdeInMm"	"driehoekig"	"De afmeting van een driehoekig verkeersbord (zijde in millimeter)."	""	"driehoekig"	"De afmeting van een driehoekig verkeersbord (zijde in millimeter)."	""	""	"true"	"https://wegenenverkeer.data.vlaanderen.be/ns/onderdeel#"	"DtuAfmetingVerkeersbord.driehoekig"	"http://www.w3.org/2002/07/owl#ObjectProperty"	"https://wegenenverkeer.data.vlaanderen.be/ns/onderdeel#DtuAfmetingVerkeersbord"	"https://wegenenverkeer.data.vlaanderen.be/ns/implementatieelement#DtcAfmetingZijdeInMm"	""	"0"	"1"
"attribute"	"OSLO-Onderdeel"	"rond"	"{396D0E06-9365-480a-A285-2B07C77865FB}"	""	"DtuAfmetingVerkeersbord"	"{8E3AF2AC-AEA7-498f-A01C-25FE190F2270}"	"DtcAfmetingDiameterInMm"	"rond"	"De afmeting voor een rond verkeersbord (diameter in millimeter)."	""	"rond"	"De afmeting voor een rond verkeersbord (diameter in millimeter)."	""	""	"true"	"https://wegenenverkeer.data.vlaanderen.be/ns/onderdeel#"	"DtuAfmetingVerkeersbord.rond"	"http://www.w3.org/2002/07/owl#ObjectProperty"	"https://wegenenverkeer.data.vlaanderen.be/ns/onderdeel#DtuAfmetingVerkeersbord"	"https://wegenenverkeer.data.vlaanderen.be/ns/implementatieelement#DtcAfmetingDiameterInMm"	""	"0"	"1"
"attribute"	"OSLO-Onderdeel"	"vierhoekig"	"{D0366F77-BC0A-40f9-9F68-6B8B944EE4CA}"	""	"DtuAfmetingVerkeersbord"	"{8E3AF2AC-AEA7-498f-A01C-25FE190F2270}"	"DtcAfmetingBxhInMm"	"vierhoekig"	"De afmeting voor een vierhoekig verkeersbord (breedte en hoogte in millimeter)."	""	"vierhoekig"	"De afmeting voor een vierhoekig verkeersbord (breedte en hoogte in millimeter)."	""	""	"true"	"https://wegenenverkeer.data.vlaanderen.be/ns/onderdeel#"	"DtuAfmetingVerkeersbord.vierhoekig"	"http://www.w3.org/2002/07/owl#ObjectProperty"	"https://wegenenverkeer.data.vlaanderen.be/ns/onderdeel#DtuAfmetingVerkeersbord"	"https://wegenenverkeer.data.vlaanderen.be/ns/implementatieelement#DtcAfmetingBxhInMm"	""	"0"	"1"
"attribute"	"OSLO-Onderdeel"	"zeshoekig"	"{F8C37538-A53C-42b7-AE2B-6A5780911580}"	""	"DtuAfmetingVerkeersbord"	"{8E3AF2AC-AEA7-498f-A01C-25FE190F2270}"	"DtcAfmetingZijdeInMm"	"zeshoekig"	"De afmeting voor een zeshoekig verkeersbord (zijde in millimeter)."	""	"zeshoekig"	"De afmeting voor een zeshoekig verkeersbord (zijde in millimeter)."	""	""	"true"	"https://wegenenverkeer.data.vlaanderen.be/ns/onderdeel#"	"DtuAfmetingVerkeersbord.zeshoekig"	"http://www.w3.org/2002/07/owl#ObjectProperty"	"https://wegenenverkeer.data.vlaanderen.be/ns/onderdeel#DtuAfmetingVerkeersbord"	"https://wegenenverkeer.data.vlaanderen.be/ns/implementatieelement#DtcAfmetingZijdeInMm"	""	"0"	"1"
"attribute"	"OSLO-Onderdeel"	"laagtype"	"{CCB7CFD9-02B3-4c8b-BBC5-0D852A2A9CD2}"	""	"DtuBVLaagtypes"	"{A70DB281-AEFD-4b04-A551-5E71C814599E}"	"KlBVLaagtype"	"laagtype"	"Het type van de bitumineuze verharding."	""	"laagtype"	"Het type van de bitumineuze verharding."	""	""	"true"	"https://wegenenverkeer.data.vlaanderen.be/ns/onderdeel#"	"DtuBVLaagtypes.laagtype"	"http://www.w3.org/2002/07/owl#ObjectProperty"	"https://wegenenverkeer.data.vlaanderen.be/ns/onderdeel#DtuBVLaagtypes"	"http://www.w3.org/2004/02/skos/core#Concept"	""	"0"	"1"
"attribute"	"OSLO-Onderdeel"	"profileerlaag"	"{C84ADE48-273A-4a5e-BF29-0E0FD68F28D5}"	""	"DtuBVLaagtypes"	"{A70DB281-AEFD-4b04-A551-5E71C814599E}"	"DtcProfileerlaag"	"profileerlaag"	"De laag die het profiel verbetert van de verharding."	""	"profileerlaag"	"De laag die het profiel verbetert van de verharding."	""	""	"true"	"https://wegenenverkeer.data.vlaanderen.be/ns/onderdeel#"	"DtuBVLaagtypes.profileerlaag"	"http://www.w3.org/2002/07/owl#ObjectProperty"	"https://wegenenverkeer.data.vlaanderen.be/ns/onderdeel#DtuBVLaagtypes"	"https://wegenenverkeer.data.vlaanderen.be/ns/onderdeel#DtcProfileerlaag"	""	"0"	"1"
"attribute"	"OSLO-Onderdeel"	"afwijkendeMethode"	"{1D2B9B03-6A1B-406c-BD6B-10E45A982E59}"	""	"DtuWvLichtmastBevsToestelMethode"	"{3DB75C31-054C-497d-8284-43688661562E}"	"String"	"afwijkende methode"	"Tekstveld waarin de afwijkende methode van bevestiging van verlichtingstoestel aan lichtmast kan beschreven worden."	""	"afwijkende methode"	"Tekstveld waarin de afwijkende methode van bevestiging van verlichtingstoestel aan lichtmast kan beschreven worden."	""	""	"true"	"https://wegenenverkeer.data.vlaanderen.be/ns/onderdeel#"	"DtuWvLichtmastBevsToestelMethode.afwijkendeMethode"	"http://www.w3.org/2002/07/owl#DatatypeProperty"	"https://wegenenverkeer.data.vlaanderen.be/ns/onderdeel#DtuWvLichtmastBevsToestelMethode"	"http://www.w3.org/2001/XMLSchema#string"	""	"0"	"1"
"attribute"	"OSLO-Onderdeel"	"standaardMethode"	"{D5E0C187-B300-4545-A7E0-0049599CC5E2}"	""	"DtuWvLichtmastBevsToestelMethode"	"{3DB75C31-054C-497d-8284-43688661562E}"	"KlWvLichtmastBevsToestel"	"standaard methode"	"Bepaling van de standaardbevestigingen van verlichtingstoestellen aan lichtmasten."	""	"standaard methode"	"Bepaling van de standaardbevestigingen van verlichtingstoestellen aan lichtmasten."	""	""	"true"	"https://wegenenverkeer.data.vlaanderen.be/ns/onderdeel#"	"DtuWvLichtmastBevsToestelMethode.standaardMethode"	"http://www.w3.org/2002/07/owl#ObjectProperty"	"https://wegenenverkeer.data.vlaanderen.be/ns/onderdeel#DtuWvLichtmastBevsToestelMethode"	"http://www.w3.org/2004/02/skos/core#Concept"	""	"0"	"1"
"attribute"	"OSLO-Onderdeel"	"afwijkendeHoogte"	"{19A095EE-3CEA-497a-9FD1-78690376DC6C}"	""	"DtuLichtmastMasthoogte"	"{A69FB6E7-FCC7-48f1-9EFA-E5A22D2A493E}"	"KwantWrdInMeter"	"afwijkende hoogte"	"De afwijkende hoogte van de mast in meter."	""	"afwijkende hoogte"	"De afwijkende hoogte van de mast in meter."	""	""	"true"	"https://wegenenverkeer.data.vlaanderen.be/ns/onderdeel#"	"DtuLichtmastMasthoogte.afwijkendeHoogte"	"http://www.w3.org/2002/07/owl#ObjectProperty"	"https://wegenenverkeer.data.vlaanderen.be/ns/onderdeel#DtuLichtmastMasthoogte"	"https://wegenenverkeer.data.vlaanderen.be/ns/implementatieelement#KwantWrdInMeter"	""	"0"	"1"
"attribute"	"OSLO-Onderdeel"	"standaardHoogte"	"{D30C3434-0872-4d63-AE0F-07399DEB9B90}"	""	"DtuLichtmastMasthoogte"	"{A69FB6E7-FCC7-48f1-9EFA-E5A22D2A493E}"	"KlLichtmastMasthoogte"	"standaard hoogte"	"Bepaling van de standaard hoogte van een mast."	""	"standaard hoogte"	"Bepaling van de standaard hoogte van een mast."	""	""	"true"	"https://wegenenverkeer.data.vlaanderen.be/ns/onderdeel#"	"DtuLichtmastMasthoogte.standaardHoogte"	"http://www.w3.org/2002/07/owl#ObjectProperty"	"https://wegenenverkeer.data.vlaanderen.be/ns/onderdeel#DtuLichtmastMasthoogte"	"http://www.w3.org/2004/02/skos/core#Concept"	""	"0"	"1"
"attribute"	"OSLO-Implementatieelement"	"standaardEenheid"	"{8682A3F1-7F87-4176-8FFE-E97BD3AEF250}"	""	"KwantWrdInDecimaleGraden"	"{FBFF6E63-A790-4d41-952F-A17A04508A52}"	"Literal"	"standaard eenheid"	"De standaard eenheid bij dit datatype is uitgedrukt in decimale graden."	"""deg""^^cdt:ucumunit"	"standaard eenheid"	"De standaard eenheid bij dit datatype is uitgedrukt in decimale graden."	""	""	"true"	"https://wegenenverkeer.data.vlaanderen.be/ns/implementatieelement#"	"KwantWrdInDecimaleGraden.standaardEenheid"	"http://www.w3.org/2002/07/owl#DatatypeProperty"	"https://wegenenverkeer.data.vlaanderen.be/ns/implementatieelement#KwantWrdInDecimaleGraden"	"http://www.w3.org/2000/01/rdf-schema#Literal"	""	"1"	"1"
"attribute"	"OSLO-Implementatieelement"	"waarde"	"{7F3EC066-0CD9-45aa-BA6D-08D876E32416}"	""	"KwantWrdInDecimaleGraden"	"{FBFF6E63-A790-4d41-952F-A17A04508A52}"	"Decimal"	"waarde"	"Bevat een getal die bij het datatype hoort."	""	"waarde"	"Bevat een getal die bij het datatype hoort."	""	""	"true"	"https://wegenenverkeer.data.vlaanderen.be/ns/implementatieelement#"	"KwantWrdInDecimaleGraden.waarde"	"http://www.w3.org/2002/07/owl#ObjectProperty"	"https://wegenenverkeer.data.vlaanderen.be/ns/implementatieelement#KwantWrdInDecimaleGraden"	"http://www.w3.org/2001/XMLSchema#decimal"	""	"1"	"1"
