"EA-Type"	"EA-Package"	"EA-Name"	"EA-GUID"	"EA-Parent"	"EA-Domain"	"EA-Domain-GUID"	"EA-Range"	"label"	"definition"	"usage"	"ap-label-nl"	"ap-definition-nl"	"ap-usageNote-nl"	"ap-codelist"	"external term"	"namespace"	"localname"	"type"	"domain"	"range"	"parent"	"min card"	"max card"
"Package"	""	"OSLO-AIM-Object"	"{1CBFF0EB-60DA-4860-85ED-081283B97616}"	""	""	""	""	""	""	""	""	""	""	""	""	"http://"	"fixme.com"	"http://www.w3.org/2002/07/owl#Ontology"	""	""	""	""	""
"ENUMERATION"	"OSLO-Onderdeel"	"KlBetrokkenheidRol"	"{34B9D913-3B2A-4bb4-A5FC-EB8F872D2DA0}"	""	""	""	""	"Betrokkenheid rol"	"Keuzelijst met mogelijke waarden voor de rol waarmee een agent betrokken is bij een object."	""	"Betrokkenheid rol"	"Keuzelijst met mogelijke waarden voor de rol waarmee een agent betrokken is bij een object."	""	"https://wegenenverkeer-test.data.vlaanderen.be/id/conceptscheme/KlBetrokkenheidRol"	"true"	"http://www.w3.org/2004/02/skos/core#"	"Concept"	"http://www.w3.org/2000/01/rdf-schema#Class"	""	""	""	""	""
"CLASS"	"OSLO-Onderdeel"	"HeeftBetrokkene"	"{6A4335C4-5121-4823-8F10-13FAFF765FFC}"	""	""	""	""	"heeft betrokkene"	"Koppelt een natuurlijk persoon,rechtspersoon of een hoedanigheid (een functie eerder dan de persoon die de functie uitoefent) aan een object in een bepaalde rol."	""	"heeft betrokkene"	"Koppelt een natuurlijk persoon,rechtspersoon of een hoedanigheid (een functie eerder dan de persoon die de functie uitoefent) aan een object in een bepaalde rol."	""	""	"true"	"https://wegenenverkeer-test.data.vlaanderen.be/ns/onderdeel#"	"HeeftBetrokkene"	"http://www.w3.org/2000/01/rdf-schema#Class"	""	""	"https://wegenenverkeer-test.data.vlaanderen.be/ns/implementatieelement#DirectioneleRelatie"	""	""
"CLASS"	"OSLO-Implementatieelement"	"AIMToestand"	"{9418C0E6-C48A-44df-ABF7-C6E3B7FF5FC4}"	""	""	""	""	"AIM Toestand"	"Voegt een atribuut toe aan de subklasse die overerft van de abstracte waarmee die een moment in de levenscyclus van het object aangeeft."	""	"AIM Toestand"	"Voegt een atribuut toe aan de subklasse die overerft van de abstracte waarmee die een moment in de levenscyclus van het object aangeeft."	""	""	"true"	"https://wegenenverkeer-test.data.vlaanderen.be/ns/implementatieelement#"	"AIMToestand"	"http://www.w3.org/2000/01/rdf-schema#Class"	""	""	""	""	""
"CLASS"	"OSLO-Implementatieelement"	"AIMStatus"	"{75C21F07-BAE5-412e-AD87-520DD947D510}"	""	""	""	""	"AIM Status"	"Voegt een atribuut met de status (actief/inactief) toe aan de subklasse die overerft van de abstracte."	""	"AIM Status"	"Voegt een atribuut met de status (actief/inactief) toe aan de subklasse die overerft van de abstracte."	""	""	"true"	"https://wegenenverkeer-test.data.vlaanderen.be/ns/implementatieelement#"	"AIMStatus"	"http://www.w3.org/2000/01/rdf-schema#Class"	""	""	""	""	""
"CLASS"	"OSLO-Implementatieelement"	"Agent"	"{C6B335E1-35B1-4429-A842-CA67095E3AF5}"	""	""	""	""	"Agent"	"Iemand die of iets dat kan handelen of een effect kan teweeg brengen."	""	"Agent"	"Iemand die of iets dat kan handelen of een effect kan teweeg brengen."	""	""	"true"	"http://purl.org/dc/terms/"	"Agent"	"http://www.w3.org/2000/01/rdf-schema#Class"	""	""	""	""	""
"CLASS"	"OSLO-Implementatieelement"	"NaampadObject"	"{79135DEF-C20F-4371-A26D-1657F2A30BF6}"	"AIMNaamObject"	""	""	""	"Naampad object"	"Abstracte als de basisklasse voor elk OTL object dat gebruik maakt van een naampad."	""	"Naampad object"	"Abstracte als de basisklasse voor elk OTL object dat gebruik maakt van een naampad."	""	""	"true"	"https://wegenenverkeer-test.data.vlaanderen.be/ns/implementatieelement#"	"NaampadObject"	"http://www.w3.org/2000/01/rdf-schema#Class"	""	""	"https://wegenenverkeer-test.data.vlaanderen.be/ns/implementatieelement#AIMNaamObject"	""	""
"CLASS"	"OSLO-Implementatieelement"	"Derdenobject"	"{93363643-7387-49bf-B147-2D6301A30B0A}"	"AIMToestand, AIMStatus"	""	""	""	"Derdenobject"	"Object niet in eigendom van de assetbeheerder dat zonder verdere typering bewaard wordt om relaties met getypeerde assets te kunnen beheren."	""	"Derdenobject"	"Object niet in eigendom van de assetbeheerder dat zonder verdere typering bewaard wordt om relaties met getypeerde assets te kunnen beheren."	""	""	"true"	"https://wegenenverkeer-test.data.vlaanderen.be/ns/implementatieelement#"	"Derdenobject"	"http://www.w3.org/2000/01/rdf-schema#Class"	""	""	"https://wegenenverkeer-test.data.vlaanderen.be/ns/implementatieelement#AIMToestand, https://wegenenverkeer-test.data.vlaanderen.be/ns/implementatieelement#AIMStatus"	""	""
"CLASS"	"OSLO-Implementatieelement"	"AIMNaamObject"	"{493E85C9-60EF-4aff-9C4C-5C45D59C0E64}"	"AIMObject"	""	""	""	"AIM naam object"	"Abstracte als de basisklasse voor elk OTL object dat benoemd wordt met een mensleesbare identificator."	""	"AIM naam object"	"Abstracte als de basisklasse voor elk OTL object dat benoemd wordt met een mensleesbare identificator."	""	""	"true"	"https://wegenenverkeer-test.data.vlaanderen.be/ns/implementatieelement#"	"AIMNaamObject"	"http://www.w3.org/2000/01/rdf-schema#Class"	""	""	"https://wegenenverkeer-test.data.vlaanderen.be/ns/implementatieelement#AIMObject"	""	""
"CLASS"	"OSLO-Implementatieelement"	"AIMObject"	"{9AF587FA-A5CF-4b0c-8A23-CF75F280760F}"	"AIMToestand, AIMStatus"	""	""	""	"AIM object"	"Abstracte als de basisklasse voor alle uniek ge誰dentificeerde OTL objecten met de basiseigenschappen die elk OTL object minstens heeft."	""	"AIM object"	"Abstracte als de basisklasse voor alle uniek ge誰dentificeerde OTL objecten met de basiseigenschappen die elk OTL object minstens heeft."	""	""	"true"	"https://wegenenverkeer-test.data.vlaanderen.be/ns/implementatieelement#"	"AIMObject"	"http://www.w3.org/2000/01/rdf-schema#Class"	""	""	"https://wegenenverkeer-test.data.vlaanderen.be/ns/implementatieelement#AIMToestand, https://wegenenverkeer-test.data.vlaanderen.be/ns/implementatieelement#AIMStatus"	""	""
"CLASS"	"OSLO-Implementatieelement"	"DirectioneleRelatie"	"{D0C0CCF0-3B36-4e28-9BFE-74D6DE41F636}"	""	""	""	""	"Directionele relatie"	"Een abstracte die relaties groepeert waarbij de richting semantisch gedefinieerd is."	""	"Directionele relatie"	"Een abstracte die relaties groepeert waarbij de richting semantisch gedefinieerd is."	""	""	"true"	"https://wegenenverkeer-test.data.vlaanderen.be/ns/implementatieelement#"	"DirectioneleRelatie"	"http://www.w3.org/2000/01/rdf-schema#Class"	""	""	"https://wegenenverkeer-test.data.vlaanderen.be/ns/implementatieelement#RelatieObject"	""	""
"CLASS"	"OSLO-Implementatieelement"	"RelatieObject"	"{13BBEBEB-43DF-4b91-B694-16E4EBB3938A}"	""	""	""	""	"Relatieobject"	"TODO"	""	"Relatieobject"	"TODO"	""	""	"true"	"https://wegenenverkeer-test.data.vlaanderen.be/ns/implementatieelement#"	"RelatieObject"	"http://www.w3.org/2000/01/rdf-schema#Class"	""	""	"https://wegenenverkeer-test.data.vlaanderen.be/ns/implementatieelement#AIMStatus"	""	""
"DATATYPE"	"OSLO-Implementatieelement"	"DtcContactinfo"	"{41082E9B-3AFF-49f2-830A-9A550C7AE8AF}"	""	""	""	""	"Contactinfo"	"Informatie zoals email,telefoon,adres die toelaat om iemand of iets te contacteren."	""	"Contactinfo"	"Informatie zoals email,telefoon,adres die toelaat om iemand of iets te contacteren."	""	""	"true"	"https://schema.org/"	"ContactPoint"	"http://www.w3.org/2000/01/rdf-schema#Class"	""	""	""	""	""
"DATATYPE"	"OSLO-Implementatieelement"	"DtcAdres"	"{281D2EBE-A38A-44a2-987B-2C818171A6FF}"	""	""	""	""	"Adres"	"De aanduiding van een bepaalde locatie,doorgaans van een huis,woning,gebouw of faciliteit,op de aarde."	""	"Adres"	"De aanduiding van een bepaalde locatie,doorgaans van een huis,woning,gebouw of faciliteit,op de aarde."	""	""	"true"	"https://wegenenverkeer-test.data.vlaanderen.be/ns/implementatieelement#"	"DtcAdres"	"http://www.w3.org/2000/01/rdf-schema#Class"	""	""	""	""	""
"DATATYPE"	"W3-XML-Schema"	"String"	"{81376A9B-DB07-4798-87F6-B226CAC2C5C8}"	""	""	""	""	"String"	"Beschrijft een tekstregel volgens http://www.w3.org/2001/XMLSchema#string"	"https://www.w3.org/TR/xmlschema-2/#string"	"String"	"Beschrijft een tekstregel volgens http://www.w3.org/2001/XMLSchema#string"	""	""	"true"	"http://www.w3.org/2001/XMLSchema#"	"string"	"http://www.w3.org/2000/01/rdf-schema#Class"	""	""	""	""	""
"DATATYPE"	"OSLO-Implementatieelement"	"DtcOpeningsurenSpecificatie"	"{7821D0E8-16E8-4b32-B24C-4356C72AD7EB}"	""	""	""	""	"Openingsurenspecificatie"	"Specifieert openingsuren volgens https://schema.org/OpeningHoursSpecification"	""	"Openingsurenspecificatie"	"Specifieert openingsuren volgens https://schema.org/OpeningHoursSpecification"	""	""	"true"	"https://schema.org/"	"OpeningHoursSpecification"	"http://www.w3.org/2000/01/rdf-schema#Class"	""	""	""	""	""
"DATATYPE"	"W3-XML-Schema"	"Time"	"{C093CB2B-1740-4725-83FE-EE29A430402E}"	""	""	""	""	"Tijd"	"Beschrijft een tijd volgens http://www.w3.org/2001/XMLSchema#time"	"https://www.w3.org/TR/xmlschema-2/#time"	"Tijd"	"Beschrijft een tijd volgens http://www.w3.org/2001/XMLSchema#time"	""	""	"true"	"http://www.w3.org/2001/XMLSchema#"	"time"	"http://www.w3.org/2000/01/rdf-schema#Class"	""	""	""	""	""
"DATATYPE"	"OSLO-Implementatieelement"	"DtcIdentificator"	"{166F8539-73F1-4112-B479-1654B795E2C2}"	""	""	""	""	"identificator"	"Complex datatype voor de identificator van een object volgens de bron van de identificator."	""	"identificator"	"Complex datatype voor de identificator van een object volgens de bron van de identificator."	""	""	"true"	"https://wegenenverkeer-test.data.vlaanderen.be/ns/implementatieelement#"	"DtcIdentificator"	"http://www.w3.org/2000/01/rdf-schema#Class"	""	""	""	""	""
"DATATYPE"	"W3-XML-Schema"	"AnyURI"	"{81711512-9AAA-4861-841D-A6A67FB29FD1}"	""	""	""	""	"URI"	"Een tekstwaarde die een verwijzing naar meer informatie van het element bevat volgens http://www.w3.org/2001/XMLSchema#anyURI ."	"https://www.w3.org/TR/xmlschema-2/#anyURI"	"URI"	"Een tekstwaarde die een verwijzing naar meer informatie van het element bevat volgens http://www.w3.org/2001/XMLSchema#anyURI ."	""	""	"true"	"http://www.w3.org/2001/XMLSchema#"	"anyURI"	"http://www.w3.org/2000/01/rdf-schema#Class"	""	""	""	""	""
"DATATYPE"	"W3-XML-Schema"	"Boolean"	"{9E1833BF-210A-4b48-8326-8A00413463CD}"	""	""	""	""	"Boolean"	"Beschrijft een boolean volgens http://www.w3.org/2001/XMLSchema#boolean"	"https://www.w3.org/TR/xmlschema-2/#boolean"	"Boolean"	"Beschrijft een boolean volgens http://www.w3.org/2001/XMLSchema#boolean"	""	""	"true"	"http://www.w3.org/2001/XMLSchema#"	"boolean"	"http://www.w3.org/2000/01/rdf-schema#Class"	""	""	""	""	""
"DATATYPE"	"W3-XML-Schema"	"Date"	"{6EA0E47B-3163-404d-A035-56A88051BC31}"	""	""	""	""	"Datum"	"Beschrijft een datum volgens http://www.w3.org/2001/XMLSchema#date"	"https://www.w3.org/TR/xmlschema-2/#date"	"Datum"	"Beschrijft een datum volgens http://www.w3.org/2001/XMLSchema#date"	""	""	"true"	"http://www.w3.org/2001/XMLSchema#"	"date"	"http://www.w3.org/2000/01/rdf-schema#Class"	""	""	""	""	""
"DATATYPE"	"OSLO-Implementatieelement"	"DtcDocument"	"{57E2B78E-3BA6-4465-85AB-B3C47F14D47F}"	""	""	""	""	"Bestandsbijlage"	"Complex datatype voor alle bestandsbijlages"	""	"Bestandsbijlage"	"Complex datatype voor alle bestandsbijlages"	""	""	"true"	"https://wegenenverkeer-test.data.vlaanderen.be/ns/implementatieelement#"	"DtcDocument"	"http://www.w3.org/2000/01/rdf-schema#Class"	""	""	""	""	""
"DATATYPE"	"OSLO-Implementatieelement"	"DteTekstblok"	"{D24614D8-8D4E-4112-B139-315B96C73DBB}"	""	""	""	""	"Tekstblok"	"Een tekst welke uit meerdere zinnen bestaat,en ook regeleindes kan bevatten. Een tekstblok bevat maximaal 65.000 karakters."	""	"Tekstblok"	"Een tekst welke uit meerdere zinnen bestaat,en ook regeleindes kan bevatten. Een tekstblok bevat maximaal 65.000 karakters."	""	""	"true"	"https://wegenenverkeer-test.data.vlaanderen.be/ns/implementatieelement#"	"DteTekstblok"	"http://www.w3.org/2000/01/rdf-schema#Class"	""	""	""	""	""
"ENUMERATION"	"OSLO-Implementatieelement"	"KlAlgGemeente"	"{3CF138FD-381B-4cf9-A15B-2A824AB07BCB}"	""	""	""	""	"Gemeente"	"Lijst van gemeentes in Vlaanderen."	""	"Gemeente"	"Lijst van gemeentes in Vlaanderen."	""	"https://wegenenverkeer-test.data.vlaanderen.be/id/conceptscheme/KlAlgGemeente"	"true"	"http://www.w3.org/2004/02/skos/core#"	"Concept"	"http://www.w3.org/2000/01/rdf-schema#Class"	""	""	""	""	""
"ENUMERATION"	"OSLO-Implementatieelement"	"KlAlgProvincie"	"{CF268148-8581-4c55-A2A3-3DFED5723CE0}"	""	""	""	""	"Provincie"	"Lijst van provincies in Vlaanderen"	""	"Provincie"	"Lijst van provincies in Vlaanderen"	""	"https://wegenenverkeer-test.data.vlaanderen.be/id/conceptscheme/KlAlgProvincie"	"true"	"http://www.w3.org/2004/02/skos/core#"	"Concept"	"http://www.w3.org/2000/01/rdf-schema#Class"	""	""	""	""	""
"ENUMERATION"	"OSLO-Implementatieelement"	"KlAlgWeekdagen"	"{3321D0AD-3976-4a71-9AB2-84A75EBF44A9}"	""	""	""	""	"Weekdagen"	"Lijst van de verschillende weekdagen"	""	"Weekdagen"	"Lijst van de verschillende weekdagen"	""	"https://wegenenverkeer-test.data.vlaanderen.be/id/conceptscheme/KlAlgWeekdagen"	"true"	"https://schema.org/"	"DayOfWeek"	"http://www.w3.org/2000/01/rdf-schema#Class"	""	""	""	""	""
"ENUMERATION"	"OSLO-Implementatieelement"	"KlAIMToestand"	"{B660858D-225E-4313-A2A1-664AFD652A5F}"	""	""	""	""	"AIM toestand"	"Keuzelijst met fasen uit de levenscyclus van een object om de toestand op een moment mee vast te leggen."	""	"AIM toestand"	"Keuzelijst met fasen uit de levenscyclus van een object om de toestand op een moment mee vast te leggen."	""	"https://wegenenverkeer-test.data.vlaanderen.be/id/conceptscheme/KlAIMToestand"	"true"	"http://www.w3.org/2004/02/skos/core#"	"Concept"	"http://www.w3.org/2000/01/rdf-schema#Class"	""	""	""	""	""
"ENUMERATION"	"OSLO-Implementatieelement"	"KlAlgMimeType"	"{496B7249-B6CF-40c8-A829-8A8BA73784A8}"	""	""	""	""	"Mimetype"	"De mime types van bestanden (AWVDocument) beperkt tot mime types voor toegelaten bestandstypen."	""	"Mimetype"	"De mime types van bestanden (AWVDocument) beperkt tot mime types voor toegelaten bestandstypen."	""	"https://wegenenverkeer-test.data.vlaanderen.be/id/conceptscheme/KlAlgMimeType"	"true"	"http://www.w3.org/2004/02/skos/core#"	"Concept"	"http://www.w3.org/2000/01/rdf-schema#Class"	""	""	""	""	""
"CLASS"	"OSLO-Onderdeel"	"Sturing"	"{14FF8B8D-1EC5-49d2-B71E-B989859DCB27}"	""	""	""	""	"Sturing"	"Deze relatie geeft aan of er een of andere vorm van dataverkeer is tussen 2 onderdelen. Een wegverlichtingstoestel dat aan staat wordt ook als sturing beschouwd, in dit geval is het een lang ononderbroken elektrisch aan-signaal. Deze relatie heeft geen richting."	""	"Sturing"	"Deze relatie geeft aan of er een of andere vorm van dataverkeer is tussen 2 onderdelen. Een wegverlichtingstoestel dat aan staat wordt ook als sturing beschouwd, in dit geval is het een lang ononderbroken elektrisch aan-signaal. Deze relatie heeft geen richting."	""	""	"true"	"https://wegenenverkeer-test.data.vlaanderen.be/ns/onderdeel#"	"Sturing"	"http://www.w3.org/2000/01/rdf-schema#Class"	""	""	"https://wegenenverkeer-test.data.vlaanderen.be/ns/implementatieelement#NietDirectioneleRelatie"	""	""
"CLASS"	"OSLO-Onderdeel"	"SluitAanOp"	"{7D8E701E-EAE3-4400-8FD4-4C19C9D59D61}"	""	""	""	""	"Sluit aan op"	"Deze relatie geeft aan hoe 2 onderdelen in horizontale zin elkaar opvolgen. Dit wordt gebruikt om een topologische netwerk op te bouwen. Enkel in gebruik bij afschermende constructies en riolering/waterlopen. Deze relatie heeft steeds een richting van het opwaartse naar het afwaartse onderdeel."	""	"Sluit aan op"	"Deze relatie geeft aan hoe 2 onderdelen in horizontale zin elkaar opvolgen. Dit wordt gebruikt om een topologische netwerk op te bouwen. Enkel in gebruik bij afschermende constructies en riolering/waterlopen. Deze relatie heeft steeds een richting van het opwaartse naar het afwaartse onderdeel."	""	""	"true"	"https://wegenenverkeer-test.data.vlaanderen.be/ns/onderdeel#"	"SluitAanOp"	"http://www.w3.org/2000/01/rdf-schema#Class"	""	""	"https://wegenenverkeer-test.data.vlaanderen.be/ns/implementatieelement#DirectioneleRelatie"	""	""
"CLASS"	"OSLO-Onderdeel"	"Bevestiging"	"{8882062D-87DF-4f16-B0C6-AD8CDB4FFEA9}"	""	""	""	""	"Bevestiging"	"Deze relatie geeft aan dat twee onderdelen direct fysiek op elkaar bevestigd zijn. Dit kan zowel aan de buitenkant als aan de binnenkant zijn zoals bv. een camera aan een paal of een laagspanningsbord in een kast. Deze relatie heeft geen richting."	""	"Bevestiging"	"Deze relatie geeft aan dat twee onderdelen direct fysiek op elkaar bevestigd zijn. Dit kan zowel aan de buitenkant als aan de binnenkant zijn zoals bv. een camera aan een paal of een laagspanningsbord in een kast. Deze relatie heeft geen richting."	""	""	"true"	"https://wegenenverkeer-test.data.vlaanderen.be/ns/onderdeel#"	"Bevestiging"	"http://www.w3.org/2000/01/rdf-schema#Class"	""	""	"https://wegenenverkeer-test.data.vlaanderen.be/ns/implementatieelement#NietDirectioneleRelatie"	""	""
"CLASS"	"OSLO-Onderdeel"	"Voedt"	"{DDDADDF9-EADB-4d84-A53D-BCF4F8806868}"	""	""	""	""	"Voedt"	"Deze relatie wordt enkel gelegd naar onderdelen die permanent onder spanning staan in normaal bedrijf. Aan deze relatie wordt steeds een richting toegekend van de voedinggever naar de ontvanger."	""	"Voedt"	"Deze relatie wordt enkel gelegd naar onderdelen die permanent onder spanning staan in normaal bedrijf. Aan deze relatie wordt steeds een richting toegekend van de voedinggever naar de ontvanger."	""	""	"true"	"https://wegenenverkeer-test.data.vlaanderen.be/ns/onderdeel#"	"Voedt"	"http://www.w3.org/2000/01/rdf-schema#Class"	""	""	"https://wegenenverkeer-test.data.vlaanderen.be/ns/implementatieelement#DirectioneleRelatie"	""	""
"CLASS"	"OSLO-Onderdeel"	"LigtOp"	"{68C966A6-BDB9-4357-B1A2-36BB4D8D03DC}"	""	""	""	""	"Ligt op"	"Deze relatie geeft aan dat 2 onderdelen direct fysiek op elkaar liggen. Deze relatie heeft een richting en gaat van het bovenste naar het onderste onderdeel."	""	"Ligt op"	"Deze relatie geeft aan dat 2 onderdelen direct fysiek op elkaar liggen. Deze relatie heeft een richting en gaat van het bovenste naar het onderste onderdeel."	""	""	"true"	"https://wegenenverkeer-test.data.vlaanderen.be/ns/onderdeel#"	"LigtOp"	"http://www.w3.org/2000/01/rdf-schema#Class"	""	""	"https://wegenenverkeer-test.data.vlaanderen.be/ns/implementatieelement#DirectioneleRelatie"	""	""
"attribute"	"OSLO-Onderdeel"	"rol"	"{05702E5D-3914-40aa-AC81-6E21773319FA}"	""	"HeeftBetrokkene"	"{6A4335C4-5121-4823-8F10-13FAFF765FFC}"	"KlBetrokkenheidRol"	"rol"	"Type voor de manier waarop een agent betrokken is bij een object."	""	"rol"	"Type voor de manier waarop een agent betrokken is bij een object."	""	""	"true"	"https://wegenenverkeer-test.data.vlaanderen.be/ns/onderdeel#"	"HeeftBetrokkene.rol"	"http://www.w3.org/2002/07/owl#ObjectProperty"	"https://wegenenverkeer-test.data.vlaanderen.be/ns/onderdeel#HeeftBetrokkene"	"http://www.w3.org/2004/02/skos/core#Concept"	""	"1"	"1"
"attribute"	"OSLO-Onderdeel"	"specifiekeContactinfo"	"{3C57570D-93A9-4783-B088-99BD5DAC9DFB}"	""	"HeeftBetrokkene"	"{6A4335C4-5121-4823-8F10-13FAFF765FFC}"	"DtcContactinfo"	"specifieke contactinfo"	"Specifieke contactgegevens van de betrokken agent met betrekking tot het gekoppelde object."	""	"specifieke contactinfo"	"Specifieke contactgegevens van de betrokken agent met betrekking tot het gekoppelde object."	""	""	"true"	"https://wegenenverkeer-test.data.vlaanderen.be/ns/onderdeel#"	"HeeftBetrokkene.specifiekeContactinfo"	"http://www.w3.org/2002/07/owl#ObjectProperty"	"https://wegenenverkeer-test.data.vlaanderen.be/ns/onderdeel#HeeftBetrokkene"	"https://schema.org/ContactPoint"	""	"0"	"*"
"attribute"	"OSLO-Implementatieelement"	"toestand"	"{19481D58-95AE-41f1-8BE8-F67BA589517E}"	""	"AIMToestand"	"{9418C0E6-C48A-44df-ABF7-C6E3B7FF5FC4}"	"KlAIMToestand"	"toestand"	"Vat de levenscyclus van het object op een bepaald moment."	"TODO"	"toestand"	"Vat de levenscyclus van het object op een bepaald moment."	""	""	"true"	"https://wegenenverkeer-test.data.vlaanderen.be/ns/implementatieelement#"	"AIMToestand.toestand"	"http://www.w3.org/2002/07/owl#ObjectProperty"	"https://wegenenverkeer-test.data.vlaanderen.be/ns/implementatieelement#AIMToestand"	"http://www.w3.org/2004/02/skos/core#Concept"	""	"1"	"1"
"attribute"	"OSLO-Implementatieelement"	"isActief"	"{3C54C181-0D46-4196-9123-F908FE26FFE1}"	""	"AIMStatus"	"{75C21F07-BAE5-412e-AD87-520DD947D510}"	"Boolean"	"status"	"Geeft aan of het object actief kan gebruikt worden of (zacht) verwijderd is uit het asset beheer systeem."	"De status die hier bedoeld wordt valt samen met de status van het record voor de asset in het asset mangement systeem. De staat waarin de asset zich bevindt, de fase in een levenscyclus en de operationele status zijn andere types die in aparte attributen bijgehouden worden."	"status"	"Geeft aan of het object actief kan gebruikt worden of (zacht) verwijderd is uit het asset beheer systeem."	""	""	"true"	"https://wegenenverkeer-test.data.vlaanderen.be/ns/implementatieelement#"	"AIMStatus.isActief"	"http://www.w3.org/2002/07/owl#DatatypeProperty"	"https://wegenenverkeer-test.data.vlaanderen.be/ns/implementatieelement#AIMStatus"	"http://www.w3.org/2001/XMLSchema#boolean"	""	"1"	"1"
"attribute"	"OSLO-Implementatieelement"	"agentId"	"{E96FEC5C-1823-40e2-95E5-322A7BF8A703}"	""	"Agent"	"{C6B335E1-35B1-4429-A842-CA67095E3AF5}"	"DtcIdentificator"	"agent identificatie"	"Identificatie van de agent volgens een bepaalde bron."	""	"agent identificatie"	"Identificatie van de agent volgens een bepaalde bron."	""	""	"true"	"http://purl.org/dc/terms/"	"Agent.agentId"	"http://www.w3.org/2002/07/owl#ObjectProperty"	"http://purl.org/dc/terms/Agent"	"https://wegenenverkeer-test.data.vlaanderen.be/ns/implementatieelement#DtcIdentificator"	""	"1"	"1"
"attribute"	"OSLO-Implementatieelement"	"contactinfo"	"{3ACBF167-45F8-4e0b-BB0B-2C9D68EAE7A0}"	""	"Agent"	"{C6B335E1-35B1-4429-A842-CA67095E3AF5}"	"DtcContactinfo"	"Contactinfo"	"Algemene contactgegevens voor de agent."	""	"Contactinfo"	"Algemene contactgegevens voor de agent."	""	""	"true"	"http://purl.org/dc/terms/"	"Agent.contactinfo"	"http://www.w3.org/2002/07/owl#ObjectProperty"	"http://purl.org/dc/terms/Agent"	"https://schema.org/ContactPoint"	""	"1"	"*"
"attribute"	"OSLO-Implementatieelement"	"naam"	"{FC3596D1-0C0A-4908-8AFE-AD133B10A035}"	""	"Agent"	"{C6B335E1-35B1-4429-A842-CA67095E3AF5}"	"String"	"naam"	"De naam waarmee de agent doorgaans benoemd wordt."	""	"naam"	"De naam waarmee de agent doorgaans benoemd wordt."	""	""	"true"	"http://purl.org/dc/terms/"	"Agent.naam"	"http://www.w3.org/2002/07/owl#DatatypeProperty"	"http://purl.org/dc/terms/Agent"	"http://www.w3.org/2001/XMLSchema#string"	""	"1"	"1"
"attribute"	"OSLO-Implementatieelement"	"naampad"	"{B482460F-6F4E-4101-9897-D60AA76350C1}"	""	"NaampadObject"	"{79135DEF-C20F-4371-A26D-1657F2A30BF6}"	"String"	"naampad"	"Een set van objecten (bv. collecties) die aanduiden waar het object zich bevindt in de objectenboom (EM-Infra)."	""	"naampad"	"Een set van objecten (bv. collecties) die aanduiden waar het object zich bevindt in de objectenboom (EM-Infra)."	""	""	"true"	"https://wegenenverkeer-test.data.vlaanderen.be/ns/implementatieelement#"	"NaampadObject.naampad"	"http://www.w3.org/2002/07/owl#DatatypeProperty"	"https://wegenenverkeer-test.data.vlaanderen.be/ns/implementatieelement#NaampadObject"	"http://www.w3.org/2001/XMLSchema#string"	""	"1"	"1"
"attribute"	"OSLO-Implementatieelement"	"assetId"	"{EC2CAFA7-4A11-4516-AC63-78F1063C931A}"	""	"Derdenobject"	"{93363643-7387-49bf-B147-2D6301A30B0A}"	"DtcIdentificator"	"asset-id"	"Unieke identificatie van de asset zoals toegekend door de assetbeheerder of n.a.v. eerste aanlevering door de leverancier."	""	"asset-id"	"Unieke identificatie van de asset zoals toegekend door de assetbeheerder of n.a.v. eerste aanlevering door de leverancier."	""	""	"true"	"https://wegenenverkeer-test.data.vlaanderen.be/ns/implementatieelement#"	"Derdenobject.assetId"	"http://www.w3.org/2002/07/owl#ObjectProperty"	"https://wegenenverkeer-test.data.vlaanderen.be/ns/implementatieelement#Derdenobject"	"https://wegenenverkeer-test.data.vlaanderen.be/ns/implementatieelement#DtcIdentificator"	""	"1"	"1"
"attribute"	"OSLO-Implementatieelement"	"contactgegevens"	"{285B5386-98B1-49eb-A35E-520083227F24}"	""	"Derdenobject"	"{93363643-7387-49bf-B147-2D6301A30B0A}"	"String"	"contactgegevens"	"Naam, voornaam, telefoonnummer en/of e-mailadres van de contactpersoon."	""	"contactgegevens"	"Naam, voornaam, telefoonnummer en/of e-mailadres van de contactpersoon."	""	""	"true"	"https://wegenenverkeer-test.data.vlaanderen.be/ns/implementatieelement#"	"Derdenobject.contactgegevens"	"http://www.w3.org/2002/07/owl#DatatypeProperty"	"https://wegenenverkeer-test.data.vlaanderen.be/ns/implementatieelement#Derdenobject"	"http://www.w3.org/2001/XMLSchema#string"	""	"1"	"1"
"attribute"	"OSLO-Implementatieelement"	"foto"	"{BD4C9ABB-2AE7-45d1-8077-FF8BBA04F47E}"	""	"Derdenobject"	"{93363643-7387-49bf-B147-2D6301A30B0A}"	"DtcDocument"	"foto"	"Een foto van het derdenobject die eventuele detailinformatie weergeeft"	"Enkel bestanden die een foto zijn."	"foto"	"Een foto van het derdenobject die eventuele detailinformatie weergeeft"	""	""	"true"	"https://wegenenverkeer-test.data.vlaanderen.be/ns/implementatieelement#"	"Derdenobject.foto"	"http://www.w3.org/2002/07/owl#ObjectProperty"	"https://wegenenverkeer-test.data.vlaanderen.be/ns/implementatieelement#Derdenobject"	"https://wegenenverkeer-test.data.vlaanderen.be/ns/implementatieelement#DtcDocument"	""	"1"	"*"
