"EA-Type"	"EA-Package"	"EA-Name"	"EA-GUID"	"EA-Parent"	"EA-Domain"	"EA-Domain-GUID"	"EA-Range"	"label"	"definition"	"usage"	"ap-label-nl"	"ap-definition-nl"	"ap-usageNote-nl"	"ap-codelist"	"external term"	"namespace"	"localname"	"type"	"domain"	"range"	"parent"	"min card"	"max card"
"Package"	""	"OSLO-Complexe-datatypes"	"{1CBFF0EB-60DA-4860-85ED-081283B97616}"	""	""	""	""	""	""	""	""	""	""	""	""	"http://"	"fixme.com"	"http://www.w3.org/2002/07/owl#Ontology"	""	""	""	""	""
"DATATYPE"	"OSLO-Implementatieelement"	"KwantWrdInMeter"	"{5A5DD566-BCF9-4770-8AF4-2BAD1E33CAC9}"	""	""	""	""	"Kwantitatieve waarde in meter"	"Een kwantitatieve waarde die een getal in meter uitdrukt."	""	"Kwantitatieve waarde in meter"	"Een kwantitatieve waarde die een getal in meter uitdrukt."	""	""	"true"	"https://wegenenverkeer-test.data.vlaanderen.be/ns/implementatieelement#"	"KwantWrdInMeter"	"http://www.w3.org/2000/01/rdf-schema#Class"	""	""	""	""	""
"DATATYPE"	"W3-RDF-Schema"	"Literal"	"{E901A017-A1F0-4073-9405-C71F670C7CBA}"	""	""	""	""	"Literal"	"Beschrijft een constante."	"http://www.w3.org/2000/01/rdf-schema#Literal"	"Literal"	"Beschrijft een constante."	""	""	"true"	"http://www.w3.org/2000/01/rdf-schema#"	"Literal"	"http://www.w3.org/2000/01/rdf-schema#Class"	""	""	""	""	""
"DATATYPE"	"W3-XML-Schema"	"Decimal"	"{B5FC49E6-0E60-4fdf-950A-209E703D5C63}"	""	""	""	""	"Decimaal getal"	"Beschrijft een decimaal getal volgens http://www.w3.org/2001/XMLSchema#decimal"	"https://www.w3.org/TR/xmlschema-2/#decimal"	"Decimaal getal"	"Beschrijft een decimaal getal volgens http://www.w3.org/2001/XMLSchema#decimal"	""	""	"true"	"http://www.w3.org/2001/XMLSchema#"	"decimal"	"http://www.w3.org/2000/01/rdf-schema#Class"	""	""	""	""	""
"DATATYPE"	"W3-XML-Schema"	"String"	"{81376A9B-DB07-4798-87F6-B226CAC2C5C8}"	""	""	""	""	"String"	"Beschrijft een tekstregel volgens http://www.w3.org/2001/XMLSchema#string"	"https://www.w3.org/TR/xmlschema-2/#string"	"String"	"Beschrijft een tekstregel volgens http://www.w3.org/2001/XMLSchema#string"	""	""	"true"	"http://www.w3.org/2001/XMLSchema#"	"string"	"http://www.w3.org/2000/01/rdf-schema#Class"	""	""	""	""	""
"DATATYPE"	"W3-XML-Schema"	"Boolean"	"{9E1833BF-210A-4b48-8326-8A00413463CD}"	""	""	""	""	"Boolean"	"Beschrijft een boolean volgens http://www.w3.org/2001/XMLSchema#boolean"	"https://www.w3.org/TR/xmlschema-2/#boolean"	"Boolean"	"Beschrijft een boolean volgens http://www.w3.org/2001/XMLSchema#boolean"	""	""	"true"	"http://www.w3.org/2001/XMLSchema#"	"boolean"	"http://www.w3.org/2000/01/rdf-schema#Class"	""	""	""	""	""
"DATATYPE"	"OSLO-Implementatieelement"	"DtcDocument"	"{57E2B78E-3BA6-4465-85AB-B3C47F14D47F}"	""	""	""	""	"Bestandsbijlage"	"Complex datatype voor alle bestandsbijlages"	""	"Bestandsbijlage"	"Complex datatype voor alle bestandsbijlages"	""	""	"true"	"https://wegenenverkeer-test.data.vlaanderen.be/ns/implementatieelement#"	"DtcDocument"	"http://www.w3.org/2000/01/rdf-schema#Class"	""	""	""	""	""
"DATATYPE"	"OSLO-Implementatieelement"	"DteTekstblok"	"{D24614D8-8D4E-4112-B139-315B96C73DBB}"	""	""	""	""	"Tekstblok"	"Een tekst welke uit meerdere zinnen bestaat,en ook regeleindes kan bevatten. Een tekstblok bevat maximaal 65.000 karakters."	""	"Tekstblok"	"Een tekst welke uit meerdere zinnen bestaat,en ook regeleindes kan bevatten. Een tekstblok bevat maximaal 65.000 karakters."	""	""	"true"	"https://wegenenverkeer-test.data.vlaanderen.be/ns/implementatieelement#"	"DteTekstblok"	"http://www.w3.org/2000/01/rdf-schema#Class"	""	""	""	""	""
"DATATYPE"	"W3-XML-Schema"	"AnyURI"	"{81711512-9AAA-4861-841D-A6A67FB29FD1}"	""	""	""	""	"URI"	"Een tekstwaarde die een verwijzing naar meer informatie van het element bevat volgens http://www.w3.org/2001/XMLSchema#anyURI ."	"https://www.w3.org/TR/xmlschema-2/#anyURI"	"URI"	"Een tekstwaarde die een verwijzing naar meer informatie van het element bevat volgens http://www.w3.org/2001/XMLSchema#anyURI ."	""	""	"true"	"http://www.w3.org/2001/XMLSchema#"	"anyURI"	"http://www.w3.org/2000/01/rdf-schema#Class"	""	""	""	""	""
"DATATYPE"	"OSLO-Implementatieelement"	"KwantWrdInMillimeter"	"{9150A7F6-E98A-4c9f-8C02-580A898B2243}"	""	""	""	""	"Kwantitatieve waarde in millimeter"	"Een kwantitatieve waarde die een getal in millimeter uitdrukt."	""	"Kwantitatieve waarde in millimeter"	"Een kwantitatieve waarde die een getal in millimeter uitdrukt."	""	""	"true"	"https://wegenenverkeer-test.data.vlaanderen.be/ns/implementatieelement#"	"KwantWrdInMillimeter"	"http://www.w3.org/2000/01/rdf-schema#Class"	""	""	""	""	""
"DATATYPE"	"OSLO-Implementatieelement"	"KwantWrdInCentimeter"	"{361F1AD7-40E3-4f04-9E63-FB28D256ADB4}"	""	""	""	""	"Kwantitatieve waarde in centimeter"	"Een kwantitatieve waarde die een getal in centimeter uitdrukt."	""	"Kwantitatieve waarde in centimeter"	"Een kwantitatieve waarde die een getal in centimeter uitdrukt."	""	""	"true"	"https://wegenenverkeer-test.data.vlaanderen.be/ns/implementatieelement#"	"KwantWrdInCentimeter"	"http://www.w3.org/2000/01/rdf-schema#Class"	""	""	""	""	""
"DATATYPE"	"OSLO-Implementatieelement"	"DtcAdres"	"{281D2EBE-A38A-44a2-987B-2C818171A6FF}"	""	""	""	""	"Adres"	"De aanduiding van een bepaalde locatie,doorgaans van een huis,woning,gebouw of faciliteit,op de aarde."	""	"Adres"	"De aanduiding van een bepaalde locatie,doorgaans van een huis,woning,gebouw of faciliteit,op de aarde."	""	""	"true"	"https://wegenenverkeer-test.data.vlaanderen.be/ns/implementatieelement#"	"DtcAdres"	"http://www.w3.org/2000/01/rdf-schema#Class"	""	""	""	""	""
"DATATYPE"	"W3-XML-Schema"	"NonNegativeInteger"	"{980E8EE1-D9EE-417d-AF7A-8217CD9CCC74}"	""	""	""	""	"Natuurlijk getal"	"Beschrijft een natuurlijk getal volgens http://www.w3.org/2001/XMLSchema#nonNegativeInteger"	"https://www.w3.org/TR/xmlschema-2/#nonNegativeInteger"	"Natuurlijk getal"	"Beschrijft een natuurlijk getal volgens http://www.w3.org/2001/XMLSchema#nonNegativeInteger"	""	""	"true"	"http://www.w3.org/2001/XMLSchema#"	"nonNegativeInteger"	"http://www.w3.org/2000/01/rdf-schema#Class"	""	""	""	""	""
"DATATYPE"	"OSLO-Implementatieelement"	"DtcAfmetingZijde"	"{4A219A7B-E9A8-4b83-A800-290D7A0F3196}"	""	""	""	""	"Afmeting zijde"	"De afmeting van een zijde in millimeter."	""	"Afmeting zijde"	"De afmeting van een zijde in millimeter."	""	""	"true"	"https://wegenenverkeer-test.data.vlaanderen.be/ns/implementatieelement#"	"DtcAfmetingZijde"	"http://www.w3.org/2000/01/rdf-schema#Class"	""	""	""	""	""
"DATATYPE"	"OSLO-Implementatieelement"	"DtcAfmetingDiameter"	"{9B871C58-E368-41a7-8D2B-8E52E427199D}"	""	""	""	""	"Afmeting diameter"	"De afmeting van een diameter in millimeter."	""	"Afmeting diameter"	"De afmeting van een diameter in millimeter."	""	""	"true"	"https://wegenenverkeer-test.data.vlaanderen.be/ns/implementatieelement#"	"DtcAfmetingDiameter"	"http://www.w3.org/2000/01/rdf-schema#Class"	""	""	""	""	""
"DATATYPE"	"OSLO-Implementatieelement"	"DtcAfmetingBxhInMm"	"{08908984-D8D9-46ed-B471-52F0D2DF8217}"	""	""	""	""	"Afmeting bxh in millimeter"	"De afmeting van de breedte en hoogte in millimeter."	""	"Afmeting bxh in millimeter"	"De afmeting van de breedte en hoogte in millimeter."	""	""	"true"	"https://wegenenverkeer-test.data.vlaanderen.be/ns/implementatieelement#"	"DtcAfmetingBxhInMm"	"http://www.w3.org/2000/01/rdf-schema#Class"	""	""	""	""	""
"DATATYPE"	"W3-XML-Schema"	"Integer"	"{A7F2B297-CC86-4b9f-8931-8977182E38B9}"	""	""	""	""	"Geheel getal"	"Beschrijft een geheel getal volgens http://www.w3.org/2001/XMLSchema#integer"	"https://www.w3.org/TR/xmlschema-2/#integer"	"Geheel getal"	"Beschrijft een geheel getal volgens http://www.w3.org/2001/XMLSchema#integer"	""	""	"true"	"http://www.w3.org/2001/XMLSchema#"	"integer"	"http://www.w3.org/2000/01/rdf-schema#Class"	""	""	""	""	""
"DATATYPE"	"OSLO-Implementatieelement"	"KwantWrdInUur"	"{D19438E9-37AB-4f42-96D8-BCB620840D37}"	""	""	""	""	"Kwantitatieve waarde in uur"	"Een kwantitatieve waarde die een getal in uur uitdrukt."	""	"Kwantitatieve waarde in uur"	"Een kwantitatieve waarde die een getal in uur uitdrukt."	""	""	"true"	"https://wegenenverkeer-test.data.vlaanderen.be/ns/implementatieelement#"	"KwantWrdInUur"	"http://www.w3.org/2000/01/rdf-schema#Class"	""	""	""	""	""
"DATATYPE"	"OSLO-Implementatieelement"	"KwantWrdInSeconde"	"{B525DFDF-AF1D-461f-B786-A9C4354B1A2F}"	""	""	""	""	"Kwantitatieve waarde in seconde"	"Een kwantitatieve waarde die een getal in seconde uitdrukt."	""	"Kwantitatieve waarde in seconde"	"Een kwantitatieve waarde die een getal in seconde uitdrukt."	""	""	"true"	"https://wegenenverkeer-test.data.vlaanderen.be/ns/implementatieelement#"	"KwantWrdInSeconde"	"http://www.w3.org/2000/01/rdf-schema#Class"	""	""	""	""	""
"DATATYPE"	"OSLO-Implementatieelement"	"KwantWrdInMinuut"	"{92017F70-A5ED-4e69-B788-9134F816CD9F}"	""	""	""	""	"Kwantitatieve waarde in minuten"	"Een kwantitatieve waarde die een getal in minuten uitdrukt."	""	"Kwantitatieve waarde in minuten"	"Een kwantitatieve waarde die een getal in minuten uitdrukt."	""	""	"true"	"https://wegenenverkeer-test.data.vlaanderen.be/ns/implementatieelement#"	"KwantWrdInMinuut"	"http://www.w3.org/2000/01/rdf-schema#Class"	""	""	""	""	""
"DATATYPE"	"OSLO-Implementatieelement"	"DtcOpeningsurenSpecificatie"	"{7821D0E8-16E8-4b32-B24C-4356C72AD7EB}"	""	""	""	""	"Openingsurenspecificatie"	"Specifieert openingsuren volgens https://schema.org/OpeningHoursSpecification"	""	"Openingsurenspecificatie"	"Specifieert openingsuren volgens https://schema.org/OpeningHoursSpecification"	""	""	"true"	"https://schema.org/"	"OpeningHoursSpecification"	"http://www.w3.org/2000/01/rdf-schema#Class"	""	""	""	""	""
"DATATYPE"	"W3-XML-Schema"	"Time"	"{C093CB2B-1740-4725-83FE-EE29A430402E}"	""	""	""	""	"Tijd"	"Beschrijft een tijd volgens http://www.w3.org/2001/XMLSchema#time"	"https://www.w3.org/TR/xmlschema-2/#time"	"Tijd"	"Beschrijft een tijd volgens http://www.w3.org/2001/XMLSchema#time"	""	""	"true"	"http://www.w3.org/2001/XMLSchema#"	"time"	"http://www.w3.org/2000/01/rdf-schema#Class"	""	""	""	""	""
"DATATYPE"	"OSLO-Onderdeel"	"DtcGrondbijmenging"	"{A54EBD0D-7439-48c9-B1F9-B0DAB28DF94B}"	""	""	""	""	"Grondbijmenging"	"Complex datatype om extra informatie van de bijmenging van grond te capteren."	""	"Grondbijmenging"	"Complex datatype om extra informatie van de bijmenging van grond te capteren."	""	""	"true"	"https://wegenenverkeer-test.data.vlaanderen.be/ns/onderdeel#"	"DtcGrondbijmenging"	"http://www.w3.org/2000/01/rdf-schema#Class"	""	""	""	""	""
"DATATYPE"	"OSLO-Onderdeel"	"DtcGrondafdekking"	"{11151B46-6B31-4526-9AD7-5E90AE3643A9}"	""	""	""	""	"Grondafdekking"	"Complex datatype om extra informatie van de afdekking van grond te capteren."	""	"Grondafdekking"	"Complex datatype om extra informatie van de afdekking van grond te capteren."	""	""	"true"	"https://wegenenverkeer-test.data.vlaanderen.be/ns/onderdeel#"	"DtcGrondafdekking"	"http://www.w3.org/2000/01/rdf-schema#Class"	""	""	""	""	""
"DATATYPE"	"OSLO-Onderdeel"	"DtcGrondAfgravinguitgraving"	"{DB1FD0A8-8D13-4bdc-B2FC-0C641AE9B2D4}"	""	""	""	""	"Grondafgraving en gronduitgraving"	"Complex datatype voor de afgraving of uitgraving van grond."	""	"Grondafgraving en gronduitgraving"	"Complex datatype voor de afgraving of uitgraving van grond."	""	""	"true"	"https://wegenenverkeer-test.data.vlaanderen.be/ns/onderdeel#"	"DtcGrondAfgravinguitgraving"	"http://www.w3.org/2000/01/rdf-schema#Class"	""	""	""	""	""
"DATATYPE"	"OSLO-Onderdeel"	"DtcGrondophoging"	"{5568941D-9EF3-4ac6-8CAA-195423B51092}"	""	""	""	""	"Grondophoging"	"Complex datatype om extra informatie van ophoging van grond te capteren."	""	"Grondophoging"	"Complex datatype om extra informatie van ophoging van grond te capteren."	""	""	"true"	"https://wegenenverkeer-test.data.vlaanderen.be/ns/onderdeel#"	"DtcGrondophoging"	"http://www.w3.org/2000/01/rdf-schema#Class"	""	""	""	""	""
"DATATYPE"	"OSLO-Implementatieelement"	"KwantWrdInTon"	"{7B13D6FA-2433-46db-A117-9509F96DE137}"	""	""	""	""	"Kwantitatieve waarde in ton"	"Een kwantitatieve waarde die een getal in ton uitdrukt."	""	"Kwantitatieve waarde in ton"	"Een kwantitatieve waarde die een getal in ton uitdrukt."	""	""	"true"	"https://wegenenverkeer-test.data.vlaanderen.be/ns/implementatieelement#"	"KwantWrdInTon"	"http://www.w3.org/2000/01/rdf-schema#Class"	""	""	""	""	""
"DATATYPE"	"OSLO-Onderdeel"	"DtcProfileerlaag"	"{EDFE1364-84A6-4f9a-BFEB-F26FA8DF8D83}"	""	""	""	""	"Profileerlaag"	"Complex datatype om extra informatie te capteren van de profilerende laag."	""	"Profileerlaag"	"Complex datatype om extra informatie te capteren van de profilerende laag."	""	""	"true"	"https://wegenenverkeer-test.data.vlaanderen.be/ns/onderdeel#"	"DtcProfileerlaag"	"http://www.w3.org/2000/01/rdf-schema#Class"	""	""	""	""	""
"DATATYPE"	"OSLO-Implementatieelement"	"DtcAfmetingBxlxhInCm"	"{A2C40A89-0FE2-4e94-84D6-AFC80F7E1D6E}"	""	""	""	""	"Afmeting bxlxh in centimeter"	"De afmeting van de breedte,de lengte en hoogte in centimeter"	""	"Afmeting bxlxh in centimeter"	"De afmeting van de breedte,de lengte en hoogte in centimeter"	""	""	"true"	"https://wegenenverkeer-test.data.vlaanderen.be/ns/implementatieelement#"	"DtcAfmetingBxlxhInCm"	"http://www.w3.org/2000/01/rdf-schema#Class"	""	""	""	""	""
"ENUMERATION"	"OSLO-Implementatieelement"	"KlAlgMimeType"	"{496B7249-B6CF-40c8-A829-8A8BA73784A8}"	""	""	""	""	"Mimetype"	"De mime types van bestanden (AWVDocument) beperkt tot mime types voor toegelaten bestandstypen."	""	"Mimetype"	"De mime types van bestanden (AWVDocument) beperkt tot mime types voor toegelaten bestandstypen."	""	"https://wegenenverkeer-test.data.vlaanderen.be/id/conceptscheme/KlAlgMimeType"	"true"	"http://www.w3.org/2004/02/skos/core#"	"Concept"	"http://www.w3.org/2000/01/rdf-schema#Class"	""	""	""	""	""
"ENUMERATION"	"OSLO-Implementatieelement"	"KlAlgGemeente"	"{3CF138FD-381B-4cf9-A15B-2A824AB07BCB}"	""	""	""	""	"Gemeente"	"Lijst van gemeentes in Vlaanderen."	""	"Gemeente"	"Lijst van gemeentes in Vlaanderen."	""	"https://wegenenverkeer-test.data.vlaanderen.be/id/conceptscheme/KlAlgGemeente"	"true"	"http://www.w3.org/2004/02/skos/core#"	"Concept"	"http://www.w3.org/2000/01/rdf-schema#Class"	""	""	""	""	""
"ENUMERATION"	"OSLO-Implementatieelement"	"KlAlgProvincie"	"{CF268148-8581-4c55-A2A3-3DFED5723CE0}"	""	""	""	""	"Provincie"	"Lijst van provincies in Vlaanderen"	""	"Provincie"	"Lijst van provincies in Vlaanderen"	""	"https://wegenenverkeer-test.data.vlaanderen.be/id/conceptscheme/KlAlgProvincie"	"true"	"http://www.w3.org/2004/02/skos/core#"	"Concept"	"http://www.w3.org/2000/01/rdf-schema#Class"	""	""	""	""	""
"ENUMERATION"	"OSLO-Onderdeel"	"KlSignalisatieMarkeringOpvatting"	"{15F1D8A9-D23C-4fd4-9131-FBEC1A7A5FCF}"	""	""	""	""	"Signalisatie markering opvatting"	"De markeringsopvattingen van de markering."	""	"Signalisatie markering opvatting"	"De markeringsopvattingen van de markering."	""	"https://wegenenverkeer-test.data.vlaanderen.be/id/conceptscheme/KlSignalisatieMarkeringOpvatting"	"true"	"http://www.w3.org/2004/02/skos/core#"	"Concept"	"http://www.w3.org/2000/01/rdf-schema#Class"	""	""	""	""	""
"ENUMERATION"	"OSLO-Onderdeel"	"KlMarkeringWaarborgperiode"	"{70CAEFE4-A10B-4490-B29D-32160E7313AA}"	""	""	""	""	"markeringswaarborgperiode"	"Opties om de waarborgperiode aan te duiden."	""	"markeringswaarborgperiode"	"Opties om de waarborgperiode aan te duiden."	""	"https://wegenenverkeer-test.data.vlaanderen.be/id/conceptscheme/KlMarkeringWaarborgperiode"	"true"	"http://www.w3.org/2004/02/skos/core#"	"Concept"	"http://www.w3.org/2000/01/rdf-schema#Class"	""	""	""	""	""
"ENUMERATION"	"OSLO-Onderdeel"	"KlPlantmaatHoogte"	"{154B7FFA-D7B5-4421-B06C-A19B637AC943}"	""	""	""	""	"Plantmaat houtige vegetatie"	"Keuzelijst die de hoogte in meter gemeten van de stamvoet tot de top met een minimum en maximum waarde oplijst."	""	"Plantmaat houtige vegetatie"	"Keuzelijst die de hoogte in meter gemeten van de stamvoet tot de top met een minimum en maximum waarde oplijst."	""	"https://wegenenverkeer-test.data.vlaanderen.be/id/conceptscheme/KlPlantmaatHoogte"	"true"	"http://www.w3.org/2004/02/skos/core#"	"Concept"	"http://www.w3.org/2000/01/rdf-schema#Class"	""	""	""	""	""
"ENUMERATION"	"OSLO-Onderdeel"	"KlPlantmaatOmtrek"	"{84E6AB0E-1D32-4015-9777-8315F8C5C2FD}"	""	""	""	""	"Plantmaat omtrek"	"De stamomtrek in centimeter  (gemeten op 1 m boven het maaiveld) met een minimum en maximum waarde."	""	"Plantmaat omtrek"	"De stamomtrek in centimeter  (gemeten op 1 m boven het maaiveld) met een minimum en maximum waarde."	""	"https://wegenenverkeer-test.data.vlaanderen.be/id/conceptscheme/KlPlantmaatOmtrek"	"true"	"http://www.w3.org/2004/02/skos/core#"	"Concept"	"http://www.w3.org/2000/01/rdf-schema#Class"	""	""	""	""	""
"ENUMERATION"	"OSLO-Onderdeel"	"KlVegetatiePlantverband"	"{6A768E17-9A2E-49ca-A123-846155FA277E}"	""	""	""	""	"Vegetatie plantverband"	"De verschillende opties voor het plantverband."	""	"Vegetatie plantverband"	"De verschillende opties voor het plantverband."	""	"https://wegenenverkeer-test.data.vlaanderen.be/id/conceptscheme/KlVegetatiePlantverband"	"true"	"http://www.w3.org/2004/02/skos/core#"	"Concept"	"http://www.w3.org/2000/01/rdf-schema#Class"	""	""	""	""	""
"ENUMERATION"	"OSLO-Onderdeel"	"KlVormAanleveringHoutigeVegetatie"	"{18E60B32-ED40-4b63-90C0-3F25D53DBDA3}"	""	""	""	""	"Vorm aanlevering houtige vegetatie"	"De wijze waarop het plantgoed wordt aangeleverd."	""	"Vorm aanlevering houtige vegetatie"	"De wijze waarop het plantgoed wordt aangeleverd."	""	"https://wegenenverkeer-test.data.vlaanderen.be/id/conceptscheme/KlVormAanleveringHoutigeVegetatie"	"true"	"http://www.w3.org/2004/02/skos/core#"	"Concept"	"http://www.w3.org/2000/01/rdf-schema#Class"	""	""	""	""	""
"ENUMERATION"	"OSLO-Onderdeel"	"KlVegetatieWortel"	"{820C3F54-B13A-44a5-9D05-BA3424EED5F7}"	""	""	""	""	"Vegetatie wortel"	"De verschillende opties van hoe de wortel was bij aanplanting."	""	"Vegetatie wortel"	"De verschillende opties van hoe de wortel was bij aanplanting."	""	"https://wegenenverkeer-test.data.vlaanderen.be/id/conceptscheme/KlVegetatieWortel"	"true"	"http://www.w3.org/2004/02/skos/core#"	"Concept"	"http://www.w3.org/2000/01/rdf-schema#Class"	""	""	""	""	""
"ENUMERATION"	"OSLO-Onderdeel"	"KlMateriaalBeschermingVraatschade"	"{EFD4E461-02FD-49be-8C45-48B20743CD0E}"	""	""	""	""	"Materiaal bescherming vraatschade"	"De middelen als bescherming tegen vraatschade."	""	"Materiaal bescherming vraatschade"	"De middelen als bescherming tegen vraatschade."	""	"https://wegenenverkeer-test.data.vlaanderen.be/id/conceptscheme/KlMateriaalBeschermingVraatschade"	"true"	"http://www.w3.org/2004/02/skos/core#"	"Concept"	"http://www.w3.org/2000/01/rdf-schema#Class"	""	""	""	""	""
"ENUMERATION"	"OSLO-Implementatieelement"	"KlAlgWeekdagen"	"{3321D0AD-3976-4a71-9AB2-84A75EBF44A9}"	""	""	""	""	"Weekdagen"	"Lijst van de verschillende weekdagen"	""	"Weekdagen"	"Lijst van de verschillende weekdagen"	""	"https://wegenenverkeer-test.data.vlaanderen.be/id/conceptscheme/KlAlgWeekdagen"	"true"	"https://schema.org/"	"DayOfWeek"	"http://www.w3.org/2000/01/rdf-schema#Class"	""	""	""	""	""
"ENUMERATION"	"OSLO-Levenscyclus"	"KlMaaiFrequentie"	"{BF47C93B-D9F7-46ec-A065-AF7A68FF98A1}"	""	""	""	""	"Maaifrequentie"	"Het aantal keer dat er gemaaid wordt per jaar."	""	"Maaifrequentie"	"Het aantal keer dat er gemaaid wordt per jaar."	""	"https://wegenenverkeer-test.data.vlaanderen.be/id/conceptscheme/KlMaaiFrequentie"	"true"	"http://www.w3.org/2004/02/skos/core#"	"Concept"	"http://www.w3.org/2000/01/rdf-schema#Class"	""	""	""	""	""
"ENUMERATION"	"OSLO-Levenscyclus"	"KlMaaiPeriode"	"{40CE9B81-4E45-47d5-8D97-ED8C52D1ACEC}"	""	""	""	""	"Maaiperiode"	"De maand waarin het maaien wordt uitgevoerd."	""	"Maaiperiode"	"De maand waarin het maaien wordt uitgevoerd."	""	"https://wegenenverkeer-test.data.vlaanderen.be/id/conceptscheme/KlMaaiPeriode"	"true"	"http://www.w3.org/2004/02/skos/core#"	"Concept"	"http://www.w3.org/2000/01/rdf-schema#Class"	""	""	""	""	""
"ENUMERATION"	"OSLO-Onderdeel"	"KlGrondHoofdnaamCode"	"{5FE4AC8B-9F4D-42d5-B32E-F781D4BFC593}"	""	""	""	""	"Grond hoofdnaamcode"	"De hoofdnaamcode van de grond.

Namespace :
http://interpretatie.kern.schemas.dov.vlaanderen.be/GecodeerdHoofdnaamCodesEnumType"	""	"Grond hoofdnaamcode"	"De hoofdnaamcode van de grond.

Namespace :
http://interpretatie.kern.schemas.dov.vlaanderen.be/GecodeerdHoofdnaamCodesEnumType"	""	"https://wegenenverkeer-test.data.vlaanderen.be/id/conceptscheme/KlGrondHoofdnaamCode"	"true"	"http://www.w3.org/2004/02/skos/core#"	"Concept"	"http://www.w3.org/2000/01/rdf-schema#Class"	""	""	""	""	""
"ENUMERATION"	"OSLO-Onderdeel"	"KlGrondBijmengingHoeveelheidCode"	"{0624A93F-8FDD-4a33-A178-66AC849479F0}"	""	""	""	""	"Grondbijmenging hoeveelheidscode"	"De mogelijke waarden voor de hoeveelheid bijmenging (X staat voor de lithologie van de bijmenging)"	""	"Grondbijmenging hoeveelheidscode"	"De mogelijke waarden voor de hoeveelheid bijmenging (X staat voor de lithologie van de bijmenging)"	""	"https://wegenenverkeer-test.data.vlaanderen.be/id/conceptscheme/KlGrondBijmengingHoeveelheidCode"	"true"	"http://www.w3.org/2004/02/skos/core#"	"Concept"	"http://www.w3.org/2000/01/rdf-schema#Class"	""	""	""	""	""
"ENUMERATION"	"OSLO-Onderdeel"	"KlGrondbestemming"	"{453ABD4C-7CDA-4771-A0A6-BBB63ED908C9}"	""	""	""	""	"Grondbestemming"	"De bestemmingen of doelen van de grond."	""	"Grondbestemming"	"De bestemmingen of doelen van de grond."	""	"https://wegenenverkeer-test.data.vlaanderen.be/id/conceptscheme/KlGrondbestemming"	"true"	"http://www.w3.org/2004/02/skos/core#"	"Concept"	"http://www.w3.org/2000/01/rdf-schema#Class"	""	""	""	""	""
"ENUMERATION"	"OSLO-Onderdeel"	"KlGrondwerksoorten"	"{5AFFACA9-AC25-437d-9189-FBF934C8CB69}"	""	""	""	""	"Grondwerksoorten"	"Soorten van grondwerk."	""	"Grondwerksoorten"	"Soorten van grondwerk."	""	"https://wegenenverkeer-test.data.vlaanderen.be/id/conceptscheme/KlGrondwerksoorten"	"true"	"http://www.w3.org/2004/02/skos/core#"	"Concept"	"http://www.w3.org/2000/01/rdf-schema#Class"	""	""	""	""	""
"ENUMERATION"	"OSLO-Onderdeel"	"KlGrondtoevoegsel"	"{BC4DA4EB-E27A-4638-9849-28D1EF48C095}"	""	""	""	""	"Grondtoevoegsel"	"De eventuele toevoegsels bij de grond."	""	"Grondtoevoegsel"	"De eventuele toevoegsels bij de grond."	""	"https://wegenenverkeer-test.data.vlaanderen.be/id/conceptscheme/KlGrondtoevoegsel"	"true"	"http://www.w3.org/2004/02/skos/core#"	"Concept"	"http://www.w3.org/2000/01/rdf-schema#Class"	""	""	""	""	""
"ENUMERATION"	"OSLO-Onderdeel"	"KlLEKantopsluitingBijkomendeParameter"	"{ADF73D85-628E-4341-8D43-EBFEA5D9A728}"	""	""	""	""	"Kantopsluiting bijkomende parameter"	"Gedetailleerder typeren van de kantopsluiting."	""	"Kantopsluiting bijkomende parameter"	"Gedetailleerder typeren van de kantopsluiting."	""	"https://wegenenverkeer-test.data.vlaanderen.be/id/conceptscheme/KlLEKantopsluitingBijkomendeParameter"	"true"	"http://www.w3.org/2004/02/skos/core#"	"Concept"	"http://www.w3.org/2000/01/rdf-schema#Class"	""	""	""	""	""
"ENUMERATION"	"OSLO-Onderdeel"	"KlLETrottoirbandVorm"	"{88EF8E81-B1D9-4208-9D82-351D6FEA6DAE}"	""	""	""	""	"Trottoirband vorm"	"De vormen van een trottoirband."	""	"Trottoirband vorm"	"De vormen van een trottoirband."	""	"https://wegenenverkeer-test.data.vlaanderen.be/id/conceptscheme/KlLETrottoirbandVorm"	"true"	"http://www.w3.org/2004/02/skos/core#"	"Concept"	"http://www.w3.org/2000/01/rdf-schema#Class"	""	""	""	""	""
"ENUMERATION"	"OSLO-Onderdeel"	"KlLEGCGeluidskarakteristiek"	"{587B7E4D-39C8-438a-8D40-E3A91CBD3BFA}"	""	""	""	""	"Geluidskarakteristiek"	"De geluidskarakteristieken van de geluidswerende constructie."	""	"Geluidskarakteristiek"	"De geluidskarakteristieken van de geluidswerende constructie."	""	"https://wegenenverkeer-test.data.vlaanderen.be/id/conceptscheme/KlLEGCGeluidskarakteristiek"	"true"	"http://www.w3.org/2004/02/skos/core#"	"Concept"	"http://www.w3.org/2000/01/rdf-schema#Class"	""	""	""	""	""
"ENUMERATION"	"OSLO-Onderdeel"	"KlLEGCMateriaal"	"{1CA72B26-AD04-4e3a-A015-E597BBCCCEF2}"	""	""	""	""	"Materiaal"	"Materialen van de geluidswerende constructie."	""	"Materiaal"	"Materialen van de geluidswerende constructie."	""	"https://wegenenverkeer-test.data.vlaanderen.be/id/conceptscheme/KlLEGCMateriaal"	"true"	"http://www.w3.org/2004/02/skos/core#"	"Concept"	"http://www.w3.org/2000/01/rdf-schema#Class"	""	""	""	""	""
"ENUMERATION"	"OSLO-Onderdeel"	"KlAanplantingswijzeSierbeplanting"	"{AE455421-A328-473f-BF6F-5778F40293AA}"	""	""	""	""	"aanplantingswijze sierbeplanting"	"De mogelijke manieren van aanplanten van sierbeplanting."	""	"aanplantingswijze sierbeplanting"	"De mogelijke manieren van aanplanten van sierbeplanting."	""	"https://wegenenverkeer-test.data.vlaanderen.be/id/conceptscheme/KlAanplantingswijzeSierbeplanting"	"true"	"http://www.w3.org/2004/02/skos/core#"	"Concept"	"http://www.w3.org/2000/01/rdf-schema#Class"	""	""	""	""	""
"ENUMERATION"	"OSLO-Onderdeel"	"KlSierbeplContainer"	"{484D3BC1-11D7-4cb2-AC35-E772F259E008}"	""	""	""	""	"Sierbeplanting container"	"Verschillende mogeliike pot- en containermaten voor de sierbeplanting."	""	"Sierbeplanting container"	"Verschillende mogeliike pot- en containermaten voor de sierbeplanting."	""	"https://wegenenverkeer-test.data.vlaanderen.be/id/conceptscheme/KlSierbeplContainer"	"true"	"http://www.w3.org/2004/02/skos/core#"	"Concept"	"http://www.w3.org/2000/01/rdf-schema#Class"	""	""	""	""	""
"ENUMERATION"	"OSLO-Onderdeel"	"KlSierbeplPlantmaat"	"{53516332-23FC-4fea-9FA1-EF9ABD650438}"	""	""	""	""	"Sierbepl plantmaat"	"De plantmaten van de sierplant."	""	"Sierbepl plantmaat"	"De plantmaten van de sierplant."	""	"https://wegenenverkeer-test.data.vlaanderen.be/id/conceptscheme/KlSierbeplPlantmaat"	"true"	"http://www.w3.org/2004/02/skos/core#"	"Concept"	"http://www.w3.org/2000/01/rdf-schema#Class"	""	""	""	""	""
