"EA-Type"	"EA-Package"	"EA-Name"	"EA-GUID"	"EA-Parent"	"EA-Domain"	"EA-Domain-GUID"	"EA-Range"	"label"	"definition"	"usage"	"ap-label-nl"	"ap-definition-nl"	"ap-usageNote-nl"	"ap-codelist"	"external term"	"namespace"	"localname"	"type"	"domain"	"range"	"parent"	"min card"	"max card"
"Package"	""	"OSLO-Camerainstallatie"	"{0EB262F2-2340-477a-B428-48F6CC5D678D}"	""	""	""	""	""	""	""	""	""	""	""	""	"http://"	"fixme.com"	"http://www.w3.org/2002/07/owl#Ontology"	""	""	""	""	""
"CLASS"	"OSLO-Abstracten"	"Kast"	"{AFF515CE-91F7-4490-9F13-1C5D041E26C4}"	""	""	""	""	"Kast"	"Abstracte voor allerlei types kasten."	""	"Kast"	"Abstracte voor allerlei types kasten."	""	""	"true"	"https://wegenenverkeer-test.data.vlaanderen.be/ns/abstracten#"	"Kast"	"http://www.w3.org/2000/01/rdf-schema#Class"	""	""	"https://wegenenverkeer-test.data.vlaanderen.be/ns/abstracten#Behuizing"	""	""
"CLASS"	"OSLO-Onderdeel"	"Wegkantkast"	"{C323776B-EEAD-4bca-AD8F-DACD12758240}"	""	""	""	""	"Wegkantkast"	"Behuizing in de vorm van kast typisch gebruikt buiten,langs de kant van de weg."	""	"Wegkantkast"	"Behuizing in de vorm van kast typisch gebruikt buiten,langs de kant van de weg."	""	""	"true"	"https://wegenenverkeer-test.data.vlaanderen.be/ns/onderdeel#"	"Wegkantkast"	"http://www.w3.org/2000/01/rdf-schema#Class"	""	""	"https://wegenenverkeer-test.data.vlaanderen.be/ns/abstracten#Buitenkast"	""	""
"CLASS"	"OSLO-Onderdeel"	"Montagekast"	"{243A55D1-F555-4141-99C5-B06BE03A8CE4}"	""	""	""	""	"Montagekast"	"Een kleine kast voor binnen of buiten die net omwille van zijn beperkte omvang doorgaans aan een paal,muur of andere objecten bevestigd wordt."	""	"Montagekast"	"Een kleine kast voor binnen of buiten die net omwille van zijn beperkte omvang doorgaans aan een paal,muur of andere objecten bevestigd wordt."	""	""	"true"	"https://wegenenverkeer-test.data.vlaanderen.be/ns/onderdeel#"	"Montagekast"	"http://www.w3.org/2000/01/rdf-schema#Class"	""	""	"https://wegenenverkeer-test.data.vlaanderen.be/ns/abstracten#Buitenkast"	""	""
"CLASS"	"OSLO-Onderdeel"	"Netwerkelement"	"{E953B85F-8165-4a20-961A-76354EFEB29E}"	""	""	""	""	"Netwerkelement"	"Toestel,onderdeel van het netwerk,waarop netwerk verbindingen kunnen aangelegd worden."	""	"Netwerkelement"	"Toestel,onderdeel van het netwerk,waarop netwerk verbindingen kunnen aangelegd worden."	""	""	"true"	"https://wegenenverkeer-test.data.vlaanderen.be/ns/onderdeel#"	"Netwerkelement"	"http://www.w3.org/2000/01/rdf-schema#Class"	""	""	"https://wegenenverkeer-test.data.vlaanderen.be/ns/implementatieelement#AIMNaamObject"	""	""
"CLASS"	"OSLO-Onderdeel"	"PoEInjector"	"{CADC3775-2822-461c-8CB9-6B7B7A7D42F8}"	""	""	""	""	"Power over Ethernet injector"	"Een toestel waarmee stroom/voeding voor een ander toestel over een datakabel gestuurd kan worden."	""	"Power over Ethernet injector"	"Een toestel waarmee stroom/voeding voor een ander toestel over een datakabel gestuurd kan worden."	""	""	"true"	"https://wegenenverkeer-test.data.vlaanderen.be/ns/onderdeel#"	"PoEInjector"	"http://www.w3.org/2000/01/rdf-schema#Class"	""	""	"https://wegenenverkeer-test.data.vlaanderen.be/ns/implementatieelement#AIMNaamObject"	""	""
"CLASS"	"OSLO-Onderdeel"	"Netwerkpoort"	"{3A18876B-5952-4de8-B1CC-7409BE65E9ED}"	""	""	""	""	"Netwerkpoort"	"Is de ingang van het toestel samen met component die erop zit bv. SFP,XFP,..."	""	"Netwerkpoort"	"Is de ingang van het toestel samen met component die erop zit bv. SFP,XFP,..."	""	""	"true"	"https://wegenenverkeer-test.data.vlaanderen.be/ns/onderdeel#"	"Netwerkpoort"	"http://www.w3.org/2000/01/rdf-schema#Class"	""	""	"https://wegenenverkeer-test.data.vlaanderen.be/ns/implementatieelement#AIMNaamObject"	""	""
"CLASS"	"OSLO-Abstracten"	"SoftwareToegang"	"{E9829500-E74A-4824-B2A5-A4EBB4CA80F8}"	""	""	""	""	"Software toegang"	"Een abstracte waarmee een object kan connecteren naar software,al dan niet door gebruik te maken van de logische poort."	""	"Software toegang"	"Een abstracte waarmee een object kan connecteren naar software,al dan niet door gebruik te maken van de logische poort."	""	""	"true"	"https://wegenenverkeer-test.data.vlaanderen.be/ns/abstracten#"	"SoftwareToegang"	"http://www.w3.org/2000/01/rdf-schema#Class"	""	""	"https://wegenenverkeer-test.data.vlaanderen.be/ns/implementatieelement#AIMNaamObject"	""	""
"CLASS"	"OSLO-Onderdeel"	"MACQPUFrontend"	"{5B47AF1A-576F-4a20-B6C2-716201B2086C}"	""	""	""	""	"MACQ PU Frontend"	"Een processing unit van MACQ die de link legt tussen de AID-module en de AID-push server en de correlatiemodule."	""	"MACQ PU Frontend"	"Een processing unit van MACQ die de link legt tussen de AID-module en de AID-push server en de correlatiemodule."	""	""	"true"	"https://wegenenverkeer-test.data.vlaanderen.be/ns/onderdeel#"	"MACQPUFrontend"	"http://www.w3.org/2000/01/rdf-schema#Class"	""	""	"https://wegenenverkeer-test.data.vlaanderen.be/ns/abstracten#PU"	""	""
"CLASS"	"OSLO-Onderdeel"	"AIDModule"	"{A2A0277C-A05B-48ff-BD68-32A73D3D12D3}"	""	""	""	""	"AID-module"	"AID staat voor Automatische IncidentDetectie op camerabeelden. Doel is om op een automatische en zo intelligent mogelijk manier gebeurtenissen uit de beelden van een CCTV-camera te halen."	""	"AID-module"	"AID staat voor Automatische IncidentDetectie op camerabeelden. Doel is om op een automatische en zo intelligent mogelijk manier gebeurtenissen uit de beelden van een CCTV-camera te halen."	""	""	"true"	"https://wegenenverkeer-test.data.vlaanderen.be/ns/onderdeel#"	"AIDModule"	"http://www.w3.org/2000/01/rdf-schema#Class"	""	""	"https://wegenenverkeer-test.data.vlaanderen.be/ns/implementatieelement#AIMNaamObject"	""	""
"CLASS"	"OSLO-Onderdeel"	"Stroomkring"	"{118123EB-7EC0-4f53-A107-38053841CF60}"	""	""	""	""	"Stroomkring"	"Ook wel vertrek of vertrekkende kabel genoemd. Afgezekerde elektrische geleiders waarmee de applicaties voorzien worden van de nodige voeding"	""	"Stroomkring"	"Ook wel vertrek of vertrekkende kabel genoemd. Afgezekerde elektrische geleiders waarmee de applicaties voorzien worden van de nodige voeding"	""	""	"true"	"https://wegenenverkeer-test.data.vlaanderen.be/ns/onderdeel#"	"Stroomkring"	"http://www.w3.org/2000/01/rdf-schema#Class"	""	""	"https://wegenenverkeer-test.data.vlaanderen.be/ns/implementatieelement#AIMNaamObject"	""	""
"CLASS"	"OSLO-Onderdeel"	"Bevestigingsbeugel"	"{DDD9E20F-88DD-457d-8D56-FA8D66981075}"	""	""	""	""	"Bevestigingsbeugel"	"Verbindingsstuk waarmee een object kan vastgemaakt worden aan een steun of oppervlak"	""	"Bevestigingsbeugel"	"Verbindingsstuk waarmee een object kan vastgemaakt worden aan een steun of oppervlak"	""	""	"true"	"https://wegenenverkeer-test.data.vlaanderen.be/ns/onderdeel#"	"Bevestigingsbeugel"	"http://www.w3.org/2000/01/rdf-schema#Class"	""	""	"https://wegenenverkeer-test.data.vlaanderen.be/ns/implementatieelement#AIMNaamObject"	""	""
"CLASS"	"OSLO-Onderdeel"	"Camera"	"{19330ECF-F073-49eb-B2ED-E8553E8EE3A6}"	""	""	""	""	"Camera"	"Een CCTV-camera, closed-circuit television camera,   kortweg camera, produceert beelden of opnames voor bewaking van een rgio vanop afstand.is een element die beelden neemt van een locatie en deze doorgeeft naar een verschillende partijen om zo de werkelijke situatie te kunnen inschatten vanop afstand.  Deze camera kan van het analoge type zijn of digitaal."	""	"Camera"	"Een CCTV-camera, closed-circuit television camera,   kortweg camera, produceert beelden of opnames voor bewaking van een rgio vanop afstand.is een element die beelden neemt van een locatie en deze doorgeeft naar een verschillende partijen om zo de werkelijke situatie te kunnen inschatten vanop afstand.  Deze camera kan van het analoge type zijn of digitaal."	""	""	"true"	"https://wegenenverkeer-test.data.vlaanderen.be/ns/onderdeel#"	"Camera"	"http://www.w3.org/2000/01/rdf-schema#Class"	""	""	"https://wegenenverkeer-test.data.vlaanderen.be/ns/implementatieelement#AIMNaamObject"	""	""
"CLASS"	"OSLO-Onderdeel"	"Omvormer"	"{2BC6BCAE-6024-47a5-9D54-74F76737AA1C}"	""	""	""	""	"Omvormer"	"Een object, bijna altijd geplaatst in paar geplaatst, omvorming en ""de""-omvorming, dat een signaal binnenneemt en terug uitstuurt maar dan  op een andere manier. Er zijn een hele reeks manieren.

- Omvorming waar er gewijzigd wordt van type kabel om dezelfde boodschap over te versturen, bv. omvorming van UTP naar Coax.

- Omvorming van codering bv. analoog naar digitaal en in omgekeerde richting digitaal naar analoog (omvorming van codering analoog-digitaal verschilt van een encoder omdat een encoder een eindproduct aflevert; in dit geval is de omvorming ter ondersteuning het transport en zal er altijd een omvorming zijn terug naar analoog)

- Omvorming  die de gegevens opnieuw versterkt zodat ze over een langere afstand kunnen getransporteerd worden. Deze variant heeft niet noodzakelijk een tweede omvormer om terug te gaan naar het origineel."	""	"Omvormer"	"Een object, bijna altijd geplaatst in paar geplaatst, omvorming en ""de""-omvorming, dat een signaal binnenneemt en terug uitstuurt maar dan  op een andere manier. Er zijn een hele reeks manieren.

- Omvorming waar er gewijzigd wordt van type kabel om dezelfde boodschap over te versturen, bv. omvorming van UTP naar Coax.

- Omvorming van codering bv. analoog naar digitaal en in omgekeerde richting digitaal naar analoog (omvorming van codering analoog-digitaal verschilt van een encoder omdat een encoder een eindproduct aflevert; in dit geval is de omvorming ter ondersteuning het transport en zal er altijd een omvorming zijn terug naar analoog)

- Omvorming  die de gegevens opnieuw versterkt zodat ze over een langere afstand kunnen getransporteerd worden. Deze variant heeft niet noodzakelijk een tweede omvormer om terug te gaan naar het origineel."	""	""	"true"	"https://wegenenverkeer-test.data.vlaanderen.be/ns/onderdeel#"	"Omvormer"	"http://www.w3.org/2000/01/rdf-schema#Class"	""	""	"https://wegenenverkeer-test.data.vlaanderen.be/ns/implementatieelement#AIMNaamObject"	""	""
"CLASS"	"OSLO-Abstracten"	"Draagconstructie"	"{1B8EB7BF-697E-437c-ABCE-562585071F6D}"	""	""	""	""	"Draagconstructie"	"Abstracte voor alle draagconstructies."	""	"Draagconstructie"	"Abstracte voor alle draagconstructies."	""	""	"true"	"https://wegenenverkeer-test.data.vlaanderen.be/ns/abstracten#"	"Draagconstructie"	"http://www.w3.org/2000/01/rdf-schema#Class"	""	""	""	""	""
"CLASS"	"OSLO-Abstracten"	"Behuizing"	"{8F3B4CEF-E9FC-41b9-B450-948A7F889A82}"	""	""	""	""	"Behuizing"	"Abstracte voor alle types van behuizing voor het beschermen van technieken."	""	"Behuizing"	"Abstracte voor alle types van behuizing voor het beschermen van technieken."	""	""	"true"	"https://wegenenverkeer-test.data.vlaanderen.be/ns/abstracten#"	"Behuizing"	"http://www.w3.org/2000/01/rdf-schema#Class"	""	""	"https://wegenenverkeer-test.data.vlaanderen.be/ns/implementatieelement#AIMNaamObject"	""	""
"CLASS"	"OSLO-Implementatieelement"	"AIMNaamObject"	"{F0C7C695-ED74-45e1-BE46-E596B7773151}"	""	""	""	""	"AIM naam object"	"Abstracte als de basisklasse voor elk OTL object dat benoemd wordt met een mensleesbare identificator."	""	"AIM naam object"	"Abstracte als de basisklasse voor elk OTL object dat benoemd wordt met een mensleesbare identificator."	""	""	"true"	"https://wegenenverkeer-test.data.vlaanderen.be/ns/implementatieelement#"	"AIMNaamObject"	"http://www.w3.org/2000/01/rdf-schema#Class"	""	""	"https://wegenenverkeer-test.data.vlaanderen.be/ns/implementatieelement#AIMObject"	""	""
"CLASS"	"OSLO-Implementatieelement"	"AIMObject"	"{B66E06D3-6DD8-4d01-B0FE-CFBB081CAEC6}"	""	""	""	""	"AIM object"	"Abstracte als de basisklasse voor alle uniek geïdentificeerde OTL objecten met de basiseigenschappen die elk OTL object minstens heeft."	""	"AIM object"	"Abstracte als de basisklasse voor alle uniek geïdentificeerde OTL objecten met de basiseigenschappen die elk OTL object minstens heeft."	""	""	"true"	"https://wegenenverkeer-test.data.vlaanderen.be/ns/implementatieelement#"	"AIMObject"	"http://www.w3.org/2000/01/rdf-schema#Class"	""	""	"https://wegenenverkeer-test.data.vlaanderen.be/ns/implementatieelement#AIMToestand, https://wegenenverkeer-test.data.vlaanderen.be/ns/implementatieelement#AIMDBStatus"	""	""
"CLASS"	"OSLO-Implementatieelement"	"AIMToestand"	"{AF1DEC32-D9CC-49cf-8BC5-7A43166C7ED7}"	""	""	""	""	"AIM Toestand"	"Voegt een attribuut toe aan de subklasse dat de huidige stand in de levenscyclus van het object aangeeft."	""	"AIM Toestand"	"Voegt een attribuut toe aan de subklasse dat de huidige stand in de levenscyclus van het object aangeeft."	""	""	"true"	"https://wegenenverkeer-test.data.vlaanderen.be/ns/implementatieelement#"	"AIMToestand"	"http://www.w3.org/2000/01/rdf-schema#Class"	""	""	""	""	""
"CLASS"	"OSLO-Implementatieelement"	"AIMDBStatus"	"{3A25C84F-2295-443d-9781-A768527A71F0}"	""	""	""	""	"AIM databank status"	"Voegt een attribuut toe aan de subklasse dat aangeeft of de asset zichtbaar is in de databank of (zacht) verwijderd is."	""	"AIM databank status"	"Voegt een attribuut toe aan de subklasse dat aangeeft of de asset zichtbaar is in de databank of (zacht) verwijderd is."	""	""	"true"	"https://wegenenverkeer-test.data.vlaanderen.be/ns/implementatieelement#"	"AIMDBStatus"	"http://www.w3.org/2000/01/rdf-schema#Class"	""	""	""	""	""
"CLASS"	"OSLO-Abstracten"	"Buitenkast"	"{9C7CFF96-B6BC-4e33-AFC4-4E477A0EBB2F}"	""	""	""	""	"Buitenkast"	"Abstracte voor kasten die typisch buiten staan en daarom bestand moeten zijn tegen de elementen en verfraaiing kunnen krijgen."	""	"Buitenkast"	"Abstracte voor kasten die typisch buiten staan en daarom bestand moeten zijn tegen de elementen en verfraaiing kunnen krijgen."	""	""	"true"	"https://wegenenverkeer-test.data.vlaanderen.be/ns/abstracten#"	"Buitenkast"	"http://www.w3.org/2000/01/rdf-schema#Class"	""	""	"https://wegenenverkeer-test.data.vlaanderen.be/ns/abstracten#Kast"	""	""
"CLASS"	"OSLO-Abstracten"	"PU"	"{E8A6A873-5D1F-4b49-A5B0-40672E3930C7}"	""	""	""	""	"PU"	"Abstracte klasse die allerhande stuureenheden groupeert (PLCs,controllers,etc.)."	""	"PU"	"Abstracte klasse die allerhande stuureenheden groupeert (PLCs,controllers,etc.)."	""	""	"true"	"https://wegenenverkeer-test.data.vlaanderen.be/ns/abstracten#"	"PU"	"http://www.w3.org/2000/01/rdf-schema#Class"	""	""	"https://wegenenverkeer-test.data.vlaanderen.be/ns/implementatieelement#AIMNaamObject"	""	""
"DATATYPE"	"OSLO-Implementatieelement"	"DtcAfmetingBxlxhInMm"	"{1395BC51-AABD-487c-BB40-1373BEBFA0D3}"	""	""	""	""	"Afmeting bxlxh in millimeter"	"Complex datatype voor de afmeting van de breedte,de lengte en hoogte in millimeter."	""	"Afmeting bxlxh in millimeter"	"Complex datatype voor de afmeting van de breedte,de lengte en hoogte in millimeter."	""	""	"true"	"https://wegenenverkeer-test.data.vlaanderen.be/ns/implementatieelement#"	"DtcAfmetingBxlxhInMm"	"http://www.w3.org/2000/01/rdf-schema#Class"	""	""	""	""	""
"DATATYPE"	"OSLO-Implementatieelement"	"KwantWrdInMillimeter"	"{36F7D80F-3877-42ff-A609-228671F7B971}"	""	""	""	""	"Kwantitatieve waarde in millimeter"	"Een kwantitatieve waarde die een getal in millimeter uitdrukt."	""	"Kwantitatieve waarde in millimeter"	"Een kwantitatieve waarde die een getal in millimeter uitdrukt."	""	""	"true"	"https://wegenenverkeer-test.data.vlaanderen.be/ns/implementatieelement#"	"KwantWrdInMillimeter"	"http://www.w3.org/2000/01/rdf-schema#Class"	""	""	""	""	""
"DATATYPE"	"W3-RDF-Schema"	"Literal"	"{A5EFCD8C-F059-4fe8-8044-FBB2A0B68AFF}"	""	""	""	""	"Literal"	"Beschrijft een constante."	"http://www.w3.org/2000/01/rdf-schema#Literal"	"Literal"	"Beschrijft een constante."	""	""	"true"	"http://www.w3.org/2000/01/rdf-schema#"	"Literal"	"http://www.w3.org/2000/01/rdf-schema#Class"	""	""	""	""	""
"DATATYPE"	"W3-XML-Schema"	"Decimal"	"{97CA8445-5181-453b-AA55-B0DFD87D36A8}"	""	""	""	""	"Decimaal getal"	"Beschrijft een decimaal getal volgens http://www.w3.org/2001/XMLSchema#decimal"	"https://www.w3.org/TR/xmlschema-2/#decimal"	"Decimaal getal"	"Beschrijft een decimaal getal volgens http://www.w3.org/2001/XMLSchema#decimal"	""	""	"true"	"http://www.w3.org/2001/XMLSchema#"	"decimal"	"http://www.w3.org/2000/01/rdf-schema#Class"	""	""	""	""	""
"DATATYPE"	"W3-XML-Schema"	"Boolean"	"{B9C428FF-1241-466a-9DFF-42CC62B9431D}"	""	""	""	""	"Boolean"	"Beschrijft een boolean volgens http://www.w3.org/2001/XMLSchema#boolean"	"https://www.w3.org/TR/xmlschema-2/#boolean"	"Boolean"	"Beschrijft een boolean volgens http://www.w3.org/2001/XMLSchema#boolean"	""	""	"true"	"http://www.w3.org/2001/XMLSchema#"	"boolean"	"http://www.w3.org/2000/01/rdf-schema#Class"	""	""	""	""	""
"DATATYPE"	"OSLO-Implementatieelement"	"DtcDocument"	"{9ECFE27F-F788-451c-8D7C-F65B137B4CF4}"	""	""	""	""	"Bestandsbijlage"	"Complex datatype voor alle bestandsbijlages"	""	"Bestandsbijlage"	"Complex datatype voor alle bestandsbijlages"	""	""	"true"	"https://wegenenverkeer-test.data.vlaanderen.be/ns/implementatieelement#"	"DtcDocument"	"http://www.w3.org/2000/01/rdf-schema#Class"	""	""	""	""	""
"DATATYPE"	"W3-XML-Schema"	"String"	"{14B67F3A-3AFA-411e-AE45-712B851EFE6E}"	""	""	""	""	"String"	"Beschrijft een tekstregel volgens http://www.w3.org/2001/XMLSchema#string"	"https://www.w3.org/TR/xmlschema-2/#string"	"String"	"Beschrijft een tekstregel volgens http://www.w3.org/2001/XMLSchema#string"	""	""	"true"	"http://www.w3.org/2001/XMLSchema#"	"string"	"http://www.w3.org/2000/01/rdf-schema#Class"	""	""	""	""	""
"DATATYPE"	"OSLO-Implementatieelement"	"DteTekstblok"	"{CEF0E482-851E-4797-836B-F3A5082057C9}"	""	""	""	""	"Tekstblok"	"Een tekst welke uit meerdere zinnen bestaat,en ook regeleindes kan bevatten. Een tekstblok bevat maximaal 65.000 karakters."	""	"Tekstblok"	"Een tekst welke uit meerdere zinnen bestaat,en ook regeleindes kan bevatten. Een tekstblok bevat maximaal 65.000 karakters."	""	""	"true"	"https://wegenenverkeer-test.data.vlaanderen.be/ns/implementatieelement#"	"DteTekstblok"	"http://www.w3.org/2000/01/rdf-schema#Class"	""	""	""	""	""
"DATATYPE"	"W3-XML-Schema"	"AnyURI"	"{A52F83DB-A464-4210-AEDC-D64B955C470B}"	""	""	""	""	"URI"	"Een tekstwaarde die een verwijzing naar meer informatie van het element bevat volgens http://www.w3.org/2001/XMLSchema#anyURI ."	"https://www.w3.org/TR/xmlschema-2/#anyURI"	"URI"	"Een tekstwaarde die een verwijzing naar meer informatie van het element bevat volgens http://www.w3.org/2001/XMLSchema#anyURI ."	""	""	"true"	"http://www.w3.org/2001/XMLSchema#"	"anyURI"	"http://www.w3.org/2000/01/rdf-schema#Class"	""	""	""	""	""
"DATATYPE"	"OSLO-Implementatieelement"	"DtcAdres"	"{D2F0F525-9079-46c6-BD63-DFC6DEB797DA}"	""	""	""	""	"Adres"	"Complex datatype voor de aanduiding van een bepaalde locatie,doorgaans van een huis,woning,gebouw of faciliteit,op de aarde."	""	"Adres"	"Complex datatype voor de aanduiding van een bepaalde locatie,doorgaans van een huis,woning,gebouw of faciliteit,op de aarde."	""	""	"true"	"https://wegenenverkeer-test.data.vlaanderen.be/ns/implementatieelement#"	"DtcAdres"	"http://www.w3.org/2000/01/rdf-schema#Class"	""	""	""	""	""
"DATATYPE"	"OSLO-Implementatieelement"	"DtcIdentificator"	"{A55DDAFC-1722-4cc6-AE76-8D7FC1C9B920}"	""	""	""	""	"Identificator"	"Complex datatype voor de identificator van een object volgens de bron van de identificator."	""	"Identificator"	"Complex datatype voor de identificator van een object volgens de bron van de identificator."	""	""	"true"	"https://wegenenverkeer-test.data.vlaanderen.be/ns/implementatieelement#"	"DtcIdentificator"	"http://www.w3.org/2000/01/rdf-schema#Class"	""	""	""	""	""
"DATATYPE"	"W3-XML-Schema"	"Date"	"{74D8F675-72C3-4370-BC7A-1AE94B43DA0A}"	""	""	""	""	"Datum"	"Beschrijft een datum volgens http://www.w3.org/2001/XMLSchema#date"	"https://www.w3.org/TR/xmlschema-2/#date"	"Datum"	"Beschrijft een datum volgens http://www.w3.org/2001/XMLSchema#date"	""	""	"true"	"http://www.w3.org/2001/XMLSchema#"	"date"	"http://www.w3.org/2000/01/rdf-schema#Class"	""	""	""	""	""
"DATATYPE"	"OSLO-Implementatieelement"	"KwantWrdInJaar"	"{7268D2CF-C570-44b8-A990-C5AE7FA5E527}"	""	""	""	""	"Kwantitatieve waarde in aantal jaar"	"Een kwantitatieve waarde die een getal in aantal jaar uitdrukt."	""	"Kwantitatieve waarde in aantal jaar"	"Een kwantitatieve waarde die een getal in aantal jaar uitdrukt."	""	""	"true"	"https://wegenenverkeer-test.data.vlaanderen.be/ns/implementatieelement#"	"KwantWrdInJaar"	"http://www.w3.org/2000/01/rdf-schema#Class"	""	""	""	""	""
"DATATYPE"	"W3-XML-Schema"	"NonNegativeInteger"	"{882AA8DC-BE96-408a-BA71-02B682F50C0C}"	""	""	""	""	"Natuurlijk getal"	"Beschrijft een natuurlijk getal volgens http://www.w3.org/2001/XMLSchema#nonNegativeInteger"	"https://www.w3.org/TR/xmlschema-2/#nonNegativeInteger"	"Natuurlijk getal"	"Beschrijft een natuurlijk getal volgens http://www.w3.org/2001/XMLSchema#nonNegativeInteger"	""	""	"true"	"http://www.w3.org/2001/XMLSchema#"	"nonNegativeInteger"	"http://www.w3.org/2000/01/rdf-schema#Class"	""	""	""	""	""
"DATATYPE"	"OSLO-Implementatieelement"	"DteIPv4Adres"	"{8D2FA01C-0286-473c-95E6-4D214A93B258}"	""	""	""	""	"IPv4-adres"	"Beschrijft een ip-adres volgens de ipv4 specificatie."	""	"IPv4-adres"	"Beschrijft een ip-adres volgens de ipv4 specificatie."	""	""	"true"	"https://wegenenverkeer-test.data.vlaanderen.be/ns/implementatieelement#"	"DteIPv4Adres"	"http://www.w3.org/2000/01/rdf-schema#Class"	""	""	""	""	""
"DATATYPE"	"W3-XML-Schema"	"Integer"	"{14639896-A26C-4369-94F2-87A53F643E43}"	""	""	""	""	"Geheel getal"	"Beschrijft een geheel getal volgens http://www.w3.org/2001/XMLSchema#integer"	"https://www.w3.org/TR/xmlschema-2/#integer"	"Geheel getal"	"Beschrijft een geheel getal volgens http://www.w3.org/2001/XMLSchema#integer"	""	""	"true"	"http://www.w3.org/2001/XMLSchema#"	"integer"	"http://www.w3.org/2000/01/rdf-schema#Class"	""	""	""	""	""
"ENUMERATION"	"OSLO-Implementatieelement"	"KlAlgMimeType"	"{2D746D83-4847-4b25-A463-046F58A383F3}"	""	""	""	""	"Mimetype"	"De mime types van bestanden (AWVDocument) beperkt tot mime types voor toegelaten bestandstypen."	""	"Mimetype"	"De mime types van bestanden (AWVDocument) beperkt tot mime types voor toegelaten bestandstypen."	""	"https://wegenenverkeer-test.data.vlaanderen.be/id/conceptscheme/KlAlgMimeType"	"true"	"http://www.w3.org/2004/02/skos/core#"	"Concept"	"http://www.w3.org/2000/01/rdf-schema#Class"	""	""	""	""	""
"ENUMERATION"	"OSLO-Onderdeel"	"KlAlgMateriaal"	"{C3B0AC93-05B8-4e7f-A80F-C8D55E025806}"	""	""	""	""	"Materiaal soorten"	"Het materiaal waaruit een object voornamelijk gebouwd is."	""	"Materiaal soorten"	"Het materiaal waaruit een object voornamelijk gebouwd is."	""	"https://wegenenverkeer-test.data.vlaanderen.be/id/conceptscheme/KlAlgMateriaal"	"true"	"http://www.w3.org/2004/02/skos/core#"	"Concept"	"http://www.w3.org/2000/01/rdf-schema#Class"	""	""	""	""	""
"ENUMERATION"	"OSLO-Implementatieelement"	"KlAlgGemeente"	"{58CEB2F4-B366-4324-AA06-61823FBE0747}"	""	""	""	""	"Gemeente"	"Lijst van gemeentes in Vlaanderen."	""	"Gemeente"	"Lijst van gemeentes in Vlaanderen."	""	"https://wegenenverkeer-test.data.vlaanderen.be/id/conceptscheme/KlAlgGemeente"	"true"	"http://www.w3.org/2004/02/skos/core#"	"Concept"	"http://www.w3.org/2000/01/rdf-schema#Class"	""	""	""	""	""
"ENUMERATION"	"OSLO-Implementatieelement"	"KlAlgProvincie"	"{95EB274C-B435-40be-9732-5ECD04DFECC9}"	""	""	""	""	"Provincie"	"Lijst van provincies in Vlaanderen"	""	"Provincie"	"Lijst van provincies in Vlaanderen"	""	"https://wegenenverkeer-test.data.vlaanderen.be/id/conceptscheme/KlAlgProvincie"	"true"	"http://www.w3.org/2004/02/skos/core#"	"Concept"	"http://www.w3.org/2000/01/rdf-schema#Class"	""	""	""	""	""
"ENUMERATION"	"OSLO-Implementatieelement"	"KlAIMToestand"	"{0B4023FA-2C71-4947-834E-10EF1C58424B}"	""	""	""	""	"AIM toestand"	"Keuzelijst met fasen uit de levenscyclus van een object om de toestand op een moment mee vast te leggen."	""	"AIM toestand"	"Keuzelijst met fasen uit de levenscyclus van een object om de toestand op een moment mee vast te leggen."	""	"https://wegenenverkeer-test.data.vlaanderen.be/id/conceptscheme/KlAIMToestand"	"true"	"http://www.w3.org/2004/02/skos/core#"	"Concept"	"http://www.w3.org/2000/01/rdf-schema#Class"	""	""	""	""	""
"ENUMERATION"	"OSLO-Onderdeel"	"KlWegkantkastType"	"{1001D494-2C47-4d23-8D10-FBE181F6BBBD}"	""	""	""	""	"Wegkantkast type"	"Keuzelijst voor gangbare types voor wegkantkasten."	""	"Wegkantkast type"	"Keuzelijst voor gangbare types voor wegkantkasten."	""	"https://wegenenverkeer-test.data.vlaanderen.be/id/conceptscheme/KlWegkantkastType"	"true"	"http://www.w3.org/2004/02/skos/core#"	"Concept"	"http://www.w3.org/2000/01/rdf-schema#Class"	""	""	""	""	""
"ENUMERATION"	"OSLO-Onderdeel"	"KlAlgIngressProtectionCode"	"{C6529B63-BDCC-4f88-A9FF-F73054056ACA}"	""	""	""	""	"Ingress Protection Codering"	"De IP-codering als een aanduiding voor de mate van beveiliging van de constructie van elektrische of elektronische apparatuur tegen eigen schade door gebruik in 'vijandige omgevingen' en tegen eventueel gevaar voor de gebruiker volgens IEC 60529."	""	"Ingress Protection Codering"	"De IP-codering als een aanduiding voor de mate van beveiliging van de constructie van elektrische of elektronische apparatuur tegen eigen schade door gebruik in 'vijandige omgevingen' en tegen eventueel gevaar voor de gebruiker volgens IEC 60529."	""	"https://wegenenverkeer-test.data.vlaanderen.be/id/conceptscheme/KlAlgIngressProtectionCode"	"true"	"http://www.w3.org/2004/02/skos/core#"	"Concept"	"http://www.w3.org/2000/01/rdf-schema#Class"	""	""	""	""	""
"ENUMERATION"	"OSLO-Abstracten"	"KlBuitenkastVerfraaid"	"{2F02194C-E5C1-4942-B57F-537C2BD4965F}"	""	""	""	""	"Verfraaing buitenkast"	"Mogelijke types voor verfraaiing als combinatie van aan- en afwezigheid en al dan niet vegund."	""	"Verfraaing buitenkast"	"Mogelijke types voor verfraaiing als combinatie van aan- en afwezigheid en al dan niet vegund."	""	"https://wegenenverkeer-test.data.vlaanderen.be/id/conceptscheme/KlBuitenkastVerfraaid"	"true"	"http://www.w3.org/2004/02/skos/core#"	"Concept"	"http://www.w3.org/2000/01/rdf-schema#Class"	""	""	""	""	""
