"EA-Type"	"EA-Package"	"EA-Name"	"EA-GUID"	"EA-Parent"	"EA-Domain"	"EA-Domain-GUID"	"EA-Range"	"label"	"definition"	"usage"	"ap-label-nl"	"ap-definition-nl"	"ap-usageNote-nl"	"ap-codelist"	"external term"	"namespace"	"localname"	"type"	"domain"	"range"	"parent"	"min card"	"max card"
"attribute"	"OSLO-Onderdeel"	"metAntiVandalisme"	"{F90B0778-4A61-42d9-94A7-2C08132D2927}"	""	"VerlichtingstoestelNaHP"	"{C0F668CB-86E9-4b24-9FA2-1123346B7C98}"	"Boolean"	"met anti-vandalisme"	"Is het een antivandalisme type verlichtingstoestel?"	""	"met anti-vandalisme"	"Is het een antivandalisme type verlichtingstoestel?"	""	""	"true"	"https://wegenenverkeer-test.data.vlaanderen.be/ns/onderdeel#"	"VerlichtingstoestelNaHP.metAntiVandalisme"	"http://www.w3.org/2002/07/owl#DatatypeProperty"	"https://wegenenverkeer-test.data.vlaanderen.be/ns/onderdeel#VerlichtingstoestelNaHP"	"http://www.w3.org/2001/XMLSchema#boolean"	""	"1"	"1"
"attribute"	"OSLO-Onderdeel"	"metSperfilter"	"{24964E23-13A3-4a4a-B329-48B2EB295E2F}"	""	"VerlichtingstoestelNaHP"	"{C0F668CB-86E9-4b24-9FA2-1123346B7C98}"	"Boolean"	"met sperfilter"	"Is er een sperfilter aanwezig?"	""	"met sperfilter"	"Is er een sperfilter aanwezig?"	""	""	"true"	"https://wegenenverkeer-test.data.vlaanderen.be/ns/onderdeel#"	"VerlichtingstoestelNaHP.metSperfilter"	"http://www.w3.org/2002/07/owl#DatatypeProperty"	"https://wegenenverkeer-test.data.vlaanderen.be/ns/onderdeel#VerlichtingstoestelNaHP"	"http://www.w3.org/2001/XMLSchema#boolean"	""	"1"	"1"
"attribute"	"OSLO-Onderdeel"	"armatuurkleur"	"{CF3E6903-7CE4-4e7e-B312-FE594972C1B2}"	""	"VerlichtingstoestelMHHP"	"{5010B4DA-CC06-435b-8B5E-372700B45F9E}"	"DteKleurRAL"	"armatuurkleur"	"De kleur van de zichtbare buitenkant van het verlichtingstoestel
"	""	"armatuurkleur"	"De kleur van de zichtbare buitenkant van het verlichtingstoestel
"	""	""	"true"	"https://wegenenverkeer-test.data.vlaanderen.be/ns/onderdeel#"	"VerlichtingstoestelMHHP.armatuurkleur"	"http://www.w3.org/2002/07/owl#ObjectProperty"	"https://wegenenverkeer-test.data.vlaanderen.be/ns/onderdeel#VerlichtingstoestelMHHP"	"https://wegenenverkeer-test.data.vlaanderen.be/ns/implementatieelement#DteKleurRAL"	""	"1"	"1"
"attribute"	"OSLO-Onderdeel"	"heeftAntiVandalisme"	"{F121724D-4E0D-4a7b-96D4-3CB1190CC203}"	""	"VerlichtingstoestelMHHP"	"{5010B4DA-CC06-435b-8B5E-372700B45F9E}"	"Boolean"	"heeft anti vandalisme"	"Is het een antivandalisme type verlichtingstoestel?"	""	"heeft anti vandalisme"	"Is het een antivandalisme type verlichtingstoestel?"	""	""	"true"	"https://wegenenverkeer-test.data.vlaanderen.be/ns/onderdeel#"	"VerlichtingstoestelMHHP.heeftAntiVandalisme"	"http://www.w3.org/2002/07/owl#DatatypeProperty"	"https://wegenenverkeer-test.data.vlaanderen.be/ns/onderdeel#VerlichtingstoestelMHHP"	"http://www.w3.org/2001/XMLSchema#boolean"	""	"1"	"1"
"attribute"	"OSLO-Abstracten"	"heeftAansluitkastGeintegreerd"	"{84A2DD3C-90D4-4fe5-AD25-B64E0B1BDF7F}"	""	"Verlichtingstoestel"	"{8CDD3E4D-F1E8-4be6-9C29-311743FDBBCA}"	"Boolean"	"heeft aansluitkast geintegreerd"	"Is de aansluitkast geïntegreerd?"	""	"heeft aansluitkast geintegreerd"	"Is de aansluitkast geïntegreerd?"	""	""	"true"	"https://wegenenverkeer-test.data.vlaanderen.be/ns/abstracten#"	"Verlichtingstoestel.heeftAansluitkastGeintegreerd"	"http://www.w3.org/2002/07/owl#DatatypeProperty"	"https://wegenenverkeer-test.data.vlaanderen.be/ns/abstracten#Verlichtingstoestel"	"http://www.w3.org/2001/XMLSchema#boolean"	""	"1"	"1"
"attribute"	"OSLO-Abstracten"	"merk"	"{1322C8D7-98A8-40d0-A650-9D7FDA835998}"	""	"Verlichtingstoestel"	"{8CDD3E4D-F1E8-4be6-9C29-311743FDBBCA}"	"KlVerlichtingstoestelMerk"	"merk"	"Merknaam van het verlichtingstoestel"	""	"merk"	"Merknaam van het verlichtingstoestel"	""	""	"true"	"https://wegenenverkeer-test.data.vlaanderen.be/ns/abstracten#"	"Verlichtingstoestel.merk"	"http://www.w3.org/2002/07/owl#ObjectProperty"	"https://wegenenverkeer-test.data.vlaanderen.be/ns/abstracten#Verlichtingstoestel"	"http://www.w3.org/2004/02/skos/core#Concept"	""	"1"	"1"
"attribute"	"OSLO-Abstracten"	"modelnaam"	"{AB3A9225-976F-41d5-A5C4-ED1958B70133}"	""	"Verlichtingstoestel"	"{8CDD3E4D-F1E8-4be6-9C29-311743FDBBCA}"	"KlVerlichtingstoestelModelnaam"	"modelnaam"	"TODO"	""	"modelnaam"	"TODO"	""	""	"true"	"https://wegenenverkeer-test.data.vlaanderen.be/ns/abstracten#"	"Verlichtingstoestel.modelnaam"	"http://www.w3.org/2002/07/owl#ObjectProperty"	"https://wegenenverkeer-test.data.vlaanderen.be/ns/abstracten#Verlichtingstoestel"	"http://www.w3.org/2004/02/skos/core#Concept"	""	"1"	"1"
"attribute"	"OSLO-Abstracten"	"opmerkingenInventaris"	"{29269A8C-5328-4946-B3DE-3A951E8FB7BA}"	""	"Verlichtingstoestel"	"{8CDD3E4D-F1E8-4be6-9C29-311743FDBBCA}"	"DteTekstblok"	"opmerkingen inventaris"	"Overige aanvullingen bij de inventaris"	""	"opmerkingen inventaris"	"Overige aanvullingen bij de inventaris"	""	""	"true"	"https://wegenenverkeer-test.data.vlaanderen.be/ns/abstracten#"	"Verlichtingstoestel.opmerkingenInventaris"	"http://www.w3.org/2002/07/owl#ObjectProperty"	"https://wegenenverkeer-test.data.vlaanderen.be/ns/abstracten#Verlichtingstoestel"	"https://wegenenverkeer-test.data.vlaanderen.be/ns/implementatieelement#DteTekstblok"	""	"1"	"1"
"attribute"	"OSLO-Abstracten"	"stroomkringnummer"	"{245FF1B2-4866-4c46-B79B-091099368003}"	""	"Verlichtingstoestel"	"{8CDD3E4D-F1E8-4be6-9C29-311743FDBBCA}"	"String"	"stroomkringnummer"	"Nummer van de stroomkring waarop het verlichtingstoestel is aangesloten"	""	"stroomkringnummer"	"Nummer van de stroomkring waarop het verlichtingstoestel is aangesloten"	""	""	"true"	"https://wegenenverkeer-test.data.vlaanderen.be/ns/abstracten#"	"Verlichtingstoestel.stroomkringnummer"	"http://www.w3.org/2002/07/owl#DatatypeProperty"	"https://wegenenverkeer-test.data.vlaanderen.be/ns/abstracten#Verlichtingstoestel"	"http://www.w3.org/2001/XMLSchema#string"	""	"1"	"1"
"attribute"	"OSLO-Abstracten"	"systeemvermogen"	"{E09BD3EE-5AA6-4dbb-9D50-0C92C8BD00DE}"	""	"Verlichtingstoestel"	"{8CDD3E4D-F1E8-4be6-9C29-311743FDBBCA}"	"KwantWrdInWatt"	"systeemvermogen"	"Systeemvermogen (Watt) van het verlichtingstoestel"	""	"systeemvermogen"	"Systeemvermogen (Watt) van het verlichtingstoestel"	""	""	"true"	"https://wegenenverkeer-test.data.vlaanderen.be/ns/abstracten#"	"Verlichtingstoestel.systeemvermogen"	"http://www.w3.org/2002/07/owl#ObjectProperty"	"https://wegenenverkeer-test.data.vlaanderen.be/ns/abstracten#Verlichtingstoestel"	"https://wegenenverkeer-test.data.vlaanderen.be/ns/implementatieelement#KwantWrdInWatt"	""	"1"	"1"
"attribute"	"OSLO-Abstracten"	"ipKlasse"	"{4B1B5655-5F0A-43d8-BCC6-CDF3183FE841}"	""	"Buitenkast"	"{49F937A2-8C90-497c-9A0D-7182273D8DC1}"	"KlAlgIngressProtectionCode"	"ingress protection klasse"	"De IP-codering als een aanduiding voor de mate van beveiliging van de constructie van elektrische of elektronische apparatuur tegen eigen schade door gebruik in ""vijandige omgevingen"" en tegen eventueel gevaar voor de gebruiker volgens IEC 60529."	""	"ingress protection klasse"	"De IP-codering als een aanduiding voor de mate van beveiliging van de constructie van elektrische of elektronische apparatuur tegen eigen schade door gebruik in ""vijandige omgevingen"" en tegen eventueel gevaar voor de gebruiker volgens IEC 60529."	""	""	"true"	"https://wegenenverkeer-test.data.vlaanderen.be/ns/abstracten#"	"Buitenkast.ipKlasse"	"http://www.w3.org/2002/07/owl#ObjectProperty"	"https://wegenenverkeer-test.data.vlaanderen.be/ns/abstracten#Buitenkast"	"http://www.w3.org/2004/02/skos/core#Concept"	""	"1"	"1"
"attribute"	"OSLO-Abstracten"	"verfraaid"	"{CC9EC3A0-BB80-4ba0-B90C-820077C0924A}"	""	"Buitenkast"	"{49F937A2-8C90-497c-9A0D-7182273D8DC1}"	"KlBehuizingVerfraaid"	"verfraaid"	"Geeft aan of de wegkantkast voorzien van verfraaiing en of die al dan niet vergund is."	""	"verfraaid"	"Geeft aan of de wegkantkast voorzien van verfraaiing en of die al dan niet vergund is."	""	""	"true"	"https://wegenenverkeer-test.data.vlaanderen.be/ns/abstracten#"	"Buitenkast.verfraaid"	"http://www.w3.org/2002/07/owl#ObjectProperty"	"https://wegenenverkeer-test.data.vlaanderen.be/ns/abstracten#Buitenkast"	"http://www.w3.org/2004/02/skos/core#Concept"	""	"1"	"1"
"attribute"	"OSLO-Abstracten"	"afmeting"	"{2D709875-DF93-4f0a-B659-E726A06BDF13}"	""	"Kast"	"{7B0BF92A-BCCB-4c44-AAD0-92E4C9745E3A}"	"DtcAfmetingBxlxhInMm"	"afmeting"	"Buitenafmeting van de kast als maximale breedte, lengte en hoogte in millimeter"	""	"afmeting"	"Buitenafmeting van de kast als maximale breedte, lengte en hoogte in millimeter"	""	""	"true"	"https://wegenenverkeer-test.data.vlaanderen.be/ns/abstracten#"	"Kast.afmeting"	"http://www.w3.org/2002/07/owl#ObjectProperty"	"https://wegenenverkeer-test.data.vlaanderen.be/ns/abstracten#Kast"	"https://wegenenverkeer-test.data.vlaanderen.be/ns/implementatieelement#DtcAfmetingBxlxhInMm"	""	"1"	"1"
"attribute"	"OSLO-Abstracten"	"heeftVerlichting"	"{259D301E-A722-40b7-997D-DEA2E5B4D44E}"	""	"Kast"	"{7B0BF92A-BCCB-4c44-AAD0-92E4C9745E3A}"	"Boolean"	"heeft verlichting"	"Geeft aan of er verlichting aanwezig is binnen de kast."	""	"heeft verlichting"	"Geeft aan of er verlichting aanwezig is binnen de kast."	""	""	"true"	"https://wegenenverkeer-test.data.vlaanderen.be/ns/abstracten#"	"Kast.heeftVerlichting"	"http://www.w3.org/2002/07/owl#DatatypeProperty"	"https://wegenenverkeer-test.data.vlaanderen.be/ns/abstracten#Kast"	"http://www.w3.org/2001/XMLSchema#boolean"	""	"1"	"1"
"attribute"	"OSLO-Abstracten"	"indelingsplan"	"{87BADF7E-18B1-410d-B11F-982073B519BE}"	""	"Kast"	"{7B0BF92A-BCCB-4c44-AAD0-92E4C9745E3A}"	"DtcDocument"	"indelingplan"	"Schematisch overzicht van de indeling van de kast volgens de aanwezige technieken in vooraanzicht."	""	"indelingplan"	"Schematisch overzicht van de indeling van de kast volgens de aanwezige technieken in vooraanzicht."	""	""	"true"	"https://wegenenverkeer-test.data.vlaanderen.be/ns/abstracten#"	"Kast.indelingsplan"	"http://www.w3.org/2002/07/owl#ObjectProperty"	"https://wegenenverkeer-test.data.vlaanderen.be/ns/abstracten#Kast"	"https://wegenenverkeer-test.data.vlaanderen.be/ns/implementatieelement#DtcDocument"	""	"1"	"1"
"attribute"	"OSLO-Abstracten"	"kastmateriaal"	"{38FE1FF3-769A-4ba5-99F7-0DE42F2A6C88}"	""	"Kast"	"{7B0BF92A-BCCB-4c44-AAD0-92E4C9745E3A}"	"KlAlgMateriaal"	"kastmateriaal"	"Materiaal waaruit de kast is opgebouwd."	""	"kastmateriaal"	"Materiaal waaruit de kast is opgebouwd."	""	""	"true"	"https://wegenenverkeer-test.data.vlaanderen.be/ns/abstracten#"	"Kast.kastmateriaal"	"http://www.w3.org/2002/07/owl#ObjectProperty"	"https://wegenenverkeer-test.data.vlaanderen.be/ns/abstracten#Kast"	"http://www.w3.org/2004/02/skos/core#Concept"	""	"1"	"1"
"attribute"	"OSLO-Abstracten"	"keuringsfrequentie"	"{B91CF293-8C05-408c-81DE-81D1D5077A2D}"	""	"Kast"	"{7B0BF92A-BCCB-4c44-AAD0-92E4C9745E3A}"	"KwantWrdInJaar"	"keuringsfrequentie"	"Frequentie (in jaar) waarmee de kast moet onderworpen worden aan een periodieke keuring door een externe dienst voor technische controle"	""	"keuringsfrequentie"	"Frequentie (in jaar) waarmee de kast moet onderworpen worden aan een periodieke keuring door een externe dienst voor technische controle"	""	""	"true"	"https://wegenenverkeer-test.data.vlaanderen.be/ns/abstracten#"	"Kast.keuringsfrequentie"	"http://www.w3.org/2002/07/owl#ObjectProperty"	"https://wegenenverkeer-test.data.vlaanderen.be/ns/abstracten#Kast"	"https://wegenenverkeer-test.data.vlaanderen.be/ns/implementatieelement#KwantWrdInJaar"	""	"1"	"1"
"attribute"	"OSLO-Implementatieelement"	"naam"	"{957690F7-3DA6-46ec-8E27-DB81BE4F5B05}"	""	"AIMNaamObject"	"{493E85C9-60EF-4aff-9C4C-5C45D59C0E64}"	"String"	"naam"	"De mensleesbare naam van een asset zoals dit bv. ook terug te vinden is op een etiket op het object zelf. De assetbeheerder kent deze naam toe of geeft de opdracht om deze toe te kennen. Indien een object een algemeen gangbare naam heeft zoals bv. bij een waterloop dan wordt deze gebruikt."	""	"naam"	"De mensleesbare naam van een asset zoals dit bv. ook terug te vinden is op een etiket op het object zelf. De assetbeheerder kent deze naam toe of geeft de opdracht om deze toe te kennen. Indien een object een algemeen gangbare naam heeft zoals bv. bij een waterloop dan wordt deze gebruikt."	""	""	"true"	"https://wegenenverkeer-test.data.vlaanderen.be/ns/implementatieelement#"	"AIMNaamObject.naam"	"http://www.w3.org/2002/07/owl#DatatypeProperty"	"https://wegenenverkeer-test.data.vlaanderen.be/ns/implementatieelement#AIMNaamObject"	"http://www.w3.org/2001/XMLSchema#string"	""	"1"	"1"
"attribute"	"OSLO-Implementatieelement"	"assetId"	"{426BDC14-4A42-41e5-8D2B-6D3306EDE1D7}"	""	"AIMObject"	"{9AF587FA-A5CF-4b0c-8A23-CF75F280760F}"	"DtcIdentificator"	"asset-id"	"Unieke identificatie van de asset zoals toegekend door de assetbeheerder of n.a.v. eerste aanlevering door de leverancier."	""	"asset-id"	"Unieke identificatie van de asset zoals toegekend door de assetbeheerder of n.a.v. eerste aanlevering door de leverancier."	""	""	"true"	"https://wegenenverkeer-test.data.vlaanderen.be/ns/implementatieelement#"	"AIMObject.assetId"	"http://www.w3.org/2002/07/owl#ObjectProperty"	"https://wegenenverkeer-test.data.vlaanderen.be/ns/implementatieelement#AIMObject"	"https://wegenenverkeer-test.data.vlaanderen.be/ns/implementatieelement#DtcIdentificator"	""	"1"	"1"
"attribute"	"OSLO-Implementatieelement"	"datumOprichtingObject"	"{49B5F640-E734-4f7f-9553-52862546331F}"	""	"AIMObject"	"{9AF587FA-A5CF-4b0c-8A23-CF75F280760F}"	"Date"	"datum oprichting object"	"Datum van de oprichting van het object."	""	"datum oprichting object"	"Datum van de oprichting van het object."	""	""	"true"	"https://wegenenverkeer-test.data.vlaanderen.be/ns/implementatieelement#"	"AIMObject.datumOprichtingObject"	"http://www.w3.org/2002/07/owl#DatatypeProperty"	"https://wegenenverkeer-test.data.vlaanderen.be/ns/implementatieelement#AIMObject"	"http://www.w3.org/2001/XMLSchema#date"	""	"1"	"1"
"attribute"	"OSLO-Implementatieelement"	"notitie"	"{8F2BB876-780D-41a7-AC77-157B19EEC3AA}"	""	"AIMObject"	"{9AF587FA-A5CF-4b0c-8A23-CF75F280760F}"	"String"	"notitie"	"Extra notitie voor het object."	""	"notitie"	"Extra notitie voor het object."	""	""	"true"	"https://wegenenverkeer-test.data.vlaanderen.be/ns/implementatieelement#"	"AIMObject.notitie"	"http://www.w3.org/2002/07/owl#DatatypeProperty"	"https://wegenenverkeer-test.data.vlaanderen.be/ns/implementatieelement#AIMObject"	"http://www.w3.org/2001/XMLSchema#string"	""	"1"	"1"
"attribute"	"OSLO-Implementatieelement"	"typeURI"	"{F1D41EB9-4958-45a8-80A4-EE5C3D657C3F}"	""	"AIMObject"	"{9AF587FA-A5CF-4b0c-8A23-CF75F280760F}"	"AnyURI"	"type URI"	"De URI van het object volgens https://www.w3.org/2001/XMLSchema#anyURI ."	""	"type URI"	"De URI van het object volgens https://www.w3.org/2001/XMLSchema#anyURI ."	""	""	"true"	"https://wegenenverkeer-test.data.vlaanderen.be/ns/implementatieelement#"	"AIMObject.typeURI"	"http://www.w3.org/2002/07/owl#ObjectProperty"	"https://wegenenverkeer-test.data.vlaanderen.be/ns/implementatieelement#AIMObject"	"http://www.w3.org/2001/XMLSchema#anyURI"	""	"1"	"1"
"attribute"	"OSLO-Implementatieelement"	"toestand"	"{19481D58-95AE-41f1-8BE8-F67BA589517E}"	""	"AIMToestand"	"{9418C0E6-C48A-44df-ABF7-C6E3B7FF5FC4}"	"KlAIMToestand"	"toestand"	"Vat de levenscyclus van het object op een bepaald moment."	"TODO"	"toestand"	"Vat de levenscyclus van het object op een bepaald moment."	""	""	"true"	"https://wegenenverkeer-test.data.vlaanderen.be/ns/implementatieelement#"	"AIMToestand.toestand"	"http://www.w3.org/2002/07/owl#ObjectProperty"	"https://wegenenverkeer-test.data.vlaanderen.be/ns/implementatieelement#AIMToestand"	"http://www.w3.org/2004/02/skos/core#Concept"	""	"1"	"1"
"attribute"	"OSLO-Implementatieelement"	"isActief"	"{3C54C181-0D46-4196-9123-F908FE26FFE1}"	""	"AIMStatus"	"{75C21F07-BAE5-412e-AD87-520DD947D510}"	"Boolean"	"status"	"Geeft aan of het object actief kan gebruikt worden of (zacht) verwijderd is uit het asset beheer systeem."	"De status die hier bedoeld wordt valt samen met de status van het record voor de asset in het asset mangement systeem. De staat waarin de asset zich bevindt, de fase in een levenscyclus en de operationele status zijn andere types die in aparte attributen bijgehouden worden."	"status"	"Geeft aan of het object actief kan gebruikt worden of (zacht) verwijderd is uit het asset beheer systeem."	""	""	"true"	"https://wegenenverkeer-test.data.vlaanderen.be/ns/implementatieelement#"	"AIMStatus.isActief"	"http://www.w3.org/2002/07/owl#DatatypeProperty"	"https://wegenenverkeer-test.data.vlaanderen.be/ns/implementatieelement#AIMStatus"	"http://www.w3.org/2001/XMLSchema#boolean"	""	"1"	"1"
"attribute"	"OSLO-Abstracten"	"aantalTelwerken"	"{891E5C97-D55F-48af-AA9C-9524C93EA0E0}"	""	"Energiemeter"	"{5048C648-9052-401c-A2AE-F176E589517C}"	"Integer"	"aantal telwerken"	"Het aantal telwerken dat de energiemeter bevat. 1 bij enkelvoudige meting, 2 bij een dag- en nacht-meter."	""	"aantal telwerken"	"Het aantal telwerken dat de energiemeter bevat. 1 bij enkelvoudige meting, 2 bij een dag- en nacht-meter."	""	""	"true"	"https://wegenenverkeer-test.data.vlaanderen.be/ns/abstracten#"	"Energiemeter.aantalTelwerken"	"http://www.w3.org/2002/07/owl#DatatypeProperty"	"https://wegenenverkeer-test.data.vlaanderen.be/ns/abstracten#Energiemeter"	"http://www.w3.org/2001/XMLSchema#integer"	""	"1"	"1"
"attribute"	"OSLO-Abstracten"	"meternummer"	"{59728C07-AC5E-4f5f-A76F-E64F5C3CC91A}"	""	"Energiemeter"	"{5048C648-9052-401c-A2AE-F176E589517C}"	"String"	"meternummer"	"Het serienummer (nummer van het fabrikaat) op de meter"	""	"meternummer"	"Het serienummer (nummer van het fabrikaat) op de meter"	""	""	"true"	"https://wegenenverkeer-test.data.vlaanderen.be/ns/abstracten#"	"Energiemeter.meternummer"	"http://www.w3.org/2002/07/owl#DatatypeProperty"	"https://wegenenverkeer-test.data.vlaanderen.be/ns/abstracten#Energiemeter"	"http://www.w3.org/2001/XMLSchema#string"	""	"1"	"1"
"attribute"	"OSLO-Abstracten"	"metertype"	"{35079D11-51E9-475a-807D-272028A3863C}"	""	"Energiemeter"	"{5048C648-9052-401c-A2AE-F176E589517C}"	"KlEnergiemeterMetertype"	"metertype"	"Type meter (mechanisch, elektronisch)"	""	"metertype"	"Type meter (mechanisch, elektronisch)"	""	""	"true"	"https://wegenenverkeer-test.data.vlaanderen.be/ns/abstracten#"	"Energiemeter.metertype"	"http://www.w3.org/2002/07/owl#ObjectProperty"	"https://wegenenverkeer-test.data.vlaanderen.be/ns/abstracten#Energiemeter"	"http://www.w3.org/2004/02/skos/core#Concept"	""	"1"	"1"
"attribute"	"OSLO-Onderdeel"	"beschermlaag"	"{1AFDCB37-9585-484d-9243-A3793AAA7223}"	""	"Lichtmast"	"{DD864976-7678-4d31-B3F0-61BEFD49D6B3}"	"KlDraagConstrBeschermlaag"	"beschermlaag"	"Beschermlaag van de lichtmast"	""	"beschermlaag"	"Beschermlaag van de lichtmast"	""	""	"true"	"https://wegenenverkeer-test.data.vlaanderen.be/ns/onderdeel#"	"Lichtmast.beschermlaag"	"http://www.w3.org/2002/07/owl#ObjectProperty"	"https://wegenenverkeer-test.data.vlaanderen.be/ns/onderdeel#Lichtmast"	"http://www.w3.org/2004/02/skos/core#Concept"	""	"1"	"1"
"attribute"	"OSLO-Onderdeel"	"dwarsdoorsnede"	"{17007874-458E-4a64-BF98-D75F0B259A06}"	""	"Lichtmast"	"{DD864976-7678-4d31-B3F0-61BEFD49D6B3}"	"KlDraagconstructieDwarsdoorsnede"	"dwarsdoorsnede"	"De vorm van de dwarsdoorsnede van de lichtmast"	""	"dwarsdoorsnede"	"De vorm van de dwarsdoorsnede van de lichtmast"	""	""	"true"	"https://wegenenverkeer-test.data.vlaanderen.be/ns/onderdeel#"	"Lichtmast.dwarsdoorsnede"	"http://www.w3.org/2002/07/owl#ObjectProperty"	"https://wegenenverkeer-test.data.vlaanderen.be/ns/onderdeel#Lichtmast"	"http://www.w3.org/2004/02/skos/core#Concept"	""	"1"	"1"
"attribute"	"OSLO-Onderdeel"	"heeftStopcontact"	"{004CBB29-5973-4320-BD6E-5923416927D6}"	""	"Lichtmast"	"{DD864976-7678-4d31-B3F0-61BEFD49D6B3}"	"Boolean"	"heeft stopcontact aanwezig"	"Is er een stopcontact aanwezig op de lichtmast?"	""	"heeft stopcontact aanwezig"	"Is er een stopcontact aanwezig op de lichtmast?"	""	""	"true"	"https://wegenenverkeer-test.data.vlaanderen.be/ns/onderdeel#"	"Lichtmast.heeftStopcontact"	"http://www.w3.org/2002/07/owl#DatatypeProperty"	"https://wegenenverkeer-test.data.vlaanderen.be/ns/onderdeel#Lichtmast"	"http://www.w3.org/2001/XMLSchema#boolean"	""	"1"	"1"
"attribute"	"OSLO-Onderdeel"	"kleur"	"{68188F63-57C2-4c8b-B689-FFDE132B6D6C}"	""	"Lichtmast"	"{DD864976-7678-4d31-B3F0-61BEFD49D6B3}"	"DteKleurRAL"	"kleur"	"RAL kleur van de lichtmast"	""	"kleur"	"RAL kleur van de lichtmast"	""	""	"true"	"https://wegenenverkeer-test.data.vlaanderen.be/ns/onderdeel#"	"Lichtmast.kleur"	"http://www.w3.org/2002/07/owl#ObjectProperty"	"https://wegenenverkeer-test.data.vlaanderen.be/ns/onderdeel#Lichtmast"	"https://wegenenverkeer-test.data.vlaanderen.be/ns/implementatieelement#DteKleurRAL"	""	"1"	"1"
"attribute"	"OSLO-Onderdeel"	"leverancier"	"{C564F12F-0688-4d96-8889-C9696A98F9FC}"	""	"Lichtmast"	"{DD864976-7678-4d31-B3F0-61BEFD49D6B3}"	"KlLichtmastLeverancier"	"leverancier"	"Leverancier van de lichtmast"	""	"leverancier"	"Leverancier van de lichtmast"	""	""	"true"	"https://wegenenverkeer-test.data.vlaanderen.be/ns/onderdeel#"	"Lichtmast.leverancier"	"http://www.w3.org/2002/07/owl#ObjectProperty"	"https://wegenenverkeer-test.data.vlaanderen.be/ns/onderdeel#Lichtmast"	"http://www.w3.org/2004/02/skos/core#Concept"	""	"1"	"1"
"attribute"	"OSLO-Onderdeel"	"masthoogte"	"{6264168C-926B-42e3-B0D6-3A732548480D}"	""	"Lichtmast"	"{DD864976-7678-4d31-B3F0-61BEFD49D6B3}"	"DtuLichtmastMasthoogte"	"masthoogte"	"Hoogte (in meter) van de lichtmast"	""	"masthoogte"	"Hoogte (in meter) van de lichtmast"	""	""	"true"	"https://wegenenverkeer-test.data.vlaanderen.be/ns/onderdeel#"	"Lichtmast.masthoogte"	"http://www.w3.org/2002/07/owl#ObjectProperty"	"https://wegenenverkeer-test.data.vlaanderen.be/ns/onderdeel#Lichtmast"	"https://wegenenverkeer-test.data.vlaanderen.be/ns/onderdeel#DtuLichtmastMasthoogte"	""	"1"	"1"
"attribute"	"OSLO-Onderdeel"	"masttype"	"{BB6A90F4-3D82-464b-B7B9-BD0ADED27D17}"	""	"Lichtmast"	"{DD864976-7678-4d31-B3F0-61BEFD49D6B3}"	"KlLichtmastMasttype"	"masttype"	"Type mast bv. rechte metalen paal, rechte metalen paal op voet, kreukelpaal met arm,..."	""	"masttype"	"Type mast bv. rechte metalen paal, rechte metalen paal op voet, kreukelpaal met arm,..."	""	""	"true"	"https://wegenenverkeer-test.data.vlaanderen.be/ns/onderdeel#"	"Lichtmast.masttype"	"http://www.w3.org/2002/07/owl#ObjectProperty"	"https://wegenenverkeer-test.data.vlaanderen.be/ns/onderdeel#Lichtmast"	"http://www.w3.org/2004/02/skos/core#Concept"	""	"1"	"1"
"attribute"	"OSLO-Onderdeel"	"normeringBotsvriendelijk"	"{EAFFB441-7EDA-4556-B5FE-801DC5B84CAB}"	""	"Lichtmast"	"{DD864976-7678-4d31-B3F0-61BEFD49D6B3}"	"KlLichtmastBotsNormering"	"normering botsvriendelijk"	"Categorie in normering botsvriendelijkheid"	""	"normering botsvriendelijk"	"Categorie in normering botsvriendelijkheid"	""	""	"true"	"https://wegenenverkeer-test.data.vlaanderen.be/ns/onderdeel#"	"Lichtmast.normeringBotsvriendelijk"	"http://www.w3.org/2002/07/owl#ObjectProperty"	"https://wegenenverkeer-test.data.vlaanderen.be/ns/onderdeel#Lichtmast"	"http://www.w3.org/2004/02/skos/core#Concept"	""	"1"	"1"
"attribute"	"OSLO-Onderdeel"	"specialeUitvoeringswijze"	"{5CA7DAF3-D5CC-47aa-BF26-F283F7DFD3F1}"	""	"Lichtmast"	"{DD864976-7678-4d31-B3F0-61BEFD49D6B3}"	"String"	"speciale uitvoeringswijze"	"Omschrijving van de speciale uitvoeringswijze van de lichtmast indien van toepassing"	""	"speciale uitvoeringswijze"	"Omschrijving van de speciale uitvoeringswijze van de lichtmast indien van toepassing"	""	""	"true"	"https://wegenenverkeer-test.data.vlaanderen.be/ns/onderdeel#"	"Lichtmast.specialeUitvoeringswijze"	"http://www.w3.org/2002/07/owl#DatatypeProperty"	"https://wegenenverkeer-test.data.vlaanderen.be/ns/onderdeel#Lichtmast"	"http://www.w3.org/2001/XMLSchema#string"	""	"1"	"1"
"attribute"	"OSLO-Implementatieelement"	"bestandsnaam"	"{79468482-E905-4988-9EB8-4A8E1A9CBC48}"	""	"DtcDocument"	"{57E2B78E-3BA6-4465-85AB-B3C47F14D47F}"	"String"	"bestandsnaam"	"De naam van het Document inclusief de bestandsextensie, van de naam gescheiden door een punt."	""	"bestandsnaam"	"De naam van het Document inclusief de bestandsextensie, van de naam gescheiden door een punt."	""	""	"true"	"https://wegenenverkeer-test.data.vlaanderen.be/ns/implementatieelement#"	"DtcDocument.bestandsnaam"	"http://www.w3.org/2002/07/owl#DatatypeProperty"	"https://wegenenverkeer-test.data.vlaanderen.be/ns/implementatieelement#DtcDocument"	"http://www.w3.org/2001/XMLSchema#string"	""	"1"	"1"
"attribute"	"OSLO-Implementatieelement"	"mimeType"	"{17338305-B334-4995-AC8A-107D37FE1F03}"	""	"DtcDocument"	"{57E2B78E-3BA6-4465-85AB-B3C47F14D47F}"	"KlAlgMimeType"	"mime-type"	"Het MIME type van het document."	""	"mime-type"	"Het MIME type van het document."	""	""	"true"	"https://wegenenverkeer-test.data.vlaanderen.be/ns/implementatieelement#"	"DtcDocument.mimeType"	"http://www.w3.org/2002/07/owl#ObjectProperty"	"https://wegenenverkeer-test.data.vlaanderen.be/ns/implementatieelement#DtcDocument"	"http://www.w3.org/2004/02/skos/core#Concept"	""	"1"	"1"
"attribute"	"OSLO-Implementatieelement"	"omschrijving"	"{1ED3EAF0-752E-4f41-BCEB-03535C8D9B21}"	""	"DtcDocument"	"{57E2B78E-3BA6-4465-85AB-B3C47F14D47F}"	"DteTekstblok"	"omschrijving"	"Een korte toelichting over waar het document juist voor dient."	""	"omschrijving"	"Een korte toelichting over waar het document juist voor dient."	""	""	"true"	"https://wegenenverkeer-test.data.vlaanderen.be/ns/implementatieelement#"	"DtcDocument.omschrijving"	"http://www.w3.org/2002/07/owl#ObjectProperty"	"https://wegenenverkeer-test.data.vlaanderen.be/ns/implementatieelement#DtcDocument"	"https://wegenenverkeer-test.data.vlaanderen.be/ns/implementatieelement#DteTekstblok"	""	"1"	"1"
