"EA-Type"	"EA-Package"	"EA-Name"	"EA-GUID"	"EA-Parent"	"EA-Domain"	"EA-Domain-GUID"	"EA-Range"	"label"	"definition"	"usage"	"ap-label-nl"	"ap-definition-nl"	"ap-usageNote-nl"	"ap-codelist"	"external term"	"namespace"	"localname"	"type"	"domain"	"range"	"parent"	"min card"	"max card"
"Package"	""	"OSLO-Verlichtingsinstallatie"	"{FEDB01A9-0146-4ca9-9D6F-439A5AD05C6C}"	""	""	""	""	""	""	""	""	""	""	""	""	"http://"	"fixme.com"	"http://www.w3.org/2002/07/owl#Ontology"	""	""	""	""	""
"CLASS"	"OSLO-Onderdeel"	"Wegkantkast"	"{C4A10C16-A3FE-4944-BE77-573632E47470}"	""	""	""	""	"Wegkantkast"	"Behuizing in de vorm van kast typisch gebruikt buiten,langs de kant van de weg."	""	"Wegkantkast"	"Behuizing in de vorm van kast typisch gebruikt buiten,langs de kant van de weg."	""	""	"true"	"https://wegenenverkeer-test.data.vlaanderen.be/ns/onderdeel#"	"Wegkantkast"	"http://www.w3.org/2000/01/rdf-schema#Class"	""	""	"https://wegenenverkeer-test.data.vlaanderen.be/ns/abstracten#Buitenkast"	""	""
"CLASS"	"OSLO-Onderdeel"	"PLC"	"{A766F000-7F48-4e5f-AFD7-ADC4083DA0B3}"	"Controller"	""	""	""	"PLC"	"TODO"	""	"PLC"	"TODO"	""	""	"true"	"https://wegenenverkeer-test.data.vlaanderen.be/ns/onderdeel#"	"PLC"	"http://www.w3.org/2000/01/rdf-schema#Class"	""	""	"https://wegenenverkeer-test.data.vlaanderen.be/ns/abstracten#Controller"	""	""
"CLASS"	"OSLO-Onderdeel"	"IOKaart"	"{697222B8-23E2-415d-9CC8-3B530F9D496D}"	""	""	""	""	"IO-Kaart"	"TODO"	""	"IO-Kaart"	"TODO"	""	""	"true"	"https://wegenenverkeer-test.data.vlaanderen.be/ns/onderdeel#"	"IOKaart"	"http://www.w3.org/2000/01/rdf-schema#Class"	""	""	"https://wegenenverkeer-test.data.vlaanderen.be/ns/implementatieelement#AIMObject"	""	""
"CLASS"	"OSLO-Onderdeel"	"Netwerkpoort"	"{E9E83B11-698E-46a5-B104-F3A72B9A1A08}"	""	""	""	""	"Netwerkpoort"	"Is de ingang van het toestel samen met component die erop zit bv. SFP,XFP,..."	""	"Netwerkpoort"	"Is de ingang van het toestel samen met component die erop zit bv. SFP,XFP,..."	""	""	"true"	"https://wegenenverkeer-test.data.vlaanderen.be/ns/onderdeel#"	"Netwerkpoort"	"http://www.w3.org/2000/01/rdf-schema#Class"	""	""	"https://wegenenverkeer-test.data.vlaanderen.be/ns/implementatieelement#AIMNaamObject"	""	""
"CLASS"	"OSLO-Onderdeel"	"BrandwerendeConstructie"	"{3E46C0DD-6F6B-45f4-928F-EF1976FBCA9A}"	""	""	""	""	"Brandwerende constructie"	"TODO"	""	"Brandwerende constructie"	"TODO"	""	""	"true"	"https://wegenenverkeer-test.data.vlaanderen.be/ns/onderdeel#"	"BrandwerendeConstructie"	"http://www.w3.org/2000/01/rdf-schema#Class"	""	""	""	""	""
"CLASS"	"OSLO-Abstracten"	"FirmwareObject"	"{42A51844-99EB-461b-AA94-A97E9861BC5A}"	""	""	""	""	"Firmware object"	"Abstracte voor de firmware van het object."	""	"Firmware object"	"Abstracte voor de firmware van het object."	""	""	"true"	"https://wegenenverkeer-test.data.vlaanderen.be/ns/abstracten#"	"FirmwareObject"	"http://www.w3.org/2000/01/rdf-schema#Class"	""	""	""	""	""
"CLASS"	"OSLO-Abstracten"	"Communicatieapparatuur"	"{940F81E3-D8C8-4163-B8C1-35BA08372B2F}"	""	""	""	""	"Communicatieapparatuur"	"Abstracte voor alle benodigde apparatuur voor het ontvangen en verzenden van signalen."	""	"Communicatieapparatuur"	"Abstracte voor alle benodigde apparatuur voor het ontvangen en verzenden van signalen."	""	""	"true"	"https://wegenenverkeer-test.data.vlaanderen.be/ns/abstracten#"	"Communicatieapparatuur"	"http://www.w3.org/2000/01/rdf-schema#Class"	""	""	"https://wegenenverkeer-test.data.vlaanderen.be/ns/implementatieelement#AIMNaamObject"	""	""
"CLASS"	"OSLO-Abstracten"	"VerlichtingstoestelConnector"	"{1D25AE7C-31D7-4d39-8F64-E3D64D6B772B}"	""	""	""	""	"Verlichtingstoestel connector"	"TODO"	""	"Verlichtingstoestel connector"	"TODO"	""	""	"true"	"https://wegenenverkeer-test.data.vlaanderen.be/ns/abstracten#"	"VerlichtingstoestelConnector"	"http://www.w3.org/2000/01/rdf-schema#Class"	""	""	""	""	""
"CLASS"	"OSLO-Abstracten"	"Controller"	"{F003906F-FAA7-4c1f-A226-64B9E1777A76}"	""	""	""	""	"Controller"	"Abstracte voor allerlei types van controllers."	""	"Controller"	"Abstracte voor allerlei types van controllers."	""	""	"true"	"https://wegenenverkeer-test.data.vlaanderen.be/ns/abstracten#"	"Controller"	"http://www.w3.org/2000/01/rdf-schema#Class"	""	""	"https://wegenenverkeer-test.data.vlaanderen.be/ns/implementatieelement#AIMNaamObject"	""	""
"CLASS"	"OSLO-Onderdeel"	"EnergiemeterAWV"	"{735D3C4C-7294-4315-B62A-610E812B801D}"	""	""	""	""	"Energiemeter AWV"	"Toestel voor multifunctionele stroom- en spanningsmetingen en logging, die via een van de courante standaardkoppelvlakken (Euridis, RS485, Modbus, ...) wordt aangesloten om lokaal of op afstand te kunnen uitlezen en zodoende het energieverbruik te kunnen opvolgen"	""	"Energiemeter AWV"	"Toestel voor multifunctionele stroom- en spanningsmetingen en logging, die via een van de courante standaardkoppelvlakken (Euridis, RS485, Modbus, ...) wordt aangesloten om lokaal of op afstand te kunnen uitlezen en zodoende het energieverbruik te kunnen opvolgen"	""	""	"true"	"https://wegenenverkeer-test.data.vlaanderen.be/ns/onderdeel#"	"EnergiemeterAWV"	"http://www.w3.org/2000/01/rdf-schema#Class"	""	""	"https://wegenenverkeer-test.data.vlaanderen.be/ns/abstracten#Energiemeter"	""	""
"CLASS"	"OSLO-Onderdeel"	"Netwerkelement"	"{7FE6B342-6295-44cd-81CD-3EF9B3521944}"	""	""	""	""	"Netwerkelement"	"TODO"	""	"Netwerkelement"	"TODO"	""	""	"true"	"https://wegenenverkeer-test.data.vlaanderen.be/ns/onderdeel#"	"Netwerkelement"	"http://www.w3.org/2000/01/rdf-schema#Class"	""	""	"https://wegenenverkeer-test.data.vlaanderen.be/ns/implementatieelement#AIMNaamObject"	""	""
"CLASS"	"OSLO-Onderdeel"	"Klimatisatie"	"{6A1DA235-13A6-45ea-9758-E5BA6074D4FF}"	""	""	""	""	"Klimatisatie"	"Component waarmee de temperatuur en klimaat geregeld wordt van het objecttype waaraan het bevestigd is zoals een behuizing of ruimte."	""	"Klimatisatie"	"Component waarmee de temperatuur en klimaat geregeld wordt van het objecttype waaraan het bevestigd is zoals een behuizing of ruimte."	""	""	"true"	"https://wegenenverkeer-test.data.vlaanderen.be/ns/onderdeel#"	"Klimatisatie"	"http://www.w3.org/2000/01/rdf-schema#Class"	""	""	"https://wegenenverkeer-test.data.vlaanderen.be/ns/implementatieelement#AIMNaamObject"	""	""
"CLASS"	"OSLO-Onderdeel"	"Toegangscontrole"	"{2612BC0E-EBB9-4d75-80C5-07FC2E59494E}"	""	""	""	""	"Toegangscontrole"	"Component voor controle van de toegang tot een ruimte of behuizing."	""	"Toegangscontrole"	"Component voor controle van de toegang tot een ruimte of behuizing."	""	""	"true"	"https://wegenenverkeer-test.data.vlaanderen.be/ns/onderdeel#"	"Toegangscontrole"	"http://www.w3.org/2000/01/rdf-schema#Class"	""	""	"https://wegenenverkeer-test.data.vlaanderen.be/ns/implementatieelement#AIMNaamObject"	""	""
"CLASS"	"OSLO-Abstracten"	"Behuizing"	"{0EED355E-1562-4941-BAA6-9A653E054A32}"	""	""	""	""	"Behuizing"	"Abstracte voor alle types van behuizing voor het beschermen van technieken."	""	"Behuizing"	"Abstracte voor alle types van behuizing voor het beschermen van technieken."	""	""	"true"	"https://wegenenverkeer-test.data.vlaanderen.be/ns/abstracten#"	"Behuizing"	"http://www.w3.org/2000/01/rdf-schema#Class"	""	""	"https://wegenenverkeer-test.data.vlaanderen.be/ns/implementatieelement#AIMNaamObject"	""	""
"CLASS"	"OSLO-Onderdeel"	"Antenne"	"{39891083-9377-4145-A0CE-7DBCBBB4256B}"	"Communicatieapparatuur"	""	""	""	"Antenne"	"Toestel verbonden met een zender of ontvanger ten behoeve van het opvangen of verspreiden van signalen"	""	"Antenne"	"Toestel verbonden met een zender of ontvanger ten behoeve van het opvangen of verspreiden van signalen"	""	""	"true"	"https://wegenenverkeer-test.data.vlaanderen.be/ns/onderdeel#"	"Antenne"	"http://www.w3.org/2000/01/rdf-schema#Class"	""	""	"https://wegenenverkeer-test.data.vlaanderen.be/ns/abstracten#Communicatieapparatuur, https://wegenenverkeer-test.data.vlaanderen.be/ns/abstracten#TunnelExterneComponenten"	""	""
"CLASS"	"OSLO-Abstracten"	"SoftwareToegang"	"{DA30D071-AD81-4dac-8864-4D650F0EBDD0}"	""	""	""	""	"Software toegang"	"Een abstracte waarmee een object kan connecteren naar software,al dan niet door gebruik te maken van de logische poort."	""	"Software toegang"	"Een abstracte waarmee een object kan connecteren naar software,al dan niet door gebruik te maken van de logische poort."	""	""	"true"	"https://wegenenverkeer-test.data.vlaanderen.be/ns/abstracten#"	"SoftwareToegang"	"http://www.w3.org/2000/01/rdf-schema#Class"	""	""	"https://wegenenverkeer-test.data.vlaanderen.be/ns/implementatieelement#AIMNaamObject"	""	""
"CLASS"	"OSLO-Onderdeel"	"Cabinecontroller"	"{C22B8FB4-9107-4d5f-85BE-AD9C2D1BB7D5}"	"Controller"	""	""	""	"Cabinecontroller"	"Controller die zorgt voor de bewaking en bediening van de geschakelde verlichtingsaftakkingen en voor bewaking van de voedingsinstallatie"	""	"Cabinecontroller"	"Controller die zorgt voor de bewaking en bediening van de geschakelde verlichtingsaftakkingen en voor bewaking van de voedingsinstallatie"	""	""	"true"	"https://wegenenverkeer-test.data.vlaanderen.be/ns/onderdeel#"	"Cabinecontroller"	"http://www.w3.org/2000/01/rdf-schema#Class"	""	""	"https://wegenenverkeer-test.data.vlaanderen.be/ns/abstracten#Controller"	""	""
"CLASS"	"OSLO-Onderdeel"	"Laagspanningsbord"	"{97C228C6-A049-45df-9052-085F53F1C2CB}"	""	""	""	""	"Laagspanningsbord"	"Verzameling van alle elektrische componenten nodig voor de voeding en sturing van applicaties die erop aangesloten zijn. Omvat onder andere automaten,klemmenblokken,..."	""	"Laagspanningsbord"	"Verzameling van alle elektrische componenten nodig voor de voeding en sturing van applicaties die erop aangesloten zijn. Omvat onder andere automaten,klemmenblokken,..."	""	""	"true"	"https://wegenenverkeer-test.data.vlaanderen.be/ns/onderdeel#"	"Laagspanningsbord"	"http://www.w3.org/2000/01/rdf-schema#Class"	""	""	"https://wegenenverkeer-test.data.vlaanderen.be/ns/implementatieelement#AIMNaamObject"	""	""
"CLASS"	"OSLO-Onderdeel"	"Hoofdschakelaar"	"{DC3490B7-7103-49d3-8F92-410EA8925D67}"	""	""	""	""	"Hoofdschakelaar"	"Algemene automatische zekering waarmee de volledige installatie buiten spanning kan worden gesteld"	""	"Hoofdschakelaar"	"Algemene automatische zekering waarmee de volledige installatie buiten spanning kan worden gesteld"	""	""	"true"	"https://wegenenverkeer-test.data.vlaanderen.be/ns/onderdeel#"	"Hoofdschakelaar"	"http://www.w3.org/2000/01/rdf-schema#Class"	""	""	"https://wegenenverkeer-test.data.vlaanderen.be/ns/implementatieelement#AIMNaamObject"	""	""
"CLASS"	"OSLO-Onderdeel"	"Aftakking"	"{7819AE7D-4273-4b1b-BDBB-5BCF83F02FA3}"	""	""	""	""	"Aftakking"	"Groep van stroomkringen specifiek bedoeld voor de aansturing van wegverlichting.
In het typeschema autosnelwegen worden er standaard 4 aftakkingen voorzien: middenberm (hoofdrijbaan),op- en afritten + signalisatie,gewestweg,parking"	""	"Aftakking"	"Groep van stroomkringen specifiek bedoeld voor de aansturing van wegverlichting.
In het typeschema autosnelwegen worden er standaard 4 aftakkingen voorzien: middenberm (hoofdrijbaan),op- en afritten + signalisatie,gewestweg,parking"	""	""	"true"	"https://wegenenverkeer-test.data.vlaanderen.be/ns/onderdeel#"	"Aftakking"	"http://www.w3.org/2000/01/rdf-schema#Class"	""	""	"https://wegenenverkeer-test.data.vlaanderen.be/ns/implementatieelement#AIMNaamObject"	""	""
"CLASS"	"OSLO-Onderdeel"	"Segmentcontroller"	"{7A0D28B1-039F-4eae-83E7-2DA33E231D81}"	"Controller"	""	""	""	"Segmentcontroller"	"Controller die zorgt voor de bewaking en bediening van verlichtingssegmenten per paal en aldus zorgt voor de communicatie tussen de cabine en de armatuurcontrollers."	""	"Segmentcontroller"	"Controller die zorgt voor de bewaking en bediening van verlichtingssegmenten per paal en aldus zorgt voor de communicatie tussen de cabine en de armatuurcontrollers."	""	""	"true"	"https://wegenenverkeer-test.data.vlaanderen.be/ns/onderdeel#"	"Segmentcontroller"	"http://www.w3.org/2000/01/rdf-schema#Class"	""	""	"https://wegenenverkeer-test.data.vlaanderen.be/ns/abstracten#Controller"	""	""
"CLASS"	"OSLO-Onderdeel"	"WVOpvoertransformator"	"{0CFA7544-CCC7-4218-92C0-9DBA21CFE1EA}"	""	""	""	""	"WV opvoertransformator"	"Toestel voor het opvoeren van de spanning,bij wegverlichtingsinstallaties gebruikt om de spanning te verhogen indien deze te laag geworden is wegens de kabelverliezen"	""	"WV opvoertransformator"	"Toestel voor het opvoeren van de spanning,bij wegverlichtingsinstallaties gebruikt om de spanning te verhogen indien deze te laag geworden is wegens de kabelverliezen"	""	""	"true"	"https://wegenenverkeer-test.data.vlaanderen.be/ns/onderdeel#"	"WVOpvoertransformator"	"http://www.w3.org/2000/01/rdf-schema#Class"	""	""	"https://wegenenverkeer-test.data.vlaanderen.be/ns/implementatieelement#AIMObject"	""	""
"CLASS"	"OSLO-Onderdeel"	"LEDDriver"	"{2A40C71B-9AFC-4347-A714-B655DEA3B5A8}"	""	""	""	""	"LED-driver"	"Een LED-driver is een elektronisch toestel dat de stroomtoevoer naar de LED's dimensioneert om de goede werking te verzekeren. Via de instelparameters van de driver kan uiteindelijk de lichtsterkte van de LED verlichting aangepast worden"	""	"LED-driver"	"Een LED-driver is een elektronisch toestel dat de stroomtoevoer naar de LED's dimensioneert om de goede werking te verzekeren. Via de instelparameters van de driver kan uiteindelijk de lichtsterkte van de LED verlichting aangepast worden"	""	""	"true"	"https://wegenenverkeer-test.data.vlaanderen.be/ns/onderdeel#"	"LEDDriver"	"http://www.w3.org/2000/01/rdf-schema#Class"	""	""	"https://wegenenverkeer-test.data.vlaanderen.be/ns/implementatieelement#AIMObject"	""	""
"CLASS"	"OSLO-Onderdeel"	"Voorschakelapparaat"	"{3B26438D-6C96-474e-9A19-016C4DA6CF92}"	""	""	""	""	"Voorschakelapparaat"	"Het voorschakelapparaat van een ontladingslamp in ruime zin omvat alle componenten die in serie of in parallel met de lamp geschakeld worden om haar goede werking te verzekeren. Ze bestaat in 2 uitvoeringsvormen elektromagnetische en elektronische.
Voor de elektromagnetische bestaat deze uit 
*de ballast: een elektromagnetische eenheid, die d.m.v. passieve componenten zoals een spoel of een condensator en/of actieve componenten, hoofdzakelijk dient om de lampstroom te beperken tot de vereiste waarde;
*een starter of een ontsteker: levert de vereiste ontsteekspanning;
*een condensator:is een component die de faseverschuiving tussen de stroom en spanning tot een aanvaardbare waarde terugbrengt en op die manier de arbeidsfactor verbetert;
*de eventuele externe beveiligingen;
*de onderlinge bekabeling."	""	"Voorschakelapparaat"	"Het voorschakelapparaat van een ontladingslamp in ruime zin omvat alle componenten die in serie of in parallel met de lamp geschakeld worden om haar goede werking te verzekeren. Ze bestaat in 2 uitvoeringsvormen elektromagnetische en elektronische.
Voor de elektromagnetische bestaat deze uit 
*de ballast: een elektromagnetische eenheid, die d.m.v. passieve componenten zoals een spoel of een condensator en/of actieve componenten, hoofdzakelijk dient om de lampstroom te beperken tot de vereiste waarde;
*een starter of een ontsteker: levert de vereiste ontsteekspanning;
*een condensator:is een component die de faseverschuiving tussen de stroom en spanning tot een aanvaardbare waarde terugbrengt en op die manier de arbeidsfactor verbetert;
*de eventuele externe beveiligingen;
*de onderlinge bekabeling."	""	""	"true"	"https://wegenenverkeer-test.data.vlaanderen.be/ns/onderdeel#"	"Voorschakelapparaat"	"http://www.w3.org/2000/01/rdf-schema#Class"	""	""	"https://wegenenverkeer-test.data.vlaanderen.be/ns/implementatieelement#AIMObject"	""	""
"CLASS"	"OSLO-Onderdeel"	"Armatuurcontroller"	"{2A45FA83-EA09-47aa-8090-56DBA1C6A68F}"	"Communicatieapparatuur, FirmwareObject"	""	""	""	"Armatuurcontroller"	"Controller die op het verlichtingstoestel wordt gemonteerd en die één verlichtingstoestel aanstuurt"	""	"Armatuurcontroller"	"Controller die op het verlichtingstoestel wordt gemonteerd en die één verlichtingstoestel aanstuurt"	""	""	"true"	"https://wegenenverkeer-test.data.vlaanderen.be/ns/onderdeel#"	"Armatuurcontroller"	"http://www.w3.org/2000/01/rdf-schema#Class"	""	""	"https://wegenenverkeer-test.data.vlaanderen.be/ns/abstracten#Communicatieapparatuur, https://wegenenverkeer-test.data.vlaanderen.be/ns/abstracten#FirmwareObject"	""	""
"CLASS"	"OSLO-Onderdeel"	"Stroomkring"	"{AB359893-60D0-4290-BC6E-75E51391847D}"	""	""	""	""	"Stroomkring"	"Ook wel vertrek of vertrekkende kabel genoemd. Afgezekerde elektrische geleiders waarmee de applicaties voorzien worden van de nodige voeding"	""	"Stroomkring"	"Ook wel vertrek of vertrekkende kabel genoemd. Afgezekerde elektrische geleiders waarmee de applicaties voorzien worden van de nodige voeding"	""	""	"true"	"https://wegenenverkeer-test.data.vlaanderen.be/ns/onderdeel#"	"Stroomkring"	"http://www.w3.org/2000/01/rdf-schema#Class"	""	""	"https://wegenenverkeer-test.data.vlaanderen.be/ns/implementatieelement#AIMNaamObject"	""	""
"CLASS"	"OSLO-Onderdeel"	"Binnenverlichtingstoestel"	"{7EDBC5F3-0196-416c-AE32-8F5269434783}"	""	""	""	""	"Binnenverlichtingstoestel"	"TODO"	""	"Binnenverlichtingstoestel"	"TODO"	""	""	"true"	"https://wegenenverkeer-test.data.vlaanderen.be/ns/onderdeel#"	"Binnenverlichtingstoestel"	"http://www.w3.org/2000/01/rdf-schema#Class"	""	""	""	""	""
"CLASS"	"OSLO-Onderdeel"	"WVLichtmast"	"{D2E033EA-E108-49a8-96FA-DDD5C72D6B77}"	"WVDraagConstructie"	""	""	""	"WV lichtmast"	"Paal voorzien van armen voor het bevestigen van verlichtingstoestellen,inclusief deurtje,klemmenblok,montagekastje,bevestigingsmaterialen (bv. voetplaten) en fundering of verankeringsmassief."	""	"WV lichtmast"	"Paal voorzien van armen voor het bevestigen van verlichtingstoestellen,inclusief deurtje,klemmenblok,montagekastje,bevestigingsmaterialen (bv. voetplaten) en fundering of verankeringsmassief."	""	""	"true"	"https://wegenenverkeer-test.data.vlaanderen.be/ns/onderdeel#"	"WVLichtmast"	"http://www.w3.org/2000/01/rdf-schema#Class"	""	""	"https://wegenenverkeer-test.data.vlaanderen.be/ns/onderdeel#Lichtmast, https://wegenenverkeer-test.data.vlaanderen.be/ns/abstracten#WVDraagConstructie"	""	""
"CLASS"	"OSLO-Abstracten"	"WVDraagConstructie"	"{CB8ADCF5-A266-4c9c-89C4-85A5E2D3D330}"	""	""	""	""	"WV draagconstructie"	"Abstracte voor een dragend element (bv. paal, kolom, seinbrug, galgpaal,) waaraan verlichting bevestigd kan worden om het verlichtingstoestel op de gewenste plaats boven/naast het wegdek (hoogte, afstand tot rand van de weg,) te brengen met als doel het wegoppervlak optimaal te kunnen verlichten"	""	"WV draagconstructie"	"Abstracte voor een dragend element (bv. paal, kolom, seinbrug, galgpaal,) waaraan verlichting bevestigd kan worden om het verlichtingstoestel op de gewenste plaats boven/naast het wegdek (hoogte, afstand tot rand van de weg,) te brengen met als doel het wegoppervlak optimaal te kunnen verlichten"	""	""	"true"	"https://wegenenverkeer-test.data.vlaanderen.be/ns/abstracten#"	"WVDraagConstructie"	"http://www.w3.org/2000/01/rdf-schema#Class"	""	""	"https://wegenenverkeer-test.data.vlaanderen.be/ns/abstracten#Draagconstructie"	""	""
"CLASS"	"OSLO-Abstracten"	"ConstructieElement"	"{171178B4-24D7-4d6e-8C77-13A122A5D6CE}"	""	""	""	""	"Constructie element"	"Abstracte voor de verschillende constructie elementen."	""	"Constructie element"	"Abstracte voor de verschillende constructie elementen."	""	""	"true"	"https://wegenenverkeer-test.data.vlaanderen.be/ns/abstracten#"	"ConstructieElement"	"http://www.w3.org/2000/01/rdf-schema#Class"	""	""	"https://wegenenverkeer-test.data.vlaanderen.be/ns/implementatieelement#AIMObject"	""	""
"CLASS"	"OSLO-Abstracten"	"BekledingComponent"	"{F7EE31EA-0752-49bc-A974-6802DCA24FDE}"	""	""	""	""	"Bekleding component"	"TODO"	""	"Bekleding component"	"TODO"	""	""	"true"	"https://wegenenverkeer-test.data.vlaanderen.be/ns/abstracten#"	"BekledingComponent"	"http://www.w3.org/2000/01/rdf-schema#Class"	""	""	""	""	""
"CLASS"	"OSLO-Onderdeel"	"Montagekast"	"{87796D6B-6388-4fb2-A99E-D4F6B8FC14A0}"	""	""	""	""	"Montagekast"	"Een kleine kast voor binnen of buiten die net omwille van zijn beperkte omvang doorgaans aan een paal,muur of andere objecten bevestigd wordt."	""	"Montagekast"	"Een kleine kast voor binnen of buiten die net omwille van zijn beperkte omvang doorgaans aan een paal,muur of andere objecten bevestigd wordt."	""	""	"true"	"https://wegenenverkeer-test.data.vlaanderen.be/ns/onderdeel#"	"Montagekast"	"http://www.w3.org/2000/01/rdf-schema#Class"	""	""	"https://wegenenverkeer-test.data.vlaanderen.be/ns/abstracten#Buitenkast"	""	""
"CLASS"	"OSLO-Onderdeel"	"VerlichtingstoestelLED"	"{463C6B3A-534B-4218-B410-E0BE8A425C63}"	"Verlichtingstoestel, VerlichtingstoestelConnector"	""	""	""	"Verlichtingstoestel LED"	"Het geheel van de LEDlichtmodule en de behuizing die werden samengesteld met als doel:
 * de lichtstroom van de lichtbronnen hoofdzakelijk op het te verlichten oppervlak (doorlopende wegsectie, conflictgebied,...) te richten, teneinde de zichtbaarheid te verhogen;
 * de lichtstroom te beheersen zodat de weggebruikers niet verblind worden en de lichthinder beperkt wordt;
 * het optisch systeem, de lichtbronnen en de hulpapparatuur tegen uitwendige invloeden te beschermen
De LED driver bevindt zich fysiek in het verlichtingstoestel maar wordt als een appart onderdeel behandeld."	""	"Verlichtingstoestel LED"	"Het geheel van de LEDlichtmodule en de behuizing die werden samengesteld met als doel:
 * de lichtstroom van de lichtbronnen hoofdzakelijk op het te verlichten oppervlak (doorlopende wegsectie, conflictgebied,...) te richten, teneinde de zichtbaarheid te verhogen;
 * de lichtstroom te beheersen zodat de weggebruikers niet verblind worden en de lichthinder beperkt wordt;
 * het optisch systeem, de lichtbronnen en de hulpapparatuur tegen uitwendige invloeden te beschermen
De LED driver bevindt zich fysiek in het verlichtingstoestel maar wordt als een appart onderdeel behandeld."	""	""	"true"	"https://wegenenverkeer-test.data.vlaanderen.be/ns/onderdeel#"	"VerlichtingstoestelLED"	"http://www.w3.org/2000/01/rdf-schema#Class"	""	""	"https://wegenenverkeer-test.data.vlaanderen.be/ns/abstracten#Verlichtingstoestel, https://wegenenverkeer-test.data.vlaanderen.be/ns/abstracten#VerlichtingstoestelConnector"	""	""
"CLASS"	"OSLO-Onderdeel"	"VerlichtingstoestelHgLP"	"{A1382D36-40E2-489c-B2AD-9C52AFCBB065}"	"Verlichtingstoestel, VerlichtingstoestelConnector"	""	""	""	"Verlichtingstoestel Hg LP"	"Het geheel van de lagedruk kwik lamp (of fluorescentielamp) (HgLP),, voorschakelapparatuur en de behuizing die werden samengesteld met als doel:
 * de lichtstroom van de lichtbronnen hoofdzakelijk op het te verlichten oppervlak (doorlopende wegsectie, conflictgebied,...) te richten, teneinde de zichtbaarheid te verhogen;
 * de lichtstroom te beheersen zodat de weggebruikers niet verblind worden en de lichthinder beperkt wordt;
 * het optisch systeem, de lichtbronnen en de hulpapparatuur tegen uitwendige invloeden te beschermen"	""	"Verlichtingstoestel Hg LP"	"Het geheel van de lagedruk kwik lamp (of fluorescentielamp) (HgLP),, voorschakelapparatuur en de behuizing die werden samengesteld met als doel:
 * de lichtstroom van de lichtbronnen hoofdzakelijk op het te verlichten oppervlak (doorlopende wegsectie, conflictgebied,...) te richten, teneinde de zichtbaarheid te verhogen;
 * de lichtstroom te beheersen zodat de weggebruikers niet verblind worden en de lichthinder beperkt wordt;
 * het optisch systeem, de lichtbronnen en de hulpapparatuur tegen uitwendige invloeden te beschermen"	""	""	"true"	"https://wegenenverkeer-test.data.vlaanderen.be/ns/onderdeel#"	"VerlichtingstoestelHgLP"	"http://www.w3.org/2000/01/rdf-schema#Class"	""	""	"https://wegenenverkeer-test.data.vlaanderen.be/ns/abstracten#Verlichtingstoestel, https://wegenenverkeer-test.data.vlaanderen.be/ns/abstracten#VerlichtingstoestelConnector"	""	""
"CLASS"	"OSLO-Onderdeel"	"VerlichtingstoestelTL"	"{5366E237-3E4C-4e69-908C-312C1A35E617}"	"Verlichtingstoestel"	""	""	""	"Verlichtingstoestel TL"	"TODO"	""	"Verlichtingstoestel TL"	"TODO"	""	""	"true"	"https://wegenenverkeer-test.data.vlaanderen.be/ns/onderdeel#"	"VerlichtingstoestelTL"	"http://www.w3.org/2000/01/rdf-schema#Class"	""	""	"https://wegenenverkeer-test.data.vlaanderen.be/ns/abstracten#Verlichtingstoestel"	""	""
"CLASS"	"OSLO-Onderdeel"	"VerlichtingstoestelNaLP"	"{5334361A-6E51-4796-8A2C-E5DE22B55D71}"	"Verlichtingstoestel"	""	""	""	"Verlichtingstoestel Na LP"	"Het geheel van de Natrium Lagedruk lamp(NaLP), eventuele vooschakelapparatuur en de behuizing die werden samengesteld met als doel:
 * de lichtstroom van de lichtbronnen hoofdzakelijk op het te verlichten oppervlak (doorlopende wegsectie, conflictgebied,...) te richten, teneinde de zichtbaarheid te verhogen;
 * de lichtstroom te beheersen, zodat de weggebruikers niet verblind worden en de lichthinder beperkt wordt;
 * het optisch systeem, de lichtbronnen en de hulpapparatuur tegen uitwendige invloeden te beschermen"	""	"Verlichtingstoestel Na LP"	"Het geheel van de Natrium Lagedruk lamp(NaLP), eventuele vooschakelapparatuur en de behuizing die werden samengesteld met als doel:
 * de lichtstroom van de lichtbronnen hoofdzakelijk op het te verlichten oppervlak (doorlopende wegsectie, conflictgebied,...) te richten, teneinde de zichtbaarheid te verhogen;
 * de lichtstroom te beheersen, zodat de weggebruikers niet verblind worden en de lichthinder beperkt wordt;
 * het optisch systeem, de lichtbronnen en de hulpapparatuur tegen uitwendige invloeden te beschermen"	""	""	"true"	"https://wegenenverkeer-test.data.vlaanderen.be/ns/onderdeel#"	"VerlichtingstoestelNaLP"	"http://www.w3.org/2000/01/rdf-schema#Class"	""	""	"https://wegenenverkeer-test.data.vlaanderen.be/ns/abstracten#Verlichtingstoestel"	""	""
