"EA-Type"	"EA-Package"	"EA-Name"	"EA-GUID"	"EA-Parent"	"EA-Domain"	"EA-Domain-GUID"	"EA-Range"	"label"	"definition"	"usage"	"ap-label-nl"	"ap-definition-nl"	"ap-usageNote-nl"	"ap-codelist"	"external term"	"namespace"	"localname"	"type"	"domain"	"range"	"parent"	"min card"	"max card"
"ENUMERATION"	"OSLO-Onderdeel"	"KlLaagRol"	"{6E941914-412F-4b63-87DF-9378498D64E8}"	""	""	""	""	"Laag rol"	"De mogelijke rollen van de laag."	""	"Laag rol"	"De mogelijke rollen van de laag."	""	"https://wegenenverkeer.data.vlaanderen.be/id/conceptscheme/KlLaagRol"	"true"	"http://www.w3.org/2004/02/skos/core#"	"Concept"	"http://www.w3.org/2000/01/rdf-schema#Class"	""	""	""	""	""
"ENUMERATION"	"OSLO-Onderdeel"	"KlProfielelementType"	"{063A1378-ECC3-4eb8-A390-85471F67FA67}"	""	""	""	""	"Profielelement type"	"Types van profielelement."	""	"Profielelement type"	"Types van profielelement."	""	"https://wegenenverkeer.data.vlaanderen.be/id/conceptscheme/KlProfielelementType"	"true"	"http://www.w3.org/2004/02/skos/core#"	"Concept"	"http://www.w3.org/2000/01/rdf-schema#Class"	""	""	""	""	""
"ENUMERATION"	"OSLO-Onderdeel"	"KlWaterloopVhagCode"	"{10409A7B-4BBF-4f0c-B25B-F84D72FD165B}"	""	""	""	""	"Waterloop vhag code"	"De VHAG code voor de waterloop."	""	"Waterloop vhag code"	"De VHAG code voor de waterloop."	""	"https://wegenenverkeer.data.vlaanderen.be/id/conceptscheme/KlWaterloopVhagCode"	"true"	"http://www.w3.org/2004/02/skos/core#"	"Concept"	"http://www.w3.org/2000/01/rdf-schema#Class"	""	""	""	""	""
"ENUMERATION"	"OSLO-Onderdeel"	"KlOeverrolMateriaal"	"{14825D93-DE0D-4494-8503-C6049A619657}"	""	""	""	""	"Oeverrol materiaal"	"De materialen van de oeverrol."	""	"Oeverrol materiaal"	"De materialen van de oeverrol."	""	"https://wegenenverkeer.data.vlaanderen.be/id/conceptscheme/KlOeverrolMateriaal"	"true"	"http://www.w3.org/2004/02/skos/core#"	"Concept"	"http://www.w3.org/2000/01/rdf-schema#Class"	""	""	""	""	""
"ENUMERATION"	"OSLO-Onderdeel"	"KlPaalDuurzaamheidsklasse"	"{1992999A-C96C-4582-8062-24083678628F}"	""	""	""	""	"Paal duurzaamheidsklasse"	"De mogelijke duurzaamheidsklassen van een houten paal of damplank."	""	"Paal duurzaamheidsklasse"	"De mogelijke duurzaamheidsklassen van een houten paal of damplank."	""	"https://wegenenverkeer.data.vlaanderen.be/id/conceptscheme/KlPaalDuurzaamheidsklasse"	"true"	"http://www.w3.org/2004/02/skos/core#"	"Concept"	"http://www.w3.org/2000/01/rdf-schema#Class"	""	""	""	""	""
"DATATYPE"	"OSLO-Onderdeel"	"DtuPaalPlankDamwandMateriaal"	"{3E604677-FDBE-427e-815B-A7DA87231FFB}"	""	""	""	""	"Paal-kantplank-damplank-damwand materiaal"	"Union datatype voor het materiaal van een paal, kantplank, damplank of damwand."	""	"Paal-kantplank-damplank-damwand materiaal"	"Union datatype voor het materiaal van een paal, kantplank, damplank of damwand."	""	""	"true"	"https://wegenenverkeer.data.vlaanderen.be/ns/onderdeel#"	"DtuPaalPlankDamwandMateriaal"	"http://www.w3.org/2000/01/rdf-schema#Class"	""	""	""	""	""
"ENUMERATION"	"OSLO-Onderdeel"	"KlDijkkant"	"{51C41656-2B79-4103-B37E-58D2B27360F1}"	""	""	""	""	"Dijkkant"	"De mogelijke kanten van een dijk."	""	"Dijkkant"	"De mogelijke kanten van een dijk."	""	"https://wegenenverkeer.data.vlaanderen.be/id/conceptscheme/KlDijkkant"	"true"	"http://www.w3.org/2004/02/skos/core#"	"Concept"	"http://www.w3.org/2000/01/rdf-schema#Class"	""	""	""	""	""
"ENUMERATION"	"OSLO-Onderdeel"	"KlOeverKant"	"{57D2B5A9-4908-41a5-A5E8-92F2C937944C}"	""	""	""	""	"Oeverkant"	"De kanten van de oever."	""	"Oeverkant"	"De kanten van de oever."	""	"https://wegenenverkeer.data.vlaanderen.be/id/conceptscheme/KlOeverKant"	"true"	"http://www.w3.org/2004/02/skos/core#"	"Concept"	"http://www.w3.org/2000/01/rdf-schema#Class"	""	""	""	""	""
"ENUMERATION"	"OSLO-Onderdeel"	"KlTaludWaarde"	"{5C38D28A-2E08-4416-8D8E-378B77D3DE27}"	""	""	""	""	"Talud waarde"	"De verschillende mogelijke waardes voor de hellingsgraad van de talud"	""	"Talud waarde"	"De verschillende mogelijke waardes voor de hellingsgraad van de talud"	""	"https://wegenenverkeer.data.vlaanderen.be/id/conceptscheme/KlTaludWaarde"	"true"	"http://www.w3.org/2004/02/skos/core#"	"Concept"	"http://www.w3.org/2000/01/rdf-schema#Class"	""	""	""	""	""
"ENUMERATION"	"OSLO-Onderdeel"	"KlHelling"	"{806F31FC-3DA4-4b3a-A369-A88AFA77C59E}"	""	""	""	""	"Helling"	"Kwarten voor het bepalen van de hellingsgraad."	""	"Helling"	"Kwarten voor het bepalen van de hellingsgraad."	""	"https://wegenenverkeer.data.vlaanderen.be/id/conceptscheme/KlHelling"	"true"	"http://www.w3.org/2004/02/skos/core#"	"Concept"	"http://www.w3.org/2000/01/rdf-schema#Class"	""	""	""	""	""
"DATATYPE"	"OSLO-Onderdeel"	"DtcBetuiningHout"	"{84FB40D4-1069-40d5-A349-3C53672AB793}"	""	""	""	""	"Betuining van hout"	"Complex datatype voor een houten plankenbetuining of damwandbetuining."	""	"Betuining van hout"	"Complex datatype voor een houten plankenbetuining of damwandbetuining."	""	""	"true"	"https://wegenenverkeer.data.vlaanderen.be/ns/onderdeel#"	"DtcBetuiningHout"	"http://www.w3.org/2000/01/rdf-schema#Class"	""	""	""	""	""
"ENUMERATION"	"OSLO-Onderdeel"	"KlGrachtFunctie"	"{88BEB387-DA19-4bf6-83CA-C0635AB93E92}"	""	""	""	""	"Gracht functie"	"Mogelijke functies van de gracht."	""	"Gracht functie"	"Mogelijke functies van de gracht."	""	"https://wegenenverkeer.data.vlaanderen.be/id/conceptscheme/KlGrachtFunctie"	"true"	"http://www.w3.org/2004/02/skos/core#"	"Concept"	"http://www.w3.org/2000/01/rdf-schema#Class"	""	""	""	""	""
"ENUMERATION"	"OSLO-Onderdeel"	"KlDijkkernMateriaal"	"{91B21BC5-FD64-4c75-9665-1CF427C623CB}"	""	""	""	""	"Dijkkern materiaal"	"De verschillende materialen gebrukt bij een dijkkern."	""	"Dijkkern materiaal"	"De verschillende materialen gebrukt bij een dijkkern."	""	"https://wegenenverkeer.data.vlaanderen.be/id/conceptscheme/KlDijkkernMateriaal"	"true"	"http://www.w3.org/2004/02/skos/core#"	"Concept"	"http://www.w3.org/2000/01/rdf-schema#Class"	""	""	""	""	""
"DATATYPE"	"OSLO-Onderdeel"	"DtcBetuiningBeton"	"{A306ECFE-9719-4cbd-B447-9A05DD983FA4}"	""	""	""	""	"Betuining van beton"	"Complex datatype voor een betonnen plankenbetuining of damwandbetuing."	""	"Betuining van beton"	"Complex datatype voor een betonnen plankenbetuining of damwandbetuing."	""	""	"true"	"https://wegenenverkeer.data.vlaanderen.be/ns/onderdeel#"	"DtcBetuiningBeton"	"http://www.w3.org/2000/01/rdf-schema#Class"	""	""	""	""	""
"DATATYPE"	"OSLO-Onderdeel"	"DtcBetuiningGerecycleerd"	"{CDDA3D77-BCD3-4ae6-9070-C8D314D0FDB8}"	""	""	""	""	"Betuining van gerecycleerd materiaal"	"Complex datatype voor een gerecycleerde plankenbetuining of damwandbetuining."	""	"Betuining van gerecycleerd materiaal"	"Complex datatype voor een gerecycleerde plankenbetuining of damwandbetuining."	""	""	"true"	"https://wegenenverkeer.data.vlaanderen.be/ns/onderdeel#"	"DtcBetuiningGerecycleerd"	"http://www.w3.org/2000/01/rdf-schema#Class"	""	""	""	""	""
"ENUMERATION"	"OSLO-Onderdeel"	"KlPaalOfbetuiningMateriaal"	"{F3086DE8-A12B-4905-AA11-D01B59880690}"	""	""	""	""	"Paal-betuining materiaal"	"Materialen voor een paal of betuining."	""	"Paal-betuining materiaal"	"Materialen voor een paal of betuining."	""	"https://wegenenverkeer.data.vlaanderen.be/id/conceptscheme/KlPaalOfbetuiningMateriaal"	"true"	"http://www.w3.org/2004/02/skos/core#"	"Concept"	"http://www.w3.org/2000/01/rdf-schema#Class"	""	""	""	""	""
"DATATYPE"	"W3-XML-Schema"	"Date"	"{518CF17E-69E2-4b04-BFC0-208BB4C618A2}"	""	""	""	""	"Datum"	"Beschrijft een datum volgens https://www.w3.org/2001/XMLSchema#date"	"https://www.w3.org/2001/XMLSchema#date"	"Datum"	"Beschrijft een datum volgens https://www.w3.org/2001/XMLSchema#date"	""	""	"true"	"https://www.w3.org/2001/XMLSchema#"	"date"	"http://www.w3.org/2000/01/rdf-schema#Class"	""	""	""	""	""
"DATATYPE"	"W3-XML-Schema"	"AnyURI"	"{720ACC1F-344F-43bb-9B65-5467749150DD}"	""	""	""	""	"URI"	"Een tekstwaarde die een verwijzing naar meer informatie van het element bevat volgens https://www.w3.org/2001/XMLSchema#anyURI ."	"https://www.w3.org/2001/XMLSchema#anyURI"	"URI"	"Een tekstwaarde die een verwijzing naar meer informatie van het element bevat volgens https://www.w3.org/2001/XMLSchema#anyURI ."	""	""	"true"	"https://www.w3.org/2001/XMLSchema#"	"anyURI"	"http://www.w3.org/2000/01/rdf-schema#Class"	""	""	""	""	""
"DATATYPE"	"W3-XML-Schema"	"String"	"{9154C721-7D7C-4c11-8FBF-C56FAEF9A4DA}"	""	""	""	""	"String"	"Beschrijft een tekstregel volgens https://www.w3.org/2001/XMLSchema#string"	"https://www.w3.org/2001/XMLSchema#string"	"String"	"Beschrijft een tekstregel volgens https://www.w3.org/2001/XMLSchema#string"	""	""	"true"	"https://www.w3.org/2001/XMLSchema#"	"string"	"http://www.w3.org/2000/01/rdf-schema#Class"	""	""	""	""	""
"DATATYPE"	"W3-XML-Schema"	"Boolean"	"{C66810D0-4F93-4948-83F5-165137DEBF82}"	""	""	""	""	"Boolean"	"Beschrijft een boolean volgens https://www.w3.org/2001/XMLSchema#boolean"	"https://www.w3.org/2001/XMLSchema#boolean"	"Boolean"	"Beschrijft een boolean volgens https://www.w3.org/2001/XMLSchema#boolean"	""	""	"true"	"https://www.w3.org/2001/XMLSchema#"	"boolean"	"http://www.w3.org/2000/01/rdf-schema#Class"	""	""	""	""	""
"DATATYPE"	"W3-RDF-Schema"	"Literal"	"{FBE7CE2F-907F-4558-A0CE-70C0A8A6AA32}"	""	""	""	""	"Literal"	"Beschrijft een constante."	"https://www.w3.org/2000/01/rdf-schema#Literal"	"Literal"	"Beschrijft een constante."	""	""	"true"	"https://www.w3.org/2000/01/rdf-schema#"	"Literal"	"http://www.w3.org/2000/01/rdf-schema#Class"	""	""	""	""	""
"DATATYPE"	"W3-XML-Schema"	"DateTime"	"{0DD21E21-29CC-461d-BC1D-FC45931957F0}"	""	""	""	""	"Datumtijd"	"Beschrijft een datumtijd volgens https://www.w3.org/2001/XMLSchema#datetime"	"https://www.w3.org/2001/XMLSchema#datetime"	"Datumtijd"	"Beschrijft een datumtijd volgens https://www.w3.org/2001/XMLSchema#datetime"	""	""	"true"	"https://www.w3.org/2001/XMLSchema#"	"datetime"	"http://www.w3.org/2000/01/rdf-schema#Class"	""	""	""	""	""
"DATATYPE"	"W3-XML-Schema"	"Decimal"	"{3300D9AD-B706-43fe-B750-0EB2D8679F90}"	""	""	""	""	"Decimaal getal"	"Beschrijft een decimaal getal volgens https://www.w3.org/2001/XMLSchema#decimal"	"https://www.w3.org/2001/XMLSchema#decimal"	"Decimaal getal"	"Beschrijft een decimaal getal volgens https://www.w3.org/2001/XMLSchema#decimal"	""	""	"true"	"https://www.w3.org/2001/XMLSchema#"	"decimal"	"http://www.w3.org/2000/01/rdf-schema#Class"	""	""	""	""	""
"attribute"	"OSLO-Proefenmeting"	"bijlage"	"{6CA57911-4ABB-43d3-9AC7-4F8F1FA05C51}"	""	"ProefBathymetrie"	"{AB09F173-B4E1-4dd2-8B9C-4172FCE6BA31}"	"DtcDocument"	"bijlage"	"Het rapport van de bathymetrie als bijlage."	""	"bijlage"	"Het rapport van de bathymetrie als bijlage."	""	""	"true"	"https://wegenenverkeer.data.vlaanderen.be/ns/proefenmeting#"	"ProefBathymetrie.bijlage"	"http://www.w3.org/2002/07/owl#ObjectProperty"	"https://wegenenverkeer.data.vlaanderen.be/ns/proefenmeting#ProefBathymetrie"	"https://wegenenverkeer.data.vlaanderen.be/ns/implementatieelement#DtcDocument"	""	"1"	"1"
"attribute"	"OSLO-Implementatieelement"	"naam"	"{0934DA42-F4E9-485b-BCE5-09CDF6AB792B}"	""	"AWVNaamObject"	"{5C144615-47A1-4f8b-A119-B293BCFD84B5}"	"String"	"naam"	"De mensleesbare naam van een AWVObject zoals dit bv. ook terug te vinden is op een etiket op het object zelf. AWV kent deze naam toe of geeft de opdracht om deze toe te kennen. Indien een object een algemeen gangbare naam heeft zoals bv. bij een waterloop dan wordt deze gebruikt."	""	"naam"	"De mensleesbare naam van een AWVObject zoals dit bv. ook terug te vinden is op een etiket op het object zelf. AWV kent deze naam toe of geeft de opdracht om deze toe te kennen. Indien een object een algemeen gangbare naam heeft zoals bv. bij een waterloop dan wordt deze gebruikt."	""	""	"true"	"https://wegenenverkeer.data.vlaanderen.be/ns/implementatieelement#"	"AWVNaamObject.naam"	"http://www.w3.org/2002/07/owl#DatatypeProperty"	"https://wegenenverkeer.data.vlaanderen.be/ns/implementatieelement#AWVNaamObject"	"http://www.w3.org/2001/XMLSchema#string"	""	"1"	"1"
"attribute"	"OSLO-Proefenmeting"	"bijlage"	"{3DCE2338-C5E5-4fe9-8539-54BDF3036A81}"	""	"ProefSondering"	"{07BF9A81-6512-4fe8-A30E-85D591E24424}"	"DtcDocument"	"bijlage"	"Het resultaat van de sonderingsproef als bijlage."	""	"bijlage"	"Het resultaat van de sonderingsproef als bijlage."	""	""	"true"	"https://wegenenverkeer.data.vlaanderen.be/ns/proefenmeting#"	"ProefSondering.bijlage"	"http://www.w3.org/2002/07/owl#ObjectProperty"	"https://wegenenverkeer.data.vlaanderen.be/ns/proefenmeting#ProefSondering"	"https://wegenenverkeer.data.vlaanderen.be/ns/implementatieelement#DtcDocument"	""	"1"	"1"
"attribute"	"OSLO-Implementatieelement"	"datumOprichtingObject"	"{BDF3B5DA-2C71-43b0-8AF1-9CBB8C9059DB}"	""	"AWVObject"	"{C3CBD401-EC86-4363-9821-CCE89EB2F0A9}"	"Date"	"datum oprichting object"	"Datum van de oprichting van het object"	""	"datum oprichting object"	"Datum van de oprichting van het object"	""	""	"true"	"https://wegenenverkeer.data.vlaanderen.be/ns/implementatieelement#"	"AWVObject.datumOprichtingObject"	"http://www.w3.org/2002/07/owl#DatatypeProperty"	"https://wegenenverkeer.data.vlaanderen.be/ns/implementatieelement#AWVObject"	"http://www.w3.org/2001/XMLSchema#date"	""	"1"	"1"
"attribute"	"OSLO-Implementatieelement"	"id"	"{B43EDD99-BBCC-4818-B6BA-0C9DBF96FA24}"	""	"AWVObject"	"{C3CBD401-EC86-4363-9821-CCE89EB2F0A9}"	"DtcAWVIdentificator"	"id"	"De identificator van het object. Zodra een object bestaat binnen de omgeving van AWV moet de id gebruikt worden zoals die daar gekend is. Bij aanlevering van nieuwe objecten wordt een lokale-id (zoals gekend bij de aannemer) ingevuld."	""	"id"	"De identificator van het object. Zodra een object bestaat binnen de omgeving van AWV moet de id gebruikt worden zoals die daar gekend is. Bij aanlevering van nieuwe objecten wordt een lokale-id (zoals gekend bij de aannemer) ingevuld."	""	""	"true"	"https://wegenenverkeer.data.vlaanderen.be/ns/implementatieelement#"	"AWVObject.id"	"http://www.w3.org/2002/07/owl#ObjectProperty"	"https://wegenenverkeer.data.vlaanderen.be/ns/implementatieelement#AWVObject"	"https://wegenenverkeer.data.vlaanderen.be/ns/implementatieelement#DtcAWVIdentificator"	""	"1"	"*"
"attribute"	"OSLO-Implementatieelement"	"notitie"	"{C5D72798-B8FE-4b73-8F50-506AE8241477}"	""	"AWVObject"	"{C3CBD401-EC86-4363-9821-CCE89EB2F0A9}"	"String"	"notitie"	"Extra notitie voor het AWV object."	""	"notitie"	"Extra notitie voor het AWV object."	""	""	"true"	"https://wegenenverkeer.data.vlaanderen.be/ns/implementatieelement#"	"AWVObject.notitie"	"http://www.w3.org/2002/07/owl#DatatypeProperty"	"https://wegenenverkeer.data.vlaanderen.be/ns/implementatieelement#AWVObject"	"http://www.w3.org/2001/XMLSchema#string"	""	"1"	"1"
"attribute"	"OSLO-Implementatieelement"	"typeURI"	"{E1765146-77A7-479e-8478-D814329806B4}"	""	"AWVObject"	"{C3CBD401-EC86-4363-9821-CCE89EB2F0A9}"	"AnyURI"	"uri type"	"De URI van het AWV Object volgens https://www.w3.org/2001/XMLSchema#anyURI ."	""	"uri type"	"De URI van het AWV Object volgens https://www.w3.org/2001/XMLSchema#anyURI ."	""	""	"true"	"https://wegenenverkeer.data.vlaanderen.be/ns/implementatieelement#"	"AWVObject.typeURI"	"http://www.w3.org/2002/07/owl#ObjectProperty"	"https://wegenenverkeer.data.vlaanderen.be/ns/implementatieelement#AWVObject"	"https://www.w3.org/2001/XMLSchema#anyURI"	""	"1"	"1"
"attribute"	"OSLO-Onderdeel"	"vhagCode"	"{60CE6242-E886-469c-9E61-D7CBE5F1E2F5}"	""	"Waterloop"	"{57D10DCF-BB9F-472d-B523-B88D7D6D812C}"	"KlWaterloopVhagCode"	"vhag code"	"Identificatiecode voor een VHA-waterloop binnen het Vlaams Gewest waartoe het segment behoort. Een VHA-waterloop is een reële waterloop van bron (punt-van-oorsprong) tot monding (voor zover binnen Vlaanderen gelegen)."	""	"vhag code"	"Identificatiecode voor een VHA-waterloop binnen het Vlaams Gewest waartoe het segment behoort. Een VHA-waterloop is een reële waterloop van bron (punt-van-oorsprong) tot monding (voor zover binnen Vlaanderen gelegen)."	""	""	"true"	"https://wegenenverkeer.data.vlaanderen.be/ns/onderdeel#"	"Waterloop.vhagCode"	"http://www.w3.org/2002/07/owl#ObjectProperty"	"https://wegenenverkeer.data.vlaanderen.be/ns/onderdeel#Waterloop"	"http://www.w3.org/2004/02/skos/core#Concept"	""	"1"	"1"
"attribute"	"OSLO-Abstracten"	"breedte"	"{2B46F49C-2845-48af-8BB1-BA2248C0C22E}"	""	"BegroeidVoorkomen"	"{09E5710C-6AD7-4d52-B15A-6D3A563007B0}"	"KwantWrdInMeter"	"breedte"	"De breedte van het begroeide oppervlak."	""	"breedte"	"De breedte van het begroeide oppervlak."	""	""	"true"	"https://wegenenverkeer.data.vlaanderen.be/ns/abstracten#"	"BegroeidVoorkomen.breedte"	"http://www.w3.org/2002/07/owl#ObjectProperty"	"https://wegenenverkeer.data.vlaanderen.be/ns/abstracten#BegroeidVoorkomen"	"https://wegenenverkeer.data.vlaanderen.be/ns/implementatieelement#KwantWrdInMeter"	""	"1"	"1"
"attribute"	"OSLO-Abstracten"	"drassigheid"	"{5533CCCE-95B5-4b2d-A92E-DE9A05AF8CAB}"	""	"BegroeidVoorkomen"	"{09E5710C-6AD7-4d52-B15A-6D3A563007B0}"	"KlVegetatieDrassigheid"	"drassigheid"	"Mate waarin de bodem verzadigd is met water. De drassigheid geeft hierbij aan in welke mate de normale werking van types machines zou kunnen verstoord worden."	""	"drassigheid"	"Mate waarin de bodem verzadigd is met water. De drassigheid geeft hierbij aan in welke mate de normale werking van types machines zou kunnen verstoord worden."	""	""	"true"	"https://wegenenverkeer.data.vlaanderen.be/ns/abstracten#"	"BegroeidVoorkomen.drassigheid"	"http://www.w3.org/2002/07/owl#ObjectProperty"	"https://wegenenverkeer.data.vlaanderen.be/ns/abstracten#BegroeidVoorkomen"	"http://www.w3.org/2004/02/skos/core#Concept"	""	"1"	"1"
"attribute"	"OSLO-Abstracten"	"heeftExoten"	"{C482D26E-8144-44a3-B08C-9EF8FAF86075}"	""	"BegroeidVoorkomen"	"{09E5710C-6AD7-4d52-B15A-6D3A563007B0}"	"Boolean"	"heeft exoten"	"Aanduiding of er al dan niet exoten aanwezig zijn."	""	"heeft exoten"	"Aanduiding of er al dan niet exoten aanwezig zijn."	""	""	"true"	"https://wegenenverkeer.data.vlaanderen.be/ns/abstracten#"	"BegroeidVoorkomen.heeftExoten"	"http://www.w3.org/2002/07/owl#DatatypeProperty"	"https://wegenenverkeer.data.vlaanderen.be/ns/abstracten#BegroeidVoorkomen"	"http://www.w3.org/2001/XMLSchema#boolean"	""	"1"	"1"
"attribute"	"OSLO-Abstracten"	"heeftObstakels"	"{FB903005-498C-4815-9C9E-05B105E5295A}"	""	"BegroeidVoorkomen"	"{09E5710C-6AD7-4d52-B15A-6D3A563007B0}"	"Boolean"	"heeft obstakels"	"Eigenschap die aangeeft of er binnen het beheerdeel al dan niet objecten voorkomen die de vrije werking van machines of andere werktuigen kan verhinderen."	""	"heeft obstakels"	"Eigenschap die aangeeft of er binnen het beheerdeel al dan niet objecten voorkomen die de vrije werking van machines of andere werktuigen kan verhinderen."	""	""	"true"	"https://wegenenverkeer.data.vlaanderen.be/ns/abstracten#"	"BegroeidVoorkomen.heeftObstakels"	"http://www.w3.org/2002/07/owl#DatatypeProperty"	"https://wegenenverkeer.data.vlaanderen.be/ns/abstracten#BegroeidVoorkomen"	"http://www.w3.org/2001/XMLSchema#boolean"	""	"1"	"1"
"attribute"	"OSLO-Abstracten"	"lengte"	"{06B75C85-416D-46fe-89C8-C514B2000BDB}"	""	"BegroeidVoorkomen"	"{09E5710C-6AD7-4d52-B15A-6D3A563007B0}"	"KwantWrdInMeter"	"lengte"	"De lengte van het begroeide oppervlak."	""	"lengte"	"De lengte van het begroeide oppervlak."	""	""	"true"	"https://wegenenverkeer.data.vlaanderen.be/ns/abstracten#"	"BegroeidVoorkomen.lengte"	"http://www.w3.org/2002/07/owl#ObjectProperty"	"https://wegenenverkeer.data.vlaanderen.be/ns/abstracten#BegroeidVoorkomen"	"https://wegenenverkeer.data.vlaanderen.be/ns/implementatieelement#KwantWrdInMeter"	""	"1"	"1"
"attribute"	"OSLO-Abstracten"	"oppervlakte"	"{63AC5153-A440-4d5e-AF55-48714EF0EFA4}"	""	"BegroeidVoorkomen"	"{09E5710C-6AD7-4d52-B15A-6D3A563007B0}"	"KwantWrdInVierkanteMeter"	"oppervlakte"	"De oppervlakte van het begroeide oppervlak in vierkante meter."	""	"oppervlakte"	"De oppervlakte van het begroeide oppervlak in vierkante meter."	""	""	"true"	"https://wegenenverkeer.data.vlaanderen.be/ns/abstracten#"	"BegroeidVoorkomen.oppervlakte"	"http://www.w3.org/2002/07/owl#ObjectProperty"	"https://wegenenverkeer.data.vlaanderen.be/ns/abstracten#BegroeidVoorkomen"	"https://wegenenverkeer.data.vlaanderen.be/ns/implementatieelement#KwantWrdInVierkanteMeter"	""	"1"	"1"
"attribute"	"OSLO-Abstracten"	"soort"	"{08C0A065-3262-4651-906C-114319B716FE}"	""	"BegroeidVoorkomen"	"{09E5710C-6AD7-4d52-B15A-6D3A563007B0}"	"DtcVegetatieSoortnaam"	"soort"	"De naam van de plantensoort
."	""	"soort"	"De naam van de plantensoort
."	""	""	"true"	"https://wegenenverkeer.data.vlaanderen.be/ns/abstracten#"	"BegroeidVoorkomen.soort"	"http://www.w3.org/2002/07/owl#ObjectProperty"	"https://wegenenverkeer.data.vlaanderen.be/ns/abstracten#BegroeidVoorkomen"	"https://wegenenverkeer.data.vlaanderen.be/ns/onderdeel#DtcVegetatieSoortnaam"	""	"1"	"*"
"attribute"	"OSLO-Abstracten"	"taludwaarde"	"{3783FB40-9C34-4fee-B007-ECE27ADF937C}"	""	"BegroeidVoorkomen"	"{09E5710C-6AD7-4d52-B15A-6D3A563007B0}"	"KlTaludWaarde"	"taludwaarde"	"Een talud is het kunstmatig gedeelte van een vlak van de wegbaan, dijken, spoorbanen, vestingswerken,? dat een helling (min. 20%, max 80% voor kunstmatig verharde taluds) vertoont en bedoeld voor het opvangen van een hoogteverschil."	""	"taludwaarde"	"Een talud is het kunstmatig gedeelte van een vlak van de wegbaan, dijken, spoorbanen, vestingswerken,? dat een helling (min. 20%, max 80% voor kunstmatig verharde taluds) vertoont en bedoeld voor het opvangen van een hoogteverschil."	""	""	"true"	"https://wegenenverkeer.data.vlaanderen.be/ns/abstracten#"	"BegroeidVoorkomen.taludwaarde"	"http://www.w3.org/2002/07/owl#ObjectProperty"	"https://wegenenverkeer.data.vlaanderen.be/ns/abstracten#BegroeidVoorkomen"	"http://www.w3.org/2004/02/skos/core#Concept"	""	"1"	"1"
"attribute"	"OSLO-Onderdeel"	"dikte"	"{8FCE7013-1844-4095-9EFF-B103F6784D4F}"	""	"Plankenbetuining"	"{B1CE2ED5-D81E-4b9b-AF72-DFD4363AC7BB}"	"KwantWrdInCentimeter"	"dikte"	"De dikte van de plankenbetuining in centimeter."	""	"dikte"	"De dikte van de plankenbetuining in centimeter."	""	""	"true"	"https://wegenenverkeer.data.vlaanderen.be/ns/onderdeel#"	"Plankenbetuining.dikte"	"http://www.w3.org/2002/07/owl#ObjectProperty"	"https://wegenenverkeer.data.vlaanderen.be/ns/onderdeel#Plankenbetuining"	"https://wegenenverkeer.data.vlaanderen.be/ns/implementatieelement#KwantWrdInCentimeter"	""	"1"	"1"
"attribute"	"OSLO-Onderdeel"	"materiaal"	"{DDC55ECF-EFB3-4782-8AA6-4C4C033FAB5A}"	""	"Plankenbetuining"	"{B1CE2ED5-D81E-4b9b-AF72-DFD4363AC7BB}"	"DtuPaalPlankDamwandMateriaal"	"materiaal"	"Het materiaal van de plankenbetuining."	""	"materiaal"	"Het materiaal van de plankenbetuining."	""	""	"true"	"https://wegenenverkeer.data.vlaanderen.be/ns/onderdeel#"	"Plankenbetuining.materiaal"	"http://www.w3.org/2002/07/owl#ObjectProperty"	"https://wegenenverkeer.data.vlaanderen.be/ns/onderdeel#Plankenbetuining"	"https://wegenenverkeer.data.vlaanderen.be/ns/onderdeel#DtuPaalPlankDamwandMateriaal"	""	"1"	"1"
"attribute"	"OSLO-Abstracten"	"breedte"	"{B1B6FB14-B0BF-4d8e-94BF-3AC5CCC7D360}"	""	"Laag"	"{58E7E3BD-A9A9-4e04-957D-942F897D7ED8}"	"KwantWrdInMeter"	"breedte"	"De gemiddelde breedte van een laag in meter."	""	"breedte"	"De gemiddelde breedte van een laag in meter."	""	""	"true"	"https://wegenenverkeer.data.vlaanderen.be/ns/abstracten#"	"Laag.breedte"	"http://www.w3.org/2002/07/owl#ObjectProperty"	"https://wegenenverkeer.data.vlaanderen.be/ns/abstracten#Laag"	"https://wegenenverkeer.data.vlaanderen.be/ns/implementatieelement#KwantWrdInMeter"	""	"1"	"1"
"attribute"	"OSLO-Abstracten"	"laagRol"	"{33674684-62D6-4803-BB1B-B97DB1D918FF}"	""	"Laag"	"{58E7E3BD-A9A9-4e04-957D-942F897D7ED8}"	"KlLaagRol"	"laagrol"	"De functie die de laag vervult in de verticale opbouw."	""	"laagrol"	"De functie die de laag vervult in de verticale opbouw."	""	""	"true"	"https://wegenenverkeer.data.vlaanderen.be/ns/abstracten#"	"Laag.laagRol"	"http://www.w3.org/2002/07/owl#ObjectProperty"	"https://wegenenverkeer.data.vlaanderen.be/ns/abstracten#Laag"	"http://www.w3.org/2004/02/skos/core#Concept"	""	"1"	"1"
"attribute"	"OSLO-Abstracten"	"lengte"	"{FA08A6B6-30C4-403d-889C-CC68626FB900}"	""	"Laag"	"{58E7E3BD-A9A9-4e04-957D-942F897D7ED8}"	"KwantWrdInMeter"	"lengte"	"De gemiddelde lengte van een laag in meter."	""	"lengte"	"De gemiddelde lengte van een laag in meter."	""	""	"true"	"https://wegenenverkeer.data.vlaanderen.be/ns/abstracten#"	"Laag.lengte"	"http://www.w3.org/2002/07/owl#ObjectProperty"	"https://wegenenverkeer.data.vlaanderen.be/ns/abstracten#Laag"	"https://wegenenverkeer.data.vlaanderen.be/ns/implementatieelement#KwantWrdInMeter"	""	"1"	"1"
"attribute"	"OSLO-Abstracten"	"oppervlakte"	"{8CAD8483-C674-4d8c-9D55-DAE3BA4C9B67}"	""	"Laag"	"{58E7E3BD-A9A9-4e04-957D-942F897D7ED8}"	"KwantWrdInVierkanteMeter"	"oppervlakte"	"De oppervlakte van een laag in m²."	""	"oppervlakte"	"De oppervlakte van een laag in m²."	""	""	"true"	"https://wegenenverkeer.data.vlaanderen.be/ns/abstracten#"	"Laag.oppervlakte"	"http://www.w3.org/2002/07/owl#ObjectProperty"	"https://wegenenverkeer.data.vlaanderen.be/ns/abstracten#Laag"	"https://wegenenverkeer.data.vlaanderen.be/ns/implementatieelement#KwantWrdInVierkanteMeter"	""	"1"	"1"
"attribute"	"OSLO-Onderdeel"	"diameter"	"{AD05112B-6D29-4b48-A96C-6001C3EEB3A4}"	""	"Palenrij"	"{02772D96-1961-49dc-8647-7DDB0A587B08}"	"KwantWrdInCentimeter"	"diameter"	"De diameter van de paal in centimeter."	""	"diameter"	"De diameter van de paal in centimeter."	""	""	"true"	"https://wegenenverkeer.data.vlaanderen.be/ns/onderdeel#"	"Palenrij.diameter"	"http://www.w3.org/2002/07/owl#ObjectProperty"	"https://wegenenverkeer.data.vlaanderen.be/ns/onderdeel#Palenrij"	"https://wegenenverkeer.data.vlaanderen.be/ns/implementatieelement#KwantWrdInCentimeter"	""	"1"	"1"
