"EA-Type"	"EA-Package"	"EA-Name"	"EA-GUID"	"EA-Parent"	"EA-Domain"	"EA-Domain-GUID"	"EA-Range"	"label"	"definition"	"usage"	"ap-label-nl"	"ap-definition-nl"	"ap-usageNote-nl"	"ap-codelist"	"external term"	"namespace"	"localname"	"type"	"domain"	"range"	"parent"	"min card"	"max card"
"attribute"	"OSLO-Installatie"	"basisbreedte"	"{8481497C-1970-48ff-952F-0B273E2B178F}"	""	"Gronddam"	"{F3591EF0-2975-4b71-B4DB-13AD2C47410E}"	"KwantWrdInMeter"	"basisbreedte"	"De basis breedte van de gronddam in meter."	""	"basisbreedte"	"De basis breedte van de gronddam in meter."	""	""	"true"	"https://wegenenverkeer.data.vlaanderen.be/ns/installatie#"	"Gronddam.basisbreedte"	"http://www.w3.org/2002/07/owl#ObjectProperty"	"https://wegenenverkeer.data.vlaanderen.be/ns/installatie#Gronddam"	"https://wegenenverkeer.data.vlaanderen.be/ns/implementatieelement#KwantWrdInMeter"	""	"1"	"1"
"attribute"	"OSLO-Installatie"	"gronddichtheid"	"{F34C412E-44C3-491a-B2D2-72DCE376163B}"	""	"Gronddam"	"{F3591EF0-2975-4b71-B4DB-13AD2C47410E}"	"Decimal"	"gronddichtheid"	"De gronddichtheid van de gronddam."	""	"gronddichtheid"	"De gronddichtheid van de gronddam."	""	""	"true"	"https://wegenenverkeer.data.vlaanderen.be/ns/installatie#"	"Gronddam.gronddichtheid"	"http://www.w3.org/2002/07/owl#ObjectProperty"	"https://wegenenverkeer.data.vlaanderen.be/ns/installatie#Gronddam"	"http://www.w3.org/2001/XMLSchema#decimal"	""	"1"	"1"
"attribute"	"OSLO-Installatie"	"hellingAchterzijde"	"{F51FB6DF-01DE-4086-980F-558CEC470587}"	""	"Gronddam"	"{F3591EF0-2975-4b71-B4DB-13AD2C47410E}"	"KlHelling"	"helling achterzijde"	"De hellingsgraad van de gronddam in kwarten."	""	"helling achterzijde"	"De hellingsgraad van de gronddam in kwarten."	""	""	"true"	"https://wegenenverkeer.data.vlaanderen.be/ns/installatie#"	"Gronddam.hellingAchterzijde"	"http://www.w3.org/2002/07/owl#ObjectProperty"	"https://wegenenverkeer.data.vlaanderen.be/ns/installatie#Gronddam"	"http://www.w3.org/2004/02/skos/core#Concept"	""	"1"	"1"
"attribute"	"OSLO-Installatie"	"hellingVoorzijde"	"{C2681641-FADB-4efe-ACD2-C225AAE3C768}"	""	"Gronddam"	"{F3591EF0-2975-4b71-B4DB-13AD2C47410E}"	"KlHelling"	"helling voorzijde"	"De helling van de gronddam in kwarten."	""	"helling voorzijde"	"De helling van de gronddam in kwarten."	""	""	"true"	"https://wegenenverkeer.data.vlaanderen.be/ns/installatie#"	"Gronddam.hellingVoorzijde"	"http://www.w3.org/2002/07/owl#ObjectProperty"	"https://wegenenverkeer.data.vlaanderen.be/ns/installatie#Gronddam"	"http://www.w3.org/2004/02/skos/core#Concept"	""	"1"	"1"
"attribute"	"OSLO-Installatie"	"hoogte"	"{F138652B-BDC4-4725-9746-0ED493142600}"	""	"Gronddam"	"{F3591EF0-2975-4b71-B4DB-13AD2C47410E}"	"KwantWrdInMeter"	"hoogte"	"De hoogte van de gronddam in meter."	""	"hoogte"	"De hoogte van de gronddam in meter."	""	""	"true"	"https://wegenenverkeer.data.vlaanderen.be/ns/installatie#"	"Gronddam.hoogte"	"http://www.w3.org/2002/07/owl#ObjectProperty"	"https://wegenenverkeer.data.vlaanderen.be/ns/installatie#Gronddam"	"https://wegenenverkeer.data.vlaanderen.be/ns/implementatieelement#KwantWrdInMeter"	""	"1"	"1"
"attribute"	"OSLO-Installatie"	"kruinbreedte"	"{58D1EF0C-CFD4-4f2b-95B9-C095B1BAF65E}"	""	"Gronddam"	"{F3591EF0-2975-4b71-B4DB-13AD2C47410E}"	"KwantWrdInMeter"	"kruinbreedte"	"De breedte van de kruin van de gronddam in meter."	""	"kruinbreedte"	"De breedte van de kruin van de gronddam in meter."	""	""	"true"	"https://wegenenverkeer.data.vlaanderen.be/ns/installatie#"	"Gronddam.kruinbreedte"	"http://www.w3.org/2002/07/owl#ObjectProperty"	"https://wegenenverkeer.data.vlaanderen.be/ns/installatie#Gronddam"	"https://wegenenverkeer.data.vlaanderen.be/ns/implementatieelement#KwantWrdInMeter"	""	"1"	"1"
"attribute"	"OSLO-Installatie"	"bijzonderIngerichteOnderdelen"	"{CE99ECBF-0A64-4ca7-90BE-2B861E1E135D}"	""	"Wegberm"	"{32E6A774-CEA0-4726-986D-B7409A744BC2}"	"KlWegbermBIO"	"bijzonder ingerichte onderdelen van de wegberm"	"De bijzonder ingericht onderdeel van de wegbermen."	""	"bijzonder ingerichte onderdelen van de wegberm"	"De bijzonder ingericht onderdeel van de wegbermen."	""	""	"true"	"https://wegenenverkeer.data.vlaanderen.be/ns/installatie#"	"Wegberm.bijzonderIngerichteOnderdelen"	"http://www.w3.org/2002/07/owl#ObjectProperty"	"https://wegenenverkeer.data.vlaanderen.be/ns/installatie#Wegberm"	"http://www.w3.org/2004/02/skos/core#Concept"	""	"1"	"1"
"attribute"	"OSLO-Installatie"	"type"	"{59C0F4A7-578E-45d2-8907-2D79312CAD91}"	""	"Wegberm"	"{32E6A774-CEA0-4726-986D-B7409A744BC2}"	"KlWegbermType"	"type"	"Type van wegberm."	""	"type"	"Type van wegberm."	""	""	"true"	"https://wegenenverkeer.data.vlaanderen.be/ns/installatie#"	"Wegberm.type"	"http://www.w3.org/2002/07/owl#ObjectProperty"	"https://wegenenverkeer.data.vlaanderen.be/ns/installatie#Wegberm"	"http://www.w3.org/2004/02/skos/core#Concept"	""	"1"	"1"
"attribute"	"OSLO-Installatie"	"dwarsprofiel"	"{414701B0-5350-477d-B2ED-7A0F666304D3}"	""	"Baanlichaam"	"{5626506C-7A3F-46f4-8C06-9C52996A4696}"	"DtcAWVDocument"	"dwarsprofiel"	"Een dwarsprofiel is een doorsnijding van een terrein of constructie met een verticaal vlak, aangebracht loodrecht op de as ervan."	"Bestanden van het type xlsx, dwg of pdf."	"dwarsprofiel"	"Een dwarsprofiel is een doorsnijding van een terrein of constructie met een verticaal vlak, aangebracht loodrecht op de as ervan."	""	""	"true"	"https://wegenenverkeer.data.vlaanderen.be/ns/installatie#"	"Baanlichaam.dwarsprofiel"	"http://www.w3.org/2002/07/owl#ObjectProperty"	"https://wegenenverkeer.data.vlaanderen.be/ns/installatie#Baanlichaam"	"https://wegenenverkeer.data.vlaanderen.be/ns/implementatieelement#DtcAWVDocument"	""	"1"	"1"
"attribute"	"OSLO-Installatie"	"horizontaleLigging"	"{D1C0B093-61E7-4572-B699-6CB4A5ED3474}"	""	"Baanlichaam"	"{5626506C-7A3F-46f4-8C06-9C52996A4696}"	"DtcAWVDocument"	"horizontale ligging"	"De horizontale ligging van het baanlichaam als document bijlage."	"Bestanden van het type xlsx, dwg of pdf."	"horizontale ligging"	"De horizontale ligging van het baanlichaam als document bijlage."	""	""	"true"	"https://wegenenverkeer.data.vlaanderen.be/ns/installatie#"	"Baanlichaam.horizontaleLigging"	"http://www.w3.org/2002/07/owl#ObjectProperty"	"https://wegenenverkeer.data.vlaanderen.be/ns/installatie#Baanlichaam"	"https://wegenenverkeer.data.vlaanderen.be/ns/implementatieelement#DtcAWVDocument"	""	"1"	"1"
"attribute"	"OSLO-Installatie"	"langsprofiel"	"{254DE162-1190-4697-9FA2-A76D144FFF37}"	""	"Baanlichaam"	"{5626506C-7A3F-46f4-8C06-9C52996A4696}"	"DtcAWVDocument"	"langsprofiel"	"Een langsprofiel is een doorsnijding van een terrein of constructie met een verticaal vlak, aangebracht in de lengterichting van de as ervan."	"Bestanden van het type xlsx, dwg of pdf."	"langsprofiel"	"Een langsprofiel is een doorsnijding van een terrein of constructie met een verticaal vlak, aangebracht in de lengterichting van de as ervan."	""	""	"true"	"https://wegenenverkeer.data.vlaanderen.be/ns/installatie#"	"Baanlichaam.langsprofiel"	"http://www.w3.org/2002/07/owl#ObjectProperty"	"https://wegenenverkeer.data.vlaanderen.be/ns/installatie#Baanlichaam"	"https://wegenenverkeer.data.vlaanderen.be/ns/implementatieelement#DtcAWVDocument"	""	"1"	"1"
"attribute"	"OSLO-Abstracten"	"hoogte"	"{24AC56EA-8EA6-4338-AF1B-42D60B32644B}"	""	"VegetatieElement"	"{AD10D488-167D-4022-B9E1-B9F509DED2DA}"	"KlVegetatieelementHoogte"	"hoogte"	"De hoogte van het vegetatie-element in meter."	""	"hoogte"	"De hoogte van het vegetatie-element in meter."	""	""	"true"	"https://wegenenverkeer.data.vlaanderen.be/ns/abstracten#"	"VegetatieElement.hoogte"	"http://www.w3.org/2002/07/owl#ObjectProperty"	"https://wegenenverkeer.data.vlaanderen.be/ns/abstracten#VegetatieElement"	"http://www.w3.org/2004/02/skos/core#Concept"	""	"1"	"1"
"attribute"	"OSLO-Abstracten"	"niveau"	"{61459A8C-8E73-4bb3-B690-5445FBD87B88}"	""	"VegetatieElement"	"{AD10D488-167D-4022-B9E1-B9F509DED2DA}"	"Decimal"	"niveau"	"Het niveau waarop het object zich bevindt, relatief ten opzichte van andere objecten. Negatieve waarden worden geassocieerd met ondergronds en positieve waarden met bovengronds. Nul wordt beschouwd als een absolute waarde om het maaiveld aan te duiden."	""	"niveau"	"Het niveau waarop het object zich bevindt, relatief ten opzichte van andere objecten. Negatieve waarden worden geassocieerd met ondergronds en positieve waarden met bovengronds. Nul wordt beschouwd als een absolute waarde om het maaiveld aan te duiden."	""	""	"true"	"https://wegenenverkeer.data.vlaanderen.be/ns/abstracten#"	"VegetatieElement.niveau"	"http://www.w3.org/2002/07/owl#ObjectProperty"	"https://wegenenverkeer.data.vlaanderen.be/ns/abstracten#VegetatieElement"	"http://www.w3.org/2001/XMLSchema#decimal"	""	"1"	"1"
"attribute"	"OSLO-Abstracten"	"plantdatum"	"{38027332-9C53-4c60-A4B7-ACF8CED2EE43}"	""	"VegetatieElement"	"{AD10D488-167D-4022-B9E1-B9F509DED2DA}"	"Date"	"plantdatum"	"De datum waarop het vegetatie element werd geplant."	""	"plantdatum"	"De datum waarop het vegetatie element werd geplant."	""	""	"true"	"https://wegenenverkeer.data.vlaanderen.be/ns/abstracten#"	"VegetatieElement.plantdatum"	"http://www.w3.org/2002/07/owl#DatatypeProperty"	"https://wegenenverkeer.data.vlaanderen.be/ns/abstracten#VegetatieElement"	"http://www.w3.org/2001/XMLSchema#date"	""	"1"	"1"
"attribute"	"OSLO-Abstracten"	"soortnaam"	"{B83D8D06-60EC-4e52-87E5-BC1ACBD74AAA}"	""	"VegetatieElement"	"{AD10D488-167D-4022-B9E1-B9F509DED2DA}"	"DtcVegetatieSoortnaam"	"soortnaam"	"De naam van de plantensoort."	""	"soortnaam"	"De naam van de plantensoort."	""	""	"true"	"https://wegenenverkeer.data.vlaanderen.be/ns/abstracten#"	"VegetatieElement.soortnaam"	"http://www.w3.org/2002/07/owl#ObjectProperty"	"https://wegenenverkeer.data.vlaanderen.be/ns/abstracten#VegetatieElement"	"https://wegenenverkeer.data.vlaanderen.be/ns/onderdeel#DtcVegetatieSoortnaam"	""	"1"	"1"
"attribute"	"OSLO-Onderdeel"	"nalichtingstijd"	"{C1432610-E1BC-44c3-9C6F-1EF042D1C7F0}"	""	"Pictogram"	"{7C88131E-C34D-40ba-BEC9-48F64B96DABB}"	"KwantWrdInMinuut"	"nalichtingstijd"	"De tijd dat het opgeslagen licht (bij bv. Fosforen) in een andere lichtfrekwentie ( met minder energie ) weer wordt uitgezonden."	""	"nalichtingstijd"	"De tijd dat het opgeslagen licht (bij bv. Fosforen) in een andere lichtfrekwentie ( met minder energie ) weer wordt uitgezonden."	""	""	"true"	"https://wegenenverkeer.data.vlaanderen.be/ns/onderdeel#"	"Pictogram.nalichtingstijd"	"http://www.w3.org/2002/07/owl#ObjectProperty"	"https://wegenenverkeer.data.vlaanderen.be/ns/onderdeel#Pictogram"	"https://wegenenverkeer.data.vlaanderen.be/ns/implementatieelement#KwantWrdInMinuut"	""	"1"	"1"
"attribute"	"OSLO-Onderdeel"	"opschrift"	"{AE93C412-1B3E-4ab1-9F50-74FC300F702E}"	""	"Pictogram"	"{7C88131E-C34D-40ba-BEC9-48F64B96DABB}"	"String"	"opschrift"	"Eventueel begeleidende tekst bij het symbool."	""	"opschrift"	"Eventueel begeleidende tekst bij het symbool."	""	""	"true"	"https://wegenenverkeer.data.vlaanderen.be/ns/onderdeel#"	"Pictogram.opschrift"	"http://www.w3.org/2002/07/owl#DatatypeProperty"	"https://wegenenverkeer.data.vlaanderen.be/ns/onderdeel#Pictogram"	"http://www.w3.org/2001/XMLSchema#string"	""	"1"	"1"
"attribute"	"OSLO-Onderdeel"	"symbool"	"{37F58A73-C06A-4eea-93A2-B20465769253}"	""	"Pictogram"	"{7C88131E-C34D-40ba-BEC9-48F64B96DABB}"	"KlPictogramSymbool"	"symbool"	"Het symbool op het pictogram."	""	"symbool"	"Het symbool op het pictogram."	""	""	"true"	"https://wegenenverkeer.data.vlaanderen.be/ns/onderdeel#"	"Pictogram.symbool"	"http://www.w3.org/2002/07/owl#ObjectProperty"	"https://wegenenverkeer.data.vlaanderen.be/ns/onderdeel#Pictogram"	"http://www.w3.org/2004/02/skos/core#Concept"	""	"1"	"1"
"attribute"	"OSLO-Onderdeel"	"type"	"{3260151F-0D21-447c-9341-0B5557E60A01}"	""	"Opening"	"{423974A6-E842-405d-BFFF-9B6647EA8DDB}"	"KlLEGCOpeningType"	"type"	"Bepaling van het type van doorgang (sas, nooddeur) (voorlopig opgenomen in figuur 8-4-1)"	""	"type"	"Bepaling van het type van doorgang (sas, nooddeur) (voorlopig opgenomen in figuur 8-4-1)"	""	""	"true"	"https://wegenenverkeer.data.vlaanderen.be/ns/onderdeel#"	"Opening.type"	"http://www.w3.org/2002/07/owl#ObjectProperty"	"https://wegenenverkeer.data.vlaanderen.be/ns/onderdeel#Opening"	"http://www.w3.org/2004/02/skos/core#Concept"	""	"1"	"1"
"attribute"	"OSLO-Onderdeel"	"snelheidsklasse"	"{4BAA9031-A85F-4de8-BF04-C9AE50CB4DAB}"	""	"Motorvangplank"	"{DFADA3BC-AD0E-485f-811E-039F7C168A25}"	"KlLEACSnelheidsklasse"	"snelheidsklasse"	"De snelheid waarmee de testen uitgevoerd worden en of deze plaatsvinden op een continu of discontinu (niet in gebruik bij AWV) systeem"	""	"snelheidsklasse"	"De snelheid waarmee de testen uitgevoerd worden en of deze plaatsvinden op een continu of discontinu (niet in gebruik bij AWV) systeem"	""	""	"true"	"https://wegenenverkeer.data.vlaanderen.be/ns/onderdeel#"	"Motorvangplank.snelheidsklasse"	"http://www.w3.org/2002/07/owl#ObjectProperty"	"https://wegenenverkeer.data.vlaanderen.be/ns/onderdeel#Motorvangplank"	"http://www.w3.org/2004/02/skos/core#Concept"	""	"1"	"1"
"attribute"	"OSLO-Onderdeel"	"werkingsbreedteMvpwd"	"{3E4ED86C-68DB-44c9-9663-D777521731CE}"	""	"Motorvangplank"	"{DFADA3BC-AD0E-485f-811E-039F7C168A25}"	"KwantWrdInMeter"	"werkingsbreedte mvpwd"	"De afstand tussen de voorkant van het onvervormd systeem tot de maximale dynamische laterale positie van elk onderdeel van het systeem."	""	"werkingsbreedte mvpwd"	"De afstand tussen de voorkant van het onvervormd systeem tot de maximale dynamische laterale positie van elk onderdeel van het systeem."	""	""	"true"	"https://wegenenverkeer.data.vlaanderen.be/ns/onderdeel#"	"Motorvangplank.werkingsbreedteMvpwd"	"http://www.w3.org/2002/07/owl#ObjectProperty"	"https://wegenenverkeer.data.vlaanderen.be/ns/onderdeel#Motorvangplank"	"https://wegenenverkeer.data.vlaanderen.be/ns/implementatieelement#KwantWrdInMeter"	""	"1"	"1"
"attribute"	"OSLO-Abstracten"	"aanlegdatum"	"{C2E11634-8470-45ce-9814-2175728FE0A8}"	""	"LijnvormigElement"	"{728C6382-F0D6-4b33-BC97-8F490C8702E0}"	"Date"	"aanlegdatum"	"De datum van aanleg van het lijnvormige element."	""	"aanlegdatum"	"De datum van aanleg van het lijnvormige element."	""	""	"true"	"https://wegenenverkeer.data.vlaanderen.be/ns/abstracten#"	"LijnvormigElement.aanlegdatum"	"http://www.w3.org/2002/07/owl#DatatypeProperty"	"https://wegenenverkeer.data.vlaanderen.be/ns/abstracten#LijnvormigElement"	"http://www.w3.org/2001/XMLSchema#date"	""	"1"	"1"
"attribute"	"OSLO-Abstracten"	"technischeFiche"	"{F5C4B71A-0DA8-4a08-B5A7-DA81DFE52029}"	""	"LijnvormigElement"	"{728C6382-F0D6-4b33-BC97-8F490C8702E0}"	"DtcAWVDocument"	"technische fiche"	"De technische fiche van het lijnvormig element."	""	"technische fiche"	"De technische fiche van het lijnvormig element."	""	""	"true"	"https://wegenenverkeer.data.vlaanderen.be/ns/abstracten#"	"LijnvormigElement.technischeFiche"	"http://www.w3.org/2002/07/owl#ObjectProperty"	"https://wegenenverkeer.data.vlaanderen.be/ns/abstracten#LijnvormigElement"	"https://wegenenverkeer.data.vlaanderen.be/ns/implementatieelement#DtcAWVDocument"	""	"1"	"*"
"attribute"	"OSLO-Installatie"	"rioleringsbeheerder"	"{11349BD8-B2CD-40ed-B020-A0A3DCB4B421}"	""	"Riolering"	"{C1BC609F-3833-4730-B98C-81AF66ABBFE4}"	"KlRioleringBeheerder"	"rioleringsbeheerder"	"De beheerder van de rioleringsinfrastructuur."	""	"rioleringsbeheerder"	"De beheerder van de rioleringsinfrastructuur."	""	""	"true"	"https://wegenenverkeer.data.vlaanderen.be/ns/installatie#"	"Riolering.rioleringsbeheerder"	"http://www.w3.org/2002/07/owl#ObjectProperty"	"https://wegenenverkeer.data.vlaanderen.be/ns/installatie#Riolering"	"http://www.w3.org/2004/02/skos/core#Concept"	""	"1"	"1"
"attribute"	"OSLO-Installatie"	"rioleringseigenaar"	"{714AD159-3A0F-4a91-BF47-F7347592E2B7}"	""	"Riolering"	"{C1BC609F-3833-4730-B98C-81AF66ABBFE4}"	"KlRioleringEigenaar"	"rioleringseigenaar"	"De eigenaar van de rioleringsinfrastructuur zoals deze gekend is binnen AWIS 2.0."	""	"rioleringseigenaar"	"De eigenaar van de rioleringsinfrastructuur zoals deze gekend is binnen AWIS 2.0."	""	""	"true"	"https://wegenenverkeer.data.vlaanderen.be/ns/installatie#"	"Riolering.rioleringseigenaar"	"http://www.w3.org/2002/07/owl#ObjectProperty"	"https://wegenenverkeer.data.vlaanderen.be/ns/installatie#Riolering"	"http://www.w3.org/2004/02/skos/core#Concept"	""	"1"	"1"
"attribute"	"OSLO-Installatie"	"rioleringsstelsel"	"{CE7F8C01-6B75-4383-9667-91BCCA946440}"	""	"Riolering"	"{C1BC609F-3833-4730-B98C-81AF66ABBFE4}"	"KlRioleringStelsel"	"rioleringsstelsel"	"Geeft aan wat voor afvoerwater er door de riolering afgevoerd wordt."	""	"rioleringsstelsel"	"Geeft aan wat voor afvoerwater er door de riolering afgevoerd wordt."	""	""	"true"	"https://wegenenverkeer.data.vlaanderen.be/ns/installatie#"	"Riolering.rioleringsstelsel"	"http://www.w3.org/2002/07/owl#ObjectProperty"	"https://wegenenverkeer.data.vlaanderen.be/ns/installatie#Riolering"	"http://www.w3.org/2004/02/skos/core#Concept"	""	"1"	"1"
"attribute"	"OSLO-Onderdeel"	"plaats"	"{CE4E9BEF-6728-4b47-A13A-BDBE3268EE21}"	""	"Putbekleding"	"{DEF118FB-D997-433f-B0C2-CC90ED698D4B}"	"KlBekledingPlaats"	"plaats"	"De plaats van de bekleding van de put."	""	"plaats"	"De plaats van de bekleding van de put."	""	""	"true"	"https://wegenenverkeer.data.vlaanderen.be/ns/onderdeel#"	"Putbekleding.plaats"	"http://www.w3.org/2002/07/owl#ObjectProperty"	"https://wegenenverkeer.data.vlaanderen.be/ns/onderdeel#Putbekleding"	"http://www.w3.org/2004/02/skos/core#Concept"	""	"1"	"1"
"attribute"	"OSLO-Onderdeel"	"type"	"{EBA25EC7-5A9A-47a1-8F86-02333134643E}"	""	"Putbekleding"	"{DEF118FB-D997-433f-B0C2-CC90ED698D4B}"	"KlPutbekledingType"	"type"	"Bepaalt het type van de putbekleding."	""	"type"	"Bepaalt het type van de putbekleding."	""	""	"true"	"https://wegenenverkeer.data.vlaanderen.be/ns/onderdeel#"	"Putbekleding.type"	"http://www.w3.org/2002/07/owl#ObjectProperty"	"https://wegenenverkeer.data.vlaanderen.be/ns/onderdeel#Putbekleding"	"http://www.w3.org/2004/02/skos/core#Concept"	""	"1"	"1"
"attribute"	"OSLO-Onderdeel"	"typeRiooltoegang"	"{4384E940-9D8A-4ee6-A13A-6461B414FC64}"	""	"Riooltoegang"	"{F867E0BF-D37E-41e6-9510-0968D3972A3E}"	"KlUitlaatType"	"type riooltoegang"	"Bepaalt het type van een riooltoegang."	""	"type riooltoegang"	"Bepaalt het type van een riooltoegang."	""	""	"true"	"https://wegenenverkeer.data.vlaanderen.be/ns/onderdeel#"	"Riooltoegang.typeRiooltoegang"	"http://www.w3.org/2002/07/owl#ObjectProperty"	"https://wegenenverkeer.data.vlaanderen.be/ns/onderdeel#Riooltoegang"	"http://www.w3.org/2004/02/skos/core#Concept"	""	"1"	"1"
"attribute"	"OSLO-Installatie"	"materiaal"	"{33831D8E-764A-49db-9D29-FC87C22736C0}"	""	"BlindePut"	"{169AB14B-E487-46d9-84F1-EAB198CD55B0}"	"KlPutMateriaal"	"materiaal"	"Het materiaal waaruit de blinde put is vervaardigd."	""	"materiaal"	"Het materiaal waaruit de blinde put is vervaardigd."	""	""	"true"	"https://wegenenverkeer.data.vlaanderen.be/ns/installatie#"	"BlindePut.materiaal"	"http://www.w3.org/2002/07/owl#ObjectProperty"	"https://wegenenverkeer.data.vlaanderen.be/ns/installatie#BlindePut"	"http://www.w3.org/2004/02/skos/core#Concept"	""	"1"	"1"
"attribute"	"OSLO-Onderdeel"	"materiaal"	"{E51D3E54-B4C3-4a6a-9720-C74407F4345A}"	""	"Kopmuur"	"{29E7BAA1-9194-42f5-8A60-8FC9190A6DAC}"	"KlKopmuurMateriaal"	"materiaal"	"Bepaalt het materiaal van de kopmuur."	""	"materiaal"	"Bepaalt het materiaal van de kopmuur."	""	""	"true"	"https://wegenenverkeer.data.vlaanderen.be/ns/onderdeel#"	"Kopmuur.materiaal"	"http://www.w3.org/2002/07/owl#ObjectProperty"	"https://wegenenverkeer.data.vlaanderen.be/ns/onderdeel#Kopmuur"	"http://www.w3.org/2004/02/skos/core#Concept"	""	"1"	"1"
"attribute"	"OSLO-Onderdeel"	"afgesloten"	"{346B8BD1-5C66-4522-BA49-7527B1214C16}"	""	"Bovenbouw"	"{54F0FA0C-DF07-4e34-988E-E04A6181C9C2}"	"Boolean"	"afgesloten"	"Geeft aan of de afsluitinrichting kan worden afgesloten of niet."	""	"afgesloten"	"Geeft aan of de afsluitinrichting kan worden afgesloten of niet."	""	""	"true"	"https://wegenenverkeer.data.vlaanderen.be/ns/onderdeel#"	"Bovenbouw.afgesloten"	"http://www.w3.org/2002/07/owl#DatatypeProperty"	"https://wegenenverkeer.data.vlaanderen.be/ns/onderdeel#Bovenbouw"	"http://www.w3.org/2001/XMLSchema#boolean"	""	"1"	"1"
"attribute"	"OSLO-Onderdeel"	"breedte"	"{3A876AAE-437F-4ed0-9C6E-0C7D022A6591}"	""	"Bovenbouw"	"{54F0FA0C-DF07-4e34-988E-E04A6181C9C2}"	"KwantWrdInCentimeter"	"breedte"	"Breedte-afmeting van het deksel in centimeter. Bij vierkante en cirkelvormige deksels is deze waarde gelijk aan de hoogte."	""	"breedte"	"Breedte-afmeting van het deksel in centimeter. Bij vierkante en cirkelvormige deksels is deze waarde gelijk aan de hoogte."	""	""	"true"	"https://wegenenverkeer.data.vlaanderen.be/ns/onderdeel#"	"Bovenbouw.breedte"	"http://www.w3.org/2002/07/owl#ObjectProperty"	"https://wegenenverkeer.data.vlaanderen.be/ns/onderdeel#Bovenbouw"	"https://wegenenverkeer.data.vlaanderen.be/ns/implementatieelement#KwantWrdInCentimeter"	""	"1"	"1"
"attribute"	"OSLO-Onderdeel"	"dekselklasse"	"{B7D847CB-DCE2-4ac6-B477-13CB05638EAF}"	""	"Bovenbouw"	"{54F0FA0C-DF07-4e34-988E-E04A6181C9C2}"	"KlDekselKlasse"	"dekselklasse"	"Bepaalt de mate waarin het deksel van de bovenbouw belast kan worden door voertuigen."	""	"dekselklasse"	"Bepaalt de mate waarin het deksel van de bovenbouw belast kan worden door voertuigen."	""	""	"true"	"https://wegenenverkeer.data.vlaanderen.be/ns/onderdeel#"	"Bovenbouw.dekselklasse"	"http://www.w3.org/2002/07/owl#ObjectProperty"	"https://wegenenverkeer.data.vlaanderen.be/ns/onderdeel#Bovenbouw"	"http://www.w3.org/2004/02/skos/core#Concept"	""	"1"	"1"
"attribute"	"OSLO-Onderdeel"	"dekselvorm"	"{88B74AD0-A710-42ee-AE4B-7E7C30916FDB}"	""	"Bovenbouw"	"{54F0FA0C-DF07-4e34-988E-E04A6181C9C2}"	"KlRioleringVorm"	"dekselvorm"	"Bepaalt de vorm van het deksel."	""	"dekselvorm"	"Bepaalt de vorm van het deksel."	""	""	"true"	"https://wegenenverkeer.data.vlaanderen.be/ns/onderdeel#"	"Bovenbouw.dekselvorm"	"http://www.w3.org/2002/07/owl#ObjectProperty"	"https://wegenenverkeer.data.vlaanderen.be/ns/onderdeel#Bovenbouw"	"http://www.w3.org/2004/02/skos/core#Concept"	""	"1"	"1"
"attribute"	"OSLO-Onderdeel"	"hoogte"	"{94A7A47D-6B6E-4a6b-B5DF-F88CDAD923D4}"	""	"Bovenbouw"	"{54F0FA0C-DF07-4e34-988E-E04A6181C9C2}"	"KwantWrdInCentimeter"	"hoogte"	"Hoogte-afmeting van het deksel in centimeter. Bij vierkante en cirkelvormige deksels is deze waarde gelijk aan de breedte."	""	"hoogte"	"Hoogte-afmeting van het deksel in centimeter. Bij vierkante en cirkelvormige deksels is deze waarde gelijk aan de breedte."	""	""	"true"	"https://wegenenverkeer.data.vlaanderen.be/ns/onderdeel#"	"Bovenbouw.hoogte"	"http://www.w3.org/2002/07/owl#ObjectProperty"	"https://wegenenverkeer.data.vlaanderen.be/ns/onderdeel#Bovenbouw"	"https://wegenenverkeer.data.vlaanderen.be/ns/implementatieelement#KwantWrdInCentimeter"	""	"1"	"1"
"attribute"	"OSLO-Onderdeel"	"kader"	"{C5542314-EE8B-485d-8CB5-CA2F5B9B6E42}"	""	"Bovenbouw"	"{54F0FA0C-DF07-4e34-988E-E04A6181C9C2}"	"KlDekselKaderType"	"kader"	"Bepaalt het type van het dekselkader."	""	"kader"	"Bepaalt het type van het dekselkader."	""	""	"true"	"https://wegenenverkeer.data.vlaanderen.be/ns/onderdeel#"	"Bovenbouw.kader"	"http://www.w3.org/2002/07/owl#ObjectProperty"	"https://wegenenverkeer.data.vlaanderen.be/ns/onderdeel#Bovenbouw"	"http://www.w3.org/2004/02/skos/core#Concept"	""	"1"	"1"
"attribute"	"OSLO-Onderdeel"	"materiaal"	"{8FB046D5-8239-41b0-9C29-38B676EAC3C9}"	""	"Bovenbouw"	"{54F0FA0C-DF07-4e34-988E-E04A6181C9C2}"	"KlDekselMateriaal"	"materiaal"	"Het materiaal waaruit het deksel van de bovenbouw is vervaardigd."	""	"materiaal"	"Het materiaal waaruit het deksel van de bovenbouw is vervaardigd."	""	""	"true"	"https://wegenenverkeer.data.vlaanderen.be/ns/onderdeel#"	"Bovenbouw.materiaal"	"http://www.w3.org/2002/07/owl#ObjectProperty"	"https://wegenenverkeer.data.vlaanderen.be/ns/onderdeel#Bovenbouw"	"http://www.w3.org/2004/02/skos/core#Concept"	""	"1"	"1"
"attribute"	"OSLO-Onderdeel"	"oppervlakte"	"{06A82696-541A-4ea3-AD72-7A874BC8B67F}"	""	"Bovenbouw"	"{54F0FA0C-DF07-4e34-988E-E04A6181C9C2}"	"Decimal"	"oppervlakte"	"De oppervlakte van de bovenbouw"	""	"oppervlakte"	"De oppervlakte van de bovenbouw"	""	""	"true"	"https://wegenenverkeer.data.vlaanderen.be/ns/onderdeel#"	"Bovenbouw.oppervlakte"	"http://www.w3.org/2002/07/owl#ObjectProperty"	"https://wegenenverkeer.data.vlaanderen.be/ns/onderdeel#Bovenbouw"	"http://www.w3.org/2001/XMLSchema#decimal"	""	"1"	"1"
"attribute"	"OSLO-Onderdeel"	"regeling"	"{7F00EC90-2B22-4fcb-929A-F52D1416B583}"	""	"Bovenbouw"	"{54F0FA0C-DF07-4e34-988E-E04A6181C9C2}"	"KlDekselRegeling"	"regeling"	"Bepaalt hoe de regeling van het deksel gebeurt."	""	"regeling"	"Bepaalt hoe de regeling van het deksel gebeurt."	""	""	"true"	"https://wegenenverkeer.data.vlaanderen.be/ns/onderdeel#"	"Bovenbouw.regeling"	"http://www.w3.org/2002/07/owl#ObjectProperty"	"https://wegenenverkeer.data.vlaanderen.be/ns/onderdeel#Bovenbouw"	"http://www.w3.org/2004/02/skos/core#Concept"	""	"1"	"1"
"attribute"	"OSLO-Onderdeel"	"scharnierend"	"{5AA4716A-3DE5-44ab-80D9-3BD32D1AE1D5}"	""	"Bovenbouw"	"{54F0FA0C-DF07-4e34-988E-E04A6181C9C2}"	"Boolean"	"scharnierend"	"Het deksel is al of niet bevestigd met een scharnier."	""	"scharnierend"	"Het deksel is al of niet bevestigd met een scharnier."	""	""	"true"	"https://wegenenverkeer.data.vlaanderen.be/ns/onderdeel#"	"Bovenbouw.scharnierend"	"http://www.w3.org/2002/07/owl#DatatypeProperty"	"https://wegenenverkeer.data.vlaanderen.be/ns/onderdeel#Bovenbouw"	"http://www.w3.org/2001/XMLSchema#boolean"	""	"1"	"1"
