"EA-Type"	"EA-Package"	"EA-Name"	"EA-GUID"	"EA-Parent"	"EA-Domain"	"EA-Domain-GUID"	"EA-Range"	"label"	"definition"	"usage"	"label-nl"	"definition-nl"	"usageNote-nl"	"label-en"	"definition-en"	"usageNote-en"	"equivalent"	"subclass"	"subclass1"	"sameAs"	"external term"	"namespace"	"localname"	"type"	"domain"	"range"	"parent"	"min card"	"max card"
"Package"	""	"OSLO-Implementatieelement"	"{6CD06FFE-B610-40b4-87B7-3F8FEAC7D400}"	""	""	""	""	""	""	""	""	""	""	""	""	""	""	""	""	""	""	"https://wegenenverkeer-test.data.vlaanderen.be/ns/"	"implementatieelement"	"http://www.w3.org/2002/07/owl#Ontology"	""	""	""	""	""
"ENUMERATION"	"OSLO-Implementatieelement"	"KlAIMToestand"	"{0B4023FA-2C71-4947-834E-10EF1C58424B}"	""	""	""	""	"AIM toestand"	"Keuzelijst met fasen uit de levenscyclus van een object om de toestand op een moment mee vast te leggen."	""	"AIM toestand"	"Keuzelijst met fasen uit de levenscyclus van een object om de toestand op een moment mee vast te leggen."	""	""	""	""	""	""	""	""	"true"	"http://www.w3.org/2004/02/skos/core#"	"Concept"	"http://www.w3.org/2000/01/rdf-schema#Class"	""	""	""	""	""
"CLASS"	"OSLO-Implementatieelement"	"AIMDBStatus"	"{3A25C84F-2295-443d-9781-A768527A71F0}"	""	""	""	""	"AIM databank status"	"Voegt een attribuut toe aan de subklasse dat aangeeft of de asset zichtbaar is in de databank of (zacht) verwijderd is."	""	"AIM databank status"	"Voegt een attribuut toe aan de subklasse dat aangeeft of de asset zichtbaar is in de databank of (zacht) verwijderd is."	""	""	""	""	""	""	""	""	"false"	"https://wegenenverkeer-test.data.vlaanderen.be/ns/implementatieelement#"	"AIMDBStatus"	"http://www.w3.org/2000/01/rdf-schema#Class"	""	""	""	""	""
"CLASS"	"OSLO-Implementatieelement"	"Derdenobject"	"{6D5FE420-C0A1-4007-9C70-54C2F32C2970}"	""	""	""	""	"Derdenobject"	"Object niet in eigendom van de assetbeheerder dat zonder verdere typering bewaard wordt om relaties met getypeerde assets te kunnen beheren."	""	"Derdenobject"	"Object niet in eigendom van de assetbeheerder dat zonder verdere typering bewaard wordt om relaties met getypeerde assets te kunnen beheren."	""	""	""	""	""	""	""	""	"false"	"https://wegenenverkeer-test.data.vlaanderen.be/ns/implementatieelement#"	"Derdenobject"	"http://www.w3.org/2000/01/rdf-schema#Class"	""	""	"https://wegenenverkeer-test.data.vlaanderen.be/ns/implementatieelement#AIMToestand, https://wegenenverkeer-test.data.vlaanderen.be/ns/implementatieelement#AIMDBStatus"	""	""
"CLASS"	"OSLO-Implementatieelement"	"AIMNaamObject"	"{F0C7C695-ED74-45e1-BE46-E596B7773151}"	""	""	""	""	"AIM naam object"	"Abstracte als de basisklasse voor elk OTL object dat benoemd wordt met een mensleesbare identificator."	""	"AIM naam object"	"Abstracte als de basisklasse voor elk OTL object dat benoemd wordt met een mensleesbare identificator."	""	""	""	""	""	""	""	""	"false"	"https://wegenenverkeer-test.data.vlaanderen.be/ns/implementatieelement#"	"AIMNaamObject"	"http://www.w3.org/2000/01/rdf-schema#Class"	""	""	"https://wegenenverkeer-test.data.vlaanderen.be/ns/implementatieelement#AIMObject"	""	""
"CLASS"	"OSLO-Implementatieelement"	"Agent"	"{F468FC72-1F16-4283-85A8-28FB170A08E2}"	""	""	""	""	"Agent"	"Iemand die of iets dat kan handelen of een effect kan teweeg brengen."	""	"Agent"	"Iemand die of iets dat kan handelen of een effect kan teweeg brengen."	""	""	""	""	""	""	""	""	"true"	"http://purl.org/dc/terms/"	"Agent"	"http://www.w3.org/2000/01/rdf-schema#Class"	""	""	""	""	""
"CLASS"	"OSLO-Implementatieelement"	"DirectioneleRelatie"	"{1B69F5F9-A0DF-44d5-AA99-99AFFE93C9DE}"	""	""	""	""	"Directionele relatie"	"Een abstracte die relaties groepeert waarbij de richting semantisch gedefinieerd is."	""	"Directionele relatie"	"Een abstracte die relaties groepeert waarbij de richting semantisch gedefinieerd is."	""	""	""	""	""	""	""	""	"false"	"https://wegenenverkeer-test.data.vlaanderen.be/ns/implementatieelement#"	"DirectioneleRelatie"	"http://www.w3.org/2000/01/rdf-schema#Class"	""	""	"https://wegenenverkeer-test.data.vlaanderen.be/ns/implementatieelement#RelatieObject"	""	""
"CLASS"	"OSLO-Implementatieelement"	"AIMObject"	"{B66E06D3-6DD8-4d01-B0FE-CFBB081CAEC6}"	""	""	""	""	"AIM object"	"Abstracte als de basisklasse voor alle uniek ge誰dentificeerde OTL objecten met de basiseigenschappen die elk OTL object minstens heeft."	""	"AIM object"	"Abstracte als de basisklasse voor alle uniek ge誰dentificeerde OTL objecten met de basiseigenschappen die elk OTL object minstens heeft."	""	""	""	""	""	""	""	""	"false"	"https://wegenenverkeer-test.data.vlaanderen.be/ns/implementatieelement#"	"AIMObject"	"http://www.w3.org/2000/01/rdf-schema#Class"	""	""	"https://wegenenverkeer-test.data.vlaanderen.be/ns/implementatieelement#AIMToestand, https://wegenenverkeer-test.data.vlaanderen.be/ns/implementatieelement#AIMDBStatus"	""	""
"CLASS"	"OSLO-Implementatieelement"	"RelatieObject"	"{1C850280-A01C-489e-8D8C-661277C579A7}"	""	""	""	""	"Relatieobject"	"Abstracte die de relaties voorziet van gemeenschappelijk eigenschappen."	""	"Relatieobject"	"Abstracte die de relaties voorziet van gemeenschappelijk eigenschappen."	""	""	""	""	""	""	""	""	"false"	"https://wegenenverkeer-test.data.vlaanderen.be/ns/implementatieelement#"	"RelatieObject"	"http://www.w3.org/2000/01/rdf-schema#Class"	""	""	"https://wegenenverkeer-test.data.vlaanderen.be/ns/implementatieelement#AIMDBStatus"	""	""
"CLASS"	"OSLO-Implementatieelement"	"NietDirectioneleRelatie"	"{2A1E88B9-B1B2-4d74-800B-ED6A6F7DE65E}"	""	""	""	""	"Niet-directionele relatie"	"Een abstracte die relaties groepeert waarbij de richting semantisch niet gedefinieerd is."	""	"Niet-directionele relatie"	"Een abstracte die relaties groepeert waarbij de richting semantisch niet gedefinieerd is."	""	""	""	""	""	""	""	""	"false"	"https://wegenenverkeer-test.data.vlaanderen.be/ns/implementatieelement#"	"NietDirectioneleRelatie"	"http://www.w3.org/2000/01/rdf-schema#Class"	""	""	"https://wegenenverkeer-test.data.vlaanderen.be/ns/implementatieelement#RelatieObject"	""	""
"CLASS"	"OSLO-Implementatieelement"	"AIMToestand"	"{AF1DEC32-D9CC-49cf-8BC5-7A43166C7ED7}"	""	""	""	""	"AIM Toestand"	"Voegt een attribuut toe aan de subklasse dat de huidige stand in de levenscyclus van het object aangeeft."	""	"AIM Toestand"	"Voegt een attribuut toe aan de subklasse dat de huidige stand in de levenscyclus van het object aangeeft."	""	""	""	""	""	""	""	""	"false"	"https://wegenenverkeer-test.data.vlaanderen.be/ns/implementatieelement#"	"AIMToestand"	"http://www.w3.org/2000/01/rdf-schema#Class"	""	""	""	""	""
"CLASS"	"OSLO-Implementatieelement"	"NaampadObject"	"{BD9A8B20-2A0B-4b7b-ACB4-E6D5B440F867}"	""	""	""	""	"Naampad object"	"Abstracte als de basisklasse voor elk OTL object dat gebruik maakt van een naampad."	""	"Naampad object"	"Abstracte als de basisklasse voor elk OTL object dat gebruik maakt van een naampad."	""	""	""	""	""	""	""	""	"false"	"https://wegenenverkeer-test.data.vlaanderen.be/ns/implementatieelement#"	"NaampadObject"	"http://www.w3.org/2000/01/rdf-schema#Class"	""	""	"https://wegenenverkeer-test.data.vlaanderen.be/ns/implementatieelement#AIMNaamObject"	""	""
"DATATYPE"	"OSLO-Implementatieelement"	"DtcIdentificator"	"{A55DDAFC-1722-4cc6-AE76-8D7FC1C9B920}"	""	""	""	""	"Identificator"	"Complex datatype voor de identificator van een object volgens de bron van de identificator."	""	"Identificator"	"Complex datatype voor de identificator van een object volgens de bron van de identificator."	""	""	""	""	""	""	""	""	"false"	"https://wegenenverkeer-test.data.vlaanderen.be/ns/implementatieelement#"	"DtcIdentificator"	"http://www.w3.org/2000/01/rdf-schema#Class"	""	""	""	""	""
"DATATYPE"	"OSLO-Implementatieelement"	"DtcAdres"	"{D2F0F525-9079-46c6-BD63-DFC6DEB797DA}"	""	""	""	""	"Adres"	"Complex datatype voor de aanduiding van een bepaalde locatie,doorgaans van een huis,woning,gebouw of faciliteit,op de aarde."	""	"Adres"	"Complex datatype voor de aanduiding van een bepaalde locatie,doorgaans van een huis,woning,gebouw of faciliteit,op de aarde."	""	""	""	""	""	""	""	""	"false"	"https://wegenenverkeer-test.data.vlaanderen.be/ns/implementatieelement#"	"DtcAdres"	"http://www.w3.org/2000/01/rdf-schema#Class"	""	""	""	""	""
"DATATYPE"	"OSLO-Implementatieelement"	"DtcContactinfo"	"{2BEEF33B-64FE-49e5-93A3-CD20A366870E}"	""	""	""	""	"Contactinfo"	"Complex datatype voor de informatie zoals email,telefoon,adres die toelaat om iemand of iets te contacteren."	""	"Contactinfo"	"Complex datatype voor de informatie zoals email,telefoon,adres die toelaat om iemand of iets te contacteren."	""	""	""	""	""	""	""	""	"true"	"https://schema.org/"	"ContactPoint"	"http://www.w3.org/2000/01/rdf-schema#Class"	""	""	""	""	""
"DATATYPE"	"OSLO-Implementatieelement"	"DtcTijdsduur"	"{8BDF0C74-6275-414e-8486-70F1800C617F}"	""	""	""	""	"Tijdsduur"	"Complex datatype voor de instelling van een tijdsbepaling."	""	"Tijdsduur"	"Complex datatype voor de instelling van een tijdsbepaling."	""	""	""	""	""	""	""	""	"false"	"https://wegenenverkeer-test.data.vlaanderen.be/ns/implementatieelement#"	"DtcTijdsduur"	"http://www.w3.org/2000/01/rdf-schema#Class"	""	""	""	""	""
"DATATYPE"	"OSLO-Implementatieelement"	"DtcDocument"	"{9ECFE27F-F788-451c-8D7C-F65B137B4CF4}"	""	""	""	""	"Bestandsbijlage"	"Complex datatype voor alle bestandsbijlages"	""	"Bestandsbijlage"	"Complex datatype voor alle bestandsbijlages"	""	""	""	""	""	""	""	""	"false"	"https://wegenenverkeer-test.data.vlaanderen.be/ns/implementatieelement#"	"DtcDocument"	"http://www.w3.org/2000/01/rdf-schema#Class"	""	""	""	""	""
"ENUMERATION"	"OSLO-Implementatieelement"	"KlAlgProvincie"	"{95EB274C-B435-40be-9732-5ECD04DFECC9}"	""	""	""	""	"Provincie"	"Lijst van provincies in Vlaanderen"	""	"Provincie"	"Lijst van provincies in Vlaanderen"	""	""	""	""	""	""	""	""	"true"	"http://www.w3.org/2004/02/skos/core#"	"Concept"	"http://www.w3.org/2000/01/rdf-schema#Class"	""	""	""	""	""
"ENUMERATION"	"OSLO-Implementatieelement"	"KlAlgGemeente"	"{58CEB2F4-B366-4324-AA06-61823FBE0747}"	""	""	""	""	"Gemeente"	"Lijst van gemeentes in Vlaanderen."	""	"Gemeente"	"Lijst van gemeentes in Vlaanderen."	""	""	""	""	""	""	""	""	"true"	"http://www.w3.org/2004/02/skos/core#"	"Concept"	"http://www.w3.org/2000/01/rdf-schema#Class"	""	""	""	""	""
"DATATYPE"	"OSLO-Implementatieelement"	"DtcProductidentificatiecode"	"{2B5D5666-6C31-4ca5-8BAD-2B972C11DC8E}"	""	""	""	""	"Productidentificatiecode"	"Complex datatype dat alle nodige informatie van het product capteert."	""	"Productidentificatiecode"	"Complex datatype dat alle nodige informatie van het product capteert."	""	""	""	""	""	""	""	""	"false"	"https://wegenenverkeer-test.data.vlaanderen.be/ns/implementatieelement#"	"DtcProductidentificatiecode"	"http://www.w3.org/2000/01/rdf-schema#Class"	""	""	""	""	""
"DATATYPE"	"OSLO-Implementatieelement"	"DtcAfmetingBxlxhInMm"	"{1395BC51-AABD-487c-BB40-1373BEBFA0D3}"	""	""	""	""	"Afmeting bxlxh in millimeter"	"Complex datatype voor de afmeting van de breedte,de lengte en hoogte in millimeter."	""	"Afmeting bxlxh in millimeter"	"Complex datatype voor de afmeting van de breedte,de lengte en hoogte in millimeter."	""	""	""	""	""	""	""	""	"false"	"https://wegenenverkeer-test.data.vlaanderen.be/ns/implementatieelement#"	"DtcAfmetingBxlxhInMm"	"http://www.w3.org/2000/01/rdf-schema#Class"	""	""	""	""	""
"DATATYPE"	"OSLO-Implementatieelement"	"DtcAfmetingBxlInM"	"{0945F97B-A78A-410a-B9EE-698E973EF0ED}"	""	""	""	""	"Afmeting bxl in meter"	"Complex datatype voor de afmeting van de breedte en de lengte in meter."	""	"Afmeting bxl in meter"	"Complex datatype voor de afmeting van de breedte en de lengte in meter."	""	""	""	""	""	""	""	""	"false"	"https://wegenenverkeer-test.data.vlaanderen.be/ns/implementatieelement#"	"DtcAfmetingBxlInM"	"http://www.w3.org/2000/01/rdf-schema#Class"	""	""	""	""	""
"DATATYPE"	"OSLO-Implementatieelement"	"DtcAfmetingZijdeInMm"	"{6E88B33F-C345-4367-9625-B06A503A5FA4}"	""	""	""	""	"Afmeting zijde in millimeter"	"Complex datatype voor de afmeting van een zijde in millimeter."	""	"Afmeting zijde in millimeter"	"Complex datatype voor de afmeting van een zijde in millimeter."	""	""	""	""	""	""	""	""	"false"	"https://wegenenverkeer-test.data.vlaanderen.be/ns/implementatieelement#"	"DtcAfmetingZijdeInMm"	"http://www.w3.org/2000/01/rdf-schema#Class"	""	""	""	""	""
"DATATYPE"	"OSLO-Implementatieelement"	"DtcAfmetingBxlInCm"	"{408DE980-1EC6-481e-A885-530C061CA068}"	""	""	""	""	"Afmeting bxl in centimeter."	"Complex datatype voor de afmeting van de breedte en de lengte in centimeter."	""	"Afmeting bxl in centimeter."	"Complex datatype voor de afmeting van de breedte en de lengte in centimeter."	""	""	""	""	""	""	""	""	"false"	"https://wegenenverkeer-test.data.vlaanderen.be/ns/implementatieelement#"	"DtcAfmetingBxlInCm"	"http://www.w3.org/2000/01/rdf-schema#Class"	""	""	""	""	""
"ENUMERATION"	"OSLO-Implementatieelement"	"KlAlgMimeType"	"{2D746D83-4847-4b25-A463-046F58A383F3}"	""	""	""	""	"Mimetype"	"De mime types van bestanden (AWVDocument) beperkt tot mime types voor toegelaten bestandstypen."	""	"Mimetype"	"De mime types van bestanden (AWVDocument) beperkt tot mime types voor toegelaten bestandstypen."	""	""	""	""	""	""	""	""	"true"	"http://www.w3.org/2004/02/skos/core#"	"Concept"	"http://www.w3.org/2000/01/rdf-schema#Class"	""	""	""	""	""
"DATATYPE"	"OSLO-Implementatieelement"	"DtcAfmetingDiameterInCm"	"{20E633CB-CE42-4f5c-8BC2-188454632A21}"	""	""	""	""	"Afmeting diameter in centimeter"	"Complex datatype voor de afmeting van een diameter in centimeter."	""	"Afmeting diameter in centimeter"	"Complex datatype voor de afmeting van een diameter in centimeter."	""	""	""	""	""	""	""	""	"false"	"https://wegenenverkeer-test.data.vlaanderen.be/ns/implementatieelement#"	"DtcAfmetingDiameterInCm"	"http://www.w3.org/2000/01/rdf-schema#Class"	""	""	""	""	""
"ENUMERATION"	"OSLO-Implementatieelement"	"KlAlgWeekdagen"	"{5CF62BC8-6610-43b1-8C52-C13DB4D546E3}"	""	""	""	""	"Weekdagen"	"Lijst van de verschillende weekdagen"	""	"Weekdagen"	"Lijst van de verschillende weekdagen"	""	""	""	""	""	""	""	""	"true"	"https://schema.org/"	"DayOfWeek"	"http://www.w3.org/2000/01/rdf-schema#Class"	""	""	""	""	""
"DATATYPE"	"OSLO-Implementatieelement"	"DtcOpeningsurenSpecificatie"	"{756C2406-B8D5-42cb-809F-0DEB0E7774B4}"	""	""	""	""	"Openingsurenspecificatie"	"Complex datatype dat de openingsuren volgens https://schema.org/OpeningHoursSpecification specifieert."	""	"Openingsurenspecificatie"	"Complex datatype dat de openingsuren volgens https://schema.org/OpeningHoursSpecification specifieert."	""	""	""	""	""	""	""	""	"true"	"https://schema.org/"	"OpeningHoursSpecification"	"http://www.w3.org/2000/01/rdf-schema#Class"	""	""	""	""	""
"DATATYPE"	"OSLO-Implementatieelement"	"DtcAfmetingBxhInMm"	"{BDF0191E-54B0-4226-96DF-91404CB2D39E}"	""	""	""	""	"Afmeting bxh in millimeter"	"Complex datatype voor de afmeting van de breedte en hoogte in millimeter."	""	"Afmeting bxh in millimeter"	"Complex datatype voor de afmeting van de breedte en hoogte in millimeter."	""	""	""	""	""	""	""	""	"false"	"https://wegenenverkeer-test.data.vlaanderen.be/ns/implementatieelement#"	"DtcAfmetingBxhInMm"	"http://www.w3.org/2000/01/rdf-schema#Class"	""	""	""	""	""
"DATATYPE"	"OSLO-Implementatieelement"	"DtcAfmetingDiameterInMm"	"{0EDFD1F2-D653-4a7c-B299-D9366F35DC1A}"	""	""	""	""	"Afmeting diameter in millimeter"	"Complex datatype voor de afmeting van een diameter in millimeter."	""	"Afmeting diameter in millimeter"	"Complex datatype voor de afmeting van een diameter in millimeter."	""	""	""	""	""	""	""	""	"false"	"https://wegenenverkeer-test.data.vlaanderen.be/ns/implementatieelement#"	"DtcAfmetingDiameterInMm"	"http://www.w3.org/2000/01/rdf-schema#Class"	""	""	""	""	""
"DATATYPE"	"OSLO-Implementatieelement"	"DtcAfmetingBxhInM"	"{5E10B0BD-0F92-4723-9DE2-117FD8AEA95C}"	""	""	""	""	"Afmeting bxh in meter"	"Complex datatype voor de afmeting van de breedte en hoogte in meter."	""	"Afmeting bxh in meter"	"Complex datatype voor de afmeting van de breedte en hoogte in meter."	""	""	""	""	""	""	""	""	"false"	"https://wegenenverkeer-test.data.vlaanderen.be/ns/implementatieelement#"	"DtcAfmetingBxhInM"	"http://www.w3.org/2000/01/rdf-schema#Class"	""	""	""	""	""
"DATATYPE"	"OSLO-Implementatieelement"	"DtcNatuurlijkPersoon"	"{A43C3198-6C44-4360-B53A-CC43C7338DF0}"	""	""	""	""	"Natuurlijk persoon"	"Complex datatype dat een natuurlijk persoon beschrijft."	""	"Natuurlijk persoon"	"Complex datatype dat een natuurlijk persoon beschrijft."	""	""	""	""	""	""	""	""	"false"	"https://wegenenverkeer-test.data.vlaanderen.be/ns/implementatieelement#"	"DtcNatuurlijkPersoon"	"http://www.w3.org/2000/01/rdf-schema#Class"	""	""	""	""	""
"DATATYPE"	"OSLO-Implementatieelement"	"DtcAfmetingBxlxhInM"	"{639F9E2D-07BE-4214-92B2-1CE223958474}"	""	""	""	""	"Afmeting bxlxh in meter"	"Complex datatype voor de afmeting van de breedte,de lengte en hoogte in meter."	""	"Afmeting bxlxh in meter"	"Complex datatype voor de afmeting van de breedte,de lengte en hoogte in meter."	""	""	""	""	""	""	""	""	"false"	"https://wegenenverkeer-test.data.vlaanderen.be/ns/implementatieelement#"	"DtcAfmetingBxlxhInM"	"http://www.w3.org/2000/01/rdf-schema#Class"	""	""	""	""	""
"DATATYPE"	"OSLO-Implementatieelement"	"DtcRechtspersoon"	"{D99E3031-87AF-456f-8BD2-539D90E081AA}"	""	""	""	""	"Rechtspersoon"	"Complex datatype voor een rechtspersoon."	""	"Rechtspersoon"	"Complex datatype voor een rechtspersoon."	""	""	""	""	""	""	""	""	"false"	"https://wegenenverkeer-test.data.vlaanderen.be/ns/implementatieelement#"	"DtcRechtspersoon"	"http://www.w3.org/2000/01/rdf-schema#Class"	""	""	""	""	""
"DATATYPE"	"OSLO-Implementatieelement"	"KwantWrdInInch"	"{A3DF52BF-592D-452e-AB34-7E186015C072}"	""	""	""	""	"Kwantitatieve waarde in inch"	"Een kwantitatieve waarde die een getal in inches uitdrukt."	""	"Kwantitatieve waarde in inch"	"Een kwantitatieve waarde die een getal in inches uitdrukt."	""	""	""	""	""	""	""	""	"false"	"https://wegenenverkeer-test.data.vlaanderen.be/ns/implementatieelement#"	"KwantWrdInInch"	"http://www.w3.org/2000/01/rdf-schema#Class"	""	""	""	""	""
"DATATYPE"	"OSLO-Implementatieelement"	"KwantWrdInMeter"	"{94C31F8A-C719-45f0-A8A1-FB2683E6A8CF}"	""	""	""	""	"Kwantitatieve waarde in meter"	"Een kwantitatieve waarde die een getal in meter uitdrukt."	""	"Kwantitatieve waarde in meter"	"Een kwantitatieve waarde die een getal in meter uitdrukt."	""	""	""	""	""	""	""	""	"false"	"https://wegenenverkeer-test.data.vlaanderen.be/ns/implementatieelement#"	"KwantWrdInMeter"	"http://www.w3.org/2000/01/rdf-schema#Class"	""	""	""	""	""
"DATATYPE"	"OSLO-Implementatieelement"	"KwantWrdInKiloVoltAmpere"	"{BEE072CC-15D8-4922-A575-40971BB33C4E}"	""	""	""	""	"Kwantitatieve waarde in kiloVoltAmpere"	"Een kwantitatieve waarde die een getal in kiloVoltAmpere uitdrukt."	""	"Kwantitatieve waarde in kiloVoltAmpere"	"Een kwantitatieve waarde die een getal in kiloVoltAmpere uitdrukt."	""	""	""	""	""	""	""	""	"false"	"https://wegenenverkeer-test.data.vlaanderen.be/ns/implementatieelement#"	"KwantWrdInKiloVoltAmpere"	"http://www.w3.org/2000/01/rdf-schema#Class"	""	""	""	""	""
"DATATYPE"	"OSLO-Implementatieelement"	"KwantWrdInMeterTAW"	"{87363FD6-6F25-4db0-A4BE-8A180C0EE0A8}"	""	""	""	""	"Kwantitatieve waarde in meter TAW"	"Een kwantitatieve waarde die de hoogte weergeeft in meter van een locatie tov het TAW-referentiepeil."	""	"Kwantitatieve waarde in meter TAW"	"Een kwantitatieve waarde die de hoogte weergeeft in meter van een locatie tov het TAW-referentiepeil."	""	""	""	""	""	""	""	""	"false"	"https://wegenenverkeer-test.data.vlaanderen.be/ns/implementatieelement#"	"KwantWrdInMeterTAW"	"http://www.w3.org/2000/01/rdf-schema#Class"	""	""	""	""	""
"DATATYPE"	"OSLO-Implementatieelement"	"KwantWrdInKiloVolt"	"{7A075704-421C-40e8-82E7-F749E7C9ACFA}"	""	""	""	""	"Kwantitatieve waarde in kilovolt"	"Een kwantitatieve waarde die een getal in kilovolt uitdrukt."	""	"Kwantitatieve waarde in kilovolt"	"Een kwantitatieve waarde die een getal in kilovolt uitdrukt."	""	""	""	""	""	""	""	""	"false"	"https://wegenenverkeer-test.data.vlaanderen.be/ns/implementatieelement#"	"KwantWrdInKiloVolt"	"http://www.w3.org/2000/01/rdf-schema#Class"	""	""	""	""	""
"DATATYPE"	"OSLO-Implementatieelement"	"KwantWrdInCentimeter"	"{5E999EE5-C3A1-4e4f-9538-F3DD7B0DA137}"	""	""	""	""	"Kwantitatieve waarde in centimeter"	"Een kwantitatieve waarde die een getal in centimeter uitdrukt."	""	"Kwantitatieve waarde in centimeter"	"Een kwantitatieve waarde die een getal in centimeter uitdrukt."	""	""	""	""	""	""	""	""	"false"	"https://wegenenverkeer-test.data.vlaanderen.be/ns/implementatieelement#"	"KwantWrdInCentimeter"	"http://www.w3.org/2000/01/rdf-schema#Class"	""	""	""	""	""
"DATATYPE"	"OSLO-Implementatieelement"	"KwantWrdInJaar"	"{7268D2CF-C570-44b8-A990-C5AE7FA5E527}"	""	""	""	""	"Kwantitatieve waarde in aantal jaar"	"Een kwantitatieve waarde die een getal in aantal jaar uitdrukt."	""	"Kwantitatieve waarde in aantal jaar"	"Een kwantitatieve waarde die een getal in aantal jaar uitdrukt."	""	""	""	""	""	""	""	""	"false"	"https://wegenenverkeer-test.data.vlaanderen.be/ns/implementatieelement#"	"KwantWrdInJaar"	"http://www.w3.org/2000/01/rdf-schema#Class"	""	""	""	""	""
"DATATYPE"	"OSLO-Implementatieelement"	"DteKleurRAL"	"{39A329C4-D7BA-449f-895D-13F854B4C055}"	""	""	""	""	"RAL-kleur"	"Beschrijft een kleur volgens het RAL klassificatiesysteem. De waarde is een natuurlijk getal tussen 1000 en 9999."	""	"RAL-kleur"	"Beschrijft een kleur volgens het RAL klassificatiesysteem. De waarde is een natuurlijk getal tussen 1000 en 9999."	""	""	""	""	""	""	""	""	"false"	"https://wegenenverkeer-test.data.vlaanderen.be/ns/implementatieelement#"	"DteKleurRAL"	"http://www.w3.org/2000/01/rdf-schema#Class"	""	""	""	""	""
"DATATYPE"	"OSLO-Implementatieelement"	"DteIPv4Adres"	"{8D2FA01C-0286-473c-95E6-4D214A93B258}"	""	""	""	""	"IPv4-adres"	"Beschrijft een ip-adres volgens de ipv4 specificatie."	""	"IPv4-adres"	"Beschrijft een ip-adres volgens de ipv4 specificatie."	""	""	""	""	""	""	""	""	"false"	"https://wegenenverkeer-test.data.vlaanderen.be/ns/implementatieelement#"	"DteIPv4Adres"	"http://www.w3.org/2000/01/rdf-schema#Class"	""	""	""	""	""
"DATATYPE"	"OSLO-Implementatieelement"	"DteTekstblok"	"{CEF0E482-851E-4797-836B-F3A5082057C9}"	""	""	""	""	"Tekstblok"	"Een tekst welke uit meerdere zinnen bestaat,en ook regeleindes kan bevatten. Een tekstblok bevat maximaal 65.000 karakters."	""	"Tekstblok"	"Een tekst welke uit meerdere zinnen bestaat,en ook regeleindes kan bevatten. Een tekstblok bevat maximaal 65.000 karakters."	""	""	""	""	""	""	""	""	"false"	"https://wegenenverkeer-test.data.vlaanderen.be/ns/implementatieelement#"	"DteTekstblok"	"http://www.w3.org/2000/01/rdf-schema#Class"	""	""	""	""	""
"DATATYPE"	"OSLO-Implementatieelement"	"KwantWrdInWatt"	"{EFD63993-CDA4-461d-89D3-FA918CB11AF5}"	""	""	""	""	"Kwantitatieve waarde in Watt"	"Een kwantitatieve waarde die een getal in Watt uitdrukt."	""	"Kwantitatieve waarde in Watt"	"Een kwantitatieve waarde die een getal in Watt uitdrukt."	""	""	""	""	""	""	""	""	"false"	"https://wegenenverkeer-test.data.vlaanderen.be/ns/implementatieelement#"	"KwantWrdInWatt"	"http://www.w3.org/2000/01/rdf-schema#Class"	""	""	""	""	""
"DATATYPE"	"OSLO-Implementatieelement"	"KwantWrdInAmpere"	"{7A13727A-58CF-4c46-BDDD-A4EF06EC47FB}"	""	""	""	""	"Kwantitatieve waarde in Ampere"	"Een kwantitatieve waarde die een getal in ampere uitdrukt."	""	"Kwantitatieve waarde in Ampere"	"Een kwantitatieve waarde die een getal in ampere uitdrukt."	""	""	""	""	""	""	""	""	"false"	"https://wegenenverkeer-test.data.vlaanderen.be/ns/implementatieelement#"	"KwantWrdInAmpere"	"http://www.w3.org/2000/01/rdf-schema#Class"	""	""	""	""	""
"DATATYPE"	"OSLO-Implementatieelement"	"KwantWrdInSeconde"	"{B371AFA5-B490-48d2-868B-681A80BBF8C1}"	""	""	""	""	"Kwantitatieve waarde in seconde"	"Een kwantitatieve waarde die een getal in seconde uitdrukt."	""	"Kwantitatieve waarde in seconde"	"Een kwantitatieve waarde die een getal in seconde uitdrukt."	""	""	""	""	""	""	""	""	"false"	"https://wegenenverkeer-test.data.vlaanderen.be/ns/implementatieelement#"	"KwantWrdInSeconde"	"http://www.w3.org/2000/01/rdf-schema#Class"	""	""	""	""	""
"DATATYPE"	"OSLO-Implementatieelement"	"KwantWrdInKubiekeMeter"	"{DD8F4A12-E63D-4c1a-9EB4-9F36965EF80A}"	""	""	""	""	"Kwantitatieve waarde in kubieke meter"	"Een kwantitatieve waarde die een getal in kubieke meter uitdrukt."	""	"Kwantitatieve waarde in kubieke meter"	"Een kwantitatieve waarde die een getal in kubieke meter uitdrukt."	""	""	""	""	""	""	""	""	"false"	"https://wegenenverkeer-test.data.vlaanderen.be/ns/implementatieelement#"	"KwantWrdInKubiekeMeter"	"http://www.w3.org/2000/01/rdf-schema#Class"	""	""	""	""	""
"DATATYPE"	"OSLO-Implementatieelement"	"KwantWrdInProcent"	"{E9A2A1D6-5FD6-4ae8-AA64-F3548274BD81}"	""	""	""	""	"Kwantitatieve waarde in procent"	"Een kwantitatieve waarde die een getal in procent uitdrukt."	""	"Kwantitatieve waarde in procent"	"Een kwantitatieve waarde die een getal in procent uitdrukt."	""	""	""	""	""	""	""	""	"false"	"https://wegenenverkeer-test.data.vlaanderen.be/ns/implementatieelement#"	"KwantWrdInProcent"	"http://www.w3.org/2000/01/rdf-schema#Class"	""	""	""	""	""
"DATATYPE"	"OSLO-Implementatieelement"	"KwantWrdInVolt"	"{48066199-E3B5-49fc-B947-32292AEDE460}"	""	""	""	""	"Kwantitatieve waarde in Volt"	"Een kwantitatieve waarde die een getal in Volt uitdrukt."	""	"Kwantitatieve waarde in Volt"	"Een kwantitatieve waarde die een getal in Volt uitdrukt."	""	""	""	""	""	""	""	""	"false"	"https://wegenenverkeer-test.data.vlaanderen.be/ns/implementatieelement#"	"KwantWrdInVolt"	"http://www.w3.org/2000/01/rdf-schema#Class"	""	""	""	""	""
