"EA-Type"	"EA-Package"	"EA-Name"	"EA-GUID"	"EA-Parent"	"EA-Domain"	"EA-Domain-GUID"	"EA-Range"	"label"	"definition"	"usage"	"ap-label-nl"	"ap-definition-nl"	"ap-usageNote-nl"	"ap-codelist"	"external term"	"namespace"	"localname"	"type"	"domain"	"range"	"parent"	"min card"	"max card"
"attribute"	"OSLO-Proefenmeting"	"bijlage"	"{6CA57911-4ABB-43d3-9AC7-4F8F1FA05C51}"	""	"ProefBathymetrie"	"{AB09F173-B4E1-4dd2-8B9C-4172FCE6BA31}"	"DtcDocument"	"bijlage"	"Het rapport van de bathymetrie als bijlage."	""	"bijlage"	"Het rapport van de bathymetrie als bijlage."	""	""	"true"	"https://wegenenverkeer-test.data.vlaanderen.be/ns/proefenmeting#"	"ProefBathymetrie.bijlage"	"http://www.w3.org/2002/07/owl#ObjectProperty"	"https://wegenenverkeer-test.data.vlaanderen.be/ns/proefenmeting#ProefBathymetrie"	"https://wegenenverkeer-test.data.vlaanderen.be/ns/implementatieelement#DtcDocument"	""	"1"	"1"
"attribute"	"OSLO-Abstracten"	"beschermlaag"	"{55DBC56B-19CE-492d-8644-61B4C56209AE}"	""	"SteunStandaard"	"{D37D818D-FF1B-4e19-9E99-6D41A167325C}"	"KlDraagConstrBeschermlaag"	"beschermlaag"	"Type bescherming van de steun bv. geschilderd, gegalvaniseerd"	""	"beschermlaag"	"Type bescherming van de steun bv. geschilderd, gegalvaniseerd"	""	""	"true"	"https://wegenenverkeer-test.data.vlaanderen.be/ns/abstracten#"	"SteunStandaard.beschermlaag"	"http://www.w3.org/2002/07/owl#ObjectProperty"	"https://wegenenverkeer-test.data.vlaanderen.be/ns/abstracten#SteunStandaard"	"http://www.w3.org/2004/02/skos/core#Concept"	""	"1"	"1"
"attribute"	"OSLO-Abstracten"	"bijzonderTransport"	"{C079DAE9-8C05-4746-A9CD-F5BDDC074B61}"	""	"SteunStandaard"	"{D37D818D-FF1B-4e19-9E99-6D41A167325C}"	"KlDraagConstrBijzondertransport"	"bijzonder transport"	"Wijze waarop het object eventueel geschikt is om bijzonder transport mogelijk te maken"	""	"bijzonder transport"	"Wijze waarop het object eventueel geschikt is om bijzonder transport mogelijk te maken"	""	""	"true"	"https://wegenenverkeer-test.data.vlaanderen.be/ns/abstracten#"	"SteunStandaard.bijzonderTransport"	"http://www.w3.org/2002/07/owl#ObjectProperty"	"https://wegenenverkeer-test.data.vlaanderen.be/ns/abstracten#SteunStandaard"	"http://www.w3.org/2004/02/skos/core#Concept"	""	"1"	"1"
"attribute"	"OSLO-Abstracten"	"fabrikant"	"{97EF3339-B589-42bf-A0EE-B3AE0A481CD8}"	""	"SteunStandaard"	"{D37D818D-FF1B-4e19-9E99-6D41A167325C}"	"String"	"fabrikant"	"Fabrikant van de steun"	""	"fabrikant"	"Fabrikant van de steun"	""	""	"true"	"https://wegenenverkeer-test.data.vlaanderen.be/ns/abstracten#"	"SteunStandaard.fabrikant"	"http://www.w3.org/2002/07/owl#DatatypeProperty"	"https://wegenenverkeer-test.data.vlaanderen.be/ns/abstracten#SteunStandaard"	"http://www.w3.org/2001/XMLSchema#string"	""	"1"	"1"
"attribute"	"OSLO-Abstracten"	"funderingswijze"	"{A0C6E98E-7C02-4bf4-AFEE-1885EBD5A59B}"	""	"SteunStandaard"	"{D37D818D-FF1B-4e19-9E99-6D41A167325C}"	"KlSteunStandaardFundering"	"funderingswijze"	"Type fundering van de steun bv. voetplaat, diep in grond,..."	""	"funderingswijze"	"Type fundering van de steun bv. voetplaat, diep in grond,..."	""	""	"true"	"https://wegenenverkeer-test.data.vlaanderen.be/ns/abstracten#"	"SteunStandaard.funderingswijze"	"http://www.w3.org/2002/07/owl#ObjectProperty"	"https://wegenenverkeer-test.data.vlaanderen.be/ns/abstracten#SteunStandaard"	"http://www.w3.org/2004/02/skos/core#Concept"	""	"1"	"1"
"attribute"	"OSLO-Abstracten"	"hoogteBovenkant"	"{FF902AF1-5425-44a7-B16F-CDE9CC73287C}"	""	"SteunStandaard"	"{D37D818D-FF1B-4e19-9E99-6D41A167325C}"	"KwantWrdInMeter"	"hoogte bovenkant"	"Hoogte (in meter) van de bovenkant van de steun"	""	"hoogte bovenkant"	"Hoogte (in meter) van de bovenkant van de steun"	""	""	"true"	"https://wegenenverkeer-test.data.vlaanderen.be/ns/abstracten#"	"SteunStandaard.hoogteBovenkant"	"http://www.w3.org/2002/07/owl#ObjectProperty"	"https://wegenenverkeer-test.data.vlaanderen.be/ns/abstracten#SteunStandaard"	"https://wegenenverkeer-test.data.vlaanderen.be/ns/implementatieelement#KwantWrdInMeter"	""	"1"	"1"
"attribute"	"OSLO-Abstracten"	"kleur"	"{02626541-99D2-46a2-AE57-E5D605D23F13}"	""	"SteunStandaard"	"{D37D818D-FF1B-4e19-9E99-6D41A167325C}"	"DteKleurRAL"	"kleur"	"De RAL kleur van het uitwendig zichtbare gedeelte."	""	"kleur"	"De RAL kleur van het uitwendig zichtbare gedeelte."	""	""	"true"	"https://wegenenverkeer-test.data.vlaanderen.be/ns/abstracten#"	"SteunStandaard.kleur"	"http://www.w3.org/2002/07/owl#ObjectProperty"	"https://wegenenverkeer-test.data.vlaanderen.be/ns/abstracten#SteunStandaard"	"https://wegenenverkeer-test.data.vlaanderen.be/ns/implementatieelement#DteKleurRAL"	""	"1"	"1"
"attribute"	"OSLO-Abstracten"	"hoogte"	"{24AC56EA-8EA6-4338-AF1B-42D60B32644B}"	""	"VegetatieElement"	"{AD10D488-167D-4022-B9E1-B9F509DED2DA}"	"KlVegetatieelementHoogte"	"hoogte"	"De hoogte van het vegetatie-element in meter."	""	"hoogte"	"De hoogte van het vegetatie-element in meter."	""	""	"true"	"https://wegenenverkeer-test.data.vlaanderen.be/ns/abstracten#"	"VegetatieElement.hoogte"	"http://www.w3.org/2002/07/owl#ObjectProperty"	"https://wegenenverkeer-test.data.vlaanderen.be/ns/abstracten#VegetatieElement"	"http://www.w3.org/2004/02/skos/core#Concept"	""	"1"	"1"
"attribute"	"OSLO-Abstracten"	"niveau"	"{61459A8C-8E73-4bb3-B690-5445FBD87B88}"	""	"VegetatieElement"	"{AD10D488-167D-4022-B9E1-B9F509DED2DA}"	"Decimal"	"niveau"	"Het niveau waarop het object zich bevindt, relatief ten opzichte van andere objecten. Negatieve waarden worden geassocieerd met ondergronds en positieve waarden met bovengronds. Nul wordt beschouwd als een absolute waarde om het maaiveld aan te duiden."	""	"niveau"	"Het niveau waarop het object zich bevindt, relatief ten opzichte van andere objecten. Negatieve waarden worden geassocieerd met ondergronds en positieve waarden met bovengronds. Nul wordt beschouwd als een absolute waarde om het maaiveld aan te duiden."	""	""	"true"	"https://wegenenverkeer-test.data.vlaanderen.be/ns/abstracten#"	"VegetatieElement.niveau"	"http://www.w3.org/2002/07/owl#ObjectProperty"	"https://wegenenverkeer-test.data.vlaanderen.be/ns/abstracten#VegetatieElement"	"http://www.w3.org/2001/XMLSchema#decimal"	""	"1"	"1"
"attribute"	"OSLO-Abstracten"	"soortnaam"	"{B83D8D06-60EC-4e52-87E5-BC1ACBD74AAA}"	""	"VegetatieElement"	"{AD10D488-167D-4022-B9E1-B9F509DED2DA}"	"DtcVegetatieSoortnaam"	"soortnaam"	"De naam van de plantensoort."	""	"soortnaam"	"De naam van de plantensoort."	""	""	"true"	"https://wegenenverkeer-test.data.vlaanderen.be/ns/abstracten#"	"VegetatieElement.soortnaam"	"http://www.w3.org/2002/07/owl#ObjectProperty"	"https://wegenenverkeer-test.data.vlaanderen.be/ns/abstracten#VegetatieElement"	"https://wegenenverkeer-test.data.vlaanderen.be/ns/onderdeel#DtcVegetatieSoortnaam"	""	"1"	"1"
"attribute"	"OSLO-Abstracten"	"kleurAflopend"	"{0B33CBBA-FEAF-4181-8217-1421CF32F3E0}"	""	"Bebakening"	"{7E55B468-C0DC-4117-96AF-3818C1A48E46}"	"KlKleurReflector"	"kleur aflopend"	"De kleur van de bebakening in aflopende richting."	""	"kleur aflopend"	"De kleur van de bebakening in aflopende richting."	""	""	"true"	"https://wegenenverkeer-test.data.vlaanderen.be/ns/abstracten#"	"Bebakening.kleurAflopend"	"http://www.w3.org/2002/07/owl#ObjectProperty"	"https://wegenenverkeer-test.data.vlaanderen.be/ns/abstracten#Bebakening"	"http://www.w3.org/2004/02/skos/core#Concept"	""	"1"	"1"
"attribute"	"OSLO-Abstracten"	"kleurOplopend"	"{D6D21457-0D2C-4d08-80E8-2EDC1F86715F}"	""	"Bebakening"	"{7E55B468-C0DC-4117-96AF-3818C1A48E46}"	"KlKleurReflector"	"kleur oplopend"	"De kleur van de bebakening in oplopende richting."	""	"kleur oplopend"	"De kleur van de bebakening in oplopende richting."	""	""	"true"	"https://wegenenverkeer-test.data.vlaanderen.be/ns/abstracten#"	"Bebakening.kleurOplopend"	"http://www.w3.org/2002/07/owl#ObjectProperty"	"https://wegenenverkeer-test.data.vlaanderen.be/ns/abstracten#Bebakening"	"http://www.w3.org/2004/02/skos/core#Concept"	""	"1"	"1"
"attribute"	"OSLO-Proefenmeting"	"toestand"	"{7DE9EF91-2B49-4cf0-9D1D-39B14D375ACE}"	""	"ProefopBuis"	"{17468210-5362-421d-9D91-C84C89D338BF}"	"String"	"toestand"	"Toestand van de buizen, toegangs- en verbindingsputten, enz."	""	"toestand"	"Toestand van de buizen, toegangs- en verbindingsputten, enz."	""	""	"true"	"https://wegenenverkeer-test.data.vlaanderen.be/ns/proefenmeting#"	"ProefopBuis.toestand"	"http://www.w3.org/2002/07/owl#DatatypeProperty"	"https://wegenenverkeer-test.data.vlaanderen.be/ns/proefenmeting#ProefopBuis"	"http://www.w3.org/2001/XMLSchema#string"	""	"1"	"1"
"attribute"	"OSLO-Proefenmeting"	"waterdichtheid"	"{EE4CFF89-9FAB-4c21-BB05-C978E4A75422}"	""	"ProefopBuis"	"{17468210-5362-421d-9D91-C84C89D338BF}"	"DtcDocument"	"waterdichtheid"	"waterdichtheid of luchtdichtheid van een leidingsvak gebeurt door de bepaling van
het waterverlies of de drukval van het beproefde leidingsvak."	""	"waterdichtheid"	"waterdichtheid of luchtdichtheid van een leidingsvak gebeurt door de bepaling van
het waterverlies of de drukval van het beproefde leidingsvak."	""	""	"true"	"https://wegenenverkeer-test.data.vlaanderen.be/ns/proefenmeting#"	"ProefopBuis.waterdichtheid"	"http://www.w3.org/2002/07/owl#ObjectProperty"	"https://wegenenverkeer-test.data.vlaanderen.be/ns/proefenmeting#ProefopBuis"	"https://wegenenverkeer-test.data.vlaanderen.be/ns/implementatieelement#DtcDocument"	""	"1"	"1"
"attribute"	"OSLO-Abstracten"	"bokAfwaarts"	"{C03A74B0-211E-475a-80A7-512B6EE869B2}"	""	"Buis"	"{71FC81DE-8AEC-4f3c-A5EB-409F128BB989}"	"KwantWrdInMeterTAW"	"bok afwaarts"	"Peil in meter-TAW van de vloei aan de afwaartse kant van de buis."	""	"bok afwaarts"	"Peil in meter-TAW van de vloei aan de afwaartse kant van de buis."	""	""	"true"	"https://wegenenverkeer-test.data.vlaanderen.be/ns/abstracten#"	"Buis.bokAfwaarts"	"http://www.w3.org/2002/07/owl#ObjectProperty"	"https://wegenenverkeer-test.data.vlaanderen.be/ns/abstracten#Buis"	"https://wegenenverkeer-test.data.vlaanderen.be/ns/implementatieelement#KwantWrdInMeterTAW"	""	"1"	"1"
"attribute"	"OSLO-Abstracten"	"bokOpwaarts"	"{6F7A411F-9E0F-476b-9096-AF555F4A7D4B}"	""	"Buis"	"{71FC81DE-8AEC-4f3c-A5EB-409F128BB989}"	"KwantWrdInMeterTAW"	"bok opwaarts"	"Peil in meter-TAW van de vloei aan de opwaartse kant van de buis."	""	"bok opwaarts"	"Peil in meter-TAW van de vloei aan de opwaartse kant van de buis."	""	""	"true"	"https://wegenenverkeer-test.data.vlaanderen.be/ns/abstracten#"	"Buis.bokOpwaarts"	"http://www.w3.org/2002/07/owl#ObjectProperty"	"https://wegenenverkeer-test.data.vlaanderen.be/ns/abstracten#Buis"	"https://wegenenverkeer-test.data.vlaanderen.be/ns/implementatieelement#KwantWrdInMeterTAW"	""	"1"	"1"
"attribute"	"OSLO-Abstracten"	"breedte"	"{5F80F989-1DF5-4a83-8E51-9AE4909685C8}"	""	"Buis"	"{71FC81DE-8AEC-4f3c-A5EB-409F128BB989}"	"KwantWrdInMillimeter"	"breedte"	"De breedte van de buis in millimeter."	""	"breedte"	"De breedte van de buis in millimeter."	""	""	"true"	"https://wegenenverkeer-test.data.vlaanderen.be/ns/abstracten#"	"Buis.breedte"	"http://www.w3.org/2002/07/owl#ObjectProperty"	"https://wegenenverkeer-test.data.vlaanderen.be/ns/abstracten#Buis"	"https://wegenenverkeer-test.data.vlaanderen.be/ns/implementatieelement#KwantWrdInMillimeter"	""	"1"	"1"
"attribute"	"OSLO-Abstracten"	"diepteAfwaarts"	"{19E9E981-2449-487d-A2C6-F6F5F98E3029}"	""	"Buis"	"{71FC81DE-8AEC-4f3c-A5EB-409F128BB989}"	"KwantWrdInMeter"	"diepte afwaarts"	"Diepte van de vloei aan de afwaartse kant van de buis tov de bovenkant van het deksel."	""	"diepte afwaarts"	"Diepte van de vloei aan de afwaartse kant van de buis tov de bovenkant van het deksel."	""	""	"true"	"https://wegenenverkeer-test.data.vlaanderen.be/ns/abstracten#"	"Buis.diepteAfwaarts"	"http://www.w3.org/2002/07/owl#ObjectProperty"	"https://wegenenverkeer-test.data.vlaanderen.be/ns/abstracten#Buis"	"https://wegenenverkeer-test.data.vlaanderen.be/ns/implementatieelement#KwantWrdInMeter"	""	"1"	"1"
"attribute"	"OSLO-Abstracten"	"diepteOpwaarts"	"{C73ADBA1-AB34-48f0-8210-F2ACD8326DCD}"	""	"Buis"	"{71FC81DE-8AEC-4f3c-A5EB-409F128BB989}"	"KwantWrdInMeter"	"diepte opwaarts"	"De diepte van de vloei aan de opwaartse kant van de buis tov de bovenkant van het deksel."	""	"diepte opwaarts"	"De diepte van de vloei aan de opwaartse kant van de buis tov de bovenkant van het deksel."	""	""	"true"	"https://wegenenverkeer-test.data.vlaanderen.be/ns/abstracten#"	"Buis.diepteOpwaarts"	"http://www.w3.org/2002/07/owl#ObjectProperty"	"https://wegenenverkeer-test.data.vlaanderen.be/ns/abstracten#Buis"	"https://wegenenverkeer-test.data.vlaanderen.be/ns/implementatieelement#KwantWrdInMeter"	""	"1"	"1"
"attribute"	"OSLO-Abstracten"	"helling"	"{48691ACA-9688-4656-B6C4-F6A509E835DE}"	""	"Buis"	"{71FC81DE-8AEC-4f3c-A5EB-409F128BB989}"	"KwantWrdInPromille"	"helling"	"De helling van de buis in de lengterichting, uitgedrukt in ."	""	"helling"	"De helling van de buis in de lengterichting, uitgedrukt in ."	""	""	"true"	"https://wegenenverkeer-test.data.vlaanderen.be/ns/abstracten#"	"Buis.helling"	"http://www.w3.org/2002/07/owl#ObjectProperty"	"https://wegenenverkeer-test.data.vlaanderen.be/ns/abstracten#Buis"	"https://wegenenverkeer-test.data.vlaanderen.be/ns/implementatieelement#KwantWrdInPromille"	""	"1"	"1"
"attribute"	"OSLO-Abstracten"	"hoogteBinnenzijde"	"{42B6E640-1EED-408f-BAD9-4E63A5CE0472}"	""	"Buis"	"{71FC81DE-8AEC-4f3c-A5EB-409F128BB989}"	"KwantWrdInMillimeter"	"hoogte binnenzijde"	"De hoogte van de binnenzijde van de buis in millimeter. Bij cirkelvormige buizen is dit de binnendiameter."	""	"hoogte binnenzijde"	"De hoogte van de binnenzijde van de buis in millimeter. Bij cirkelvormige buizen is dit de binnendiameter."	""	""	"true"	"https://wegenenverkeer-test.data.vlaanderen.be/ns/abstracten#"	"Buis.hoogteBinnenzijde"	"http://www.w3.org/2002/07/owl#ObjectProperty"	"https://wegenenverkeer-test.data.vlaanderen.be/ns/abstracten#Buis"	"https://wegenenverkeer-test.data.vlaanderen.be/ns/implementatieelement#KwantWrdInMillimeter"	""	"1"	"1"
"attribute"	"OSLO-Abstracten"	"hoogteBuitenzijde"	"{BF2ABF5B-7035-43ce-B139-1BCA9AB5171F}"	""	"Buis"	"{71FC81DE-8AEC-4f3c-A5EB-409F128BB989}"	"KwantWrdInMillimeter"	"hoogte buitenzijde"	"De hoogte van de buitenzijde van een buis in millimeter. Bij cirkelvormige buizen is dit de buitendiameter."	""	"hoogte buitenzijde"	"De hoogte van de buitenzijde van een buis in millimeter. Bij cirkelvormige buizen is dit de buitendiameter."	""	""	"true"	"https://wegenenverkeer-test.data.vlaanderen.be/ns/abstracten#"	"Buis.hoogteBuitenzijde"	"http://www.w3.org/2002/07/owl#ObjectProperty"	"https://wegenenverkeer-test.data.vlaanderen.be/ns/abstracten#Buis"	"https://wegenenverkeer-test.data.vlaanderen.be/ns/implementatieelement#KwantWrdInMillimeter"	""	"1"	"1"
"attribute"	"OSLO-Abstracten"	"isManToegankelijk"	"{48E6BF0D-9750-4f11-9A46-5811925819B5}"	""	"Buis"	"{71FC81DE-8AEC-4f3c-A5EB-409F128BB989}"	"Boolean"	"is man toegankelijk"	"Bepaalt of de buis toegankelijk is voor een persoon."	""	"is man toegankelijk"	"Bepaalt of de buis toegankelijk is voor een persoon."	""	""	"true"	"https://wegenenverkeer-test.data.vlaanderen.be/ns/abstracten#"	"Buis.isManToegankelijk"	"http://www.w3.org/2002/07/owl#DatatypeProperty"	"https://wegenenverkeer-test.data.vlaanderen.be/ns/abstracten#Buis"	"http://www.w3.org/2001/XMLSchema#boolean"	""	"1"	"1"
"attribute"	"OSLO-Abstracten"	"isOpgevuld"	"{0A12D043-A70C-4423-B167-D31403DEA87A}"	""	"Buis"	"{71FC81DE-8AEC-4f3c-A5EB-409F128BB989}"	"Boolean"	"is opgevuld"	"Geeft aan of de buis gestabileerd/opgevuld is of niet."	""	"is opgevuld"	"Geeft aan of de buis gestabileerd/opgevuld is of niet."	""	""	"true"	"https://wegenenverkeer-test.data.vlaanderen.be/ns/abstracten#"	"Buis.isOpgevuld"	"http://www.w3.org/2002/07/owl#DatatypeProperty"	"https://wegenenverkeer-test.data.vlaanderen.be/ns/abstracten#Buis"	"http://www.w3.org/2001/XMLSchema#boolean"	""	"1"	"1"
"attribute"	"OSLO-Abstracten"	"lengte"	"{45A33CA4-3CD4-475c-80D2-E4681F93A398}"	""	"Buis"	"{71FC81DE-8AEC-4f3c-A5EB-409F128BB989}"	"KwantWrdInMeter"	"lengte"	"De totale lengte in meter van de buis tussen opwaartse en afwaartse put."	""	"lengte"	"De totale lengte in meter van de buis tussen opwaartse en afwaartse put."	""	""	"true"	"https://wegenenverkeer-test.data.vlaanderen.be/ns/abstracten#"	"Buis.lengte"	"http://www.w3.org/2002/07/owl#ObjectProperty"	"https://wegenenverkeer-test.data.vlaanderen.be/ns/abstracten#Buis"	"https://wegenenverkeer-test.data.vlaanderen.be/ns/implementatieelement#KwantWrdInMeter"	""	"1"	"1"
"attribute"	"OSLO-Abstracten"	"technischeFiche"	"{EA0EF292-6DDC-4938-8D43-DDDBE4533E5D}"	""	"Buis"	"{71FC81DE-8AEC-4f3c-A5EB-409F128BB989}"	"DtcDocument"	"technische fiche"	"De technische fiche van de buis."	"Bestanden van het type xlsx of pdf."	"technische fiche"	"De technische fiche van de buis."	""	""	"true"	"https://wegenenverkeer-test.data.vlaanderen.be/ns/abstracten#"	"Buis.technischeFiche"	"http://www.w3.org/2002/07/owl#ObjectProperty"	"https://wegenenverkeer-test.data.vlaanderen.be/ns/abstracten#Buis"	"https://wegenenverkeer-test.data.vlaanderen.be/ns/implementatieelement#DtcDocument"	""	"1"	"*"
"attribute"	"OSLO-Abstracten"	"vorm"	"{436BDC27-3632-441c-80B9-45E3212C68C2}"	""	"Buis"	"{71FC81DE-8AEC-4f3c-A5EB-409F128BB989}"	"KlRioleringVorm"	"vorm"	"Bepaalt de vorm van de buis."	""	"vorm"	"Bepaalt de vorm van de buis."	""	""	"true"	"https://wegenenverkeer-test.data.vlaanderen.be/ns/abstracten#"	"Buis.vorm"	"http://www.w3.org/2002/07/owl#ObjectProperty"	"https://wegenenverkeer-test.data.vlaanderen.be/ns/abstracten#Buis"	"http://www.w3.org/2004/02/skos/core#Concept"	""	"1"	"1"
"attribute"	"OSLO-Implementatieelement"	"naam"	"{0934DA42-F4E9-485b-BCE5-09CDF6AB792B}"	""	"AWVNaamObject"	"{5C144615-47A1-4f8b-A119-B293BCFD84B5}"	"String"	"naam"	"De mensleesbare naam van een AWVObject zoals dit bv. ook terug te vinden is op een etiket op het object zelf. AWV kent deze naam toe of geeft de opdracht om deze toe te kennen. Indien een object een algemeen gangbare naam heeft zoals bv. bij een waterloop dan wordt deze gebruikt."	""	"naam"	"De mensleesbare naam van een AWVObject zoals dit bv. ook terug te vinden is op een etiket op het object zelf. AWV kent deze naam toe of geeft de opdracht om deze toe te kennen. Indien een object een algemeen gangbare naam heeft zoals bv. bij een waterloop dan wordt deze gebruikt."	""	""	"true"	"https://wegenenverkeer-test.data.vlaanderen.be/ns/implementatieelement#"	"AWVNaamObject.naam"	"http://www.w3.org/2002/07/owl#DatatypeProperty"	"https://wegenenverkeer-test.data.vlaanderen.be/ns/implementatieelement#AWVNaamObject"	"http://www.w3.org/2001/XMLSchema#string"	""	"1"	"1"
"attribute"	"OSLO-Implementatieelement"	"datumOprichtingObject"	"{BDF3B5DA-2C71-43b0-8AF1-9CBB8C9059DB}"	""	"AWVObject"	"{C3CBD401-EC86-4363-9821-CCE89EB2F0A9}"	"Date"	"datum oprichting object"	"Datum van de oprichting van het object."	""	"datum oprichting object"	"Datum van de oprichting van het object."	""	""	"true"	"https://wegenenverkeer-test.data.vlaanderen.be/ns/implementatieelement#"	"AWVObject.datumOprichtingObject"	"http://www.w3.org/2002/07/owl#DatatypeProperty"	"https://wegenenverkeer-test.data.vlaanderen.be/ns/implementatieelement#AWVObject"	"http://www.w3.org/2001/XMLSchema#date"	""	"1"	"1"
"attribute"	"OSLO-Implementatieelement"	"id"	"{B43EDD99-BBCC-4818-B6BA-0C9DBF96FA24}"	""	"AWVObject"	"{C3CBD401-EC86-4363-9821-CCE89EB2F0A9}"	"DtcAWVIdentificator"	"id"	"De identificator van het object. Zodra een object bestaat binnen de omgeving van AWV moet de id gebruikt worden zoals die daar gekend is. Bij aanlevering van nieuwe objecten wordt een lokale-id (zoals gekend bij de aannemer) ingevuld."	""	"id"	"De identificator van het object. Zodra een object bestaat binnen de omgeving van AWV moet de id gebruikt worden zoals die daar gekend is. Bij aanlevering van nieuwe objecten wordt een lokale-id (zoals gekend bij de aannemer) ingevuld."	""	""	"true"	"https://wegenenverkeer-test.data.vlaanderen.be/ns/implementatieelement#"	"AWVObject.id"	"http://www.w3.org/2002/07/owl#ObjectProperty"	"https://wegenenverkeer-test.data.vlaanderen.be/ns/implementatieelement#AWVObject"	"https://wegenenverkeer-test.data.vlaanderen.be/ns/implementatieelement#DtcAWVIdentificator"	""	"1"	"*"
"attribute"	"OSLO-Implementatieelement"	"notitie"	"{C5D72798-B8FE-4b73-8F50-506AE8241477}"	""	"AWVObject"	"{C3CBD401-EC86-4363-9821-CCE89EB2F0A9}"	"String"	"notitie"	"Extra notitie voor het object."	""	"notitie"	"Extra notitie voor het object."	""	""	"true"	"https://wegenenverkeer-test.data.vlaanderen.be/ns/implementatieelement#"	"AWVObject.notitie"	"http://www.w3.org/2002/07/owl#DatatypeProperty"	"https://wegenenverkeer-test.data.vlaanderen.be/ns/implementatieelement#AWVObject"	"http://www.w3.org/2001/XMLSchema#string"	""	"1"	"1"
"attribute"	"OSLO-Implementatieelement"	"typeURI"	"{E1765146-77A7-479e-8478-D814329806B4}"	""	"AWVObject"	"{C3CBD401-EC86-4363-9821-CCE89EB2F0A9}"	"AnyURI"	"type URI"	"De URI van het object volgens https://www.w3.org/2001/XMLSchema#anyURI ."	""	"type URI"	"De URI van het object volgens https://www.w3.org/2001/XMLSchema#anyURI ."	""	""	"true"	"https://wegenenverkeer-test.data.vlaanderen.be/ns/implementatieelement#"	"AWVObject.typeURI"	"http://www.w3.org/2002/07/owl#ObjectProperty"	"https://wegenenverkeer-test.data.vlaanderen.be/ns/implementatieelement#AWVObject"	"http://www.w3.org/2001/XMLSchema#anyURI"	""	"1"	"1"
"attribute"	"OSLO-Abstracten"	"gietrandtype"	"{1D36D449-6281-4d5c-8E4E-92B054FAA113}"	""	"AanlegBoomvorm"	"{5F680186-4B1B-4f3e-8DF9-D0B057AD1B2E}"	"KlBoomGietrandtype"	"gietrandtype"	"Het type omwalling rond de stamvoet van een boom."	""	"gietrandtype"	"Het type omwalling rond de stamvoet van een boom."	""	""	"true"	"https://wegenenverkeer-test.data.vlaanderen.be/ns/abstracten#"	"AanlegBoomvorm.gietrandtype"	"http://www.w3.org/2002/07/owl#ObjectProperty"	"https://wegenenverkeer-test.data.vlaanderen.be/ns/abstracten#AanlegBoomvorm"	"http://www.w3.org/2004/02/skos/core#Concept"	""	"1"	"1"
"attribute"	"OSLO-Abstracten"	"heeftBoomplaat"	"{635261AA-C860-4c68-B4AD-885D3D756409}"	""	"AanlegBoomvorm"	"{5F680186-4B1B-4f3e-8DF9-D0B057AD1B2E}"	"Boolean"	"heeft boomplaat"	"Boomplaten worden aangebracht rond de stam van bomen, bosgoed en heesters en eventueel vastgezet met piketten. Ze hebben een centrale opening en een rechte snede, zodat ze op eenvoudige wijze rond de planten kunnen aangebracht worden."	""	"heeft boomplaat"	"Boomplaten worden aangebracht rond de stam van bomen, bosgoed en heesters en eventueel vastgezet met piketten. Ze hebben een centrale opening en een rechte snede, zodat ze op eenvoudige wijze rond de planten kunnen aangebracht worden."	""	""	"true"	"https://wegenenverkeer-test.data.vlaanderen.be/ns/abstracten#"	"AanlegBoomvorm.heeftBoomplaat"	"http://www.w3.org/2002/07/owl#DatatypeProperty"	"https://wegenenverkeer-test.data.vlaanderen.be/ns/abstracten#AanlegBoomvorm"	"http://www.w3.org/2001/XMLSchema#boolean"	""	"1"	"1"
"attribute"	"OSLO-Abstracten"	"heeftWortelgeleidingwortelwering"	"{5AF6D775-02D0-4478-A69E-355CF6EEAA33}"	""	"AanlegBoomvorm"	"{5F680186-4B1B-4f3e-8DF9-D0B057AD1B2E}"	"Boolean"	"heeft wortelgeleiding wortelwering"	"Wortelgeleiding en wering moet voorkomen dat boomwortels het trottoir, de middenberm, het fietspad, de rijweg, andere wegverhardingen en leidingstelsels beschadigen. Het heeft als doel om boomwortels naar beneden te leiden, waar ze onder een obstakel verder kunnen groeien."	""	"heeft wortelgeleiding wortelwering"	"Wortelgeleiding en wering moet voorkomen dat boomwortels het trottoir, de middenberm, het fietspad, de rijweg, andere wegverhardingen en leidingstelsels beschadigen. Het heeft als doel om boomwortels naar beneden te leiden, waar ze onder een obstakel verder kunnen groeien."	""	""	"true"	"https://wegenenverkeer-test.data.vlaanderen.be/ns/abstracten#"	"AanlegBoomvorm.heeftWortelgeleidingwortelwering"	"http://www.w3.org/2002/07/owl#DatatypeProperty"	"https://wegenenverkeer-test.data.vlaanderen.be/ns/abstracten#AanlegBoomvorm"	"http://www.w3.org/2001/XMLSchema#boolean"	""	"1"	"1"
"attribute"	"OSLO-Abstracten"	"plantmaat"	"{92037637-C170-4672-B91C-8E99D44A0E3E}"	""	"AanlegBoomvorm"	"{5F680186-4B1B-4f3e-8DF9-D0B057AD1B2E}"	"KlBoomPlantmaat"	"plantmaat"	"De maat van de boom in cm gemeten op 1 m boven het maaiveld tussen een minimum en maximum waarde."	""	"plantmaat"	"De maat van de boom in cm gemeten op 1 m boven het maaiveld tussen een minimum en maximum waarde."	""	""	"true"	"https://wegenenverkeer-test.data.vlaanderen.be/ns/abstracten#"	"AanlegBoomvorm.plantmaat"	"http://www.w3.org/2002/07/owl#ObjectProperty"	"https://wegenenverkeer-test.data.vlaanderen.be/ns/abstracten#AanlegBoomvorm"	"http://www.w3.org/2004/02/skos/core#Concept"	""	"1"	"1"
"attribute"	"OSLO-Abstracten"	"verankering"	"{5D4620A8-A1BF-4f7d-BE11-583CF6978C6F}"	""	"AanlegBoomvorm"	"{5F680186-4B1B-4f3e-8DF9-D0B057AD1B2E}"	"KlBoomVerankering"	"verankering"	"Duidt de manier van verankering van de boom bij aanplant aan."	""	"verankering"	"Duidt de manier van verankering van de boom bij aanplant aan."	""	""	"true"	"https://wegenenverkeer-test.data.vlaanderen.be/ns/abstracten#"	"AanlegBoomvorm.verankering"	"http://www.w3.org/2002/07/owl#ObjectProperty"	"https://wegenenverkeer-test.data.vlaanderen.be/ns/abstracten#AanlegBoomvorm"	"http://www.w3.org/2004/02/skos/core#Concept"	""	"1"	"1"
"attribute"	"OSLO-Abstracten"	"verankeringstype"	"{9998BE88-D551-400b-9C8E-C704740B2B16}"	""	"AanlegBoomvorm"	"{5F680186-4B1B-4f3e-8DF9-D0B057AD1B2E}"	"KlBoomVerankeringtype"	"verankeringstype"	"Duidt het type van verankering van de boom aan."	""	"verankeringstype"	"Duidt het type van verankering van de boom aan."	""	""	"true"	"https://wegenenverkeer-test.data.vlaanderen.be/ns/abstracten#"	"AanlegBoomvorm.verankeringstype"	"http://www.w3.org/2002/07/owl#ObjectProperty"	"https://wegenenverkeer-test.data.vlaanderen.be/ns/abstracten#AanlegBoomvorm"	"http://www.w3.org/2004/02/skos/core#Concept"	""	"1"	"1"
