"EA-Type"	"EA-Package"	"EA-Name"	"EA-GUID"	"EA-Parent"	"EA-Domain"	"EA-Domain-GUID"	"EA-Range"	"label"	"definition"	"usage"	"ap-label-nl"	"ap-definition-nl"	"ap-usageNote-nl"	"ap-codelist"	"external term"	"namespace"	"localname"	"type"	"domain"	"range"	"parent"	"min card"	"max card"
"Package"	""	"OSLO-Ecologische-maatregelen"	"{62D698F4-14DD-4b0e-AC35-08E54AA06F1C}"	""	""	""	""	""	""	""	""	""	""	""	""	"http://"	"fixme.com"	"http://www.w3.org/2002/07/owl#Ontology"	""	""	""	""	""
"CLASS"	"OSLO-Proefenmeting"	"ProefBathymetrie"	"{AB09F173-B4E1-4dd2-8B9C-4172FCE6BA31}"	"Proef"	""	""	""	"Proef bathymetrie"	"Abstracte voor de gemeenschappelijke eigenschappen van de proef Bathymetrie."	""	"Proef bathymetrie"	"Abstracte voor de gemeenschappelijke eigenschappen van de proef Bathymetrie."	""	""	"true"	"https://wegenenverkeer-test.data.vlaanderen.be/ns/proefenmeting#"	"ProefBathymetrie"	"http://www.w3.org/2000/01/rdf-schema#Class"	""	""	"https://wegenenverkeer-test.data.vlaanderen.be/ns/proefenmeting#Proef"	""	""
"CLASS"	"OSLO-Abstracten"	"SteunStandaard"	"{D37D818D-FF1B-4e19-9E99-6D41A167325C}"	"Draagconstructie"	""	""	""	"Steun standaard"	"Abstracte voor de standaard steunen."	""	"Steun standaard"	"Abstracte voor de standaard steunen."	""	""	"true"	"https://wegenenverkeer-test.data.vlaanderen.be/ns/abstracten#"	"SteunStandaard"	"http://www.w3.org/2000/01/rdf-schema#Class"	""	""	"https://wegenenverkeer-test.data.vlaanderen.be/ns/abstracten#Draagconstructie"	""	""
"CLASS"	"OSLO-Abstracten"	"VRIDraagConstructie"	"{A43B5DE6-5C6C-4063-B247-4509A5F20DCB}"	"SteunStandaard"	""	""	""	"Verkeersregelinstallatie draagconstructie"	"Abstracte voor een dragend element (bv. paal, kolom,& ) waaraan lantaarns met verkeerslichten bevestigd kunnen worden bij de verkeersregelinstallatie."	""	"Verkeersregelinstallatie draagconstructie"	"Abstracte voor een dragend element (bv. paal, kolom,& ) waaraan lantaarns met verkeerslichten bevestigd kunnen worden bij de verkeersregelinstallatie."	""	""	"true"	"https://wegenenverkeer-test.data.vlaanderen.be/ns/abstracten#"	"VRIDraagConstructie"	"http://www.w3.org/2000/01/rdf-schema#Class"	""	""	"https://wegenenverkeer-test.data.vlaanderen.be/ns/abstracten#SteunStandaard"	""	""
"CLASS"	"OSLO-Abstracten"	"VegetatieElement"	"{AD10D488-167D-4022-B9E1-B9F509DED2DA}"	"AWVObject"	""	""	""	"Vegetatie element"	"Abstracte om alle gemeenschappelijke eigenschappen en relaties van de solitaire plant in de ruimte onder 1 noemer te plaatsen."	""	"Vegetatie element"	"Abstracte om alle gemeenschappelijke eigenschappen en relaties van de solitaire plant in de ruimte onder 1 noemer te plaatsen."	""	""	"true"	"https://wegenenverkeer-test.data.vlaanderen.be/ns/abstracten#"	"VegetatieElement"	"http://www.w3.org/2000/01/rdf-schema#Class"	""	""	"https://wegenenverkeer-test.data.vlaanderen.be/ns/implementatieelement#AWVObject"	""	""
"CLASS"	"OSLO-Abstracten"	"Signalisatie"	"{92092140-81B9-4aea-8495-C1CC94F9713F}"	""	""	""	""	"Signalisatie"	"Abstracte voor de gemeenschappelijke eigenschappen en relaties."	""	"Signalisatie"	"Abstracte voor de gemeenschappelijke eigenschappen en relaties."	""	""	"true"	"https://wegenenverkeer-test.data.vlaanderen.be/ns/abstracten#"	"Signalisatie"	"http://www.w3.org/2000/01/rdf-schema#Class"	""	""	""	""	""
"CLASS"	"OSLO-Abstracten"	"Bebakening"	"{7E55B468-C0DC-4117-96AF-3818C1A48E46}"	"Signalisatie, AWVObject"	""	""	""	"Bebakening"	"Abstracte voor de bebakeningen."	""	"Bebakening"	"Abstracte voor de bebakeningen."	""	""	"true"	"https://wegenenverkeer-test.data.vlaanderen.be/ns/abstracten#"	"Bebakening"	"http://www.w3.org/2000/01/rdf-schema#Class"	""	""	"https://wegenenverkeer-test.data.vlaanderen.be/ns/implementatieelement#AWVObject, https://wegenenverkeer-test.data.vlaanderen.be/ns/abstracten#Signalisatie"	""	""
"CLASS"	"OSLO-Proefenmeting"	"Proef"	"{A1EF4D85-B064-4217-9932-40B85F6EEC1B}"	""	""	""	""	"Proeven"	"Abstracte voor de gemeenschappelijke eigenschappen en relaties alle proeven."	""	"Proeven"	"Abstracte voor de gemeenschappelijke eigenschappen en relaties alle proeven."	""	""	"true"	"https://wegenenverkeer-test.data.vlaanderen.be/ns/proefenmeting#"	"Proef"	"http://www.w3.org/2000/01/rdf-schema#Class"	""	""	""	""	""
"CLASS"	"OSLO-Proefenmeting"	"ProefopBuis"	"{17468210-5362-421d-9D91-C84C89D338BF}"	"Proef"	""	""	""	"Proef op buis"	"Abstracte voor de gemeenschappelijke eigenschappen van de proef op een buis."	""	"Proef op buis"	"Abstracte voor de gemeenschappelijke eigenschappen van de proef op een buis."	""	""	"true"	"https://wegenenverkeer-test.data.vlaanderen.be/ns/proefenmeting#"	"ProefopBuis"	"http://www.w3.org/2000/01/rdf-schema#Class"	""	""	"https://wegenenverkeer-test.data.vlaanderen.be/ns/proefenmeting#Proef"	""	""
"CLASS"	"OSLO-Abstracten"	"Buis"	"{71FC81DE-8AEC-4f3c-A5EB-409F128BB989}"	"AWVObject, ProefopBuis"	""	""	""	"Buis"	"Abstracte om de gemeenschappelijke eigenschappen en relaties van de verschillende soorten buizen onder één noemer te houden."	""	"Buis"	"Abstracte om de gemeenschappelijke eigenschappen en relaties van de verschillende soorten buizen onder één noemer te houden."	""	""	"true"	"https://wegenenverkeer-test.data.vlaanderen.be/ns/abstracten#"	"Buis"	"http://www.w3.org/2000/01/rdf-schema#Class"	""	""	"https://wegenenverkeer-test.data.vlaanderen.be/ns/implementatieelement#AWVObject, https://wegenenverkeer-test.data.vlaanderen.be/ns/proefenmeting#ProefopBuis"	""	""
"CLASS"	"OSLO-Implementatieelement"	"AWVNaamObject"	"{5C144615-47A1-4f8b-A119-B293BCFD84B5}"	"AWVObject"	""	""	""	"AWV naam object"	"Abstracte als de basisklasse voor elk OTL object dat benoemd wordt met een mensleesbare identificator. "	""	"AWV naam object"	"Abstracte als de basisklasse voor elk OTL object dat benoemd wordt met een mensleesbare identificator. "	""	""	"true"	"https://wegenenverkeer-test.data.vlaanderen.be/ns/implementatieelement#"	"AWVNaamObject"	"http://www.w3.org/2000/01/rdf-schema#Class"	""	""	"https://wegenenverkeer-test.data.vlaanderen.be/ns/implementatieelement#AWVObject"	""	""
"CLASS"	"OSLO-Implementatieelement"	"AWVObject"	"{C3CBD401-EC86-4363-9821-CCE89EB2F0A9}"	""	""	""	""	"AWV object"	"Abstracte als de basisklasse (super class) voor alle uniek geïdentificeerde OTL objecten met de basiseigenschappen die elk OTL object minstens heeft."	""	"AWV object"	"Abstracte als de basisklasse (super class) voor alle uniek geïdentificeerde OTL objecten met de basiseigenschappen die elk OTL object minstens heeft."	""	""	"true"	"https://wegenenverkeer-test.data.vlaanderen.be/ns/implementatieelement#"	"AWVObject"	"http://www.w3.org/2000/01/rdf-schema#Class"	""	""	""	""	""
"CLASS"	"OSLO-Onderdeel"	"ComplexeGeleiding"	"{CC0DB383-08CB-4bfd-AA02-A028DBA00DB6}"	"Geleiding, AWVObject"	""	""	""	"Complexe geleiding"	"Een Abstracte die de SluitAanOp relatie mogelijk van voor de samenstellende onderdelen van een complexere geleiding."	""	"Complexe geleiding"	"Een Abstracte die de SluitAanOp relatie mogelijk van voor de samenstellende onderdelen van een complexere geleiding."	""	""	"true"	"https://wegenenverkeer-test.data.vlaanderen.be/ns/onderdeel#"	"ComplexeGeleiding"	"http://www.w3.org/2000/01/rdf-schema#Class"	""	""	"https://wegenenverkeer-test.data.vlaanderen.be/ns/implementatieelement#AWVObject, https://wegenenverkeer-test.data.vlaanderen.be/ns/abstracten#Geleiding"	""	""
"CLASS"	"OSLO-Abstracten"	"AanlegBoomvorm"	"{5F680186-4B1B-4f3e-8DF9-D0B057AD1B2E}"	"VegetatieElement"	""	""	""	"Aanleg boomvorm"	"Abstracte om alle gemeenschappelijke eigenschappen en relaties van de aanleg van een boomvorm onder 1 noemer te houden."	""	"Aanleg boomvorm"	"Abstracte om alle gemeenschappelijke eigenschappen en relaties van de aanleg van een boomvorm onder 1 noemer te houden."	""	""	"true"	"https://wegenenverkeer-test.data.vlaanderen.be/ns/abstracten#"	"AanlegBoomvorm"	"http://www.w3.org/2000/01/rdf-schema#Class"	""	""	"https://wegenenverkeer-test.data.vlaanderen.be/ns/abstracten#VegetatieElement"	""	""
"CLASS"	"OSLO-Abstracten"	"Draagconstructie"	"{C1093B52-E90F-4b82-A3D3-DB7D8AAE1271}"	"AWVNaamObject"	""	""	""	"Draagconstructie"	"Abstracte voor alle draagconstructies."	""	"Draagconstructie"	"Abstracte voor alle draagconstructies."	""	""	"true"	"https://wegenenverkeer-test.data.vlaanderen.be/ns/abstracten#"	"Draagconstructie"	"http://www.w3.org/2000/01/rdf-schema#Class"	""	""	"https://wegenenverkeer-test.data.vlaanderen.be/ns/implementatieelement#AWVNaamObject"	""	""
"CLASS"	"OSLO-Onderdeel"	"WWSvlakdetectie"	"{13DAA117-8644-4b93-9E2F-BCD0CF0C4C0D}"	"WWSdetectie"	""	""	""	"Vlakdetectie"	"De vlakdetectie screent op een ruimere zone passerende dieren via sensoren."	""	"Vlakdetectie"	"De vlakdetectie screent op een ruimere zone passerende dieren via sensoren."	""	""	"true"	"https://wegenenverkeer-test.data.vlaanderen.be/ns/onderdeel#"	"WWSvlakdetectie"	"http://www.w3.org/2000/01/rdf-schema#Class"	""	""	"https://wegenenverkeer-test.data.vlaanderen.be/ns/onderdeel#WWSdetectie"	""	""
"CLASS"	"OSLO-Onderdeel"	"WWSlijndetectie"	"{40A738DA-0ED9-4c06-B74E-61BE7056D5F7}"	"WWSdetectie"	""	""	""	"Lijndetectie"	"De lijndetectie stuurt een systeem in werking als een infraroodstraal wordt onderbroken."	""	"Lijndetectie"	"De lijndetectie stuurt een systeem in werking als een infraroodstraal wordt onderbroken."	""	""	"true"	"https://wegenenverkeer-test.data.vlaanderen.be/ns/onderdeel#"	"WWSlijndetectie"	"http://www.w3.org/2000/01/rdf-schema#Class"	""	""	"https://wegenenverkeer-test.data.vlaanderen.be/ns/onderdeel#WWSdetectie"	""	""
"CLASS"	"OSLO-Onderdeel"	"WWSdetectie"	"{0A5BD35A-946D-4423-B9A3-079318735031}"	"AWVObject"	""	""	""	"Wildwaarschuwingsdetectie"	"Abstracte voor het wildwaarschuwingsdetectie systeem."	""	"Wildwaarschuwingsdetectie"	"Abstracte voor het wildwaarschuwingsdetectie systeem."	""	""	"true"	"https://wegenenverkeer-test.data.vlaanderen.be/ns/onderdeel#"	"WWSdetectie"	"http://www.w3.org/2000/01/rdf-schema#Class"	""	""	"https://wegenenverkeer-test.data.vlaanderen.be/ns/implementatieelement#AWVObject"	""	""
"CLASS"	"OSLO-Onderdeel"	"WWSsluis"	"{4B6C4ED1-C3F4-4c00-86F5-3E88422E9B96}"	"AWVObject"	""	""	""	"Wildwaarschuwingssluis"	"Een onderbreking in het ecoraster waar een wildwaarschuwingssysteem is geïnstalleerd zodoende de voertuigen te waarschuwen voor overstekende dieren."	""	"Wildwaarschuwingssluis"	"Een onderbreking in het ecoraster waar een wildwaarschuwingssysteem is geïnstalleerd zodoende de voertuigen te waarschuwen voor overstekende dieren."	""	""	"true"	"https://wegenenverkeer-test.data.vlaanderen.be/ns/onderdeel#"	"WWSsluis"	"http://www.w3.org/2000/01/rdf-schema#Class"	""	""	"https://wegenenverkeer-test.data.vlaanderen.be/ns/implementatieelement#AWVObject"	""	""
"CLASS"	"OSLO-Installatie"	"Gronddam"	"{F3591EF0-2975-4b71-B4DB-13AD2C47410E}"	"AWVObject"	""	""	""	"Gronddam"	"Gronddammen zijn trapeziumvormige constructies bestaande uit zand, grond of steenachtige materialen. De onderkant van de gronddam wordt direct op het bestaand maaiveld aangebracht of op een vooraf aangebrachte grondverbetering."	""	"Gronddam"	"Gronddammen zijn trapeziumvormige constructies bestaande uit zand, grond of steenachtige materialen. De onderkant van de gronddam wordt direct op het bestaand maaiveld aangebracht of op een vooraf aangebrachte grondverbetering."	""	""	"true"	"https://wegenenverkeer-test.data.vlaanderen.be/ns/installatie#"	"Gronddam"	"http://www.w3.org/2000/01/rdf-schema#Class"	""	""	"https://wegenenverkeer-test.data.vlaanderen.be/ns/implementatieelement#AWVObject"	""	""
"CLASS"	"OSLO-Onderdeel"	"Seinbrug"	"{22A092A4-1630-4acd-BE42-D80F702B4D49}"	"VRIDraagConstructie"	""	""	""	"Seinbrug"	"Metalen constructie bestaande uit 2 of meer verticale steunen met voetplaat en uit een enkele of een dubbel uitgevoerde horizontale dwarsverbinding, allen kokervormig met rechthoekige doorsnede. Ook wel portiek of portaal genoemd"	""	"Seinbrug"	"Metalen constructie bestaande uit 2 of meer verticale steunen met voetplaat en uit een enkele of een dubbel uitgevoerde horizontale dwarsverbinding, allen kokervormig met rechthoekige doorsnede. Ook wel portiek of portaal genoemd"	""	""	"true"	"https://wegenenverkeer-test.data.vlaanderen.be/ns/onderdeel#"	"Seinbrug"	"http://www.w3.org/2000/01/rdf-schema#Class"	""	""	"https://wegenenverkeer-test.data.vlaanderen.be/ns/abstracten#VRIDraagConstructie"	""	""
"CLASS"	"OSLO-Onderdeel"	"Boombrug"	"{15F418B4-3017-45ce-BC32-E7F8618A9202}"	""	""	""	""	"Boombrug"	"Een eenvoudige constructie die een oversteek biedt voor soorten die in bomen leven, voornamelijk eekhoorns."	""	"Boombrug"	"Een eenvoudige constructie die een oversteek biedt voor soorten die in bomen leven, voornamelijk eekhoorns."	""	""	"true"	"https://wegenenverkeer-test.data.vlaanderen.be/ns/onderdeel#"	"Boombrug"	"http://www.w3.org/2000/01/rdf-schema#Class"	""	""	""	""	""
"CLASS"	"OSLO-Installatie"	"Ecovallei"	"{C53C20A6-7968-4f44-A2E0-9982FC51F6BC}"	""	""	""	""	"Ecovallei"	"Een vallei onder de verkeersbrug waar het landschap gewoon onderdoor loopt en minimaal wordt verstoord."	""	"Ecovallei"	"Een vallei onder de verkeersbrug waar het landschap gewoon onderdoor loopt en minimaal wordt verstoord."	""	""	"true"	"https://wegenenverkeer-test.data.vlaanderen.be/ns/installatie#"	"Ecovallei"	"http://www.w3.org/2000/01/rdf-schema#Class"	""	""	""	""	""
"CLASS"	"OSLO-Onderdeel"	"Afscherming"	"{E89EDEBE-7907-41f3-9A5C-F923B62DFE93}"	"AWVObject"	""	""	""	"Afscherming"	"Schermen of wallen op de rand van het ecoduct die ervoor zorgen dat dieren op de brug niet afgeschrikt worden door de lichten van voorbijrijdende voertuigen."	""	"Afscherming"	"Schermen of wallen op de rand van het ecoduct die ervoor zorgen dat dieren op de brug niet afgeschrikt worden door de lichten van voorbijrijdende voertuigen."	""	""	"true"	"https://wegenenverkeer-test.data.vlaanderen.be/ns/onderdeel#"	"Afscherming"	"http://www.w3.org/2000/01/rdf-schema#Class"	""	""	"https://wegenenverkeer-test.data.vlaanderen.be/ns/implementatieelement#AWVObject"	""	""
"CLASS"	"OSLO-Onderdeel"	"Veerooster"	"{1A0BC53D-351E-46a9-908F-882F1B01503D}"	"ComplexeGeleiding, AWVObject"	""	""	""	"Veerooster"	"Een veerooster is een infrastructurele voorziening die is aangebracht in het wegdek om te voorkomen dat vee een gebied binnenkomt of verlaat."	""	"Veerooster"	"Een veerooster is een infrastructurele voorziening die is aangebracht in het wegdek om te voorkomen dat vee een gebied binnenkomt of verlaat."	""	""	"true"	"https://wegenenverkeer-test.data.vlaanderen.be/ns/onderdeel#"	"Veerooster"	"http://www.w3.org/2000/01/rdf-schema#Class"	""	""	"https://wegenenverkeer-test.data.vlaanderen.be/ns/onderdeel#ComplexeGeleiding, https://wegenenverkeer-test.data.vlaanderen.be/ns/implementatieelement#AWVObject"	""	""
"CLASS"	"OSLO-Onderdeel"	"Stobbenwal"	"{02590B66-4BCC-4264-B32A-108DB928AA9C}"	"Geleiding"	""	""	""	"Stobbenwal"	"Wortelkluiten of ander houtmateriaal (zoals stamhout) om beschutting en geleiding van kleinere diersoorten zoals muizen, egels."	""	"Stobbenwal"	"Wortelkluiten of ander houtmateriaal (zoals stamhout) om beschutting en geleiding van kleinere diersoorten zoals muizen, egels."	""	""	"true"	"https://wegenenverkeer-test.data.vlaanderen.be/ns/onderdeel#"	"Stobbenwal"	"http://www.w3.org/2000/01/rdf-schema#Class"	""	""	"https://wegenenverkeer-test.data.vlaanderen.be/ns/abstracten#Geleiding"	""	""
"CLASS"	"OSLO-Installatie"	"Ecoduiker"	"{F2730292-C76F-4c47-B96E-11DBB15F9477}"	""	""	""	""	"Ecoduiker"	"Buis- of tunnelvormige doorgang voor water onder een weg, die is voorzien van een oeverstrook of van looprichels zodat kleinere diersoorten beschermd voor het verkeer kunnen doorsteken."	""	"Ecoduiker"	"Buis- of tunnelvormige doorgang voor water onder een weg, die is voorzien van een oeverstrook of van looprichels zodat kleinere diersoorten beschermd voor het verkeer kunnen doorsteken."	""	""	"true"	"https://wegenenverkeer-test.data.vlaanderen.be/ns/installatie#"	"Ecoduiker"	"http://www.w3.org/2000/01/rdf-schema#Class"	""	""	""	""	""
"CLASS"	"OSLO-Abstracten"	"Geleiding"	"{7346FA01-2AB1-4c32-ABFB-E9444CC77577}"	"AWVObject"	""	""	""	"Geleiding"	"Abstracte om de gerelateerde objecten onder 1 noemer te houden."	""	"Geleiding"	"Abstracte om de gerelateerde objecten onder 1 noemer te houden."	""	""	"true"	"https://wegenenverkeer-test.data.vlaanderen.be/ns/abstracten#"	"Geleiding"	"http://www.w3.org/2000/01/rdf-schema#Class"	""	""	"https://wegenenverkeer-test.data.vlaanderen.be/ns/implementatieelement#AWVObject"	""	""
"CLASS"	"OSLO-Installatie"	"Ecoduct"	"{B10DAB45-8E2D-4c5b-9D84-F0F320AC2C64}"	""	""	""	""	"Ecoduct"	"Ecoducten of natuurbruggen zorgen ervoor dat dieren veilig de weg kunnen oversteken."	""	"Ecoduct"	"Ecoducten of natuurbruggen zorgen ervoor dat dieren veilig de weg kunnen oversteken."	""	""	"true"	"https://wegenenverkeer-test.data.vlaanderen.be/ns/installatie#"	"Ecoduct"	"http://www.w3.org/2000/01/rdf-schema#Class"	""	""	""	""	""
"CLASS"	"OSLO-Installatie"	"Ecotunnel"	"{76BEA703-445C-4e4e-AD6E-255EC66E5FA1}"	""	""	""	""	"Ecotunnel"	"Een (grote) ecotunnel is een tunnel onder een grote weg, waarlangs dieren veilig de overkant kunnen bereiken."	""	"Ecotunnel"	"Een (grote) ecotunnel is een tunnel onder een grote weg, waarlangs dieren veilig de overkant kunnen bereiken."	""	""	"true"	"https://wegenenverkeer-test.data.vlaanderen.be/ns/installatie#"	"Ecotunnel"	"http://www.w3.org/2000/01/rdf-schema#Class"	""	""	""	""	""
"CLASS"	"OSLO-Abstracten"	"Laag"	"{58E7E3BD-A9A9-4e04-957D-942F897D7ED8}"	"AWVObject"	""	""	""	"Laag"	"Abstracte voor de gemeenschappelijke eigenschappen van de onderliggende verhardings- en funderings-onderdelen."	""	"Laag"	"Abstracte voor de gemeenschappelijke eigenschappen van de onderliggende verhardings- en funderings-onderdelen."	""	""	"true"	"https://wegenenverkeer-test.data.vlaanderen.be/ns/abstracten#"	"Laag"	"http://www.w3.org/2000/01/rdf-schema#Class"	""	""	"https://wegenenverkeer-test.data.vlaanderen.be/ns/implementatieelement#AWVObject"	""	""
"CLASS"	"OSLO-Abstracten"	"ConstructieElement"	"{917FBCD6-FAE5-4b0a-94ED-2D7B8053BE7C}"	"AWVObject"	""	""	""	"Constructie element"	"Abstracte voor de verschillende constructie elementen."	""	"Constructie element"	"Abstracte voor de verschillende constructie elementen."	""	""	"true"	"https://wegenenverkeer-test.data.vlaanderen.be/ns/abstracten#"	"ConstructieElement"	"http://www.w3.org/2000/01/rdf-schema#Class"	""	""	"https://wegenenverkeer-test.data.vlaanderen.be/ns/implementatieelement#AWVObject"	""	""
"CLASS"	"OSLO-Abstracten"	"LEDBordToegang"	"{F9FCD18B-B222-479b-A20F-9EFDFF7C1F86}"	"AWVNaamObject"	""	""	""	"LED-bord toegang"	"Abstracte als toegang tot de verschillende ledborden."	""	"LED-bord toegang"	"Abstracte als toegang tot de verschillende ledborden."	""	""	"true"	"https://wegenenverkeer-test.data.vlaanderen.be/ns/abstracten#"	"LEDBordToegang"	"http://www.w3.org/2000/01/rdf-schema#Class"	""	""	"https://wegenenverkeer-test.data.vlaanderen.be/ns/implementatieelement#AWVNaamObject"	""	""
"CLASS"	"OSLO-Installatie"	"VleermuisvriendelijkeVerlichting"	"{C2365CCF-095D-465d-A39C-F911478F63E4}"	""	""	""	""	"Vleermuisvriendelijke verlichting"	"Verlichting op gemengde natuurbruggen of -tunnels aangepast zodat deze vleermuisvriendelijk gemaakt worden."	""	"Vleermuisvriendelijke verlichting"	"Verlichting op gemengde natuurbruggen of -tunnels aangepast zodat deze vleermuisvriendelijk gemaakt worden."	""	""	"true"	"https://wegenenverkeer-test.data.vlaanderen.be/ns/installatie#"	"VleermuisvriendelijkeVerlichting"	"http://www.w3.org/2000/01/rdf-schema#Class"	""	""	""	""	""
"CLASS"	"OSLO-Onderdeel"	"Geleidingswand"	"{B22EA516-5285-459f-A27A-6CAA8AE70FE2}"	"Geleiding"	""	""	""	"Geleidingswand"	"Een geleidingswand geleidt kleinere dieren zoals amfibieën naar kleinere ecokokers,ecoduikers,..."	""	"Geleidingswand"	"Een geleidingswand geleidt kleinere dieren zoals amfibieën naar kleinere ecokokers,ecoduikers,..."	""	""	"true"	"https://wegenenverkeer-test.data.vlaanderen.be/ns/onderdeel#"	"Geleidingswand"	"http://www.w3.org/2000/01/rdf-schema#Class"	""	""	"https://wegenenverkeer-test.data.vlaanderen.be/ns/abstracten#Geleiding"	""	""
"CLASS"	"OSLO-Installatie"	"Ecokoker"	"{85C10327-CF3B-45d8-B9A2-25717BA3BBFD}"	""	""	""	""	"Ecokoker"	"Een kleine ecotunnel of ecokoker is een doorgang voor dieren onder een weg of spoorweg."	""	"Ecokoker"	"Een kleine ecotunnel of ecokoker is een doorgang voor dieren onder een weg of spoorweg."	""	""	"true"	"https://wegenenverkeer-test.data.vlaanderen.be/ns/installatie#"	"Ecokoker"	"http://www.w3.org/2000/01/rdf-schema#Class"	""	""	""	""	""
"CLASS"	"OSLO-Onderdeel"	"Rioleringsbuis"	"{778272F6-2241-4617-8DA3-23382122582B}"	"Buis"	""	""	""	"Rioleringsbuis"	"Ondergronds kanaal of pijp voor gravitaire afvoer van water."	""	"Rioleringsbuis"	"Ondergronds kanaal of pijp voor gravitaire afvoer van water."	""	""	"true"	"https://wegenenverkeer-test.data.vlaanderen.be/ns/onderdeel#"	"Rioleringsbuis"	"http://www.w3.org/2000/01/rdf-schema#Class"	""	""	"https://wegenenverkeer-test.data.vlaanderen.be/ns/abstracten#Buis"	""	""
"CLASS"	"OSLO-Installatie"	"Wildwaarschuwingssysteem"	"{D29CDC18-5B4A-4ca8-8AD8-1251EF4667B5}"	""	""	""	""	"Wildwaarschuwingssysteem"	"Wildwaarschuwingssysteem (wilddetectiesystemen) registreren de beweging van dieren in de omgeving van de weg. Vervolgens kan het chauffeurs waarschuwen dat er zich dieren op de weg bevinden, zodat ze op tijd hun snelheid kunnen aanpassen."	""	"Wildwaarschuwingssysteem"	"Wildwaarschuwingssysteem (wilddetectiesystemen) registreren de beweging van dieren in de omgeving van de weg. Vervolgens kan het chauffeurs waarschuwen dat er zich dieren op de weg bevinden, zodat ze op tijd hun snelheid kunnen aanpassen."	""	""	"true"	"https://wegenenverkeer-test.data.vlaanderen.be/ns/installatie#"	"Wildwaarschuwingssysteem"	"http://www.w3.org/2000/01/rdf-schema#Class"	""	""	""	""	""
"CLASS"	"OSLO-Onderdeel"	"Wildreflector"	"{E7B9A61E-89E9-4678-8C44-DE48D034E043}"	"Bebakening"	""	""	""	"Wildreflector"	"Een wildreflector is een reflecterend afschrikkingssysteem voor groot en klein wild nabij een weg."	""	"Wildreflector"	"Een wildreflector is een reflecterend afschrikkingssysteem voor groot en klein wild nabij een weg."	""	""	"true"	"https://wegenenverkeer-test.data.vlaanderen.be/ns/onderdeel#"	"Wildreflector"	"http://www.w3.org/2000/01/rdf-schema#Class"	""	""	"https://wegenenverkeer-test.data.vlaanderen.be/ns/abstracten#Bebakening"	""	""
"CLASS"	"OSLO-Onderdeel"	"Terugkeer"	"{4933A3F6-01BD-4f2f-AC74-7DBD356FB63C}"	"ComplexeGeleiding, AWVObject"	""	""	""	"Terugkeer"	"Een mogelijkheid om dieren die toch aan de wegkant verzeild zijn geraakt terug naar de veilige kant te laten begeven."	""	"Terugkeer"	"Een mogelijkheid om dieren die toch aan de wegkant verzeild zijn geraakt terug naar de veilige kant te laten begeven."	""	""	"true"	"https://wegenenverkeer-test.data.vlaanderen.be/ns/onderdeel#"	"Terugkeer"	"http://www.w3.org/2000/01/rdf-schema#Class"	""	""	"https://wegenenverkeer-test.data.vlaanderen.be/ns/onderdeel#ComplexeGeleiding, https://wegenenverkeer-test.data.vlaanderen.be/ns/implementatieelement#AWVObject"	""	""
"CLASS"	"OSLO-Onderdeel"	"EcoPoort"	"{795CCBF6-FDF8-4c55-965B-63E0453D1554}"	"ComplexeGeleiding, AWVObject"	""	""	""	"Eco poort"	"Een afsluitbare doorgang om mensen toe te laten tot het gebied."	""	"Eco poort"	"Een afsluitbare doorgang om mensen toe te laten tot het gebied."	""	""	"true"	"https://wegenenverkeer-test.data.vlaanderen.be/ns/onderdeel#"	"EcoPoort"	"http://www.w3.org/2000/01/rdf-schema#Class"	""	""	"https://wegenenverkeer-test.data.vlaanderen.be/ns/onderdeel#ComplexeGeleiding, https://wegenenverkeer-test.data.vlaanderen.be/ns/implementatieelement#AWVObject"	""	""
"CLASS"	"OSLO-Onderdeel"	"Ecoraster"	"{085F112D-8AB8-4b0f-9323-F03CF3BA5A5E}"	"ComplexeGeleiding"	""	""	""	"Ecoraster"	"Een geleiding om dieren te leiden naar een plaats (ecoduct, ecotunel,) waar ze veilig een drukke weg kunnen oversteken."	""	"Ecoraster"	"Een geleiding om dieren te leiden naar een plaats (ecoduct, ecotunel,) waar ze veilig een drukke weg kunnen oversteken."	""	""	"true"	"https://wegenenverkeer-test.data.vlaanderen.be/ns/onderdeel#"	"Ecoraster"	"http://www.w3.org/2000/01/rdf-schema#Class"	""	""	"https://wegenenverkeer-test.data.vlaanderen.be/ns/onderdeel#ComplexeGeleiding"	""	""
"CLASS"	"OSLO-Abstracten"	"WaterloopRelatie"	"{C81481D9-7417-48f8-A935-7605EF570082}"	"AWVNaamObject, ProefBathymetrie"	""	""	""	"Waterloop relatie"	"Abstracte om de gemeenschappelijke relaties van de verschillende soorten waterlopen onder 1 noemer te houden."	""	"Waterloop relatie"	"Abstracte om de gemeenschappelijke relaties van de verschillende soorten waterlopen onder 1 noemer te houden."	""	""	"true"	"https://wegenenverkeer-test.data.vlaanderen.be/ns/abstracten#"	"WaterloopRelatie"	"http://www.w3.org/2000/01/rdf-schema#Class"	""	""	"https://wegenenverkeer-test.data.vlaanderen.be/ns/proefenmeting#ProefBathymetrie, https://wegenenverkeer-test.data.vlaanderen.be/ns/implementatieelement#AWVNaamObject"	""	""
"CLASS"	"OSLO-Onderdeel"	"Bevestiging"	"{851E2395-627F-4352-8324-2E91CD6B80DE}"	""	""	""	""	"Bevestiging"	"Deze relatie geeft aan dat twee onderdelen direct fysiek op elkaar bevestigd zijn. Dit kan zowel aan de buitenkant als aan de binnenkant zijn zoals bv. een camera aan een paal of een laagspanningsbord in een kast. Deze relatie heeft geen richting."	""	"Bevestiging"	"Deze relatie geeft aan dat twee onderdelen direct fysiek op elkaar bevestigd zijn. Dit kan zowel aan de buitenkant als aan de binnenkant zijn zoals bv. een camera aan een paal of een laagspanningsbord in een kast. Deze relatie heeft geen richting."	""	""	"true"	"https://wegenenverkeer-test.data.vlaanderen.be/ns/onderdeel#"	"Bevestiging"	"http://www.w3.org/2000/01/rdf-schema#Class"	""	""	""	""	""
