"EA-Type"	"EA-Package"	"EA-Name"	"EA-GUID"	"EA-Parent"	"EA-Domain"	"EA-Domain-GUID"	"EA-Range"	"label"	"definition"	"usage"	"ap-label-nl"	"ap-definition-nl"	"ap-usageNote-nl"	"ap-codelist"	"external term"	"namespace"	"localname"	"type"	"domain"	"range"	"parent"	"min card"	"max card"
"attribute"	"OSLO-Onderdeel"	"plantmaat"	"{B8AB0035-23F3-4d83-BBA6-10A7862FC8B5}"	""	"DtcHoutigeAanleg"	"{6DEFDE50-304C-4764-891E-57F35C17C9BB}"	"KlHoutigePlantmaat"	"plantmaat"	"De hoogte van de plant in cm gemeten tussen een minimum en maximum waarde."	""	"plantmaat"	"De hoogte van de plant in cm gemeten tussen een minimum en maximum waarde."	""	""	"true"	"https://wegenenverkeer-test.data.vlaanderen.be/ns/abstracten#"	"DtcHoutigeAanleg.plantmaat"	"http://www.w3.org/2002/07/owl#ObjectProperty"	"https://wegenenverkeer-test.data.vlaanderen.be/ns/abstracten#DtcHoutigeAanleg"	"http://www.w3.org/2004/02/skos/core#Concept"	""	"1"	"1"
"attribute"	"OSLO-Onderdeel"	"plantverband"	"{F8EE1106-D59E-4ca0-A7CF-28D5638079E6}"	""	"DtcHoutigeAanleg"	"{6DEFDE50-304C-4764-891E-57F35C17C9BB}"	"KlVegetatiePlantverband"	"plantverband"	"De wijze waarop de planten zijn geschikt."	""	"plantverband"	"De wijze waarop de planten zijn geschikt."	""	""	"true"	"https://wegenenverkeer-test.data.vlaanderen.be/ns/abstracten#"	"DtcHoutigeAanleg.plantverband"	"http://www.w3.org/2002/07/owl#ObjectProperty"	"https://wegenenverkeer-test.data.vlaanderen.be/ns/abstracten#DtcHoutigeAanleg"	"http://www.w3.org/2004/02/skos/core#Concept"	""	"1"	"1"
"attribute"	"OSLO-Onderdeel"	"wortel"	"{45E5AAF1-BFE0-4f74-88AB-F83461290CB6}"	""	"DtcHoutigeAanleg"	"{6DEFDE50-304C-4764-891E-57F35C17C9BB}"	"KlVegetatieWortel"	"wortel"	"De manier van levering en aanplanting van het wortelgestel van de boom of plant."	""	"wortel"	"De manier van levering en aanplanting van het wortelgestel van de boom of plant."	""	""	"true"	"https://wegenenverkeer-test.data.vlaanderen.be/ns/abstracten#"	"DtcHoutigeAanleg.wortel"	"http://www.w3.org/2002/07/owl#ObjectProperty"	"https://wegenenverkeer-test.data.vlaanderen.be/ns/abstracten#DtcHoutigeAanleg"	"http://www.w3.org/2004/02/skos/core#Concept"	""	"1"	"1"
"attribute"	"OSLO-Onderdeel"	"wortelgeleidingwortelwering"	"{185062C1-C78E-4117-9835-2395F5C767C9}"	""	"DtcHoutigeAanleg"	"{6DEFDE50-304C-4764-891E-57F35C17C9BB}"	"Boolean"	"wortelgeleiding-wortelwering"	"Wortelgeleiding en wering moet voorkomen dat boomwortels het trottoir, de middenberm, het fietspad, de rijweg, andere wegverhardingen en leidingstelsels beschadigen. Het heeft als doel om boomwortels naar beneden te leiden, waar ze onder een obstakel verder kunnen groeien."	""	"wortelgeleiding-wortelwering"	"Wortelgeleiding en wering moet voorkomen dat boomwortels het trottoir, de middenberm, het fietspad, de rijweg, andere wegverhardingen en leidingstelsels beschadigen. Het heeft als doel om boomwortels naar beneden te leiden, waar ze onder een obstakel verder kunnen groeien."	""	""	"true"	"https://wegenenverkeer-test.data.vlaanderen.be/ns/abstracten#"	"DtcHoutigeAanleg.wortelgeleidingwortelwering"	"http://www.w3.org/2002/07/owl#DatatypeProperty"	"https://wegenenverkeer-test.data.vlaanderen.be/ns/abstracten#DtcHoutigeAanleg"	"http://www.w3.org/2001/XMLSchema#boolean"	""	"1"	"1"
"attribute"	"OSLO-Onderdeel"	"code"	"{6F3A2819-1A63-4844-AD4A-A7D1EB5F0829}"	""	"DtcVegetatieSoortnaam"	"{10C9D2C4-EA68-4094-B41F-5421A8B495FB}"	"String"	"code"	"De GBIF key, een unieke identificator voor de soort van het vegetatie-element."	""	"code"	"De GBIF key, een unieke identificator voor de soort van het vegetatie-element."	""	""	"true"	"https://wegenenverkeer-test.data.vlaanderen.be/ns/abstracten#"	"DtcVegetatieSoortnaam.code"	"http://www.w3.org/2002/07/owl#DatatypeProperty"	"https://wegenenverkeer-test.data.vlaanderen.be/ns/abstracten#DtcVegetatieSoortnaam"	"http://www.w3.org/2001/XMLSchema#string"	""	"1"	"1"
"attribute"	"OSLO-Onderdeel"	"soortnaamNederlands"	"{7E38C7D1-A5D0-440a-81E5-27B2B7095A93}"	""	"DtcVegetatieSoortnaam"	"{10C9D2C4-EA68-4094-B41F-5421A8B495FB}"	"String"	"soortnaam nederlands"	"De Nederlandse soortnaam van de beplanting."	""	"soortnaam nederlands"	"De Nederlandse soortnaam van de beplanting."	""	""	"true"	"https://wegenenverkeer-test.data.vlaanderen.be/ns/abstracten#"	"DtcVegetatieSoortnaam.soortnaamNederlands"	"http://www.w3.org/2002/07/owl#DatatypeProperty"	"https://wegenenverkeer-test.data.vlaanderen.be/ns/abstracten#DtcVegetatieSoortnaam"	"http://www.w3.org/2001/XMLSchema#string"	""	"1"	"1"
"attribute"	"OSLO-Onderdeel"	"soortnaamWetenschappelijk"	"{2F408F1C-78FC-44ba-ADD4-5E3F7DA44828}"	""	"DtcVegetatieSoortnaam"	"{10C9D2C4-EA68-4094-B41F-5421A8B495FB}"	"String"	"soortnaam wetenschappelijk"	"De wetenschappelijke soortnaam van de beplanting."	""	"soortnaam wetenschappelijk"	"De wetenschappelijke soortnaam van de beplanting."	""	""	"true"	"https://wegenenverkeer-test.data.vlaanderen.be/ns/abstracten#"	"DtcVegetatieSoortnaam.soortnaamWetenschappelijk"	"http://www.w3.org/2002/07/owl#DatatypeProperty"	"https://wegenenverkeer-test.data.vlaanderen.be/ns/abstracten#DtcVegetatieSoortnaam"	"http://www.w3.org/2001/XMLSchema#string"	""	"1"	"1"
"attribute"	"OSLO-Onderdeel"	"aanleg"	"{0AEDE244-1A56-46e9-872D-5450803EE8DE}"	""	"Sierbeplanting"	"{C86E4E58-F801-4e96-9885-07C922206C93}"	"DtcSierbeplAanleg"	"aanleg"	"De manier van aanleg van de sierbeplanting."	""	"aanleg"	"De manier van aanleg van de sierbeplanting."	""	""	"true"	"https://wegenenverkeer-test.data.vlaanderen.be/ns/abstracten#"	"Sierbeplanting.aanleg"	"http://www.w3.org/2002/07/owl#ObjectProperty"	"https://wegenenverkeer-test.data.vlaanderen.be/ns/abstracten#Sierbeplanting"	"https://wegenenverkeer-test.data.vlaanderen.be/ns/abstracten#DtcSierbeplAanleg"	""	"1"	"1"
"attribute"	"OSLO-Onderdeel"	"type"	"{4FF34C64-112C-4fe0-9E0F-0BCC4EE40FEF}"	""	"Sierbeplanting"	"{C86E4E58-F801-4e96-9885-07C922206C93}"	"KlSierbeplantingType"	"type"	"Type van sierbeplanting."	""	"type"	"Type van sierbeplanting."	""	""	"true"	"https://wegenenverkeer-test.data.vlaanderen.be/ns/abstracten#"	"Sierbeplanting.type"	"http://www.w3.org/2002/07/owl#ObjectProperty"	"https://wegenenverkeer-test.data.vlaanderen.be/ns/abstracten#Sierbeplanting"	"http://www.w3.org/2004/02/skos/core#Concept"	""	"1"	"1"
"attribute"	"OSLO-Onderdeel"	"aanleg"	"{FA20F6C0-E2E8-44ce-AF44-7E28FF0650C4}"	""	"HoutigeVegetatie"	"{690C1ECA-FFF8-4ed1-B695-3F4EFD956454}"	"DtcHoutigeAanleg"	"aanleg"	"De manier van aanleg van de houtige vegetatie."	""	"aanleg"	"De manier van aanleg van de houtige vegetatie."	""	""	"true"	"https://wegenenverkeer-test.data.vlaanderen.be/ns/abstracten#"	"HoutigeVegetatie.aanleg"	"http://www.w3.org/2002/07/owl#ObjectProperty"	"https://wegenenverkeer-test.data.vlaanderen.be/ns/abstracten#HoutigeVegetatie"	"https://wegenenverkeer-test.data.vlaanderen.be/ns/abstracten#DtcHoutigeAanleg"	""	"1"	"1"
"attribute"	"OSLO-Onderdeel"	"hoogte"	"{CE2F7254-657F-479a-912C-ABCC4547C620}"	""	"HoutigeVegetatie"	"{690C1ECA-FFF8-4ed1-B695-3F4EFD956454}"	"KwantWrdInMeter"	"hoogte"	"De hoogte van de begroeiing in meter."	""	"hoogte"	"De hoogte van de begroeiing in meter."	""	""	"true"	"https://wegenenverkeer-test.data.vlaanderen.be/ns/abstracten#"	"HoutigeVegetatie.hoogte"	"http://www.w3.org/2002/07/owl#ObjectProperty"	"https://wegenenverkeer-test.data.vlaanderen.be/ns/abstracten#HoutigeVegetatie"	"https://wegenenverkeer-test.data.vlaanderen.be/ns/abstracten#KwantWrdInMeter"	""	"1"	"1"
"attribute"	"OSLO-Onderdeel"	"knipoppervlak"	"{2A6B12EE-A1C7-42cf-8211-FF18F7C6B829}"	""	"HoutigeVegetatie"	"{690C1ECA-FFF8-4ed1-B695-3F4EFD956454}"	"KwantWrdInVierkanteMeter"	"knipoppervlak"	"De afmeting van de begroeiing in vierkante meter dat geschoren moet worden."	""	"knipoppervlak"	"De afmeting van de begroeiing in vierkante meter dat geschoren moet worden."	""	""	"true"	"https://wegenenverkeer-test.data.vlaanderen.be/ns/abstracten#"	"HoutigeVegetatie.knipoppervlak"	"http://www.w3.org/2002/07/owl#ObjectProperty"	"https://wegenenverkeer-test.data.vlaanderen.be/ns/abstracten#HoutigeVegetatie"	"https://wegenenverkeer-test.data.vlaanderen.be/ns/abstracten#KwantWrdInVierkanteMeter"	""	"1"	"1"
"attribute"	"OSLO-Onderdeel"	"vrijUitgroeiend"	"{11BBA193-C341-4460-A04F-B1050628103E}"	""	"HoutigeVegetatie"	"{690C1ECA-FFF8-4ed1-B695-3F4EFD956454}"	"Boolean"	"vrij uitgroeiend"	"Geeft aan of de vegetatie of begroeiing al dan niet snoei vereist."	""	"vrij uitgroeiend"	"Geeft aan of de vegetatie of begroeiing al dan niet snoei vereist."	""	""	"true"	"https://wegenenverkeer-test.data.vlaanderen.be/ns/abstracten#"	"HoutigeVegetatie.vrijUitgroeiend"	"http://www.w3.org/2002/07/owl#DatatypeProperty"	"https://wegenenverkeer-test.data.vlaanderen.be/ns/abstracten#HoutigeVegetatie"	"http://www.w3.org/2001/XMLSchema#boolean"	""	"1"	"1"
"attribute"	"OSLO-Onderdeel"	"aanleg"	"{02E64906-0822-40bf-AFC5-3E9F04D95134}"	""	"GrazigeVegetatie"	"{0FD50373-4EF9-4fc2-8342-E94FDEA8CC57}"	"KlGrazigeVegetatieAanleg"	"aanleg"	"De wijze van aanleg/aanplanting van de grazige vegetatie."	""	"aanleg"	"De wijze van aanleg/aanplanting van de grazige vegetatie."	""	""	"true"	"https://wegenenverkeer-test.data.vlaanderen.be/ns/abstracten#"	"GrazigeVegetatie.aanleg"	"http://www.w3.org/2002/07/owl#ObjectProperty"	"https://wegenenverkeer-test.data.vlaanderen.be/ns/abstracten#GrazigeVegetatie"	"http://www.w3.org/2004/02/skos/core#Concept"	""	"1"	"1"
"attribute"	"OSLO-Onderdeel"	"overgroeienRandVerharding"	"{7D5A7367-D6EC-4bc3-A579-D5D86C922A7B}"	""	"GrazigeVegetatie"	"{0FD50373-4EF9-4fc2-8342-E94FDEA8CC57}"	"Boolean"	"overgroeien rand verharding"	"Geeft aan of de rand van de verharding al dan niet wordt overgroeid door de grazige vegetatie."	""	"overgroeien rand verharding"	"Geeft aan of de rand van de verharding al dan niet wordt overgroeid door de grazige vegetatie."	""	""	"true"	"https://wegenenverkeer-test.data.vlaanderen.be/ns/abstracten#"	"GrazigeVegetatie.overgroeienRandVerharding"	"http://www.w3.org/2002/07/owl#DatatypeProperty"	"https://wegenenverkeer-test.data.vlaanderen.be/ns/abstracten#GrazigeVegetatie"	"http://www.w3.org/2001/XMLSchema#boolean"	""	"1"	"1"
"attribute"	"OSLO-Abstracten"	"breedte"	"{2B46F49C-2845-48af-8BB1-BA2248C0C22E}"	""	"BegroeidVoorkomen"	"{09E5710C-6AD7-4d52-B15A-6D3A563007B0}"	"KwantWrdInMeter"	"breedte"	"De breedte van het begroeide oppervlak."	""	"breedte"	"De breedte van het begroeide oppervlak."	""	""	"true"	"https://wegenenverkeer-test.data.vlaanderen.be/ns/abstracten#"	"BegroeidVoorkomen.breedte"	"http://www.w3.org/2002/07/owl#ObjectProperty"	"https://wegenenverkeer-test.data.vlaanderen.be/ns/abstracten#BegroeidVoorkomen"	"https://wegenenverkeer-test.data.vlaanderen.be/ns/abstracten#KwantWrdInMeter"	""	"1"	"1"
"attribute"	"OSLO-Abstracten"	"drassigheid"	"{5533CCCE-95B5-4b2d-A92E-DE9A05AF8CAB}"	""	"BegroeidVoorkomen"	"{09E5710C-6AD7-4d52-B15A-6D3A563007B0}"	"KlVegetatieDrassigheid"	"drassigheid"	"Mate waarin de bodem verzadigd is met water. De drassigheid geeft hierbij aan in welke mate de normale werking van types machines zou kunnen verstoord worden."	""	"drassigheid"	"Mate waarin de bodem verzadigd is met water. De drassigheid geeft hierbij aan in welke mate de normale werking van types machines zou kunnen verstoord worden."	""	""	"true"	"https://wegenenverkeer-test.data.vlaanderen.be/ns/abstracten#"	"BegroeidVoorkomen.drassigheid"	"http://www.w3.org/2002/07/owl#ObjectProperty"	"https://wegenenverkeer-test.data.vlaanderen.be/ns/abstracten#BegroeidVoorkomen"	"http://www.w3.org/2004/02/skos/core#Concept"	""	"1"	"1"
"attribute"	"OSLO-Abstracten"	"exoten"	"{C482D26E-8144-44a3-B08C-9EF8FAF86075}"	""	"BegroeidVoorkomen"	"{09E5710C-6AD7-4d52-B15A-6D3A563007B0}"	"Boolean"	"exoten"	"Aanduiding of er al dan niet exoten aanwezig zijn."	""	"exoten"	"Aanduiding of er al dan niet exoten aanwezig zijn."	""	""	"true"	"https://wegenenverkeer-test.data.vlaanderen.be/ns/abstracten#"	"BegroeidVoorkomen.exoten"	"http://www.w3.org/2002/07/owl#DatatypeProperty"	"https://wegenenverkeer-test.data.vlaanderen.be/ns/abstracten#BegroeidVoorkomen"	"http://www.w3.org/2001/XMLSchema#boolean"	""	"1"	"1"
"attribute"	"OSLO-Abstracten"	"lengte"	"{06B75C85-416D-46fe-89C8-C514B2000BDB}"	""	"BegroeidVoorkomen"	"{09E5710C-6AD7-4d52-B15A-6D3A563007B0}"	"KwantWrdInMeter"	"lengte"	"De lengte van het begroeide oppervlak."	""	"lengte"	"De lengte van het begroeide oppervlak."	""	""	"true"	"https://wegenenverkeer-test.data.vlaanderen.be/ns/abstracten#"	"BegroeidVoorkomen.lengte"	"http://www.w3.org/2002/07/owl#ObjectProperty"	"https://wegenenverkeer-test.data.vlaanderen.be/ns/abstracten#BegroeidVoorkomen"	"https://wegenenverkeer-test.data.vlaanderen.be/ns/abstracten#KwantWrdInMeter"	""	"1"	"1"
"attribute"	"OSLO-Abstracten"	"obstakels"	"{FB903005-498C-4815-9C9E-05B105E5295A}"	""	"BegroeidVoorkomen"	"{09E5710C-6AD7-4d52-B15A-6D3A563007B0}"	"Boolean"	"obstakels"	"Eigenschap die aangeeft of er binnen het beheerdeel al dan niet objecten voorkomen die de vrije werking van machines of andere werktuigen kan verhinderen."	""	"obstakels"	"Eigenschap die aangeeft of er binnen het beheerdeel al dan niet objecten voorkomen die de vrije werking van machines of andere werktuigen kan verhinderen."	""	""	"true"	"https://wegenenverkeer-test.data.vlaanderen.be/ns/abstracten#"	"BegroeidVoorkomen.obstakels"	"http://www.w3.org/2002/07/owl#DatatypeProperty"	"https://wegenenverkeer-test.data.vlaanderen.be/ns/abstracten#BegroeidVoorkomen"	"http://www.w3.org/2001/XMLSchema#boolean"	""	"1"	"1"
"attribute"	"OSLO-Abstracten"	"oppervlakte"	"{63AC5153-A440-4d5e-AF55-48714EF0EFA4}"	""	"BegroeidVoorkomen"	"{09E5710C-6AD7-4d52-B15A-6D3A563007B0}"	"KwantWrdInVierkanteMeter"	"oppervlakte"	"De oppervlakte van het begroeide oppervlak in vierkante meter."	""	"oppervlakte"	"De oppervlakte van het begroeide oppervlak in vierkante meter."	""	""	"true"	"https://wegenenverkeer-test.data.vlaanderen.be/ns/abstracten#"	"BegroeidVoorkomen.oppervlakte"	"http://www.w3.org/2002/07/owl#ObjectProperty"	"https://wegenenverkeer-test.data.vlaanderen.be/ns/abstracten#BegroeidVoorkomen"	"https://wegenenverkeer-test.data.vlaanderen.be/ns/abstracten#KwantWrdInVierkanteMeter"	""	"1"	"1"
"attribute"	"OSLO-Abstracten"	"soort"	"{08C0A065-3262-4651-906C-114319B716FE}"	""	"BegroeidVoorkomen"	"{09E5710C-6AD7-4d52-B15A-6D3A563007B0}"	"DtcVegetatieSoortnaam"	"soort"	"De naam van de plantensoort
."	""	"soort"	"De naam van de plantensoort
."	""	""	"true"	"https://wegenenverkeer-test.data.vlaanderen.be/ns/abstracten#"	"BegroeidVoorkomen.soort"	"http://www.w3.org/2002/07/owl#ObjectProperty"	"https://wegenenverkeer-test.data.vlaanderen.be/ns/abstracten#BegroeidVoorkomen"	"https://wegenenverkeer-test.data.vlaanderen.be/ns/abstracten#DtcVegetatieSoortnaam"	""	"1"	"1"
"attribute"	"OSLO-Abstracten"	"taludwaarde"	"{3783FB40-9C34-4fee-B007-ECE27ADF937C}"	""	"BegroeidVoorkomen"	"{09E5710C-6AD7-4d52-B15A-6D3A563007B0}"	"KlTaludWaarde"	"taludwaarde"	"Een talud is het kunstmatig gedeelte van een vlak van de wegbaan, dijken, spoorbanen, vestingswerken,? dat een helling (min. 20%, max 80% voor kunstmatig verharde taluds) vertoont en bedoeld voor het opvangen van een hoogteverschil."	""	"taludwaarde"	"Een talud is het kunstmatig gedeelte van een vlak van de wegbaan, dijken, spoorbanen, vestingswerken,? dat een helling (min. 20%, max 80% voor kunstmatig verharde taluds) vertoont en bedoeld voor het opvangen van een hoogteverschil."	""	""	"true"	"https://wegenenverkeer-test.data.vlaanderen.be/ns/abstracten#"	"BegroeidVoorkomen.taludwaarde"	"http://www.w3.org/2002/07/owl#ObjectProperty"	"https://wegenenverkeer-test.data.vlaanderen.be/ns/abstracten#BegroeidVoorkomen"	"http://www.w3.org/2004/02/skos/core#Concept"	""	"1"	"1"
"attribute"	"OSLO-Levenscyclus"	"begieting"	"{49E4A817-8E87-47bb-B922-E2E93AD0C1DC}"	""	"Boomvormbeheer"	"{BBF91BF0-3621-4cb5-9957-0C3974151DA0}"	"Boolean"	"begieting"	"Aanduiding of begieting van de boom nodig is en gebeurt."	""	"begieting"	"Aanduiding of begieting van de boom nodig is en gebeurt."	""	""	"true"	"https://wegenenverkeer-test.data.vlaanderen.be/ns/abstracten#"	"Boomvormbeheer.begieting"	"http://www.w3.org/2002/07/owl#DatatypeProperty"	"https://wegenenverkeer-test.data.vlaanderen.be/ns/abstracten#Boomvormbeheer"	"http://www.w3.org/2001/XMLSchema#boolean"	""	"1"	"1"
"attribute"	"OSLO-Levenscyclus"	"naderOnderzoekTomograaf"	"{BE93542A-DEDB-4d65-9E7C-6D790590869D}"	""	"Boomvormbeheer"	"{BBF91BF0-3621-4cb5-9957-0C3974151DA0}"	"Boolean"	"onderzoek tomograaf"	"Aanduiding of onderzoek is gedaan met een tomograaf."	""	"onderzoek tomograaf"	"Aanduiding of onderzoek is gedaan met een tomograaf."	""	""	"true"	"https://wegenenverkeer-test.data.vlaanderen.be/ns/abstracten#"	"Boomvormbeheer.naderOnderzoekTomograaf"	"http://www.w3.org/2002/07/owl#DatatypeProperty"	"https://wegenenverkeer-test.data.vlaanderen.be/ns/abstracten#Boomvormbeheer"	"http://www.w3.org/2001/XMLSchema#boolean"	""	"1"	"1"
"attribute"	"OSLO-Levenscyclus"	"verderOnderzoekTrekproef"	"{BA1C0731-5639-4202-BE6F-2BADD158FFD8}"	""	"Boomvormbeheer"	"{BBF91BF0-3621-4cb5-9957-0C3974151DA0}"	"Boolean"	"onderzoek trekproef"	"Aanduiding of onderzoek gedaan is met de trekproef."	""	"onderzoek trekproef"	"Aanduiding of onderzoek gedaan is met de trekproef."	""	""	"true"	"https://wegenenverkeer-test.data.vlaanderen.be/ns/abstracten#"	"Boomvormbeheer.verderOnderzoekTrekproef"	"http://www.w3.org/2002/07/owl#DatatypeProperty"	"https://wegenenverkeer-test.data.vlaanderen.be/ns/abstracten#Boomvormbeheer"	"http://www.w3.org/2001/XMLSchema#boolean"	""	"1"	"1"
"attribute"	"OSLO-Abstracten"	"boomplaat"	"{635261AA-C860-4c68-B4AD-885D3D756409}"	""	"AanlegBoomvorm"	"{5F680186-4B1B-4f3e-8DF9-D0B057AD1B2E}"	"Boolean"	"boomplaat"	"Boomplaten worden aangebracht rond de stam van bomen, bosgoed en heesters en eventueel vastgezet met piketten. Ze hebben een centrale opening en een rechte snede, zodat ze op eenvoudige wijze rond de planten kunnen aangebracht worden."	""	"boomplaat"	"Boomplaten worden aangebracht rond de stam van bomen, bosgoed en heesters en eventueel vastgezet met piketten. Ze hebben een centrale opening en een rechte snede, zodat ze op eenvoudige wijze rond de planten kunnen aangebracht worden."	""	""	"true"	"https://wegenenverkeer-test.data.vlaanderen.be/ns/abstracten#"	"AanlegBoomvorm.boomplaat"	"http://www.w3.org/2002/07/owl#DatatypeProperty"	"https://wegenenverkeer-test.data.vlaanderen.be/ns/abstracten#AanlegBoomvorm"	"http://www.w3.org/2001/XMLSchema#boolean"	""	"1"	"1"
"attribute"	"OSLO-Abstracten"	"gietrandtype"	"{1D36D449-6281-4d5c-8E4E-92B054FAA113}"	""	"AanlegBoomvorm"	"{5F680186-4B1B-4f3e-8DF9-D0B057AD1B2E}"	"KlBoomGietrandtype"	"gietrandtype"	"Het type omwalling rond de stamvoet van een boom."	""	"gietrandtype"	"Het type omwalling rond de stamvoet van een boom."	""	""	"true"	"https://wegenenverkeer-test.data.vlaanderen.be/ns/abstracten#"	"AanlegBoomvorm.gietrandtype"	"http://www.w3.org/2002/07/owl#ObjectProperty"	"https://wegenenverkeer-test.data.vlaanderen.be/ns/abstracten#AanlegBoomvorm"	"http://www.w3.org/2004/02/skos/core#Concept"	""	"1"	"1"
"attribute"	"OSLO-Abstracten"	"plantmaat"	"{92037637-C170-4672-B91C-8E99D44A0E3E}"	""	"AanlegBoomvorm"	"{5F680186-4B1B-4f3e-8DF9-D0B057AD1B2E}"	"KlBoomPlantmaat"	"plantmaat"	"De maat van de boom in cm gemeten op 1 m boven het maaiveld tussen een minimum en maximum waarde."	""	"plantmaat"	"De maat van de boom in cm gemeten op 1 m boven het maaiveld tussen een minimum en maximum waarde."	""	""	"true"	"https://wegenenverkeer-test.data.vlaanderen.be/ns/abstracten#"	"AanlegBoomvorm.plantmaat"	"http://www.w3.org/2002/07/owl#ObjectProperty"	"https://wegenenverkeer-test.data.vlaanderen.be/ns/abstracten#AanlegBoomvorm"	"http://www.w3.org/2004/02/skos/core#Concept"	""	"1"	"1"
"attribute"	"OSLO-Abstracten"	"verankering"	"{5D4620A8-A1BF-4f7d-BE11-583CF6978C6F}"	""	"AanlegBoomvorm"	"{5F680186-4B1B-4f3e-8DF9-D0B057AD1B2E}"	"KlBoomVerankering"	"verankering"	"Duidt de manier van verankering van de boom bij aanplant aan."	""	"verankering"	"Duidt de manier van verankering van de boom bij aanplant aan."	""	""	"true"	"https://wegenenverkeer-test.data.vlaanderen.be/ns/abstracten#"	"AanlegBoomvorm.verankering"	"http://www.w3.org/2002/07/owl#ObjectProperty"	"https://wegenenverkeer-test.data.vlaanderen.be/ns/abstracten#AanlegBoomvorm"	"http://www.w3.org/2004/02/skos/core#Concept"	""	"1"	"1"
"attribute"	"OSLO-Abstracten"	"verankeringstype"	"{9998BE88-D551-400b-9C8E-C704740B2B16}"	""	"AanlegBoomvorm"	"{5F680186-4B1B-4f3e-8DF9-D0B057AD1B2E}"	"KlBoomVerankeringtype"	"verankeringstype"	"Duidt het type van verankering van de boom aan."	""	"verankeringstype"	"Duidt het type van verankering van de boom aan."	""	""	"true"	"https://wegenenverkeer-test.data.vlaanderen.be/ns/abstracten#"	"AanlegBoomvorm.verankeringstype"	"http://www.w3.org/2002/07/owl#ObjectProperty"	"https://wegenenverkeer-test.data.vlaanderen.be/ns/abstracten#AanlegBoomvorm"	"http://www.w3.org/2004/02/skos/core#Concept"	""	"1"	"1"
"attribute"	"OSLO-Abstracten"	"wortelAanplant"	"{2311EA55-6003-4266-BA66-A99DC28483D6}"	""	"AanlegBoomvorm"	"{5F680186-4B1B-4f3e-8DF9-D0B057AD1B2E}"	"KlVegetatieWortel"	"wortel aanplant"	"De manier van levering en aanplanting van het wortelgestel van de boom of plant."	""	"wortel aanplant"	"De manier van levering en aanplanting van het wortelgestel van de boom of plant."	""	""	"true"	"https://wegenenverkeer-test.data.vlaanderen.be/ns/abstracten#"	"AanlegBoomvorm.wortelAanplant"	"http://www.w3.org/2002/07/owl#ObjectProperty"	"https://wegenenverkeer-test.data.vlaanderen.be/ns/abstracten#AanlegBoomvorm"	"http://www.w3.org/2004/02/skos/core#Concept"	""	"1"	"1"
"attribute"	"OSLO-Abstracten"	"wortelgeleidingWortelwering"	"{5AF6D775-02D0-4478-A69E-355CF6EEAA33}"	""	"AanlegBoomvorm"	"{5F680186-4B1B-4f3e-8DF9-D0B057AD1B2E}"	"Boolean"	"wortelgeleiding wortelwering"	"Wortelgeleiding en wering moet voorkomen dat boomwortels het trottoir, de middenberm, het fietspad, de rijweg, andere wegverhardingen en leidingstelsels beschadigen. Het heeft als doel om boomwortels naar beneden te leiden, waar ze onder een obstakel verder kunnen groeien."	""	"wortelgeleiding wortelwering"	"Wortelgeleiding en wering moet voorkomen dat boomwortels het trottoir, de middenberm, het fietspad, de rijweg, andere wegverhardingen en leidingstelsels beschadigen. Het heeft als doel om boomwortels naar beneden te leiden, waar ze onder een obstakel verder kunnen groeien."	""	""	"true"	"https://wegenenverkeer-test.data.vlaanderen.be/ns/abstracten#"	"AanlegBoomvorm.wortelgeleidingWortelwering"	"http://www.w3.org/2002/07/owl#DatatypeProperty"	"https://wegenenverkeer-test.data.vlaanderen.be/ns/abstracten#AanlegBoomvorm"	"http://www.w3.org/2001/XMLSchema#boolean"	""	"1"	"1"
"attribute"	"OSLO-Proefenmeting"	"naderOnderzoekTomograaf"	"{6D9B3BC9-1F09-4fc3-BAA5-7EFE8EEE3B53}"	""	"ProefBoomtoestand"	"{AC9CAE62-34FC-4f4c-8140-036CB0ECF37D}"	"DtcAWVDocument"	"nader onderzoek tomograaf"	"Een geluids- en/of elektrische weerstandstomografie is een niet-destructieve methode om rot en holtes in bomen op te sporen door gebruik van geluidsgolven en/of elektrische stroom."	""	"nader onderzoek tomograaf"	"Een geluids- en/of elektrische weerstandstomografie is een niet-destructieve methode om rot en holtes in bomen op te sporen door gebruik van geluidsgolven en/of elektrische stroom."	""	""	"true"	"https://wegenenverkeer-test.data.vlaanderen.be/ns/abstracten#"	"ProefBoomtoestand.naderOnderzoekTomograaf"	"http://www.w3.org/2002/07/owl#ObjectProperty"	"https://wegenenverkeer-test.data.vlaanderen.be/ns/abstracten#ProefBoomtoestand"	"https://wegenenverkeer-test.data.vlaanderen.be/ns/abstracten#DtcAWVDocument"	""	"1"	"*"
"attribute"	"OSLO-Proefenmeting"	"verderOnderzoekTrekproef"	"{667295F3-8F02-46b3-BA1E-7B6469551EDD}"	""	"ProefBoomtoestand"	"{AC9CAE62-34FC-4f4c-8140-036CB0ECF37D}"	"DtcAWVDocument"	"verder onderzoek trekproef"	"Een trekproef is een niet-destructieve methode om de stabiliteit (gevoeligheid voor windworp) van
bomen te testen door een kunstmatige belasting op de stam te relateren met het kantelen van de
stamvoet."	""	"verder onderzoek trekproef"	"Een trekproef is een niet-destructieve methode om de stabiliteit (gevoeligheid voor windworp) van
bomen te testen door een kunstmatige belasting op de stam te relateren met het kantelen van de
stamvoet."	""	""	"true"	"https://wegenenverkeer-test.data.vlaanderen.be/ns/abstracten#"	"ProefBoomtoestand.verderOnderzoekTrekproef"	"http://www.w3.org/2002/07/owl#ObjectProperty"	"https://wegenenverkeer-test.data.vlaanderen.be/ns/abstracten#ProefBoomtoestand"	"https://wegenenverkeer-test.data.vlaanderen.be/ns/abstracten#DtcAWVDocument"	""	"1"	"*"
"attribute"	"OSLO-Installatie"	"bijzonderIngerichteOnderdelen"	"{CE99ECBF-0A64-4ca7-90BE-2B861E1E135D}"	""	"Wegberm"	"{32E6A774-CEA0-4726-986D-B7409A744BC2}"	"KlWegbermBIO"	"bijzonder ingerichte onderdelen van de wegberm"	"De bijzonder ingericht onderdeel van de wegbermen."	""	"bijzonder ingerichte onderdelen van de wegberm"	"De bijzonder ingericht onderdeel van de wegbermen."	""	""	"true"	"https://wegenenverkeer-test.data.vlaanderen.be/ns/abstracten#"	"Wegberm.bijzonderIngerichteOnderdelen"	"http://www.w3.org/2002/07/owl#ObjectProperty"	"https://wegenenverkeer-test.data.vlaanderen.be/ns/abstracten#Wegberm"	"http://www.w3.org/2004/02/skos/core#Concept"	""	"1"	"1"
"attribute"	"OSLO-Installatie"	"type"	"{59C0F4A7-578E-45d2-8907-2D79312CAD91}"	""	"Wegberm"	"{32E6A774-CEA0-4726-986D-B7409A744BC2}"	"KlWegbermType"	"type"	"Type van wegberm."	""	"type"	"Type van wegberm."	""	""	"true"	"https://wegenenverkeer-test.data.vlaanderen.be/ns/abstracten#"	"Wegberm.type"	"http://www.w3.org/2002/07/owl#ObjectProperty"	"https://wegenenverkeer-test.data.vlaanderen.be/ns/abstracten#Wegberm"	"http://www.w3.org/2004/02/skos/core#Concept"	""	"1"	"1"
