"EA-Type"	"EA-Package"	"EA-Name"	"EA-GUID"	"EA-Parent"	"EA-Domain"	"EA-Domain-GUID"	"EA-Range"	"label"	"definition"	"usage"	"ap-label-nl"	"ap-definition-nl"	"ap-usageNote-nl"	"ap-codelist"	"external term"	"namespace"	"localname"	"type"	"domain"	"range"	"parent"	"min card"	"max card"
"Package"	""	"BegroeidVoorkomen"	"{33028F34-3E92-4892-9018-78F017886236}"	""	""	""	""	""	""	""	""	""	""	""	""	"https://data.vlaanderen.be/ns/openbaardomein/"	"begroeidvoorkomen"	"http://www.w3.org/2002/07/owl#Ontology"	""	""	""	""	""
"CLASS"	"BegroeidVoorkomen"	"Houtachtigen"	"{3DCD7E4E-1F91-40d7-8E15-25383F06E8C7}"	"BegroeidVoorkomen"	""	""	""	"Houtachtigen"	"Houtige planten of houtige gewassen (planta lignosa) zijn overblijvende planten die worden gekenmerkt door secundaire diktegroei, waardoor de takken, stammen en wortels veel hout bevatten."	""	"Houtachtigen"	"Houtige planten of houtige gewassen (planta lignosa) zijn overblijvende planten die worden gekenmerkt door secundaire diktegroei, waardoor de takken, stammen en wortels veel hout bevatten."	""	""	"false"	"https://data.vlaanderen.be/ns/openbaardomein/begroeidvoorkomen#"	"Houtachtigen"	"http://www.w3.org/2000/01/rdf-schema#Class"	""	""	"https://data.vlaanderen.be/ns/openbaardomein/begroeidvoorkomen#BegroeidVoorkomen"	""	""
"CLASS"	"BegroeidVoorkomen"	"BegroeidVoorkomen"	"{7265F46D-BC35-448a-983F-044380912A0F}"	"TerreinVoorkomen"	""	""	""	"Begroeid Voorkomen"	"De ruimtelijke massa van planten-individuen, in samenhang met de plaats waar zij groeien. "	""	"Begroeid Voorkomen"	"De ruimtelijke massa van planten-individuen, in samenhang met de plaats waar zij groeien. "	""	""	"false"	"https://data.vlaanderen.be/ns/openbaardomein/begroeidvoorkomen#"	"BegroeidVoorkomen"	"http://www.w3.org/2000/01/rdf-schema#Class"	""	""	"https://data.vlaanderen.be/ns/openbaardomein/terreindeel#TerreinVoorkomen"	""	""
"CLASS"	"BegroeidVoorkomen"	"Grasachtigen"	"{598EB11A-5E09-4a1a-94C8-9EDE9034D784}"	"BegroeidVoorkomen"	""	""	""	"Grasachtigen"	"Begroeiingen die overheersend bestaat uit grassen (behorende tot de Grassenfamilie, Poaceae)."	""	"Grasachtigen"	"Begroeiingen die overheersend bestaat uit grassen (behorende tot de Grassenfamilie, Poaceae)."	""	""	"false"	"https://data.vlaanderen.be/ns/openbaardomein/begroeidvoorkomen#"	"Grasachtigen"	"http://www.w3.org/2000/01/rdf-schema#Class"	""	""	"https://data.vlaanderen.be/ns/openbaardomein/begroeidvoorkomen#BegroeidVoorkomen"	""	""
"CLASS"	"BegroeidVoorkomen"	"Kruidachtigen"	"{318B5EC1-F425-4a7b-8852-9D8F384DC79F}"	"BegroeidVoorkomen"	""	""	""	"Kruidachtigen"	"Planten die geen blijvende houtige stengel vormen. Eenjarige, tweejarige of vaste planten, die in de winter tot de grond toe afsterven."	""	"Kruidachtigen"	"Planten die geen blijvende houtige stengel vormen. Eenjarige, tweejarige of vaste planten, die in de winter tot de grond toe afsterven."	""	""	"false"	"https://data.vlaanderen.be/ns/openbaardomein/begroeidvoorkomen#"	"Kruidachtigen"	"http://www.w3.org/2000/01/rdf-schema#Class"	""	""	"https://data.vlaanderen.be/ns/openbaardomein/begroeidvoorkomen#BegroeidVoorkomen"	""	""
"CLASS"	"BegroeidVoorkomen"	"Bloemenweide"	"{C44B766E-87D9-4e34-B6B1-C2CED620440F}"	"Grasachtigen"	""	""	""	"Bloemenweide"	"Grasland dat is ingezaaid met wilde- of half wilde soorten"	""	"Bloemenweide"	"Grasland dat is ingezaaid met wilde- of half wilde soorten"	""	""	"false"	"https://data.vlaanderen.be/ns/openbaardomein/begroeidvoorkomen#"	"Bloemenweide"	"http://www.w3.org/2000/01/rdf-schema#Class"	""	""	"https://data.vlaanderen.be/ns/openbaardomein/begroeidvoorkomen#Grasachtigen"	""	""
"CLASS"	"BegroeidVoorkomen"	"Gazon"	"{0757B884-B80B-4150-9EB2-6B1695BCCE19}"	"Grasachtigen"	""	""	""	"Gazon"	"Grasland zonder bloeiende grassen noch planten, gekenmerkt door een monotoon groen uiterlijk, lage soortendiversiteit en een kort vegetatiedek (enkele centimers hoogte) Een gazon wordt in stand gehouden door een intensief beheer (hoge maaifrequentie)"	""	"Gazon"	"Grasland zonder bloeiende grassen noch planten, gekenmerkt door een monotoon groen uiterlijk, lage soortendiversiteit en een kort vegetatiedek (enkele centimers hoogte) Een gazon wordt in stand gehouden door een intensief beheer (hoge maaifrequentie)"	""	""	"false"	"https://data.vlaanderen.be/ns/openbaardomein/begroeidvoorkomen#"	"Gazon"	"http://www.w3.org/2000/01/rdf-schema#Class"	""	""	"https://data.vlaanderen.be/ns/openbaardomein/begroeidvoorkomen#Grasachtigen"	""	""
"CLASS"	"BegroeidVoorkomen"	"Grasdals"	"{39EEBEFF-E296-4a41-8EE1-68B0634B454E}"	"Grasachtigen"	""	""	""	"Grasdals"	"Gras- en kruidachtig vegetatietype dat voorzien is van een rastervormig kunststof verstevigingsmateriaal en bedoeld om de bodem te verstevigen."	"Ook gekend onder de term 'grasbetontegel', NOTE cf. GRB-skeletaanvulling detail: WSV1003: grasdal"	"Grasdals"	"Gras- en kruidachtig vegetatietype dat voorzien is van een rastervormig kunststof verstevigingsmateriaal en bedoeld om de bodem te verstevigen."	"Ook gekend onder de term 'grasbetontegel', NOTE cf. GRB-skeletaanvulling detail: WSV1003: grasdal"	""	"false"	"https://data.vlaanderen.be/ns/openbaardomein/begroeidvoorkomen#"	"Grasdals"	"http://www.w3.org/2000/01/rdf-schema#Class"	""	""	"https://data.vlaanderen.be/ns/openbaardomein/begroeidvoorkomen#Grasachtigen"	""	""
"CLASS"	"BegroeidVoorkomen"	"Grindgazon"	"{B7BA8694-E9E1-47fa-BF7C-DBE0178B9230}"	"Gazon"	""	""	""	"Grindgazon"	"Gazontype specifiek op een gestabiliseerde ondergrond."	""	"Grindgazon"	"Gazontype specifiek op een gestabiliseerde ondergrond."	""	""	"false"	"https://data.vlaanderen.be/ns/openbaardomein/begroeidvoorkomen#"	"Grindgazon"	"http://www.w3.org/2000/01/rdf-schema#Class"	""	""	"https://data.vlaanderen.be/ns/openbaardomein/begroeidvoorkomen#Gazon"	""	""
"CLASS"	"BegroeidVoorkomen"	"Ruigte"	"{859C769E-C57D-458c-980C-3713F30CF568}"	"Kruidachtigen"	""	""	""	"Ruigte"	"Terrein of zoomvegetatie gedomineerd door ruigtekruiden of riet."	""	"Ruigte"	"Terrein of zoomvegetatie gedomineerd door ruigtekruiden of riet."	""	""	"false"	"https://data.vlaanderen.be/ns/openbaardomein/begroeidvoorkomen#"	"Ruigte"	"http://www.w3.org/2000/01/rdf-schema#Class"	""	""	"https://data.vlaanderen.be/ns/openbaardomein/begroeidvoorkomen#Kruidachtigen"	""	""
"CLASS"	"BegroeidVoorkomen"	"Sportgazon"	"{23A0E380-2545-45bc-AC16-2133BD9D53A8}"	"Gazon"	""	""	""	"Sportgazon"	"Gazon gebruikt als sportterrein."	""	"Sportgazon"	"Gazon gebruikt als sportterrein."	""	""	"false"	"https://data.vlaanderen.be/ns/openbaardomein/begroeidvoorkomen#"	"Sportgazon"	"http://www.w3.org/2000/01/rdf-schema#Class"	""	""	"https://data.vlaanderen.be/ns/openbaardomein/begroeidvoorkomen#Gazon"	""	""
"CLASS"	"BegroeidVoorkomen"	"Heestermassief"	"{06B611DA-5A83-4304-B11C-CC5700BA1B45}"	"Houtachtigen"	""	""	""	"Heestermassief"	"Heestertype gekenmerkt door een gesloten, massieve structuur, waarbij de individuele heesters moeilijk te onderscheiden zijn."	"In functie van bijvoorbeeld de vrije doorgang kan wel beslist worden om een of twee kanten te scheren."	"Heestermassief"	"Heestertype gekenmerkt door een gesloten, massieve structuur, waarbij de individuele heesters moeilijk te onderscheiden zijn."	"In functie van bijvoorbeeld de vrije doorgang kan wel beslist worden om een of twee kanten te scheren."	""	"false"	"https://data.vlaanderen.be/ns/openbaardomein/begroeidvoorkomen#"	"Heestermassief"	"http://www.w3.org/2000/01/rdf-schema#Class"	""	""	"https://data.vlaanderen.be/ns/openbaardomein/begroeidvoorkomen#Houtachtigen"	""	""
"CLASS"	"BegroeidVoorkomen"	"Haag"	"{96E9DA51-9392-40f1-BA33-99181179F2BA}"	"Houtachtigen"	""	""	""	"Haag"	"Hagen zijn lijnvormige elementen en onderscheiden zich van een heestermassief doordat zowel de bovenkant als de zijkanten geschoren worden."	""	"Haag"	"Hagen zijn lijnvormige elementen en onderscheiden zich van een heestermassief doordat zowel de bovenkant als de zijkanten geschoren worden."	""	""	"false"	"https://data.vlaanderen.be/ns/openbaardomein/begroeidvoorkomen#"	"Haag"	"http://www.w3.org/2000/01/rdf-schema#Class"	""	""	"https://data.vlaanderen.be/ns/openbaardomein/begroeidvoorkomen#Houtachtigen"	""	""
"CLASS"	"BegroeidVoorkomen"	"Bodembedekkers"	"{FE2E4492-66F1-4e13-A412-3538D215B3AF}"	"Kruidachtigen"	""	""	""	"Bodembedekkers"	"Aangelegd begroeiingstype, doorgaans met vaste planten, die bedoeld is om snel de bodem af te dekken."	""	"Bodembedekkers"	"Aangelegd begroeiingstype, doorgaans met vaste planten, die bedoeld is om snel de bodem af te dekken."	""	""	"false"	"https://data.vlaanderen.be/ns/openbaardomein/begroeidvoorkomen#"	"Bodembedekkers"	"http://www.w3.org/2000/01/rdf-schema#Class"	""	""	"https://data.vlaanderen.be/ns/openbaardomein/begroeidvoorkomen#Kruidachtigen"	""	""
"CLASS"	"BegroeidVoorkomen"	"VastePlanten"	"{EE009B41-C07F-4948-99A7-FDE1F79F185D}"	"Kruidachtigen"	""	""	""	"Vaste planten"	"Begroeiingstype met planten die een kruidachtige stengel hebben en overblijvend zijn."	"Bron definitie: naar Technisch Vademecum Kruidachtigen Harmonisch Park- en Groenbeheer. De term vaste plant wordt niet gebruikt in de biologie. De term komt uit de kwekerijsector. Onder vaste planten (s.s.) worden in kwekerscatalogi planten verstaan die een kruidachtige stengel hebben en overblijvend zijn. De meeste soorten sterven in de winter bovengronds af (levensvorm: hemicryptofyten) en vormen elk jaar nieuwe stengels, bladeren, bloemen en zaad. Hun overwinteringsknoppen zitten gewoonlijk op het maaiveld. Soorten die hun overwinteringsknoppen boven het maaiveld hebben onder de 50 cm, behoren tot de chamefyten en zijn meestal verhout., De term vaste plant (s.l.) wordt dus gebruikt voor alle kruidachtige vaatplanten, met uitzondering van eenjarige en tweejarige kruidachtige soorten."	"Vaste planten"	"Begroeiingstype met planten die een kruidachtige stengel hebben en overblijvend zijn."	"Bron definitie: naar Technisch Vademecum Kruidachtigen Harmonisch Park- en Groenbeheer. De term vaste plant wordt niet gebruikt in de biologie. De term komt uit de kwekerijsector. Onder vaste planten (s.s.) worden in kwekerscatalogi planten verstaan die een kruidachtige stengel hebben en overblijvend zijn. De meeste soorten sterven in de winter bovengronds af (levensvorm: hemicryptofyten) en vormen elk jaar nieuwe stengels, bladeren, bloemen en zaad. Hun overwinteringsknoppen zitten gewoonlijk op het maaiveld. Soorten die hun overwinteringsknoppen boven het maaiveld hebben onder de 50 cm, behoren tot de chamefyten en zijn meestal verhout., De term vaste plant (s.l.) wordt dus gebruikt voor alle kruidachtige vaatplanten, met uitzondering van eenjarige en tweejarige kruidachtige soorten."	""	"false"	"https://data.vlaanderen.be/ns/openbaardomein/begroeidvoorkomen#"	"VastePlanten"	"http://www.w3.org/2000/01/rdf-schema#Class"	""	""	"https://data.vlaanderen.be/ns/openbaardomein/begroeidvoorkomen#Kruidachtigen"	""	""
"CLASS"	"BegroeidVoorkomen"	"Wisselperk"	"{433CA5B8-F2A9-425f-AE30-250E3EEEA6AC}"	"Kruidachtigen"	""	""	""	"Wisselperk"	"	Jaarlijks opnieuw aangelegd begroeiingstype waarbij de sierwaarde centraal staat. De sierwaarde bestaat uit rijkelijk bloeiende planten."	"Bron definitie: Technisch Vademecum Kruidachtigen Harmonisch Park- en Groenbeheer (ANB). Typische BLOEMPERKEN horen eveneens bij WISSELPERKEN."	"Wisselperk"	"	Jaarlijks opnieuw aangelegd begroeiingstype waarbij de sierwaarde centraal staat. De sierwaarde bestaat uit rijkelijk bloeiende planten."	"Bron definitie: Technisch Vademecum Kruidachtigen Harmonisch Park- en Groenbeheer (ANB). Typische BLOEMPERKEN horen eveneens bij WISSELPERKEN."	""	"false"	"https://data.vlaanderen.be/ns/openbaardomein/begroeidvoorkomen#"	"Wisselperk"	"http://www.w3.org/2000/01/rdf-schema#Class"	""	""	"https://data.vlaanderen.be/ns/openbaardomein/begroeidvoorkomen#Kruidachtigen"	""	""
"CLASS"	"BegroeidVoorkomen"	"Braakland"	"{E79320E9-F833-4acc-A91E-8879EAF48645}"	"BegroeidVoorkomen"	""	""	""	"Braakland"	"Tijdelijke eenheid die ongebruikt blijft liggen en nog niet tot ruigte of bos geëvolueerd is."	""	"Braakland"	"Tijdelijke eenheid die ongebruikt blijft liggen en nog niet tot ruigte of bos geëvolueerd is."	""	""	"false"	"https://data.vlaanderen.be/ns/openbaardomein/begroeidvoorkomen#"	"Braakland"	"http://www.w3.org/2000/01/rdf-schema#Class"	""	""	"https://data.vlaanderen.be/ns/openbaardomein/begroeidvoorkomen#BegroeidVoorkomen"	""	""
"CLASS"	"BegroeidVoorkomen"	"NietBegroeid"	"{2E3B09C7-DFDF-49a7-9FFA-783783662471}"	"BegroeidVoorkomen"	""	""	""	"Niet begroeid"	"(Deel van) een begroeiingstype dat door een bepaalde reden niet begroeid is."	"Bijvoorbeeld door systematische betreding ontstane open plekken in gazon."	"Niet begroeid"	"(Deel van) een begroeiingstype dat door een bepaalde reden niet begroeid is."	"Bijvoorbeeld door systematische betreding ontstane open plekken in gazon."	""	"false"	"https://data.vlaanderen.be/ns/openbaardomein/begroeidvoorkomen#"	"NietBegroeid"	"http://www.w3.org/2000/01/rdf-schema#Class"	""	""	"https://data.vlaanderen.be/ns/openbaardomein/begroeidvoorkomen#BegroeidVoorkomen"	""	""
"CLASS"	"Terreindeel"	"TerreinVoorkomen"	"{C125F2F5-1DAD-41e1-978C-758F071A982E}"	"FysiekVoorkomen"	""	""	""	"Terrein Voorkomen"	"Beschrijving van het terrein voorkomen van het terreindeel"	""	"Terrein Voorkomen"	"Beschrijving van het terrein voorkomen van het terreindeel"	""	""	"true"	"https://data.vlaanderen.be/ns/openbaardomein/terreindeel#"	"TerreinVoorkomen"	"http://www.w3.org/2000/01/rdf-schema#Class"	""	""	"https://data.vlaanderen.be/ns/openbaardomein#FysiekVoorkomen"	""	""
"CLASS"	"Model"	"FysiekVoorkomen"	"{9F88AE75-34D3-48d3-B55E-BDD2CAA5DE74}"	""	""	""	""	"Fysiek Voorkomen"	"Beschrijving van het fysieke voorkomen van het object."	""	"Fysiek Voorkomen"	"Beschrijving van het fysieke voorkomen van het object."	""	""	"true"	"https://data.vlaanderen.be/ns/openbaardomein#"	"FysiekVoorkomen"	"http://www.w3.org/2000/01/rdf-schema#Class"	""	""	""	""	""
"ENUMERATION"	"Codelijsten"	"DrassigheidWaarde"	"{2D059119-4274-463b-8A45-CC5061B237AD}"	""	""	""	""	"Drassigheid"	"De mate van drassigheid."	""	"Drassigheid"	"De mate van drassigheid."	""	""	"true"	"http://www.w3.org/2004/02/skos/core#"	"Concept"	"http://www.w3.org/2000/01/rdf-schema#Class"	""	""	""	""	""
"CLASS"	"BegroeidVoorkomen"	"Bloemenakker"	"{BDEBAF84-2376-4a9e-B6D3-BEAEFFBF19ED}"	"Grasachtigen"	""	""	""	"Bloemenakker"	"Grasland dat is ingezaaid met wilde- of half wilde soorten waarvan de bodem elk jaar moet geschoffeld of geploegd worden."	""	"Bloemenakker"	"Grasland dat is ingezaaid met wilde- of half wilde soorten waarvan de bodem elk jaar moet geschoffeld of geploegd worden."	""	""	"false"	"https://data.vlaanderen.be/ns/openbaardomein/begroeidvoorkomen#"	"Bloemenakker"	"http://www.w3.org/2000/01/rdf-schema#Class"	""	""	"https://data.vlaanderen.be/ns/openbaardomein/begroeidvoorkomen#Grasachtigen"	""	""
"CLASS"	"BegroeidVoorkomen"	"Speelgazon"	"{E1FE4752-6814-4c21-8FAA-D631D63B8A5D}"	"Gazon"	""	""	""	"Speelgazon"	"Gazon gebruikt als speelterrein."	""	"Speelgazon"	"Gazon gebruikt als speelterrein."	""	""	"false"	"https://data.vlaanderen.be/ns/openbaardomein/begroeidvoorkomen#"	"Speelgazon"	"http://www.w3.org/2000/01/rdf-schema#Class"	""	""	"https://data.vlaanderen.be/ns/openbaardomein/begroeidvoorkomen#Gazon"	""	""
"CLASS"	"BegroeidVoorkomen"	"Siergazon"	"{4E624D31-FE80-4fc9-B0E7-63A87973837F}"	"Gazon"	""	""	""	"Siergazon"	"Gazon aangelegd vanwege decoratieve waarde."	""	"Siergazon"	"Gazon aangelegd vanwege decoratieve waarde."	""	""	"false"	"https://data.vlaanderen.be/ns/openbaardomein/begroeidvoorkomen#"	"Siergazon"	"http://www.w3.org/2000/01/rdf-schema#Class"	""	""	"https://data.vlaanderen.be/ns/openbaardomein/begroeidvoorkomen#Gazon"	""	""
"CLASS"	"BegroeidVoorkomen"	"Houtkant"	"{7092F8AA-52DC-4d18-B7F1-A2218A4DABB4}"	"Houtachtigen"	""	""	""	"Houtkant"	"Ongeschoren haag of mantelvegetatie, die soms als hakhout wordt behandeld, maar niet op een door de mens aangelegde wal (verhoging)."	"Bron definitie: Vlaams agentschap voor Natuur en Bos"	"Houtkant"	"Ongeschoren haag of mantelvegetatie, die soms als hakhout wordt behandeld, maar niet op een door de mens aangelegde wal (verhoging)."	""	""	"false"	"https://data.vlaanderen.be/ns/openbaardomein/begroeidvoorkomen#"	"Houtkant"	"http://www.w3.org/2000/01/rdf-schema#Class"	""	""	"https://data.vlaanderen.be/ns/openbaardomein/begroeidvoorkomen#Houtachtigen"	""	""
"CLASS"	"BegroeidVoorkomen"	"Houtwal"	"{71AED20C-452C-4512-8F0E-CCBC1AF22831}"	"Houtachtigen"	""	""	""	"Houtwal"	"Houtkant op een door de mens aangelegde wal (verhoging)."	"Bron definitie: Vlaams agentschap voor Natuur en Bos"	"Houtwal"	"Houtkant op een door de mens aangelegde wal (verhoging)."	""	""	"false"	"https://data.vlaanderen.be/ns/openbaardomein/begroeidvoorkomen#"	"Houtwal"	"http://www.w3.org/2000/01/rdf-schema#Class"	""	""	"https://data.vlaanderen.be/ns/openbaardomein/begroeidvoorkomen#Houtachtigen"	""	""
"CLASS"	"BegroeidVoorkomen"	"Siergrassen"	"{79C77C99-6B20-46a0-9702-3B71377C6A1A}"	"Kruidachtigen"	""	""	""	"Siergrassen"	"Grasachtige planten met een decoratieve waarde."	"Niet geplant als gazon (zie siergazon)"	"Siergrassen"	"Grasachtige planten met een decoratieve waarde."	"Niet geplant als gazon (zie siergazon)"	""	"false"	"https://data.vlaanderen.be/ns/openbaardomein/begroeidvoorkomen#"	"Siergrassen"	"http://www.w3.org/2000/01/rdf-schema#Class"	""	""	"https://data.vlaanderen.be/ns/openbaardomein/begroeidvoorkomen#Kruidachtigen"	""	""
"CLASS"	"BegroeidVoorkomen"	"BolEnKnolgewassen"	"{3F2DDC44-719B-4501-A736-77566988F7A1}"	"Kruidachtigen"	""	""	""	"Bol- en knolgewassen"	"Bol- en knolgewassen beschikken over een ondergronds voedselreservoir in de vorm van een bol of een knol. Veelal verschijnen de bovengrondse delen in een specifieke periode van het jaar en kennen zij een geweldige bloei."	""	"Bol- en knolgewassen"	"Bol- en knolgewassen beschikken over een ondergronds voedselreservoir in de vorm van een bol of een knol. Veelal verschijnen de bovengrondse delen in een specifieke periode van het jaar en kennen zij een geweldige bloei."	""	""	"false"	"https://data.vlaanderen.be/ns/openbaardomein/begroeidvoorkomen#"	"BolEnKnolgewassen"	"http://www.w3.org/2000/01/rdf-schema#Class"	""	""	"https://data.vlaanderen.be/ns/openbaardomein/begroeidvoorkomen#Kruidachtigen"	""	""
"CLASS"	"BegroeidVoorkomen"	"Bomen"	"{4001E1AA-A1B3-4ce5-B9ED-6F3FA6250C7D}"	"Houtachtigen"	""	""	""	"Bomen"	"Opgaande beplanting van houtachtige gewassen die boomvormend zijn."	"Bron definitie: vrij naar CROW in Gegevenscatalogus IMGeo 2.1.1 (definitie BOSPLANTSOEN)"	"Bomen"	"Opgaande beplanting van houtachtige gewassen die boomvormend zijn."	"Bron definitie: vrij naar CROW in Gegevenscatalogus IMGeo 2.1.1 (definitie BOSPLANTSOEN)"	""	"false"	"https://data.vlaanderen.be/ns/openbaardomein/begroeidvoorkomen#"	"Bomen"	"http://www.w3.org/2000/01/rdf-schema#Class"	""	""	"https://data.vlaanderen.be/ns/openbaardomein/begroeidvoorkomen#Houtachtigen"	""	""
"CLASS"	"BegroeidVoorkomen"	"Bollengrasland"	"{826BA5C4-8FEE-4def-9D24-D01DC0EDFC2B}"	"Grasachtigen"	""	""	""	"Bollengrasland"	"Grasland met planten die bloeien voor de groei van de graszode goed op gang komt."	""	"Bollengrasland"	"Grasland met planten die bloeien voor de groei van de graszode goed op gang komt."	""	""	"false"	"https://data.vlaanderen.be/ns/openbaardomein/begroeidvoorkomen#"	"Bollengrasland"	"http://www.w3.org/2000/01/rdf-schema#Class"	""	""	"https://data.vlaanderen.be/ns/openbaardomein/begroeidvoorkomen#Grasachtigen"	""	""
"CLASS"	"BegroeidVoorkomen"	"Hooiland"	"{EA544FFE-8179-4b1a-8756-591E899531F9}"	"Grasachtigen"	""	""	""	"Hooiland"	"Een grasland gebruikt wordt om hooi te oogsten met hoofdzakelijk inheemse planten en dat extensief gemaaid wordt."	""	"Hooiland"	"Een grasland gebruikt wordt om hooi te oogsten met hoofdzakelijk inheemse planten en dat extensief gemaaid wordt."	""	""	"false"	"https://data.vlaanderen.be/ns/openbaardomein/begroeidvoorkomen#"	"Hooiland"	"http://www.w3.org/2000/01/rdf-schema#Class"	""	""	"https://data.vlaanderen.be/ns/openbaardomein/begroeidvoorkomen#Grasachtigen"	""	""
"CLASS"	"BegroeidVoorkomen"	"Weiland"	"{7880E89B-3A57-4dc5-9E87-6C37455FC78D}"	"Grasachtigen"	""	""	""	"Weiland"	"Open grasland dat gebruikt wordt om vee te laten grazen."	""	"Weiland"	"Open grasland dat gebruikt wordt om vee te laten grazen."	""	""	"false"	"https://data.vlaanderen.be/ns/openbaardomein/begroeidvoorkomen#"	"Weiland"	"http://www.w3.org/2000/01/rdf-schema#Class"	""	""	"https://data.vlaanderen.be/ns/openbaardomein/begroeidvoorkomen#Grasachtigen"	""	""
"CLASS"	"BegroeidVoorkomen"	"RuwGras"	"{5FCFFEDC-AA57-4674-B2A1-9EA7570B61BE}"	"Grasachtigen"	""	""	""	"Ruw gras"	"Grasland zonder bloeiende grassen noch planten, gekenmerkt door een monotoon groen uiterlijk en een extensief beheer."	""	"Ruw gras"	"Grasland zonder bloeiende grassen noch planten, gekenmerkt door een monotoon groen uiterlijk en een extensief beheer."	""	""	"false"	"https://data.vlaanderen.be/ns/openbaardomein/begroeidvoorkomen#"	"RuwGras"	"http://www.w3.org/2000/01/rdf-schema#Class"	""	""	"https://data.vlaanderen.be/ns/openbaardomein/begroeidvoorkomen#Grasachtigen"	""	""
"attribute"	"BegroeidVoorkomen"	"breedte"	"{05D432F6-2868-4df6-BC6B-68D2C398FD4D}"	""	"Houtachtigen"	"{3DCD7E4E-1F91-40d7-8E15-25383F06E8C7}"	"Double"	"breedte"	"De breedte van het object in meter."	""	"breedte"	"De breedte van het object in meter."	""	""	"true"	"http://schema.org/"	"width"	"http://www.w3.org/2002/07/owl#DatatypeProperty"	"https://data.vlaanderen.be/ns/openbaardomein/begroeidvoorkomen#Houtachtigen"	"http://www.w3.org/2001/XMLSchema#double"	""	"1"	"1"
"attribute"	"BegroeidVoorkomen"	"hoogte"	"{A3A87CB9-7D64-45ca-878E-07ED4A764E72}"	""	"Houtachtigen"	"{3DCD7E4E-1F91-40d7-8E15-25383F06E8C7}"	"Double"	"hoogte"	"De hoogte van het object in meter."	"Indien er variatie zit in de hoogte wordt de gemiddelde hoogte opgenomen."	"hoogte"	"De hoogte van het object in meter."	"Indien er variatie zit in de hoogte wordt de gemiddelde hoogte opgenomen."	""	"true"	"http://schema.org/"	"height"	"http://www.w3.org/2002/07/owl#DatatypeProperty"	"https://data.vlaanderen.be/ns/openbaardomein/begroeidvoorkomen#Houtachtigen"	"http://www.w3.org/2001/XMLSchema#double"	""	"1"	"1"
"attribute"	"BegroeidVoorkomen"	"knipoppervlak"	"{A5DB8A7F-3086-4373-88B9-09F0C5E9B7E7}"	""	"Houtachtigen"	"{3DCD7E4E-1F91-40d7-8E15-25383F06E8C7}"	"Double"	"knipoppervlak"	"De afmeting van het object in vierkante meter dat geschoren moet worden."	""	"knipoppervlak"	"De afmeting van het object in vierkante meter dat geschoren moet worden."	""	""	"false"	"https://data.vlaanderen.be/ns/openbaardomein/begroeidvoorkomen#"	"knipoppervlak"	"http://www.w3.org/2002/07/owl#DatatypeProperty"	"https://data.vlaanderen.be/ns/openbaardomein/begroeidvoorkomen#Houtachtigen"	"http://www.w3.org/2001/XMLSchema#double"	""	"1"	"1"
"attribute"	"BegroeidVoorkomen"	"lengte"	"{631E2A4A-C7BC-4505-ACFC-DC44601555B0}"	""	"Houtachtigen"	"{3DCD7E4E-1F91-40d7-8E15-25383F06E8C7}"	"Double"	"lengte"	"De lineare grootte van het object in meter."	""	"lengte"	"De lineare grootte van het object in meter."	""	""	"true"	"http://open.vocab.org/terms/"	"length"	"http://www.w3.org/2002/07/owl#DatatypeProperty"	"https://data.vlaanderen.be/ns/openbaardomein/begroeidvoorkomen#Houtachtigen"	"http://www.w3.org/2001/XMLSchema#double"	""	"1"	"1"
"attribute"	"BegroeidVoorkomen"	"vrijUitgroeiend"	"{3D65787D-4980-4604-82B7-88B972B179EC}"	""	"Houtachtigen"	"{3DCD7E4E-1F91-40d7-8E15-25383F06E8C7}"	"Boolean"	"vrij uitgroeiend"	"Geeft aan of de vegetatie of begroeiing al dan niet snoei vereist."	""	"vrij uitgroeiend"	"Geeft aan of de vegetatie of begroeiing al dan niet snoei vereist."	""	""	"false"	"https://data.vlaanderen.be/ns/openbaardomein/begroeidvoorkomen#"	"vrijUitgroeiend"	"http://www.w3.org/2002/07/owl#DatatypeProperty"	"https://data.vlaanderen.be/ns/openbaardomein#Object"	"http://www.w3.org/2001/XMLSchema#boolean"	""	"1"	"1"
"attribute"	"BegroeidVoorkomen"	"drassigheid"	"{83EE1822-D96E-4bba-9ACD-E8AB382101D2}"	""	"BegroeidVoorkomen"	"{7265F46D-BC35-448a-983F-044380912A0F}"	"DrassigheidWaarde"	"drassigheid"	"Mate waarin de bodem verzadigd is met water."	"De drassigheid geeft hierbij aan in welke mate de normale werking van types machines zou kunnen verstoord worden."	"drassigheid"	"Mate waarin de bodem verzadigd is met water."	"De drassigheid geeft hierbij aan in welke mate de normale werking van types machines zou kunnen verstoord worden."	"https://data.vlaanderen.be/id/conceptscheme/DrassigheidWaarde"	"false"	"https://data.vlaanderen.be/ns/openbaardomein/begroeidvoorkomen#"	"drassigheid"	"http://www.w3.org/2002/07/owl#ObjectProperty"	"https://data.vlaanderen.be/ns/openbaardomein/begroeidvoorkomen#BegroeidVoorkomen"	"http://www.w3.org/2004/02/skos/core#Concept"	""	"0"	"1"
"attribute"	"BegroeidVoorkomen"	"soortcode"	"{430C53BF-E2A1-4ea4-94AC-BE5195584AFA}"	""	"BegroeidVoorkomen"	"{7265F46D-BC35-448a-983F-044380912A0F}"	"GBIFcode"	"soortcode"	"Een unieke identificator voor de soort van het vegetatie-element. "	"De soortcode wordt opgenomen onder de vorm van de 'GBIF Key'."	"soortcode"	"Een unieke identificator voor de soort van het vegetatie-element. "	"De soortcode wordt opgenomen onder de vorm van de 'GBIF Key'."	"https://www.gbif.org/species/6"	"false"	"https://data.vlaanderen.be/ns/openbaardomein/begroeidvoorkomen#"	"soortcode"	"http://www.w3.org/2002/07/owl#ObjectProperty"	"http://www.w3.org/2000/01/rdf-schema#Resource"	"http://www.w3.org/2004/02/skos/core#Concept"	""	"0"	"*"
"attribute"	"BegroeidVoorkomen"	"soortnaamNederlands"	"{852A1902-526C-4604-8E25-6B3D7FD403DC}"	""	"BegroeidVoorkomen"	"{7265F46D-BC35-448a-983F-044380912A0F}"	"GBIFcode"	"soortnaam Nederlands"	"Soortnaam in het Nederlands."	""	"soortnaam Nederlands"	"Soortnaam in het Nederlands."	""	""	"false"	"https://data.vlaanderen.be/ns/openbaardomein/begroeidvoorkomen#"	"soortnaamNederlands"	"http://www.w3.org/1999/02/22-rdf-syntax-ns#Property"	"http://www.w3.org/2000/01/rdf-schema#Resource"	""	""	"0"	"*"
