"EA-Type"	"EA-Package"	"EA-Name"	"EA-GUID"	"EA-Parent"	"EA-Domain"	"EA-Domain-GUID"	"EA-Range"	"label"	"definition"	"usage"	"ap-label-nl"	"ap-definition-nl"	"ap-usageNote-nl"	"ap-codelist"	"external term"	"namespace"	"localname"	"type"	"domain"	"range"	"parent"	"min card"	"max card"
"attribute"	"BegroeidVoorkomen"	"soortnaamWetenschappelijk"	"{608977B4-C29C-4c2c-AAAF-3B04DA989D93}"	""	"BegroeidVoorkomen"	"{7265F46D-BC35-448a-983F-044380912A0F}"	"GBIFcode"	"wetenschappelijke soortnaam"	"De wetenschappelijke soortnaam."	""	"wetenschappelijke soortnaam"	"De wetenschappelijke soortnaam."	""	""	"true"	"http://rs.tdwg.org/dwc/terms/"	"scientificName"	"http://www.w3.org/1999/02/22-rdf-syntax-ns#Property"	"http://www.w3.org/2000/01/rdf-schema#Resource"	""	""	"0"	"*"
"attribute"	"Terreindeel"	"obstakels"	"{5D57C513-6618-47d9-AFA6-20FFA42BC9D5}"	""	"TerreinVoorkomen"	"{C125F2F5-1DAD-41e1-978C-758F071A982E}"	"Boolean"	"obstakels"	"Eigenschap die aangeeft of er binnen het beheerdeel  al dan niet objecten voorkomen die de vrije werking van machines of andere werktuigen kan verhinderen"	""	"obstakels"	"Eigenschap die aangeeft of er binnen het beheerdeel  al dan niet objecten voorkomen die de vrije werking van machines of andere werktuigen kan verhinderen"	""	""	"true"	"https://data.vlaanderen.be/ns/openbaardomein/terreindeel#"	"obstakels"	"http://www.w3.org/2002/07/owl#DatatypeProperty"	"https://data.vlaanderen.be/ns/openbaardomein/terreindeel#TerreinVoorkomen"	"http://www.w3.org/2001/XMLSchema#boolean"	""	"0"	"1"
"attribute"	"Terreindeel"	"talud"	"{50B8E8C0-8C7F-4796-A65D-9ECC63385914}"	""	"TerreinVoorkomen"	"{C125F2F5-1DAD-41e1-978C-758F071A982E}"	"TaludWaarde"	"talud"	"Een talud is het kunstmatig gedeelte van een vlak van de wegbaan, dijken, spoorbanen, vestingswerken, dat een helling (min. 20%, max 80% voor kunstmatig verharde taluds) vertoont en bedoeld voor het opvangen van een hoogteverschil."	"Naar GRB-skeletaanvulling detail - WTO1: Teen verharde talud; WTO2: Kruin verharde talud; WTO3: Teen onverharde talud; WTO4: Kruin onverharde talud "	"talud"	"Een talud is het kunstmatig gedeelte van een vlak van de wegbaan, dijken, spoorbanen, vestingswerken, dat een helling (min. 20%, max 80% voor kunstmatig verharde taluds) vertoont en bedoeld voor het opvangen van een hoogteverschil."	"Naar GRB-skeletaanvulling detail - WTO1: Teen verharde talud; WTO2: Kruin verharde talud; WTO3: Teen onverharde talud; WTO4: Kruin onverharde talud "	"https://data.vlaanderen.be/id/conceptscheme/TaludWaarde"	"true"	"https://data.vlaanderen.be/ns/openbaardomein/terreindeel#"	"talud"	"http://www.w3.org/2002/07/owl#ObjectProperty"	"https://data.vlaanderen.be/ns/openbaardomein/terreindeel#TerreinVoorkomen"	"http://www.w3.org/2004/02/skos/core#Concept"	""	"0"	"1"
"attribute"	"Codelijsten"	"NIET_DRASSIG"	"{EA623A53-C63F-4c00-903A-542722246C0C}"	""	"DrassigheidWaarde"	"{2D059119-4274-463b-8A45-CC5061B237AD}"	""	"Sterk drassig"	"De ondergrond is niet drassig."	""	"Sterk drassig"	"De ondergrond is niet drassig."	""	""	"true"	"https://data.vlaanderen.be/id/conceptscheme/DrassigheidWaarde/"	"https://data.vlaanderen.be/id/conceptscheme/DrassigheidWaarde/NIET_DRASSIG"	"http://www.w3.org/2004/02/skos/core#Concept"	""	""	""	""	""
"attribute"	"Codelijsten"	"MATIG_DRASSIG"	"{71058B26-A858-45f1-81F3-80C48F81BFFF}"	""	"DrassigheidWaarde"	"{2D059119-4274-463b-8A45-CC5061B237AD}"	""	"Matig drassig"	"De ondergrond is matig drassig."	""	"Matig drassig"	"De ondergrond is matig drassig."	""	""	"true"	"https://data.vlaanderen.be/id/conceptscheme/DrassigheidWaarde/"	"https://data.vlaanderen.be/id/conceptscheme/DrassigheidWaarde/MATIG_DRASSIG"	"http://www.w3.org/2004/02/skos/core#Concept"	""	""	""	""	""
"attribute"	"Codelijsten"	"STERK_DRASSIG"	"{7DED21B3-76EF-49d8-AC9C-AFA1F79589BA}"	""	"DrassigheidWaarde"	"{2D059119-4274-463b-8A45-CC5061B237AD}"	""	"Sterk drassig"	"De ondergrond is sterk drassig."	""	"Sterk drassig"	"De ondergrond is sterk drassig."	""	""	"true"	"https://data.vlaanderen.be/id/conceptscheme/DrassigheidWaarde/"	"https://data.vlaanderen.be/id/conceptscheme/DrassigheidWaarde/STERK_DRASSIG"	"http://www.w3.org/2004/02/skos/core#Concept"	""	""	""	""	""
