"EA-Type"	"EA-Package"	"EA-Name"	"EA-GUID"	"EA-Parent"	"EA-Domain"	"EA-Domain-GUID"	"EA-Range"	"label"	"definition"	"usage"	"ap-label-nl"	"ap-definition-nl"	"ap-usageNote-nl"	"ap-codelist"	"external term"	"namespace"	"localname"	"type"	"domain"	"range"	"parent"	"min card"	"max card"
"DATATYPE"	"W3-XML-Schema"	"Boolean"	"{C66810D0-4F93-4948-83F5-165137DEBF82}"	""	""	""	""	"Boolean"	"Beschrijft een boolean volgens https://www.w3.org/2001/XMLSchema#boolean"	"https://www.w3.org/2001/XMLSchema#boolean"	"Boolean"	"Beschrijft een boolean volgens https://www.w3.org/2001/XMLSchema#boolean"	""	""	"true"	"https://www.w3.org/2001/XMLSchema#"	"boolean"	"http://www.w3.org/2000/01/rdf-schema#Class"	""	""	""	""	""
"DATATYPE"	"W3-RDF-Schema"	"Literal"	"{FBE7CE2F-907F-4558-A0CE-70C0A8A6AA32}"	""	""	""	""	"Literal"	"Beschrijft een constante."	"https://www.w3.org/2000/01/rdf-schema#Literal"	"Literal"	"Beschrijft een constante."	""	""	"true"	"https://www.w3.org/2000/01/rdf-schema#"	"Literal"	"http://www.w3.org/2000/01/rdf-schema#Class"	""	""	""	""	""
"DATATYPE"	"W3-XML-Schema"	"DateTime"	"{0DD21E21-29CC-461d-BC1D-FC45931957F0}"	""	""	""	""	"Datumtijd"	"Beschrijft een datumtijd volgens https://www.w3.org/2001/XMLSchema#datetime"	"https://www.w3.org/2001/XMLSchema#datetime"	"Datumtijd"	"Beschrijft een datumtijd volgens https://www.w3.org/2001/XMLSchema#datetime"	""	""	"true"	"https://www.w3.org/2001/XMLSchema#"	"datetime"	"http://www.w3.org/2000/01/rdf-schema#Class"	""	""	""	""	""
"DATATYPE"	"W3-XML-Schema"	"Integer"	"{2CD576D2-B0D2-4c75-AF0D-5AFE65067E53}"	""	""	""	""	"Geheel getal"	"Beschrijft een geheel getal volgens https://www.w3.org/2001/XMLSchema#integer"	"https://www.w3.org/2001/XMLSchema#integer"	"Geheel getal"	"Beschrijft een geheel getal volgens https://www.w3.org/2001/XMLSchema#integer"	""	""	"true"	"https://www.w3.org/2001/XMLSchema#"	"integer"	"http://www.w3.org/2000/01/rdf-schema#Class"	""	""	""	""	""
"DATATYPE"	"W3-XML-Schema"	"Decimal"	"{3300D9AD-B706-43fe-B750-0EB2D8679F90}"	""	""	""	""	"Decimaal getal"	"Beschrijft een decimaal getal volgens https://www.w3.org/2001/XMLSchema#decimal"	"https://www.w3.org/2001/XMLSchema#decimal"	"Decimaal getal"	"Beschrijft een decimaal getal volgens https://www.w3.org/2001/XMLSchema#decimal"	""	""	"true"	"https://www.w3.org/2001/XMLSchema#"	"decimal"	"http://www.w3.org/2000/01/rdf-schema#Class"	""	""	""	""	""
"attribute"	"OSLO-Proefenmeting"	"toestand"	"{7DE9EF91-2B49-4cf0-9D1D-39B14D375ACE}"	""	"ProefopBuis"	"{17468210-5362-421d-9D91-C84C89D338BF}"	"String"	"toestand"	"Toestand van de buizen, toegangs- en verbindingsputten, enz."	""	"toestand"	"Toestand van de buizen, toegangs- en verbindingsputten, enz."	""	""	"true"	"https://wegenenverkeer.data.vlaanderen.be/ns/proefenmeting#"	"ProefopBuis.toestand"	"http://www.w3.org/2002/07/owl#DatatypeProperty"	"https://wegenenverkeer.data.vlaanderen.be/ns/proefenmeting#ProefopBuis"	"http://www.w3.org/2001/XMLSchema#string"	""	"1"	"1"
"attribute"	"OSLO-Proefenmeting"	"waterdichtheid"	"{EE4CFF89-9FAB-4c21-BB05-C978E4A75422}"	""	"ProefopBuis"	"{17468210-5362-421d-9D91-C84C89D338BF}"	"DtcDocument"	"waterdichtheid"	"waterdichtheid of luchtdichtheid van een leidingsvak gebeurt door de bepaling van
het waterverlies of de drukval van het beproefde leidingsvak."	""	"waterdichtheid"	"waterdichtheid of luchtdichtheid van een leidingsvak gebeurt door de bepaling van
het waterverlies of de drukval van het beproefde leidingsvak."	""	""	"true"	"https://wegenenverkeer.data.vlaanderen.be/ns/proefenmeting#"	"ProefopBuis.waterdichtheid"	"http://www.w3.org/2002/07/owl#ObjectProperty"	"https://wegenenverkeer.data.vlaanderen.be/ns/proefenmeting#ProefopBuis"	"https://wegenenverkeer.data.vlaanderen.be/ns/implementatieelement#DtcDocument"	""	"1"	"1"
"attribute"	"OSLO-Implementatieelement"	"contactgegevens"	"{58D12C76-C8FD-422f-A99C-DF92ABBB2372}"	""	"Derdenobject"	"{2E742FB9-8EC0-4b0c-B647-412FE90511F7}"	"String"	"contactgegevens"	"Naam, voornaam, telefoonnummer en/of e-mailadres van de contactpersoon."	""	"contactgegevens"	"Naam, voornaam, telefoonnummer en/of e-mailadres van de contactpersoon."	""	""	"true"	"https://wegenenverkeer.data.vlaanderen.be/ns/implementatieelement#"	"Derdenobject.contactgegevens"	"http://www.w3.org/2002/07/owl#DatatypeProperty"	"https://wegenenverkeer.data.vlaanderen.be/ns/implementatieelement#Derdenobject"	"http://www.w3.org/2001/XMLSchema#string"	""	"1"	"1"
"attribute"	"OSLO-Implementatieelement"	"foto"	"{C5F08D6F-6EA6-414b-87A0-41D3A7DB50A3}"	""	"Derdenobject"	"{2E742FB9-8EC0-4b0c-B647-412FE90511F7}"	"DtcDocument"	"foto"	"Een foto van het derdenobject die eventuele detailinformatie weergeeft"	"Enkel bestanden die een foto zijn."	"foto"	"Een foto van het derdenobject die eventuele detailinformatie weergeeft"	""	""	"true"	"https://wegenenverkeer.data.vlaanderen.be/ns/implementatieelement#"	"Derdenobject.foto"	"http://www.w3.org/2002/07/owl#ObjectProperty"	"https://wegenenverkeer.data.vlaanderen.be/ns/implementatieelement#Derdenobject"	"https://wegenenverkeer.data.vlaanderen.be/ns/implementatieelement#DtcDocument"	""	"1"	"*"
"attribute"	"OSLO-Implementatieelement"	"heeftAansluitkastGeintegreerd"	"{091A36F5-B907-4c02-A3FC-6ED88B3588AD}"	""	"Derdenobject"	"{2E742FB9-8EC0-4b0c-B647-412FE90511F7}"	"Boolean"	"heeft aansluitkast geintegreerd"	"Aanduiding of de aansluitkast geïntegreerd is."	""	"heeft aansluitkast geintegreerd"	"Aanduiding of de aansluitkast geïntegreerd is."	""	""	"true"	"https://wegenenverkeer.data.vlaanderen.be/ns/implementatieelement#"	"Derdenobject.heeftAansluitkastGeintegreerd"	"http://www.w3.org/2002/07/owl#DatatypeProperty"	"https://wegenenverkeer.data.vlaanderen.be/ns/implementatieelement#Derdenobject"	"http://www.w3.org/2001/XMLSchema#boolean"	""	"1"	"1"
"attribute"	"OSLO-Implementatieelement"	"omschrijving"	"{EEFD4177-A253-4211-B31A-F6859613138E}"	""	"Derdenobject"	"{2E742FB9-8EC0-4b0c-B647-412FE90511F7}"	"String"	"omschrijving"	"Omschrijving van het derdenobject"	""	"omschrijving"	"Omschrijving van het derdenobject"	""	""	"true"	"https://wegenenverkeer.data.vlaanderen.be/ns/implementatieelement#"	"Derdenobject.omschrijving"	"http://www.w3.org/2002/07/owl#DatatypeProperty"	"https://wegenenverkeer.data.vlaanderen.be/ns/implementatieelement#Derdenobject"	"http://www.w3.org/2001/XMLSchema#string"	""	"1"	"1"
"attribute"	"OSLO-Implementatieelement"	"naam"	"{0934DA42-F4E9-485b-BCE5-09CDF6AB792B}"	""	"AWVNaamObject"	"{5C144615-47A1-4f8b-A119-B293BCFD84B5}"	"String"	"naam"	"De mensleesbare naam van een AWVObject zoals dit bv. ook terug te vinden is op een etiket op het object zelf. AWV kent deze naam toe of geeft de opdracht om deze toe te kennen. Indien een object een algemeen gangbare naam heeft zoals bv. bij een waterloop dan wordt deze gebruikt."	""	"naam"	"De mensleesbare naam van een AWVObject zoals dit bv. ook terug te vinden is op een etiket op het object zelf. AWV kent deze naam toe of geeft de opdracht om deze toe te kennen. Indien een object een algemeen gangbare naam heeft zoals bv. bij een waterloop dan wordt deze gebruikt."	""	""	"true"	"https://wegenenverkeer.data.vlaanderen.be/ns/implementatieelement#"	"AWVNaamObject.naam"	"http://www.w3.org/2002/07/owl#DatatypeProperty"	"https://wegenenverkeer.data.vlaanderen.be/ns/implementatieelement#AWVNaamObject"	"http://www.w3.org/2001/XMLSchema#string"	""	"1"	"1"
"attribute"	"OSLO-Abstracten"	"batchnummer"	"{8C629A1B-8258-4536-92EC-AE9BD1336A06}"	""	"Controller"	"{ED1033C8-5031-478c-AA2F-4276A684A423}"	"String"	"batchnummer"	"Nummer van de batch"	""	"batchnummer"	"Nummer van de batch"	""	""	"true"	"https://wegenenverkeer.data.vlaanderen.be/ns/abstracten#"	"Controller.batchnummer"	"http://www.w3.org/2002/07/owl#DatatypeProperty"	"https://wegenenverkeer.data.vlaanderen.be/ns/abstracten#Controller"	"http://www.w3.org/2001/XMLSchema#string"	""	"1"	"1"
"attribute"	"OSLO-Abstracten"	"dNSNaam"	"{49A98FCE-B305-4f77-961D-2F85D5770A20}"	""	"Controller"	"{ED1033C8-5031-478c-AA2F-4276A684A423}"	"String"	"DNS-naam"	"DNS-naam van de controller"	""	"DNS-naam"	"DNS-naam van de controller"	""	""	"true"	"https://wegenenverkeer.data.vlaanderen.be/ns/abstracten#"	"Controller.dNSNaam"	"http://www.w3.org/2002/07/owl#DatatypeProperty"	"https://wegenenverkeer.data.vlaanderen.be/ns/abstracten#Controller"	"http://www.w3.org/2001/XMLSchema#string"	""	"1"	"1"
"attribute"	"OSLO-Abstracten"	"firmwareversie"	"{0250BDD7-C64B-4fc2-94E1-5D77AA33D395}"	""	"Controller"	"{ED1033C8-5031-478c-AA2F-4276A684A423}"	"String"	"firmwareversie"	"Firmwareversie van de controller"	""	"firmwareversie"	"Firmwareversie van de controller"	""	""	"true"	"https://wegenenverkeer.data.vlaanderen.be/ns/abstracten#"	"Controller.firmwareversie"	"http://www.w3.org/2002/07/owl#DatatypeProperty"	"https://wegenenverkeer.data.vlaanderen.be/ns/abstracten#Controller"	"http://www.w3.org/2001/XMLSchema#string"	""	"1"	"1"
"attribute"	"OSLO-Abstracten"	"iPAdres"	"{476E5912-5326-435b-B145-C40E274935EE}"	""	"Controller"	"{ED1033C8-5031-478c-AA2F-4276A684A423}"	"DteIPv4Adres"	"IP-adres"	"IP-adres van de controller"	""	"IP-adres"	"IP-adres van de controller"	""	""	"true"	"https://wegenenverkeer.data.vlaanderen.be/ns/abstracten#"	"Controller.iPAdres"	"http://www.w3.org/2002/07/owl#ObjectProperty"	"https://wegenenverkeer.data.vlaanderen.be/ns/abstracten#Controller"	"https://wegenenverkeer.data.vlaanderen.be/ns/implementatieelement#DteIPv4Adres"	""	"1"	"1"
"attribute"	"OSLO-Abstracten"	"serienummer"	"{707C153E-2697-42c5-A74D-C44FA31D3ECA}"	""	"Controller"	"{ED1033C8-5031-478c-AA2F-4276A684A423}"	"String"	"serienummer"	"Serienummer van de controller"	""	"serienummer"	"Serienummer van de controller"	""	""	"true"	"https://wegenenverkeer.data.vlaanderen.be/ns/abstracten#"	"Controller.serienummer"	"http://www.w3.org/2002/07/owl#DatatypeProperty"	"https://wegenenverkeer.data.vlaanderen.be/ns/abstracten#Controller"	"http://www.w3.org/2001/XMLSchema#string"	""	"1"	"1"
"attribute"	"OSLO-Implementatieelement"	"datumOprichtingObject"	"{BDF3B5DA-2C71-43b0-8AF1-9CBB8C9059DB}"	""	"AWVObject"	"{C3CBD401-EC86-4363-9821-CCE89EB2F0A9}"	"Date"	"datum oprichting object"	"Datum van de oprichting van het object"	""	"datum oprichting object"	"Datum van de oprichting van het object"	""	""	"true"	"https://wegenenverkeer.data.vlaanderen.be/ns/implementatieelement#"	"AWVObject.datumOprichtingObject"	"http://www.w3.org/2002/07/owl#DatatypeProperty"	"https://wegenenverkeer.data.vlaanderen.be/ns/implementatieelement#AWVObject"	"http://www.w3.org/2001/XMLSchema#date"	""	"1"	"1"
"attribute"	"OSLO-Implementatieelement"	"id"	"{B43EDD99-BBCC-4818-B6BA-0C9DBF96FA24}"	""	"AWVObject"	"{C3CBD401-EC86-4363-9821-CCE89EB2F0A9}"	"DtcAWVIdentificator"	"id"	"De identificator van het object. Zodra een object bestaat binnen de omgeving van AWV moet de id gebruikt worden zoals die daar gekend is. Bij aanlevering van nieuwe objecten wordt een lokale-id (zoals gekend bij de aannemer) ingevuld."	""	"id"	"De identificator van het object. Zodra een object bestaat binnen de omgeving van AWV moet de id gebruikt worden zoals die daar gekend is. Bij aanlevering van nieuwe objecten wordt een lokale-id (zoals gekend bij de aannemer) ingevuld."	""	""	"true"	"https://wegenenverkeer.data.vlaanderen.be/ns/implementatieelement#"	"AWVObject.id"	"http://www.w3.org/2002/07/owl#ObjectProperty"	"https://wegenenverkeer.data.vlaanderen.be/ns/implementatieelement#AWVObject"	"https://wegenenverkeer.data.vlaanderen.be/ns/implementatieelement#DtcAWVIdentificator"	""	"1"	"*"
"attribute"	"OSLO-Implementatieelement"	"notitie"	"{C5D72798-B8FE-4b73-8F50-506AE8241477}"	""	"AWVObject"	"{C3CBD401-EC86-4363-9821-CCE89EB2F0A9}"	"String"	"notitie"	"Extra notitie voor het AWV object."	""	"notitie"	"Extra notitie voor het AWV object."	""	""	"true"	"https://wegenenverkeer.data.vlaanderen.be/ns/implementatieelement#"	"AWVObject.notitie"	"http://www.w3.org/2002/07/owl#DatatypeProperty"	"https://wegenenverkeer.data.vlaanderen.be/ns/implementatieelement#AWVObject"	"http://www.w3.org/2001/XMLSchema#string"	""	"1"	"1"
"attribute"	"OSLO-Implementatieelement"	"typeURI"	"{E1765146-77A7-479e-8478-D814329806B4}"	""	"AWVObject"	"{C3CBD401-EC86-4363-9821-CCE89EB2F0A9}"	"AnyURI"	"uri type"	"De URI van het AWV Object volgens https://www.w3.org/2001/XMLSchema#anyURI ."	""	"uri type"	"De URI van het AWV Object volgens https://www.w3.org/2001/XMLSchema#anyURI ."	""	""	"true"	"https://wegenenverkeer.data.vlaanderen.be/ns/implementatieelement#"	"AWVObject.typeURI"	"http://www.w3.org/2002/07/owl#ObjectProperty"	"https://wegenenverkeer.data.vlaanderen.be/ns/implementatieelement#AWVObject"	"https://www.w3.org/2001/XMLSchema#anyURI"	""	"1"	"1"
"attribute"	"OSLO-Onderdeel"	"materiaal"	"{C3DA3C1C-96A7-4f19-AAA5-18A14767A232}"	""	"Persleiding"	"{7A98A793-EC14-4941-B563-14E7D3111EFA}"	"KlPersleidingMateriaal"	"materiaal"	"Bepaalt het materiaal van de persleiding."	""	"materiaal"	"Bepaalt het materiaal van de persleiding."	""	""	"true"	"https://wegenenverkeer.data.vlaanderen.be/ns/onderdeel#"	"Persleiding.materiaal"	"http://www.w3.org/2002/07/owl#ObjectProperty"	"https://wegenenverkeer.data.vlaanderen.be/ns/onderdeel#Persleiding"	"http://www.w3.org/2004/02/skos/core#Concept"	""	"1"	"1"
"attribute"	"OSLO-Abstracten"	"bokAfwaarts"	"{C03A74B0-211E-475a-80A7-512B6EE869B2}"	""	"Buis"	"{71FC81DE-8AEC-4f3c-A5EB-409F128BB989}"	"KwantWrdInMeterTAW"	"bok afwaarts"	"Peil in meter-TAW van de vloei aan de afwaartse kant van de buis."	""	"bok afwaarts"	"Peil in meter-TAW van de vloei aan de afwaartse kant van de buis."	""	""	"true"	"https://wegenenverkeer.data.vlaanderen.be/ns/abstracten#"	"Buis.bokAfwaarts"	"http://www.w3.org/2002/07/owl#ObjectProperty"	"https://wegenenverkeer.data.vlaanderen.be/ns/abstracten#Buis"	"https://wegenenverkeer.data.vlaanderen.be/ns/implementatieelement#KwantWrdInMeterTAW"	""	"1"	"1"
"attribute"	"OSLO-Abstracten"	"bokOpwaarts"	"{6F7A411F-9E0F-476b-9096-AF555F4A7D4B}"	""	"Buis"	"{71FC81DE-8AEC-4f3c-A5EB-409F128BB989}"	"KwantWrdInMeterTAW"	"bok opwaarts"	"Peil in meter-TAW van de vloei aan de opwaartse kant van de buis."	""	"bok opwaarts"	"Peil in meter-TAW van de vloei aan de opwaartse kant van de buis."	""	""	"true"	"https://wegenenverkeer.data.vlaanderen.be/ns/abstracten#"	"Buis.bokOpwaarts"	"http://www.w3.org/2002/07/owl#ObjectProperty"	"https://wegenenverkeer.data.vlaanderen.be/ns/abstracten#Buis"	"https://wegenenverkeer.data.vlaanderen.be/ns/implementatieelement#KwantWrdInMeterTAW"	""	"1"	"1"
"attribute"	"OSLO-Abstracten"	"breedte"	"{5F80F989-1DF5-4a83-8E51-9AE4909685C8}"	""	"Buis"	"{71FC81DE-8AEC-4f3c-A5EB-409F128BB989}"	"KwantWrdInMillimeter"	"breedte"	"De breedte van de buis in millimeter."	""	"breedte"	"De breedte van de buis in millimeter."	""	""	"true"	"https://wegenenverkeer.data.vlaanderen.be/ns/abstracten#"	"Buis.breedte"	"http://www.w3.org/2002/07/owl#ObjectProperty"	"https://wegenenverkeer.data.vlaanderen.be/ns/abstracten#Buis"	"https://wegenenverkeer.data.vlaanderen.be/ns/implementatieelement#KwantWrdInMillimeter"	""	"1"	"1"
"attribute"	"OSLO-Abstracten"	"diepteAfwaarts"	"{19E9E981-2449-487d-A2C6-F6F5F98E3029}"	""	"Buis"	"{71FC81DE-8AEC-4f3c-A5EB-409F128BB989}"	"KwantWrdInMeter"	"diepte afwaarts"	"Diepte van de vloei aan de afwaartse kant van de buis tov de bovenkant van het deksel."	""	"diepte afwaarts"	"Diepte van de vloei aan de afwaartse kant van de buis tov de bovenkant van het deksel."	""	""	"true"	"https://wegenenverkeer.data.vlaanderen.be/ns/abstracten#"	"Buis.diepteAfwaarts"	"http://www.w3.org/2002/07/owl#ObjectProperty"	"https://wegenenverkeer.data.vlaanderen.be/ns/abstracten#Buis"	"https://wegenenverkeer.data.vlaanderen.be/ns/implementatieelement#KwantWrdInMeter"	""	"1"	"1"
"attribute"	"OSLO-Abstracten"	"diepteOpwaarts"	"{C73ADBA1-AB34-48f0-8210-F2ACD8326DCD}"	""	"Buis"	"{71FC81DE-8AEC-4f3c-A5EB-409F128BB989}"	"KwantWrdInMeter"	"diepte opwaarts"	"De diepte van de vloei aan de opwaartse kant van de buis tov de bovenkant van het deksel."	""	"diepte opwaarts"	"De diepte van de vloei aan de opwaartse kant van de buis tov de bovenkant van het deksel."	""	""	"true"	"https://wegenenverkeer.data.vlaanderen.be/ns/abstracten#"	"Buis.diepteOpwaarts"	"http://www.w3.org/2002/07/owl#ObjectProperty"	"https://wegenenverkeer.data.vlaanderen.be/ns/abstracten#Buis"	"https://wegenenverkeer.data.vlaanderen.be/ns/implementatieelement#KwantWrdInMeter"	""	"1"	"1"
"attribute"	"OSLO-Abstracten"	"helling"	"{48691ACA-9688-4656-B6C4-F6A509E835DE}"	""	"Buis"	"{71FC81DE-8AEC-4f3c-A5EB-409F128BB989}"	"KwantWrdInPromille"	"helling"	"De helling van de buis in de lengterichting, uitgedrukt in ."	""	"helling"	"De helling van de buis in de lengterichting, uitgedrukt in ."	""	""	"true"	"https://wegenenverkeer.data.vlaanderen.be/ns/abstracten#"	"Buis.helling"	"http://www.w3.org/2002/07/owl#ObjectProperty"	"https://wegenenverkeer.data.vlaanderen.be/ns/abstracten#Buis"	"https://wegenenverkeer.data.vlaanderen.be/ns/implementatieelement#KwantWrdInPromille"	""	"1"	"1"
"attribute"	"OSLO-Abstracten"	"hoogteBinnenzijde"	"{42B6E640-1EED-408f-BAD9-4E63A5CE0472}"	""	"Buis"	"{71FC81DE-8AEC-4f3c-A5EB-409F128BB989}"	"KwantWrdInMillimeter"	"hoogte binnenzijde"	"De hoogte van de binnenzijde van de buis in millimeter. Bij cirkelvormige buizen is dit de binnendiameter."	""	"hoogte binnenzijde"	"De hoogte van de binnenzijde van de buis in millimeter. Bij cirkelvormige buizen is dit de binnendiameter."	""	""	"true"	"https://wegenenverkeer.data.vlaanderen.be/ns/abstracten#"	"Buis.hoogteBinnenzijde"	"http://www.w3.org/2002/07/owl#ObjectProperty"	"https://wegenenverkeer.data.vlaanderen.be/ns/abstracten#Buis"	"https://wegenenverkeer.data.vlaanderen.be/ns/implementatieelement#KwantWrdInMillimeter"	""	"1"	"1"
"attribute"	"OSLO-Abstracten"	"hoogteBuitenzijde"	"{BF2ABF5B-7035-43ce-B139-1BCA9AB5171F}"	""	"Buis"	"{71FC81DE-8AEC-4f3c-A5EB-409F128BB989}"	"KwantWrdInMillimeter"	"hoogte buitenzijde"	"De hoogte van de buitenzijde van een buis in millimeter. Bij cirkelvormige buizen is dit de buitendiameter."	""	"hoogte buitenzijde"	"De hoogte van de buitenzijde van een buis in millimeter. Bij cirkelvormige buizen is dit de buitendiameter."	""	""	"true"	"https://wegenenverkeer.data.vlaanderen.be/ns/abstracten#"	"Buis.hoogteBuitenzijde"	"http://www.w3.org/2002/07/owl#ObjectProperty"	"https://wegenenverkeer.data.vlaanderen.be/ns/abstracten#Buis"	"https://wegenenverkeer.data.vlaanderen.be/ns/implementatieelement#KwantWrdInMillimeter"	""	"1"	"1"
"attribute"	"OSLO-Abstracten"	"isManToegankelijk"	"{48E6BF0D-9750-4f11-9A46-5811925819B5}"	""	"Buis"	"{71FC81DE-8AEC-4f3c-A5EB-409F128BB989}"	"Boolean"	"is man toegankelijk"	"Bepaalt of de buis toegankelijk is voor een persoon."	""	"is man toegankelijk"	"Bepaalt of de buis toegankelijk is voor een persoon."	""	""	"true"	"https://wegenenverkeer.data.vlaanderen.be/ns/abstracten#"	"Buis.isManToegankelijk"	"http://www.w3.org/2002/07/owl#DatatypeProperty"	"https://wegenenverkeer.data.vlaanderen.be/ns/abstracten#Buis"	"http://www.w3.org/2001/XMLSchema#boolean"	""	"1"	"1"
"attribute"	"OSLO-Abstracten"	"isOpgevuld"	"{0A12D043-A70C-4423-B167-D31403DEA87A}"	""	"Buis"	"{71FC81DE-8AEC-4f3c-A5EB-409F128BB989}"	"Boolean"	"is opgevuld"	"Geeft aan of de buis gestabileerd/opgevuld is of niet."	""	"is opgevuld"	"Geeft aan of de buis gestabileerd/opgevuld is of niet."	""	""	"true"	"https://wegenenverkeer.data.vlaanderen.be/ns/abstracten#"	"Buis.isOpgevuld"	"http://www.w3.org/2002/07/owl#DatatypeProperty"	"https://wegenenverkeer.data.vlaanderen.be/ns/abstracten#Buis"	"http://www.w3.org/2001/XMLSchema#boolean"	""	"1"	"1"
"attribute"	"OSLO-Abstracten"	"lengte"	"{45A33CA4-3CD4-475c-80D2-E4681F93A398}"	""	"Buis"	"{71FC81DE-8AEC-4f3c-A5EB-409F128BB989}"	"KwantWrdInMeter"	"lengte"	"De totale lengte in meter van de buis tussen opwaartse en afwaartse put."	""	"lengte"	"De totale lengte in meter van de buis tussen opwaartse en afwaartse put."	""	""	"true"	"https://wegenenverkeer.data.vlaanderen.be/ns/abstracten#"	"Buis.lengte"	"http://www.w3.org/2002/07/owl#ObjectProperty"	"https://wegenenverkeer.data.vlaanderen.be/ns/abstracten#Buis"	"https://wegenenverkeer.data.vlaanderen.be/ns/implementatieelement#KwantWrdInMeter"	""	"1"	"1"
"attribute"	"OSLO-Abstracten"	"technischeFiche"	"{EA0EF292-6DDC-4938-8D43-DDDBE4533E5D}"	""	"Buis"	"{71FC81DE-8AEC-4f3c-A5EB-409F128BB989}"	"DtcDocument"	"technische fiche"	"De technische fiche van de buis."	"Bestanden van het type xlsx of pdf."	"technische fiche"	"De technische fiche van de buis."	""	""	"true"	"https://wegenenverkeer.data.vlaanderen.be/ns/abstracten#"	"Buis.technischeFiche"	"http://www.w3.org/2002/07/owl#ObjectProperty"	"https://wegenenverkeer.data.vlaanderen.be/ns/abstracten#Buis"	"https://wegenenverkeer.data.vlaanderen.be/ns/implementatieelement#DtcDocument"	""	"1"	"*"
"attribute"	"OSLO-Abstracten"	"vorm"	"{436BDC27-3632-441c-80B9-45E3212C68C2}"	""	"Buis"	"{71FC81DE-8AEC-4f3c-A5EB-409F128BB989}"	"KlRioleringVorm"	"vorm"	"Bepaalt de vorm van de buis."	""	"vorm"	"Bepaalt de vorm van de buis."	""	""	"true"	"https://wegenenverkeer.data.vlaanderen.be/ns/abstracten#"	"Buis.vorm"	"http://www.w3.org/2002/07/owl#ObjectProperty"	"https://wegenenverkeer.data.vlaanderen.be/ns/abstracten#Buis"	"http://www.w3.org/2004/02/skos/core#Concept"	""	"1"	"1"
"attribute"	"OSLO-Abstracten"	"technischeFiche"	"{310BAEC8-42E9-4a15-87D8-7DCF2286AF8A}"	""	"LinkendElement"	"{C21947AD-F6DC-4c97-8495-E1CF9D7DE221}"	"DtcDocument"	"technische fiche"	"De technische fiche van een linkend element."	""	"technische fiche"	"De technische fiche van een linkend element."	""	""	"true"	"https://wegenenverkeer.data.vlaanderen.be/ns/abstracten#"	"LinkendElement.technischeFiche"	"http://www.w3.org/2002/07/owl#ObjectProperty"	"https://wegenenverkeer.data.vlaanderen.be/ns/abstracten#LinkendElement"	"https://wegenenverkeer.data.vlaanderen.be/ns/implementatieelement#DtcDocument"	""	"1"	"*"
"attribute"	"OSLO-Onderdeel"	"inkomendeDruk"	"{9F9517F5-B85A-489a-9CA4-BAC7E5951EA8}"	""	"Drukverhogingsgroep"	"{7CDFAF0B-099B-4f59-A8DE-8A3CAEDD5093}"	"KwantWrdInBar"	"inkomende druk"	"TODO"	""	"inkomende druk"	"TODO"	""	""	"true"	"https://wegenenverkeer.data.vlaanderen.be/ns/onderdeel#"	"Drukverhogingsgroep.inkomendeDruk"	"http://www.w3.org/2002/07/owl#ObjectProperty"	"https://wegenenverkeer.data.vlaanderen.be/ns/onderdeel#Drukverhogingsgroep"	"https://wegenenverkeer.data.vlaanderen.be/ns/implementatieelement#KwantWrdInBar"	""	"1"	"1"
"attribute"	"OSLO-Onderdeel"	"uitgaandeDruk"	"{C348EF41-2904-43d0-889E-FAE619A28AEA}"	""	"Drukverhogingsgroep"	"{7CDFAF0B-099B-4f59-A8DE-8A3CAEDD5093}"	"KwantWrdInBar"	"uitgaande druk"	"TODO"	""	"uitgaande druk"	"TODO"	""	""	"true"	"https://wegenenverkeer.data.vlaanderen.be/ns/onderdeel#"	"Drukverhogingsgroep.uitgaandeDruk"	"http://www.w3.org/2002/07/owl#ObjectProperty"	"https://wegenenverkeer.data.vlaanderen.be/ns/onderdeel#Drukverhogingsgroep"	"https://wegenenverkeer.data.vlaanderen.be/ns/implementatieelement#KwantWrdInBar"	""	"1"	"1"
"attribute"	"OSLO-Onderdeel"	"vermogen"	"{E6F1F0AD-2BA7-4938-9737-F8DC5B73912D}"	""	"Drukverhogingsgroep"	"{7CDFAF0B-099B-4f59-A8DE-8A3CAEDD5093}"	"KwantWrdInKiloWatt"	"vermogen"	"TODO"	""	"vermogen"	"TODO"	""	""	"true"	"https://wegenenverkeer.data.vlaanderen.be/ns/onderdeel#"	"Drukverhogingsgroep.vermogen"	"http://www.w3.org/2002/07/owl#ObjectProperty"	"https://wegenenverkeer.data.vlaanderen.be/ns/onderdeel#Drukverhogingsgroep"	"https://wegenenverkeer.data.vlaanderen.be/ns/implementatieelement#KwantWrdInKiloWatt"	""	"1"	"1"
"attribute"	"OSLO-Onderdeel"	"isolatie"	"{1D6607F7-3783-4520-A2ED-A863B991C717}"	""	"Brandleiding"	"{0046EB6D-0C97-4bc3-BA93-68AC3E3C6A25}"	"Boolean"	"isolatie"	"TODO"	""	"isolatie"	"TODO"	""	""	"true"	"https://wegenenverkeer.data.vlaanderen.be/ns/onderdeel#"	"Brandleiding.isolatie"	"http://www.w3.org/2002/07/owl#DatatypeProperty"	"https://wegenenverkeer.data.vlaanderen.be/ns/onderdeel#Brandleiding"	"http://www.w3.org/2001/XMLSchema#boolean"	""	"1"	"1"
"attribute"	"OSLO-Onderdeel"	"leidingdruk"	"{9FA194B7-6F2B-4e1f-B8A9-CB1E9FDA4F40}"	""	"Brandleiding"	"{0046EB6D-0C97-4bc3-BA93-68AC3E3C6A25}"	"KwantWrdInBar"	"leidingdruk"	"TODO"	""	"leidingdruk"	"TODO"	""	""	"true"	"https://wegenenverkeer.data.vlaanderen.be/ns/onderdeel#"	"Brandleiding.leidingdruk"	"http://www.w3.org/2002/07/owl#ObjectProperty"	"https://wegenenverkeer.data.vlaanderen.be/ns/onderdeel#Brandleiding"	"https://wegenenverkeer.data.vlaanderen.be/ns/implementatieelement#KwantWrdInBar"	""	"1"	"1"
"attribute"	"OSLO-Onderdeel"	"stroomkringnummer"	"{959F68A7-581B-4f93-B644-E597184BB67C}"	""	"Stroomkring"	"{9E56032E-DD28-4ef8-8DCF-FF35647F878A}"	"Integer"	"stroomkringnummer"	"Nummer van de stroomkring"	""	"stroomkringnummer"	"Nummer van de stroomkring"	""	""	"true"	"https://wegenenverkeer.data.vlaanderen.be/ns/onderdeel#"	"Stroomkring.stroomkringnummer"	"http://www.w3.org/2002/07/owl#DatatypeProperty"	"https://wegenenverkeer.data.vlaanderen.be/ns/onderdeel#Stroomkring"	"http://www.w3.org/2001/XMLSchema#integer"	""	"1"	"1"
"attribute"	"OSLO-Onderdeel"	"buitendiameter"	"{5FF5D507-AE58-4c41-B06C-97B6CEE599AA}"	""	"Brandhaspel"	"{0ECADCC5-E6C9-4b85-AD22-0CA0346124C6}"	"KwantWrdInCentimeter"	"buitendiameter"	"TODO"	""	"buitendiameter"	"TODO"	""	""	"true"	"https://wegenenverkeer.data.vlaanderen.be/ns/onderdeel#"	"Brandhaspel.buitendiameter"	"http://www.w3.org/2002/07/owl#ObjectProperty"	"https://wegenenverkeer.data.vlaanderen.be/ns/onderdeel#Brandhaspel"	"https://wegenenverkeer.data.vlaanderen.be/ns/implementatieelement#KwantWrdInCentimeter"	""	"1"	"1"
"attribute"	"OSLO-Onderdeel"	"keuringsdatum"	"{BDCA7A59-861A-4efd-AAB3-A87AA599508F}"	""	"Brandhaspel"	"{0ECADCC5-E6C9-4b85-AD22-0CA0346124C6}"	"Date"	"keuringsdatum"	"TODO"	""	"keuringsdatum"	"TODO"	""	""	"true"	"https://wegenenverkeer.data.vlaanderen.be/ns/onderdeel#"	"Brandhaspel.keuringsdatum"	"http://www.w3.org/2002/07/owl#DatatypeProperty"	"https://wegenenverkeer.data.vlaanderen.be/ns/onderdeel#Brandhaspel"	"http://www.w3.org/2001/XMLSchema#date"	""	"1"	"1"
