"EA-Type"	"EA-Package"	"EA-Name"	"EA-GUID"	"EA-Parent"	"EA-Domain"	"EA-Domain-GUID"	"EA-Range"	"label"	"definition"	"usage"	"ap-label-nl"	"ap-definition-nl"	"ap-usageNote-nl"	"ap-codelist"	"external term"	"namespace"	"localname"	"type"	"domain"	"range"	"parent"	"min card"	"max card"
"Package"	""	"OSLO-Brandleiding"	"{AAFEBC76-8588-4fe2-8C81-3632F2DF9B14}"	""	""	""	""	""	""	""	""	""	""	""	""	"http://"	"fixme.com"	"http://www.w3.org/2002/07/owl#Ontology"	""	""	""	""	""
"CLASS"	"OSLO-Proefenmeting"	"Proef"	"{A1EF4D85-B064-4217-9932-40B85F6EEC1B}"	""	""	""	""	"Proeven"	"Abstracte voor de gemeenschappelijke eigenschappen en relaties alle proeven."	""	"Proeven"	"Abstracte voor de gemeenschappelijke eigenschappen en relaties alle proeven."	""	""	"true"	"https://wegenenverkeer.data.vlaanderen.be/ns/proefenmeting#"	"Proef"	"http://www.w3.org/2000/01/rdf-schema#Class"	""	""	""	""	""
"CLASS"	"OSLO-Proefenmeting"	"ProefopBuis"	"{17468210-5362-421d-9D91-C84C89D338BF}"	"Proef"	""	""	""	"Proef op buis"	"Abstracte voor de gemeenschappelijke eigenschappen van de proef op een buis."	""	"Proef op buis"	"Abstracte voor de gemeenschappelijke eigenschappen van de proef op een buis."	""	""	"true"	"https://wegenenverkeer.data.vlaanderen.be/ns/proefenmeting#"	"ProefopBuis"	"http://www.w3.org/2000/01/rdf-schema#Class"	""	""	"https://wegenenverkeer.data.vlaanderen.be/ns/proefenmeting#Proef"	""	""
"CLASS"	"OSLO-Implementatieelement"	"Derdenobject"	"{2E742FB9-8EC0-4b0c-B647-412FE90511F7}"	""	""	""	""	"Derdenobject"	"Object niet in eigendom van AWV maar verbonden met een object van AWV."	""	"Derdenobject"	"Object niet in eigendom van AWV maar verbonden met een object van AWV."	""	""	"true"	"https://wegenenverkeer.data.vlaanderen.be/ns/implementatieelement#"	"Derdenobject"	"http://www.w3.org/2000/01/rdf-schema#Class"	""	""	""	""	""
"CLASS"	"OSLO-Implementatieelement"	"AWVNaamObject"	"{5C144615-47A1-4f8b-A119-B293BCFD84B5}"	"AWVObject"	""	""	""	"AWV naam object"	"Abstracte als de basisklasse voor elk OTL object dat benoemd wordt met een mensleesbare identificator. "	""	"AWV naam object"	"Abstracte als de basisklasse voor elk OTL object dat benoemd wordt met een mensleesbare identificator. "	""	""	"true"	"https://wegenenverkeer.data.vlaanderen.be/ns/implementatieelement#"	"AWVNaamObject"	"http://www.w3.org/2000/01/rdf-schema#Class"	""	""	"https://wegenenverkeer.data.vlaanderen.be/ns/implementatieelement#AWVObject"	""	""
"CLASS"	"OSLO-Abstracten"	"Controller"	"{ED1033C8-5031-478c-AA2F-4276A684A423}"	"AWVNaamObject"	""	""	""	"Controller"	"Abstracte voor allerlei types van controllers."	""	"Controller"	"Abstracte voor allerlei types van controllers."	""	""	"true"	"https://wegenenverkeer.data.vlaanderen.be/ns/abstracten#"	"Controller"	"http://www.w3.org/2000/01/rdf-schema#Class"	""	""	"https://wegenenverkeer.data.vlaanderen.be/ns/implementatieelement#AWVNaamObject"	""	""
"CLASS"	"OSLO-Implementatieelement"	"AWVObject"	"{C3CBD401-EC86-4363-9821-CCE89EB2F0A9}"	""	""	""	""	"AWV object"	"Abstracte als de basisklasse (super class) voor alle uniek geïdentificeerde OTL objecten met de basiseigenschappen die elk OTL object minstens heeft."	""	"AWV object"	"Abstracte als de basisklasse (super class) voor alle uniek geïdentificeerde OTL objecten met de basiseigenschappen die elk OTL object minstens heeft."	""	""	"true"	"https://wegenenverkeer.data.vlaanderen.be/ns/implementatieelement#"	"AWVObject"	"http://www.w3.org/2000/01/rdf-schema#Class"	""	""	""	""	""
"CLASS"	"OSLO-Onderdeel"	"Persleiding"	"{7A98A793-EC14-4941-B563-14E7D3111EFA}"	"Buis"	""	""	""	"Persleiding"	"Ondergronds kanaal of pijp voor afvoer van water onder druk."	""	"Persleiding"	"Ondergronds kanaal of pijp voor afvoer van water onder druk."	""	""	"true"	"https://wegenenverkeer.data.vlaanderen.be/ns/onderdeel#"	"Persleiding"	"http://www.w3.org/2000/01/rdf-schema#Class"	""	""	"https://wegenenverkeer.data.vlaanderen.be/ns/abstracten#Buis"	""	""
"CLASS"	"OSLO-Abstracten"	"Buis"	"{71FC81DE-8AEC-4f3c-A5EB-409F128BB989}"	"AWVObject, ProefopBuis"	""	""	""	"Buis"	"Abstracte om de gemeenschappelijke eigenschappen en relaties van de verschillende soorten buizen onder één noemer te houden."	""	"Buis"	"Abstracte om de gemeenschappelijke eigenschappen en relaties van de verschillende soorten buizen onder één noemer te houden."	""	""	"true"	"https://wegenenverkeer.data.vlaanderen.be/ns/abstracten#"	"Buis"	"http://www.w3.org/2000/01/rdf-schema#Class"	""	""	"https://wegenenverkeer.data.vlaanderen.be/ns/implementatieelement#AWVObject, https://wegenenverkeer.data.vlaanderen.be/ns/proefenmeting#ProefopBuis"	""	""
"CLASS"	"OSLO-Abstracten"	"LinkendElement"	"{C21947AD-F6DC-4c97-8495-E1CF9D7DE221}"	"AWVObject"	""	""	""	"Linkend element"	"Abstracte bedoeld om alle eigenschappen en relaties van linkende elementen te groeperen. Linkende elementen zijn objecten die aansluiten op een buis."	""	"Linkend element"	"Abstracte bedoeld om alle eigenschappen en relaties van linkende elementen te groeperen. Linkende elementen zijn objecten die aansluiten op een buis."	""	""	"true"	"https://wegenenverkeer.data.vlaanderen.be/ns/abstracten#"	"LinkendElement"	"http://www.w3.org/2000/01/rdf-schema#Class"	""	""	"https://wegenenverkeer.data.vlaanderen.be/ns/implementatieelement#AWVObject"	""	""
"CLASS"	"OSLO-Onderdeel"	"Drukverhogingsgroep"	"{7CDFAF0B-099B-4f59-A8DE-8A3CAEDD5093}"	"LinkendElement"	""	""	""	"Drukverhogingsgroep"	"TODO"	""	"Drukverhogingsgroep"	"TODO"	""	""	"true"	"https://wegenenverkeer.data.vlaanderen.be/ns/onderdeel#"	"Drukverhogingsgroep"	"http://www.w3.org/2000/01/rdf-schema#Class"	""	""	"https://wegenenverkeer.data.vlaanderen.be/ns/abstracten#LinkendElement"	""	""
"CLASS"	"OSLO-Onderdeel"	"Brandleiding"	"{0046EB6D-0C97-4bc3-BA93-68AC3E3C6A25}"	"Persleiding"	""	""	""	"Brandleiding"	"TODO"	""	"Brandleiding"	"TODO"	""	""	"true"	"https://wegenenverkeer.data.vlaanderen.be/ns/onderdeel#"	"Brandleiding"	"http://www.w3.org/2000/01/rdf-schema#Class"	""	""	"https://wegenenverkeer.data.vlaanderen.be/ns/onderdeel#Persleiding"	""	""
"CLASS"	"OSLO-Onderdeel"	"Stroomkring"	"{9E56032E-DD28-4ef8-8DCF-FF35647F878A}"	"AWVNaamObject"	""	""	""	"Stroomkring"	"Ook wel vertrek of vertrekkende kabel genoemd. Afgezekerde elektrische geleiders waarmee de applicaties voorzien worden van de nodige voeding"	""	"Stroomkring"	"Ook wel vertrek of vertrekkende kabel genoemd. Afgezekerde elektrische geleiders waarmee de applicaties voorzien worden van de nodige voeding"	""	""	"true"	"https://wegenenverkeer.data.vlaanderen.be/ns/onderdeel#"	"Stroomkring"	"http://www.w3.org/2000/01/rdf-schema#Class"	""	""	"https://wegenenverkeer.data.vlaanderen.be/ns/implementatieelement#AWVNaamObject"	""	""
"CLASS"	"OSLO-Onderdeel"	"Brandhaspel"	"{0ECADCC5-E6C9-4b85-AD22-0CA0346124C6}"	"LinkendElement"	""	""	""	"Brandhaspel"	"TODO"	""	"Brandhaspel"	"TODO"	""	""	"true"	"https://wegenenverkeer.data.vlaanderen.be/ns/onderdeel#"	"Brandhaspel"	"http://www.w3.org/2000/01/rdf-schema#Class"	""	""	"https://wegenenverkeer.data.vlaanderen.be/ns/abstracten#LinkendElement"	""	""
"CLASS"	"OSLO-Onderdeel"	"IOKaart"	"{3ABC664E-5A1A-4e30-B70F-F5748EF344ED}"	"AWVObject"	""	""	""	"IO-Kaart"	"TODO"	""	"IO-Kaart"	"TODO"	""	""	"true"	"https://wegenenverkeer.data.vlaanderen.be/ns/onderdeel#"	"IOKaart"	"http://www.w3.org/2000/01/rdf-schema#Class"	""	""	"https://wegenenverkeer.data.vlaanderen.be/ns/implementatieelement#AWVObject"	""	""
"CLASS"	"OSLO-Onderdeel"	"PLC"	"{387EDE6E-A7C0-48a6-B1B2-996DABF755B2}"	"Controller"	""	""	""	"PLC"	"TODO"	""	"PLC"	"TODO"	""	""	"true"	"https://wegenenverkeer.data.vlaanderen.be/ns/onderdeel#"	"PLC"	"http://www.w3.org/2000/01/rdf-schema#Class"	""	""	"https://wegenenverkeer.data.vlaanderen.be/ns/abstracten#Controller"	""	""
"CLASS"	"OSLO-Onderdeel"	"Verwarmingslint"	"{BFDB0209-11C7-41b9-8479-1042D736FE0F}"	"AWVObject"	""	""	""	"Verwarmingslint"	"TODO"	""	"Verwarmingslint"	"TODO"	""	""	"true"	"https://wegenenverkeer.data.vlaanderen.be/ns/onderdeel#"	"Verwarmingslint"	"http://www.w3.org/2000/01/rdf-schema#Class"	""	""	"https://wegenenverkeer.data.vlaanderen.be/ns/implementatieelement#AWVObject"	""	""
"CLASS"	"OSLO-Onderdeel"	"Verwarmingselement"	"{21EB4D68-61B0-4e18-8B22-50F52F78F0CB}"	"AWVObject"	""	""	""	"Verwarmingselement"	"Verwarmingselement"	""	"Verwarmingselement"	"Verwarmingselement"	""	""	"true"	"https://wegenenverkeer.data.vlaanderen.be/ns/onderdeel#"	"Verwarmingselement"	"http://www.w3.org/2000/01/rdf-schema#Class"	""	""	"https://wegenenverkeer.data.vlaanderen.be/ns/implementatieelement#AWVObject"	""	""
"CLASS"	"OSLO-Onderdeel"	"Hydrant"	"{E8B006D6-7BD8-418c-BF76-8054BEBCE93D}"	"LinkendElement, Derdenobject"	""	""	""	"Hydrant"	"TODO"	""	"Hydrant"	"TODO"	""	""	"true"	"https://wegenenverkeer.data.vlaanderen.be/ns/onderdeel#"	"Hydrant"	"http://www.w3.org/2000/01/rdf-schema#Class"	""	""	"https://wegenenverkeer.data.vlaanderen.be/ns/implementatieelement#Derdenobject, https://wegenenverkeer.data.vlaanderen.be/ns/abstracten#LinkendElement"	""	""
"CLASS"	"OSLO-Onderdeel"	"Bevestiging"	"{851E2395-627F-4352-8324-2E91CD6B80DE}"	""	""	""	""	"Bevestiging"	"Deze relatie geeft aan dat twee onderdelen direct fysiek op elkaar bevestigd zijn. Dit kan zowel aan de buitenkant als aan de binnenkant zijn zoals bv. een camera aan een paal of een laagspanningsbord in een kast. Deze relatie heeft geen richting."	""	"Bevestiging"	"Deze relatie geeft aan dat twee onderdelen direct fysiek op elkaar bevestigd zijn. Dit kan zowel aan de buitenkant als aan de binnenkant zijn zoals bv. een camera aan een paal of een laagspanningsbord in een kast. Deze relatie heeft geen richting."	""	""	"true"	"https://wegenenverkeer.data.vlaanderen.be/ns/onderdeel#"	"Bevestiging"	"http://www.w3.org/2000/01/rdf-schema#Class"	""	""	""	""	""
"CLASS"	"OSLO-Onderdeel"	"SluitAanOp"	"{81328BD8-BCDE-4489-A4CD-1D1011BEFC91}"	""	""	""	""	"Sluit aan op"	"Deze relatie geeft aan hoe 2 onderdelen in horizontale zin elkaar opvolgen. Dit wordt gebruikt om een topologische netwerk op te bouwen. Enkel in gebruik bij afschermende constructies en riolering/waterlopen. Deze relatie heeft steeds een richting van het opwaartse naar het afwaartse onderdeel."	""	"Sluit aan op"	"Deze relatie geeft aan hoe 2 onderdelen in horizontale zin elkaar opvolgen. Dit wordt gebruikt om een topologische netwerk op te bouwen. Enkel in gebruik bij afschermende constructies en riolering/waterlopen. Deze relatie heeft steeds een richting van het opwaartse naar het afwaartse onderdeel."	""	""	"true"	"https://wegenenverkeer.data.vlaanderen.be/ns/onderdeel#"	"SluitAanOp"	"http://www.w3.org/2000/01/rdf-schema#Class"	""	""	""	""	""
"CLASS"	"OSLO-Onderdeel"	"Sturing"	"{13A4F9E6-F804-4033-81E8-9BC04BDF0DE7}"	""	""	""	""	"Sturing"	"Deze relatie geeft aan of er een of andere vorm van dataverkeer is tussen 2 onderdelen. Een wegverlichtingstoestel dat aan staat wordt ook als sturing beschouwd, in dit geval is het een lang ononderbroken elektrisch aan-signaal. Deze relatie heeft geen richting."	""	"Sturing"	"Deze relatie geeft aan of er een of andere vorm van dataverkeer is tussen 2 onderdelen. Een wegverlichtingstoestel dat aan staat wordt ook als sturing beschouwd, in dit geval is het een lang ononderbroken elektrisch aan-signaal. Deze relatie heeft geen richting."	""	""	"true"	"https://wegenenverkeer.data.vlaanderen.be/ns/onderdeel#"	"Sturing"	"http://www.w3.org/2000/01/rdf-schema#Class"	""	""	""	""	""
"CLASS"	"OSLO-Onderdeel"	"Voedt"	"{8AA83131-996E-4433-96B7-609D2D41C2F7}"	""	""	""	""	"Voedt"	"Deze relatie wordt enkel gelegd naar onderdelen die permanent onder spanning staan in normaal bedrijf. Aan deze relatie wordt steeds een richting toegekend van de voedinggever naar de ontvanger."	""	"Voedt"	"Deze relatie wordt enkel gelegd naar onderdelen die permanent onder spanning staan in normaal bedrijf. Aan deze relatie wordt steeds een richting toegekend van de voedinggever naar de ontvanger."	""	""	"true"	"https://wegenenverkeer.data.vlaanderen.be/ns/onderdeel#"	"Voedt"	"http://www.w3.org/2000/01/rdf-schema#Class"	""	""	""	""	""
"DATATYPE"	"OSLO-Implementatieelement"	"DtcAWVIdentificator"	"{0A270AE5-3C56-44b7-8B06-DBC66BD6EB66}"	""	""	""	""	"AWV-identificator"	"Complex datatype voor de identifictor van het AWV-object."	""	"AWV-identificator"	"Complex datatype voor de identifictor van het AWV-object."	""	""	"true"	"https://wegenenverkeer.data.vlaanderen.be/ns/implementatieelement#"	"DtcAWVIdentificator"	"http://www.w3.org/2000/01/rdf-schema#Class"	""	""	""	""	""
"DATATYPE"	"OSLO-Implementatieelement"	"DtcDocument"	"{441527E2-4B20-4bca-899E-9DC151A2A981}"	""	""	""	""	"Bestandsbijlage"	"Complex datatype voor alle bestandsbijlages"	""	"Bestandsbijlage"	"Complex datatype voor alle bestandsbijlages"	""	""	"true"	"https://wegenenverkeer.data.vlaanderen.be/ns/implementatieelement#"	"DtcDocument"	"http://www.w3.org/2000/01/rdf-schema#Class"	""	""	""	""	""
"ENUMERATION"	"OSLO-Implementatieelement"	"KlAlgMimeType"	"{9BCD2B4C-9CAB-4988-A052-6C4B006D450A}"	""	""	""	""	"Mimetype"	"De mime types van bestanden (AWVDocument) beperkt tot mime types voor toegelaten bestandstypen."	""	"Mimetype"	"De mime types van bestanden (AWVDocument) beperkt tot mime types voor toegelaten bestandstypen."	""	"https://wegenenverkeer.data.vlaanderen.be/id/conceptscheme/KlAlgMimeType"	"true"	"http://www.w3.org/2004/02/skos/core#"	"Concept"	"http://www.w3.org/2000/01/rdf-schema#Class"	""	""	""	""	""
"DATATYPE"	"OSLO-Implementatieelement"	"DteIPv4Adres"	"{AF96DFD7-4CAA-488b-A873-A338795310EB}"	""	""	""	""	"IPv4-adres"	"Beschrijft een ip-adres volgens de ipv4 specificatie."	""	"IPv4-adres"	"Beschrijft een ip-adres volgens de ipv4 specificatie."	""	""	"true"	"https://wegenenverkeer.data.vlaanderen.be/ns/implementatieelement#"	"DteIPv4Adres"	"http://www.w3.org/2000/01/rdf-schema#Class"	""	""	""	""	""
"DATATYPE"	"OSLO-Implementatieelement"	"DteTekstblok"	"{E5E67991-BD15-468d-A90F-26B3A0821EF1}"	""	""	""	""	"Tekstblok"	"Een tekst welke uit meerdere zinnen bestaat, en ook regeleindes kan bevatten. Een tekstblok bevat maximaal 65.000 karakters."	""	"Tekstblok"	"Een tekst welke uit meerdere zinnen bestaat, en ook regeleindes kan bevatten. Een tekstblok bevat maximaal 65.000 karakters."	""	""	"true"	"https://wegenenverkeer.data.vlaanderen.be/ns/implementatieelement#"	"DteTekstblok"	"http://www.w3.org/2000/01/rdf-schema#Class"	""	""	""	""	""
"DATATYPE"	"OSLO-Implementatieelement"	"KwantWrdInWatt"	"{003FB507-CE8D-44a3-B5A2-D509E3D76463}"	""	""	""	""	"Kwantitatieve waarde in Watt"	"Een kwantitatieve waarde die een getal in Watt uitdrukt."	""	"Kwantitatieve waarde in Watt"	"Een kwantitatieve waarde die een getal in Watt uitdrukt."	""	""	"true"	"https://wegenenverkeer.data.vlaanderen.be/ns/implementatieelement#"	"KwantWrdInWatt"	"http://www.w3.org/2000/01/rdf-schema#Class"	""	""	""	""	""
"DATATYPE"	"OSLO-Implementatieelement"	"KwantWrdInKubiekeMeter"	"{1AF0D461-DFD1-4a5d-BF31-2A3D2E183A2C}"	""	""	""	""	"Kwantitatieve waarde in kubieke meter"	"Een kwantitatieve waarde die een getal in kubieke meter uitdrukt."	""	"Kwantitatieve waarde in kubieke meter"	"Een kwantitatieve waarde die een getal in kubieke meter uitdrukt."	""	""	"true"	"https://wegenenverkeer.data.vlaanderen.be/ns/implementatieelement#"	"KwantWrdInKubiekeMeter"	"http://www.w3.org/2000/01/rdf-schema#Class"	""	""	""	""	""
"DATATYPE"	"OSLO-Implementatieelement"	"KwantWrdInInch"	"{27AB8F9D-4D87-4a2e-9FB6-DA49DED904A7}"	""	""	""	""	"Kwantitatieve waarde in inch"	"Een kwantitatieve waarde die een getal in inches uitdrukt."	""	"Kwantitatieve waarde in inch"	"Een kwantitatieve waarde die een getal in inches uitdrukt."	""	""	"true"	"https://wegenenverkeer.data.vlaanderen.be/ns/implementatieelement#"	"KwantWrdInInch"	"http://www.w3.org/2000/01/rdf-schema#Class"	""	""	""	""	""
"DATATYPE"	"OSLO-Implementatieelement"	"KwantWrdInMeter"	"{30A575B2-90E9-4879-A70F-2DE16F53B112}"	""	""	""	""	"Kwantitatieve waarde in meter"	"Een kwantitatieve waarde die een getal in meter uitdrukt."	""	"Kwantitatieve waarde in meter"	"Een kwantitatieve waarde die een getal in meter uitdrukt."	""	""	"true"	"https://wegenenverkeer.data.vlaanderen.be/ns/implementatieelement#"	"KwantWrdInMeter"	"http://www.w3.org/2000/01/rdf-schema#Class"	""	""	""	""	""
"DATATYPE"	"OSLO-Implementatieelement"	"KwantWrdInMeterTAW"	"{3944F347-842A-4743-A0D5-4560367372CF}"	""	""	""	""	"Kwantitatieve waarde in meter TAW"	"Geeft de hoogte weer van een locatie in meter tov het TAW-referentiepeil."	""	"Kwantitatieve waarde in meter TAW"	"Geeft de hoogte weer van een locatie in meter tov het TAW-referentiepeil."	""	""	"true"	"https://wegenenverkeer.data.vlaanderen.be/ns/implementatieelement#"	"KwantWrdInMeterTAW"	"http://www.w3.org/2000/01/rdf-schema#Class"	""	""	""	""	""
"DATATYPE"	"OSLO-Implementatieelement"	"KwantWrdInCentimeter"	"{4EDCC34B-4D09-4eac-9B1C-78B67973D1B1}"	""	""	""	""	"Kwantitatieve waarde in centimeter"	"Een kwantitatieve waarde die een getal in centimeter uitdrukt."	""	"Kwantitatieve waarde in centimeter"	"Een kwantitatieve waarde die een getal in centimeter uitdrukt."	""	""	"true"	"https://wegenenverkeer.data.vlaanderen.be/ns/implementatieelement#"	"KwantWrdInCentimeter"	"http://www.w3.org/2000/01/rdf-schema#Class"	""	""	""	""	""
"DATATYPE"	"OSLO-Implementatieelement"	"KwantWrdInVolt"	"{626F9E60-BDB9-449d-9A52-1A576DEBC804}"	""	""	""	""	"Kwantitatieve waarde in Volt"	"Een kwantitatieve waarde die een getal in Volt uitdrukt."	""	"Kwantitatieve waarde in Volt"	"Een kwantitatieve waarde die een getal in Volt uitdrukt."	""	""	"true"	"https://wegenenverkeer.data.vlaanderen.be/ns/implementatieelement#"	"KwantWrdInVolt"	"http://www.w3.org/2000/01/rdf-schema#Class"	""	""	""	""	""
"DATATYPE"	"OSLO-Implementatieelement"	"KwantWrdInBar"	"{94556852-F9D2-4a84-ADBC-CB2DC3940952}"	""	""	""	""	"Kwantitatieve waarde in bar"	"Een kwantitatieve waarde die een getal in bar uitdrukt."	""	"Kwantitatieve waarde in bar"	"Een kwantitatieve waarde die een getal in bar uitdrukt."	""	""	"true"	"https://wegenenverkeer.data.vlaanderen.be/ns/implementatieelement#"	"KwantWrdInBar"	"http://www.w3.org/2000/01/rdf-schema#Class"	""	""	""	""	""
"DATATYPE"	"OSLO-Implementatieelement"	"KwantWrdInMillimeter"	"{AE04A0C4-258A-4401-B823-305832B572AC}"	""	""	""	""	"Kwantitatieve waarde in millimeter"	"Een kwantitatieve waarde die een getal in millimeter uitdrukt."	""	"Kwantitatieve waarde in millimeter"	"Een kwantitatieve waarde die een getal in millimeter uitdrukt."	""	""	"true"	"https://wegenenverkeer.data.vlaanderen.be/ns/implementatieelement#"	"KwantWrdInMillimeter"	"http://www.w3.org/2000/01/rdf-schema#Class"	""	""	""	""	""
"DATATYPE"	"OSLO-Implementatieelement"	"KwantWrdInPromille"	"{F32D092A-501E-4b6f-8C06-6B32E16A2460}"	""	""	""	""	"Kwantitatieve waarde in promille"	"Een kwantitatieve waarde die een getal in promille uitdrukt."	""	"Kwantitatieve waarde in promille"	"Een kwantitatieve waarde die een getal in promille uitdrukt."	""	""	"true"	"https://wegenenverkeer.data.vlaanderen.be/ns/implementatieelement#"	"KwantWrdInPromille"	"http://www.w3.org/2000/01/rdf-schema#Class"	""	""	""	""	""
"DATATYPE"	"OSLO-Implementatieelement"	"KwantWrdInKiloWatt"	"{FF8D3C52-55DD-4d6e-8089-B460090DED26}"	""	""	""	""	"Kwantitatieve waarde in kilowatt"	"Een kwantitatieve waarde die een getal in kilowatt uitdrukt."	""	"Kwantitatieve waarde in kilowatt"	"Een kwantitatieve waarde die een getal in kilowatt uitdrukt."	""	""	"true"	"https://wegenenverkeer.data.vlaanderen.be/ns/implementatieelement#"	"KwantWrdInKiloWatt"	"http://www.w3.org/2000/01/rdf-schema#Class"	""	""	""	""	""
"ENUMERATION"	"OSLO-Onderdeel"	"KlPersleidingMateriaal"	"{7A7ADBE3-2F34-4fc7-A3B3-B2BF5B349599}"	""	""	""	""	"Persleiding materiaal"	"Materialen van de persleiding"	""	"Persleiding materiaal"	"Materialen van de persleiding"	""	"https://wegenenverkeer.data.vlaanderen.be/id/conceptscheme/KlPersleidingMateriaal"	"true"	"http://www.w3.org/2004/02/skos/core#"	"Concept"	"http://www.w3.org/2000/01/rdf-schema#Class"	""	""	""	""	""
"ENUMERATION"	"OSLO-Onderdeel"	"KlRioleringVorm"	"{ADF6CDE3-502C-46bb-9547-EC6E58655245}"	""	""	""	""	"Riolering vorm"	"Vormen van de riolering."	""	"Riolering vorm"	"Vormen van de riolering."	""	"https://wegenenverkeer.data.vlaanderen.be/id/conceptscheme/KlRioleringVorm"	"true"	"http://www.w3.org/2004/02/skos/core#"	"Concept"	"http://www.w3.org/2000/01/rdf-schema#Class"	""	""	""	""	""
"ENUMERATION"	"OSLO-Onderdeel"	"KlBrandhaspelMerk"	"{2D4B5CE0-7C0D-47f0-A1C2-C6C604ACC45C}"	""	""	""	""	"Brandhaspel merk"	"Keuzelijst met merken voor brandhaspels"	""	"Brandhaspel merk"	"Keuzelijst met merken voor brandhaspels"	""	"https://wegenenverkeer.data.vlaanderen.be/id/conceptscheme/KlBrandhaspelMerk"	"true"	"http://www.w3.org/2004/02/skos/core#"	"Concept"	"http://www.w3.org/2000/01/rdf-schema#Class"	""	""	""	""	""
"ENUMERATION"	"OSLO-Onderdeel"	"KlHydrantKoppeling"	"{EEC45766-8E12-44ce-A114-3CA05DC3FC4A}"	""	""	""	""	"Hydrant koppeling"	"Keuzelijst met types koppelingen van hydranten"	""	"Hydrant koppeling"	"Keuzelijst met types koppelingen van hydranten"	""	"https://wegenenverkeer.data.vlaanderen.be/id/conceptscheme/KlHydrantKoppeling"	"true"	"http://www.w3.org/2004/02/skos/core#"	"Concept"	"http://www.w3.org/2000/01/rdf-schema#Class"	""	""	""	""	""
"ENUMERATION"	"OSLO-Onderdeel"	"KlBrandhaspelModelnaam"	"{26C6285E-B8BD-497d-AB97-B36B4CDB01D0}"	""	""	""	""	"brandhaspel model naam"	"Keuzelijst met modelnamen voor brandhaspels van alle relevante merken."	""	"brandhaspel model naam"	"Keuzelijst met modelnamen voor brandhaspels van alle relevante merken."	""	"https://wegenenverkeer.data.vlaanderen.be/id/conceptscheme/KlBrandhaspelModelnaam"	"true"	"http://www.w3.org/2004/02/skos/core#"	"Concept"	"http://www.w3.org/2000/01/rdf-schema#Class"	""	""	""	""	""
"ENUMERATION"	"OSLO-Onderdeel"	"KlVerwarmingselementModelnaam"	"{86C38E4A-D5E5-443b-8790-593464270EBD}"	""	""	""	""	"Verwarmingselement model naam"	"Keuzelijst van modellen van verwarmingselementen voor alle relevante merken"	""	"Verwarmingselement model naam"	"Keuzelijst van modellen van verwarmingselementen voor alle relevante merken"	""	"https://wegenenverkeer.data.vlaanderen.be/id/conceptscheme/KlVerwarmingselementModelnaam"	"true"	"http://www.w3.org/2004/02/skos/core#"	"Concept"	"http://www.w3.org/2000/01/rdf-schema#Class"	""	""	""	""	""
"ENUMERATION"	"OSLO-Onderdeel"	"KlVerwarmingselementMerk"	"{D428470A-D193-4867-B248-EE4AD261F48C}"	""	""	""	""	"Verwarmingselement merk"	"Keuzelijst van merken voor verwarmingselementen"	""	"Verwarmingselement merk"	"Keuzelijst van merken voor verwarmingselementen"	""	"https://wegenenverkeer.data.vlaanderen.be/id/conceptscheme/KlVerwarmingselementMerk"	"true"	"http://www.w3.org/2004/02/skos/core#"	"Concept"	"http://www.w3.org/2000/01/rdf-schema#Class"	""	""	""	""	""
"ENUMERATION"	"OSLO-Onderdeel"	"KlIOType"	"{29A7FB62-B9D3-486e-A6CF-B86DFE1CAB42}"	""	""	""	""	"IO type"	"TODO"	""	"IO type"	"TODO"	""	"https://wegenenverkeer.data.vlaanderen.be/id/conceptscheme/KlIOType"	"true"	"http://www.w3.org/2004/02/skos/core#"	"Concept"	"http://www.w3.org/2000/01/rdf-schema#Class"	""	""	""	""	""
"ENUMERATION"	"OSLO-Onderdeel"	"KlIOBitSnelheid"	"{36B747D5-14D1-4ad5-BF61-D0FB3A76CEEC}"	""	""	""	""	"IO bit snelheid"	"TODO"	""	"IO bit snelheid"	"TODO"	""	"https://wegenenverkeer.data.vlaanderen.be/id/conceptscheme/KlIOBitSnelheid"	"true"	"http://www.w3.org/2004/02/skos/core#"	"Concept"	"http://www.w3.org/2000/01/rdf-schema#Class"	""	""	""	""	""
"ENUMERATION"	"OSLO-Onderdeel"	"KlPLCModelnaam"	"{58CD147C-BCE9-46f7-9845-463F78099217}"	""	""	""	""	"PLC model"	"TODO"	""	"PLC model"	"TODO"	""	"https://wegenenverkeer.data.vlaanderen.be/id/conceptscheme/KlPLCModelnaam"	"true"	"http://www.w3.org/2004/02/skos/core#"	"Concept"	"http://www.w3.org/2000/01/rdf-schema#Class"	""	""	""	""	""
"ENUMERATION"	"OSLO-Onderdeel"	"KlPLCMerk"	"{E1176C80-4212-4282-B9C9-0E598AE01909}"	""	""	""	""	"PLC merk"	"TODO"	""	"PLC merk"	"TODO"	""	"https://wegenenverkeer.data.vlaanderen.be/id/conceptscheme/KlPLCMerk"	"true"	"http://www.w3.org/2004/02/skos/core#"	"Concept"	"http://www.w3.org/2000/01/rdf-schema#Class"	""	""	""	""	""
"ENUMERATION"	"OSLO-Onderdeel"	"KlIOSignaaltype"	"{AC27D3F0-DC0A-4a64-B1E1-D452878068F1}"	""	""	""	""	"IO signaaltype"	"TODO"	""	"IO signaaltype"	"TODO"	""	"https://wegenenverkeer.data.vlaanderen.be/id/conceptscheme/KlIOSignaaltype"	"true"	"http://www.w3.org/2004/02/skos/core#"	"Concept"	"http://www.w3.org/2000/01/rdf-schema#Class"	""	""	""	""	""
"DATATYPE"	"W3-XML-Schema"	"Date"	"{518CF17E-69E2-4b04-BFC0-208BB4C618A2}"	""	""	""	""	"Datum"	"Beschrijft een datum volgens https://www.w3.org/2001/XMLSchema#date"	"https://www.w3.org/2001/XMLSchema#date"	"Datum"	"Beschrijft een datum volgens https://www.w3.org/2001/XMLSchema#date"	""	""	"true"	"https://www.w3.org/2001/XMLSchema#"	"date"	"http://www.w3.org/2000/01/rdf-schema#Class"	""	""	""	""	""
"DATATYPE"	"W3-XML-Schema"	"AnyURI"	"{720ACC1F-344F-43bb-9B65-5467749150DD}"	""	""	""	""	"URI"	"Een tekstwaarde die een verwijzing naar meer informatie van het element bevat volgens https://www.w3.org/2001/XMLSchema#anyURI ."	"https://www.w3.org/2001/XMLSchema#anyURI"	"URI"	"Een tekstwaarde die een verwijzing naar meer informatie van het element bevat volgens https://www.w3.org/2001/XMLSchema#anyURI ."	""	""	"true"	"https://www.w3.org/2001/XMLSchema#"	"anyURI"	"http://www.w3.org/2000/01/rdf-schema#Class"	""	""	""	""	""
"DATATYPE"	"W3-XML-Schema"	"String"	"{9154C721-7D7C-4c11-8FBF-C56FAEF9A4DA}"	""	""	""	""	"String"	"Beschrijft een tekstregel volgens https://www.w3.org/2001/XMLSchema#string"	"https://www.w3.org/2001/XMLSchema#string"	"String"	"Beschrijft een tekstregel volgens https://www.w3.org/2001/XMLSchema#string"	""	""	"true"	"https://www.w3.org/2001/XMLSchema#"	"string"	"http://www.w3.org/2000/01/rdf-schema#Class"	""	""	""	""	""
