"EA-Type"	"EA-Package"	"EA-Name"	"EA-GUID"	"EA-Parent"	"EA-Domain"	"EA-Domain-GUID"	"EA-Range"	"label"	"definition"	"usage"	"ap-label-nl"	"ap-definition-nl"	"ap-usageNote-nl"	"ap-codelist"	"external term"	"namespace"	"localname"	"type"	"domain"	"range"	"parent"	"min card"	"max card"
"ENUMERATION"	"OSLO-Onderdeel"	"KlLEACSnelheidsklasse"	"{37346205-6A4A-4ea2-AA77-D564BEC82063}"	""	""	""	""	"Snelheidsklasse"	"De verschillende snelheidsklasses van afschermende constructies"	""	"Snelheidsklasse"	"De verschillende snelheidsklasses van afschermende constructies"	""	"https://wegenenverkeer-test.data.vlaanderen.be/id/conceptscheme/KlLEACSnelheidsklasse"	"true"	"http://www.w3.org/2004/02/skos/core#"	"Concept"	"http://www.w3.org/2000/01/rdf-schema#Class"	""	""	""	""	""
"ENUMERATION"	"OSLO-Onderdeel"	"KlLEACUitbuigingstype"	"{5B3C9692-D727-4588-B067-3E07276EB4C2}"	""	""	""	""	"Uitbuigingstype"	"De mogelijke uitbuigingstypes."	""	"Uitbuigingstype"	"De mogelijke uitbuigingstypes."	""	"https://wegenenverkeer-test.data.vlaanderen.be/id/conceptscheme/KlLEACUitbuigingstype"	"true"	"http://www.w3.org/2004/02/skos/core#"	"Concept"	"http://www.w3.org/2000/01/rdf-schema#Class"	""	""	""	""	""
"ENUMERATION"	"OSLO-Onderdeel"	"KlLEACWerkingsbreedte"	"{22BB0CD4-8FA8-49fe-85A3-983AD45092F0}"	""	""	""	""	"Werkingsbreedte"	"De verschillende mogelijke werkingsbreedtes."	""	"Werkingsbreedte"	"De verschillende mogelijke werkingsbreedtes."	""	"https://wegenenverkeer-test.data.vlaanderen.be/id/conceptscheme/KlLEACWerkingsbreedte"	"true"	"http://www.w3.org/2004/02/skos/core#"	"Concept"	"http://www.w3.org/2000/01/rdf-schema#Class"	""	""	""	""	""
"ENUMERATION"	"OSLO-Onderdeel"	"KlLEACTypeEindstuk"	"{7194246B-89A6-4e02-A069-3E937CBC4E61}"	""	""	""	""	"Type eindstuk"	"De verschillende types eindstukken"	""	"Type eindstuk"	"De verschillende types eindstukken"	""	"https://wegenenverkeer-test.data.vlaanderen.be/id/conceptscheme/KlLEACTypeEindstuk"	"true"	"http://www.w3.org/2004/02/skos/core#"	"Concept"	"http://www.w3.org/2000/01/rdf-schema#Class"	""	""	""	""	""
"ENUMERATION"	"OSLO-Onderdeel"	"KlLEACObstakelbeveiligerType"	"{CBBA376C-F08D-447e-AE20-95C8BF405302}"	""	""	""	""	"Obstakelbeveiliger type"	"De verschillende types van obstakelbeveiliger"	""	"Obstakelbeveiliger type"	"De verschillende types van obstakelbeveiliger"	""	"https://wegenenverkeer-test.data.vlaanderen.be/id/conceptscheme/KlLEACObstakelbeveiligerType"	"true"	"http://www.w3.org/2004/02/skos/core#"	"Concept"	"http://www.w3.org/2000/01/rdf-schema#Class"	""	""	""	""	""
"ENUMERATION"	"OSLO-Onderdeel"	"KlPictogramSymbool"	"{4389F7A5-0508-4f25-92A2-2BB1C83F9C0F}"	""	""	""	""	"Pictogram symbool"	"De mogelijke symbolen op het pictogram."	""	"Pictogram symbool"	"De mogelijke symbolen op het pictogram."	""	"https://wegenenverkeer-test.data.vlaanderen.be/id/conceptscheme/KlPictogramSymbool"	"true"	"http://www.w3.org/2004/02/skos/core#"	"Concept"	"http://www.w3.org/2000/01/rdf-schema#Class"	""	""	""	""	""
"ENUMERATION"	"OSLO-Onderdeel"	"KlHelling"	"{ECDABF34-7594-424c-9582-40D5A177E954}"	""	""	""	""	"Helling"	"Kwarten voor het bepalen van de hellingsgraad."	""	"Helling"	"Kwarten voor het bepalen van de hellingsgraad."	""	"https://wegenenverkeer-test.data.vlaanderen.be/id/conceptscheme/KlHelling"	"true"	"http://www.w3.org/2004/02/skos/core#"	"Concept"	"http://www.w3.org/2000/01/rdf-schema#Class"	""	""	""	""	""
"ENUMERATION"	"OSLO-Onderdeel"	"KlLEGCOpeningType"	"{A6769257-DD01-4971-9B9F-B9A7BACCDC7A}"	""	""	""	""	"Opening type"	"Types van opening."	""	"Opening type"	"Types van opening."	""	"https://wegenenverkeer-test.data.vlaanderen.be/id/conceptscheme/KlLEGCOpeningType"	"true"	"http://www.w3.org/2004/02/skos/core#"	"Concept"	"http://www.w3.org/2000/01/rdf-schema#Class"	""	""	""	""	""
"ENUMERATION"	"OSLO-Onderdeel"	"KlLEGCSchermelementType"	"{1ECEA54D-EC25-4c01-A313-803BF1E2B07D}"	""	""	""	""	"Schermelement type"	"Schermelement types."	""	"Schermelement type"	"Schermelement types."	""	"https://wegenenverkeer-test.data.vlaanderen.be/id/conceptscheme/KlLEGCSchermelementType"	"true"	"http://www.w3.org/2004/02/skos/core#"	"Concept"	"http://www.w3.org/2000/01/rdf-schema#Class"	""	""	""	""	""
"ENUMERATION"	"OSLO-Onderdeel"	"KlLEGCSchermtype"	"{4E840206-CC06-470a-84D9-624A5D97A7EA}"	""	""	""	""	"Schermtype"	"De mogelijke schermtypes (vlak,niet-vlak)"	""	"Schermtype"	"De mogelijke schermtypes (vlak,niet-vlak)"	""	"https://wegenenverkeer-test.data.vlaanderen.be/id/conceptscheme/KlLEGCSchermtype"	"true"	"http://www.w3.org/2004/02/skos/core#"	"Concept"	"http://www.w3.org/2000/01/rdf-schema#Class"	""	""	""	""	""
"ENUMERATION"	"OSLO-Onderdeel"	"KlLEGCGeluidskarakteristiek"	"{9F1392B8-90DF-4afd-A1E6-A585593B4783}"	""	""	""	""	"Geluidskarakteristiek"	"De geluidskarakteristieken van de geluidswerende constructie."	""	"Geluidskarakteristiek"	"De geluidskarakteristieken van de geluidswerende constructie."	""	"https://wegenenverkeer-test.data.vlaanderen.be/id/conceptscheme/KlLEGCGeluidskarakteristiek"	"true"	"http://www.w3.org/2004/02/skos/core#"	"Concept"	"http://www.w3.org/2000/01/rdf-schema#Class"	""	""	""	""	""
"ENUMERATION"	"OSLO-Onderdeel"	"KlLEGCMateriaal"	"{213BABA3-8B3D-4994-BEB1-1D3CC571749A}"	""	""	""	""	"Materiaal"	"Materialen van de geluidswerende constructie."	""	"Materiaal"	"Materialen van de geluidswerende constructie."	""	"https://wegenenverkeer-test.data.vlaanderen.be/id/conceptscheme/KlLEGCMateriaal"	"true"	"http://www.w3.org/2004/02/skos/core#"	"Concept"	"http://www.w3.org/2000/01/rdf-schema#Class"	""	""	""	""	""
"ENUMERATION"	"OSLO-Onderdeel"	"KlLEGCOpstelling"	"{0D871A33-4B84-4d9c-9B28-E86E8D8EE501}"	""	""	""	""	"Opstelling"	"De opstellingen van de geluidswerende constructie."	""	"Opstelling"	"De opstellingen van de geluidswerende constructie."	""	"https://wegenenverkeer-test.data.vlaanderen.be/id/conceptscheme/KlLEGCOpstelling"	"true"	"http://www.w3.org/2004/02/skos/core#"	"Concept"	"http://www.w3.org/2000/01/rdf-schema#Class"	""	""	""	""	""
"ENUMERATION"	"OSLO-Onderdeel"	"KlLaagRol"	"{CA2B0BF9-E4F4-4362-A11A-E063D70EAA48}"	""	""	""	""	"Laag rol"	"De mogelijke rollen van de laag."	""	"Laag rol"	"De mogelijke rollen van de laag."	""	"https://wegenenverkeer-test.data.vlaanderen.be/id/conceptscheme/KlLaagRol"	"true"	"http://www.w3.org/2004/02/skos/core#"	"Concept"	"http://www.w3.org/2000/01/rdf-schema#Class"	""	""	""	""	""
"ENUMERATION"	"OSLO-Onderdeel"	"KlLEACUitzettingswaardeDilatatie"	"{852C38C2-484A-4b08-9626-4D0252CE9A67}"	""	""	""	""	"Uitzetttingswaarde dilatatie"	"De grootst mogelijke uitzetting die mogelijk is voor een bepaalde dilatatieoplossing."	""	"Uitzetttingswaarde dilatatie"	"De grootst mogelijke uitzetting die mogelijk is voor een bepaalde dilatatieoplossing."	""	"https://wegenenverkeer-test.data.vlaanderen.be/id/conceptscheme/KlLEACUitzettingswaardeDilatatie"	"true"	"http://www.w3.org/2004/02/skos/core#"	"Concept"	"http://www.w3.org/2000/01/rdf-schema#Class"	""	""	""	""	""
"ENUMERATION"	"OSLO-Onderdeel"	"KlRetroreflecterendVerkeersbordAfwerkingsgraad"	"{E86FEE05-2299-4a37-89F4-F5100536ADB3}"	""	""	""	""	"Keuzelijst afwerkingsgraad retroreflecterend verkeersbord"	"Keuzeopties om de afwerkingsgraad van een RetroreflecterendVerkeersbord aan te geven volgens SB250."	""	"Keuzelijst afwerkingsgraad retroreflecterend verkeersbord"	"Keuzeopties om de afwerkingsgraad van een RetroreflecterendVerkeersbord aan te geven volgens SB250."	""	"https://wegenenverkeer-test.data.vlaanderen.be/id/conceptscheme/KlRetroreflecterendVerkeersbordAfwerkingsgraad"	"true"	"http://www.w3.org/2004/02/skos/core#"	"Concept"	"http://www.w3.org/2000/01/rdf-schema#Class"	""	""	""	""	""
"ENUMERATION"	"OSLO-Onderdeel"	"KlRetroreflecterendVerkeersbordGrootteorde"	"{6B26715D-1D82-4b01-A75B-D403782C56D0}"	""	""	""	""	"Retroreflecterend verkeersbord grootteorde"	"Opties om de grootteorde van een RetroreflecterendVerkeersbord aan te geven zoals gedefinieerd in SB250."	""	"Retroreflecterend verkeersbord grootteorde"	"Opties om de grootteorde van een RetroreflecterendVerkeersbord aan te geven zoals gedefinieerd in SB250."	""	"https://wegenenverkeer-test.data.vlaanderen.be/id/conceptscheme/KlRetroreflecterendVerkeersbordGrootteorde"	"true"	"http://www.w3.org/2004/02/skos/core#"	"Concept"	"http://www.w3.org/2000/01/rdf-schema#Class"	""	""	""	""	""
"ENUMERATION"	"OSLO-Onderdeel"	"KlRetroreflecterendVerkeersbordMerk"	"{3140F783-549E-4cee-885D-0D3EF9559005}"	""	""	""	""	"Retroreflecterend Verkeersbord Merk"	"Keuzelijst met merknamen van retroreflecterende verkeersborden. De merknaam duidt op de leverancier of producent van het verkeersbord."	""	"Retroreflecterend Verkeersbord Merk"	"Keuzelijst met merknamen van retroreflecterende verkeersborden. De merknaam duidt op de leverancier of producent van het verkeersbord."	""	"https://wegenenverkeer-test.data.vlaanderen.be/id/conceptscheme/KlRetroreflecterendVerkeersbordMerk"	"true"	"http://www.w3.org/2004/02/skos/core#"	"Concept"	"http://www.w3.org/2000/01/rdf-schema#Class"	""	""	""	""	""
"ENUMERATION"	"OSLO-Onderdeel"	"KlOperationeleStatus"	"{643F40B5-BED5-41d9-8F0A-495874E4E173}"	""	""	""	""	"Keuzelijst operationele status"	"Operationele status codes."	""	"Keuzelijst operationele status"	"Operationele status codes."	""	"https://wegenenverkeer-test.data.vlaanderen.be/id/conceptscheme/KlOperationeleStatus"	"true"	"http://www.w3.org/2004/02/skos/core#"	"Concept"	"http://www.w3.org/2000/01/rdf-schema#Class"	""	""	""	""	""
"ENUMERATION"	"OSLO-Onderdeel"	"KlKleurReflector"	"{EB98640E-A032-4985-8FFF-7154D78F27B3}"	""	""	""	""	"Kleur reflector"	"Kleuropties voor de reflector."	""	"Kleur reflector"	"Kleuropties voor de reflector."	""	"https://wegenenverkeer-test.data.vlaanderen.be/id/conceptscheme/KlKleurReflector"	"true"	"http://www.w3.org/2004/02/skos/core#"	"Concept"	"http://www.w3.org/2000/01/rdf-schema#Class"	""	""	""	""	""
"ENUMERATION"	"OSLO-Onderdeel"	"KlZonnepaneelMerk"	"{DEFD1640-B297-419d-970B-663D72802B2C}"	""	""	""	""	"Zonnepaneel merk"	"Het merk van het zonnepaneel."	""	"Zonnepaneel merk"	"Het merk van het zonnepaneel."	""	"https://wegenenverkeer-test.data.vlaanderen.be/id/conceptscheme/KlZonnepaneelMerk"	"true"	"http://www.w3.org/2004/02/skos/core#"	"Concept"	"http://www.w3.org/2000/01/rdf-schema#Class"	""	""	""	""	""
"ENUMERATION"	"OSLO-Onderdeel"	"KlZonnepaneelModelnaam"	"{CDE27A6A-FD58-4184-82C7-9D2DA63EF545}"	""	""	""	""	"Zonnepaneel modelnaam"	"De modelnaam van het zonnepaneel."	""	"Zonnepaneel modelnaam"	"De modelnaam van het zonnepaneel."	""	"https://wegenenverkeer-test.data.vlaanderen.be/id/conceptscheme/KlZonnepaneelModelnaam"	"true"	"http://www.w3.org/2004/02/skos/core#"	"Concept"	"http://www.w3.org/2000/01/rdf-schema#Class"	""	""	""	""	""
"CLASS"	"OSLO-Onderdeel"	"HoortBij"	"{90BADDC8-57A6-4ebf-8B41-F029FFBAEF24}"	""	""	""	""	"Hoort bij"	"De relatie geeft aan dat een onderdeel of collectie behoort bij,deel van of lid van een (andere) groep of collectie is."	""	"Hoort bij"	"De relatie geeft aan dat een onderdeel of collectie behoort bij,deel van of lid van een (andere) groep of collectie is."	""	""	"true"	"https://wegenenverkeer-test.data.vlaanderen.be/ns/onderdeel#"	"HoortBij"	"http://www.w3.org/2000/01/rdf-schema#Class"	""	""	"https://wegenenverkeer-test.data.vlaanderen.be/ns/implementatieelement#DirectioneleRelatie"	""	""
"CLASS"	"OSLO-Onderdeel"	"SluitAanOp"	"{AAC28383-7F08-4b62-BECF-8A2FEE38A5C9}"	""	""	""	""	"Sluit aan op"	"Deze relatie geeft aan hoe 2 onderdelen in horizontale zin elkaar opvolgen. Dit wordt gebruikt om een topologische netwerk op te bouwen. Enkel in gebruik bij afschermende constructies en riolering/waterlopen. Deze relatie heeft steeds een richting van het opwaartse naar het afwaartse onderdeel."	""	"Sluit aan op"	"Deze relatie geeft aan hoe 2 onderdelen in horizontale zin elkaar opvolgen. Dit wordt gebruikt om een topologische netwerk op te bouwen. Enkel in gebruik bij afschermende constructies en riolering/waterlopen. Deze relatie heeft steeds een richting van het opwaartse naar het afwaartse onderdeel."	""	""	"true"	"https://wegenenverkeer-test.data.vlaanderen.be/ns/onderdeel#"	"SluitAanOp"	"http://www.w3.org/2000/01/rdf-schema#Class"	""	""	"https://wegenenverkeer-test.data.vlaanderen.be/ns/implementatieelement#DirectioneleRelatie"	""	""
"CLASS"	"OSLO-Onderdeel"	"Bevestiging"	"{E82F347E-11E7-4292-8B87-2883C98B9BC9}"	""	""	""	""	"Bevestiging"	"Deze relatie geeft aan dat twee onderdelen direct fysiek op elkaar bevestigd zijn. Dit kan zowel aan de buitenkant als aan de binnenkant zijn zoals bv. een camera aan een paal of een laagspanningsbord in een kast. Deze relatie heeft geen richting."	""	"Bevestiging"	"Deze relatie geeft aan dat twee onderdelen direct fysiek op elkaar bevestigd zijn. Dit kan zowel aan de buitenkant als aan de binnenkant zijn zoals bv. een camera aan een paal of een laagspanningsbord in een kast. Deze relatie heeft geen richting."	""	""	"true"	"https://wegenenverkeer-test.data.vlaanderen.be/ns/onderdeel#"	"Bevestiging"	"http://www.w3.org/2000/01/rdf-schema#Class"	""	""	"https://wegenenverkeer-test.data.vlaanderen.be/ns/implementatieelement#NietDirectioneleRelatie"	""	""
"CLASS"	"OSLO-Onderdeel"	"LigtOp"	"{B3042F97-7817-4de4-97C2-E138C2106B2B}"	""	""	""	""	"Ligt op"	"Deze relatie geeft aan dat 2 onderdelen direct fysiek op elkaar liggen. Deze relatie heeft een richting en gaat van het bovenste naar het onderste onderdeel."	""	"Ligt op"	"Deze relatie geeft aan dat 2 onderdelen direct fysiek op elkaar liggen. Deze relatie heeft een richting en gaat van het bovenste naar het onderste onderdeel."	""	""	"true"	"https://wegenenverkeer-test.data.vlaanderen.be/ns/onderdeel#"	"LigtOp"	"http://www.w3.org/2000/01/rdf-schema#Class"	""	""	"https://wegenenverkeer-test.data.vlaanderen.be/ns/implementatieelement#DirectioneleRelatie"	""	""
"attribute"	"OSLO-Abstracten"	"hoogte"	"{2EB2FB2C-2A17-44a1-BF4E-59A098EE6067}"	""	"Fundering"	"{E9A94C16-6AC1-4be7-8F57-6E37B008D9F8}"	"KwantWrdInCentimeter"	"hoogte"	"De afstand tussen het laagste punt van de onderkant en hoogste punt van de bovenkant van de fundering."	""	"hoogte"	"De afstand tussen het laagste punt van de onderkant en hoogste punt van de bovenkant van de fundering."	""	""	"true"	"https://wegenenverkeer-test.data.vlaanderen.be/ns/abstracten#"	"Fundering.hoogte"	"http://www.w3.org/2002/07/owl#ObjectProperty"	"https://wegenenverkeer-test.data.vlaanderen.be/ns/abstracten#Fundering"	"https://wegenenverkeer-test.data.vlaanderen.be/ns/implementatieelement#KwantWrdInCentimeter"	""	"1"	"1"
"attribute"	"OSLO-Onderdeel"	"uitzettingswaarde"	"{1A9E2A83-E759-441c-9FFA-774CE4B2FA43}"	""	"Dilatatie"	"{81E0A154-5FAD-4347-B9C9-0404CE7AD2B2}"	"KlLEACUitzettingswaardeDilatatie"	"Uitzettingswaarde"	"De grootst mogelijke uitzetting die mogelijk is voor een bepaalde dilatatieoplossing."	""	"Uitzettingswaarde"	"De grootst mogelijke uitzetting die mogelijk is voor een bepaalde dilatatieoplossing."	""	""	"true"	"https://wegenenverkeer-test.data.vlaanderen.be/ns/onderdeel#"	"Dilatatie.uitzettingswaarde"	"http://www.w3.org/2002/07/owl#ObjectProperty"	"https://wegenenverkeer-test.data.vlaanderen.be/ns/onderdeel#Dilatatie"	"http://www.w3.org/2004/02/skos/core#Concept"	""	"1"	"1"
"attribute"	"OSLO-Onderdeel"	"afwerkingsgraad"	"{229F407D-7C5E-49e5-B247-52AB8914D967}"	""	"RetroreflecterendVerkeersbord"	"{9991EF82-D9AD-4618-86F6-D97B1FBB2FC8}"	"KlRetroreflecterendVerkeersbordAfwerkingsgraad"	"afwerkingsgraad"	"De afwerkingsgraad van het retroreflecterend verkeersbord, volgens een keuzelijst op basis van SB250."	""	"afwerkingsgraad"	"De afwerkingsgraad van het retroreflecterend verkeersbord, volgens een keuzelijst op basis van SB250."	""	""	"true"	"https://wegenenverkeer-test.data.vlaanderen.be/ns/onderdeel#"	"RetroreflecterendVerkeersbord.afwerkingsgraad"	"http://www.w3.org/2002/07/owl#ObjectProperty"	"https://wegenenverkeer-test.data.vlaanderen.be/ns/onderdeel#RetroreflecterendVerkeersbord"	"http://www.w3.org/2004/02/skos/core#Concept"	""	"1"	"1"
"attribute"	"OSLO-Onderdeel"	"grootteorde"	"{4255A517-3BED-4ee5-90A4-B7E7EE4B0053}"	""	"RetroreflecterendVerkeersbord"	"{9991EF82-D9AD-4618-86F6-D97B1FBB2FC8}"	"KlRetroreflecterendVerkeersbordGrootteorde"	"grootteorde"	"De classificatie naar grootteorde van het verkeersbord, zoals gedefinieerd in SB250 hoofdstuk 10."	""	"grootteorde"	"De classificatie naar grootteorde van het verkeersbord, zoals gedefinieerd in SB250 hoofdstuk 10."	""	""	"true"	"https://wegenenverkeer-test.data.vlaanderen.be/ns/onderdeel#"	"RetroreflecterendVerkeersbord.grootteorde"	"http://www.w3.org/2002/07/owl#ObjectProperty"	"https://wegenenverkeer-test.data.vlaanderen.be/ns/onderdeel#RetroreflecterendVerkeersbord"	"http://www.w3.org/2004/02/skos/core#Concept"	""	"0"	"1"
"attribute"	"OSLO-Onderdeel"	"kleurAchterkant"	"{8992DC14-AE83-4f17-BE2A-DB9FE23C58D0}"	""	"RetroreflecterendVerkeersbord"	"{9991EF82-D9AD-4618-86F6-D97B1FBB2FC8}"	"DteKleurRAL"	"kleur achterkant"	"De kleur van de achterkant van het retroreflecterend verkeersbord."	""	"kleur achterkant"	"De kleur van de achterkant van het retroreflecterend verkeersbord."	""	""	"true"	"https://wegenenverkeer-test.data.vlaanderen.be/ns/onderdeel#"	"RetroreflecterendVerkeersbord.kleurAchterkant"	"http://www.w3.org/2002/07/owl#ObjectProperty"	"https://wegenenverkeer-test.data.vlaanderen.be/ns/onderdeel#RetroreflecterendVerkeersbord"	"https://wegenenverkeer-test.data.vlaanderen.be/ns/implementatieelement#DteKleurRAL"	""	"1"	"1"
"attribute"	"OSLO-Onderdeel"	"merk"	"{9C2D931A-C6BA-4377-8920-8626FF8057DC}"	""	"RetroreflecterendVerkeersbord"	"{9991EF82-D9AD-4618-86F6-D97B1FBB2FC8}"	"KlRetroreflecterendVerkeersbordMerk"	"Merk"	"De merknaam van het verkeersbord; duidt op de leverancier of producent van het verkeersbord."	"Te selecteren uit een keuzelijst."	"Merk"	"De merknaam van het verkeersbord; duidt op de leverancier of producent van het verkeersbord."	""	""	"true"	"https://wegenenverkeer-test.data.vlaanderen.be/ns/onderdeel#"	"RetroreflecterendVerkeersbord.merk"	"http://www.w3.org/2002/07/owl#ObjectProperty"	"https://wegenenverkeer-test.data.vlaanderen.be/ns/onderdeel#RetroreflecterendVerkeersbord"	"http://www.w3.org/2004/02/skos/core#Concept"	""	"1"	"1"
"attribute"	"OSLO-Onderdeel"	"oppervlakte"	"{44078168-5086-4da0-9633-A03A1A1FDE13}"	""	"RetroreflecterendVerkeersbord"	"{9991EF82-D9AD-4618-86F6-D97B1FBB2FC8}"	"KwantWrdInVierkanteMeter"	"oppervlakte"	"De oppervlakte van het beeldvlak van een verkeersbord."	""	"oppervlakte"	"De oppervlakte van het beeldvlak van een verkeersbord."	""	""	"true"	"https://wegenenverkeer-test.data.vlaanderen.be/ns/onderdeel#"	"RetroreflecterendVerkeersbord.oppervlakte"	"http://www.w3.org/2002/07/owl#ObjectProperty"	"https://wegenenverkeer-test.data.vlaanderen.be/ns/onderdeel#RetroreflecterendVerkeersbord"	"https://wegenenverkeer-test.data.vlaanderen.be/ns/implementatieelement#KwantWrdInVierkanteMeter"	""	"0"	"1"
"attribute"	"OSLO-Onderdeel"	"merk"	"{ABBE0AE1-9175-499d-B0D4-D180AD3AE089}"	""	"Zonnepaneel"	"{A2773920-C9D3-42cf-A500-6181ECC37D1F}"	"KlZonnepaneelMerk"	"merk"	"Het merk van het zonnepaneel."	""	"merk"	"Het merk van het zonnepaneel."	""	""	"true"	"https://wegenenverkeer-test.data.vlaanderen.be/ns/onderdeel#"	"Zonnepaneel.merk"	"http://www.w3.org/2002/07/owl#ObjectProperty"	"https://wegenenverkeer-test.data.vlaanderen.be/ns/onderdeel#Zonnepaneel"	"http://www.w3.org/2004/02/skos/core#Concept"	""	"1"	"1"
"attribute"	"OSLO-Onderdeel"	"modelnaam"	"{F42BDBEA-E30F-496d-B768-ED17A06E80BC}"	""	"Zonnepaneel"	"{A2773920-C9D3-42cf-A500-6181ECC37D1F}"	"KlZonnepaneelModelnaam"	"modelnaam"	"De modelnaam van het zonnepaneel."	""	"modelnaam"	"De modelnaam van het zonnepaneel."	""	""	"true"	"https://wegenenverkeer-test.data.vlaanderen.be/ns/onderdeel#"	"Zonnepaneel.modelnaam"	"http://www.w3.org/2002/07/owl#ObjectProperty"	"https://wegenenverkeer-test.data.vlaanderen.be/ns/onderdeel#Zonnepaneel"	"http://www.w3.org/2004/02/skos/core#Concept"	""	"1"	"1"
"attribute"	"OSLO-Onderdeel"	"vermogen"	"{A5D52F8E-5578-446a-B52E-98F447F04D06}"	""	"Zonnepaneel"	"{A2773920-C9D3-42cf-A500-6181ECC37D1F}"	"KwantWrdInWatt"	"vermogen"	"Het vermogen van het zonnepaneel."	""	"vermogen"	"Het vermogen van het zonnepaneel."	""	""	"true"	"https://wegenenverkeer-test.data.vlaanderen.be/ns/onderdeel#"	"Zonnepaneel.vermogen"	"http://www.w3.org/2002/07/owl#ObjectProperty"	"https://wegenenverkeer-test.data.vlaanderen.be/ns/onderdeel#Zonnepaneel"	"https://wegenenverkeer-test.data.vlaanderen.be/ns/implementatieelement#KwantWrdInWatt"	""	"1"	"1"
"attribute"	"OSLO-Onderdeel"	"aantalRijenBetonstraatsteen"	"{E5D804E4-F082-4146-85FB-0A097DE16088}"	""	"WatergreppelAfw"	"{996FE652-5117-4a32-98AA-24B11ADF57B1}"	"Integer"	"aantal rijen betonstraatsteen"	"Het aantal rijen betonstraatsteen waaruit de watergreppel is opgebouwd."	""	"aantal rijen betonstraatsteen"	"Het aantal rijen betonstraatsteen waaruit de watergreppel is opgebouwd."	""	""	"true"	"https://wegenenverkeer-test.data.vlaanderen.be/ns/onderdeel#"	"WatergreppelAfw.aantalRijenBetonstraatsteen"	"http://www.w3.org/2002/07/owl#DatatypeProperty"	"https://wegenenverkeer-test.data.vlaanderen.be/ns/onderdeel#WatergreppelAfw"	"http://www.w3.org/2001/XMLSchema#integer"	""	"1"	"1"
"attribute"	"OSLO-Onderdeel"	"aantalRijenBetonstraatsteen"	"{99360D8B-1DE6-43ce-98A3-BE530D505D97}"	""	"KantstrookAfw"	"{3A6AC821-6D5A-4c3a-8AE9-57A51525485E}"	"Integer"	"aantal rijen betonstraatsteen"	"Het aantal rijen betonstraatsteen waaruit de kantstrook is opgebouwd."	""	"aantal rijen betonstraatsteen"	"Het aantal rijen betonstraatsteen waaruit de kantstrook is opgebouwd."	""	""	"true"	"https://wegenenverkeer-test.data.vlaanderen.be/ns/onderdeel#"	"KantstrookAfw.aantalRijenBetonstraatsteen"	"http://www.w3.org/2002/07/owl#DatatypeProperty"	"https://wegenenverkeer-test.data.vlaanderen.be/ns/onderdeel#KantstrookAfw"	"http://www.w3.org/2001/XMLSchema#integer"	""	"1"	"1"
"attribute"	"OSLO-Onderdeel"	"norm"	"{ACE156C5-5540-44ff-85F3-5CBBFE70FA85}"	""	"TrottoirbandWatergreppelStd"	"{C8FEBADB-296D-49db-A3A3-87BD8D894C9D}"	"DtcLENorm"	"norm"	"De gestandaardiseerde trottoirband_watergreppel volgens aangeduide norm."	""	"norm"	"De gestandaardiseerde trottoirband_watergreppel volgens aangeduide norm."	""	""	"true"	"https://wegenenverkeer-test.data.vlaanderen.be/ns/onderdeel#"	"TrottoirbandWatergreppelStd.norm"	"http://www.w3.org/2002/07/owl#ObjectProperty"	"https://wegenenverkeer-test.data.vlaanderen.be/ns/onderdeel#TrottoirbandWatergreppelStd"	"https://wegenenverkeer-test.data.vlaanderen.be/ns/onderdeel#DtcLENorm"	""	"1"	"1"
"attribute"	"OSLO-Onderdeel"	"type"	"{10A3AA69-8720-4c45-893A-F974854A42DC}"	""	"TrottoirbandWatergreppelStd"	"{C8FEBADB-296D-49db-A3A3-87BD8D894C9D}"	"KlLETrottoirbandWatergreppelType"	"type"	"Het type van gestandaardiseerde trottoirband_watergreppel"	""	"type"	"Het type van gestandaardiseerde trottoirband_watergreppel"	""	""	"true"	"https://wegenenverkeer-test.data.vlaanderen.be/ns/onderdeel#"	"TrottoirbandWatergreppelStd.type"	"http://www.w3.org/2002/07/owl#ObjectProperty"	"https://wegenenverkeer-test.data.vlaanderen.be/ns/onderdeel#TrottoirbandWatergreppelStd"	"http://www.w3.org/2004/02/skos/core#Concept"	""	"1"	"1"
"attribute"	"OSLO-Onderdeel"	"vorm"	"{90AD743E-10EA-4840-8AFB-E9DA493AF243}"	""	"TrottoirbandWatergreppelStd"	"{C8FEBADB-296D-49db-A3A3-87BD8D894C9D}"	"DtcTrottoirbandVorm"	"vorm"	"De vorm van de gestandaardiseerde trottoirband_watergreppel."	""	"vorm"	"De vorm van de gestandaardiseerde trottoirband_watergreppel."	""	""	"true"	"https://wegenenverkeer-test.data.vlaanderen.be/ns/onderdeel#"	"TrottoirbandWatergreppelStd.vorm"	"http://www.w3.org/2002/07/owl#ObjectProperty"	"https://wegenenverkeer-test.data.vlaanderen.be/ns/onderdeel#TrottoirbandWatergreppelStd"	"https://wegenenverkeer-test.data.vlaanderen.be/ns/onderdeel#DtcTrottoirbandVorm"	""	"1"	"1"
"attribute"	"OSLO-Onderdeel"	"breedte"	"{1F20EC51-AC74-423d-82A7-E9B415E76EF1}"	""	"SchampkantStd"	"{3675C112-6829-4f2d-B5F9-9FFA4497F2C2}"	"KwantWrdInCentimeter"	"breedte"	"De breedte van de gestandaardiseerde schampkant in centimeter."	""	"breedte"	"De breedte van de gestandaardiseerde schampkant in centimeter."	""	""	"true"	"https://wegenenverkeer-test.data.vlaanderen.be/ns/onderdeel#"	"SchampkantStd.breedte"	"http://www.w3.org/2002/07/owl#ObjectProperty"	"https://wegenenverkeer-test.data.vlaanderen.be/ns/onderdeel#SchampkantStd"	"https://wegenenverkeer-test.data.vlaanderen.be/ns/implementatieelement#KwantWrdInCentimeter"	""	"1"	"1"
"attribute"	"OSLO-Onderdeel"	"dikte"	"{47DD5851-A162-4c68-976A-4163F36E94B9}"	""	"SchampkantStd"	"{3675C112-6829-4f2d-B5F9-9FFA4497F2C2}"	"KwantWrdInCentimeter"	"dikte"	"De dikte van de gestandaardiseerde schampkant in centimeter."	""	"dikte"	"De dikte van de gestandaardiseerde schampkant in centimeter."	""	""	"true"	"https://wegenenverkeer-test.data.vlaanderen.be/ns/onderdeel#"	"SchampkantStd.dikte"	"http://www.w3.org/2002/07/owl#ObjectProperty"	"https://wegenenverkeer-test.data.vlaanderen.be/ns/onderdeel#SchampkantStd"	"https://wegenenverkeer-test.data.vlaanderen.be/ns/implementatieelement#KwantWrdInCentimeter"	""	"1"	"1"
"attribute"	"OSLO-Onderdeel"	"norm"	"{6A53D9C0-1BD9-44f8-BE29-962DA5DBB484}"	""	"SchampkantStd"	"{3675C112-6829-4f2d-B5F9-9FFA4497F2C2}"	"DtcLENorm"	"norm"	"De gestandaardiseerde schampkant volgens aangeduide norm."	""	"norm"	"De gestandaardiseerde schampkant volgens aangeduide norm."	""	""	"true"	"https://wegenenverkeer-test.data.vlaanderen.be/ns/onderdeel#"	"SchampkantStd.norm"	"http://www.w3.org/2002/07/owl#ObjectProperty"	"https://wegenenverkeer-test.data.vlaanderen.be/ns/onderdeel#SchampkantStd"	"https://wegenenverkeer-test.data.vlaanderen.be/ns/onderdeel#DtcLENorm"	""	"1"	"1"
