"EA-Type"	"EA-Package"	"EA-Name"	"EA-GUID"	"EA-Parent"	"EA-Domain"	"EA-Domain-GUID"	"EA-Range"	"label"	"definition"	"usage"	"ap-label-nl"	"ap-definition-nl"	"ap-usageNote-nl"	"ap-codelist"	"external term"	"namespace"	"localname"	"type"	"domain"	"range"	"parent"	"min card"	"max card"
"attribute"	"OSLO-Abstracten"	"soort"	"{F0BDA9BA-EBA1-4363-9833-C20E2FCDA3AC}"	""	"Kantopsluiting"	"{3076A428-ED26-4372-A15A-95B2CADC147C}"	"KlLEKantopsluitingSoort"	"soort"	"De soort van kantopsluiting."	""	"soort"	"De soort van kantopsluiting."	""	""	"true"	"https://wegenenverkeer-test.data.vlaanderen.be/ns/abstracten#"	"Kantopsluiting.soort"	"http://www.w3.org/2002/07/owl#ObjectProperty"	"https://wegenenverkeer-test.data.vlaanderen.be/ns/abstracten#Kantopsluiting"	"http://www.w3.org/2004/02/skos/core#Concept"	""	"1"	"1"
"attribute"	"OSLO-Abstracten"	"totaleLengte"	"{37C29873-38DC-49e5-A4DF-33BD449A46E7}"	""	"Kantopsluiting"	"{3076A428-ED26-4372-A15A-95B2CADC147C}"	"KwantWrdInMeter"	"lengte"	"De totale lengte van de geplaatste constructie van kantopsluitingen in meter."	""	"lengte"	"De totale lengte van de geplaatste constructie van kantopsluitingen in meter."	""	""	"true"	"https://wegenenverkeer-test.data.vlaanderen.be/ns/abstracten#"	"Kantopsluiting.totaleLengte"	"http://www.w3.org/2002/07/owl#ObjectProperty"	"https://wegenenverkeer-test.data.vlaanderen.be/ns/abstracten#Kantopsluiting"	"https://wegenenverkeer-test.data.vlaanderen.be/ns/implementatieelement#KwantWrdInMeter"	""	"1"	"1"
"attribute"	"OSLO-Implementatieelement"	"assetId"	"{E7949773-97DA-41ca-87AA-1853AA025955}"	""	"AIMObject"	"{88503FAE-2021-462b-A7F8-0159BE43D56A}"	"DtcIdentificator"	"asset-id"	"Unieke identificatie van de asset zoals toegekend door de assetbeheerder of n.a.v. eerste aanlevering door de leverancier."	""	"asset-id"	"Unieke identificatie van de asset zoals toegekend door de assetbeheerder of n.a.v. eerste aanlevering door de leverancier."	""	""	"true"	"https://wegenenverkeer-test.data.vlaanderen.be/ns/implementatieelement#"	"AIMObject.assetId"	"http://www.w3.org/2002/07/owl#ObjectProperty"	"https://wegenenverkeer-test.data.vlaanderen.be/ns/implementatieelement#AIMObject"	"https://wegenenverkeer-test.data.vlaanderen.be/ns/implementatieelement#DtcIdentificator"	""	"1"	"1"
"attribute"	"OSLO-Implementatieelement"	"bestekPostNummer"	"{ED38D64A-6C46-4ebf-B554-DF017F871252}"	""	"AIMObject"	"{88503FAE-2021-462b-A7F8-0159BE43D56A}"	"String"	"bestekpostnummer"	"Een verwijzing naar een postnummer uit het specifieke bestek waar het object mee verband houdt."	""	"bestekpostnummer"	"Een verwijzing naar een postnummer uit het specifieke bestek waar het object mee verband houdt."	""	""	"true"	"https://wegenenverkeer-test.data.vlaanderen.be/ns/implementatieelement#"	"AIMObject.bestekPostNummer"	"http://www.w3.org/2002/07/owl#DatatypeProperty"	"https://wegenenverkeer-test.data.vlaanderen.be/ns/implementatieelement#AIMObject"	"http://www.w3.org/2001/XMLSchema#string"	""	"1"	"*"
"attribute"	"OSLO-Implementatieelement"	"datumOprichtingObject"	"{C38CFD17-6644-477b-81F9-59A1A0A25A53}"	""	"AIMObject"	"{88503FAE-2021-462b-A7F8-0159BE43D56A}"	"Date"	"datum oprichting object"	"Datum van de oprichting van het object."	""	"datum oprichting object"	"Datum van de oprichting van het object."	""	""	"true"	"https://wegenenverkeer-test.data.vlaanderen.be/ns/implementatieelement#"	"AIMObject.datumOprichtingObject"	"http://www.w3.org/2002/07/owl#DatatypeProperty"	"https://wegenenverkeer-test.data.vlaanderen.be/ns/implementatieelement#AIMObject"	"http://www.w3.org/2001/XMLSchema#date"	""	"1"	"1"
"attribute"	"OSLO-Implementatieelement"	"notitie"	"{0EA19E5B-3D80-4267-8FB9-2E5AEB676573}"	""	"AIMObject"	"{88503FAE-2021-462b-A7F8-0159BE43D56A}"	"String"	"notitie"	"Extra notitie voor het object."	""	"notitie"	"Extra notitie voor het object."	""	""	"true"	"https://wegenenverkeer-test.data.vlaanderen.be/ns/implementatieelement#"	"AIMObject.notitie"	"http://www.w3.org/2002/07/owl#DatatypeProperty"	"https://wegenenverkeer-test.data.vlaanderen.be/ns/implementatieelement#AIMObject"	"http://www.w3.org/2001/XMLSchema#string"	""	"1"	"1"
"attribute"	"OSLO-Implementatieelement"	"standaardBestekPostNummer"	"{3F3F836C-7304-4f0f-9818-237FDAE6EA38}"	""	"AIMObject"	"{88503FAE-2021-462b-A7F8-0159BE43D56A}"	"String"	"standaardbestekpostnummer"	"Een verwijzing naar een postnummer uit het standaardbestek waar het object mee verband houdt. De notatie van het postnummer moet overeenkomen met de notatie die gebruikt is in de catalogi van standaardbestekken, bijvoorbeeld postnummer 0701.20404G."	""	"standaardbestekpostnummer"	"Een verwijzing naar een postnummer uit het standaardbestek waar het object mee verband houdt. De notatie van het postnummer moet overeenkomen met de notatie die gebruikt is in de catalogi van standaardbestekken, bijvoorbeeld postnummer 0701.20404G."	""	""	"true"	"https://wegenenverkeer-test.data.vlaanderen.be/ns/implementatieelement#"	"AIMObject.standaardBestekPostNummer"	"http://www.w3.org/2002/07/owl#DatatypeProperty"	"https://wegenenverkeer-test.data.vlaanderen.be/ns/implementatieelement#AIMObject"	"http://www.w3.org/2001/XMLSchema#string"	""	"1"	"*"
"attribute"	"OSLO-Implementatieelement"	"typeURI"	"{B2575195-82F2-4a75-9C7C-952635A8DE90}"	""	"AIMObject"	"{88503FAE-2021-462b-A7F8-0159BE43D56A}"	"AnyURI"	"type URI"	"De URI van het object volgens https://www.w3.org/2001/XMLSchema#anyURI ."	""	"type URI"	"De URI van het object volgens https://www.w3.org/2001/XMLSchema#anyURI ."	""	""	"true"	"https://wegenenverkeer-test.data.vlaanderen.be/ns/implementatieelement#"	"AIMObject.typeURI"	"http://www.w3.org/2002/07/owl#ObjectProperty"	"https://wegenenverkeer-test.data.vlaanderen.be/ns/implementatieelement#AIMObject"	"http://www.w3.org/2001/XMLSchema#anyURI"	""	"1"	"1"
"attribute"	"OSLO-Implementatieelement"	"toestand"	"{7C966B34-58C9-452e-9E3B-9037B9D6924F}"	""	"AIMToestand"	"{A15866FB-94B6-4938-AAD6-552F4D5AEEF9}"	"KlAIMToestand"	"toestand"	"Geeft de actuele stand in de levenscyclus van het object."	""	"toestand"	"Geeft de actuele stand in de levenscyclus van het object."	""	""	"true"	"https://wegenenverkeer-test.data.vlaanderen.be/ns/implementatieelement#"	"AIMToestand.toestand"	"http://www.w3.org/2002/07/owl#ObjectProperty"	"https://wegenenverkeer-test.data.vlaanderen.be/ns/implementatieelement#AIMToestand"	"http://www.w3.org/2004/02/skos/core#Concept"	""	"1"	"1"
"attribute"	"OSLO-Implementatieelement"	"isActief"	"{DBB2EB51-C555-405e-BCCD-A5E836AC34CF}"	""	"AIMDBStatus"	"{C69C60D8-2A25-4059-A97C-88B4F945C0F4}"	"Boolean"	"is actief"	"Geeft aan of het object actief kan gebruikt worden of (zacht) verwijderd is uit het asset beheer systeem."	""	"is actief"	"Geeft aan of het object actief kan gebruikt worden of (zacht) verwijderd is uit het asset beheer systeem."	""	""	"true"	"https://wegenenverkeer-test.data.vlaanderen.be/ns/implementatieelement#"	"AIMDBStatus.isActief"	"http://www.w3.org/2002/07/owl#DatatypeProperty"	"https://wegenenverkeer-test.data.vlaanderen.be/ns/implementatieelement#AIMDBStatus"	"http://www.w3.org/2001/XMLSchema#boolean"	""	"1"	"1"
"attribute"	"OSLO-Abstracten"	"breedte"	"{EA8A6704-28D4-4636-BD8D-D7AE3A39876F}"	""	"TerreinDeel"	"{7D424DCA-A194-4abc-9492-BE3CF8FF4939}"	"KwantWrdInMeter"	"breedte"	"De breedte van het object in meter. In geval van een ongelijkmatige breedte wordt de gemiddelde breedte opgenomen."	""	"breedte"	"De breedte van het object in meter. In geval van een ongelijkmatige breedte wordt de gemiddelde breedte opgenomen."	""	""	"true"	"https://wegenenverkeer-test.data.vlaanderen.be/ns/abstracten#"	"TerreinDeel.breedte"	"http://www.w3.org/2002/07/owl#ObjectProperty"	"https://wegenenverkeer-test.data.vlaanderen.be/ns/abstracten#TerreinDeel"	"https://wegenenverkeer-test.data.vlaanderen.be/ns/implementatieelement#KwantWrdInMeter"	""	"1"	"1"
"attribute"	"OSLO-Abstracten"	"lengte"	"{E7F8290D-C2A7-4947-B915-22A14168145F}"	""	"TerreinDeel"	"{7D424DCA-A194-4abc-9492-BE3CF8FF4939}"	"KwantWrdInMeter"	"lengte"	"De lengte van het object in meter. In geval van een ongelijkmatige lengte wordt de gemiddelde lengte opgenomen."	""	"lengte"	"De lengte van het object in meter. In geval van een ongelijkmatige lengte wordt de gemiddelde lengte opgenomen."	""	""	"true"	"https://wegenenverkeer-test.data.vlaanderen.be/ns/abstracten#"	"TerreinDeel.lengte"	"http://www.w3.org/2002/07/owl#ObjectProperty"	"https://wegenenverkeer-test.data.vlaanderen.be/ns/abstracten#TerreinDeel"	"https://wegenenverkeer-test.data.vlaanderen.be/ns/implementatieelement#KwantWrdInMeter"	""	"1"	"1"
"attribute"	"OSLO-Abstracten"	"niveau"	"{AF3FFF3E-EBE7-4df0-9D91-971BF3D341B6}"	""	"TerreinDeel"	"{7D424DCA-A194-4abc-9492-BE3CF8FF4939}"	"Decimal"	"niveau"	"Het niveau waarop het object zich bevindt, relatief ten opzichte van andere objecten. Negatieve waarden worden geassocieerd met ondergronds en positieve waarden met bovengronds. Nul wordt beschouwd als een absolute waarde om het maaiveld aan te duiden."	""	"niveau"	"Het niveau waarop het object zich bevindt, relatief ten opzichte van andere objecten. Negatieve waarden worden geassocieerd met ondergronds en positieve waarden met bovengronds. Nul wordt beschouwd als een absolute waarde om het maaiveld aan te duiden."	""	""	"true"	"https://wegenenverkeer-test.data.vlaanderen.be/ns/abstracten#"	"TerreinDeel.niveau"	"http://www.w3.org/2002/07/owl#ObjectProperty"	"https://wegenenverkeer-test.data.vlaanderen.be/ns/abstracten#TerreinDeel"	"http://www.w3.org/2001/XMLSchema#decimal"	""	"1"	"1"
"attribute"	"OSLO-Abstracten"	"oppervlakte"	"{475716CE-6412-4771-9DD8-982065F3B5E3}"	""	"TerreinDeel"	"{7D424DCA-A194-4abc-9492-BE3CF8FF4939}"	"KwantWrdInVierkanteMeter"	"oppervlakte"	"De oppervlakte in vierkante meter"	""	"oppervlakte"	"De oppervlakte in vierkante meter"	""	""	"true"	"https://wegenenverkeer-test.data.vlaanderen.be/ns/abstracten#"	"TerreinDeel.oppervlakte"	"http://www.w3.org/2002/07/owl#ObjectProperty"	"https://wegenenverkeer-test.data.vlaanderen.be/ns/abstracten#TerreinDeel"	"https://wegenenverkeer-test.data.vlaanderen.be/ns/implementatieelement#KwantWrdInVierkanteMeter"	""	"1"	"1"
"attribute"	"OSLO-Abstracten"	"aanzicht"	"{A4284B90-CCEB-418a-8D88-C08ED273B9E4}"	""	"Verkeersbord"	"{FDA1B9E5-3881-4b68-849C-AF3E128389ED}"	"KwantWrdInDecimaleGraden"	"aanzicht"	"De hoek waarin het fysiek bord gepositioneerd is ten opzichte van een vooropgestelde as (het ware noorden). De hoek wordt gemeten in radialen of graden ten opzichte van het noorden in wijzerzin."	"In radialen of graden ten opzichte van het noorden in wijzerzin."	"aanzicht"	"De hoek waarin het fysiek bord gepositioneerd is ten opzichte van een vooropgestelde as (het ware noorden). De hoek wordt gemeten in radialen of graden ten opzichte van het noorden in wijzerzin."	""	""	"true"	"https://wegenenverkeer-test.data.vlaanderen.be/ns/abstracten#"	"Verkeersbord.aanzicht"	"http://www.w3.org/2002/07/owl#ObjectProperty"	"https://wegenenverkeer-test.data.vlaanderen.be/ns/abstracten#Verkeersbord"	"https://wegenenverkeer-test.data.vlaanderen.be/ns/implementatieelement#KwantWrdInDecimaleGraden"	""	"1"	"1"
"attribute"	"OSLO-Abstracten"	"afbeelding"	"{219DDB04-BC21-4e93-B207-856866F9753D}"	""	"Verkeersbord"	"{FDA1B9E5-3881-4b68-849C-AF3E128389ED}"	"DtcDocument"	"afbeelding"	"De afbeelding van het verkeersbord."	""	"afbeelding"	"De afbeelding van het verkeersbord."	""	""	"true"	"https://wegenenverkeer-test.data.vlaanderen.be/ns/abstracten#"	"Verkeersbord.afbeelding"	"http://www.w3.org/2002/07/owl#ObjectProperty"	"https://wegenenverkeer-test.data.vlaanderen.be/ns/abstracten#Verkeersbord"	"https://wegenenverkeer-test.data.vlaanderen.be/ns/implementatieelement#DtcDocument"	""	"0"	"*"
"attribute"	"OSLO-Abstracten"	"afmeting"	"{A8228976-9A7C-4c27-A55B-2C11D15441C2}"	""	"Verkeersbord"	"{FDA1B9E5-3881-4b68-849C-AF3E128389ED}"	"DtuAfmetingVerkeersbord"	"afmeting"	"De afmeting(en) van het verkeersbord."	""	"afmeting"	"De afmeting(en) van het verkeersbord."	""	""	"true"	"https://wegenenverkeer-test.data.vlaanderen.be/ns/abstracten#"	"Verkeersbord.afmeting"	"http://www.w3.org/2002/07/owl#ObjectProperty"	"https://wegenenverkeer-test.data.vlaanderen.be/ns/abstracten#Verkeersbord"	"https://wegenenverkeer-test.data.vlaanderen.be/ns/onderdeel#DtuAfmetingVerkeersbord"	""	"1"	"1"
"attribute"	"OSLO-Abstracten"	"fabricagevoorschrift"	"{ADE03CEE-551F-457e-8887-175C72058B55}"	""	"Verkeersbord"	"{FDA1B9E5-3881-4b68-849C-AF3E128389ED}"	"String"	"fabricagevoorschrift"	"Het fabricagevoorschrift op het verkeersbord."	""	"fabricagevoorschrift"	"Het fabricagevoorschrift op het verkeersbord."	""	""	"true"	"https://wegenenverkeer-test.data.vlaanderen.be/ns/abstracten#"	"Verkeersbord.fabricagevoorschrift"	"http://www.w3.org/2002/07/owl#DatatypeProperty"	"https://wegenenverkeer-test.data.vlaanderen.be/ns/abstracten#Verkeersbord"	"http://www.w3.org/2001/XMLSchema#string"	""	"1"	"1"
"attribute"	"OSLO-Abstracten"	"operationeleStatus"	"{2E7D0007-E58F-4c23-88BF-121DA301F561}"	""	"Verkeersbord"	"{FDA1B9E5-3881-4b68-849C-AF3E128389ED}"	"KlOperationeleStatus"	"operationele status"	"De operationele status van het verkeersbord."	"Enkel te gebruiken wanneer een object 'in gebruik' is. Zie ook attribuut toestand overgeërfd van AIMToestand om de asset levenscyclus aan te duiden."	"operationele status"	"De operationele status van het verkeersbord."	""	""	"true"	"https://wegenenverkeer-test.data.vlaanderen.be/ns/abstracten#"	"Verkeersbord.operationeleStatus"	"http://www.w3.org/2002/07/owl#ObjectProperty"	"https://wegenenverkeer-test.data.vlaanderen.be/ns/abstracten#Verkeersbord"	"http://www.w3.org/2004/02/skos/core#Concept"	""	"1"	"1"
"attribute"	"OSLO-Abstracten"	"opstelhoogte"	"{4DD5A226-F294-4446-BE9E-2E968AF5F1E1}"	""	"Verkeersbord"	"{FDA1B9E5-3881-4b68-849C-AF3E128389ED}"	"KwantWrdInMeter"	"opstelhoogte"	"Afstand tussen het maaiveld en de onderrand van het bord."	""	"opstelhoogte"	"Afstand tussen het maaiveld en de onderrand van het bord."	""	""	"true"	"https://wegenenverkeer-test.data.vlaanderen.be/ns/abstracten#"	"Verkeersbord.opstelhoogte"	"http://www.w3.org/2002/07/owl#ObjectProperty"	"https://wegenenverkeer-test.data.vlaanderen.be/ns/abstracten#Verkeersbord"	"https://wegenenverkeer-test.data.vlaanderen.be/ns/implementatieelement#KwantWrdInMeter"	""	"1"	"1"
"attribute"	"OSLO-Abstracten"	"kleurReflectorAflopend"	"{5F4FEA9C-F611-4893-8468-8EA196084917}"	""	"Bebakening"	"{57301420-4E33-4e9a-877A-BADDE05CAD1E}"	"KlKleurReflector"	"kleur aflopend"	"De kleur van de reflector stroomafwaarts."	""	"kleur aflopend"	"De kleur van de reflector stroomafwaarts."	""	""	"true"	"https://wegenenverkeer-test.data.vlaanderen.be/ns/abstracten#"	"Bebakening.kleurReflectorAflopend"	"http://www.w3.org/2002/07/owl#ObjectProperty"	"https://wegenenverkeer-test.data.vlaanderen.be/ns/abstracten#Bebakening"	"http://www.w3.org/2004/02/skos/core#Concept"	""	"1"	"1"
"attribute"	"OSLO-Abstracten"	"kleurReflectorOplopend"	"{AF62A560-5E7D-40a5-8118-8983117E35DE}"	""	"Bebakening"	"{57301420-4E33-4e9a-877A-BADDE05CAD1E}"	"KlKleurReflector"	"kleur oplopend"	"De kleur van de reflector stroomopwaarts."	""	"kleur oplopend"	"De kleur van de reflector stroomopwaarts."	""	""	"true"	"https://wegenenverkeer-test.data.vlaanderen.be/ns/abstracten#"	"Bebakening.kleurReflectorOplopend"	"http://www.w3.org/2002/07/owl#ObjectProperty"	"https://wegenenverkeer-test.data.vlaanderen.be/ns/abstracten#Bebakening"	"http://www.w3.org/2004/02/skos/core#Concept"	""	"1"	"1"
"attribute"	"OSLO-Implementatieelement"	"naam"	"{B9115F31-1B3C-42d0-BE37-D794B2620E93}"	""	"AIMNaamObject"	"{36C589DA-0DFB-4b23-9DCC-F70E81EF57DB}"	"String"	"naam"	"De mensleesbare naam van een asset zoals dit bv. ook terug te vinden is op een etiket op het object zelf. De assetbeheerder kent deze naam toe of geeft de opdracht om deze toe te kennen. Indien een object een algemeen gangbare naam heeft zoals bv. bij een waterloop dan wordt deze gebruikt."	""	"naam"	"De mensleesbare naam van een asset zoals dit bv. ook terug te vinden is op een etiket op het object zelf. De assetbeheerder kent deze naam toe of geeft de opdracht om deze toe te kennen. Indien een object een algemeen gangbare naam heeft zoals bv. bij een waterloop dan wordt deze gebruikt."	""	""	"true"	"https://wegenenverkeer-test.data.vlaanderen.be/ns/implementatieelement#"	"AIMNaamObject.naam"	"http://www.w3.org/2002/07/owl#DatatypeProperty"	"https://wegenenverkeer-test.data.vlaanderen.be/ns/implementatieelement#AIMNaamObject"	"http://www.w3.org/2001/XMLSchema#string"	""	"1"	"1"
"attribute"	"OSLO-Implementatieelement"	"standaardEenheid"	"{33F2FEB0-427A-4920-ADA4-FA09FBFF2751}"	""	"KwantWrdInCentimeter"	"{B743E32D-DAEB-40c0-A7C7-994EC794D317}"	"Literal"	"standaard eenheid"	"De standaard eenheid bij dit datatype is uitgedrukt in centimeter."	"""cm""^^cdt:ucumunit"	"standaard eenheid"	"De standaard eenheid bij dit datatype is uitgedrukt in centimeter."	""	""	"true"	"https://wegenenverkeer-test.data.vlaanderen.be/ns/implementatieelement#"	"KwantWrdInCentimeter.standaardEenheid"	"http://www.w3.org/2002/07/owl#DatatypeProperty"	"https://wegenenverkeer-test.data.vlaanderen.be/ns/implementatieelement#KwantWrdInCentimeter"	"http://www.w3.org/2000/01/rdf-schema#Literal"	""	"1"	"1"
"attribute"	"OSLO-Implementatieelement"	"waarde"	"{A8457158-0AB0-467f-A36B-469B7DAF99EA}"	""	"KwantWrdInCentimeter"	"{B743E32D-DAEB-40c0-A7C7-994EC794D317}"	"Decimal"	"waarde"	"Bevat een getal die bij het datatype hoort."	""	"waarde"	"Bevat een getal die bij het datatype hoort."	""	""	"true"	"https://wegenenverkeer-test.data.vlaanderen.be/ns/implementatieelement#"	"KwantWrdInCentimeter.waarde"	"http://www.w3.org/2002/07/owl#ObjectProperty"	"https://wegenenverkeer-test.data.vlaanderen.be/ns/implementatieelement#KwantWrdInCentimeter"	"http://www.w3.org/2001/XMLSchema#decimal"	""	"1"	"1"
"attribute"	"OSLO-Implementatieelement"	"bestandsnaam"	"{A3661F84-C7FB-48f4-B9E2-1654A91E2531}"	""	"DtcDocument"	"{67EDF58E-5D61-418a-8049-E320E3932F33}"	"String"	"bestandsnaam"	"De naam van het Document inclusief de bestandsextensie, van de naam gescheiden door een punt."	""	"bestandsnaam"	"De naam van het Document inclusief de bestandsextensie, van de naam gescheiden door een punt."	""	""	"true"	"https://wegenenverkeer-test.data.vlaanderen.be/ns/implementatieelement#"	"DtcDocument.bestandsnaam"	"http://www.w3.org/2002/07/owl#DatatypeProperty"	"https://wegenenverkeer-test.data.vlaanderen.be/ns/implementatieelement#DtcDocument"	"http://www.w3.org/2001/XMLSchema#string"	""	"1"	"1"
"attribute"	"OSLO-Implementatieelement"	"mimeType"	"{A1DB59BA-799C-4c7c-A72A-2BEFD80BDAA0}"	""	"DtcDocument"	"{67EDF58E-5D61-418a-8049-E320E3932F33}"	"KlAlgMimeType"	"mime-type"	"Het MIME type van het document."	""	"mime-type"	"Het MIME type van het document."	""	""	"true"	"https://wegenenverkeer-test.data.vlaanderen.be/ns/implementatieelement#"	"DtcDocument.mimeType"	"http://www.w3.org/2002/07/owl#ObjectProperty"	"https://wegenenverkeer-test.data.vlaanderen.be/ns/implementatieelement#DtcDocument"	"http://www.w3.org/2004/02/skos/core#Concept"	""	"1"	"1"
"attribute"	"OSLO-Implementatieelement"	"omschrijving"	"{A39A5112-AF66-4109-8F19-FAC561A079D7}"	""	"DtcDocument"	"{67EDF58E-5D61-418a-8049-E320E3932F33}"	"DteTekstblok"	"omschrijving"	"Een korte toelichting over waar het document juist voor dient."	""	"omschrijving"	"Een korte toelichting over waar het document juist voor dient."	""	""	"true"	"https://wegenenverkeer-test.data.vlaanderen.be/ns/implementatieelement#"	"DtcDocument.omschrijving"	"http://www.w3.org/2002/07/owl#ObjectProperty"	"https://wegenenverkeer-test.data.vlaanderen.be/ns/implementatieelement#DtcDocument"	"https://wegenenverkeer-test.data.vlaanderen.be/ns/implementatieelement#DteTekstblok"	""	"1"	"1"
"attribute"	"OSLO-Implementatieelement"	"uri"	"{C6062215-5DB3-4d6d-84A6-A59150E98109}"	""	"DtcDocument"	"{67EDF58E-5D61-418a-8049-E320E3932F33}"	"AnyURI"	"uri"	"De verwijzing naar de bestandslocatie via een link. Bij lokale bestanden kan dit eventueel ook een pad zijn."	""	"uri"	"De verwijzing naar de bestandslocatie via een link. Bij lokale bestanden kan dit eventueel ook een pad zijn."	""	""	"true"	"https://wegenenverkeer-test.data.vlaanderen.be/ns/implementatieelement#"	"DtcDocument.uri"	"http://www.w3.org/2002/07/owl#ObjectProperty"	"https://wegenenverkeer-test.data.vlaanderen.be/ns/implementatieelement#DtcDocument"	"http://www.w3.org/2001/XMLSchema#anyURI"	""	"1"	"1"
"attribute"	"OSLO-Implementatieelement"	"waarde"	"{CD7B71A6-BB9E-463b-AD15-7B096EA095BB}"	""	"DteTekstblok"	"{283DFABF-8123-4605-8E63-5220D7E90924}"	"String"	"waarde"	"De string welke uit meerdere zinnen bestaat, en ook regeleindes kan bevatten. Een tekstblok bevat maximaal 65.000 karakters."	""	"waarde"	"De string welke uit meerdere zinnen bestaat, en ook regeleindes kan bevatten. Een tekstblok bevat maximaal 65.000 karakters."	""	""	"true"	"https://wegenenverkeer-test.data.vlaanderen.be/ns/implementatieelement#"	"DteTekstblok.waarde"	"http://www.w3.org/2002/07/owl#DatatypeProperty"	"https://wegenenverkeer-test.data.vlaanderen.be/ns/implementatieelement#DteTekstblok"	"http://www.w3.org/2001/XMLSchema#string"	""	"1"	"1"
"attribute"	"OSLO-Implementatieelement"	"standaardEenheid"	"{B33B0B6F-AEE6-4b92-AB48-6503A73EBE10}"	""	"KwantWrdInMeter"	"{AD568F16-2A2F-4674-AB84-8600A2994308}"	"Literal"	"standaard eenheid"	"De standaard eenheid bij dit datatype is uitgedrukt in meter."	"""m""^^cdt:ucumunit"	"standaard eenheid"	"De standaard eenheid bij dit datatype is uitgedrukt in meter."	""	""	"true"	"https://wegenenverkeer-test.data.vlaanderen.be/ns/implementatieelement#"	"KwantWrdInMeter.standaardEenheid"	"http://www.w3.org/2002/07/owl#DatatypeProperty"	"https://wegenenverkeer-test.data.vlaanderen.be/ns/implementatieelement#KwantWrdInMeter"	"http://www.w3.org/2000/01/rdf-schema#Literal"	""	"1"	"1"
"attribute"	"OSLO-Implementatieelement"	"waarde"	"{87565B08-A307-403e-90B7-CA1FCC4499C3}"	""	"KwantWrdInMeter"	"{AD568F16-2A2F-4674-AB84-8600A2994308}"	"Decimal"	"waarde"	"Bevat een getal die bij het datatype hoort."	""	"waarde"	"Bevat een getal die bij het datatype hoort."	""	""	"true"	"https://wegenenverkeer-test.data.vlaanderen.be/ns/implementatieelement#"	"KwantWrdInMeter.waarde"	"http://www.w3.org/2002/07/owl#ObjectProperty"	"https://wegenenverkeer-test.data.vlaanderen.be/ns/implementatieelement#KwantWrdInMeter"	"http://www.w3.org/2001/XMLSchema#decimal"	""	"1"	"1"
"attribute"	"OSLO-Implementatieelement"	"identificator"	"{C7C0531E-51B7-4662-80D1-73C43C3D89A6}"	""	"DtcIdentificator"	"{4FE8FD6F-EC29-453d-B38A-79775D658E87}"	"String"	"identificator"	"Een groep van tekens om een AIM object te identificeren of te benoemen."	""	"identificator"	"Een groep van tekens om een AIM object te identificeren of te benoemen."	""	""	"true"	"https://wegenenverkeer-test.data.vlaanderen.be/ns/implementatieelement#"	"DtcIdentificator.identificator"	"http://www.w3.org/2002/07/owl#DatatypeProperty"	"https://wegenenverkeer-test.data.vlaanderen.be/ns/implementatieelement#DtcIdentificator"	"http://www.w3.org/2001/XMLSchema#string"	""	"1"	"1"
"attribute"	"OSLO-Implementatieelement"	"toegekendDoor"	"{4A6321F9-3E1E-4f54-A289-288221563685}"	""	"DtcIdentificator"	"{4FE8FD6F-EC29-453d-B38A-79775D658E87}"	"String"	"toegekend door"	"Gegevens van de organisatie die de toekenning deed."	""	"toegekend door"	"Gegevens van de organisatie die de toekenning deed."	""	""	"true"	"https://wegenenverkeer-test.data.vlaanderen.be/ns/implementatieelement#"	"DtcIdentificator.toegekendDoor"	"http://www.w3.org/2002/07/owl#DatatypeProperty"	"https://wegenenverkeer-test.data.vlaanderen.be/ns/implementatieelement#DtcIdentificator"	"http://www.w3.org/2001/XMLSchema#string"	""	"1"	"1"
"attribute"	"OSLO-Onderdeel"	"bijkomendeParameter"	"{658829DD-FD21-40cc-9889-16504869E258}"	""	"DtcLENorm"	"{FFB5FC2C-DF22-4f9b-9A26-AD1120DFD858}"	"KlLEKantopsluitingBijkomendeParameter"	"bijkomende parameter"	"Het gedetailleerder typeren van de kantopsluiting."	""	"bijkomende parameter"	"Het gedetailleerder typeren van de kantopsluiting."	""	""	"true"	"https://wegenenverkeer-test.data.vlaanderen.be/ns/onderdeel#"	"DtcLENorm.bijkomendeParameter"	"http://www.w3.org/2002/07/owl#ObjectProperty"	"https://wegenenverkeer-test.data.vlaanderen.be/ns/onderdeel#DtcLENorm"	"http://www.w3.org/2004/02/skos/core#Concept"	""	"1"	"1"
"attribute"	"OSLO-Onderdeel"	"norm"	"{F703E1DD-385C-4069-8E65-BBB5B38323EB}"	""	"DtcLENorm"	"{FFB5FC2C-DF22-4f9b-9A26-AD1120DFD858}"	"String"	"norm"	"De opgelegde en beschreven standaard van de kantopsluiting ."	""	"norm"	"De opgelegde en beschreven standaard van de kantopsluiting ."	""	""	"true"	"https://wegenenverkeer-test.data.vlaanderen.be/ns/onderdeel#"	"DtcLENorm.norm"	"http://www.w3.org/2002/07/owl#DatatypeProperty"	"https://wegenenverkeer-test.data.vlaanderen.be/ns/onderdeel#DtcLENorm"	"http://www.w3.org/2001/XMLSchema#string"	""	"1"	"1"
"attribute"	"OSLO-Onderdeel"	"breedte"	"{86A2AA12-7390-4346-B232-1B6AD2BAD3B7}"	""	"DtcTrottoirbandVorm"	"{4457C7DA-59C8-4c46-A0D4-9191FB259FD4}"	"KwantWrdInCentimeter"	"breedte"	"De breedte van de trottoirband."	""	"breedte"	"De breedte van de trottoirband."	""	""	"true"	"https://wegenenverkeer-test.data.vlaanderen.be/ns/onderdeel#"	"DtcTrottoirbandVorm.breedte"	"http://www.w3.org/2002/07/owl#ObjectProperty"	"https://wegenenverkeer-test.data.vlaanderen.be/ns/onderdeel#DtcTrottoirbandVorm"	"https://wegenenverkeer-test.data.vlaanderen.be/ns/implementatieelement#KwantWrdInCentimeter"	""	"1"	"1"
