"EA-Type"	"EA-Package"	"EA-Name"	"EA-GUID"	"EA-Parent"	"EA-Domain"	"EA-Domain-GUID"	"EA-Range"	"label"	"definition"	"usage"	"ap-label-nl"	"ap-definition-nl"	"ap-usageNote-nl"	"ap-codelist"	"external term"	"namespace"	"localname"	"type"	"domain"	"range"	"parent"	"min card"	"max card"
"attribute"	"OSLO-Onderdeel"	"kleur"	"{BA831267-1860-4b7f-AFB1-D89D0DF30EC9}"	""	"DunneOverlaging"	"{3577B1E0-40BC-4fbe-93C2-CF8BCF9ADFAF}"	"KlKleurSupp"	"kleur"	"De kleur van de dunne overlaging."	""	"kleur"	"De kleur van de dunne overlaging."	""	""	"true"	"https://wegenenverkeer-test.data.vlaanderen.be/ns/onderdeel#"	"DunneOverlaging.kleur"	"http://www.w3.org/2002/07/owl#ObjectProperty"	"https://wegenenverkeer-test.data.vlaanderen.be/ns/onderdeel#DunneOverlaging"	"http://www.w3.org/2004/02/skos/core#Concept"	""	"1"	"1"
"attribute"	"OSLO-Onderdeel"	"type"	"{FFCB92D2-5FB9-42c5-B809-BE71F061B388}"	""	"DunneOverlaging"	"{3577B1E0-40BC-4fbe-93C2-CF8BCF9ADFAF}"	"KlDunneOverlagingType"	"type"	"Het type SME overlaging of antisliplaag."	""	"type"	"Het type SME overlaging of antisliplaag."	""	""	"true"	"https://wegenenverkeer-test.data.vlaanderen.be/ns/onderdeel#"	"DunneOverlaging.type"	"http://www.w3.org/2002/07/owl#ObjectProperty"	"https://wegenenverkeer-test.data.vlaanderen.be/ns/onderdeel#DunneOverlaging"	"http://www.w3.org/2004/02/skos/core#Concept"	""	"1"	"1"
"attribute"	"OSLO-Onderdeel"	"kaliber"	"{4142E299-260C-478f-825B-47A88AA3AFEF}"	""	"Bestrijking"	"{10FA75F5-FB68-4db5-818E-A127DFC1024A}"	"KlBestrijkingKaliber"	"kaliber"	"De korrelmaat gebruikt bij de bestrijking."	""	"kaliber"	"De korrelmaat gebruikt bij de bestrijking."	""	""	"true"	"https://wegenenverkeer-test.data.vlaanderen.be/ns/onderdeel#"	"Bestrijking.kaliber"	"http://www.w3.org/2002/07/owl#ObjectProperty"	"https://wegenenverkeer-test.data.vlaanderen.be/ns/onderdeel#Bestrijking"	"http://www.w3.org/2004/02/skos/core#Concept"	""	"1"	"1"
"attribute"	"OSLO-Onderdeel"	"productfamilie"	"{27534652-E32F-4cf7-BB43-82F83A07BFAB}"	""	"Bestrijking"	"{10FA75F5-FB68-4db5-818E-A127DFC1024A}"	"KlBestrijkingProductfamilie"	"productfamilie"	"Bepaling tot welke productfamilie de bestrijking behoort. "	""	"productfamilie"	"Bepaling tot welke productfamilie de bestrijking behoort. "	""	""	"true"	"https://wegenenverkeer-test.data.vlaanderen.be/ns/onderdeel#"	"Bestrijking.productfamilie"	"http://www.w3.org/2002/07/owl#ObjectProperty"	"https://wegenenverkeer-test.data.vlaanderen.be/ns/onderdeel#Bestrijking"	"http://www.w3.org/2004/02/skos/core#Concept"	""	"1"	"1"
"attribute"	"OSLO-Onderdeel"	"soort"	"{BC69AFED-E163-4bab-BE7A-EEEE564E1408}"	""	"Bestrijking"	"{10FA75F5-FB68-4db5-818E-A127DFC1024A}"	"KlBestrijkingsoort"	"soort"	"De soort bestrijking."	""	"soort"	"De soort bestrijking."	""	""	"true"	"https://wegenenverkeer-test.data.vlaanderen.be/ns/onderdeel#"	"Bestrijking.soort"	"http://www.w3.org/2002/07/owl#ObjectProperty"	"https://wegenenverkeer-test.data.vlaanderen.be/ns/onderdeel#Bestrijking"	"http://www.w3.org/2004/02/skos/core#Concept"	""	"1"	"1"
"attribute"	"OSLO-Onderdeel"	"formaatVanBestratingselement"	"{4268F4BE-E59A-4dc6-A7F4-880AC1D3BC25}"	""	"BestratingVanGebakkenStraatsteen"	"{96A1051C-CFED-4830-AF40-F4B444CBD8E7}"	"KlFormaatGebakkenStraatsteen"	"formaat van bestratingselement"	"Bepaling van de afmeting van het bestratingselement."	""	"formaat van bestratingselement"	"Bepaling van de afmeting van het bestratingselement."	""	""	"true"	"https://wegenenverkeer-test.data.vlaanderen.be/ns/onderdeel#"	"BestratingVanGebakkenStraatsteen.formaatVanBestratingselement"	"http://www.w3.org/2002/07/owl#ObjectProperty"	"https://wegenenverkeer-test.data.vlaanderen.be/ns/onderdeel#BestratingVanGebakkenStraatsteen"	"http://www.w3.org/2004/02/skos/core#Concept"	""	"1"	"1"
"attribute"	"OSLO-Onderdeel"	"standaardkwaliteitsklasse"	"{090FEA83-7626-456e-96A2-28C998ACD0B5}"	""	"BestratingVanGebakkenStraatsteen"	"{96A1051C-CFED-4830-AF40-F4B444CBD8E7}"	"KlStandaardkwaliteitsklasse"	"standaardkwaliteitsklasse"	"De standaardkwaliteitsklasse volgens PTV 910."	""	"standaardkwaliteitsklasse"	"De standaardkwaliteitsklasse volgens PTV 910."	""	""	"true"	"https://wegenenverkeer-test.data.vlaanderen.be/ns/onderdeel#"	"BestratingVanGebakkenStraatsteen.standaardkwaliteitsklasse"	"http://www.w3.org/2002/07/owl#ObjectProperty"	"https://wegenenverkeer-test.data.vlaanderen.be/ns/onderdeel#BestratingVanGebakkenStraatsteen"	"http://www.w3.org/2004/02/skos/core#Concept"	""	"1"	"1"
"attribute"	"OSLO-Installatie"	"dwarsprofiel"	"{58701865-3876-4e79-8963-9005F24BCD6C}"	""	"Baanlichaam"	"{B1894702-9092-4543-93E5-7F08996F53AF}"	"DtcDocument"	"dwarsprofiel"	"Een dwarsprofiel is een doorsnijding van een terrein of constructie met een verticaal vlak, aangebracht loodrecht op de as ervan."	"Bestanden van het type xlsx, dwg of pdf."	"dwarsprofiel"	"Een dwarsprofiel is een doorsnijding van een terrein of constructie met een verticaal vlak, aangebracht loodrecht op de as ervan."	""	""	"true"	"https://wegenenverkeer-test.data.vlaanderen.be/ns/installatie#"	"Baanlichaam.dwarsprofiel"	"http://www.w3.org/2002/07/owl#ObjectProperty"	"https://wegenenverkeer-test.data.vlaanderen.be/ns/installatie#Baanlichaam"	"https://wegenenverkeer-test.data.vlaanderen.be/ns/implementatieelement#DtcDocument"	""	"1"	"1"
"attribute"	"OSLO-Installatie"	"horizontaleLigging"	"{00AC3EC2-3AD6-4515-ABB8-D93F96697C1F}"	""	"Baanlichaam"	"{B1894702-9092-4543-93E5-7F08996F53AF}"	"DtcDocument"	"horizontale ligging"	"De horizontale ligging van het baanlichaam als document bijlage."	"Bestanden van het type xlsx, dwg of pdf."	"horizontale ligging"	"De horizontale ligging van het baanlichaam als document bijlage."	""	""	"true"	"https://wegenenverkeer-test.data.vlaanderen.be/ns/installatie#"	"Baanlichaam.horizontaleLigging"	"http://www.w3.org/2002/07/owl#ObjectProperty"	"https://wegenenverkeer-test.data.vlaanderen.be/ns/installatie#Baanlichaam"	"https://wegenenverkeer-test.data.vlaanderen.be/ns/implementatieelement#DtcDocument"	""	"1"	"1"
"attribute"	"OSLO-Installatie"	"langsprofiel"	"{FD6CCAD6-08B5-4985-8916-69FD597E264C}"	""	"Baanlichaam"	"{B1894702-9092-4543-93E5-7F08996F53AF}"	"DtcDocument"	"langsprofiel"	"Een langsprofiel is een doorsnijding van een terrein of constructie met een verticaal vlak, aangebracht in de lengterichting van de as ervan."	"Bestanden van het type xlsx, dwg of pdf."	"langsprofiel"	"Een langsprofiel is een doorsnijding van een terrein of constructie met een verticaal vlak, aangebracht in de lengterichting van de as ervan."	""	""	"true"	"https://wegenenverkeer-test.data.vlaanderen.be/ns/installatie#"	"Baanlichaam.langsprofiel"	"http://www.w3.org/2002/07/owl#ObjectProperty"	"https://wegenenverkeer-test.data.vlaanderen.be/ns/installatie#Baanlichaam"	"https://wegenenverkeer-test.data.vlaanderen.be/ns/implementatieelement#DtcDocument"	""	"1"	"1"
"attribute"	"OSLO-Onderdeel"	"aard"	"{B090C45C-175A-4677-9D54-245B050BAA57}"	""	"WaterdoorlatendeBestrating"	"{308738F7-03B1-4297-9561-764CDAD96BEB}"	"KlAardWBSS"	"aard"	"Het kenmerk of de vorm van de waterdoorlatende betonstraatsteen waardoor infiltratie van hemelwater in de bodem mogelijk is."	""	"aard"	"Het kenmerk of de vorm van de waterdoorlatende betonstraatsteen waardoor infiltratie van hemelwater in de bodem mogelijk is."	""	""	"true"	"https://wegenenverkeer-test.data.vlaanderen.be/ns/onderdeel#"	"WaterdoorlatendeBestrating.aard"	"http://www.w3.org/2002/07/owl#ObjectProperty"	"https://wegenenverkeer-test.data.vlaanderen.be/ns/onderdeel#WaterdoorlatendeBestrating"	"http://www.w3.org/2004/02/skos/core#Concept"	""	"1"	"1"
"attribute"	"OSLO-Onderdeel"	"afmetingVanBestratingselementLxB"	"{BC859C5C-7CC1-43c5-B8E0-E16B04770C9C}"	""	"WaterdoorlatendeBestrating"	"{308738F7-03B1-4297-9561-764CDAD96BEB}"	"KlBestratingselementAfmetingLxB"	"afmeting van bestratingselement LxB"	"De lengte en breedte van het bestratingselement in millimeter."	""	"afmeting van bestratingselement LxB"	"De lengte en breedte van het bestratingselement in millimeter."	""	""	"true"	"https://wegenenverkeer-test.data.vlaanderen.be/ns/onderdeel#"	"WaterdoorlatendeBestrating.afmetingVanBestratingselementLxB"	"http://www.w3.org/2002/07/owl#ObjectProperty"	"https://wegenenverkeer-test.data.vlaanderen.be/ns/onderdeel#WaterdoorlatendeBestrating"	"http://www.w3.org/2004/02/skos/core#Concept"	""	"1"	"1"
"attribute"	"OSLO-Onderdeel"	"afwerking"	"{42FDBEF9-0F37-4ba3-A914-218EEDBB2532}"	""	"WaterdoorlatendeBestrating"	"{308738F7-03B1-4297-9561-764CDAD96BEB}"	"KlBestratingAfwerking"	"afwerking"	"Bepaling van de afwerking van de waterdoorlatende betonstraatstenen of betontegels."	""	"afwerking"	"Bepaling van de afwerking van de waterdoorlatende betonstraatstenen of betontegels."	""	""	"true"	"https://wegenenverkeer-test.data.vlaanderen.be/ns/onderdeel#"	"WaterdoorlatendeBestrating.afwerking"	"http://www.w3.org/2002/07/owl#ObjectProperty"	"https://wegenenverkeer-test.data.vlaanderen.be/ns/onderdeel#WaterdoorlatendeBestrating"	"http://www.w3.org/2004/02/skos/core#Concept"	""	"1"	"1"
"attribute"	"OSLO-Onderdeel"	"type"	"{6EB6787B-EB6E-4656-90C8-3980BBDAB515}"	""	"WaterdoorlatendeBestrating"	"{308738F7-03B1-4297-9561-764CDAD96BEB}"	"KlWBSSType"	"type"	"Het type van waterdoorlatende betonstraatstenen of betontegels."	""	"type"	"Het type van waterdoorlatende betonstraatstenen of betontegels."	""	""	"true"	"https://wegenenverkeer-test.data.vlaanderen.be/ns/onderdeel#"	"WaterdoorlatendeBestrating.type"	"http://www.w3.org/2002/07/owl#ObjectProperty"	"https://wegenenverkeer-test.data.vlaanderen.be/ns/onderdeel#WaterdoorlatendeBestrating"	"http://www.w3.org/2004/02/skos/core#Concept"	""	"1"	"1"
"attribute"	"OSLO-Onderdeel"	"afmetingVanBestratingselementLxB"	"{BCD00A1A-2E68-45ca-9A9A-A85A78A0B259}"	""	"BestratingVanNatuursteentegel"	"{5E289810-75D3-48cf-8162-914BA2DBA97E}"	"KlBestratingselementAfmetingLxB"	"afmeting van bestratingselement LxB"	"De lengte en breedte van het bestratingselement in millimeter."	""	"afmeting van bestratingselement LxB"	"De lengte en breedte van het bestratingselement in millimeter."	""	""	"true"	"https://wegenenverkeer-test.data.vlaanderen.be/ns/onderdeel#"	"BestratingVanNatuursteentegel.afmetingVanBestratingselementLxB"	"http://www.w3.org/2002/07/owl#ObjectProperty"	"https://wegenenverkeer-test.data.vlaanderen.be/ns/onderdeel#BestratingVanNatuursteentegel"	"http://www.w3.org/2004/02/skos/core#Concept"	""	"1"	"1"
"attribute"	"OSLO-Onderdeel"	"afwerking"	"{CA8C5C9D-AD09-4141-9CD5-3F288DC23C52}"	""	"BestratingVanNatuursteentegel"	"{5E289810-75D3-48cf-8162-914BA2DBA97E}"	"KlBestratingAfwerking"	"afwerking"	"Bepaling van de afwerking van het oppervlak van de natuursteentegels."	""	"afwerking"	"Bepaling van de afwerking van het oppervlak van de natuursteentegels."	""	""	"true"	"https://wegenenverkeer-test.data.vlaanderen.be/ns/onderdeel#"	"BestratingVanNatuursteentegel.afwerking"	"http://www.w3.org/2002/07/owl#ObjectProperty"	"https://wegenenverkeer-test.data.vlaanderen.be/ns/onderdeel#BestratingVanNatuursteentegel"	"http://www.w3.org/2004/02/skos/core#Concept"	""	"1"	"1"
"attribute"	"OSLO-Onderdeel"	"gebruiksklasse"	"{C7457330-FE5B-49a9-A8A2-BDDB06BDAD22}"	""	"BestratingVanNatuursteentegel"	"{5E289810-75D3-48cf-8162-914BA2DBA97E}"	"KlNatuursteentegelGebruiksklasse"	"gebruiksklasse"	"Bepaling van het toegelaten verkeer en belasting op de bestrating van natuursteentegels."	""	"gebruiksklasse"	"Bepaling van het toegelaten verkeer en belasting op de bestrating van natuursteentegels."	""	""	"true"	"https://wegenenverkeer-test.data.vlaanderen.be/ns/onderdeel#"	"BestratingVanNatuursteentegel.gebruiksklasse"	"http://www.w3.org/2002/07/owl#ObjectProperty"	"https://wegenenverkeer-test.data.vlaanderen.be/ns/onderdeel#BestratingVanNatuursteentegel"	"http://www.w3.org/2004/02/skos/core#Concept"	""	"1"	"1"
"attribute"	"OSLO-Onderdeel"	"formaat"	"{6AF716CA-6020-4c38-B2CF-83F1D8F279CF}"	""	"BestratingVanMozaiekkei"	"{259F6C54-874B-44b1-A253-327BFE6B6856}"	"KlMozaiekkeiFormaat"	"formaat"	"De grootte van mozaïekkei."	""	"formaat"	"De grootte van mozaïekkei."	""	""	"true"	"https://wegenenverkeer-test.data.vlaanderen.be/ns/onderdeel#"	"BestratingVanMozaiekkei.formaat"	"http://www.w3.org/2002/07/owl#ObjectProperty"	"https://wegenenverkeer-test.data.vlaanderen.be/ns/onderdeel#BestratingVanMozaiekkei"	"http://www.w3.org/2004/02/skos/core#Concept"	""	"1"	"1"
"attribute"	"OSLO-Onderdeel"	"isHerbruik"	"{E959A033-0E29-4b81-BCBD-0969D6BCEB5A}"	""	"BestratingVanMozaiekkei"	"{259F6C54-874B-44b1-A253-327BFE6B6856}"	"Boolean"	"is herbruik"	"Bepaling of de mozaïekkeien gerecycleerd werden."	""	"is herbruik"	"Bepaling of de mozaïekkeien gerecycleerd werden."	""	""	"true"	"https://wegenenverkeer-test.data.vlaanderen.be/ns/onderdeel#"	"BestratingVanMozaiekkei.isHerbruik"	"http://www.w3.org/2002/07/owl#DatatypeProperty"	"https://wegenenverkeer-test.data.vlaanderen.be/ns/onderdeel#BestratingVanMozaiekkei"	"http://www.w3.org/2001/XMLSchema#boolean"	""	"1"	"1"
"attribute"	"OSLO-Onderdeel"	"afmetingVanBestratingselementBxl"	"{F0841947-F980-47a5-911F-6952AA25987B}"	""	"BestratingVanKassei"	"{B9E2C7CF-7520-4ece-90FE-C08A4EC9332C}"	"DtcAfmetingBxlInCm"	"afmeting van bestratingselement bxl"	"Afmeting van de breedte in cm (langste)
 en van de lengte in cm (kortste)
 van de kassei."	""	"afmeting van bestratingselement bxl"	"Afmeting van de breedte in cm (langste)
 en van de lengte in cm (kortste)
 van de kassei."	""	""	"true"	"https://wegenenverkeer-test.data.vlaanderen.be/ns/onderdeel#"	"BestratingVanKassei.afmetingVanBestratingselementBxl"	"http://www.w3.org/2002/07/owl#ObjectProperty"	"https://wegenenverkeer-test.data.vlaanderen.be/ns/onderdeel#BestratingVanKassei"	"https://wegenenverkeer-test.data.vlaanderen.be/ns/implementatieelement#DtcAfmetingBxlInCm"	""	"1"	"1"
"attribute"	"OSLO-Onderdeel"	"vulling"	"{99514DC0-3536-4dba-A751-C8A28E1E16D0}"	""	"VerhardingGrasKunststofplaat"	"{196C4122-9780-42ad-9367-19ABD189EB4B}"	"KlBestratingOpvulsoort"	"vulling"	"Het gebruikte materiaal als toevoeging in de vrije openingen van de gras-kunststofplaten."	""	"vulling"	"Het gebruikte materiaal als toevoeging in de vrije openingen van de gras-kunststofplaten."	""	""	"true"	"https://wegenenverkeer-test.data.vlaanderen.be/ns/onderdeel#"	"VerhardingGrasKunststofplaat.vulling"	"http://www.w3.org/2002/07/owl#ObjectProperty"	"https://wegenenverkeer-test.data.vlaanderen.be/ns/onderdeel#VerhardingGrasKunststofplaat"	"http://www.w3.org/2004/02/skos/core#Concept"	""	"1"	"1"
"attribute"	"OSLO-Onderdeel"	"afmetingVanBestratingselementLxB"	"{FB322F56-D691-45e8-A2FC-4C9090768603}"	""	"BestratingVanBetontegel"	"{636CDE1D-9515-4f14-B506-11B754BA78BB}"	"KlBestratingselementAfmetingLxB"	"afmeting van bestratingselement LxB"	"De lengte en breedte van het bestratingselement in millimeter."	""	"afmeting van bestratingselement LxB"	"De lengte en breedte van het bestratingselement in millimeter."	""	""	"true"	"https://wegenenverkeer-test.data.vlaanderen.be/ns/onderdeel#"	"BestratingVanBetontegel.afmetingVanBestratingselementLxB"	"http://www.w3.org/2002/07/owl#ObjectProperty"	"https://wegenenverkeer-test.data.vlaanderen.be/ns/onderdeel#BestratingVanBetontegel"	"http://www.w3.org/2004/02/skos/core#Concept"	""	"1"	"1"
"attribute"	"OSLO-Onderdeel"	"afwerking"	"{B1CC88C3-29CD-4958-BE7F-2770FC76C7D1}"	""	"BestratingVanBetontegel"	"{636CDE1D-9515-4f14-B506-11B754BA78BB}"	"KlBestratingAfwerking"	"afwerking"	"Bepaling van afwerking van de betontegels."	""	"afwerking"	"Bepaling van afwerking van de betontegels."	""	""	"true"	"https://wegenenverkeer-test.data.vlaanderen.be/ns/onderdeel#"	"BestratingVanBetontegel.afwerking"	"http://www.w3.org/2002/07/owl#ObjectProperty"	"https://wegenenverkeer-test.data.vlaanderen.be/ns/onderdeel#BestratingVanBetontegel"	"http://www.w3.org/2004/02/skos/core#Concept"	""	"1"	"1"
"attribute"	"OSLO-Onderdeel"	"type"	"{92AD8EBD-839D-4c11-8B81-2DA12E3CF20D}"	""	"BestratingVanBetontegel"	"{636CDE1D-9515-4f14-B506-11B754BA78BB}"	"KlBSSType"	"type"	"Het type betontegel."	""	"type"	"Het type betontegel."	""	""	"true"	"https://wegenenverkeer-test.data.vlaanderen.be/ns/onderdeel#"	"BestratingVanBetontegel.type"	"http://www.w3.org/2002/07/owl#ObjectProperty"	"https://wegenenverkeer-test.data.vlaanderen.be/ns/onderdeel#BestratingVanBetontegel"	"http://www.w3.org/2004/02/skos/core#Concept"	""	"1"	"1"
"attribute"	"OSLO-Onderdeel"	"afmetingVanBestratingselementLxB"	"{1D3D88BA-7CED-4ffa-8A7B-ECAC510E42F1}"	""	"BestratingVanBetonstraatsteen"	"{7D37665E-88AD-4293-A601-A587DBB0CBC1}"	"KlBestratingselementAfmetingLxB"	"afmeting van bestratingselement LxB"	"De lengte en breedte van het bestratingselement in millimeter."	""	"afmeting van bestratingselement LxB"	"De lengte en breedte van het bestratingselement in millimeter."	""	""	"true"	"https://wegenenverkeer-test.data.vlaanderen.be/ns/onderdeel#"	"BestratingVanBetonstraatsteen.afmetingVanBestratingselementLxB"	"http://www.w3.org/2002/07/owl#ObjectProperty"	"https://wegenenverkeer-test.data.vlaanderen.be/ns/onderdeel#BestratingVanBetonstraatsteen"	"http://www.w3.org/2004/02/skos/core#Concept"	""	"1"	"1"
"attribute"	"OSLO-Onderdeel"	"afwerking"	"{07918C84-474C-4059-9DC5-22BAD1C47622}"	""	"BestratingVanBetonstraatsteen"	"{7D37665E-88AD-4293-A601-A587DBB0CBC1}"	"KlBestratingAfwerking"	"afwerking"	"Bepaling van afwerking van de betonstraatstenen."	""	"afwerking"	"Bepaling van afwerking van de betonstraatstenen."	""	""	"true"	"https://wegenenverkeer-test.data.vlaanderen.be/ns/onderdeel#"	"BestratingVanBetonstraatsteen.afwerking"	"http://www.w3.org/2002/07/owl#ObjectProperty"	"https://wegenenverkeer-test.data.vlaanderen.be/ns/onderdeel#BestratingVanBetonstraatsteen"	"http://www.w3.org/2004/02/skos/core#Concept"	""	"1"	"1"
"attribute"	"OSLO-Onderdeel"	"randafwerking"	"{B2B3D040-BFB1-4723-998B-CD264BF05C90}"	""	"BestratingVanBetonstraatsteen"	"{7D37665E-88AD-4293-A601-A587DBB0CBC1}"	"DtcBSSRandafwerking"	"randafwerking"	"De wijze waarop de rand van de betonstraatsteenverharding is afgewerkt."	""	"randafwerking"	"De wijze waarop de rand van de betonstraatsteenverharding is afgewerkt."	""	""	"true"	"https://wegenenverkeer-test.data.vlaanderen.be/ns/onderdeel#"	"BestratingVanBetonstraatsteen.randafwerking"	"http://www.w3.org/2002/07/owl#ObjectProperty"	"https://wegenenverkeer-test.data.vlaanderen.be/ns/onderdeel#BestratingVanBetonstraatsteen"	"https://wegenenverkeer-test.data.vlaanderen.be/ns/onderdeel#DtcBSSRandafwerking"	""	"1"	"1"
"attribute"	"OSLO-Onderdeel"	"type"	"{2853CAF7-B0BD-454c-8D51-3487500AA49E}"	""	"BestratingVanBetonstraatsteen"	"{7D37665E-88AD-4293-A601-A587DBB0CBC1}"	"KlBSSType"	"type"	"Het type betonstraatsteen."	""	"type"	"Het type betonstraatsteen."	""	""	"true"	"https://wegenenverkeer-test.data.vlaanderen.be/ns/onderdeel#"	"BestratingVanBetonstraatsteen.type"	"http://www.w3.org/2002/07/owl#ObjectProperty"	"https://wegenenverkeer-test.data.vlaanderen.be/ns/onderdeel#BestratingVanBetonstraatsteen"	"http://www.w3.org/2004/02/skos/core#Concept"	""	"1"	"1"
"attribute"	"OSLO-Onderdeel"	"vulling"	"{926C2A69-C8CF-481b-8A2B-4B1DA9AF7DB0}"	""	"BestratingVanGrasbetontegel"	"{160092CD-6173-410c-B82F-2D73FF8251DA}"	"KlBestratingOpvulsoort"	"vulling"	"Het gebruikte materiaal als toevoeging in de vrije openingen van de tegels."	""	"vulling"	"Het gebruikte materiaal als toevoeging in de vrije openingen van de tegels."	""	""	"true"	"https://wegenenverkeer-test.data.vlaanderen.be/ns/onderdeel#"	"BestratingVanGrasbetontegel.vulling"	"http://www.w3.org/2002/07/owl#ObjectProperty"	"https://wegenenverkeer-test.data.vlaanderen.be/ns/onderdeel#BestratingVanGrasbetontegel"	"http://www.w3.org/2004/02/skos/core#Concept"	""	"1"	"1"
"attribute"	"OSLO-Onderdeel"	"heeftDeuvels"	"{0C1A5C5B-CEBC-40cd-9247-A18A7DC94DE0}"	""	"Wegdekvoeg"	"{ABA56653-5FD9-478d-A3B7-9557671EA8DF}"	"Boolean"	"heeft deuvels"	"Aanduiding of de voeg al dan niet verdeuveld is."	""	"heeft deuvels"	"Aanduiding of de voeg al dan niet verdeuveld is."	""	""	"true"	"https://wegenenverkeer-test.data.vlaanderen.be/ns/onderdeel#"	"Wegdekvoeg.heeftDeuvels"	"http://www.w3.org/2002/07/owl#DatatypeProperty"	"https://wegenenverkeer-test.data.vlaanderen.be/ns/onderdeel#Wegdekvoeg"	"http://www.w3.org/2001/XMLSchema#boolean"	""	"1"	"1"
"attribute"	"OSLO-Onderdeel"	"lengte"	"{9B1241D9-6822-4c3d-8FDB-C4E2FFDAC317}"	""	"Wegdekvoeg"	"{ABA56653-5FD9-478d-A3B7-9557671EA8DF}"	"KwantWrdInMeter"	"lengte"	"De lengte van de wegdekvoeg."	""	"lengte"	"De lengte van de wegdekvoeg."	""	""	"true"	"https://wegenenverkeer-test.data.vlaanderen.be/ns/onderdeel#"	"Wegdekvoeg.lengte"	"http://www.w3.org/2002/07/owl#ObjectProperty"	"https://wegenenverkeer-test.data.vlaanderen.be/ns/onderdeel#Wegdekvoeg"	"https://wegenenverkeer-test.data.vlaanderen.be/ns/implementatieelement#KwantWrdInMeter"	""	"1"	"1"
"attribute"	"OSLO-Onderdeel"	"type"	"{0412F542-889C-46a1-B487-65F43958B7C0}"	""	"Wegdekvoeg"	"{ABA56653-5FD9-478d-A3B7-9557671EA8DF}"	"KlWegdekvoegType"	"type"	"Het type van wegdekvoeg."	""	"type"	"Het type van wegdekvoeg."	""	""	"true"	"https://wegenenverkeer-test.data.vlaanderen.be/ns/onderdeel#"	"Wegdekvoeg.type"	"http://www.w3.org/2002/07/owl#ObjectProperty"	"https://wegenenverkeer-test.data.vlaanderen.be/ns/onderdeel#Wegdekvoeg"	"http://www.w3.org/2004/02/skos/core#Concept"	""	"1"	"1"
"attribute"	"OSLO-Onderdeel"	"breedte"	"{1B36FAA4-7EEA-43c7-983F-4C9EC7C36FBA}"	""	"Verankeringslandhoofd"	"{B4371843-424B-4d8b-98ED-E49DCCE63CED}"	"KwantWrdInMeter"	"breedte"	"De breedte van het verankeringslandhoofd in meter."	""	"breedte"	"De breedte van het verankeringslandhoofd in meter."	""	""	"true"	"https://wegenenverkeer-test.data.vlaanderen.be/ns/onderdeel#"	"Verankeringslandhoofd.breedte"	"http://www.w3.org/2002/07/owl#ObjectProperty"	"https://wegenenverkeer-test.data.vlaanderen.be/ns/onderdeel#Verankeringslandhoofd"	"https://wegenenverkeer-test.data.vlaanderen.be/ns/implementatieelement#KwantWrdInMeter"	""	"1"	"1"
"attribute"	"OSLO-Onderdeel"	"lengte"	"{B2B5F65A-2152-4886-A19B-43C81107DDFB}"	""	"Verankeringslandhoofd"	"{B4371843-424B-4d8b-98ED-E49DCCE63CED}"	"KwantWrdInMeter"	"lengte"	"De lengte van het verankeringslandhoofd in meter."	""	"lengte"	"De lengte van het verankeringslandhoofd in meter."	""	""	"true"	"https://wegenenverkeer-test.data.vlaanderen.be/ns/onderdeel#"	"Verankeringslandhoofd.lengte"	"http://www.w3.org/2002/07/owl#ObjectProperty"	"https://wegenenverkeer-test.data.vlaanderen.be/ns/onderdeel#Verankeringslandhoofd"	"https://wegenenverkeer-test.data.vlaanderen.be/ns/implementatieelement#KwantWrdInMeter"	""	"1"	"1"
"attribute"	"OSLO-Onderdeel"	"ribben"	"{D3513DD5-DED3-4c64-9297-F324A158D9AB}"	""	"Verankeringslandhoofd"	"{B4371843-424B-4d8b-98ED-E49DCCE63CED}"	"Integer"	"ribben"	"Het aantal ribben van het verankeringslandhoofd."	""	"ribben"	"Het aantal ribben van het verankeringslandhoofd."	""	""	"true"	"https://wegenenverkeer-test.data.vlaanderen.be/ns/onderdeel#"	"Verankeringslandhoofd.ribben"	"http://www.w3.org/2002/07/owl#DatatypeProperty"	"https://wegenenverkeer-test.data.vlaanderen.be/ns/onderdeel#Verankeringslandhoofd"	"http://www.w3.org/2001/XMLSchema#integer"	""	"1"	"1"
"attribute"	"OSLO-Onderdeel"	"type"	"{80B5406F-8F3C-4a4f-BD4B-2834CF4FB60E}"	""	"Steenslagverharding"	"{4930F1C6-6131-4f1c-9A5C-159A98EF0ADE}"	"KlSteenslagType"	"type"	"Bepaling van het type steenslagverharding."	""	"type"	"Bepaling van het type steenslagverharding."	""	""	"true"	"https://wegenenverkeer-test.data.vlaanderen.be/ns/onderdeel#"	"Steenslagverharding.type"	"http://www.w3.org/2002/07/owl#ObjectProperty"	"https://wegenenverkeer-test.data.vlaanderen.be/ns/onderdeel#Steenslagverharding"	"http://www.w3.org/2004/02/skos/core#Concept"	""	"1"	"1"
"attribute"	"OSLO-Onderdeel"	"type"	"{323D9B96-FD6A-4d95-B2FA-2A474A639150}"	""	"Dolomietverharding"	"{0037F07C-4B8A-4138-8D13-C6D7129E9FE2}"	"KlDolomietType"	"type"	"Het type dolomiet."	""	"type"	"Het type dolomiet."	""	""	"true"	"https://wegenenverkeer-test.data.vlaanderen.be/ns/onderdeel#"	"Dolomietverharding.type"	"http://www.w3.org/2002/07/owl#ObjectProperty"	"https://wegenenverkeer-test.data.vlaanderen.be/ns/onderdeel#Dolomietverharding"	"http://www.w3.org/2004/02/skos/core#Concept"	""	"1"	"1"
"attribute"	"OSLO-Abstracten"	"kleur"	"{654A328C-39CF-4000-A83E-DE4B062387C9}"	""	"Bestrating"	"{52BCC8E0-6618-46f2-8667-6161B876D5A7}"	"KlKleurSupp"	"kleur"	"De kleur van de bestrating."	""	"kleur"	"De kleur van de bestrating."	""	""	"true"	"https://wegenenverkeer-test.data.vlaanderen.be/ns/abstracten#"	"Bestrating.kleur"	"http://www.w3.org/2002/07/owl#ObjectProperty"	"https://wegenenverkeer-test.data.vlaanderen.be/ns/abstracten#Bestrating"	"http://www.w3.org/2004/02/skos/core#Concept"	""	"1"	"1"
"attribute"	"OSLO-Abstracten"	"steenverband"	"{40F9BD08-7007-42d9-87B1-592E1231D16F}"	""	"Bestrating"	"{52BCC8E0-6618-46f2-8667-6161B876D5A7}"	"KlBestratingSteenverband"	"steenverband"	"Het patroon waarin de bestrating gelegd werd."	""	"steenverband"	"Het patroon waarin de bestrating gelegd werd."	""	""	"true"	"https://wegenenverkeer-test.data.vlaanderen.be/ns/abstracten#"	"Bestrating.steenverband"	"http://www.w3.org/2002/07/owl#ObjectProperty"	"https://wegenenverkeer-test.data.vlaanderen.be/ns/abstracten#Bestrating"	"http://www.w3.org/2004/02/skos/core#Concept"	""	"1"	"1"
"attribute"	"OSLO-Abstracten"	"voegvulling"	"{4D203FD1-A686-4895-B4ED-184AFE7B5747}"	""	"Bestrating"	"{52BCC8E0-6618-46f2-8667-6161B876D5A7}"	"KlBestratingVoegvulling"	"voegvulling"	"De gebruikte voegvulling van de bestrating."	""	"voegvulling"	"De gebruikte voegvulling van de bestrating."	""	""	"true"	"https://wegenenverkeer-test.data.vlaanderen.be/ns/abstracten#"	"Bestrating.voegvulling"	"http://www.w3.org/2002/07/owl#ObjectProperty"	"https://wegenenverkeer-test.data.vlaanderen.be/ns/abstracten#Bestrating"	"http://www.w3.org/2004/02/skos/core#Concept"	""	"1"	"1"
