"EA-Type"	"EA-Package"	"EA-Name"	"EA-GUID"	"EA-Parent"	"EA-Domain"	"EA-Domain-GUID"	"EA-Range"	"label"	"definition"	"usage"	"ap-label-nl"	"ap-definition-nl"	"ap-usageNote-nl"	"ap-codelist"	"external term"	"namespace"	"localname"	"type"	"domain"	"range"	"parent"	"min card"	"max card"
"Package"	""	"OSLO-Zone-30"	"{BBAAE7DF-5234-42e7-843D-3143D2D922A2}"	""	""	""	""	""	""	""	""	""	""	""	""	"http://"	"fixme.com"	"http://www.w3.org/2002/07/owl#Ontology"	""	""	""	""	""
"CLASS"	"OSLO-Proefenmeting"	"Proef"	"{A1EF4D85-B064-4217-9932-40B85F6EEC1B}"	""	""	""	""	"Proeven"	"Abstracte voor de gemeenschappelijke eigenschappen en relaties alle proeven."	""	"Proeven"	"Abstracte voor de gemeenschappelijke eigenschappen en relaties alle proeven."	""	""	"true"	"https://wegenenverkeer.data.vlaanderen.be/ns/proefenmeting#"	"Proef"	"http://www.w3.org/2000/01/rdf-schema#Class"	""	""	""	""	""
"CLASS"	"OSLO-Proefenmeting"	"ProefTijdensVerkeersbord"	"{49CC568F-867C-4fb8-9EF6-5CF13F341F2B}"	"Proef"	""	""	""	"Proef tijdens verkeersbord"	"Abstracte voor de eigenschappen van de proef op het verkeersbord tijdens de werken."	""	"Proef tijdens verkeersbord"	"Abstracte voor de eigenschappen van de proef op het verkeersbord tijdens de werken."	""	""	"true"	"https://wegenenverkeer.data.vlaanderen.be/ns/proefenmeting#"	"ProefTijdensVerkeersbord"	"http://www.w3.org/2000/01/rdf-schema#Class"	""	""	"https://wegenenverkeer.data.vlaanderen.be/ns/proefenmeting#Proef"	""	""
"CLASS"	"OSLO-Proefenmeting"	"ProefAPosterioriVerkeersbord"	"{B14F53F3-49EC-4a42-8BB2-1F5107E76323}"	"Proef"	""	""	""	"Proef a posteriori verkeersbord"	"Abstracte voor de gemeenschappelijke eigenschappen van de proef op een verkeersbord na de werken."	""	"Proef a posteriori verkeersbord"	"Abstracte voor de gemeenschappelijke eigenschappen van de proef op een verkeersbord na de werken."	""	""	"true"	"https://wegenenverkeer.data.vlaanderen.be/ns/proefenmeting#"	"ProefAPosterioriVerkeersbord"	"http://www.w3.org/2000/01/rdf-schema#Class"	""	""	"https://wegenenverkeer.data.vlaanderen.be/ns/proefenmeting#Proef"	""	""
"CLASS"	"OSLO-Abstracten"	"VRIDraagConstructie"	"{A43B5DE6-5C6C-4063-B247-4509A5F20DCB}"	"SteunStandaard"	""	""	""	"Verkeersregelinstallatie draagconstructie"	"Abstracte voor een dragend element (bv. paal, kolom,& ) waaraan lantaarns met verkeerslichten bevestigd kunnen worden bij de verkeersregelinstallatie."	""	"Verkeersregelinstallatie draagconstructie"	"Abstracte voor een dragend element (bv. paal, kolom,& ) waaraan lantaarns met verkeerslichten bevestigd kunnen worden bij de verkeersregelinstallatie."	""	""	"true"	"https://wegenenverkeer.data.vlaanderen.be/ns/abstracten#"	"VRIDraagConstructie"	"http://www.w3.org/2000/01/rdf-schema#Class"	""	""	"https://wegenenverkeer.data.vlaanderen.be/ns/abstracten#SteunStandaard"	""	""
"CLASS"	"OSLO-Abstracten"	"PU"	"{9423AEC3-7FAD-439a-960C-A19BC5DDE9D6}"	"AWVNaamObject"	""	""	""	"PU"	"TODO"	""	"PU"	"TODO"	""	""	"true"	"https://wegenenverkeer.data.vlaanderen.be/ns/abstracten#"	"PU"	"http://www.w3.org/2000/01/rdf-schema#Class"	""	""	"https://wegenenverkeer.data.vlaanderen.be/ns/implementatieelement#AWVNaamObject"	""	""
"CLASS"	"OSLO-Abstracten"	"Ruimtes"	"{E469FF22-9017-4ec5-A947-52822DE9317B}"	"AWVNaamObject"	""	""	""	"Ruimtes"	"Abstracte voor alle ruimtes."	""	"Ruimtes"	"Abstracte voor alle ruimtes."	""	""	"true"	"https://wegenenverkeer.data.vlaanderen.be/ns/abstracten#"	"Ruimtes"	"http://www.w3.org/2000/01/rdf-schema#Class"	""	""	"https://wegenenverkeer.data.vlaanderen.be/ns/implementatieelement#AWVNaamObject"	""	""
"CLASS"	"OSLO-Abstracten"	"Energiemeter"	"{AFF5AF69-98B0-404e-85AD-5D41582362F9}"	"AWVNaamObject"	""	""	""	"Energiemeter"	"Abstracte voor alle energiemeters."	""	"Energiemeter"	"Abstracte voor alle energiemeters."	""	""	"true"	"https://wegenenverkeer.data.vlaanderen.be/ns/abstracten#"	"Energiemeter"	"http://www.w3.org/2000/01/rdf-schema#Class"	""	""	"https://wegenenverkeer.data.vlaanderen.be/ns/implementatieelement#AWVNaamObject"	""	""
"CLASS"	"OSLO-Abstracten"	"Voedingspunt"	"{AEA5D7F2-A679-4388-B1BB-5E545F18DF3A}"	"AWVNaamObject"	""	""	""	"Voedingspunt"	"Abstracte voor het aansluitpunt van de voeding"	""	"Voedingspunt"	"Abstracte voor het aansluitpunt van de voeding"	""	""	"true"	"https://wegenenverkeer.data.vlaanderen.be/ns/abstracten#"	"Voedingspunt"	"http://www.w3.org/2000/01/rdf-schema#Class"	""	""	"https://wegenenverkeer.data.vlaanderen.be/ns/implementatieelement#AWVNaamObject"	""	""
"CLASS"	"OSLO-Abstracten"	"DNB"	"{10780FA6-BAFA-4b40-9BA9-48553DA2B44A}"	"Voedingspunt"	""	""	""	"DNB"	"TODO"	""	"DNB"	"TODO"	""	""	"true"	"https://wegenenverkeer.data.vlaanderen.be/ns/abstracten#"	"DNB"	"http://www.w3.org/2000/01/rdf-schema#Class"	""	""	"https://wegenenverkeer.data.vlaanderen.be/ns/abstracten#Voedingspunt"	""	""
"CLASS"	"OSLO-Implementatieelement"	"AWVObject"	"{C3CBD401-EC86-4363-9821-CCE89EB2F0A9}"	""	""	""	""	"AWV object"	"Abstracte als de basisklasse (super class) voor alle uniek geïdentificeerde OTL objecten met de basiseigenschappen die elk OTL object minstens heeft."	""	"AWV object"	"Abstracte als de basisklasse (super class) voor alle uniek geïdentificeerde OTL objecten met de basiseigenschappen die elk OTL object minstens heeft."	""	""	"true"	"https://wegenenverkeer.data.vlaanderen.be/ns/implementatieelement#"	"AWVObject"	"http://www.w3.org/2000/01/rdf-schema#Class"	""	""	""	""	""
"CLASS"	"OSLO-Implementatieelement"	"AWVNaamObject"	"{5C144615-47A1-4f8b-A119-B293BCFD84B5}"	"AWVObject"	""	""	""	"AWV naam object"	"Abstracte als de basisklasse voor elk OTL object dat benoemd wordt met een mensleesbare identificator. "	""	"AWV naam object"	"Abstracte als de basisklasse voor elk OTL object dat benoemd wordt met een mensleesbare identificator. "	""	""	"true"	"https://wegenenverkeer.data.vlaanderen.be/ns/implementatieelement#"	"AWVNaamObject"	"http://www.w3.org/2000/01/rdf-schema#Class"	""	""	"https://wegenenverkeer.data.vlaanderen.be/ns/implementatieelement#AWVObject"	""	""
"CLASS"	"OSLO-Onderdeel"	"ForfaitaireAansluiting"	"{DFC38369-5E39-44a8-95CB-690115F81086}"	"AWVNaamObject"	""	""	""	"Forfaitaire aansluiting"	"TODO"	""	"Forfaitaire aansluiting"	"TODO"	""	""	"true"	"https://wegenenverkeer.data.vlaanderen.be/ns/onderdeel#"	"ForfaitaireAansluiting"	"http://www.w3.org/2000/01/rdf-schema#Class"	""	""	"https://wegenenverkeer.data.vlaanderen.be/ns/implementatieelement#AWVNaamObject"	""	""
"CLASS"	"OSLO-Onderdeel"	"Paalkast"	"{A05DE06B-CC91-484e-9863-86FEF2D477F1}"	"Ruimtes"	""	""	""	"Paalkast"	"TODO"	""	"Paalkast"	"TODO"	""	""	"true"	"https://wegenenverkeer.data.vlaanderen.be/ns/onderdeel#"	"Paalkast"	"http://www.w3.org/2000/01/rdf-schema#Class"	""	""	"https://wegenenverkeer.data.vlaanderen.be/ns/abstracten#Ruimtes"	""	""
"CLASS"	"OSLO-Onderdeel"	"Z30BordType"	"{936DE4AC-C28E-42b3-A41C-DBE18574414E}"	"LEDBordType"	""	""	""	"Z30 bord type"	"TODO"	""	"Z30 bord type"	"TODO"	""	""	"true"	"https://wegenenverkeer.data.vlaanderen.be/ns/onderdeel#"	"Z30BordType"	"http://www.w3.org/2000/01/rdf-schema#Class"	""	""	"https://wegenenverkeer.data.vlaanderen.be/ns/abstracten#LEDBordType"	""	""
"CLASS"	"OSLO-Abstracten"	"LEDBordType"	"{00E39381-6075-451e-AF85-72938A696AD0}"	""	""	""	""	"LED-bord type"	"TODO"	""	"LED-bord type"	"TODO"	""	""	"true"	"https://wegenenverkeer.data.vlaanderen.be/ns/abstracten#"	"LEDBordType"	"http://www.w3.org/2000/01/rdf-schema#Class"	""	""	""	""	""
"CLASS"	"OSLO-Onderdeel"	"EnergiemeterDNB"	"{6EF6B2FA-1630-4351-BD93-43F945B51FAE}"	"Energiemeter"	""	""	""	"Energiemeter DNB"	"Toestel dat eigendom is van de distributienetbeheerder en in de installatie van AWV geplaatst wordt voor het meten van het energieverbruik van de betreffende installatie"	""	"Energiemeter DNB"	"Toestel dat eigendom is van de distributienetbeheerder en in de installatie van AWV geplaatst wordt voor het meten van het energieverbruik van de betreffende installatie"	""	""	"true"	"https://wegenenverkeer.data.vlaanderen.be/ns/onderdeel#"	"EnergiemeterDNB"	"http://www.w3.org/2000/01/rdf-schema#Class"	""	""	"https://wegenenverkeer.data.vlaanderen.be/ns/abstracten#Energiemeter"	""	""
"CLASS"	"OSLO-Onderdeel"	"DNBLaagspanning"	"{DAB4BD74-4508-4e7c-9301-7928132C8D78}"	"DNB"	""	""	""	"DNB laagspanning"	"Aansluiting op het laagspanningsnet van de distributienetbeheerder"	""	"DNB laagspanning"	"Aansluiting op het laagspanningsnet van de distributienetbeheerder"	""	""	"true"	"https://wegenenverkeer.data.vlaanderen.be/ns/onderdeel#"	"DNBLaagspanning"	"http://www.w3.org/2000/01/rdf-schema#Class"	""	""	"https://wegenenverkeer.data.vlaanderen.be/ns/abstracten#DNB"	""	""
"CLASS"	"OSLO-Onderdeel"	"Z30CPUType"	"{37CB19B6-F96E-4a75-90AB-9AACEB9DF00D}"	""	""	""	""	"Z30 CPU type"	"TODO"	""	"Z30 CPU type"	"TODO"	""	""	"true"	"https://wegenenverkeer.data.vlaanderen.be/ns/onderdeel#"	"Z30CPUType"	"http://www.w3.org/2000/01/rdf-schema#Class"	""	""	""	""	""
"CLASS"	"OSLO-Abstracten"	"SteunStandaard"	"{D37D818D-FF1B-4e19-9E99-6D41A167325C}"	"Draagconstructie"	""	""	""	"Steun standaard"	"Abstracte voor de standaard steunen."	""	"Steun standaard"	"Abstracte voor de standaard steunen."	""	""	"true"	"https://wegenenverkeer.data.vlaanderen.be/ns/abstracten#"	"SteunStandaard"	"http://www.w3.org/2000/01/rdf-schema#Class"	""	""	"https://wegenenverkeer.data.vlaanderen.be/ns/abstracten#Draagconstructie"	""	""
"CLASS"	"OSLO-Abstracten"	"Seinlantaarn"	"{974C44AF-9549-401d-8605-AC5991536203}"	"AWVNaamObject"	""	""	""	"Seinlantaarns"	"Abstracte voor het geheel van één of meerdere verkeerslichten die boven elkaar worden opgesteld en worden bevestigd op een steun, teneinde de beweging van een weggebruiker die een bepaald traject volgt, te verhinderen of toe te laten."	""	"Seinlantaarns"	"Abstracte voor het geheel van één of meerdere verkeerslichten die boven elkaar worden opgesteld en worden bevestigd op een steun, teneinde de beweging van een weggebruiker die een bepaald traject volgt, te verhinderen of toe te laten."	""	""	"true"	"https://wegenenverkeer.data.vlaanderen.be/ns/abstracten#"	"Seinlantaarn"	"http://www.w3.org/2000/01/rdf-schema#Class"	""	""	"https://wegenenverkeer.data.vlaanderen.be/ns/implementatieelement#AWVNaamObject"	""	""
"CLASS"	"OSLO-Onderdeel"	"Knipperlantaarn"	"{506DF1F1-1762-49d9-8378-48192C6B9085}"	"Seinlantaarn"	""	""	""	"Knipperlantaarn"	"Een lantaarn bestaande uit één of meerdere knipperende oranje-geel verkeerslichten bevestigd op een steun, teneinde de weggebruiker te waarschuwen."	""	"Knipperlantaarn"	"Een lantaarn bestaande uit één of meerdere knipperende oranje-geel verkeerslichten bevestigd op een steun, teneinde de weggebruiker te waarschuwen."	""	""	"true"	"https://wegenenverkeer.data.vlaanderen.be/ns/onderdeel#"	"Knipperlantaarn"	"http://www.w3.org/2000/01/rdf-schema#Class"	""	""	"https://wegenenverkeer.data.vlaanderen.be/ns/abstracten#Seinlantaarn"	""	""
"CLASS"	"OSLO-Onderdeel"	"RetroreflecterendVerkeersbord"	"{BADFBCD5-2049-415c-8C1B-ABF1F7EDC492}"	"ProefAPosterioriVerkeersbord, ProefTijdensVerkeersbord, AWVObject"	""	""	""	"Retroreflecterend verkeersbord"	"Fysieke drager van het verkeersteken waarvan de betekenis bepaald wordt door een verkeersbordconcept."	""	"Retroreflecterend verkeersbord"	"Fysieke drager van het verkeersteken waarvan de betekenis bepaald wordt door een verkeersbordconcept."	""	""	"true"	"https://wegenenverkeer.data.vlaanderen.be/ns/onderdeel#"	"RetroreflecterendVerkeersbord"	"http://www.w3.org/2000/01/rdf-schema#Class"	""	""	"https://wegenenverkeer.data.vlaanderen.be/ns/proefenmeting#ProefAPosterioriVerkeersbord, https://wegenenverkeer.data.vlaanderen.be/ns/proefenmeting#ProefTijdensVerkeersbord, https://wegenenverkeer.data.vlaanderen.be/ns/implementatieelement#AWVObject"	""	""
"CLASS"	"OSLO-Onderdeel"	"Z30CPU"	"{BFE73093-060C-4d9c-8BF8-81CB582CB04F}"	"PU"	""	""	""	"Z30 CPU"	"TODO"	""	"Z30 CPU"	"TODO"	""	""	"true"	"https://wegenenverkeer.data.vlaanderen.be/ns/onderdeel#"	"Z30CPU"	"http://www.w3.org/2000/01/rdf-schema#Class"	""	""	"https://wegenenverkeer.data.vlaanderen.be/ns/abstracten#PU"	""	""
"CLASS"	"OSLO-Onderdeel"	"RechteSteun"	"{C973E78C-8683-4778-B1E2-FACE450CC6DB}"	"VRIDraagConstructie"	""	""	""	"Rechte steun"	"Rechte paal voor het steun geven aan allerlei installaties. Dit omvat het volledige draagsysteem, zijnde de logische samenstelling van met elkaar verbonden onderdelen, bestemd voor het geven van mechanische sterkte en stabiliteit aan de installatie voor wegsignalering.
Afhankelijk van het gekozen modek kan de rechte steun bestemd zijn voor:
Verkeerslichten (A-paal, D-paal en zwanehals), variabele zone 30, bi-flash of andere installaties."	""	"Rechte steun"	"Rechte paal voor het steun geven aan allerlei installaties. Dit omvat het volledige draagsysteem, zijnde de logische samenstelling van met elkaar verbonden onderdelen, bestemd voor het geven van mechanische sterkte en stabiliteit aan de installatie voor wegsignalering.
Afhankelijk van het gekozen modek kan de rechte steun bestemd zijn voor:
Verkeerslichten (A-paal, D-paal en zwanehals), variabele zone 30, bi-flash of andere installaties."	""	""	"true"	"https://wegenenverkeer.data.vlaanderen.be/ns/onderdeel#"	"RechteSteun"	"http://www.w3.org/2000/01/rdf-schema#Class"	""	""	"https://wegenenverkeer.data.vlaanderen.be/ns/abstracten#VRIDraagConstructie"	""	""
"CLASS"	"OSLO-Abstracten"	"SoftwareToegang"	"{7E20EC09-A2A2-4c6f-B816-FE265A38B393}"	"AWVNaamObject"	""	""	""	"Software toegang"	"TODO"	""	"Software toegang"	"TODO"	""	""	"true"	"https://wegenenverkeer.data.vlaanderen.be/ns/abstracten#"	"SoftwareToegang"	"http://www.w3.org/2000/01/rdf-schema#Class"	""	""	"https://wegenenverkeer.data.vlaanderen.be/ns/implementatieelement#AWVNaamObject"	""	""
"CLASS"	"OSLO-Onderdeel"	"Stroomkring"	"{9E56032E-DD28-4ef8-8DCF-FF35647F878A}"	"AWVNaamObject"	""	""	""	"Stroomkring"	"Ook wel vertrek of vertrekkende kabel genoemd. Afgezekerde elektrische geleiders waarmee de applicaties voorzien worden van de nodige voeding"	""	"Stroomkring"	"Ook wel vertrek of vertrekkende kabel genoemd. Afgezekerde elektrische geleiders waarmee de applicaties voorzien worden van de nodige voeding"	""	""	"true"	"https://wegenenverkeer.data.vlaanderen.be/ns/onderdeel#"	"Stroomkring"	"http://www.w3.org/2000/01/rdf-schema#Class"	""	""	"https://wegenenverkeer.data.vlaanderen.be/ns/implementatieelement#AWVNaamObject"	""	""
"CLASS"	"OSLO-Abstracten"	"Draagconstructie"	"{C1093B52-E90F-4b82-A3D3-DB7D8AAE1271}"	"AWVNaamObject"	""	""	""	"Draagconstructie"	"Abstracte voor alle draagconstructies."	""	"Draagconstructie"	"Abstracte voor alle draagconstructies."	""	""	"true"	"https://wegenenverkeer.data.vlaanderen.be/ns/abstracten#"	"Draagconstructie"	"http://www.w3.org/2000/01/rdf-schema#Class"	""	""	"https://wegenenverkeer.data.vlaanderen.be/ns/implementatieelement#AWVNaamObject"	""	""
"CLASS"	"OSLO-Onderdeel"	"Z30Bord"	"{2DBA9F56-9737-4402-B442-14ADEC5DEFF2}"	"LEDBordToegang"	""	""	""	"Z30 bord"	"TODO"	""	"Z30 bord"	"TODO"	""	""	"true"	"https://wegenenverkeer.data.vlaanderen.be/ns/onderdeel#"	"Z30Bord"	"http://www.w3.org/2000/01/rdf-schema#Class"	""	""	"https://wegenenverkeer.data.vlaanderen.be/ns/abstracten#LEDBordToegang"	""	""
"CLASS"	"OSLO-Abstracten"	"LEDBordToegang"	"{F9FCD18B-B222-479b-A20F-9EFDFF7C1F86}"	"AWVNaamObject"	""	""	""	"LED-bord toegang"	"Abstracte als toegang tot de verschillende ledborden."	""	"LED-bord toegang"	"Abstracte als toegang tot de verschillende ledborden."	""	""	"true"	"https://wegenenverkeer.data.vlaanderen.be/ns/abstracten#"	"LEDBordToegang"	"http://www.w3.org/2000/01/rdf-schema#Class"	""	""	"https://wegenenverkeer.data.vlaanderen.be/ns/implementatieelement#AWVNaamObject"	""	""
"CLASS"	"OSLO-Onderdeel"	"Bevestigingsbeugel"	"{D74E2585-DC12-42d0-AA22-9A3F91C3F60F}"	"AWVNaamObject"	""	""	""	"Bevestigingsbeugel"	"Verbindingsstuk waarmee een object kan vastgemaakt worden aan een steun of oppervlak"	""	"Bevestigingsbeugel"	"Verbindingsstuk waarmee een object kan vastgemaakt worden aan een steun of oppervlak"	""	""	"true"	"https://wegenenverkeer.data.vlaanderen.be/ns/onderdeel#"	"Bevestigingsbeugel"	"http://www.w3.org/2000/01/rdf-schema#Class"	""	""	"https://wegenenverkeer.data.vlaanderen.be/ns/implementatieelement#AWVNaamObject"	""	""
"CLASS"	"OSLO-Onderdeel"	"VHSModem"	"{AF204442-454E-4c65-A38E-88E90E319401}"	"AWVNaamObject"	""	""	""	"VHS-modem"	"TODO"	""	"VHS-modem"	"TODO"	""	""	"true"	"https://wegenenverkeer.data.vlaanderen.be/ns/onderdeel#"	"VHSModem"	"http://www.w3.org/2000/01/rdf-schema#Class"	""	""	"https://wegenenverkeer.data.vlaanderen.be/ns/implementatieelement#AWVNaamObject"	""	""
"CLASS"	"OSLO-Onderdeel"	"Kast"	"{3EF2F3D8-F751-4012-8E69-2A37C90B436C}"	"Ruimtes"	""	""	""	"Kast"	"Omhullende behuizing bedoeld als bescherming van elektronische/elektrische apparatuur die erin geplaatst werd, hetzij laagspanningsschakelmateriaal, klemmenblokken..."	""	"Kast"	"Omhullende behuizing bedoeld als bescherming van elektronische/elektrische apparatuur die erin geplaatst werd, hetzij laagspanningsschakelmateriaal, klemmenblokken..."	""	""	"true"	"https://wegenenverkeer.data.vlaanderen.be/ns/onderdeel#"	"Kast"	"http://www.w3.org/2000/01/rdf-schema#Class"	""	""	"https://wegenenverkeer.data.vlaanderen.be/ns/abstracten#Ruimtes"	""	""
"CLASS"	"OSLO-Onderdeel"	"Bevestiging"	"{851E2395-627F-4352-8324-2E91CD6B80DE}"	""	""	""	""	"Bevestiging"	"Deze relatie geeft aan dat twee onderdelen direct fysiek op elkaar bevestigd zijn. Dit kan zowel aan de buitenkant als aan de binnenkant zijn zoals bv. een camera aan een paal of een laagspanningsbord in een kast. Deze relatie heeft geen richting."	""	"Bevestiging"	"Deze relatie geeft aan dat twee onderdelen direct fysiek op elkaar bevestigd zijn. Dit kan zowel aan de buitenkant als aan de binnenkant zijn zoals bv. een camera aan een paal of een laagspanningsbord in een kast. Deze relatie heeft geen richting."	""	""	"true"	"https://wegenenverkeer.data.vlaanderen.be/ns/onderdeel#"	"Bevestiging"	"http://www.w3.org/2000/01/rdf-schema#Class"	""	""	""	""	""
"CLASS"	"OSLO-Onderdeel"	"IsTypeVan"	"{BB3ABC16-BED7-47d2-ABA6-F7D05B8E8E61}"	""	""	""	""	"Is type van"	"Deze relatie dient specifiek om het type template concept te realiseren. De relatie wordt gelegd tussen datatemplates en de bijhorende objecten."	""	"Is type van"	"Deze relatie dient specifiek om het type template concept te realiseren. De relatie wordt gelegd tussen datatemplates en de bijhorende objecten."	""	""	"true"	"https://wegenenverkeer.data.vlaanderen.be/ns/onderdeel#"	"IsTypeVan"	"http://www.w3.org/2000/01/rdf-schema#Class"	""	""	""	""	""
"CLASS"	"OSLO-Onderdeel"	"Sturing"	"{13A4F9E6-F804-4033-81E8-9BC04BDF0DE7}"	""	""	""	""	"Sturing"	"Deze relatie geeft aan of er een of andere vorm van dataverkeer is tussen 2 onderdelen. Een wegverlichtingstoestel dat aan staat wordt ook als sturing beschouwd, in dit geval is het een lang ononderbroken elektrisch aan-signaal. Deze relatie heeft geen richting."	""	"Sturing"	"Deze relatie geeft aan of er een of andere vorm van dataverkeer is tussen 2 onderdelen. Een wegverlichtingstoestel dat aan staat wordt ook als sturing beschouwd, in dit geval is het een lang ononderbroken elektrisch aan-signaal. Deze relatie heeft geen richting."	""	""	"true"	"https://wegenenverkeer.data.vlaanderen.be/ns/onderdeel#"	"Sturing"	"http://www.w3.org/2000/01/rdf-schema#Class"	""	""	""	""	""
"CLASS"	"OSLO-Onderdeel"	"Voedt"	"{8AA83131-996E-4433-96B7-609D2D41C2F7}"	""	""	""	""	"Voedt"	"Deze relatie wordt enkel gelegd naar onderdelen die permanent onder spanning staan in normaal bedrijf. Aan deze relatie wordt steeds een richting toegekend van de voedinggever naar de ontvanger."	""	"Voedt"	"Deze relatie wordt enkel gelegd naar onderdelen die permanent onder spanning staan in normaal bedrijf. Aan deze relatie wordt steeds een richting toegekend van de voedinggever naar de ontvanger."	""	""	"true"	"https://wegenenverkeer.data.vlaanderen.be/ns/onderdeel#"	"Voedt"	"http://www.w3.org/2000/01/rdf-schema#Class"	""	""	""	""	""
"ENUMERATION"	"OSLO-Abstracten"	"KlDraagConstrBijzondertransport"	"{F5832A95-DC56-478a-9F26-99814AEDEEE5}"	""	""	""	""	"Draagconstructie bijzonder transport"	"De mogelijkheden en manieren waarop een steun geschikt is om bijzonder transport mogelijk te maken."	""	"Draagconstructie bijzonder transport"	"De mogelijkheden en manieren waarop een steun geschikt is om bijzonder transport mogelijk te maken."	""	"https://wegenenverkeer.data.vlaanderen.be/id/conceptscheme/KlAlgBijzondertransport"	"true"	"http://www.w3.org/2004/02/skos/core#"	"Concept"	"http://www.w3.org/2000/01/rdf-schema#Class"	""	""	""	""	""
"ENUMERATION"	"OSLO-Abstracten"	"KlSteunStandaardFundering"	"{FD6C1502-9224-4e28-9D35-87B3D9B7834A}"	""	""	""	""	"Fundering"	"Types van verankering voor de steun bv. voetplaat, diep in grond,..."	""	"Fundering"	"Types van verankering voor de steun bv. voetplaat, diep in grond,..."	""	"https://wegenenverkeer.data.vlaanderen.be/id/conceptscheme/KlSteunStandaardFundering"	"true"	"http://www.w3.org/2004/02/skos/core#"	"Concept"	"http://www.w3.org/2000/01/rdf-schema#Class"	""	""	""	""	""
"ENUMERATION"	"OSLO-Abstracten"	"KlEnergiemeterMetertype"	"{E21F76DD-7037-4097-ABC3-2B2505C900E3}"	""	""	""	""	"Elektrisch metertype"	"TODO"	""	"Elektrisch metertype"	"TODO"	""	"https://wegenenverkeer.data.vlaanderen.be/id/conceptscheme/KlEnergiemeterMetertype"	"true"	"http://www.w3.org/2004/02/skos/core#"	"Concept"	"http://www.w3.org/2000/01/rdf-schema#Class"	""	""	""	""	""
"ENUMERATION"	"OSLO-Abstracten"	"KlSeinlantaarnDiameter"	"{070F8357-6562-48a4-A2CC-731F7499C131}"	""	""	""	""	"Seinlantaarn diameter"	"TODO"	""	"Seinlantaarn diameter"	"TODO"	""	"https://wegenenverkeer.data.vlaanderen.be/id/conceptscheme/KlSeinlantaarnDiameter"	"true"	"http://www.w3.org/2004/02/skos/core#"	"Concept"	"http://www.w3.org/2000/01/rdf-schema#Class"	""	""	""	""	""
"ENUMERATION"	"OSLO-Abstracten"	"KlSeinlantaarnModelnaam"	"{BAA3932F-CB0F-4b4a-B96A-E2B1DD791A2C}"	""	""	""	""	"seinlantaarn modelnaam"	"TODO"	""	"seinlantaarn modelnaam"	"TODO"	""	"https://wegenenverkeer.data.vlaanderen.be/id/conceptscheme/KlSeinlantaarnModelnaam"	"true"	"http://www.w3.org/2004/02/skos/core#"	"Concept"	"http://www.w3.org/2000/01/rdf-schema#Class"	""	""	""	""	""
"ENUMERATION"	"OSLO-Abstracten"	"KlLantaarnVormgeving"	"{C3BD1828-EBDC-4bc4-9B6A-82D00A540538}"	""	""	""	""	"Lantaarn vormgeving"	"TODO"	""	"Lantaarn vormgeving"	"TODO"	""	"https://wegenenverkeer.data.vlaanderen.be/id/conceptscheme/KlAlgVormgeving"	"true"	"http://www.w3.org/2004/02/skos/core#"	"Concept"	"http://www.w3.org/2000/01/rdf-schema#Class"	""	""	""	""	""
"ENUMERATION"	"OSLO-Abstracten"	"KlSeinlantaarnMerk"	"{F78FC6DF-CA4D-478d-8703-029864551F5E}"	""	""	""	""	"seinlantaarn merk"	"TODO"	""	"seinlantaarn merk"	"TODO"	""	"https://wegenenverkeer.data.vlaanderen.be/id/conceptscheme/KlSeinlantaarnMerk"	"true"	"http://www.w3.org/2004/02/skos/core#"	"Concept"	"http://www.w3.org/2000/01/rdf-schema#Class"	""	""	""	""	""
"DATATYPE"	"OSLO-Implementatieelement"	"DtcAWVIdentificator"	"{0A270AE5-3C56-44b7-8B06-DBC66BD6EB66}"	""	""	""	""	"AWV-identificator"	"Complex datatype voor de identifictor van het AWV-object."	""	"AWV-identificator"	"Complex datatype voor de identifictor van het AWV-object."	""	""	"true"	"https://wegenenverkeer.data.vlaanderen.be/ns/implementatieelement#"	"DtcAWVIdentificator"	"http://www.w3.org/2000/01/rdf-schema#Class"	""	""	""	""	""
"DATATYPE"	"OSLO-Implementatieelement"	"DtcAdres"	"{0BE4CA53-E0D7-4149-9D89-4D6C4D6F0ED6}"	""	""	""	""	"Adres"	"De aanduiding van een bepaalde locatie, doorgaans van een huis, woning, gebouw of faciliteit, op de aarde."	""	"Adres"	"De aanduiding van een bepaalde locatie, doorgaans van een huis, woning, gebouw of faciliteit, op de aarde."	""	""	"true"	"https://wegenenverkeer.data.vlaanderen.be/ns/implementatieelement#"	"DtcAdres"	"http://www.w3.org/2000/01/rdf-schema#Class"	""	""	""	""	""
"DATATYPE"	"OSLO-Implementatieelement"	"DtcDocument"	"{441527E2-4B20-4bca-899E-9DC151A2A981}"	""	""	""	""	"Bestandsbijlage"	"Complex datatype voor alle bestandsbijlages"	""	"Bestandsbijlage"	"Complex datatype voor alle bestandsbijlages"	""	""	"true"	"https://wegenenverkeer.data.vlaanderen.be/ns/implementatieelement#"	"DtcDocument"	"http://www.w3.org/2000/01/rdf-schema#Class"	""	""	""	""	""
"DATATYPE"	"OSLO-Implementatieelement"	"DtcAfmetingZijde"	"{7BD7B9ED-4392-49c8-9C11-3BCCE9EFCF3D}"	""	""	""	""	"Afmeting zijde"	"De afmeting van een zijde."	""	"Afmeting zijde"	"De afmeting van een zijde."	""	""	"true"	"https://wegenenverkeer.data.vlaanderen.be/ns/implementatieelement#"	"DtcAfmetingZijde"	"http://www.w3.org/2000/01/rdf-schema#Class"	""	""	""	""	""
"ENUMERATION"	"OSLO-Implementatieelement"	"KlAlgMimeType"	"{9BCD2B4C-9CAB-4988-A052-6C4B006D450A}"	""	""	""	""	"Mimetype"	"De mime types van bestanden (AWVDocument) beperkt tot mime types voor toegelaten bestandstypen."	""	"Mimetype"	"De mime types van bestanden (AWVDocument) beperkt tot mime types voor toegelaten bestandstypen."	""	"https://wegenenverkeer.data.vlaanderen.be/id/conceptscheme/KlAlgMimeType"	"true"	"http://www.w3.org/2004/02/skos/core#"	"Concept"	"http://www.w3.org/2000/01/rdf-schema#Class"	""	""	""	""	""
"DATATYPE"	"OSLO-Implementatieelement"	"DtcAfmetingDiameter"	"{A4E9EF18-BBDC-4b53-B4AB-6C95DDD83985}"	""	""	""	""	"Afmeting diameter"	"De afmeting van een diameter."	""	"Afmeting diameter"	"De afmeting van een diameter."	""	""	"true"	"https://wegenenverkeer.data.vlaanderen.be/ns/implementatieelement#"	"DtcAfmetingDiameter"	"http://www.w3.org/2000/01/rdf-schema#Class"	""	""	""	""	""
"DATATYPE"	"OSLO-Implementatieelement"	"DtcAfmetingBxh"	"{B1D8888A-C7D8-46f9-9E15-26BF83B0726B}"	""	""	""	""	"Afmeting bxh"	"De afmeting van de breedte en hoogte in meter."	""	"Afmeting bxh"	"De afmeting van de breedte en hoogte in meter."	""	""	"true"	"https://wegenenverkeer.data.vlaanderen.be/ns/implementatieelement#"	"DtcAfmetingBxh"	"http://www.w3.org/2000/01/rdf-schema#Class"	""	""	""	""	""
