"EA-Type"	"EA-Package"	"EA-Name"	"EA-GUID"	"EA-Parent"	"EA-Domain"	"EA-Domain-GUID"	"EA-Range"	"label"	"definition"	"usage"	"ap-label-nl"	"ap-definition-nl"	"ap-usageNote-nl"	"ap-codelist"	"external term"	"namespace"	"localname"	"type"	"domain"	"range"	"parent"	"min card"	"max card"
"attribute"	"OSLO-Implementatieelement"	"naam"	"{2B976399-DF91-4167-8CAE-FB86654AFE33}"	""	"AIMNaamObject"	"{E3A247BC-7230-448b-9E87-96E7C8F950B1}"	"String"	"naam"	"De mensleesbare naam van een asset zoals dit bv. ook terug te vinden is op een etiket op het object zelf. De assetbeheerder kent deze naam toe of geeft de opdracht om deze toe te kennen. Indien een object een algemeen gangbare naam heeft zoals bv. bij een waterloop dan wordt deze gebruikt."	""	"naam"	"De mensleesbare naam van een asset zoals dit bv. ook terug te vinden is op een etiket op het object zelf. De assetbeheerder kent deze naam toe of geeft de opdracht om deze toe te kennen. Indien een object een algemeen gangbare naam heeft zoals bv. bij een waterloop dan wordt deze gebruikt."	""	""	"true"	"https://wegenenverkeer-test.data.vlaanderen.be/ns/implementatieelement#"	"AIMNaamObject.naam"	"http://www.w3.org/2002/07/owl#DatatypeProperty"	"https://wegenenverkeer-test.data.vlaanderen.be/ns/implementatieelement#AIMNaamObject"	"http://www.w3.org/2001/XMLSchema#string"	""	"1"	"1"
"attribute"	"OSLO-Abstracten"	"elektrischeBeveiliging"	"{7FD2DF21-0374-4ce6-83CE-C88C609A4134}"	""	"EMDraagconstructie"	"{74AC8A14-099F-4d19-BBB4-562D1BF6F09E}"	"KlEMDraagconstructieElekBeveiliging"	"elektrische beveiliging"	"Type elektrische beveiliging aanwezig in de draagconstructie."	""	"elektrische beveiliging"	"Type elektrische beveiliging aanwezig in de draagconstructie."	""	""	"true"	"https://wegenenverkeer-test.data.vlaanderen.be/ns/abstracten#"	"EMDraagconstructie.elektrischeBeveiliging"	"http://www.w3.org/2002/07/owl#ObjectProperty"	"https://wegenenverkeer-test.data.vlaanderen.be/ns/abstracten#EMDraagconstructie"	"http://www.w3.org/2004/02/skos/core#Concept"	""	"1"	"1"
"attribute"	"OSLO-Abstracten"	"bokAfwaarts"	"{1E25CCE8-BCFE-491b-B596-38099F86CD95}"	""	"Buis"	"{109B9A6C-E5A5-43f3-B463-6E4AE80A19AF}"	"KwantWrdInMeterTAW"	"bok afwaarts"	"Peil in meter-TAW van de vloei aan de afwaartse kant van de buis."	""	"bok afwaarts"	"Peil in meter-TAW van de vloei aan de afwaartse kant van de buis."	""	""	"true"	"https://wegenenverkeer-test.data.vlaanderen.be/ns/abstracten#"	"Buis.bokAfwaarts"	"http://www.w3.org/2002/07/owl#ObjectProperty"	"https://wegenenverkeer-test.data.vlaanderen.be/ns/abstracten#Buis"	"https://wegenenverkeer-test.data.vlaanderen.be/ns/implementatieelement#KwantWrdInMeterTAW"	""	"1"	"1"
"attribute"	"OSLO-Abstracten"	"bokOpwaarts"	"{D065194C-A512-4390-84FD-366CD3982F3E}"	""	"Buis"	"{109B9A6C-E5A5-43f3-B463-6E4AE80A19AF}"	"KwantWrdInMeterTAW"	"bok opwaarts"	"Peil in meter-TAW van de vloei aan de opwaartse kant van de buis."	""	"bok opwaarts"	"Peil in meter-TAW van de vloei aan de opwaartse kant van de buis."	""	""	"true"	"https://wegenenverkeer-test.data.vlaanderen.be/ns/abstracten#"	"Buis.bokOpwaarts"	"http://www.w3.org/2002/07/owl#ObjectProperty"	"https://wegenenverkeer-test.data.vlaanderen.be/ns/abstracten#Buis"	"https://wegenenverkeer-test.data.vlaanderen.be/ns/implementatieelement#KwantWrdInMeterTAW"	""	"1"	"1"
"attribute"	"OSLO-Abstracten"	"breedte"	"{B317469B-4E52-4f99-87A3-2985A3D2EB8F}"	""	"Buis"	"{109B9A6C-E5A5-43f3-B463-6E4AE80A19AF}"	"KwantWrdInMillimeter"	"breedte"	"De breedte van de buis in millimeter."	""	"breedte"	"De breedte van de buis in millimeter."	""	""	"true"	"https://wegenenverkeer-test.data.vlaanderen.be/ns/abstracten#"	"Buis.breedte"	"http://www.w3.org/2002/07/owl#ObjectProperty"	"https://wegenenverkeer-test.data.vlaanderen.be/ns/abstracten#Buis"	"https://wegenenverkeer-test.data.vlaanderen.be/ns/implementatieelement#KwantWrdInMillimeter"	""	"1"	"1"
"attribute"	"OSLO-Abstracten"	"diepteAfwaarts"	"{38A2F138-96B2-4024-B46D-23646374EF02}"	""	"Buis"	"{109B9A6C-E5A5-43f3-B463-6E4AE80A19AF}"	"KwantWrdInMeter"	"diepte afwaarts"	"Diepte van de vloei aan de afwaartse kant van de buis tov de bovenkant van het deksel."	""	"diepte afwaarts"	"Diepte van de vloei aan de afwaartse kant van de buis tov de bovenkant van het deksel."	""	""	"true"	"https://wegenenverkeer-test.data.vlaanderen.be/ns/abstracten#"	"Buis.diepteAfwaarts"	"http://www.w3.org/2002/07/owl#ObjectProperty"	"https://wegenenverkeer-test.data.vlaanderen.be/ns/abstracten#Buis"	"https://wegenenverkeer-test.data.vlaanderen.be/ns/implementatieelement#KwantWrdInMeter"	""	"1"	"1"
"attribute"	"OSLO-Abstracten"	"diepteOpwaarts"	"{E7FC8A63-7104-47d2-A8B3-FCB983D59644}"	""	"Buis"	"{109B9A6C-E5A5-43f3-B463-6E4AE80A19AF}"	"KwantWrdInMeter"	"diepte opwaarts"	"De diepte van de vloei aan de opwaartse kant van de buis tov de bovenkant van het deksel."	""	"diepte opwaarts"	"De diepte van de vloei aan de opwaartse kant van de buis tov de bovenkant van het deksel."	""	""	"true"	"https://wegenenverkeer-test.data.vlaanderen.be/ns/abstracten#"	"Buis.diepteOpwaarts"	"http://www.w3.org/2002/07/owl#ObjectProperty"	"https://wegenenverkeer-test.data.vlaanderen.be/ns/abstracten#Buis"	"https://wegenenverkeer-test.data.vlaanderen.be/ns/implementatieelement#KwantWrdInMeter"	""	"1"	"1"
"attribute"	"OSLO-Abstracten"	"helling"	"{ED8E586C-B5E4-427f-A132-8C7276E9B214}"	""	"Buis"	"{109B9A6C-E5A5-43f3-B463-6E4AE80A19AF}"	"KwantWrdInPromille"	"helling"	"De helling van de buis in de lengterichting, uitgedrukt in ."	""	"helling"	"De helling van de buis in de lengterichting, uitgedrukt in ."	""	""	"true"	"https://wegenenverkeer-test.data.vlaanderen.be/ns/abstracten#"	"Buis.helling"	"http://www.w3.org/2002/07/owl#ObjectProperty"	"https://wegenenverkeer-test.data.vlaanderen.be/ns/abstracten#Buis"	"https://wegenenverkeer-test.data.vlaanderen.be/ns/implementatieelement#KwantWrdInPromille"	""	"1"	"1"
"attribute"	"OSLO-Abstracten"	"hoogteBinnenzijde"	"{4EE72142-65C9-4591-935D-4D1AB9A80952}"	""	"Buis"	"{109B9A6C-E5A5-43f3-B463-6E4AE80A19AF}"	"KwantWrdInMillimeter"	"hoogte binnenzijde"	"De hoogte van de binnenzijde van de buis in millimeter. Bij cirkelvormige buizen is dit de binnendiameter."	""	"hoogte binnenzijde"	"De hoogte van de binnenzijde van de buis in millimeter. Bij cirkelvormige buizen is dit de binnendiameter."	""	""	"true"	"https://wegenenverkeer-test.data.vlaanderen.be/ns/abstracten#"	"Buis.hoogteBinnenzijde"	"http://www.w3.org/2002/07/owl#ObjectProperty"	"https://wegenenverkeer-test.data.vlaanderen.be/ns/abstracten#Buis"	"https://wegenenverkeer-test.data.vlaanderen.be/ns/implementatieelement#KwantWrdInMillimeter"	""	"1"	"1"
"attribute"	"OSLO-Abstracten"	"hoogteBuitenzijde"	"{DDB1922D-C870-4b35-8EA4-8A41CC287DEC}"	""	"Buis"	"{109B9A6C-E5A5-43f3-B463-6E4AE80A19AF}"	"KwantWrdInMillimeter"	"hoogte buitenzijde"	"De hoogte van de buitenzijde van een buis in millimeter. Bij cirkelvormige buizen is dit de buitendiameter."	""	"hoogte buitenzijde"	"De hoogte van de buitenzijde van een buis in millimeter. Bij cirkelvormige buizen is dit de buitendiameter."	""	""	"true"	"https://wegenenverkeer-test.data.vlaanderen.be/ns/abstracten#"	"Buis.hoogteBuitenzijde"	"http://www.w3.org/2002/07/owl#ObjectProperty"	"https://wegenenverkeer-test.data.vlaanderen.be/ns/abstracten#Buis"	"https://wegenenverkeer-test.data.vlaanderen.be/ns/implementatieelement#KwantWrdInMillimeter"	""	"1"	"1"
"attribute"	"OSLO-Abstracten"	"isManToegankelijk"	"{FB095C2E-B3B0-4b9b-9838-CD23F1709B9B}"	""	"Buis"	"{109B9A6C-E5A5-43f3-B463-6E4AE80A19AF}"	"Boolean"	"is man toegankelijk"	"Bepaalt of de buis toegankelijk is voor een persoon."	""	"is man toegankelijk"	"Bepaalt of de buis toegankelijk is voor een persoon."	""	""	"true"	"https://wegenenverkeer-test.data.vlaanderen.be/ns/abstracten#"	"Buis.isManToegankelijk"	"http://www.w3.org/2002/07/owl#DatatypeProperty"	"https://wegenenverkeer-test.data.vlaanderen.be/ns/abstracten#Buis"	"http://www.w3.org/2001/XMLSchema#boolean"	""	"1"	"1"
"attribute"	"OSLO-Abstracten"	"isOpgevuld"	"{53095658-EF24-4ae5-8278-67BA20AAD5C0}"	""	"Buis"	"{109B9A6C-E5A5-43f3-B463-6E4AE80A19AF}"	"Boolean"	"is opgevuld"	"Geeft aan of de buis gestabiliseerd/opgevuld is of niet."	""	"is opgevuld"	"Geeft aan of de buis gestabiliseerd/opgevuld is of niet."	""	""	"true"	"https://wegenenverkeer-test.data.vlaanderen.be/ns/abstracten#"	"Buis.isOpgevuld"	"http://www.w3.org/2002/07/owl#DatatypeProperty"	"https://wegenenverkeer-test.data.vlaanderen.be/ns/abstracten#Buis"	"http://www.w3.org/2001/XMLSchema#boolean"	""	"1"	"1"
"attribute"	"OSLO-Abstracten"	"lengte"	"{C3D5EF95-13D6-473d-A56F-A5F0331EBF6A}"	""	"Buis"	"{109B9A6C-E5A5-43f3-B463-6E4AE80A19AF}"	"KwantWrdInMeter"	"lengte"	"De totale lengte in meter van de buis tussen opwaartse en afwaartse put."	""	"lengte"	"De totale lengte in meter van de buis tussen opwaartse en afwaartse put."	""	""	"true"	"https://wegenenverkeer-test.data.vlaanderen.be/ns/abstracten#"	"Buis.lengte"	"http://www.w3.org/2002/07/owl#ObjectProperty"	"https://wegenenverkeer-test.data.vlaanderen.be/ns/abstracten#Buis"	"https://wegenenverkeer-test.data.vlaanderen.be/ns/implementatieelement#KwantWrdInMeter"	""	"1"	"1"
"attribute"	"OSLO-Abstracten"	"technischeFiche"	"{E1FFFE4E-370A-434f-A68F-2D2295F9E85E}"	""	"Buis"	"{109B9A6C-E5A5-43f3-B463-6E4AE80A19AF}"	"DtcDocument"	"technische fiche"	"De technische fiche van de buis."	"Bestanden van het type xlsx of pdf."	"technische fiche"	"De technische fiche van de buis."	""	""	"true"	"https://wegenenverkeer-test.data.vlaanderen.be/ns/abstracten#"	"Buis.technischeFiche"	"http://www.w3.org/2002/07/owl#ObjectProperty"	"https://wegenenverkeer-test.data.vlaanderen.be/ns/abstracten#Buis"	"https://wegenenverkeer-test.data.vlaanderen.be/ns/implementatieelement#DtcDocument"	""	"1"	"*"
"attribute"	"OSLO-Abstracten"	"toestandBuis"	"{BF1274F5-C7C5-4169-91C8-28B0246682FB}"	""	"Buis"	"{109B9A6C-E5A5-43f3-B463-6E4AE80A19AF}"	"DteTekstblok"	"toestand buis"	"Opmerkingen van de toestand en staat van de buis."	""	"toestand buis"	"Opmerkingen van de toestand en staat van de buis."	""	""	"true"	"https://wegenenverkeer-test.data.vlaanderen.be/ns/abstracten#"	"Buis.toestandBuis"	"http://www.w3.org/2002/07/owl#ObjectProperty"	"https://wegenenverkeer-test.data.vlaanderen.be/ns/abstracten#Buis"	"https://wegenenverkeer-test.data.vlaanderen.be/ns/implementatieelement#DteTekstblok"	""	"1"	"1"
"attribute"	"OSLO-Abstracten"	"vorm"	"{FCDD2C66-AE83-4204-92AA-811D0635D1A9}"	""	"Buis"	"{109B9A6C-E5A5-43f3-B463-6E4AE80A19AF}"	"KlRioleringVorm"	"vorm"	"Bepaalt de vorm van de buis."	""	"vorm"	"Bepaalt de vorm van de buis."	""	""	"true"	"https://wegenenverkeer-test.data.vlaanderen.be/ns/abstracten#"	"Buis.vorm"	"http://www.w3.org/2002/07/owl#ObjectProperty"	"https://wegenenverkeer-test.data.vlaanderen.be/ns/abstracten#Buis"	"http://www.w3.org/2004/02/skos/core#Concept"	""	"1"	"1"
"attribute"	"OSLO-Abstracten"	"kleurReflectorAflopend"	"{EB971521-738B-448f-830C-0DD52B25DAF4}"	""	"Bebakening"	"{070A6168-4F6D-4e6d-BC05-2B379698D292}"	"KlKleurReflector"	"kleur aflopend"	"De kleur van de reflector stroomafwaarts."	""	"kleur aflopend"	"De kleur van de reflector stroomafwaarts."	""	""	"true"	"https://wegenenverkeer-test.data.vlaanderen.be/ns/abstracten#"	"Bebakening.kleurReflectorAflopend"	"http://www.w3.org/2002/07/owl#ObjectProperty"	"https://wegenenverkeer-test.data.vlaanderen.be/ns/abstracten#Bebakening"	"http://www.w3.org/2004/02/skos/core#Concept"	""	"1"	"1"
"attribute"	"OSLO-Abstracten"	"kleurReflectorOplopend"	"{013789EB-3AFE-4dce-8B67-6B555257F385}"	""	"Bebakening"	"{070A6168-4F6D-4e6d-BC05-2B379698D292}"	"KlKleurReflector"	"kleur oplopend"	"De kleur van de reflector stroomopwaarts."	""	"kleur oplopend"	"De kleur van de reflector stroomopwaarts."	""	""	"true"	"https://wegenenverkeer-test.data.vlaanderen.be/ns/abstracten#"	"Bebakening.kleurReflectorOplopend"	"http://www.w3.org/2002/07/owl#ObjectProperty"	"https://wegenenverkeer-test.data.vlaanderen.be/ns/abstracten#Bebakening"	"http://www.w3.org/2004/02/skos/core#Concept"	""	"1"	"1"
"attribute"	"OSLO-Implementatieelement"	"identificator"	"{7EAAF9AE-5C9C-4d5d-9771-CE2B8F468D5A}"	""	"DtcIdentificator"	"{3C1A9CE1-8B09-4751-B7FE-9D35685E30AD}"	"String"	"identificator"	"Een groep van tekens om een AWV object te identificeren of te benoemen."	""	"identificator"	"Een groep van tekens om een AWV object te identificeren of te benoemen."	""	""	"true"	"https://wegenenverkeer-test.data.vlaanderen.be/ns/implementatieelement#"	"DtcIdentificator.identificator"	"http://www.w3.org/2002/07/owl#DatatypeProperty"	"https://wegenenverkeer-test.data.vlaanderen.be/ns/implementatieelement#DtcIdentificator"	"http://www.w3.org/2001/XMLSchema#string"	""	"1"	"1"
"attribute"	"OSLO-Implementatieelement"	"toegekendDoor"	"{1B46CF83-72E7-482b-B666-B01073EF4799}"	""	"DtcIdentificator"	"{3C1A9CE1-8B09-4751-B7FE-9D35685E30AD}"	"String"	"toegekend door"	"Gegevens van de organisatie die de toekenning deed."	""	"toegekend door"	"Gegevens van de organisatie die de toekenning deed."	""	""	"true"	"https://wegenenverkeer-test.data.vlaanderen.be/ns/implementatieelement#"	"DtcIdentificator.toegekendDoor"	"http://www.w3.org/2002/07/owl#DatatypeProperty"	"https://wegenenverkeer-test.data.vlaanderen.be/ns/implementatieelement#DtcIdentificator"	"http://www.w3.org/2001/XMLSchema#string"	""	"1"	"1"
"attribute"	"OSLO-Implementatieelement"	"standaardEenheid"	"{6B43496F-46A5-43d3-8C3C-A6BFD9C9279B}"	""	"KwantWrdInMeter"	"{CD137DF1-65D5-4347-9D31-F6E4BD49A2D1}"	"Literal"	"standaard eenheid"	"De standaard eenheid bij dit datatype is uitgedrukt in meter."	"""m""^^cdt:ucumunit"	"standaard eenheid"	"De standaard eenheid bij dit datatype is uitgedrukt in meter."	""	""	"true"	"https://wegenenverkeer-test.data.vlaanderen.be/ns/implementatieelement#"	"KwantWrdInMeter.standaardEenheid"	"http://www.w3.org/2002/07/owl#DatatypeProperty"	"https://wegenenverkeer-test.data.vlaanderen.be/ns/implementatieelement#KwantWrdInMeter"	"http://www.w3.org/2000/01/rdf-schema#Literal"	""	"1"	"1"
"attribute"	"OSLO-Implementatieelement"	"waarde"	"{846E203A-32E9-404d-9D12-69A9121D28D3}"	""	"KwantWrdInMeter"	"{CD137DF1-65D5-4347-9D31-F6E4BD49A2D1}"	"Decimal"	"waarde"	"Bevat een getal die bij het datatype hoort."	""	"waarde"	"Bevat een getal die bij het datatype hoort."	""	""	"true"	"https://wegenenverkeer-test.data.vlaanderen.be/ns/implementatieelement#"	"KwantWrdInMeter.waarde"	"http://www.w3.org/2002/07/owl#ObjectProperty"	"https://wegenenverkeer-test.data.vlaanderen.be/ns/implementatieelement#KwantWrdInMeter"	"http://www.w3.org/2001/XMLSchema#decimal"	""	"1"	"1"
"attribute"	"OSLO-Implementatieelement"	"bestandsnaam"	"{BCC67F7E-AB4A-4b3a-92F7-8E97A51EBC72}"	""	"DtcDocument"	"{E0B6DD17-B56B-4a53-95B5-9049B1EC980E}"	"String"	"bestandsnaam"	"De naam van het Document inclusief de bestandsextensie, van de naam gescheiden door een punt."	""	"bestandsnaam"	"De naam van het Document inclusief de bestandsextensie, van de naam gescheiden door een punt."	""	""	"true"	"https://wegenenverkeer-test.data.vlaanderen.be/ns/implementatieelement#"	"DtcDocument.bestandsnaam"	"http://www.w3.org/2002/07/owl#DatatypeProperty"	"https://wegenenverkeer-test.data.vlaanderen.be/ns/implementatieelement#DtcDocument"	"http://www.w3.org/2001/XMLSchema#string"	""	"1"	"1"
"attribute"	"OSLO-Implementatieelement"	"mimeType"	"{E672ABDC-554F-431f-A2F9-59CACD6AB1ED}"	""	"DtcDocument"	"{E0B6DD17-B56B-4a53-95B5-9049B1EC980E}"	"KlAlgMimeType"	"mime-type"	"Het MIME type van het document."	""	"mime-type"	"Het MIME type van het document."	""	""	"true"	"https://wegenenverkeer-test.data.vlaanderen.be/ns/implementatieelement#"	"DtcDocument.mimeType"	"http://www.w3.org/2002/07/owl#ObjectProperty"	"https://wegenenverkeer-test.data.vlaanderen.be/ns/implementatieelement#DtcDocument"	"http://www.w3.org/2004/02/skos/core#Concept"	""	"1"	"1"
"attribute"	"OSLO-Implementatieelement"	"omschrijving"	"{FF0D8214-6AF1-412c-91EA-C066490A409C}"	""	"DtcDocument"	"{E0B6DD17-B56B-4a53-95B5-9049B1EC980E}"	"DteTekstblok"	"omschrijving"	"Een korte toelichting over waar het document juist voor dient."	""	"omschrijving"	"Een korte toelichting over waar het document juist voor dient."	""	""	"true"	"https://wegenenverkeer-test.data.vlaanderen.be/ns/implementatieelement#"	"DtcDocument.omschrijving"	"http://www.w3.org/2002/07/owl#ObjectProperty"	"https://wegenenverkeer-test.data.vlaanderen.be/ns/implementatieelement#DtcDocument"	"https://wegenenverkeer-test.data.vlaanderen.be/ns/implementatieelement#DteTekstblok"	""	"1"	"1"
"attribute"	"OSLO-Implementatieelement"	"uri"	"{A144FDD1-1FBF-4392-B97A-B15310A28300}"	""	"DtcDocument"	"{E0B6DD17-B56B-4a53-95B5-9049B1EC980E}"	"AnyURI"	"uri"	"De verwijzing naar de bestandslocatie via een link. Bij lokale bestanden kan dit eventueel ook een pad zijn."	""	"uri"	"De verwijzing naar de bestandslocatie via een link. Bij lokale bestanden kan dit eventueel ook een pad zijn."	""	""	"true"	"https://wegenenverkeer-test.data.vlaanderen.be/ns/implementatieelement#"	"DtcDocument.uri"	"http://www.w3.org/2002/07/owl#ObjectProperty"	"https://wegenenverkeer-test.data.vlaanderen.be/ns/implementatieelement#DtcDocument"	"http://www.w3.org/2001/XMLSchema#anyURI"	""	"1"	"1"
"attribute"	"OSLO-Implementatieelement"	"waarde"	"{6A28900E-4D1C-42b8-A53A-AAF30837B267}"	""	"DteTekstblok"	"{5E0F1078-64D7-41e6-AB33-41BD4C95F570}"	"String"	"waarde"	"De string welke uit meerdere zinnen bestaat, en ook regeleindes kan bevatten. Een tekstblok bevat maximaal 65.000 karakters."	""	"waarde"	"De string welke uit meerdere zinnen bestaat, en ook regeleindes kan bevatten. Een tekstblok bevat maximaal 65.000 karakters."	""	""	"true"	"https://wegenenverkeer-test.data.vlaanderen.be/ns/implementatieelement#"	"DteTekstblok.waarde"	"http://www.w3.org/2002/07/owl#DatatypeProperty"	"https://wegenenverkeer-test.data.vlaanderen.be/ns/implementatieelement#DteTekstblok"	"http://www.w3.org/2001/XMLSchema#string"	""	"1"	"1"
"attribute"	"OSLO-Implementatieelement"	"waarde"	"{817CF764-31D2-438b-90BD-CAD3EDBF47A5}"	""	"DteKleurRAL"	"{FC69D376-788C-49e8-8ACA-B249952D78E8}"	"String"	"waarde"	"Beschrijft een kleur volgens het RAL klassificatiesysteem"	"De waarde moet voldoen aan volgende regex: [1-9]\d{3}"	"waarde"	"Beschrijft een kleur volgens het RAL klassificatiesysteem"	""	""	"true"	"https://wegenenverkeer-test.data.vlaanderen.be/ns/implementatieelement#"	"DteKleurRAL.waarde"	"http://www.w3.org/2002/07/owl#DatatypeProperty"	"https://wegenenverkeer-test.data.vlaanderen.be/ns/implementatieelement#DteKleurRAL"	"http://www.w3.org/2001/XMLSchema#string"	""	"1"	"1"
"attribute"	"OSLO-Implementatieelement"	"standaardEenheid"	"{18520C9A-461B-497e-9334-1F6F7AA3CFC7}"	""	"KwantWrdInVierkanteMeter"	"{67C07D13-17AB-4500-868B-A4075514CD6A}"	"Literal"	"standaard eenheid"	"De standaard eenheid bij dit datatype is uitgedrukt in vierkante meter."	"""m2""^^cdt:ucumunit"	"standaard eenheid"	"De standaard eenheid bij dit datatype is uitgedrukt in vierkante meter."	""	""	"true"	"https://wegenenverkeer-test.data.vlaanderen.be/ns/implementatieelement#"	"KwantWrdInVierkanteMeter.standaardEenheid"	"http://www.w3.org/2002/07/owl#DatatypeProperty"	"https://wegenenverkeer-test.data.vlaanderen.be/ns/implementatieelement#KwantWrdInVierkanteMeter"	"http://www.w3.org/2000/01/rdf-schema#Literal"	""	"1"	"1"
"attribute"	"OSLO-Implementatieelement"	"waarde"	"{04985BF1-8DBA-4295-B764-43E5B2A297D0}"	""	"KwantWrdInVierkanteMeter"	"{67C07D13-17AB-4500-868B-A4075514CD6A}"	"Decimal"	"waarde"	"Bevat een getal die bij het datatype hoort."	""	"waarde"	"Bevat een getal die bij het datatype hoort."	""	""	"true"	"https://wegenenverkeer-test.data.vlaanderen.be/ns/implementatieelement#"	"KwantWrdInVierkanteMeter.waarde"	"http://www.w3.org/2002/07/owl#ObjectProperty"	"https://wegenenverkeer-test.data.vlaanderen.be/ns/implementatieelement#KwantWrdInVierkanteMeter"	"http://www.w3.org/2001/XMLSchema#decimal"	""	"1"	"1"
"attribute"	"OSLO-Implementatieelement"	"standaardEenheid"	"{C312C3FD-8935-4e99-9DDB-1FD92441C983}"	""	"KwantWrdInMillimeter"	"{05FF4D5B-B5A2-4909-9657-572035B89026}"	"Literal"	"standaard eenheid"	"De standaard eenheid bij dit datatype is uitgedrukt in millimeter."	"""mm""^^cdt:ucumunit"	"standaard eenheid"	"De standaard eenheid bij dit datatype is uitgedrukt in millimeter."	""	""	"true"	"https://wegenenverkeer-test.data.vlaanderen.be/ns/implementatieelement#"	"KwantWrdInMillimeter.standaardEenheid"	"http://www.w3.org/2002/07/owl#DatatypeProperty"	"https://wegenenverkeer-test.data.vlaanderen.be/ns/implementatieelement#KwantWrdInMillimeter"	"http://www.w3.org/2000/01/rdf-schema#Literal"	""	"1"	"1"
"attribute"	"OSLO-Implementatieelement"	"waarde"	"{64A2BCDA-EDE0-4156-B3E8-DB39133A9387}"	""	"KwantWrdInMillimeter"	"{05FF4D5B-B5A2-4909-9657-572035B89026}"	"Decimal"	"waarde"	"Bevat een getal die bij het datatype hoort."	""	"waarde"	"Bevat een getal die bij het datatype hoort."	""	""	"true"	"https://wegenenverkeer-test.data.vlaanderen.be/ns/implementatieelement#"	"KwantWrdInMillimeter.waarde"	"http://www.w3.org/2002/07/owl#ObjectProperty"	"https://wegenenverkeer-test.data.vlaanderen.be/ns/implementatieelement#KwantWrdInMillimeter"	"http://www.w3.org/2001/XMLSchema#decimal"	""	"1"	"1"
"attribute"	"OSLO-Implementatieelement"	"standaardEenheid"	"{9CD94ECD-4B9A-4c73-9F9D-7333A52EE2E0}"	""	"KwantWrdInMeterTAW"	"{A138E53E-02EA-4c1a-BDF3-B4A88794D94B}"	"Literal"	"standaard eenheid"	"De standaard eenheid bij dit datatype is uitgedrukt in meter."	"""m""^^cdt:ucumunit"	"standaard eenheid"	"De standaard eenheid bij dit datatype is uitgedrukt in meter."	""	""	"true"	"https://wegenenverkeer-test.data.vlaanderen.be/ns/implementatieelement#"	"KwantWrdInMeterTAW.standaardEenheid"	"http://www.w3.org/2002/07/owl#DatatypeProperty"	"https://wegenenverkeer-test.data.vlaanderen.be/ns/implementatieelement#KwantWrdInMeterTAW"	"http://www.w3.org/2000/01/rdf-schema#Literal"	""	"1"	"1"
"attribute"	"OSLO-Implementatieelement"	"waarde"	"{461B4D1A-267B-4828-96B9-E216D75F98BD}"	""	"KwantWrdInMeterTAW"	"{A138E53E-02EA-4c1a-BDF3-B4A88794D94B}"	"Decimal"	"waarde"	"Bevat een getal die bij het datatype hoort."	""	"waarde"	"Bevat een getal die bij het datatype hoort."	""	""	"true"	"https://wegenenverkeer-test.data.vlaanderen.be/ns/implementatieelement#"	"KwantWrdInMeterTAW.waarde"	"http://www.w3.org/2002/07/owl#ObjectProperty"	"https://wegenenverkeer-test.data.vlaanderen.be/ns/implementatieelement#KwantWrdInMeterTAW"	"http://www.w3.org/2001/XMLSchema#decimal"	""	"1"	"1"
"attribute"	"OSLO-Implementatieelement"	"standaardEenheid"	"{8BA22A41-EEE9-4f1e-B600-FCC74B2AB31D}"	""	"KwantWrdInPromille"	"{02C0D0D1-CA57-42f3-A409-59C72EC92548}"	"Literal"	"standaard eenheid"	"De standaard eenheid bij dit datatype is uitgedrukt in promille."	"""""^^cdt:ucumunit"	"standaard eenheid"	"De standaard eenheid bij dit datatype is uitgedrukt in promille."	""	""	"true"	"https://wegenenverkeer-test.data.vlaanderen.be/ns/implementatieelement#"	"KwantWrdInPromille.standaardEenheid"	"http://www.w3.org/2002/07/owl#DatatypeProperty"	"https://wegenenverkeer-test.data.vlaanderen.be/ns/implementatieelement#KwantWrdInPromille"	"http://www.w3.org/2000/01/rdf-schema#Literal"	""	"1"	"1"
"attribute"	"OSLO-Implementatieelement"	"waarde"	"{DCC9F017-D509-4bee-8EE7-52540F7E2FB8}"	""	"KwantWrdInPromille"	"{02C0D0D1-CA57-42f3-A409-59C72EC92548}"	"Decimal"	"waarde"	"Bevat een getal die bij het datatype hoort."	""	"waarde"	"Bevat een getal die bij het datatype hoort."	""	""	"true"	"https://wegenenverkeer-test.data.vlaanderen.be/ns/implementatieelement#"	"KwantWrdInPromille.waarde"	"http://www.w3.org/2002/07/owl#ObjectProperty"	"https://wegenenverkeer-test.data.vlaanderen.be/ns/implementatieelement#KwantWrdInPromille"	"http://www.w3.org/2001/XMLSchema#decimal"	""	"1"	"1"
"attribute"	"OSLO-Implementatieelement"	"in ontwerp"	"{7CEA248E-960D-4e7c-977C-7828B6D6A31D}"	""	"KlAIMToestand"	"{25ADBE0F-1B72-4818-8A64-0A38427DBB89}"	""	""	""	""	""	"TODO"	""	""	"true"	"https://wegenenverkeer-test.data.vlaanderen.be/ns/implementatieelement/KlAIMToestand/in "	"https://wegenenverkeer-test.data.vlaanderen.be/ns/implementatieelement/KlAIMToestand/in ontwerp"	"http://www.w3.org/2004/02/skos/core#Concept"	""	""	""	""	""
"attribute"	"OSLO-Implementatieelement"	"gepland"	"{2368383E-EEBF-418e-8A21-35FF487C0A03}"	""	"KlAIMToestand"	"{25ADBE0F-1B72-4818-8A64-0A38427DBB89}"	""	""	""	""	""	"TODO"	""	""	"true"	"https://wegenenverkeer-test.data.vlaanderen.be/ns/implementatieelement/KlAIMToestand/"	"https://wegenenverkeer-test.data.vlaanderen.be/ns/implementatieelement/KlAIMToestand/gepland"	"http://www.w3.org/2004/02/skos/core#Concept"	""	""	""	""	""
"attribute"	"OSLO-Implementatieelement"	"in opbouw"	"{68C9E691-91E9-42e4-A23B-CCEE985ECAF5}"	""	"KlAIMToestand"	"{25ADBE0F-1B72-4818-8A64-0A38427DBB89}"	""	""	""	""	""	"TODO"	""	""	"true"	"https://wegenenverkeer-test.data.vlaanderen.be/ns/implementatieelement/KlAIMToestand/in "	"https://wegenenverkeer-test.data.vlaanderen.be/ns/implementatieelement/KlAIMToestand/in opbouw"	"http://www.w3.org/2004/02/skos/core#Concept"	""	""	""	""	""
"attribute"	"OSLO-Implementatieelement"	"geannuleerd"	"{4E8DE0CC-45B2-49a3-829E-421A92BE94AD}"	""	"KlAIMToestand"	"{25ADBE0F-1B72-4818-8A64-0A38427DBB89}"	""	""	""	""	""	"TODO"	""	""	"true"	"https://wegenenverkeer-test.data.vlaanderen.be/ns/implementatieelement/KlAIMToestand/"	"https://wegenenverkeer-test.data.vlaanderen.be/ns/implementatieelement/KlAIMToestand/geannuleerd"	"http://www.w3.org/2004/02/skos/core#Concept"	""	""	""	""	""
"attribute"	"OSLO-Implementatieelement"	"in gebruik"	"{3F4EB5A7-D10E-48d5-A4EA-5C74C10494AB}"	""	"KlAIMToestand"	"{25ADBE0F-1B72-4818-8A64-0A38427DBB89}"	""	""	""	""	""	"TODO"	""	""	"true"	"https://wegenenverkeer-test.data.vlaanderen.be/ns/implementatieelement/KlAIMToestand/in "	"https://wegenenverkeer-test.data.vlaanderen.be/ns/implementatieelement/KlAIMToestand/in gebruik"	"http://www.w3.org/2004/02/skos/core#Concept"	""	""	""	""	""
