"EA-Type"	"EA-Package"	"EA-Name"	"EA-GUID"	"EA-Parent"	"EA-Domain"	"EA-Domain-GUID"	"EA-Range"	"label"	"definition"	"usage"	"ap-label-nl"	"ap-definition-nl"	"ap-usageNote-nl"	"ap-codelist"	"external term"	"namespace"	"localname"	"type"	"domain"	"range"	"parent"	"min card"	"max card"
"Package"	""	"OSLO-Ecologische-maatregelen"	"{C7970DFD-5EA1-4fb2-BA0F-80231E8DBC3E}"	""	""	""	""	""	""	""	""	""	""	""	""	"http://"	"fixme.com"	"http://www.w3.org/2002/07/owl#Ontology"	""	""	""	""	""
"CLASS"	"OSLO-Abstracten"	"ComplexeGeleiding"	"{2A42910F-8CD9-428b-91E5-978C8400F79D}"	"Geleiding"	""	""	""	"Complexe geleiding"	"Een Abstracte die de SluitAanOp relatie mogelijk van voor de samenstellende onderdelen van een complexere geleiding."	""	"Complexe geleiding"	"Een Abstracte die de SluitAanOp relatie mogelijk van voor de samenstellende onderdelen van een complexere geleiding."	""	""	"true"	"https://wegenenverkeer-test.data.vlaanderen.be/ns/abstracten#"	"ComplexeGeleiding"	"http://www.w3.org/2000/01/rdf-schema#Class"	""	""	"https://wegenenverkeer-test.data.vlaanderen.be/ns/abstracten#Geleiding"	""	""
"CLASS"	"OSLO-Installatie"	"Gronddam"	"{4CAB6512-1CEF-4bc8-8455-D12FD208A585}"	""	""	""	""	"Gronddam"	"Gronddammen zijn trapeziumvormige constructies bestaande uit zand, grond of steenachtige materialen.
De onderkant van de gronddam wordt direct op het bestaand maaiveld aangebracht of op een vooraf aangebrachte grondverbetering.
Een gronddam kan volgende functies vervullen: geluidswering, geleidng van dieren, veiligheid en lichtwering."	""	"Gronddam"	"Gronddammen zijn trapeziumvormige constructies bestaande uit zand, grond of steenachtige materialen.
De onderkant van de gronddam wordt direct op het bestaand maaiveld aangebracht of op een vooraf aangebrachte grondverbetering.
Een gronddam kan volgende functies vervullen: geluidswering, geleidng van dieren, veiligheid en lichtwering."	""	""	"true"	"https://wegenenverkeer-test.data.vlaanderen.be/ns/installatie#"	"Gronddam"	"http://www.w3.org/2000/01/rdf-schema#Class"	""	""	"https://wegenenverkeer-test.data.vlaanderen.be/ns/implementatieelement#AIMObject"	""	""
"CLASS"	"OSLO-Onderdeel"	"Seinbrug"	"{4A946A56-0C98-4b54-AFB7-1666B2DE01CC}"	""	""	""	""	"Seinbrug"	"Metalen constructie bestaande uit 2 of meer verticale steunen met voetplaat en uit een enkele of een dubbel uitgevoerde horizontale dwarsverbinding,allen kokervormig met rechthoekige doorsnede. Ook wel portiek of portaal genoemd"	""	"Seinbrug"	"Metalen constructie bestaande uit 2 of meer verticale steunen met voetplaat en uit een enkele of een dubbel uitgevoerde horizontale dwarsverbinding,allen kokervormig met rechthoekige doorsnede. Ook wel portiek of portaal genoemd"	""	""	"true"	"https://wegenenverkeer-test.data.vlaanderen.be/ns/onderdeel#"	"Seinbrug"	"http://www.w3.org/2000/01/rdf-schema#Class"	""	""	"https://wegenenverkeer-test.data.vlaanderen.be/ns/abstracten#VRIDraagconstructie"	""	""
"CLASS"	"OSLO-Onderdeel"	"Boombrug"	"{4E4FD1BA-5AC7-456e-8E26-B054FA4D6B0B}"	""	""	""	""	"Boombrug"	"Een eenvoudige constructie die een oversteek biedt voor soorten die in bomen leven,voornamelijk eekhoorns."	""	"Boombrug"	"Een eenvoudige constructie die een oversteek biedt voor soorten die in bomen leven,voornamelijk eekhoorns."	""	""	"true"	"https://wegenenverkeer-test.data.vlaanderen.be/ns/onderdeel#"	"Boombrug"	"http://www.w3.org/2000/01/rdf-schema#Class"	""	""	"https://wegenenverkeer-test.data.vlaanderen.be/ns/implementatieelement#AIMObject"	""	""
"CLASS"	"OSLO-Installatie"	"Ecovallei"	"{5005F3C8-A15B-4c2e-BD27-8C149A8F6996}"	""	""	""	""	"Ecovallei"	"Een vallei onder de verkeersbrug waar het landschap gewoon onderdoor loopt en minimaal wordt verstoord."	""	"Ecovallei"	"Een vallei onder de verkeersbrug waar het landschap gewoon onderdoor loopt en minimaal wordt verstoord."	""	""	"true"	"https://wegenenverkeer-test.data.vlaanderen.be/ns/installatie#"	"Ecovallei"	"http://www.w3.org/2000/01/rdf-schema#Class"	""	""	"https://wegenenverkeer-test.data.vlaanderen.be/ns/implementatieelement#AIMObject"	""	""
"CLASS"	"OSLO-Onderdeel"	"Afscherming"	"{96162534-012C-4e2c-A1DB-87B57D7A49A1}"	""	""	""	""	"Afscherming"	"Schermen of wallen op de rand van het ecoduct die ervoor zorgen dat dieren op de brug niet afgeschrikt worden door de lichten van voorbijrijdende voertuigen."	""	"Afscherming"	"Schermen of wallen op de rand van het ecoduct die ervoor zorgen dat dieren op de brug niet afgeschrikt worden door de lichten van voorbijrijdende voertuigen."	""	""	"true"	"https://wegenenverkeer-test.data.vlaanderen.be/ns/onderdeel#"	"Afscherming"	"http://www.w3.org/2000/01/rdf-schema#Class"	""	""	"https://wegenenverkeer-test.data.vlaanderen.be/ns/implementatieelement#AIMObject"	""	""
"CLASS"	"OSLO-Onderdeel"	"Veerooster"	"{942DCFF5-761E-45b9-914E-9CE1C4815871}"	"ComplexeGeleiding"	""	""	""	"Veerooster"	"Een veerooster is een infrastructurele voorziening die is aangebracht in het wegdek om te voorkomen dat vee een gebied binnenkomt of verlaat."	""	"Veerooster"	"Een veerooster is een infrastructurele voorziening die is aangebracht in het wegdek om te voorkomen dat vee een gebied binnenkomt of verlaat."	""	""	"true"	"https://wegenenverkeer-test.data.vlaanderen.be/ns/onderdeel#"	"Veerooster"	"http://www.w3.org/2000/01/rdf-schema#Class"	""	""	"https://wegenenverkeer-test.data.vlaanderen.be/ns/abstracten#ComplexeGeleiding"	""	""
"CLASS"	"OSLO-Onderdeel"	"Stobbenwal"	"{B5E6314B-52D0-44fc-BE0E-C2D39A47C195}"	"Geleiding"	""	""	""	"Stobbenwal"	"Wortelkluiten of ander houtmateriaal (zoals stamhout) om beschutting en geleiding van kleinere diersoorten zoals muizen,egels."	""	"Stobbenwal"	"Wortelkluiten of ander houtmateriaal (zoals stamhout) om beschutting en geleiding van kleinere diersoorten zoals muizen,egels."	""	""	"true"	"https://wegenenverkeer-test.data.vlaanderen.be/ns/onderdeel#"	"Stobbenwal"	"http://www.w3.org/2000/01/rdf-schema#Class"	""	""	"https://wegenenverkeer-test.data.vlaanderen.be/ns/abstracten#Geleiding"	""	""
"CLASS"	"OSLO-Installatie"	"Ecoduiker"	"{76F66774-3FF7-41cc-B97B-22F69EA2AED8}"	""	""	""	""	"Ecoduiker"	"Buis- of tunnelvormige doorgang voor water onder een weg,die is voorzien van een oeverstrook of van looprichels zodat kleinere diersoorten beschermd voor het verkeer kunnen doorsteken."	""	"Ecoduiker"	"Buis- of tunnelvormige doorgang voor water onder een weg,die is voorzien van een oeverstrook of van looprichels zodat kleinere diersoorten beschermd voor het verkeer kunnen doorsteken."	""	""	"true"	"https://wegenenverkeer-test.data.vlaanderen.be/ns/installatie#"	"Ecoduiker"	"http://www.w3.org/2000/01/rdf-schema#Class"	""	""	"https://wegenenverkeer-test.data.vlaanderen.be/ns/implementatieelement#AIMObject"	""	""
"CLASS"	"OSLO-Abstracten"	"Geleiding"	"{06485BB9-AE75-4cb9-AC7F-A556B29F83C3}"	""	""	""	""	"Geleiding"	"Abstracte om de gerelateerde objecten onder 1 noemer te houden."	""	"Geleiding"	"Abstracte om de gerelateerde objecten onder 1 noemer te houden."	""	""	"true"	"https://wegenenverkeer-test.data.vlaanderen.be/ns/abstracten#"	"Geleiding"	"http://www.w3.org/2000/01/rdf-schema#Class"	""	""	"https://wegenenverkeer-test.data.vlaanderen.be/ns/implementatieelement#AIMObject"	""	""
"CLASS"	"OSLO-Installatie"	"Ecoduct"	"{688A1AEE-57F4-45e8-8A76-98BD57294271}"	""	""	""	""	"Ecoduct"	"Ecoducten of natuurbruggen zorgen ervoor dat dieren veilig de weg kunnen oversteken."	""	"Ecoduct"	"Ecoducten of natuurbruggen zorgen ervoor dat dieren veilig de weg kunnen oversteken."	""	""	"true"	"https://wegenenverkeer-test.data.vlaanderen.be/ns/installatie#"	"Ecoduct"	"http://www.w3.org/2000/01/rdf-schema#Class"	""	""	"https://wegenenverkeer-test.data.vlaanderen.be/ns/implementatieelement#AIMObject"	""	""
"CLASS"	"OSLO-Installatie"	"Ecotunnel"	"{328B3783-29C3-4f50-AE2F-C8BEA22F6F2D}"	""	""	""	""	"Ecotunnel"	"Een (grote) ecotunnel is een tunnel onder een grote weg,waarlangs dieren veilig de overkant kunnen bereiken."	""	"Ecotunnel"	"Een (grote) ecotunnel is een tunnel onder een grote weg,waarlangs dieren veilig de overkant kunnen bereiken."	""	""	"true"	"https://wegenenverkeer-test.data.vlaanderen.be/ns/installatie#"	"Ecotunnel"	"http://www.w3.org/2000/01/rdf-schema#Class"	""	""	"https://wegenenverkeer-test.data.vlaanderen.be/ns/implementatieelement#AIMObject"	""	""
"CLASS"	"OSLO-Abstracten"	"Laag"	"{F1F08207-3686-429d-BFF8-1F7B6E40BA35}"	""	""	""	""	"Laag"	"Abstracte voor de gemeenschappelijke eigenschappen van de onderliggende verhardings- en funderings-onderdelen."	""	"Laag"	"Abstracte voor de gemeenschappelijke eigenschappen van de onderliggende verhardings- en funderings-onderdelen."	""	""	"true"	"https://wegenenverkeer-test.data.vlaanderen.be/ns/abstracten#"	"Laag"	"http://www.w3.org/2000/01/rdf-schema#Class"	""	""	"https://wegenenverkeer-test.data.vlaanderen.be/ns/implementatieelement#AIMObject"	""	""
"CLASS"	"OSLO-Abstracten"	"ConstructieElement"	"{88B021C3-9071-457e-ADB9-AA09915D962A}"	""	""	""	""	"Constructie element"	"Abstracte voor de verschillende constructie elementen."	""	"Constructie element"	"Abstracte voor de verschillende constructie elementen."	""	""	"true"	"https://wegenenverkeer-test.data.vlaanderen.be/ns/abstracten#"	"ConstructieElement"	"http://www.w3.org/2000/01/rdf-schema#Class"	""	""	"https://wegenenverkeer-test.data.vlaanderen.be/ns/implementatieelement#AIMObject"	""	""
"CLASS"	"OSLO-Onderdeel"	"Geleidingswand"	"{AF82A406-13C5-4bab-B5AE-DA036D27F901}"	"Geleiding"	""	""	""	"Geleidingswand"	"Een geleidingswand geleidt kleinere dieren zoals amfibieën naar kleinere ecokokers,ecoduikers,..."	""	"Geleidingswand"	"Een geleidingswand geleidt kleinere dieren zoals amfibieën naar kleinere ecokokers,ecoduikers,..."	""	""	"true"	"https://wegenenverkeer-test.data.vlaanderen.be/ns/onderdeel#"	"Geleidingswand"	"http://www.w3.org/2000/01/rdf-schema#Class"	""	""	"https://wegenenverkeer-test.data.vlaanderen.be/ns/abstracten#Geleiding"	""	""
"CLASS"	"OSLO-Installatie"	"Ecokoker"	"{739E3B61-7380-4835-B46A-46DAC7078505}"	""	""	""	""	"Ecokoker"	"Een kleine ecotunnel of ecokoker is een doorgang voor dieren onder een weg of spoorweg."	""	"Ecokoker"	"Een kleine ecotunnel of ecokoker is een doorgang voor dieren onder een weg of spoorweg."	""	""	"true"	"https://wegenenverkeer-test.data.vlaanderen.be/ns/installatie#"	"Ecokoker"	"http://www.w3.org/2000/01/rdf-schema#Class"	""	""	"https://wegenenverkeer-test.data.vlaanderen.be/ns/implementatieelement#AIMObject"	""	""
"CLASS"	"OSLO-Onderdeel"	"Rioleringsbuis"	"{EF72E7AA-BC9F-4a51-B254-7DE196D8B4C1}"	""	""	""	""	"Rioleringsbuis"	"Ondergronds kanaal of pijp voor gravitaire afvoer van water."	""	"Rioleringsbuis"	"Ondergronds kanaal of pijp voor gravitaire afvoer van water."	""	""	"true"	"https://wegenenverkeer-test.data.vlaanderen.be/ns/onderdeel#"	"Rioleringsbuis"	"http://www.w3.org/2000/01/rdf-schema#Class"	""	""	"https://wegenenverkeer-test.data.vlaanderen.be/ns/abstracten#Buis"	""	""
"CLASS"	"OSLO-Onderdeel"	"Wildreflector"	"{92933315-5ADA-48a5-AB9D-D68F089F07BD}"	""	""	""	""	"Wildreflector"	"Een wildreflector is een reflecterend afschrikkingssysteem voor groot en klein wild nabij een weg."	""	"Wildreflector"	"Een wildreflector is een reflecterend afschrikkingssysteem voor groot en klein wild nabij een weg."	""	""	"true"	"https://wegenenverkeer-test.data.vlaanderen.be/ns/onderdeel#"	"Wildreflector"	"http://www.w3.org/2000/01/rdf-schema#Class"	""	""	"https://wegenenverkeer-test.data.vlaanderen.be/ns/abstracten#Bebakening"	""	""
"CLASS"	"OSLO-Onderdeel"	"Terugkeer"	"{A7B478F9-7C28-427a-BABB-523B8D54DF35}"	"ComplexeGeleiding"	""	""	""	"Terugkeer"	"Een mogelijkheid om dieren die toch aan de wegkant verzeild zijn geraakt terug naar de veilige kant te laten begeven."	""	"Terugkeer"	"Een mogelijkheid om dieren die toch aan de wegkant verzeild zijn geraakt terug naar de veilige kant te laten begeven."	""	""	"true"	"https://wegenenverkeer-test.data.vlaanderen.be/ns/onderdeel#"	"Terugkeer"	"http://www.w3.org/2000/01/rdf-schema#Class"	""	""	"https://wegenenverkeer-test.data.vlaanderen.be/ns/abstracten#ComplexeGeleiding"	""	""
"CLASS"	"OSLO-Onderdeel"	"EcoPoort"	"{F7AB9E5B-BFF4-442d-AE3E-8BD8FF361128}"	"ComplexeGeleiding"	""	""	""	"Eco poort"	"Een afsluitbare doorgang om mensen toe te laten tot het gebied."	""	"Eco poort"	"Een afsluitbare doorgang om mensen toe te laten tot het gebied."	""	""	"true"	"https://wegenenverkeer-test.data.vlaanderen.be/ns/onderdeel#"	"EcoPoort"	"http://www.w3.org/2000/01/rdf-schema#Class"	""	""	"https://wegenenverkeer-test.data.vlaanderen.be/ns/abstracten#ComplexeGeleiding"	""	""
"CLASS"	"OSLO-Onderdeel"	"Ecoraster"	"{817EF691-3C30-4685-9ED0-48EF6676C3E6}"	"ComplexeGeleiding"	""	""	""	"Ecoraster"	"Een geleiding om dieren te leiden naar een plaats (ecoduct,ecotunnel,) waar ze veilig een drukke weg kunnen oversteken."	""	"Ecoraster"	"Een geleiding om dieren te leiden naar een plaats (ecoduct,ecotunnel,) waar ze veilig een drukke weg kunnen oversteken."	""	""	"true"	"https://wegenenverkeer-test.data.vlaanderen.be/ns/onderdeel#"	"Ecoraster"	"http://www.w3.org/2000/01/rdf-schema#Class"	""	""	"https://wegenenverkeer-test.data.vlaanderen.be/ns/abstracten#ComplexeGeleiding"	""	""
"CLASS"	"OSLO-Implementatieelement"	"AIMObject"	"{405A0FFB-83F2-4d60-81EF-A5F73B440219}"	""	""	""	""	"AIM object"	"Abstracte als de basisklasse voor alle uniek geïdentificeerde OTL objecten met de basiseigenschappen die elk OTL object minstens heeft."	""	"AIM object"	"Abstracte als de basisklasse voor alle uniek geïdentificeerde OTL objecten met de basiseigenschappen die elk OTL object minstens heeft."	""	""	"true"	"https://wegenenverkeer-test.data.vlaanderen.be/ns/implementatieelement#"	"AIMObject"	"http://www.w3.org/2000/01/rdf-schema#Class"	""	""	"https://wegenenverkeer-test.data.vlaanderen.be/ns/implementatieelement#AIMToestand, https://wegenenverkeer-test.data.vlaanderen.be/ns/implementatieelement#AIMDBStatus"	""	""
"CLASS"	"OSLO-Implementatieelement"	"AIMToestand"	"{DAC5AED4-C3FC-467b-8E09-DC0BB5EEBB3C}"	""	""	""	""	"AIM Toestand"	"Voegt een attribuut toe aan de subklasse dat de huidige stand in de levenscyclus van het object aangeeft."	""	"AIM Toestand"	"Voegt een attribuut toe aan de subklasse dat de huidige stand in de levenscyclus van het object aangeeft."	""	""	"true"	"https://wegenenverkeer-test.data.vlaanderen.be/ns/implementatieelement#"	"AIMToestand"	"http://www.w3.org/2000/01/rdf-schema#Class"	""	""	""	""	""
"CLASS"	"OSLO-Implementatieelement"	"AIMDBStatus"	"{364BCD16-2039-4d45-B022-B493CBB057DA}"	""	""	""	""	"AIM databank status"	"Voegt een attribuut toe aan de subklasse dat aangeeft of de asset zichtbaar is in de databank of (zacht) verwijderd is."	""	"AIM databank status"	"Voegt een attribuut toe aan de subklasse dat aangeeft of de asset zichtbaar is in de databank of (zacht) verwijderd is."	""	""	"true"	"https://wegenenverkeer-test.data.vlaanderen.be/ns/implementatieelement#"	"AIMDBStatus"	"http://www.w3.org/2000/01/rdf-schema#Class"	""	""	""	""	""
"CLASS"	"OSLO-Abstracten"	"VRIDraagconstructie"	"{6789095A-C03B-4adb-9A25-52AD926B11C6}"	""	""	""	""	"Verkeersregelinstallatie draagconstructie"	"Abstracte voor een dragend element (bv. paal,kolom,& ) waaraan lantaarns met verkeerslichten bevestigd kunnen worden bij de verkeersregelinstallatie."	""	"Verkeersregelinstallatie draagconstructie"	"Abstracte voor een dragend element (bv. paal,kolom,& ) waaraan lantaarns met verkeerslichten bevestigd kunnen worden bij de verkeersregelinstallatie."	""	""	"true"	"https://wegenenverkeer-test.data.vlaanderen.be/ns/abstracten#"	"VRIDraagconstructie"	"http://www.w3.org/2000/01/rdf-schema#Class"	""	""	"https://wegenenverkeer-test.data.vlaanderen.be/ns/abstracten#SteunStandaard"	""	""
"CLASS"	"OSLO-Abstracten"	"SteunStandaard"	"{29B8D3A5-65B0-45f0-9FD9-387C67E73076}"	""	""	""	""	"Steun standaard"	"Abstracte voor de standaard steunen."	""	"Steun standaard"	"Abstracte voor de standaard steunen."	""	""	"true"	"https://wegenenverkeer-test.data.vlaanderen.be/ns/abstracten#"	"SteunStandaard"	"http://www.w3.org/2000/01/rdf-schema#Class"	""	""	"https://wegenenverkeer-test.data.vlaanderen.be/ns/implementatieelement#AIMNaamObject, https://wegenenverkeer-test.data.vlaanderen.be/ns/abstracten#EMDraagconstructie"	""	""
"CLASS"	"OSLO-Implementatieelement"	"AIMNaamObject"	"{E3A247BC-7230-448b-9E87-96E7C8F950B1}"	""	""	""	""	"AIM naam object"	"Abstracte als de basisklasse voor elk OTL object dat benoemd wordt met een mensleesbare identificator."	""	"AIM naam object"	"Abstracte als de basisklasse voor elk OTL object dat benoemd wordt met een mensleesbare identificator."	""	""	"true"	"https://wegenenverkeer-test.data.vlaanderen.be/ns/implementatieelement#"	"AIMNaamObject"	"http://www.w3.org/2000/01/rdf-schema#Class"	""	""	"https://wegenenverkeer-test.data.vlaanderen.be/ns/implementatieelement#AIMObject"	""	""
"CLASS"	"OSLO-Abstracten"	"EMDraagconstructie"	"{74AC8A14-099F-4d19-BBB4-562D1BF6F09E}"	""	""	""	""	"EM-draagconstructie"	"Abstracte voor een elektromechanisch (EM) dragend element (bv. paal,kolom,seinbrug,galgpaal,) waaraan EM-toestellen bevestigd kunnen worden."	""	"EM-draagconstructie"	"Abstracte voor een elektromechanisch (EM) dragend element (bv. paal,kolom,seinbrug,galgpaal,) waaraan EM-toestellen bevestigd kunnen worden."	""	""	"true"	"https://wegenenverkeer-test.data.vlaanderen.be/ns/abstracten#"	"EMDraagconstructie"	"http://www.w3.org/2000/01/rdf-schema#Class"	""	""	"https://wegenenverkeer-test.data.vlaanderen.be/ns/abstracten#Draagconstructie"	""	""
"CLASS"	"OSLO-Abstracten"	"Draagconstructie"	"{4C8318DD-383A-46bc-B58B-A265F4BD7883}"	""	""	""	""	"Draagconstructie"	"Abstracte voor alle draagconstructies."	""	"Draagconstructie"	"Abstracte voor alle draagconstructies."	""	""	"true"	"https://wegenenverkeer-test.data.vlaanderen.be/ns/abstracten#"	"Draagconstructie"	"http://www.w3.org/2000/01/rdf-schema#Class"	""	""	""	""	""
"CLASS"	"OSLO-Abstracten"	"Buis"	"{109B9A6C-E5A5-43f3-B463-6E4AE80A19AF}"	""	""	""	""	"Buis"	"Abstracte om de gemeenschappelijke eigenschappen en relaties van de verschillende soorten buizen onder één noemer te houden."	""	"Buis"	"Abstracte om de gemeenschappelijke eigenschappen en relaties van de verschillende soorten buizen onder één noemer te houden."	""	""	"true"	"https://wegenenverkeer-test.data.vlaanderen.be/ns/abstracten#"	"Buis"	"http://www.w3.org/2000/01/rdf-schema#Class"	""	""	"https://wegenenverkeer-test.data.vlaanderen.be/ns/implementatieelement#AIMObject"	""	""
"CLASS"	"OSLO-Abstracten"	"Bebakening"	"{070A6168-4F6D-4e6d-BC05-2B379698D292}"	""	""	""	""	"Bebakening"	"Abstracte voor de bebakeningen."	""	"Bebakening"	"Abstracte voor de bebakeningen."	""	""	"true"	"https://wegenenverkeer-test.data.vlaanderen.be/ns/abstracten#"	"Bebakening"	"http://www.w3.org/2000/01/rdf-schema#Class"	""	""	"https://wegenenverkeer-test.data.vlaanderen.be/ns/implementatieelement#AIMObject, https://wegenenverkeer-test.data.vlaanderen.be/ns/abstracten#Signalisatie"	""	""
"CLASS"	"OSLO-Abstracten"	"Signalisatie"	"{DB2B2B39-D01E-4c1f-A235-B5C8DA761700}"	""	""	""	""	"Signalisatie"	"Abstracte voor de gemeenschappelijke eigenschappen en relaties."	""	"Signalisatie"	"Abstracte voor de gemeenschappelijke eigenschappen en relaties."	""	""	"true"	"https://wegenenverkeer-test.data.vlaanderen.be/ns/abstracten#"	"Signalisatie"	"http://www.w3.org/2000/01/rdf-schema#Class"	""	""	""	""	""
"DATATYPE"	"OSLO-Implementatieelement"	"DtcIdentificator"	"{3C1A9CE1-8B09-4751-B7FE-9D35685E30AD}"	""	""	""	""	"Identificator"	"Complex datatype voor de identificator van een object volgens de bron van de identificator."	""	"Identificator"	"Complex datatype voor de identificator van een object volgens de bron van de identificator."	""	""	"true"	"https://wegenenverkeer-test.data.vlaanderen.be/ns/implementatieelement#"	"DtcIdentificator"	"http://www.w3.org/2000/01/rdf-schema#Class"	""	""	""	""	""
"DATATYPE"	"W3-XML-Schema"	"String"	"{46000FD5-B812-4509-A95A-0E70BC519F47}"	""	""	""	""	"String"	"Beschrijft een tekstregel volgens http://www.w3.org/2001/XMLSchema#string"	"https://www.w3.org/TR/xmlschema-2/#string"	"String"	"Beschrijft een tekstregel volgens http://www.w3.org/2001/XMLSchema#string"	""	""	"true"	"http://www.w3.org/2001/XMLSchema#"	"string"	"http://www.w3.org/2000/01/rdf-schema#Class"	""	""	""	""	""
"DATATYPE"	"W3-XML-Schema"	"Date"	"{AB17F590-7515-42f2-A1FD-017F6A8D1F87}"	""	""	""	""	"Datum"	"Beschrijft een datum volgens http://www.w3.org/2001/XMLSchema#date"	"https://www.w3.org/TR/xmlschema-2/#date"	"Datum"	"Beschrijft een datum volgens http://www.w3.org/2001/XMLSchema#date"	""	""	"true"	"http://www.w3.org/2001/XMLSchema#"	"date"	"http://www.w3.org/2000/01/rdf-schema#Class"	""	""	""	""	""
"DATATYPE"	"W3-XML-Schema"	"AnyURI"	"{7D2306ED-5ECE-451a-9FC0-38E7E6A9D69D}"	""	""	""	""	"URI"	"Een tekstwaarde die een verwijzing naar meer informatie van het element bevat volgens http://www.w3.org/2001/XMLSchema#anyURI ."	"https://www.w3.org/TR/xmlschema-2/#anyURI"	"URI"	"Een tekstwaarde die een verwijzing naar meer informatie van het element bevat volgens http://www.w3.org/2001/XMLSchema#anyURI ."	""	""	"true"	"http://www.w3.org/2001/XMLSchema#"	"anyURI"	"http://www.w3.org/2000/01/rdf-schema#Class"	""	""	""	""	""
"DATATYPE"	"W3-XML-Schema"	"Boolean"	"{0544FFC3-F3A6-418d-AE01-A297FBC08BFF}"	""	""	""	""	"Boolean"	"Beschrijft een boolean volgens http://www.w3.org/2001/XMLSchema#boolean"	"https://www.w3.org/TR/xmlschema-2/#boolean"	"Boolean"	"Beschrijft een boolean volgens http://www.w3.org/2001/XMLSchema#boolean"	""	""	"true"	"http://www.w3.org/2001/XMLSchema#"	"boolean"	"http://www.w3.org/2000/01/rdf-schema#Class"	""	""	""	""	""
"DATATYPE"	"OSLO-Implementatieelement"	"KwantWrdInMeter"	"{CD137DF1-65D5-4347-9D31-F6E4BD49A2D1}"	""	""	""	""	"Kwantitatieve waarde in meter"	"Een kwantitatieve waarde die een getal in meter uitdrukt."	""	"Kwantitatieve waarde in meter"	"Een kwantitatieve waarde die een getal in meter uitdrukt."	""	""	"true"	"https://wegenenverkeer-test.data.vlaanderen.be/ns/implementatieelement#"	"KwantWrdInMeter"	"http://www.w3.org/2000/01/rdf-schema#Class"	""	""	""	""	""
"DATATYPE"	"W3-RDF-Schema"	"Literal"	"{77B0B6CB-5141-4d3a-BCB5-92EA7382CD6B}"	""	""	""	""	"Literal"	"Beschrijft een constante."	"http://www.w3.org/2000/01/rdf-schema#Literal"	"Literal"	"Beschrijft een constante."	""	""	"true"	"http://www.w3.org/2000/01/rdf-schema#"	"Literal"	"http://www.w3.org/2000/01/rdf-schema#Class"	""	""	""	""	""
"DATATYPE"	"W3-XML-Schema"	"Decimal"	"{199E318E-2D42-40c6-B228-32B2E490B640}"	""	""	""	""	"Decimaal getal"	"Beschrijft een decimaal getal volgens http://www.w3.org/2001/XMLSchema#decimal"	"https://www.w3.org/TR/xmlschema-2/#decimal"	"Decimaal getal"	"Beschrijft een decimaal getal volgens http://www.w3.org/2001/XMLSchema#decimal"	""	""	"true"	"http://www.w3.org/2001/XMLSchema#"	"decimal"	"http://www.w3.org/2000/01/rdf-schema#Class"	""	""	""	""	""
"DATATYPE"	"OSLO-Implementatieelement"	"DtcDocument"	"{E0B6DD17-B56B-4a53-95B5-9049B1EC980E}"	""	""	""	""	"Bestandsbijlage"	"Complex datatype voor alle bestandsbijlages"	""	"Bestandsbijlage"	"Complex datatype voor alle bestandsbijlages"	""	""	"true"	"https://wegenenverkeer-test.data.vlaanderen.be/ns/implementatieelement#"	"DtcDocument"	"http://www.w3.org/2000/01/rdf-schema#Class"	""	""	""	""	""
"DATATYPE"	"OSLO-Implementatieelement"	"DteTekstblok"	"{5E0F1078-64D7-41e6-AB33-41BD4C95F570}"	""	""	""	""	"Tekstblok"	"Een tekst welke uit meerdere zinnen bestaat,en ook regeleindes kan bevatten. Een tekstblok bevat maximaal 65.000 karakters."	""	"Tekstblok"	"Een tekst welke uit meerdere zinnen bestaat,en ook regeleindes kan bevatten. Een tekstblok bevat maximaal 65.000 karakters."	""	""	"true"	"https://wegenenverkeer-test.data.vlaanderen.be/ns/implementatieelement#"	"DteTekstblok"	"http://www.w3.org/2000/01/rdf-schema#Class"	""	""	""	""	""
"DATATYPE"	"OSLO-Implementatieelement"	"DteKleurRAL"	"{FC69D376-788C-49e8-8ACA-B249952D78E8}"	""	""	""	""	"RAL-kleur"	"Beschrijft een kleur volgens het RAL klassificatiesysteem. De waarde is een natuurlijk getal tussen 1000 en 9999."	""	"RAL-kleur"	"Beschrijft een kleur volgens het RAL klassificatiesysteem. De waarde is een natuurlijk getal tussen 1000 en 9999."	""	""	"true"	"https://wegenenverkeer-test.data.vlaanderen.be/ns/implementatieelement#"	"DteKleurRAL"	"http://www.w3.org/2000/01/rdf-schema#Class"	""	""	""	""	""
"DATATYPE"	"OSLO-Implementatieelement"	"KwantWrdInVierkanteMeter"	"{67C07D13-17AB-4500-868B-A4075514CD6A}"	""	""	""	""	"Kwantitatieve waarde in vierkante meter"	"Een kwantitatieve waarde die een getal in vierkante meter uitdrukt."	""	"Kwantitatieve waarde in vierkante meter"	"Een kwantitatieve waarde die een getal in vierkante meter uitdrukt."	""	""	"true"	"https://wegenenverkeer-test.data.vlaanderen.be/ns/implementatieelement#"	"KwantWrdInVierkanteMeter"	"http://www.w3.org/2000/01/rdf-schema#Class"	""	""	""	""	""
"DATATYPE"	"OSLO-Implementatieelement"	"KwantWrdInMillimeter"	"{05FF4D5B-B5A2-4909-9657-572035B89026}"	""	""	""	""	"Kwantitatieve waarde in millimeter"	"Een kwantitatieve waarde die een getal in millimeter uitdrukt."	""	"Kwantitatieve waarde in millimeter"	"Een kwantitatieve waarde die een getal in millimeter uitdrukt."	""	""	"true"	"https://wegenenverkeer-test.data.vlaanderen.be/ns/implementatieelement#"	"KwantWrdInMillimeter"	"http://www.w3.org/2000/01/rdf-schema#Class"	""	""	""	""	""
"DATATYPE"	"W3-XML-Schema"	"Integer"	"{C927C962-4676-4c73-ADE9-1AAE6048F361}"	""	""	""	""	"Geheel getal"	"Beschrijft een geheel getal volgens http://www.w3.org/2001/XMLSchema#integer"	"https://www.w3.org/TR/xmlschema-2/#integer"	"Geheel getal"	"Beschrijft een geheel getal volgens http://www.w3.org/2001/XMLSchema#integer"	""	""	"true"	"http://www.w3.org/2001/XMLSchema#"	"integer"	"http://www.w3.org/2000/01/rdf-schema#Class"	""	""	""	""	""
