"EA-Type"	"EA-Package"	"EA-Name"	"EA-GUID"	"EA-Parent"	"EA-Domain"	"EA-Domain-GUID"	"EA-Range"	"label"	"definition"	"usage"	"label-nl"	"definition-nl"	"usageNote-nl"	"label-en"	"definition-en"	"usageNote-en"	"equivalent"	"subclass"	"subclass1"	"sameAs"	"external term"	"namespace"	"localname"	"type"	"domain"	"range"	"parent"	"min card"	"max card"
"CLASS"	"OSLO-Proefenmeting"	"ProefVlakheid"	"{0908FE15-DA07-4bc0-A786-DD5ABC82BB4F}"	""	""	""	""	"Proef vlakheid"	"Controle van de effenheid van het oppervlak met behulp van een 3 meter lange rei volgens NBN EN 13036-7."	""	"Proef vlakheid"	"Controle van de effenheid van het oppervlak met behulp van een 3 meter lange rei volgens NBN EN 13036-7."	""	""	""	""	""	""	""	""	"false"	"https://wegenenverkeer-test.data.vlaanderen.be/ns/proefenmeting#"	"ProefVlakheid"	"http://www.w3.org/2000/01/rdf-schema#Class"	""	""	"https://wegenenverkeer-test.data.vlaanderen.be/ns/abstracten#Proef"	""	""
"CLASS"	"OSLO-Proefenmeting"	"ProefGemetenDikte"	"{6C368487-AA79-4bb4-A9EF-1DEA9335FE65}"	""	""	""	""	"Proef gemeten dikte"	"De effectieve dikte van de laag."	""	"Proef gemeten dikte"	"De effectieve dikte van de laag."	""	""	""	""	""	""	""	""	"false"	"https://wegenenverkeer-test.data.vlaanderen.be/ns/proefenmeting#"	"ProefGemetenDikte"	"http://www.w3.org/2000/01/rdf-schema#Class"	""	""	"https://wegenenverkeer-test.data.vlaanderen.be/ns/abstracten#Proef"	""	""
"CLASS"	"OSLO-Proefenmeting"	"ProefWeerstandAfschilfering"	"{BED46A70-B61E-4615-9470-7D57211FC09E}"	""	""	""	""	"Proef weerstand afschilfering"	"Controle van de vorst-dooiweerstand volgens CEN/TS 12390-9."	""	"Proef weerstand afschilfering"	"Controle van de vorst-dooiweerstand volgens CEN/TS 12390-9."	""	""	""	""	""	""	""	""	"false"	"https://wegenenverkeer-test.data.vlaanderen.be/ns/proefenmeting#"	"ProefWeerstandAfschilfering"	"http://www.w3.org/2000/01/rdf-schema#Class"	""	""	"https://wegenenverkeer-test.data.vlaanderen.be/ns/abstracten#Proef"	""	""
"CLASS"	"OSLO-Proefenmeting"	"ProefDwarsvlakheid"	"{4857535C-1EB6-4a03-8C45-3414E05C9FA0}"	""	""	""	""	"Proef dwarsvlakheid"	"Controle van de spoorvorming via de latmethode."	""	"Proef dwarsvlakheid"	"Controle van de spoorvorming via de latmethode."	""	""	""	""	""	""	""	""	"false"	"https://wegenenverkeer-test.data.vlaanderen.be/ns/proefenmeting#"	"ProefDwarsvlakheid"	"http://www.w3.org/2000/01/rdf-schema#Class"	""	""	"https://wegenenverkeer-test.data.vlaanderen.be/ns/abstracten#Proef"	""	""
"CLASS"	"OSLO-Proefenmeting"	"ProefVisueleBeoordeling"	"{7B78870D-3129-47fd-AECA-6F83CFAD2894}"	""	""	""	""	"Proef visuele beoordeling"	"Opsporen van de gebreken bij de definitieve oplevering."	""	"Proef visuele beoordeling"	"Opsporen van de gebreken bij de definitieve oplevering."	""	""	""	""	""	""	""	""	"false"	"https://wegenenverkeer-test.data.vlaanderen.be/ns/proefenmeting#"	"ProefVisueleBeoordeling"	"http://www.w3.org/2000/01/rdf-schema#Class"	""	""	"https://wegenenverkeer-test.data.vlaanderen.be/ns/abstracten#Proef"	""	""
"CLASS"	"OSLO-Proefenmeting"	"Keuring"	"{0D52A028-9173-404c-AC6F-0DF24972A390}"	""	""	""	""	"Keuring"	"Technische keuring uitgevoerd door een officiële keuringsinstantie."	""	"Keuring"	"Technische keuring uitgevoerd door een officiële keuringsinstantie."	""	""	""	""	""	""	""	""	"false"	"https://wegenenverkeer-test.data.vlaanderen.be/ns/proefenmeting#"	"Keuring"	"http://www.w3.org/2000/01/rdf-schema#Class"	""	""	""	""	""
"CLASS"	"OSLO-Proefenmeting"	"MeteropnameEnergiemeterGecombineerd"	"{AC9F4EA0-A355-4df3-B5D1-21A1AC763336}"	""	""	""	""	"Meteropname gecombineerde energiemeter"	"Resultaten van een meteropname van een gecombineerde energiemeter."	""	"Meteropname gecombineerde energiemeter"	"Resultaten van een meteropname van een gecombineerde energiemeter."	""	""	""	""	""	""	""	""	"false"	"https://wegenenverkeer-test.data.vlaanderen.be/ns/proefenmeting#"	"MeteropnameEnergiemeterGecombineerd"	"http://www.w3.org/2000/01/rdf-schema#Class"	""	""	"https://wegenenverkeer-test.data.vlaanderen.be/ns/proefenmeting#MeteropnameEnergiemeter"	""	""
"CLASS"	"OSLO-Proefenmeting"	"MeteropnameEnergiemeter"	"{C52285C2-0160-468d-A1EA-0033C7E7A108}"	""	""	""	""	"Meteropname energiemeter"	"Resultaten van een meteropname van een energiemeter."	""	"Meteropname energiemeter"	"Resultaten van een meteropname van een energiemeter."	""	""	""	""	""	""	""	""	"false"	"https://wegenenverkeer-test.data.vlaanderen.be/ns/proefenmeting#"	"MeteropnameEnergiemeter"	"http://www.w3.org/2000/01/rdf-schema#Class"	""	""	"https://wegenenverkeer-test.data.vlaanderen.be/ns/implementatieelement#AIMNaamObject"	""	""
"attribute"	"OSLO-Proefenmeting"	"stroefheid"	"{5963037E-236C-4afa-B19A-EE1B221744BE}"	""	"ProefStroefheid"	"{5841805D-D6E7-4412-A034-3BEADAB3458B}"	"DtcDocument"	"stroefheid"	"Proefresultaten van de stroefheid."	""	"stroefheid"	"Proefresultaten van de stroefheid."	""	""	""	""	""	""	""	""	"false"	"https://wegenenverkeer-test.data.vlaanderen.be/ns/proefenmeting#"	"ProefStroefheid.stroefheid"	"http://www.w3.org/2002/07/owl#ObjectProperty"	"https://wegenenverkeer-test.data.vlaanderen.be/ns/proefenmeting#ProefStroefheid"	"https://wegenenverkeer-test.data.vlaanderen.be/ns/implementatieelement#DtcDocument"	""	"1"	"1"
"attribute"	"OSLO-Proefenmeting"	"draineervermogen"	"{C0A869E9-2221-40cd-AC0B-761105A37F69}"	""	"ProefDraineervermogen"	"{5E058377-C500-42c4-B861-C206367F4380}"	"DtcDocument"	"draineervermogen"	"Proefresultaten van het drainvermogen."	""	"draineervermogen"	"Proefresultaten van het drainvermogen."	""	""	""	""	""	""	""	""	"false"	"https://wegenenverkeer-test.data.vlaanderen.be/ns/proefenmeting#"	"ProefDraineervermogen.draineervermogen"	"http://www.w3.org/2002/07/owl#ObjectProperty"	"https://wegenenverkeer-test.data.vlaanderen.be/ns/proefenmeting#ProefDraineervermogen"	"https://wegenenverkeer-test.data.vlaanderen.be/ns/implementatieelement#DtcDocument"	""	"1"	"1"
"attribute"	"OSLO-Proefenmeting"	"luminantiecoëfficiënt"	"{9BA3B533-E7ED-4c0e-A7C8-D12FB47C2996}"	""	"ProefZichtbaarheidBijDagOfWV"	"{D70EF271-FA02-4c81-B1CF-DC130868DA10}"	"Decimal"	"luminantiecoëfficient"	"De verhouding van de luminantie van het oppervlak in een gegeven richting en de verlichtingssterkte op het oppervlak."	"uitgedrukt in mcd. m-2.lux-1"	"luminantiecoëfficient"	"De verhouding van de luminantie van het oppervlak in een gegeven richting en de verlichtingssterkte op het oppervlak."	"uitgedrukt in mcd. m-2.lux-1"	""	""	""	""	""	""	""	"false"	"https://wegenenverkeer-test.data.vlaanderen.be/ns/proefenmeting#"	"ProefZichtbaarheidBijDagOfWV.luminantiecoëfficiënt"	"http://www.w3.org/2002/07/owl#ObjectProperty"	"https://wegenenverkeer-test.data.vlaanderen.be/ns/proefenmeting#ProefZichtbaarheidBijDagOfWV"	"http://www.w3.org/2001/XMLSchema#decimal"	""	"1"	"1"
"attribute"	"OSLO-Proefenmeting"	"druksterkte"	"{181B7512-2D1C-4f17-82D7-BBE62D3204E6}"	""	"ProefDruksterkte"	"{6EAEF81D-D119-4daf-84E8-D8EBD6B197CA}"	"DtcDocument"	"druksterkte"	"Proefresultaten van de druksterkte van de laag."	""	"druksterkte"	"Proefresultaten van de druksterkte van de laag."	""	""	""	""	""	""	""	""	"false"	"https://wegenenverkeer-test.data.vlaanderen.be/ns/proefenmeting#"	"ProefDruksterkte.druksterkte"	"http://www.w3.org/2002/07/owl#ObjectProperty"	"https://wegenenverkeer-test.data.vlaanderen.be/ns/proefenmeting#ProefDruksterkte"	"https://wegenenverkeer-test.data.vlaanderen.be/ns/implementatieelement#DtcDocument"	""	"1"	"1"
"attribute"	"OSLO-Proefenmeting"	"schokindexMvp"	"{59721F23-CDEB-4c4a-AE20-063FA1075A98}"	""	"ProefSchokindexMVP"	"{4FA601B7-AE2C-48bb-A088-C525AF41843C}"	"KlLEACSchokindexMVP"	"schokindex mvp"	" head injury criterium (HIC) van een motorvangplank.
"	""	"schokindex mvp"	" head injury criterium (HIC) van een motorvangplank.
"	""	""	""	""	""	""	""	""	"false"	"https://wegenenverkeer-test.data.vlaanderen.be/ns/proefenmeting#"	"ProefSchokindexMVP.schokindexMvp"	"http://www.w3.org/2002/07/owl#ObjectProperty"	"https://wegenenverkeer-test.data.vlaanderen.be/ns/proefenmeting#ProefSchokindexMVP"	"http://www.w3.org/2004/02/skos/core#Concept"	""	"1"	"1"
"attribute"	"OSLO-Proefenmeting"	"gaafheid"	"{9A8E4840-AC9B-4a95-AE04-37F5F7C7CC76}"	""	"ProefGaafheid"	"{E7603A7B-6DCF-4dba-A048-886BA4FA9D97}"	"DtcDocument"	"gaafheid"	"De resultaten van de controle."	""	"gaafheid"	"De resultaten van de controle."	""	""	""	""	""	""	""	""	"false"	"https://wegenenverkeer-test.data.vlaanderen.be/ns/proefenmeting#"	"ProefGaafheid.gaafheid"	"http://www.w3.org/2002/07/owl#ObjectProperty"	"https://wegenenverkeer-test.data.vlaanderen.be/ns/proefenmeting#ProefGaafheid"	"https://wegenenverkeer-test.data.vlaanderen.be/ns/implementatieelement#DtcDocument"	""	"1"	"1"
"attribute"	"OSLO-Proefenmeting"	"luchtdichtheid"	"{D036C38C-F1E9-4114-9D43-67FF7CAB24F2}"	""	"ProefLuchtdichtheid"	"{4A924F29-03F6-4889-B4D0-A06C6039D6E8}"	"DtcDocument"	"luchtdichtheid"	"Testresultaten van de opgemeten drukval van het beproefde leidingsvak."	""	"luchtdichtheid"	"Testresultaten van de opgemeten drukval van het beproefde leidingsvak."	""	""	""	""	""	""	""	""	"false"	"https://wegenenverkeer-test.data.vlaanderen.be/ns/proefenmeting#"	"ProefLuchtdichtheid.luchtdichtheid"	"http://www.w3.org/2002/07/owl#ObjectProperty"	"https://wegenenverkeer-test.data.vlaanderen.be/ns/proefenmeting#ProefLuchtdichtheid"	"https://wegenenverkeer-test.data.vlaanderen.be/ns/implementatieelement#DtcDocument"	""	"1"	"1"
"attribute"	"OSLO-Proefenmeting"	"luminantiefactor"	"{1F9AC9C5-8FF0-4e21-BA71-C35D8E91570A}"	""	"ProefLuminantie"	"{5230387C-B0A6-4882-B657-20F53FDD70B4}"	"Decimal"	"luminantiefactor"	"Waarde om het contrast met het wegdek en bijgevolg de dagzichtbaarheid te bepalen."	""	"luminantiefactor"	"Waarde om het contrast met het wegdek en bijgevolg de dagzichtbaarheid te bepalen."	""	""	""	""	""	""	""	""	"false"	"https://wegenenverkeer-test.data.vlaanderen.be/ns/proefenmeting#"	"ProefLuminantie.luminantiefactor"	"http://www.w3.org/2002/07/owl#ObjectProperty"	"https://wegenenverkeer-test.data.vlaanderen.be/ns/proefenmeting#ProefLuminantie"	"http://www.w3.org/2001/XMLSchema#decimal"	""	"1"	"1"
"attribute"	"OSLO-Proefenmeting"	"doorlatendheid"	"{C64DE4D3-3E23-457e-8C76-6C590E4CF47F}"	""	"ProefDoorlatendheid"	"{71431722-A81A-4edf-B654-5AD344BC81DA}"	"DtcDocument"	"doorlatendheid"	"Proefresultaten van de waterdoorlatendheid."	""	"doorlatendheid"	"Proefresultaten van de waterdoorlatendheid."	""	""	""	""	""	""	""	""	"false"	"https://wegenenverkeer-test.data.vlaanderen.be/ns/proefenmeting#"	"ProefDoorlatendheid.doorlatendheid"	"http://www.w3.org/2002/07/owl#ObjectProperty"	"https://wegenenverkeer-test.data.vlaanderen.be/ns/proefenmeting#ProefDoorlatendheid"	"https://wegenenverkeer-test.data.vlaanderen.be/ns/implementatieelement#DtcDocument"	""	"1"	"1"
"attribute"	"OSLO-Proefenmeting"	"langsvlakheid"	"{5E78EBCF-08FD-4f25-9931-50215312D93D}"	""	"ProefLangsvlakheid"	"{7CB5CAA5-43C0-41f6-85CA-459671469F31}"	"DtcDocument"	"langsvlakheid"	"Het resultaat van de meting."	""	"langsvlakheid"	"Het resultaat van de meting."	""	""	""	""	""	""	""	""	"false"	"https://wegenenverkeer-test.data.vlaanderen.be/ns/proefenmeting#"	"ProefLangsvlakheid.langsvlakheid"	"http://www.w3.org/2002/07/owl#ObjectProperty"	"https://wegenenverkeer-test.data.vlaanderen.be/ns/proefenmeting#ProefLangsvlakheid"	"https://wegenenverkeer-test.data.vlaanderen.be/ns/implementatieelement#DtcDocument"	""	"1"	"1"
"attribute"	"OSLO-Proefenmeting"	"mortelkwaliteit"	"{AAF78631-14FB-4049-B645-5160137D500D}"	""	"ProefMortelkwaliteit"	"{549C9BC1-BFA1-4288-92E3-602ABDA2EA58}"	"DtcDocument"	"mortelkwaliteit"	"Een rapport van de mortelkwaliteit van de onderbouw laag."	""	"mortelkwaliteit"	"Een rapport van de mortelkwaliteit van de onderbouw laag."	""	""	""	""	""	""	""	""	"false"	"https://wegenenverkeer-test.data.vlaanderen.be/ns/proefenmeting#"	"ProefMortelkwaliteit.mortelkwaliteit"	"http://www.w3.org/2002/07/owl#ObjectProperty"	"https://wegenenverkeer-test.data.vlaanderen.be/ns/proefenmeting#ProefMortelkwaliteit"	"https://wegenenverkeer-test.data.vlaanderen.be/ns/implementatieelement#DtcDocument"	""	"1"	"1"
"attribute"	"OSLO-Proefenmeting"	"schokindex"	"{C6610D65-D9BC-412f-9EBD-0A72E0E168EF}"	""	"ProefSchokindex"	"{350B29C4-AB54-4f57-8A4B-E428FCC50613}"	"KlLEACSchokindex"	"schokindex"	" De parameter die 
weergeeft hoe groot de kans op ernstige letsels is van de inzittenden bij een
aanrijding."	""	"schokindex"	" De parameter die 
weergeeft hoe groot de kans op ernstige letsels is van de inzittenden bij een
aanrijding."	""	""	""	""	""	""	""	""	"false"	"https://wegenenverkeer-test.data.vlaanderen.be/ns/proefenmeting#"	"ProefSchokindex.schokindex"	"http://www.w3.org/2002/07/owl#ObjectProperty"	"https://wegenenverkeer-test.data.vlaanderen.be/ns/proefenmeting#ProefSchokindex"	"http://www.w3.org/2004/02/skos/core#Concept"	""	"1"	"1"
"attribute"	"OSLO-Proefenmeting"	"waterdichtheid"	"{D8841F5A-EF28-4f96-99A2-1B349CA229D8}"	""	"ProefWaterdichtheid"	"{04B940F0-4C55-485e-96EF-C1929A464C0D}"	"DtcDocument"	"waterdichtheid"	"Testresultaten van het opgemeten waterverlies van het beproefde leidingsvak."	""	"waterdichtheid"	"Testresultaten van het opgemeten waterverlies van het beproefde leidingsvak."	""	""	""	""	""	""	""	""	"false"	"https://wegenenverkeer-test.data.vlaanderen.be/ns/proefenmeting#"	"ProefWaterdichtheid.waterdichtheid"	"http://www.w3.org/2002/07/owl#ObjectProperty"	"https://wegenenverkeer-test.data.vlaanderen.be/ns/proefenmeting#ProefWaterdichtheid"	"https://wegenenverkeer-test.data.vlaanderen.be/ns/implementatieelement#DtcDocument"	""	"1"	"1"
"attribute"	"OSLO-Proefenmeting"	"wateropslorping"	"{08D956BA-E390-414a-A809-2B317A3F07D8}"	""	"ProefWateropslorping"	"{D75320F6-AF6C-4753-9EA4-F2B82918E689}"	"DtcDocument"	"wateropslorping"	"Proef om de wateropslorping van de laag te bepalen."	""	"wateropslorping"	"Proef om de wateropslorping van de laag te bepalen."	""	""	""	""	""	""	""	""	"false"	"https://wegenenverkeer-test.data.vlaanderen.be/ns/proefenmeting#"	"ProefWateropslorping.wateropslorping"	"http://www.w3.org/2002/07/owl#ObjectProperty"	"https://wegenenverkeer-test.data.vlaanderen.be/ns/proefenmeting#ProefWateropslorping"	"https://wegenenverkeer-test.data.vlaanderen.be/ns/implementatieelement#DtcDocument"	""	"1"	"1"
"attribute"	"OSLO-Proefenmeting"	"temperatuur"	"{D356EB4F-5312-44bf-81D1-C39745A40324}"	""	"ProefTemperatuur"	"{4717ED22-EDB4-4247-824F-5C1D34BCE041}"	"KwantWrdInCelsius"	"temperatuur"	"De temperatuur van de BV laag in graden Celsius."	""	"temperatuur"	"De temperatuur van de BV laag in graden Celsius."	""	""	""	""	""	""	""	""	"false"	"https://wegenenverkeer-test.data.vlaanderen.be/ns/proefenmeting#"	"ProefTemperatuur.temperatuur"	"http://www.w3.org/2002/07/owl#ObjectProperty"	"https://wegenenverkeer-test.data.vlaanderen.be/ns/proefenmeting#ProefTemperatuur"	"https://wegenenverkeer-test.data.vlaanderen.be/ns/implementatieelement#KwantWrdInCelsius"	""	"1"	"1"
"attribute"	"OSLO-Proefenmeting"	"rolgeluid"	"{CD767532-DC2A-46c8-9E06-CA923658DC99}"	""	"ProefRolgeluid"	"{8628D871-4AE2-4582-AF12-75A80561757C}"	"DtcDocument"	"rolgeluid"	"Proefresultaten van het rolgeluid van de toplaag."	""	"rolgeluid"	"Proefresultaten van het rolgeluid van de toplaag."	""	""	""	""	""	""	""	""	"false"	"https://wegenenverkeer-test.data.vlaanderen.be/ns/proefenmeting#"	"ProefRolgeluid.rolgeluid"	"http://www.w3.org/2002/07/owl#ObjectProperty"	"https://wegenenverkeer-test.data.vlaanderen.be/ns/proefenmeting#ProefRolgeluid"	"https://wegenenverkeer-test.data.vlaanderen.be/ns/implementatieelement#DtcDocument"	""	"1"	"1"
"attribute"	"OSLO-Proefenmeting"	"voertuigOverhelling"	"{71CEC7E2-C2EB-4152-A8CB-12EE6FF665B4}"	""	"ProefVoertuigOverhelling"	"{60C69807-2E65-4bf8-B541-708063715CF4}"	"KlLEACVoertuigOverhelling"	"voertuig overhelling"	"Naast het horizontaal verplaatsen van de veiligheidsafbakening bij een impact, kan een voertuig bij impact ook over de afbakening hellen.  De maximale overhelling wordt op basis van foto's en video-opnames van de test bepaald."	""	"voertuig overhelling"	"Naast het horizontaal verplaatsen van de veiligheidsafbakening bij een impact, kan een voertuig bij impact ook over de afbakening hellen.  De maximale overhelling wordt op basis van foto's en video-opnames van de test bepaald."	""	""	""	""	""	""	""	""	"false"	"https://wegenenverkeer-test.data.vlaanderen.be/ns/proefenmeting#"	"ProefVoertuigOverhelling.voertuigOverhelling"	"http://www.w3.org/2002/07/owl#ObjectProperty"	"https://wegenenverkeer-test.data.vlaanderen.be/ns/proefenmeting#ProefVoertuigOverhelling"	"http://www.w3.org/2004/02/skos/core#Concept"	""	"1"	"1"
"attribute"	"OSLO-Proefenmeting"	"verankeringskracht"	"{28A6A77F-2915-42e9-AEA0-099F4CF66DA8}"	""	"ProefVerankeringskracht"	"{DF2347EC-A207-47fb-8B50-235A905E02C5}"	"DtcDocument"	"verankeringskracht"	"Het resultaat van de test om de verankeringskracht in de BV laag."	""	"verankeringskracht"	"Het resultaat van de test om de verankeringskracht in de BV laag."	""	""	""	""	""	""	""	""	"false"	"https://wegenenverkeer-test.data.vlaanderen.be/ns/proefenmeting#"	"ProefVerankeringskracht.verankeringskracht"	"http://www.w3.org/2002/07/owl#ObjectProperty"	"https://wegenenverkeer-test.data.vlaanderen.be/ns/proefenmeting#ProefVerankeringskracht"	"https://wegenenverkeer-test.data.vlaanderen.be/ns/implementatieelement#DtcDocument"	""	"1"	"1"
"attribute"	"OSLO-Proefenmeting"	"basiswaarde"	"{3A626756-A5F0-4d6b-AF67-E8E7D39244A1}"	""	"ProefBoomtoestand"	"{6DBD4713-8F88-4e27-9065-F9273B910BC7}"	"KwantWrdInEuro"	"rapportage onderzoek"	"Het schriftelijk verslag dat na onderzoek of visuele controle wordt opgemaakt."	""	"rapportage onderzoek"	"Het schriftelijk verslag dat na onderzoek of visuele controle wordt opgemaakt."	""	""	""	""	""	""	""	""	"false"	"https://wegenenverkeer-test.data.vlaanderen.be/ns/proefenmeting#"	"ProefBoomtoestand.basiswaarde"	"http://www.w3.org/2002/07/owl#ObjectProperty"	"https://wegenenverkeer-test.data.vlaanderen.be/ns/proefenmeting#ProefBoomtoestand"	"https://wegenenverkeer-test.data.vlaanderen.be/ns/implementatieelement#KwantWrdInEuro"	""	"1"	"1"
"attribute"	"OSLO-Proefenmeting"	"conditiebeoordeling"	"{24F393BD-32BF-4006-ACC0-E4D25B8917C7}"	""	"ProefBoomtoestand"	"{6DBD4713-8F88-4e27-9065-F9273B910BC7}"	"KlBoomConditiebeoordeling"	"conditiebeoordeling"	"De conditie beoordeeld volgens de kronenstructuur van Dr. A. Roloff, gelet op de scheutlengte ontwikkeling en vorming van dood hout."	""	"conditiebeoordeling"	"De conditie beoordeeld volgens de kronenstructuur van Dr. A. Roloff, gelet op de scheutlengte ontwikkeling en vorming van dood hout."	""	""	""	""	""	""	""	""	"false"	"https://wegenenverkeer-test.data.vlaanderen.be/ns/proefenmeting#"	"ProefBoomtoestand.conditiebeoordeling"	"http://www.w3.org/2002/07/owl#ObjectProperty"	"https://wegenenverkeer-test.data.vlaanderen.be/ns/proefenmeting#ProefBoomtoestand"	"http://www.w3.org/2004/02/skos/core#Concept"	""	"1"	"1"
"attribute"	"OSLO-Proefenmeting"	"conditiewaarde"	"{39AB8D58-A3BE-4118-BC53-55641E2D5F97}"	""	"ProefBoomtoestand"	"{6DBD4713-8F88-4e27-9065-F9273B910BC7}"	"KlBoomConditiewaarde"	"conditiewaarde"	"Een coëfficiënt die iets vertelt over de gezondheidstoestand (vitaliteit, conditie) en de levensverwachting van een boom."	""	"conditiewaarde"	"Een coëfficiënt die iets vertelt over de gezondheidstoestand (vitaliteit, conditie) en de levensverwachting van een boom."	""	""	""	""	""	""	""	""	"false"	"https://wegenenverkeer-test.data.vlaanderen.be/ns/proefenmeting#"	"ProefBoomtoestand.conditiewaarde"	"http://www.w3.org/2002/07/owl#ObjectProperty"	"https://wegenenverkeer-test.data.vlaanderen.be/ns/proefenmeting#ProefBoomtoestand"	"http://www.w3.org/2004/02/skos/core#Concept"	""	"1"	"1"
"attribute"	"OSLO-Proefenmeting"	"conflicten"	"{BBF74CC9-1902-4778-9394-62118732BE8C}"	""	"ProefBoomtoestand"	"{6DBD4713-8F88-4e27-9065-F9273B910BC7}"	"KlBoomConflicten"	"conflicten"	"Mogelijke standplaatsconflicten die de condities of structuur van de boom negatief kunnen beïnvloeden."	""	"conflicten"	"Mogelijke standplaatsconflicten die de condities of structuur van de boom negatief kunnen beïnvloeden."	""	""	""	""	""	""	""	""	"false"	"https://wegenenverkeer-test.data.vlaanderen.be/ns/proefenmeting#"	"ProefBoomtoestand.conflicten"	"http://www.w3.org/2002/07/owl#ObjectProperty"	"https://wegenenverkeer-test.data.vlaanderen.be/ns/proefenmeting#ProefBoomtoestand"	"http://www.w3.org/2004/02/skos/core#Concept"	""	"1"	"1"
"attribute"	"OSLO-Proefenmeting"	"gebreken"	"{8AA4171E-B888-46db-B05D-EBCD58EEBB08}"	""	"ProefBoomtoestand"	"{6DBD4713-8F88-4e27-9065-F9273B910BC7}"	"KlBoomGebreken"	"gebreken"	"Een visueel defect aan een boom wat dient gemonitord te worden."	""	"gebreken"	"Een visueel defect aan een boom wat dient gemonitord te worden."	""	""	""	""	""	""	""	""	"false"	"https://wegenenverkeer-test.data.vlaanderen.be/ns/proefenmeting#"	"ProefBoomtoestand.gebreken"	"http://www.w3.org/2002/07/owl#ObjectProperty"	"https://wegenenverkeer-test.data.vlaanderen.be/ns/proefenmeting#ProefBoomtoestand"	"http://www.w3.org/2004/02/skos/core#Concept"	""	"1"	"*"
"attribute"	"OSLO-Proefenmeting"	"krooninspectie"	"{BE24896A-BEB2-429e-A36B-1638722465D8}"	""	"ProefBoomtoestand"	"{6DBD4713-8F88-4e27-9065-F9273B910BC7}"	"DtcDocument"	"krooninspectie"	"Controle van gebrekssymptomen in de kroon."	""	"krooninspectie"	"Controle van gebrekssymptomen in de kroon."	""	""	""	""	""	""	""	""	"false"	"https://wegenenverkeer-test.data.vlaanderen.be/ns/proefenmeting#"	"ProefBoomtoestand.krooninspectie"	"http://www.w3.org/2002/07/owl#ObjectProperty"	"https://wegenenverkeer-test.data.vlaanderen.be/ns/proefenmeting#ProefBoomtoestand"	"https://wegenenverkeer-test.data.vlaanderen.be/ns/implementatieelement#DtcDocument"	""	"1"	"1"
"attribute"	"OSLO-Proefenmeting"	"meerwaarde"	"{68DE7547-B524-480b-923D-77C94341C319}"	""	"ProefBoomtoestand"	"{6DBD4713-8F88-4e27-9065-F9273B910BC7}"	"KlBoomtoestandMeerwaardefactor"	"meerwaarde"	"Mogelijkheid om de boom een waarde toe te kennen op basis van hun uitzonderlijke ecologische of erfgoedwaarde ."	""	"meerwaarde"	"Mogelijkheid om de boom een waarde toe te kennen op basis van hun uitzonderlijke ecologische of erfgoedwaarde ."	""	""	""	""	""	""	""	""	"false"	"https://wegenenverkeer-test.data.vlaanderen.be/ns/proefenmeting#"	"ProefBoomtoestand.meerwaarde"	"http://www.w3.org/2002/07/owl#ObjectProperty"	"https://wegenenverkeer-test.data.vlaanderen.be/ns/proefenmeting#ProefBoomtoestand"	"http://www.w3.org/2004/02/skos/core#Concept"	""	"1"	"1"
"attribute"	"OSLO-Proefenmeting"	"onderhoudstoestand"	"{3D2F9029-1360-4730-A950-2E1DAA89BEAD}"	""	"ProefBoomtoestand"	"{6DBD4713-8F88-4e27-9065-F9273B910BC7}"	"KlBoomOnderhoudstoestand"	"onderhoudstoestand"	"De toestand van een boom die de eventuele snoeiachterstand aangeeft"	""	"onderhoudstoestand"	"De toestand van een boom die de eventuele snoeiachterstand aangeeft"	""	""	""	""	""	""	""	""	"false"	"https://wegenenverkeer-test.data.vlaanderen.be/ns/proefenmeting#"	"ProefBoomtoestand.onderhoudstoestand"	"http://www.w3.org/2002/07/owl#ObjectProperty"	"https://wegenenverkeer-test.data.vlaanderen.be/ns/proefenmeting#ProefBoomtoestand"	"http://www.w3.org/2004/02/skos/core#Concept"	""	"1"	"1"
"attribute"	"OSLO-Proefenmeting"	"onderzoekVisueleBoomcontrole"	"{154657CE-0666-474c-9E53-4DC1F329E965}"	""	"ProefBoomtoestand"	"{6DBD4713-8F88-4e27-9065-F9273B910BC7}"	"DtcDocument"	"Onderzoek visuele boomcontrole"	"Visueel bepalen van de veiligheid en conditie van een boom."	""	"Onderzoek visuele boomcontrole"	"Visueel bepalen van de veiligheid en conditie van een boom."	""	""	""	""	""	""	""	""	"false"	"https://wegenenverkeer-test.data.vlaanderen.be/ns/proefenmeting#"	"ProefBoomtoestand.onderzoekVisueleBoomcontrole"	"http://www.w3.org/2002/07/owl#ObjectProperty"	"https://wegenenverkeer-test.data.vlaanderen.be/ns/proefenmeting#ProefBoomtoestand"	"https://wegenenverkeer-test.data.vlaanderen.be/ns/implementatieelement#DtcDocument"	""	"1"	"1"
"attribute"	"OSLO-Proefenmeting"	"plantwijzewaarde"	"{E4107C69-9C15-4ec6-B4B9-2B6B1316649B}"	""	"ProefBoomtoestand"	"{6DBD4713-8F88-4e27-9065-F9273B910BC7}"	"KlBoomPlantwijzewaarde"	"plantwijzewaarde"	"Een factor die de ontwikkeling van het uiterlijk (de habitus) van een boom relateert met de manier waarop hij geplant wordt."	""	"plantwijzewaarde"	"Een factor die de ontwikkeling van het uiterlijk (de habitus) van een boom relateert met de manier waarop hij geplant wordt."	""	""	""	""	""	""	""	""	"false"	"https://wegenenverkeer-test.data.vlaanderen.be/ns/proefenmeting#"	"ProefBoomtoestand.plantwijzewaarde"	"http://www.w3.org/2002/07/owl#ObjectProperty"	"https://wegenenverkeer-test.data.vlaanderen.be/ns/proefenmeting#ProefBoomtoestand"	"http://www.w3.org/2004/02/skos/core#Concept"	""	"1"	"1"
"attribute"	"OSLO-Proefenmeting"	"rapportageOnderzoek"	"{AF8A0F21-208B-4658-A3BA-7776A477A098}"	""	"ProefBoomtoestand"	"{6DBD4713-8F88-4e27-9065-F9273B910BC7}"	"DtcDocument"	"rapportage onderzoek"	"Het schriftelijk verslag dat na onderzoek of visuele controle wordt opgemaakt."	""	"rapportage onderzoek"	"Het schriftelijk verslag dat na onderzoek of visuele controle wordt opgemaakt."	""	""	""	""	""	""	""	""	"false"	"https://wegenenverkeer-test.data.vlaanderen.be/ns/proefenmeting#"	"ProefBoomtoestand.rapportageOnderzoek"	"http://www.w3.org/2002/07/owl#ObjectProperty"	"https://wegenenverkeer-test.data.vlaanderen.be/ns/proefenmeting#ProefBoomtoestand"	"https://wegenenverkeer-test.data.vlaanderen.be/ns/implementatieelement#DtcDocument"	""	"1"	"1"
