"EA-Type"	"EA-Package"	"EA-Name"	"EA-GUID"	"EA-Parent"	"EA-Domain"	"EA-Domain-GUID"	"EA-Range"	"label"	"definition"	"usage"	"label-nl"	"definition-nl"	"usageNote-nl"	"label-en"	"definition-en"	"usageNote-en"	"equivalent"	"subclass"	"subclass1"	"sameAs"	"external term"	"namespace"	"localname"	"type"	"domain"	"range"	"parent"	"min card"	"max card"
"attribute"	"OSLO-Proefenmeting"	"soortwaarde"	"{CE988FE2-6CE0-446a-909A-9E7087E2E2CA}"	""	"ProefBoomtoestand"	"{6DBD4713-8F88-4e27-9065-F9273B910BC7}"	"Decimal"	"soortwaarde"	"Geeft voor een bepaalde boomsoort of -variëteit de verhouding weer tussen de prijs per cm² van die soort en de eenheidsprijs."	""	"soortwaarde"	"Geeft voor een bepaalde boomsoort of -variëteit de verhouding weer tussen de prijs per cm² van die soort en de eenheidsprijs."	""	""	""	""	""	""	""	""	"false"	"https://wegenenverkeer-test.data.vlaanderen.be/ns/proefenmeting#"	"ProefBoomtoestand.soortwaarde"	"http://www.w3.org/2002/07/owl#ObjectProperty"	"https://wegenenverkeer-test.data.vlaanderen.be/ns/proefenmeting#ProefBoomtoestand"	"http://www.w3.org/2001/XMLSchema#decimal"	""	"1"	"1"
"attribute"	"OSLO-Proefenmeting"	"stamomtrek"	"{66366928-D22A-4f54-8603-1C9EE036DCAF}"	""	"ProefBoomtoestand"	"{6DBD4713-8F88-4e27-9065-F9273B910BC7}"	"KwantWrdInCentimeter"	"stamomtrek"	"Omtrek van de stam van de boom in cm, gemeten op 1 meter boven de grond."	""	"stamomtrek"	"Omtrek van de stam van de boom in cm, gemeten op 1 meter boven de grond."	""	""	""	""	""	""	""	""	"false"	"https://wegenenverkeer-test.data.vlaanderen.be/ns/proefenmeting#"	"ProefBoomtoestand.stamomtrek"	"http://www.w3.org/2002/07/owl#ObjectProperty"	"https://wegenenverkeer-test.data.vlaanderen.be/ns/proefenmeting#ProefBoomtoestand"	"https://wegenenverkeer-test.data.vlaanderen.be/ns/implementatieelement#KwantWrdInCentimeter"	""	"1"	"1"
"attribute"	"OSLO-Proefenmeting"	"standplaatswaarde"	"{A4D29F76-EA59-4626-A7C4-0E7F96C09D46}"	""	"ProefBoomtoestand"	"{6DBD4713-8F88-4e27-9065-F9273B910BC7}"	"KlBoomStandplaatswaarde"	"standplaatswaarde"	"De waarde van de boom afhankelijk van de bebouwingsdichtheid en de aanplantingsmogelijkheden rondom en voor de boom."	""	"standplaatswaarde"	"De waarde van de boom afhankelijk van de bebouwingsdichtheid en de aanplantingsmogelijkheden rondom en voor de boom."	""	""	""	""	""	""	""	""	"false"	"https://wegenenverkeer-test.data.vlaanderen.be/ns/proefenmeting#"	"ProefBoomtoestand.standplaatswaarde"	"http://www.w3.org/2002/07/owl#ObjectProperty"	"https://wegenenverkeer-test.data.vlaanderen.be/ns/proefenmeting#ProefBoomtoestand"	"http://www.w3.org/2004/02/skos/core#Concept"	""	"1"	"1"
"attribute"	"OSLO-Proefenmeting"	"tijdstempelBoomtoestand"	"{6A663786-4A87-4f2e-A851-1D290829B3E4}"	""	"ProefBoomtoestand"	"{6DBD4713-8F88-4e27-9065-F9273B910BC7}"	"DateTime"	"tijdstempel boomtoestand"	"Datum van laatste snoeibeurt."	""	"tijdstempel boomtoestand"	"Datum van laatste snoeibeurt."	""	""	""	""	""	""	""	""	"false"	"https://wegenenverkeer-test.data.vlaanderen.be/ns/proefenmeting#"	"ProefBoomtoestand.tijdstempelBoomtoestand"	"http://www.w3.org/2002/07/owl#DatatypeProperty"	"https://wegenenverkeer-test.data.vlaanderen.be/ns/proefenmeting#ProefBoomtoestand"	"http://www.w3.org/2001/XMLSchema#dateTime"	""	"1"	"1"
"attribute"	"OSLO-Proefenmeting"	"uitgebreidPlaatsonderzoek"	"{F173DE1B-F30C-495c-B367-ECA6C2FDC270}"	""	"ProefBoomtoestand"	"{6DBD4713-8F88-4e27-9065-F9273B910BC7}"	"DtcDocument"	"uitgebreid plaatsonderzoek"	"Grondige beoordeling van de textuur en structuur van de bodem, met als doel een voorstel tot conditieverbeterende maatregelen."	""	"uitgebreid plaatsonderzoek"	"Grondige beoordeling van de textuur en structuur van de bodem, met als doel een voorstel tot conditieverbeterende maatregelen."	""	""	""	""	""	""	""	""	"false"	"https://wegenenverkeer-test.data.vlaanderen.be/ns/proefenmeting#"	"ProefBoomtoestand.uitgebreidPlaatsonderzoek"	"http://www.w3.org/2002/07/owl#ObjectProperty"	"https://wegenenverkeer-test.data.vlaanderen.be/ns/proefenmeting#ProefBoomtoestand"	"https://wegenenverkeer-test.data.vlaanderen.be/ns/implementatieelement#DtcDocument"	""	"1"	"1"
"attribute"	"OSLO-Proefenmeting"	"wortelonderzoek"	"{A68D9478-8B50-4772-9E24-6CEBCC28AF48}"	""	"ProefBoomtoestand"	"{6DBD4713-8F88-4e27-9065-F9273B910BC7}"	"DtcDocument"	"Wortelonderzoek"	"Bepalen van de kwaliteit van de wortels (bv. aantasting door schimmels) of het bepalen van de reikwijdte van de wortels (bv. om een wortelbeschermingszone op te zetten in de buurt van werken van de  bomen)"	""	"Wortelonderzoek"	"Bepalen van de kwaliteit van de wortels (bv. aantasting door schimmels) of het bepalen van de reikwijdte van de wortels (bv. om een wortelbeschermingszone op te zetten in de buurt van werken van de  bomen)"	""	""	""	""	""	""	""	""	"false"	"https://wegenenverkeer-test.data.vlaanderen.be/ns/proefenmeting#"	"ProefBoomtoestand.wortelonderzoek"	"http://www.w3.org/2002/07/owl#ObjectProperty"	"https://wegenenverkeer-test.data.vlaanderen.be/ns/proefenmeting#ProefBoomtoestand"	"https://wegenenverkeer-test.data.vlaanderen.be/ns/implementatieelement#DtcDocument"	""	"1"	"1"
"attribute"	"OSLO-Proefenmeting"	"performantieniveau"	"{6859A226-F388-4041-A947-24BC47F1F5E3}"	""	"ProefPerformantieniveau"	"{64D1ED4B-C798-4c93-8F4C-5C1744923499}"	"KlLEACPerformantieniveau"	"performantieniveau"	"Het niveau waarop de obstakelbeveiliger is getest."	""	"performantieniveau"	"Het niveau waarop de obstakelbeveiliger is getest."	""	""	""	""	""	""	""	""	"false"	"https://wegenenverkeer-test.data.vlaanderen.be/ns/proefenmeting#"	"ProefPerformantieniveau.performantieniveau"	"http://www.w3.org/2002/07/owl#ObjectProperty"	"https://wegenenverkeer-test.data.vlaanderen.be/ns/proefenmeting#ProefPerformantieniveau"	"http://www.w3.org/2004/02/skos/core#Concept"	""	"1"	"1"
"attribute"	"OSLO-Proefenmeting"	"staalvezelgehalte"	"{E66EA86E-0063-48d4-B077-72F5A044F517}"	""	"ProefStaalvezelgehalte"	"{51CD2C90-E704-46b9-98E9-F921622D4200}"	"DtcDocument"	"staalvezelgehalte"	"Het resultaat van de test van het gemeten staalvezelgehalte in de BV laag."	""	"staalvezelgehalte"	"Het resultaat van de test van het gemeten staalvezelgehalte in de BV laag."	""	""	""	""	""	""	""	""	"false"	"https://wegenenverkeer-test.data.vlaanderen.be/ns/proefenmeting#"	"ProefStaalvezelgehalte.staalvezelgehalte"	"http://www.w3.org/2002/07/owl#ObjectProperty"	"https://wegenenverkeer-test.data.vlaanderen.be/ns/proefenmeting#ProefStaalvezelgehalte"	"https://wegenenverkeer-test.data.vlaanderen.be/ns/implementatieelement#DtcDocument"	""	"1"	"1"
"attribute"	"OSLO-Proefenmeting"	"performantieklasse"	"{3FB776F4-3AF0-4c85-BF91-23AB3D3AA3AD}"	""	"ProefPerformantieklasse"	"{628C88A9-E3F2-46fc-89B2-99F2CB0779B3}"	"KlLEACPerformantieklasse"	"performantieklasse"	"De aanduiding hoe (performantie) de beginconstructie is getest."	""	"performantieklasse"	"De aanduiding hoe (performantie) de beginconstructie is getest."	""	""	""	""	""	""	""	""	"false"	"https://wegenenverkeer-test.data.vlaanderen.be/ns/proefenmeting#"	"ProefPerformantieklasse.performantieklasse"	"http://www.w3.org/2002/07/owl#ObjectProperty"	"https://wegenenverkeer-test.data.vlaanderen.be/ns/proefenmeting#ProefPerformantieklasse"	"http://www.w3.org/2004/02/skos/core#Concept"	""	"1"	"1"
"attribute"	"OSLO-Proefenmeting"	"watergehalte"	"{423D9037-497E-42a2-914C-C99D28C76CE7}"	""	"ProefWatergehalte"	"{C14CE256-AE0B-41ab-9C54-E95CA62F93EC}"	"DtcDocument"	"watergehalte"	"Het resultaat van de test van het gemeten watergehalte in de BV laag."	""	"watergehalte"	"Het resultaat van de test van het gemeten watergehalte in de BV laag."	""	""	""	""	""	""	""	""	"false"	"https://wegenenverkeer-test.data.vlaanderen.be/ns/proefenmeting#"	"ProefWatergehalte.watergehalte"	"http://www.w3.org/2002/07/owl#ObjectProperty"	"https://wegenenverkeer-test.data.vlaanderen.be/ns/proefenmeting#ProefWatergehalte"	"https://wegenenverkeer-test.data.vlaanderen.be/ns/implementatieelement#DtcDocument"	""	"1"	"1"
"attribute"	"OSLO-Proefenmeting"	"consistentie"	"{06A9A689-904E-4c84-A19B-C96E605FF187}"	""	"ProefConsistentie"	"{DB49C2D1-6211-4907-B4C1-F5B401068E7E}"	"DtcDocument"	"consistentie"	"Proefresultaten van de consistentie"	""	"consistentie"	"Proefresultaten van de consistentie"	""	""	""	""	""	""	""	""	"false"	"https://wegenenverkeer-test.data.vlaanderen.be/ns/proefenmeting#"	"ProefConsistentie.consistentie"	"http://www.w3.org/2002/07/owl#ObjectProperty"	"https://wegenenverkeer-test.data.vlaanderen.be/ns/proefenmeting#ProefConsistentie"	"https://wegenenverkeer-test.data.vlaanderen.be/ns/implementatieelement#DtcDocument"	""	"1"	"1"
"attribute"	"OSLO-Proefenmeting"	"draagvermogen"	"{3463EF7F-2C4E-4a42-97B2-D915B791BDC4}"	""	"ProefDraagvermogen"	"{6BF4AAD1-1AC0-42b2-83C1-0EE160D2D01C}"	"DtcDocument"	"draagvermogen"	"Proef die het draagvermogen van de laag bepaald."	""	"draagvermogen"	"Proef die het draagvermogen van de laag bepaald."	""	""	""	""	""	""	""	""	"false"	"https://wegenenverkeer-test.data.vlaanderen.be/ns/proefenmeting#"	"ProefDraagvermogen.draagvermogen"	"http://www.w3.org/2002/07/owl#ObjectProperty"	"https://wegenenverkeer-test.data.vlaanderen.be/ns/proefenmeting#ProefDraagvermogen"	"https://wegenenverkeer-test.data.vlaanderen.be/ns/implementatieelement#DtcDocument"	""	"1"	"1"
"attribute"	"OSLO-Proefenmeting"	"korrelverdeling"	"{ECFC29A4-BDC1-45ef-9D2F-26707A93E1D4}"	""	"ProefKorrelverdeling"	"{1682D8C3-21D6-4065-BAF9-B350FCF1FACE}"	"DtcDocument"	"korrelverdeling"	"Het resultaat van de test van de gemeten korrelverdeling in de BV laag."	""	"korrelverdeling"	"Het resultaat van de test van de gemeten korrelverdeling in de BV laag."	""	""	""	""	""	""	""	""	"false"	"https://wegenenverkeer-test.data.vlaanderen.be/ns/proefenmeting#"	"ProefKorrelverdeling.korrelverdeling"	"http://www.w3.org/2002/07/owl#ObjectProperty"	"https://wegenenverkeer-test.data.vlaanderen.be/ns/proefenmeting#ProefKorrelverdeling"	"https://wegenenverkeer-test.data.vlaanderen.be/ns/implementatieelement#DtcDocument"	""	"1"	"1"
"attribute"	"OSLO-Proefenmeting"	"luchtgehalte"	"{BDD4EAD2-F49C-40a2-AA4E-DBB4B93AF342}"	""	"ProefLuchtgehalte"	"{E2E8B24B-1F29-41e3-9685-4D1F1B8270F2}"	"DtcDocument"	"luchtgehalte"	"Proefresultaten van het luchtgehalte"	""	"luchtgehalte"	"Proefresultaten van het luchtgehalte"	""	""	""	""	""	""	""	""	"false"	"https://wegenenverkeer-test.data.vlaanderen.be/ns/proefenmeting#"	"ProefLuchtgehalte.luchtgehalte"	"http://www.w3.org/2002/07/owl#ObjectProperty"	"https://wegenenverkeer-test.data.vlaanderen.be/ns/proefenmeting#ProefLuchtgehalte"	"https://wegenenverkeer-test.data.vlaanderen.be/ns/implementatieelement#DtcDocument"	""	"1"	"1"
"attribute"	"OSLO-Proefenmeting"	"technischVerslagBindmiddeldosering"	"{7E736DA8-7892-4e2a-95D0-BEE4BC778C50}"	""	"ProefBindmiddeldosering"	"{6C95A2C4-C3A7-4e7e-B747-5C7F1F6C144B}"	"DtcDocument"	"technisch verslag bindmiddeldosering"	"Het technisch verslag van een aangewezen bindmiddeldosering."	""	"technisch verslag bindmiddeldosering"	"Het technisch verslag van een aangewezen bindmiddeldosering."	""	""	""	""	""	""	""	""	"false"	"https://wegenenverkeer-test.data.vlaanderen.be/ns/proefenmeting#"	"ProefBindmiddeldosering.technischVerslagBindmiddeldosering"	"http://www.w3.org/2002/07/owl#ObjectProperty"	"https://wegenenverkeer-test.data.vlaanderen.be/ns/proefenmeting#ProefBindmiddeldosering"	"https://wegenenverkeer-test.data.vlaanderen.be/ns/implementatieelement#DtcDocument"	""	"1"	"1"
"attribute"	"OSLO-Proefenmeting"	"pctHolleruimte"	"{F94C698E-33AE-438c-9243-A83CBD2035A4}"	""	"ProefPctHolleruimte"	"{C5B807D9-654B-4609-AB68-99147CB4DB03}"	"DtcDocument"	"pct holleruimte"	"Het resultaat van het aantal percentage holleruimte meting aanwezig in de laag."	""	"pct holleruimte"	"Het resultaat van het aantal percentage holleruimte meting aanwezig in de laag."	""	""	""	""	""	""	""	""	"false"	"https://wegenenverkeer-test.data.vlaanderen.be/ns/proefenmeting#"	"ProefPctHolleruimte.pctHolleruimte"	"http://www.w3.org/2002/07/owl#ObjectProperty"	"https://wegenenverkeer-test.data.vlaanderen.be/ns/proefenmeting#ProefPctHolleruimte"	"https://wegenenverkeer-test.data.vlaanderen.be/ns/implementatieelement#DtcDocument"	""	"1"	"1"
"attribute"	"OSLO-Proefenmeting"	"hechtsterkte"	"{3B4AB068-319F-4dae-BE76-A74A4480F365}"	""	"ProefHechtsterkte"	"{E08A0CD9-D98C-4d5b-8E74-4D5E5D996AF3}"	"DtcDocument"	"hechtsterkte"	"Proef om de hechtsterkte van de laag te bepalen."	""	"hechtsterkte"	"Proef om de hechtsterkte van de laag te bepalen."	""	""	""	""	""	""	""	""	"false"	"https://wegenenverkeer-test.data.vlaanderen.be/ns/proefenmeting#"	"ProefHechtsterkte.hechtsterkte"	"http://www.w3.org/2002/07/owl#ObjectProperty"	"https://wegenenverkeer-test.data.vlaanderen.be/ns/proefenmeting#ProefHechtsterkte"	"https://wegenenverkeer-test.data.vlaanderen.be/ns/implementatieelement#DtcDocument"	""	"1"	"1"
"attribute"	"OSLO-Proefenmeting"	"verderOnderzoekTrekproef"	"{C9443B20-A37B-4341-8EC6-621342240566}"	""	"ProefVerderOnderzoekTrekproef"	"{3B540B1F-B7AF-44a6-B868-027208385988}"	"DtcDocument"	"verder onderzoek trekproef"	"Een trekproef is een niet-destructieve methode om de stabiliteit (gevoeligheid voor windworp) van
bomen te testen door een kunstmatige belasting op de stam te relateren met het kantelen van de
stamvoet."	""	"verder onderzoek trekproef"	"Een trekproef is een niet-destructieve methode om de stabiliteit (gevoeligheid voor windworp) van
bomen te testen door een kunstmatige belasting op de stam te relateren met het kantelen van de
stamvoet."	""	""	""	""	""	""	""	""	"false"	"https://wegenenverkeer-test.data.vlaanderen.be/ns/proefenmeting#"	"ProefVerderOnderzoekTrekproef.verderOnderzoekTrekproef"	"http://www.w3.org/2002/07/owl#ObjectProperty"	"https://wegenenverkeer-test.data.vlaanderen.be/ns/proefenmeting#ProefVerderOnderzoekTrekproef"	"https://wegenenverkeer-test.data.vlaanderen.be/ns/implementatieelement#DtcDocument"	""	"1"	"*"
"attribute"	"OSLO-Proefenmeting"	"inclusiefElektrisch"	"{738E45C4-136D-4b3b-AFB3-0A8CE1D533DD}"	""	"ProefNaderOnderzoekTomograaf"	"{85119C3B-1DD7-41e8-B1F4-C95245FCAB5B}"	"Boolean"	"inclusief elektrisch"	"Aanduiding of naast een geluidsweerstandstomografie ook een elektrische weerstandstomografie gebeurd is."	""	"inclusief elektrisch"	"Aanduiding of naast een geluidsweerstandstomografie ook een elektrische weerstandstomografie gebeurd is."	""	""	""	""	""	""	""	""	"false"	"https://wegenenverkeer-test.data.vlaanderen.be/ns/proefenmeting#"	"ProefNaderOnderzoekTomograaf.inclusiefElektrisch"	"http://www.w3.org/2002/07/owl#DatatypeProperty"	"https://wegenenverkeer-test.data.vlaanderen.be/ns/proefenmeting#ProefNaderOnderzoekTomograaf"	"http://www.w3.org/2001/XMLSchema#boolean"	""	"1"	"1"
"attribute"	"OSLO-Proefenmeting"	"naderOnderzoekTomograaf"	"{7F7D99D8-54E0-46dd-B09E-9E4DC7D53F32}"	""	"ProefNaderOnderzoekTomograaf"	"{85119C3B-1DD7-41e8-B1F4-C95245FCAB5B}"	"DtcDocument"	"nader onderzoek tomograaf"	"Het resultaat van de tomograaf proef."	""	"nader onderzoek tomograaf"	"Het resultaat van de tomograaf proef."	""	""	""	""	""	""	""	""	"false"	"https://wegenenverkeer-test.data.vlaanderen.be/ns/proefenmeting#"	"ProefNaderOnderzoekTomograaf.naderOnderzoekTomograaf"	"http://www.w3.org/2002/07/owl#ObjectProperty"	"https://wegenenverkeer-test.data.vlaanderen.be/ns/proefenmeting#ProefNaderOnderzoekTomograaf"	"https://wegenenverkeer-test.data.vlaanderen.be/ns/implementatieelement#DtcDocument"	""	"1"	"*"
"attribute"	"OSLO-Proefenmeting"	"retrotreflectiecoëfficiënt"	"{9680CD89-8B7C-44f6-A5ED-C39DF91A9381}"	""	"ProefZichtbaarheidBijNacht"	"{641FB5EE-15DF-47e7-8FF7-B23D6B4592BB}"	"Decimal"	"retrotreflectiecoëfficiënt"	"De maat voor het retroreflecterend vermogen van een markering bij nacht."	"uitgedrukt in mcd. m-2.lux-1"	"retrotreflectiecoëfficiënt"	"De maat voor het retroreflecterend vermogen van een markering bij nacht."	"uitgedrukt in mcd. m-2.lux-1"	""	""	""	""	""	""	""	"false"	"https://wegenenverkeer-test.data.vlaanderen.be/ns/proefenmeting#"	"ProefZichtbaarheidBijNacht.retrotreflectiecoëfficiënt"	"http://www.w3.org/2002/07/owl#ObjectProperty"	"https://wegenenverkeer-test.data.vlaanderen.be/ns/proefenmeting#ProefZichtbaarheidBijNacht"	"http://www.w3.org/2001/XMLSchema#decimal"	""	"1"	"1"
"attribute"	"OSLO-Proefenmeting"	"retroreflectie"	"{90D0D375-6824-423f-83F1-FD903B992AEF}"	""	"ProefRetroreflectie"	"{491B1F72-3340-4304-AEA0-66CFCF85C42F}"	"DtcDocument"	"retroreflectie"	"Proef om de retroreflectie van een verkeersbord te bepalen."	""	"retroreflectie"	"Proef om de retroreflectie van een verkeersbord te bepalen."	""	""	""	""	""	""	""	""	"false"	"https://wegenenverkeer-test.data.vlaanderen.be/ns/proefenmeting#"	"ProefRetroreflectie.retroreflectie"	"http://www.w3.org/2002/07/owl#ObjectProperty"	"https://wegenenverkeer-test.data.vlaanderen.be/ns/proefenmeting#ProefRetroreflectie"	"https://wegenenverkeer-test.data.vlaanderen.be/ns/implementatieelement#DtcDocument"	""	"1"	"1"
"attribute"	"OSLO-Proefenmeting"	"geluidsabsorptieReflectie"	"{312E5A65-3AD0-4bee-A180-194BFB2464DD}"	""	"DtcGeluidstestRapport"	"{CD04400F-41E2-4c89-ADD9-31FEE3EAB3D1}"	"Integer"	"geluidsabsorptie reflectie"	"De absorptie- of reflectiewaarde van het geluidsscherm als geheel getal."	""	"geluidsabsorptie reflectie"	"De absorptie- of reflectiewaarde van het geluidsscherm als geheel getal."	""	""	""	""	""	""	""	""	"false"	"https://wegenenverkeer-test.data.vlaanderen.be/ns/proefenmeting#"	"DtcGeluidstestRapport.geluidsabsorptieReflectie"	"http://www.w3.org/2002/07/owl#DatatypeProperty"	"https://wegenenverkeer-test.data.vlaanderen.be/ns/proefenmeting#DtcGeluidstestRapport"	"http://www.w3.org/2001/XMLSchema#integer"	""	"1"	"1"
"attribute"	"OSLO-Proefenmeting"	"gemetenWaarde"	"{57D83729-0755-40f1-A1F4-91D0219AF28B}"	""	"DtcGeluidstestRapport"	"{CD04400F-41E2-4c89-ADD9-31FEE3EAB3D1}"	"Integer"	"gemeten waarde"	"De sterkte van het geluid in dB."	""	"gemeten waarde"	"De sterkte van het geluid in dB."	""	""	""	""	""	""	""	""	"false"	"https://wegenenverkeer-test.data.vlaanderen.be/ns/proefenmeting#"	"DtcGeluidstestRapport.gemetenWaarde"	"http://www.w3.org/2002/07/owl#DatatypeProperty"	"https://wegenenverkeer-test.data.vlaanderen.be/ns/proefenmeting#DtcGeluidstestRapport"	"http://www.w3.org/2001/XMLSchema#integer"	""	"1"	"1"
"attribute"	"OSLO-Proefenmeting"	"locatieInSitulabo"	"{02CF4D3E-B67F-410f-A535-96BB972FD57B}"	""	"DtcGeluidstestRapport"	"{CD04400F-41E2-4c89-ADD9-31FEE3EAB3D1}"	"KlGCMeetMethode"	"locatie in situlabo"	"Locatie waar de geluidstest is uitgevoerd (terrein of labo)."	""	"locatie in situlabo"	"Locatie waar de geluidstest is uitgevoerd (terrein of labo)."	""	""	""	""	""	""	""	""	"false"	"https://wegenenverkeer-test.data.vlaanderen.be/ns/proefenmeting#"	"DtcGeluidstestRapport.locatieInSitulabo"	"http://www.w3.org/2002/07/owl#ObjectProperty"	"https://wegenenverkeer-test.data.vlaanderen.be/ns/proefenmeting#DtcGeluidstestRapport"	"http://www.w3.org/2004/02/skos/core#Concept"	""	"1"	"1"
"attribute"	"OSLO-Proefenmeting"	"luchtgeluidsisolatie"	"{958B96C6-5C16-401e-9ED1-3B5B9F2D38A5}"	""	"DtcGeluidstestRapport"	"{CD04400F-41E2-4c89-ADD9-31FEE3EAB3D1}"	"Integer"	"luchtgeluidsisolatie"	"De gemeten waarde van het  luchtgeluidsisiolatie van het geluidsscherm."	""	"luchtgeluidsisolatie"	"De gemeten waarde van het  luchtgeluidsisiolatie van het geluidsscherm."	""	""	""	""	""	""	""	""	"false"	"https://wegenenverkeer-test.data.vlaanderen.be/ns/proefenmeting#"	"DtcGeluidstestRapport.luchtgeluidsisolatie"	"http://www.w3.org/2002/07/owl#DatatypeProperty"	"https://wegenenverkeer-test.data.vlaanderen.be/ns/proefenmeting#DtcGeluidstestRapport"	"http://www.w3.org/2001/XMLSchema#integer"	""	"1"	"1"
"attribute"	"OSLO-Proefenmeting"	"norm"	"{D2E5513E-39ED-4fa9-8E34-C13337FFE5EF}"	""	"DtcGeluidstestRapport"	"{CD04400F-41E2-4c89-ADD9-31FEE3EAB3D1}"	"KlLEGCNorm"	"norm"	"De proef volgens de beschreven standaard."	""	"norm"	"De proef volgens de beschreven standaard."	""	""	""	""	""	""	""	""	"false"	"https://wegenenverkeer-test.data.vlaanderen.be/ns/proefenmeting#"	"DtcGeluidstestRapport.norm"	"http://www.w3.org/2002/07/owl#ObjectProperty"	"https://wegenenverkeer-test.data.vlaanderen.be/ns/proefenmeting#DtcGeluidstestRapport"	"http://www.w3.org/2004/02/skos/core#Concept"	""	"1"	"1"
"attribute"	"OSLO-Proefenmeting"	"testrapport"	"{0658CAAE-85E8-4559-9D17-EEA438C70F9F}"	""	"DtcGeluidstestRapport"	"{CD04400F-41E2-4c89-ADD9-31FEE3EAB3D1}"	"DtcDocument"	"testrapport"	"Documentbijlage met de resultaten van de test"	"Bestanden van het type xlsx of pdf."	"testrapport"	"Documentbijlage met de resultaten van de test"	"Bestanden van het type xlsx of pdf."	""	""	""	""	""	""	""	"false"	"https://wegenenverkeer-test.data.vlaanderen.be/ns/proefenmeting#"	"DtcGeluidstestRapport.testrapport"	"http://www.w3.org/2002/07/owl#ObjectProperty"	"https://wegenenverkeer-test.data.vlaanderen.be/ns/proefenmeting#DtcGeluidstestRapport"	"https://wegenenverkeer-test.data.vlaanderen.be/ns/implementatieelement#DtcDocument"	""	"1"	"*"
"attribute"	"OSLO-Proefenmeting"	"type"	"{4F389975-6BE6-4ae1-8539-362B6FC2EA6F}"	""	"DtcGeluidstestRapport"	"{CD04400F-41E2-4c89-ADD9-31FEE3EAB3D1}"	"KlLEGCTestType"	"type"	"Het type van de test."	""	"type"	"Het type van de test."	""	""	""	""	""	""	""	""	"false"	"https://wegenenverkeer-test.data.vlaanderen.be/ns/proefenmeting#"	"DtcGeluidstestRapport.type"	"http://www.w3.org/2002/07/owl#ObjectProperty"	"https://wegenenverkeer-test.data.vlaanderen.be/ns/proefenmeting#DtcGeluidstestRapport"	"http://www.w3.org/2004/02/skos/core#Concept"	""	"1"	"1"
"attribute"	"OSLO-Proefenmeting"	"geluidstestrapport"	"{E2BBA2EC-5A04-4bbe-9316-8ACE99283619}"	""	"ProefGeluidstest"	"{F1BE0824-2DE0-4592-88C1-172E6A45D55A}"	"DtcGeluidstestRapport"	"geluidstestrapport"	"Het resultaat geluidstest."	""	"geluidstestrapport"	"Het resultaat geluidstest."	""	""	""	""	""	""	""	""	"false"	"https://wegenenverkeer-test.data.vlaanderen.be/ns/proefenmeting#"	"ProefGeluidstest.geluidstestrapport"	"http://www.w3.org/2002/07/owl#ObjectProperty"	"https://wegenenverkeer-test.data.vlaanderen.be/ns/proefenmeting#ProefGeluidstest"	"https://wegenenverkeer-test.data.vlaanderen.be/ns/proefenmeting#DtcGeluidstestRapport"	""	"1"	"1"
"attribute"	"OSLO-Proefenmeting"	"textuurdiepte"	"{39089192-F0E6-4a5e-B11B-BF6A2655212E}"	""	"ProefTextuurdiepte"	"{CF057988-EDF4-4d2b-84BB-44089BF1A161}"	"DtcDocument"	"textuurdiepte"	"Proefresultaten van de textuurdiepte van de toplaag."	""	"textuurdiepte"	"Proefresultaten van de textuurdiepte van de toplaag."	""	""	""	""	""	""	""	""	"false"	"https://wegenenverkeer-test.data.vlaanderen.be/ns/proefenmeting#"	"ProefTextuurdiepte.textuurdiepte"	"http://www.w3.org/2002/07/owl#ObjectProperty"	"https://wegenenverkeer-test.data.vlaanderen.be/ns/proefenmeting#ProefTextuurdiepte"	"https://wegenenverkeer-test.data.vlaanderen.be/ns/implementatieelement#DtcDocument"	""	"1"	"1"
"attribute"	"OSLO-Proefenmeting"	"retrotreflectiecoëfficiënt"	"{F31C3BBE-9E96-482c-931C-C23E9F6154CA}"	""	"ProefZichtbaarheidBijNachtNatWegdek"	"{62ABAB02-96E5-4c6a-A5E7-53E355D881E4}"	"Decimal"	"retrotreflectiecoëfficiënt"	"De maat voor het retroreflecterend vermogen van een markering bij nacht bij nat wegdek"	"uitgedrukt in mcd. m-2.lux-1"	"retrotreflectiecoëfficiënt"	"De maat voor het retroreflecterend vermogen van een markering bij nacht bij nat wegdek"	"uitgedrukt in mcd. m-2.lux-1"	""	""	""	""	""	""	""	"false"	"https://wegenenverkeer-test.data.vlaanderen.be/ns/proefenmeting#"	"ProefZichtbaarheidBijNachtNatWegdek.retrotreflectiecoëfficiënt"	"http://www.w3.org/2002/07/owl#ObjectProperty"	"https://wegenenverkeer-test.data.vlaanderen.be/ns/proefenmeting#ProefZichtbaarheidBijNachtNatWegdek"	"http://www.w3.org/2001/XMLSchema#decimal"	""	"1"	"1"
"attribute"	"OSLO-Proefenmeting"	"kerendVermogen"	"{05213903-F27D-4398-A6E0-04E171A68F01}"	""	"ProefKerendVermogen"	"{D1C930BD-0693-482f-963A-006321D2D0E3}"	"KlLEACKerendVermogen"	"kerend vermogen"	"Het vermogen van een voertuigkering om een doorbraak bij een bepaald type crash te voorkomen."	""	"kerend vermogen"	"Het vermogen van een voertuigkering om een doorbraak bij een bepaald type crash te voorkomen."	""	""	""	""	""	""	""	""	"false"	"https://wegenenverkeer-test.data.vlaanderen.be/ns/proefenmeting#"	"ProefKerendVermogen.kerendVermogen"	"http://www.w3.org/2002/07/owl#ObjectProperty"	"https://wegenenverkeer-test.data.vlaanderen.be/ns/proefenmeting#ProefKerendVermogen"	"http://www.w3.org/2004/02/skos/core#Concept"	""	"1"	"1"
"attribute"	"OSLO-Proefenmeting"	"effectiefBindmiddelgehalte"	"{8B60A983-73FF-4515-9DA6-5762CDA6ADE2}"	""	"ProefEffectiefBindmiddelgehalte"	"{0D0F2C17-5E6E-43d8-97C1-37A87C359183}"	"DtcDocument"	"effectief bindmiddelgehalte"	"Het resultaat van de test van het gemeten effectief bindmiddelgehalte in de BV laag."	""	"effectief bindmiddelgehalte"	"Het resultaat van de test van het gemeten effectief bindmiddelgehalte in de BV laag."	""	""	""	""	""	""	""	""	"false"	"https://wegenenverkeer-test.data.vlaanderen.be/ns/proefenmeting#"	"ProefEffectiefBindmiddelgehalte.effectiefBindmiddelgehalte"	"http://www.w3.org/2002/07/owl#ObjectProperty"	"https://wegenenverkeer-test.data.vlaanderen.be/ns/proefenmeting#ProefEffectiefBindmiddelgehalte"	"https://wegenenverkeer-test.data.vlaanderen.be/ns/implementatieelement#DtcDocument"	""	"1"	"1"
