"EA-Type"	"EA-Package"	"EA-Name"	"EA-GUID"	"EA-Parent"	"EA-Domain"	"EA-Domain-GUID"	"EA-Range"	"label"	"definition"	"usage"	"ap-label-nl"	"ap-definition-nl"	"ap-usageNote-nl"	"ap-codelist"	"external term"	"namespace"	"localname"	"type"	"domain"	"range"	"parent"	"min card"	"max card"
"Package"	""	"OSLO-Grondwerken"	"{C0EB4F72-B0D0-4679-B832-38D6CDC3879D}"	""	""	""	""	""	""	""	""	""	""	""	""	"http://"	"fixme.com"	"http://www.w3.org/2002/07/owl#Ontology"	""	""	""	""	""
"DATATYPE"	"OSLO-Onderdeel"	"DtcGrondbijmenging"	"{EEECED90-0B07-49b8-BE07-D836559D4372}"	""	""	""	""	"Grondbijmenging"	"Complex datatype om extra informatie van de bijmenging van grond te capteren."	""	"Grondbijmenging"	"Complex datatype om extra informatie van de bijmenging van grond te capteren."	""	""	"true"	"https://wegenenverkeer-test.data.vlaanderen.be/ns/Onderdeel#"	"DtcGrondbijmenging"	"http://www.w3.org/2000/01/rdf-schema#Class"	""	""	""	""	""
"CLASS"	"OSLO-Onderdeel"	"PiezometrischeBuis"	"{5470D1BD-1043-47c1-B0E3-3F8CA6D94FEF}"	""	""	""	""	"Piezometrische buis"	"Een al dan niet permanente buis om waterstanden bij grondverlaging te meten."	""	"Piezometrische buis"	"Een al dan niet permanente buis om waterstanden bij grondverlaging te meten."	""	""	"true"	"https://wegenenverkeer-test.data.vlaanderen.be/ns/Onderdeel#"	"PiezometrischeBuis"	"http://www.w3.org/2000/01/rdf-schema#Class"	""	""	""	""	""
"CLASS"	"OSLO-Abstracten"	"LaagDikte"	"{B866DD1D-FBBC-4ea7-BDEC-C9C679CB17AA}"	""	""	""	""	"Laagdikte"	"Abstracte waarmee aan een laag het atribuut dikte wordt toegekend."	""	"Laagdikte"	"Abstracte waarmee aan een laag het atribuut dikte wordt toegekend."	""	""	"true"	"https://wegenenverkeer-test.data.vlaanderen.be/ns/abstracten#"	"LaagDikte"	"http://www.w3.org/2000/01/rdf-schema#Class"	""	""	""	""	""
"DATATYPE"	"OSLO-Onderdeel"	"DtcGrondafdekking"	"{9AD39FF0-9248-4b30-8BD6-A241B9961693}"	""	""	""	""	"Grondafdekking"	"Complex datatype om extra informatie van de afdekking van grond te capteren."	""	"Grondafdekking"	"Complex datatype om extra informatie van de afdekking van grond te capteren."	""	""	"true"	"https://wegenenverkeer-test.data.vlaanderen.be/ns/Onderdeel#"	"DtcGrondafdekking"	"http://www.w3.org/2000/01/rdf-schema#Class"	""	""	""	""	""
"DATATYPE"	"OSLO-Onderdeel"	"DtcGrondAfgravinguitgraving"	"{A8BD9015-EAF5-4147-8F17-9AAD0E2C2C5D}"	""	""	""	""	"Grondafgraving en gronduitgraving"	"Complex datatype voor de afgraving of uitgraving van grond."	""	"Grondafgraving en gronduitgraving"	"Complex datatype voor de afgraving of uitgraving van grond."	""	""	"true"	"https://wegenenverkeer-test.data.vlaanderen.be/ns/Onderdeel#"	"DtcGrondAfgravinguitgraving"	"http://www.w3.org/2000/01/rdf-schema#Class"	""	""	""	""	""
"DATATYPE"	"OSLO-Onderdeel"	"DtcGrondophoging"	"{0CE5453B-23F5-49bf-9BF9-CA3D03034AD4}"	""	""	""	""	"Grondophoging"	"Complex datatype om extra informatie van ophoging van grond te capteren."	""	"Grondophoging"	"Complex datatype om extra informatie van ophoging van grond te capteren."	""	""	"true"	"https://wegenenverkeer-test.data.vlaanderen.be/ns/Onderdeel#"	"DtcGrondophoging"	"http://www.w3.org/2000/01/rdf-schema#Class"	""	""	""	""	""
"DATATYPE"	"OSLO-Onderdeel"	"DtuSoortGrondwerk"	"{24F22FD0-5713-4f31-876A-C5040F923B0E}"	""	""	""	""	"Soort grondwerk"	"Union datatype voor het soort werk waar de grond van afkomstig is of voor dient."	"Gebruik enkel 1 attribuut van dit Union datatype."	"Soort grondwerk"	"Union datatype voor het soort werk waar de grond van afkomstig is of voor dient."	""	""	"true"	"https://wegenenverkeer-test.data.vlaanderen.be/ns/Onderdeel#"	"DtuSoortGrondwerk"	"http://www.w3.org/2000/01/rdf-schema#Class"	""	""	""	""	""
"DATATYPE"	"OSLO-Onderdeel"	"DtcGrondsoort"	"{02A3E994-84B7-4455-A23D-D3D589E21DDF}"	""	""	""	""	"Grondsoort"	"Complex datatype om het soort grond te bepalen."	""	"Grondsoort"	"Complex datatype om het soort grond te bepalen."	""	""	"true"	"https://wegenenverkeer-test.data.vlaanderen.be/ns/Onderdeel#"	"DtcGrondsoort"	"http://www.w3.org/2000/01/rdf-schema#Class"	""	""	""	""	""
"CLASS"	"OSLO-Onderdeel"	"Grond"	"{DB77B560-3D97-4890-BE0B-D006E3593781}"	"LaagDikte, Laag"	""	""	""	"Grond"	"Lithologisch hoofd- en nevenbestanddeel (als code) van de laag zoals gebruikt bij Databank Ondergrond Vlaanderen (gecodeerde lithologie en geotechnische codering)."	""	"Grond"	"Lithologisch hoofd- en nevenbestanddeel (als code) van de laag zoals gebruikt bij Databank Ondergrond Vlaanderen (gecodeerde lithologie en geotechnische codering)."	""	""	"true"	"https://wegenenverkeer-test.data.vlaanderen.be/ns/Onderdeel#"	"Grond"	"http://www.w3.org/2000/01/rdf-schema#Class"	""	""	"https://wegenenverkeer-test.data.vlaanderen.be/ns/abstracten#LaagDikte, https://wegenenverkeer-test.data.vlaanderen.be/ns/abstracten#Laag"	""	""
"CLASS"	"OSLO-Abstracten"	"Laag"	"{58E7E3BD-A9A9-4e04-957D-942F897D7ED8}"	""	""	""	""	"Laag"	"Abstracte voor de gemeenschappelijke eigenschappen van de onderliggende verhardings- en funderings-onderdelen."	""	"Laag"	"Abstracte voor de gemeenschappelijke eigenschappen van de onderliggende verhardings- en funderings-onderdelen."	""	""	"true"	"https://wegenenverkeer-test.data.vlaanderen.be/ns/abstracten#"	"Laag"	"http://www.w3.org/2000/01/rdf-schema#Class"	""	""	""	""	""
"CLASS"	"OSLO-Onderdeel"	"Bevestigd"	"{851E2395-627F-4352-8324-2E91CD6B80DE}"	""	""	""	""	"Bevestigd"	"Deze relatie geeft aan dat 2 onderdelen direct fysiek op elkaar bevestigd zijn. Dit kan zowel aan de buitenkant als aan de binnenkant zijn zoals bv. een camera aan een paal of een laagspanningsbord in een kast. Deze relatie heeft geen richting."	""	"Bevestigd"	"Deze relatie geeft aan dat 2 onderdelen direct fysiek op elkaar bevestigd zijn. Dit kan zowel aan de buitenkant als aan de binnenkant zijn zoals bv. een camera aan een paal of een laagspanningsbord in een kast. Deze relatie heeft geen richting."	""	""	"true"	"https://wegenenverkeer-test.data.vlaanderen.be/ns/Onderdeel#"	"Bevestigd"	"http://www.w3.org/2000/01/rdf-schema#Class"	""	""	""	""	""
"CLASS"	"OSLO-Onderdeel"	"LigtOp"	"{DD431B57-FDB0-484b-BF00-1921E46850DA}"	""	""	""	""	"Ligt op"	"Deze relatie geeft aan dat 2 onderdelen direct fysiek op elkaar liggen. Deze relatie heeft geen richting."	""	"Ligt op"	"Deze relatie geeft aan dat 2 onderdelen direct fysiek op elkaar liggen. Deze relatie heeft geen richting."	""	""	"true"	"https://wegenenverkeer-test.data.vlaanderen.be/ns/Onderdeel#"	"LigtOp"	"http://www.w3.org/2000/01/rdf-schema#Class"	""	""	""	""	""
"ENUMERATION"	"OSLO-Implementatieelement"	"KlAlgMimeType"	"{9BCD2B4C-9CAB-4988-A052-6C4B006D450A}"	""	""	""	""	"AlgMimeType"	"De mime types van bestanden (AWVDocument) beperkt tot mime types voor toegelaten bestandstypen."	""	"AlgMimeType"	"De mime types van bestanden (AWVDocument) beperkt tot mime types voor toegelaten bestandstypen."	""	"https://wegenenverkeer.data.vlaanderen.be/id/conceptscheme/AlgMimeType"	"true"	"http://www.w3.org/2004/02/skos/core#"	"Concept"	"http://www.w3.org/2000/01/rdf-schema#Class"	""	""	""	""	""
"ENUMERATION"	"OSLO-Onderdeel"	"KlGrondtoevoegsel"	"{5A1E0D01-3EE6-451f-9101-EE2252F682C9}"	""	""	""	""	"Grondtoevoegsel"	"De eventuele toevoegsels bij de grond."	""	"Grondtoevoegsel"	"De eventuele toevoegsels bij de grond."	""	"https://wegenenverkeer.data.vlaanderen.be/id/conceptscheme/Grondtoevoegsel"	"true"	"http://www.w3.org/2004/02/skos/core#"	"Concept"	"http://www.w3.org/2000/01/rdf-schema#Class"	""	""	""	""	""
"ENUMERATION"	"OSLO-Onderdeel"	"KlGrondbestemming"	"{602D1C38-CECC-4c5e-8997-436628038F84}"	""	""	""	""	"Grondbestemming"	"De bestemmingen of doelen van de grond."	""	"Grondbestemming"	"De bestemmingen of doelen van de grond."	""	"https://wegenenverkeer.data.vlaanderen.be/id/conceptscheme/Grondbestemming"	"true"	"http://www.w3.org/2004/02/skos/core#"	"Concept"	"http://www.w3.org/2000/01/rdf-schema#Class"	""	""	""	""	""
"ENUMERATION"	"OSLO-Onderdeel"	"KlGrondHoofdnaamCode"	"{62086B01-B7EF-461c-9F25-2AA52CAAB03F}"	""	""	""	""	"Grond hoofdnaamcode"	"De hoofdnaamcode van de grond.

Namespace :
http://interpretatie.kern.schemas.dov.vlaanderen.be/GecodeerdHoofdnaamCodesEnumType"	""	"Grond hoofdnaamcode"	"De hoofdnaamcode van de grond.

Namespace :
http://interpretatie.kern.schemas.dov.vlaanderen.be/GecodeerdHoofdnaamCodesEnumType"	""	"https://wegenenverkeer.data.vlaanderen.be/id/conceptscheme/GrondHoofdnaamCode"	"true"	"http://www.w3.org/2004/02/skos/core#"	"Concept"	"http://www.w3.org/2000/01/rdf-schema#Class"	""	""	""	""	""
"ENUMERATION"	"OSLO-Onderdeel"	"KlGrondBijmengingHoeveelheidCode"	"{8847F1B4-9C0F-478e-BA01-36F554D8868A}"	""	""	""	""	"Grondbijmenging hoeveelheidscode"	"De mogelijke waarden voor de hoeveelheid bijmenging (X staat voor de lithologie van de bijmenging)"	""	"Grondbijmenging hoeveelheidscode"	"De mogelijke waarden voor de hoeveelheid bijmenging (X staat voor de lithologie van de bijmenging)"	""	"https://wegenenverkeer.data.vlaanderen.be/id/conceptscheme/GrondBijmengingHoeveelheidCode"	"true"	"http://www.w3.org/2004/02/skos/core#"	"Concept"	"http://www.w3.org/2000/01/rdf-schema#Class"	""	""	""	""	""
"ENUMERATION"	"OSLO-Onderdeel"	"KlGrondwerksoorten"	"{A4F7E70F-5415-4d71-BBCA-5599760EA27C}"	""	""	""	""	"Grondwerksoorten"	"Soorten van grondwerk."	""	"Grondwerksoorten"	"Soorten van grondwerk."	""	"https://wegenenverkeer.data.vlaanderen.be/id/conceptscheme/Grondwerksoorten"	"true"	"http://www.w3.org/2004/02/skos/core#"	"Concept"	"http://www.w3.org/2000/01/rdf-schema#Class"	""	""	""	""	""
"ENUMERATION"	"OSLO-Onderdeel"	"KlLaagRol"	"{6E941914-412F-4b63-87DF-9378498D64E8}"	""	""	""	""	"Laag rol"	"De mogelijke rollen van de laag."	""	"Laag rol"	"De mogelijke rollen van de laag."	""	"https://wegenenverkeer.data.vlaanderen.be/id/conceptscheme/LaagRol"	"true"	"http://www.w3.org/2004/02/skos/core#"	"Concept"	"http://www.w3.org/2000/01/rdf-schema#Class"	""	""	""	""	""
"attribute"	"OSLO-Onderdeel"	"bijmengingshoofdnaamcode"	"{D36CBA79-0199-459b-9D6A-2DEF855A8774}"	""	"DtcGrondbijmenging"	"{EEECED90-0B07-49b8-BE07-D836559D4372}"	"KlGrondHoofdnaamCode"	"bijmengingshoofdnaamcode"	"Lithologisch nevenbestanddeel (als code) van de laag zoals gebruikt bij Databank Ondergrond Vlaanderen (gecodeerde lithologie en geotechnische codering)."	"https://www.dov.vlaanderen.be/xdov/schema/latest/xsd/kern/interpretatie/GecodeerdeLithologieDataCodes.xsd  (GecodeerdHoofdnaamCodesEnumType)"	"bijmengingshoofdnaamcode"	"Lithologisch nevenbestanddeel (als code) van de laag zoals gebruikt bij Databank Ondergrond Vlaanderen (gecodeerde lithologie en geotechnische codering)."	""	""	"true"	"https://wegenenverkeer-test.data.vlaanderen.be/ns/Onderdeel#"	"DtcGrondbijmenging.bijmengingshoofdnaamcode"	"http://www.w3.org/2002/07/owl#ObjectProperty"	"https://wegenenverkeer-test.data.vlaanderen.be/ns/Onderdeel#DtcGrondbijmenging"	"http://www.w3.org/2004/02/skos/core#Concept"	""	"1"	"1"
"attribute"	"OSLO-Onderdeel"	"hoeveelheidscode"	"{D3F7E46B-0C8A-4000-A5FF-EDB883DFDAD4}"	""	"DtcGrondbijmenging"	"{EEECED90-0B07-49b8-BE07-D836559D4372}"	"KlGrondBijmengingHoeveelheidCode"	"hoeveelheidscode"	"Aanduiding (als code) van de hoeveelheid bijmenging."	" https://www.dov.vlaanderen.be/xdov/schema/latest/xsd/kern/interpretatie/GecodeerdeLithologieDataCodes.xsd  (GecodeerdBijmengingHoeveelheidEnumType)"	"hoeveelheidscode"	"Aanduiding (als code) van de hoeveelheid bijmenging."	""	""	"true"	"https://wegenenverkeer-test.data.vlaanderen.be/ns/Onderdeel#"	"DtcGrondbijmenging.hoeveelheidscode"	"http://www.w3.org/2002/07/owl#ObjectProperty"	"https://wegenenverkeer-test.data.vlaanderen.be/ns/Onderdeel#DtcGrondbijmenging"	"http://www.w3.org/2004/02/skos/core#Concept"	""	"1"	"1"
"attribute"	"OSLO-Onderdeel"	"isPlaatselijk"	"{3D0CF7CB-8C3B-4dcf-ABA8-F01A1AD8EDDC}"	""	"DtcGrondbijmenging"	"{EEECED90-0B07-49b8-BE07-D836559D4372}"	"Boolean"	"is grondmenging plaatselijk"	"Grondbijmenging plaatselijk of niet-plaatselijk"	""	"is grondmenging plaatselijk"	"Grondbijmenging plaatselijk of niet-plaatselijk"	""	""	"true"	"https://wegenenverkeer-test.data.vlaanderen.be/ns/Onderdeel#"	"DtcGrondbijmenging.isPlaatselijk"	"http://www.w3.org/2002/07/owl#DatatypeProperty"	"https://wegenenverkeer-test.data.vlaanderen.be/ns/Onderdeel#DtcGrondbijmenging"	"http://www.w3.org/2001/XMLSchema#boolean"	""	"1"	"1"
"attribute"	"OSLO-Onderdeel"	"diepte"	"{81868F47-6ED6-450e-BCEB-1DE650809D63}"	""	"PiezometrischeBuis"	"{5470D1BD-1043-47c1-B0E3-3F8CA6D94FEF}"	"KwantWrdInMeter"	"diepte"	"De diepte van de piezometrische buis in meter."	""	"diepte"	"De diepte van de piezometrische buis in meter."	""	""	"true"	"https://wegenenverkeer-test.data.vlaanderen.be/ns/Onderdeel#"	"PiezometrischeBuis.diepte"	"http://www.w3.org/2002/07/owl#ObjectProperty"	"https://wegenenverkeer-test.data.vlaanderen.be/ns/Onderdeel#PiezometrischeBuis"	"https://wegenenverkeer-test.data.vlaanderen.be/ns/implementatieelement#KwantWrdInMeter"	""	"1"	"1"
"attribute"	"OSLO-Abstracten"	"dikte"	"{E00FF396-5431-422f-8134-A8C0513B70A8}"	""	"LaagDikte"	"{B866DD1D-FBBC-4ea7-BDEC-C9C679CB17AA}"	"KwantWrdInCentimeter"	"dikte"	"De gemiddelde dikte van een laag in centimeter."	""	"dikte"	"De gemiddelde dikte van een laag in centimeter."	""	""	"true"	"https://wegenenverkeer-test.data.vlaanderen.be/ns/abstracten#"	"LaagDikte.dikte"	"http://www.w3.org/2002/07/owl#ObjectProperty"	"https://wegenenverkeer-test.data.vlaanderen.be/ns/abstracten#LaagDikte"	"https://wegenenverkeer-test.data.vlaanderen.be/ns/implementatieelement#KwantWrdInCentimeter"	""	"1"	"1"
"attribute"	"OSLO-Onderdeel"	"herkomst"	"{1D96F490-D37D-4ee7-94A8-DCF93C9D3AAF}"	""	"DtcGrondafdekking"	"{9AD39FF0-9248-4b30-8BD6-A241B9961693}"	"KlGrondbestemming"	"herkomst"	"Bepaalt de origine van de grond."	""	"herkomst"	"Bepaalt de origine van de grond."	""	""	"true"	"https://wegenenverkeer-test.data.vlaanderen.be/ns/Onderdeel#"	"DtcGrondafdekking.herkomst"	"http://www.w3.org/2002/07/owl#ObjectProperty"	"https://wegenenverkeer-test.data.vlaanderen.be/ns/Onderdeel#DtcGrondafdekking"	"http://www.w3.org/2004/02/skos/core#Concept"	""	"1"	"1"
"attribute"	"OSLO-Onderdeel"	"soortGrondwerk"	"{7FBE99F8-DA86-4d89-A17E-9EBA8CC3215F}"	""	"DtcGrondafdekking"	"{9AD39FF0-9248-4b30-8BD6-A241B9961693}"	"KlGrondwerksoorten"	"soort grondwerk"	"Het soort werk waar de grond van afkomstig is of voor dient."	""	"soort grondwerk"	"Het soort werk waar de grond van afkomstig is of voor dient."	""	""	"true"	"https://wegenenverkeer-test.data.vlaanderen.be/ns/Onderdeel#"	"DtcGrondafdekking.soortGrondwerk"	"http://www.w3.org/2002/07/owl#ObjectProperty"	"https://wegenenverkeer-test.data.vlaanderen.be/ns/Onderdeel#DtcGrondafdekking"	"http://www.w3.org/2004/02/skos/core#Concept"	""	"1"	"1"
"attribute"	"OSLO-Onderdeel"	"grondbestemming"	"{D35BC759-0E9C-471a-81D6-C85A6B906B97}"	""	"DtcGrondAfgravinguitgraving"	"{A8BD9015-EAF5-4147-8F17-9AAD0E2C2C5D}"	"KlGrondbestemming"	"grondbestemming"	"Bepaalt de bestemming van de grond."	""	"grondbestemming"	"Bepaalt de bestemming van de grond."	""	""	"true"	"https://wegenenverkeer-test.data.vlaanderen.be/ns/Onderdeel#"	"DtcGrondAfgravinguitgraving.grondbestemming"	"http://www.w3.org/2002/07/owl#ObjectProperty"	"https://wegenenverkeer-test.data.vlaanderen.be/ns/Onderdeel#DtcGrondAfgravinguitgraving"	"http://www.w3.org/2004/02/skos/core#Concept"	""	"1"	"1"
"attribute"	"OSLO-Onderdeel"	"soortGrondwerk"	"{D456D164-6BCC-46b6-99E9-03B33F5BD9E5}"	""	"DtcGrondAfgravinguitgraving"	"{A8BD9015-EAF5-4147-8F17-9AAD0E2C2C5D}"	"KlGrondwerksoorten"	"soort grondwerk"	"Het soort werk waar de grond van afkomstig is of voor dient."	""	"soort grondwerk"	"Het soort werk waar de grond van afkomstig is of voor dient."	""	""	"true"	"https://wegenenverkeer-test.data.vlaanderen.be/ns/Onderdeel#"	"DtcGrondAfgravinguitgraving.soortGrondwerk"	"http://www.w3.org/2002/07/owl#ObjectProperty"	"https://wegenenverkeer-test.data.vlaanderen.be/ns/Onderdeel#DtcGrondAfgravinguitgraving"	"http://www.w3.org/2004/02/skos/core#Concept"	""	"1"	"1"
"attribute"	"OSLO-Onderdeel"	"grondtoevoegsel"	"{524D43B9-FCBB-4a50-8F16-F49C151E912C}"	""	"DtcGrondophoging"	"{0CE5453B-23F5-49bf-9BF9-CA3D03034AD4}"	"KlGrondtoevoegsel"	"grondtoevoegsel"	"Aanduiding of er evenuteel een toevoeging aan de grond is gebeurd."	""	"grondtoevoegsel"	"Aanduiding of er evenuteel een toevoeging aan de grond is gebeurd."	""	""	"true"	"https://wegenenverkeer-test.data.vlaanderen.be/ns/Onderdeel#"	"DtcGrondophoging.grondtoevoegsel"	"http://www.w3.org/2002/07/owl#ObjectProperty"	"https://wegenenverkeer-test.data.vlaanderen.be/ns/Onderdeel#DtcGrondophoging"	"http://www.w3.org/2004/02/skos/core#Concept"	""	"1"	"1"
"attribute"	"OSLO-Onderdeel"	"herkomst"	"{91C47F9D-A84B-415f-B645-2309BDE0E607}"	""	"DtcGrondophoging"	"{0CE5453B-23F5-49bf-9BF9-CA3D03034AD4}"	"KlGrondbestemming"	"herkomst"	"Bepaalt de origine van de grond."	""	"herkomst"	"Bepaalt de origine van de grond."	""	""	"true"	"https://wegenenverkeer-test.data.vlaanderen.be/ns/Onderdeel#"	"DtcGrondophoging.herkomst"	"http://www.w3.org/2002/07/owl#ObjectProperty"	"https://wegenenverkeer-test.data.vlaanderen.be/ns/Onderdeel#DtcGrondophoging"	"http://www.w3.org/2004/02/skos/core#Concept"	""	"1"	"1"
"attribute"	"OSLO-Onderdeel"	"soortGrondwerk"	"{7FA0CF15-FA98-489a-B4CE-9C18CC50952F}"	""	"DtcGrondophoging"	"{0CE5453B-23F5-49bf-9BF9-CA3D03034AD4}"	"KlGrondwerksoorten"	"soort grondwerk"	"Het soort werk waar de grond van afkomstig is of voor dient."	""	"soort grondwerk"	"Het soort werk waar de grond van afkomstig is of voor dient."	""	""	"true"	"https://wegenenverkeer-test.data.vlaanderen.be/ns/Onderdeel#"	"DtcGrondophoging.soortGrondwerk"	"http://www.w3.org/2002/07/owl#ObjectProperty"	"https://wegenenverkeer-test.data.vlaanderen.be/ns/Onderdeel#DtcGrondophoging"	"http://www.w3.org/2004/02/skos/core#Concept"	""	"1"	"1"
"attribute"	"OSLO-Onderdeel"	"afdekking"	"{49232CDF-1C72-4c0b-84FD-DADE31957B5E}"	""	"DtuSoortGrondwerk"	"{24F22FD0-5713-4f31-876A-C5040F923B0E}"	"DtcGrondafdekking"	"afdekking"	"Afdekking van grond."	""	"afdekking"	"Afdekking van grond."	""	""	"true"	"https://wegenenverkeer-test.data.vlaanderen.be/ns/Onderdeel#"	"DtuSoortGrondwerk.afdekking"	"http://www.w3.org/2002/07/owl#ObjectProperty"	"https://wegenenverkeer-test.data.vlaanderen.be/ns/Onderdeel#DtuSoortGrondwerk"	"https://wegenenverkeer-test.data.vlaanderen.be/ns/Onderdeel#DtcGrondafdekking"	""	"0"	"1"
"attribute"	"OSLO-Onderdeel"	"afgraving"	"{05F372EC-AA85-46b5-89E8-D219759FC7CA}"	""	"DtuSoortGrondwerk"	"{24F22FD0-5713-4f31-876A-C5040F923B0E}"	"DtcGrondAfgravinguitgraving"	"afgraving"	"Afgraving van grond."	""	"afgraving"	"Afgraving van grond."	""	""	"true"	"https://wegenenverkeer-test.data.vlaanderen.be/ns/Onderdeel#"	"DtuSoortGrondwerk.afgraving"	"http://www.w3.org/2002/07/owl#ObjectProperty"	"https://wegenenverkeer-test.data.vlaanderen.be/ns/Onderdeel#DtuSoortGrondwerk"	"https://wegenenverkeer-test.data.vlaanderen.be/ns/Onderdeel#DtcGrondAfgravinguitgraving"	""	"0"	"1"
"attribute"	"OSLO-Onderdeel"	"ophoging"	"{A52CC9F1-0DB0-4389-A64E-96F31B655E97}"	""	"DtuSoortGrondwerk"	"{24F22FD0-5713-4f31-876A-C5040F923B0E}"	"DtcGrondophoging"	"ophoging"	"Ophoging van grond."	""	"ophoging"	"Ophoging van grond."	""	""	"true"	"https://wegenenverkeer-test.data.vlaanderen.be/ns/Onderdeel#"	"DtuSoortGrondwerk.ophoging"	"http://www.w3.org/2002/07/owl#ObjectProperty"	"https://wegenenverkeer-test.data.vlaanderen.be/ns/Onderdeel#DtuSoortGrondwerk"	"https://wegenenverkeer-test.data.vlaanderen.be/ns/Onderdeel#DtcGrondophoging"	""	"0"	"1"
"attribute"	"OSLO-Onderdeel"	"uitgraving"	"{935B0B27-EE66-46a7-9AA9-A0649CA1FBC8}"	""	"DtuSoortGrondwerk"	"{24F22FD0-5713-4f31-876A-C5040F923B0E}"	"DtcGrondAfgravinguitgraving"	"uitgraving"	"Uitgraving van grond."	""	"uitgraving"	"Uitgraving van grond."	""	""	"true"	"https://wegenenverkeer-test.data.vlaanderen.be/ns/Onderdeel#"	"DtuSoortGrondwerk.uitgraving"	"http://www.w3.org/2002/07/owl#ObjectProperty"	"https://wegenenverkeer-test.data.vlaanderen.be/ns/Onderdeel#DtuSoortGrondwerk"	"https://wegenenverkeer-test.data.vlaanderen.be/ns/Onderdeel#DtcGrondAfgravinguitgraving"	""	"0"	"1"
"attribute"	"OSLO-Onderdeel"	"bijmenging"	"{351BB58F-A5A5-4bba-A2BF-D512B72D3CBE}"	""	"DtcGrondsoort"	"{02A3E994-84B7-4455-A23D-D3D589E21DDF}"	"DtcGrondbijmenging"	"bijmenging"	"Lithologisch hoofdbestanddeel (als code) van de laag zoals gebruikt bij Databank Ondergrond Vlaanderen (gecodeerde lithologie en geotechnische codering)."	"https://www.dov.vlaanderen.be/xdov/schema/latest/xsd/kern/interpretatie/GecodeerdeLithologieDataCodes.xsd  (GecodeerdHoofdnaamCodesEnumType)"	"bijmenging"	"Lithologisch hoofdbestanddeel (als code) van de laag zoals gebruikt bij Databank Ondergrond Vlaanderen (gecodeerde lithologie en geotechnische codering)."	""	""	"true"	"https://wegenenverkeer-test.data.vlaanderen.be/ns/Onderdeel#"	"DtcGrondsoort.bijmenging"	"http://www.w3.org/2002/07/owl#ObjectProperty"	"https://wegenenverkeer-test.data.vlaanderen.be/ns/Onderdeel#DtcGrondsoort"	"https://wegenenverkeer-test.data.vlaanderen.be/ns/Onderdeel#DtcGrondbijmenging"	""	"1"	"3"
"attribute"	"OSLO-Onderdeel"	"hoofdnaamcode"	"{886CEDB9-C41D-4796-9C1B-DE5D7943547C}"	""	"DtcGrondsoort"	"{02A3E994-84B7-4455-A23D-D3D589E21DDF}"	"KlGrondHoofdnaamCode"	"hoofdnaamcode"	"Lithologisch hoofdbestanddeel (als code) van de laag zoals gebruikt bij Databank Ondergrond Vlaanderen (gecodeerde lithologie en geotechnische codering)."	"https://www.dov.vlaanderen.be/xdov/schema/latest/xsd/kern/interpretatie/GecodeerdeLithologieDataCodes.xsd  (GecodeerdHoofdnaamCodesEnumType)"	"hoofdnaamcode"	"Lithologisch hoofdbestanddeel (als code) van de laag zoals gebruikt bij Databank Ondergrond Vlaanderen (gecodeerde lithologie en geotechnische codering)."	""	""	"true"	"https://wegenenverkeer-test.data.vlaanderen.be/ns/Onderdeel#"	"DtcGrondsoort.hoofdnaamcode"	"http://www.w3.org/2002/07/owl#ObjectProperty"	"https://wegenenverkeer-test.data.vlaanderen.be/ns/Onderdeel#DtcGrondsoort"	"http://www.w3.org/2004/02/skos/core#Concept"	""	"1"	"1"
"attribute"	"OSLO-Onderdeel"	"grondsoort"	"{D8E4EBAA-DF63-4019-BE1B-FD4D0C9B3764}"	""	"Grond"	"{DB77B560-3D97-4890-BE0B-D006E3593781}"	"DtcGrondsoort"	"soort grond"	"Lithologisch hoofd- en nevenbestanddeel (als code) van de laag zoals gebruikt bij  databank ondergrond Vlaanderen (gecodeerde lithologie en geotechnische codering)."	""	"soort grond"	"Lithologisch hoofd- en nevenbestanddeel (als code) van de laag zoals gebruikt bij  databank ondergrond Vlaanderen (gecodeerde lithologie en geotechnische codering)."	""	""	"true"	"https://wegenenverkeer-test.data.vlaanderen.be/ns/Onderdeel#"	"Grond.grondsoort"	"http://www.w3.org/2002/07/owl#ObjectProperty"	"https://wegenenverkeer-test.data.vlaanderen.be/ns/Onderdeel#Grond"	"https://wegenenverkeer-test.data.vlaanderen.be/ns/Onderdeel#DtcGrondsoort"	""	"1"	"1"
"attribute"	"OSLO-Onderdeel"	"milieuHygienischeCode"	"{9A87BCE8-C82B-4810-923C-13CD57E862F5}"	""	"Grond"	"{DB77B560-3D97-4890-BE0B-D006E3593781}"	"Integer"	"milieuhygiënische code"	"Het 3-delig nummer dat gehanteerd wordt door de vzw grondbank om de milieuhygiënische mogelijkheden van een partij bodem of grond aan te geven."	""	"milieuhygiënische code"	"Het 3-delig nummer dat gehanteerd wordt door de vzw grondbank om de milieuhygiënische mogelijkheden van een partij bodem of grond aan te geven."	""	""	"true"	"https://wegenenverkeer-test.data.vlaanderen.be/ns/Onderdeel#"	"Grond.milieuHygienischeCode"	"http://www.w3.org/2002/07/owl#DatatypeProperty"	"https://wegenenverkeer-test.data.vlaanderen.be/ns/Onderdeel#Grond"	"http://www.w3.org/2001/XMLSchema#integer"	""	"1"	"1"
"attribute"	"OSLO-Onderdeel"	"soortGrondwerk"	"{6C09C6E4-5C9A-45ef-BE02-7A32F57F4935}"	""	"Grond"	"{DB77B560-3D97-4890-BE0B-D006E3593781}"	"DtuSoortGrondwerk"	"soort grondwerk"	"De soort van uitgevoerde grondwerken die op het pakket grond zijn uitgevoerd."	""	"soort grondwerk"	"De soort van uitgevoerde grondwerken die op het pakket grond zijn uitgevoerd."	""	""	"true"	"https://wegenenverkeer-test.data.vlaanderen.be/ns/Onderdeel#"	"Grond.soortGrondwerk"	"http://www.w3.org/2002/07/owl#ObjectProperty"	"https://wegenenverkeer-test.data.vlaanderen.be/ns/Onderdeel#Grond"	"https://wegenenverkeer-test.data.vlaanderen.be/ns/Onderdeel#DtuSoortGrondwerk"	""	"1"	"1"
"attribute"	"OSLO-Onderdeel"	"technischVerslagBodemonderzoek"	"{A5685997-56AD-4ae5-AC87-7DDD498A6091}"	""	"Grond"	"{DB77B560-3D97-4890-BE0B-D006E3593781}"	"DtcAWVDocument"	"technisch verslag bodemonderzoek"	"Het technisch verslag van een bodemonderzoek."	""	"technisch verslag bodemonderzoek"	"Het technisch verslag van een bodemonderzoek."	""	""	"true"	"https://wegenenverkeer-test.data.vlaanderen.be/ns/Onderdeel#"	"Grond.technischVerslagBodemonderzoek"	"http://www.w3.org/2002/07/owl#ObjectProperty"	"https://wegenenverkeer-test.data.vlaanderen.be/ns/Onderdeel#Grond"	"https://wegenenverkeer-test.data.vlaanderen.be/ns/implementatieelement#DtcAWVDocument"	""	"1"	"*"
"attribute"	"OSLO-Onderdeel"	"tot"	"{44417C89-78B5-4e38-82A3-3B80644B462E}"	""	"Grond"	"{DB77B560-3D97-4890-BE0B-D006E3593781}"	"KwantWrdInMeter"	"tot"	"Diepte van de onderkant van de laag in meter.  https://www.dov.vlaanderen.be/xdov/schema/latest/xsd/kern/generiek/GeneriekeDataTypes.xsd  (DiepteType)"	""	"tot"	"Diepte van de onderkant van de laag in meter.  https://www.dov.vlaanderen.be/xdov/schema/latest/xsd/kern/generiek/GeneriekeDataTypes.xsd  (DiepteType)"	""	""	"true"	"https://wegenenverkeer-test.data.vlaanderen.be/ns/Onderdeel#"	"Grond.tot"	"http://www.w3.org/2002/07/owl#ObjectProperty"	"https://wegenenverkeer-test.data.vlaanderen.be/ns/Onderdeel#Grond"	"https://wegenenverkeer-test.data.vlaanderen.be/ns/implementatieelement#KwantWrdInMeter"	""	"1"	"1"
