"EA-Type"	"EA-Package"	"EA-Name"	"EA-GUID"	"EA-Parent"	"EA-Domain"	"EA-Domain-GUID"	"EA-Range"	"label"	"definition"	"usage"	"label-nl"	"definition-nl"	"usageNote-nl"	"label-en"	"definition-en"	"usageNote-en"	"equivalent"	"subclass"	"subclass1"	"sameAs"	"external term"	"namespace"	"localname"	"type"	"domain"	"range"	"parent"	"min card"	"max card"
"Package"	""	"OSLO-Implementatieelement"	"{82FAA1CD-BF2E-480d-94E9-912E8F91600A}"	""	""	""	""	""	""	""	""	""	""	""	""	""	""	""	""	""	""	"https://wegenenverkeer-test.data.vlaanderen.be/ns/"	"implementatieelement"	"http://www.w3.org/2002/07/owl#Ontology"	""	""	""	""	""
"CLASS"	"OSLO-Implementatieelement"	"Derdenobject"	"{2E742FB9-8EC0-4b0c-B647-412FE90511F7}"	""	""	""	""	"Derdenobject"	"Object niet in eigendom van AWV maar verbonden met een object van AWV."	""	"Derdenobject"	"Object niet in eigendom van AWV maar verbonden met een object van AWV."	""	""	""	""	""	""	""	""	"false"	"https://wegenenverkeer-test.data.vlaanderen.be/ns/implementatieelement#"	"Derdenobject"	"http://www.w3.org/2000/01/rdf-schema#Class"	""	""	""	""	""
"CLASS"	"OSLO-Implementatieelement"	"AWVNaamObject"	"{5C144615-47A1-4f8b-A119-B293BCFD84B5}"	""	""	""	""	"AWV naam object"	"Abstracte als de basisklasse voor elk OTL object dat benoemd wordt met een mensleesbare identificator. "	""	"AWV naam object"	"Abstracte als de basisklasse voor elk OTL object dat benoemd wordt met een mensleesbare identificator. "	""	""	""	""	""	""	""	""	"false"	"https://wegenenverkeer-test.data.vlaanderen.be/ns/implementatieelement#"	"AWVNaamObject"	"http://www.w3.org/2000/01/rdf-schema#Class"	""	""	"https://wegenenverkeer-test.data.vlaanderen.be/ns/implementatieelement#AWVObject"	""	""
"CLASS"	"OSLO-Implementatieelement"	"AWVObject"	"{C3CBD401-EC86-4363-9821-CCE89EB2F0A9}"	""	""	""	""	"AWV object"	"Abstracte als de basisklasse (super class) voor alle uniek geïdentificeerde OTL objecten met de basiseigenschappen die elk OTL object minstens heeft."	""	"AWV object"	"Abstracte als de basisklasse (super class) voor alle uniek geïdentificeerde OTL objecten met de basiseigenschappen die elk OTL object minstens heeft."	""	""	""	""	""	""	""	""	"false"	"https://wegenenverkeer-test.data.vlaanderen.be/ns/implementatieelement#"	"AWVObject"	"http://www.w3.org/2000/01/rdf-schema#Class"	""	""	""	""	""
"CLASS"	"OSLO-Implementatieelement"	"RelatieObject"	"{DAF61403-E9CE-4025-982A-7FF50D238076}"	""	""	""	""	"Relatieobject"	""	""	"Relatieobject"	"TODO"	""	""	""	""	""	""	""	""	"false"	"https://wegenenverkeer-test.data.vlaanderen.be/ns/implementatieelement#"	"RelatieObject"	"http://www.w3.org/2000/01/rdf-schema#Class"	""	""	""	""	""
"CLASS"	"OSLO-Implementatieelement"	"AWVNaampadObject"	"{FC6C5EAE-E8BA-483e-94E5-C43BAB738D21}"	""	""	""	""	"AWV naampad object"	"Abstracte als de basisklasse voor elk OTL object dat gebruik maakt van een naampad."	""	"AWV naampad object"	"Abstracte als de basisklasse voor elk OTL object dat gebruik maakt van een naampad."	""	""	""	""	""	""	""	""	"false"	"https://wegenenverkeer-test.data.vlaanderen.be/ns/implementatieelement#"	"AWVNaampadObject"	"http://www.w3.org/2000/01/rdf-schema#Class"	""	""	"https://wegenenverkeer-test.data.vlaanderen.be/ns/implementatieelement#AWVNaamObject"	""	""
"DATATYPE"	"OSLO-Implementatieelement"	"DtcAWVIdentificator"	"{0A270AE5-3C56-44b7-8B06-DBC66BD6EB66}"	""	""	""	""	"AWV-identificator"	"Complex datatype voor de identifictor van het AWV-object."	""	"AWV-identificator"	"Complex datatype voor de identifictor van het AWV-object."	""	""	""	""	""	""	""	""	"false"	"https://wegenenverkeer-test.data.vlaanderen.be/ns/implementatieelement#"	"DtcAWVIdentificator"	"http://www.w3.org/2000/01/rdf-schema#Class"	""	""	""	""	""
"DATATYPE"	"OSLO-Implementatieelement"	"DtcAdres"	"{0BE4CA53-E0D7-4149-9D89-4D6C4D6F0ED6}"	""	""	""	""	"Adres"	"De aanduiding van een bepaalde locatie, doorgaans van een huis, woning, gebouw of faciliteit, op de aarde."	""	"Adres"	"De aanduiding van een bepaalde locatie, doorgaans van een huis, woning, gebouw of faciliteit, op de aarde."	""	""	""	""	""	""	""	""	"false"	"https://wegenenverkeer-test.data.vlaanderen.be/ns/implementatieelement#"	"DtcAdres"	"http://www.w3.org/2000/01/rdf-schema#Class"	""	""	""	""	""
"DATATYPE"	"OSLO-Implementatieelement"	"DtcTijdsduur"	"{2A0CAEDB-E50D-45df-B793-21B87BBB4590}"	""	""	""	""	"Tijdsduur"	"Complex datatype voor de instelling van een tijdsbepaling."	""	"Tijdsduur"	"Complex datatype voor de instelling van een tijdsbepaling."	""	""	""	""	""	""	""	""	"false"	"https://wegenenverkeer-test.data.vlaanderen.be/ns/implementatieelement#"	"DtcTijdsduur"	"http://www.w3.org/2000/01/rdf-schema#Class"	""	""	""	""	""
"ENUMERATION"	"OSLO-Implementatieelement"	"KlAlgVerharding"	"{3379404F-88A9-4d1d-A7FD-6FEE03DFE312}"	""	""	""	""	"AlgVerharding"	""	""	"AlgVerharding"	"TODO"	""	""	""	""	""	""	""	""	"true"	"http://www.w3.org/2004/02/skos/core#"	"Concept"	"http://www.w3.org/2000/01/rdf-schema#Class"	""	""	""	""	""
"ENUMERATION"	"OSLO-Implementatieelement"	"KlAlgLamptype"	"{376F4B80-21B9-42ac-97CF-706413F26F01}"	""	""	""	""	"AlgLamptype"	"De lamp types."	""	"AlgLamptype"	"De lamp types."	""	""	""	""	""	""	""	""	"true"	"http://www.w3.org/2004/02/skos/core#"	"Concept"	"http://www.w3.org/2000/01/rdf-schema#Class"	""	""	""	""	""
"ENUMERATION"	"OSLO-Implementatieelement"	"KlAlgBeschermlaag"	"{3B9CFD26-FCF3-4423-9AF1-230DAE456D32}"	""	""	""	""	"AlgBeschermlaag"	"De manieren van aanbrengen van een beschermlaag ter voorkoming van roestvorming."	""	"AlgBeschermlaag"	"De manieren van aanbrengen van een beschermlaag ter voorkoming van roestvorming."	""	""	""	""	""	""	""	""	"true"	"http://www.w3.org/2004/02/skos/core#"	"Concept"	"http://www.w3.org/2000/01/rdf-schema#Class"	""	""	""	""	""
"DATATYPE"	"OSLO-Implementatieelement"	"DtcAWVDocument"	"{441527E2-4B20-4bca-899E-9DC151A2A981}"	""	""	""	""	"Bestandsbijlage"	"Complex datatype voor alle bestandsbijlages"	""	"Bestandsbijlage"	"Complex datatype voor alle bestandsbijlages"	""	""	""	""	""	""	""	""	"false"	"https://wegenenverkeer-test.data.vlaanderen.be/ns/implementatieelement#"	"DtcAWVDocument"	"http://www.w3.org/2000/01/rdf-schema#Class"	""	""	""	""	""
"DATATYPE"	"OSLO-Implementatieelement"	"DtcAfmetingBxl"	"{4CAB9328-30C1-4a48-8482-E31CC8398A0D}"	""	""	""	""	"Afmeting bxl"	"De afmeting van de breedte en de lengte in meter."	""	"Afmeting bxl"	"De afmeting van de breedte en de lengte in meter."	""	""	""	""	""	""	""	""	"false"	"https://wegenenverkeer-test.data.vlaanderen.be/ns/implementatieelement#"	"DtcAfmetingBxl"	"http://www.w3.org/2000/01/rdf-schema#Class"	""	""	""	""	""
"DATATYPE"	"OSLO-Implementatieelement"	"DtcCoordLambert72"	"{73A65FAF-52A4-4d56-BF2F-EECB2D03C4F8}"	""	""	""	""	"Coördinaat Lambert72"	"Complex datatype, beschrijft een locatie volgens het Lambert72 coördinatenstelsel."	""	"Coördinaat Lambert72"	"Complex datatype, beschrijft een locatie volgens het Lambert72 coördinatenstelsel."	""	""	""	""	""	""	""	""	"false"	"https://wegenenverkeer-test.data.vlaanderen.be/ns/implementatieelement#"	"DtcCoordLambert72"	"http://www.w3.org/2000/01/rdf-schema#Class"	""	""	""	""	""
"DATATYPE"	"OSLO-Implementatieelement"	"DtcAfmetingZijde"	"{7BD7B9ED-4392-49c8-9C11-3BCCE9EFCF3D}"	""	""	""	""	"Afmeting zijde"	"De afmeting van een zijde."	""	"Afmeting zijde"	"De afmeting van een zijde."	""	""	""	""	""	""	""	""	"false"	"https://wegenenverkeer-test.data.vlaanderen.be/ns/implementatieelement#"	"DtcAfmetingZijde"	"http://www.w3.org/2000/01/rdf-schema#Class"	""	""	""	""	""
"ENUMERATION"	"OSLO-Implementatieelement"	"KlAlgTypeOpslaggeheugen"	"{7DBEACE8-8CFC-4810-82B5-BB534DDCA5C1}"	""	""	""	""	"AlgTypeOpslaggeheugen"	""	""	"AlgTypeOpslaggeheugen"	"TODO"	""	""	""	""	""	""	""	""	"true"	"http://www.w3.org/2004/02/skos/core#"	"Concept"	"http://www.w3.org/2000/01/rdf-schema#Class"	""	""	""	""	""
"ENUMERATION"	"OSLO-Implementatieelement"	"KlAlgRijrichting"	"{869D3114-49F3-47d8-A173-165E5E28558F}"	""	""	""	""	"AlgRijrichting"	"De mogelijke rijrichtingen."	""	"AlgRijrichting"	"De mogelijke rijrichtingen."	""	""	""	""	""	""	""	""	"true"	"http://www.w3.org/2004/02/skos/core#"	"Concept"	"http://www.w3.org/2000/01/rdf-schema#Class"	""	""	""	""	""
"ENUMERATION"	"OSLO-Implementatieelement"	"KlAlgMateriaal"	"{8AD8B3A6-44A8-40f4-AD20-3CA15B1628F2}"	""	""	""	""	"AlgMateriaal"	"De gebruikte materialen bij een object."	""	"AlgMateriaal"	"De gebruikte materialen bij een object."	""	""	""	""	""	""	""	""	"true"	"http://www.w3.org/2004/02/skos/core#"	"Concept"	"http://www.w3.org/2000/01/rdf-schema#Class"	""	""	""	""	""
"ENUMERATION"	"OSLO-Implementatieelement"	"KlAlgMimeType"	"{9BCD2B4C-9CAB-4988-A052-6C4B006D450A}"	""	""	""	""	"AlgMimeType"	"De mime types van bestanden (AWVDocument) beperkt tot mime types voor toegelaten bestandstypen."	""	"AlgMimeType"	"De mime types van bestanden (AWVDocument) beperkt tot mime types voor toegelaten bestandstypen."	""	""	""	""	""	""	""	""	"true"	"http://www.w3.org/2004/02/skos/core#"	"Concept"	"http://www.w3.org/2000/01/rdf-schema#Class"	""	""	""	""	""
"ENUMERATION"	"OSLO-Implementatieelement"	"KlAlgWeekdagen"	"{A248BAD9-7C8F-4d6e-9AD8-7D4E1444FEEC}"	""	""	""	""	"Weekdagen"	"Lijst van de verschillende weekdagen"	""	"Weekdagen"	"Lijst van de verschillende weekdagen"	""	""	""	""	""	""	""	""	"true"	"https://schema.org/"	"DayOfWeek"	"http://www.w3.org/2000/01/rdf-schema#Class"	""	""	""	""	""
"DATATYPE"	"OSLO-Implementatieelement"	"DtcAfmetingDiameter"	"{A4E9EF18-BBDC-4b53-B4AB-6C95DDD83985}"	""	""	""	""	"Afmeting diameter"	"De afmeting van een diameter."	""	"Afmeting diameter"	"De afmeting van een diameter."	""	""	""	""	""	""	""	""	"false"	"https://wegenenverkeer-test.data.vlaanderen.be/ns/implementatieelement#"	"DtcAfmetingDiameter"	"http://www.w3.org/2000/01/rdf-schema#Class"	""	""	""	""	""
"DATATYPE"	"OSLO-Implementatieelement"	"DtcAfmetingBxh"	"{B1D8888A-C7D8-46f9-9E15-26BF83B0726B}"	""	""	""	""	"Afmeting bxh"	"De afmeting van de breedte en hoogte in meter."	""	"Afmeting bxh"	"De afmeting van de breedte en hoogte in meter."	""	""	""	""	""	""	""	""	"false"	"https://wegenenverkeer-test.data.vlaanderen.be/ns/implementatieelement#"	"DtcAfmetingBxh"	"http://www.w3.org/2000/01/rdf-schema#Class"	""	""	""	""	""
"DATATYPE"	"OSLO-Implementatieelement"	"DtcNatuurlijkPersoon"	"{B30BD3DB-A0B6-4d87-941F-A1224443D437}"	""	""	""	""	"Natuurlijk persoon"	"Beschrijft een natuurlijk persoon."	""	"Natuurlijk persoon"	"Beschrijft een natuurlijk persoon."	""	""	""	""	""	""	""	""	"false"	"https://wegenenverkeer-test.data.vlaanderen.be/ns/implementatieelement#"	"DtcNatuurlijkPersoon"	"http://www.w3.org/2000/01/rdf-schema#Class"	""	""	""	""	""
"DATATYPE"	"OSLO-Implementatieelement"	"DtcAfmetingBxlxh"	"{B5A50111-A7AF-47dd-9425-B2B1D2D3F925}"	""	""	""	""	"Afmeting bxlxh"	"De afmeting van de breedte, de lengte en hoogte in meter."	""	"Afmeting bxlxh"	"De afmeting van de breedte, de lengte en hoogte in meter."	""	""	""	""	""	""	""	""	"false"	"https://wegenenverkeer-test.data.vlaanderen.be/ns/implementatieelement#"	"DtcAfmetingBxlxh"	"http://www.w3.org/2000/01/rdf-schema#Class"	""	""	""	""	""
"ENUMERATION"	"OSLO-Implementatieelement"	"KlAlgVerfraaid"	"{C393C557-C4C2-409c-A204-46FD2B23C526}"	""	""	""	""	"AlgVerfraaid"	""	""	"AlgVerfraaid"	"TODO"	""	""	""	""	""	""	""	""	"true"	"http://www.w3.org/2004/02/skos/core#"	"Concept"	"http://www.w3.org/2000/01/rdf-schema#Class"	""	""	""	""	""
"ENUMERATION"	"OSLO-Implementatieelement"	"KlAlgVormgeving"	"{C3BD1828-EBDC-4bc4-9B6A-82D00A540538}"	""	""	""	""	"AlgVormgeving"	""	""	"AlgVormgeving"	"TODO"	""	""	""	""	""	""	""	""	"true"	"http://www.w3.org/2004/02/skos/core#"	"Concept"	"http://www.w3.org/2000/01/rdf-schema#Class"	""	""	""	""	""
"DATATYPE"	"OSLO-Implementatieelement"	"DtcRechtspersoon"	"{C465F307-CAA7-474e-99A4-2C2787B88C5D}"	""	""	""	""	"Rechtspersoon"	"Complex datatype voor een rechtspersoon."	""	"Rechtspersoon"	"Complex datatype voor een rechtspersoon."	""	""	""	""	""	""	""	""	"false"	"https://wegenenverkeer-test.data.vlaanderen.be/ns/implementatieelement#"	"DtcRechtspersoon"	"http://www.w3.org/2000/01/rdf-schema#Class"	""	""	""	""	""
"ENUMERATION"	"OSLO-Implementatieelement"	"KlAlgProvincie"	"{C792E483-A9F8-4d2a-BFA6-E944EEAC7B64}"	""	""	""	""	"AlgProvincie"	"Lijst van provincies in Vlaanderen"	""	"AlgProvincie"	"Lijst van provincies in Vlaanderen"	""	""	""	""	""	""	""	""	"true"	"http://www.w3.org/2004/02/skos/core#"	"Concept"	"http://www.w3.org/2000/01/rdf-schema#Class"	""	""	""	""	""
"ENUMERATION"	"OSLO-Implementatieelement"	"KlAlgGemeente"	"{C7C30358-F905-47c5-9A01-E1331EF347D5}"	""	""	""	""	"AlgGemeente"	"Lijst van gemeentes in Vlaanderen."	""	"AlgGemeente"	"Lijst van gemeentes in Vlaanderen."	""	""	""	""	""	""	""	""	"true"	"http://www.w3.org/2004/02/skos/core#"	"Concept"	"http://www.w3.org/2000/01/rdf-schema#Class"	""	""	""	""	""
"DATATYPE"	"OSLO-Implementatieelement"	"DtcProductidentificatiecode"	"{DF43B202-DE7C-4eda-9167-220E7A7B4CEC}"	""	""	""	""	"Productidentificatiecode"	"Complex data type dat alle nodige informatie van het product capteert."	""	"Productidentificatiecode"	"Complex data type dat alle nodige informatie van het product capteert."	""	""	""	""	""	""	""	""	"false"	"https://wegenenverkeer-test.data.vlaanderen.be/ns/implementatieelement#"	"DtcProductidentificatiecode"	"http://www.w3.org/2000/01/rdf-schema#Class"	""	""	""	""	""
"ENUMERATION"	"OSLO-Implementatieelement"	"KlAlgSnelheidsregime"	"{EB680F37-D0FB-4f75-B330-DC99A8F64759}"	""	""	""	""	"AlgSnelheidsregime"	"De snelheidsregimes met variabele mogelijkeid."	""	"AlgSnelheidsregime"	"De snelheidsregimes met variabele mogelijkeid."	""	""	""	""	""	""	""	""	"true"	"http://www.w3.org/2004/02/skos/core#"	"Concept"	"http://www.w3.org/2000/01/rdf-schema#Class"	""	""	""	""	""
"ENUMERATION"	"OSLO-Implementatieelement"	"KlIngressionProtectionCode"	"{EBE1E880-A8CB-4ed7-B4B4-FC3CC4B4F883}"	""	""	""	""	"Ingress Protection Codering"	"De IP-codering als een aanduiding voor de mate van beveiliging van de constructie van elektrische of elektronische apparatuur tegen eigen schade door gebruik in ""vijandige omgevingen"" en tegen eventueel gevaar voor de gebruiker volgens IEC 60529."	""	"Ingress Protection Codering"	"De IP-codering als een aanduiding voor de mate van beveiliging van de constructie van elektrische of elektronische apparatuur tegen eigen schade door gebruik in ""vijandige omgevingen"" en tegen eventueel gevaar voor de gebruiker volgens IEC 60529."	""	""	""	""	""	""	""	""	"false"	"https://wegenenverkeer-test.data.vlaanderen.be/ns/implementatieelement#"	"KlIngressionProtectionCode"	"http://www.w3.org/2000/01/rdf-schema#Class"	""	""	""	""	""
"ENUMERATION"	"OSLO-Implementatieelement"	"KlAlgBijzondertransport"	"{F5832A95-DC56-478a-9F26-99814AEDEEE5}"	""	""	""	""	"AlgBijzondertransport"	"De mogelijkheden en manieren waarop een steun geschikt is om bijzonder transport mogelijk te maken."	""	"AlgBijzondertransport"	"De mogelijkheden en manieren waarop een steun geschikt is om bijzonder transport mogelijk te maken."	""	""	""	""	""	""	""	""	"true"	"http://www.w3.org/2004/02/skos/core#"	"Concept"	"http://www.w3.org/2000/01/rdf-schema#Class"	""	""	""	""	""
"DATATYPE"	"OSLO-Implementatieelement"	"DteKleurRAL"	"{069C1580-90CD-4968-AD22-C6D8BAB47DF7}"	""	""	""	""	"RAL-kleur"	"Beschrijft een kleur volgens het RAL klassificatiesysteem. De waarde is een natuurlijk getal tussen 1000 en 9999."	""	"RAL-kleur"	"Beschrijft een kleur volgens het RAL klassificatiesysteem. De waarde is een natuurlijk getal tussen 1000 en 9999."	""	""	""	""	""	""	""	""	"false"	"https://wegenenverkeer-test.data.vlaanderen.be/ns/implementatieelement#"	"DteKleurRAL"	"http://www.w3.org/2000/01/rdf-schema#Class"	""	""	""	""	""
"DATATYPE"	"OSLO-Implementatieelement"	"DteURI"	"{720ACC1F-344F-43bb-9B65-5467749150DD}"	""	""	""	""	"URI"	"Een tekstwaarde die een verwijzing naar meer informatie van het element bevat volgens http://www.w3.org/2001/XMLSchema#anyURI ."	""	"URI"	"Een tekstwaarde die een verwijzing naar meer informatie van het element bevat volgens http://www.w3.org/2001/XMLSchema#anyURI ."	""	""	""	""	""	""	""	""	"true"	"http://www.w3.org/2001/XMLSchema#"	"anyURI"	"http://www.w3.org/2000/01/rdf-schema#Class"	""	""	""	""	""
"DATATYPE"	"OSLO-Implementatieelement"	"DteIPv4Adres"	"{AF96DFD7-4CAA-488b-A873-A338795310EB}"	""	""	""	""	"IPv4-adres"	"Beschrijft een ip-adres volgens de ipv4 specificatie."	""	"IPv4-adres"	"Beschrijft een ip-adres volgens de ipv4 specificatie."	""	""	""	""	""	""	""	""	"false"	"https://wegenenverkeer-test.data.vlaanderen.be/ns/implementatieelement#"	"DteIPv4Adres"	"http://www.w3.org/2000/01/rdf-schema#Class"	""	""	""	""	""
"DATATYPE"	"OSLO-Implementatieelement"	"DteTekstblok"	"{E5E67991-BD15-468d-A90F-26B3A0821EF1}"	""	""	""	""	"Tekstblok"	"Een tekst welke uit meerdere zinnen bestaat, en ook regeleindes kan bevatten. Een tekstblok bevat maximaal 65.000 karakters."	""	"Tekstblok"	"Een tekst welke uit meerdere zinnen bestaat, en ook regeleindes kan bevatten. Een tekstblok bevat maximaal 65.000 karakters."	""	""	""	""	""	""	""	""	"false"	"https://wegenenverkeer-test.data.vlaanderen.be/ns/implementatieelement#"	"DteTekstblok"	"http://www.w3.org/2000/01/rdf-schema#Class"	""	""	""	""	""
"DATATYPE"	"OSLO-Implementatieelement"	"KwantWrdInWatt"	"{003FB507-CE8D-44a3-B5A2-D509E3D76463}"	""	""	""	""	"Kwantitatieve waarde in Watt"	"Een kwantitatieve waarde die een getal in Watt uitdrukt."	""	"Kwantitatieve waarde in Watt"	"Een kwantitatieve waarde die een getal in Watt uitdrukt."	""	""	""	""	""	""	""	""	"false"	"https://wegenenverkeer-test.data.vlaanderen.be/ns/implementatieelement#"	"KwantWrdInWatt"	"http://www.w3.org/2000/01/rdf-schema#Class"	""	""	""	""	""
"DATATYPE"	"OSLO-Implementatieelement"	"KwantWrdInAmpere"	"{1038976D-050C-46ed-A79B-913C3A37BB05}"	""	""	""	""	"Kwantitatieve waarde in Ampere"	"Een kwantitatieve waarde die een getal in ampere uitdrukt."	""	"Kwantitatieve waarde in Ampere"	"Een kwantitatieve waarde die een getal in ampere uitdrukt."	""	""	""	""	""	""	""	""	"false"	"https://wegenenverkeer-test.data.vlaanderen.be/ns/implementatieelement#"	"KwantWrdInAmpere"	"http://www.w3.org/2000/01/rdf-schema#Class"	""	""	""	""	""
"DATATYPE"	"OSLO-Implementatieelement"	"KwantWrdInSeconde"	"{173CE085-A4C9-47a9-9559-EA4785B40604}"	""	""	""	""	"Kwantitatieve waarde in seconde"	"Een kwantitatieve waarde die een getal in seconde uitdrukt."	""	"Kwantitatieve waarde in seconde"	"Een kwantitatieve waarde die een getal in seconde uitdrukt."	""	""	""	""	""	""	""	""	"false"	"https://wegenenverkeer-test.data.vlaanderen.be/ns/implementatieelement#"	"KwantWrdInSeconde"	"http://www.w3.org/2000/01/rdf-schema#Class"	""	""	""	""	""
"DATATYPE"	"OSLO-Implementatieelement"	"KwantWrdInKubiekeMeter"	"{1AF0D461-DFD1-4a5d-BF31-2A3D2E183A2C}"	""	""	""	""	"Kwantitatieve waarde in kubieke meter"	"Een kwantitatieve waarde die een getal in kubieke meter uitdrukt."	""	"Kwantitatieve waarde in kubieke meter"	"Een kwantitatieve waarde die een getal in kubieke meter uitdrukt."	""	""	""	""	""	""	""	""	"false"	"https://wegenenverkeer-test.data.vlaanderen.be/ns/implementatieelement#"	"KwantWrdInKubiekeMeter"	"http://www.w3.org/2000/01/rdf-schema#Class"	""	""	""	""	""
"DATATYPE"	"OSLO-Implementatieelement"	"KwantWrdInInch"	"{27AB8F9D-4D87-4a2e-9FB6-DA49DED904A7}"	""	""	""	""	"Kwantitatieve waarde in inch"	"Een kwantitatieve waarde die een getal in inches uitdrukt."	""	"Kwantitatieve waarde in inch"	"Een kwantitatieve waarde die een getal in inches uitdrukt."	""	""	""	""	""	""	""	""	"false"	"https://wegenenverkeer-test.data.vlaanderen.be/ns/implementatieelement#"	"KwantWrdInInch"	"http://www.w3.org/2000/01/rdf-schema#Class"	""	""	""	""	""
"DATATYPE"	"OSLO-Implementatieelement"	"KwantWrdInMeter"	"{30A575B2-90E9-4879-A70F-2DE16F53B112}"	""	""	""	""	"Kwantitatieve waarde in meter"	"Een kwantitatieve waarde die een getal in meter uitdrukt."	""	"Kwantitatieve waarde in meter"	"Een kwantitatieve waarde die een getal in meter uitdrukt."	""	""	""	""	""	""	""	""	"false"	"https://wegenenverkeer-test.data.vlaanderen.be/ns/implementatieelement#"	"KwantWrdInMeter"	"http://www.w3.org/2000/01/rdf-schema#Class"	""	""	""	""	""
"DATATYPE"	"OSLO-Implementatieelement"	"KwantWrdInKiloVoltAmpere"	"{3271BDDA-98CC-4237-84F8-EA20FC177042}"	""	""	""	""	"Kwantitatieve waarde in kiloVoltAmpere"	"Een kwantitatieve waarde die een getal in kiloVoltAmpere uitdrukt."	""	"Kwantitatieve waarde in kiloVoltAmpere"	"Een kwantitatieve waarde die een getal in kiloVoltAmpere uitdrukt."	""	""	""	""	""	""	""	""	"false"	"https://wegenenverkeer-test.data.vlaanderen.be/ns/implementatieelement#"	"KwantWrdInKiloVoltAmpere"	"http://www.w3.org/2000/01/rdf-schema#Class"	""	""	""	""	""
"DATATYPE"	"OSLO-Implementatieelement"	"KwantWrdInVoltAmpere"	"{35C28A1C-09E7-494d-943C-C30D1330A2BC}"	""	""	""	""	"Kwantitatieve waarde in VoltAmpere"	"Een kwantitatieve waarde die een getal in VoltAmpere uitdrukt."	""	"Kwantitatieve waarde in VoltAmpere"	"Een kwantitatieve waarde die een getal in VoltAmpere uitdrukt."	""	""	""	""	""	""	""	""	"false"	"https://wegenenverkeer-test.data.vlaanderen.be/ns/implementatieelement#"	"KwantWrdInVoltAmpere"	"http://www.w3.org/2000/01/rdf-schema#Class"	""	""	""	""	""
"DATATYPE"	"OSLO-Implementatieelement"	"KwantWrdInCelsius"	"{803F451A-79A8-4fa5-AD10-6324BB6C84FC}"	""	""	""	""	"Kwantitatieve waarde in Celsius"	"Een kwantitatieve waarde die een getal in graden celsius uitdrukt."	""	"Kwantitatieve waarde in Celsius"	"Een kwantitatieve waarde die een getal in graden celsius uitdrukt."	""	""	""	""	""	""	""	""	"false"	"https://wegenenverkeer-test.data.vlaanderen.be/ns/implementatieelement#"	"KwantWrdInCelsius"	"http://www.w3.org/2000/01/rdf-schema#Class"	""	""	""	""	""
"DATATYPE"	"OSLO-Implementatieelement"	"KwantWrdInKelvin"	"{832D3F37-10BE-4f25-B0DA-CADD062D011C}"	""	""	""	""	"Kwantitatieve waarde in Kelvin"	"Een kwantitatieve waarde die een getal in Kelvin uitdrukt."	""	"Kwantitatieve waarde in Kelvin"	"Een kwantitatieve waarde die een getal in Kelvin uitdrukt."	""	""	""	""	""	""	""	""	"false"	"https://wegenenverkeer-test.data.vlaanderen.be/ns/implementatieelement#"	"KwantWrdInKelvin"	"http://www.w3.org/2000/01/rdf-schema#Class"	""	""	""	""	""
"DATATYPE"	"OSLO-Implementatieelement"	"KwantWrdInMilliAmpere"	"{858C7C88-0E96-45d9-BD11-98C4D19EC331}"	""	""	""	""	"Kwantitatieve waarde in milliAmpere"	"Een kwantitatieve waarde die een getal in milliAmpere uitdrukt."	""	"Kwantitatieve waarde in milliAmpere"	"Een kwantitatieve waarde die een getal in milliAmpere uitdrukt."	""	""	""	""	""	""	""	""	"false"	"https://wegenenverkeer-test.data.vlaanderen.be/ns/implementatieelement#"	"KwantWrdInMilliAmpere"	"http://www.w3.org/2000/01/rdf-schema#Class"	""	""	""	""	""
"DATATYPE"	"OSLO-Implementatieelement"	"KwantWrdInkWh"	"{8C91A5A7-2062-4b43-8DE8-0F8505B14A6F}"	""	""	""	""	"Kwantitatieve waarde in kWh"	"Een kwantitatieve waarde die een getal in kiloWattUur uitdrukt."	""	"Kwantitatieve waarde in kWh"	"Een kwantitatieve waarde die een getal in kiloWattUur uitdrukt."	""	""	""	""	""	""	""	""	"false"	"https://wegenenverkeer-test.data.vlaanderen.be/ns/implementatieelement#"	"KwantWrdInkWh"	"http://www.w3.org/2000/01/rdf-schema#Class"	""	""	""	""	""
"DATATYPE"	"OSLO-Implementatieelement"	"KwantWrdInBar"	"{94556852-F9D2-4a84-ADBC-CB2DC3940952}"	""	""	""	""	"Kwantitatieve waarde in bar"	"Een kwantitatieve waarde die een getal in bar uitdrukt."	""	"Kwantitatieve waarde in bar"	"Een kwantitatieve waarde die een getal in bar uitdrukt."	""	""	""	""	""	""	""	""	"false"	"https://wegenenverkeer-test.data.vlaanderen.be/ns/implementatieelement#"	"KwantWrdInBar"	"http://www.w3.org/2000/01/rdf-schema#Class"	""	""	""	""	""
"DATATYPE"	"OSLO-Implementatieelement"	"KwantWrdInVierkanteMeter"	"{ACAE1065-C7E9-4785-8C11-71E641483BDF}"	""	""	""	""	"Kwantitatieve waarde in vierkante meter"	"Een kwantitatieve waarde die een getal in vierkante meter uitdrukt."	""	"Kwantitatieve waarde in vierkante meter"	"Een kwantitatieve waarde die een getal in vierkante meter uitdrukt."	""	""	""	""	""	""	""	""	"false"	"https://wegenenverkeer-test.data.vlaanderen.be/ns/implementatieelement#"	"KwantWrdInVierkanteMeter"	"http://www.w3.org/2000/01/rdf-schema#Class"	""	""	""	""	""
"DATATYPE"	"OSLO-Implementatieelement"	"KwantWrdInMillimeter"	"{AE04A0C4-258A-4401-B823-305832B572AC}"	""	""	""	""	"Kwantitatieve waarde in millimeter"	"Een kwantitatieve waarde die een getal in millimeter uitdrukt."	""	"Kwantitatieve waarde in millimeter"	"Een kwantitatieve waarde die een getal in millimeter uitdrukt."	""	""	""	""	""	""	""	""	"false"	"https://wegenenverkeer-test.data.vlaanderen.be/ns/implementatieelement#"	"KwantWrdInMillimeter"	"http://www.w3.org/2000/01/rdf-schema#Class"	""	""	""	""	""
"DATATYPE"	"OSLO-Implementatieelement"	"KwantWrdInkVARh"	"{CA5081AA-2EEE-4f8a-81F9-1A2626D4F325}"	""	""	""	""	"Kwantitatieve waarde in kVARh"	"Een kwantitatieve waarde die een getal in KiloVoltAmpereReactiefUur uitdrukt."	""	"Kwantitatieve waarde in kVARh"	"Een kwantitatieve waarde die een getal in KiloVoltAmpereReactiefUur uitdrukt."	""	""	""	""	""	""	""	""	"false"	"https://wegenenverkeer-test.data.vlaanderen.be/ns/implementatieelement#"	"KwantWrdInkVARh"	"http://www.w3.org/2000/01/rdf-schema#Class"	""	""	""	""	""
"DATATYPE"	"OSLO-Implementatieelement"	"KwantWrdInMeterTAW"	"{3944F347-842A-4743-A0D5-4560367372CF}"	""	""	""	""	"Kwantitatieve waarde in meter TAW"	"Geeft de hoogte weer van een locatie in meter tov het TAW-referentiepeil."	""	"Kwantitatieve waarde in meter TAW"	"Geeft de hoogte weer van een locatie in meter tov het TAW-referentiepeil."	""	""	""	""	""	""	""	""	"false"	"https://wegenenverkeer-test.data.vlaanderen.be/ns/implementatieelement#"	"KwantWrdInMeterTAW"	"http://www.w3.org/2000/01/rdf-schema#Class"	""	""	"https://wegenenverkeer-test.data.vlaanderen.be/ns/implementatieelement#KwantWrdInMeter"	""	""
