"EA-Type"	"EA-Package"	"EA-Name"	"EA-GUID"	"EA-Parent"	"EA-Domain"	"EA-Domain-GUID"	"EA-Range"	"label"	"definition"	"usage"	"ap-label-nl"	"ap-definition-nl"	"ap-usageNote-nl"	"ap-codelist"	"external term"	"namespace"	"localname"	"type"	"domain"	"range"	"parent"	"min card"	"max card"
"Package"	""	"OSLO-Zone-30"	"{2B13B3EA-0869-40b9-842C-E1548C90F0D9}"	""	""	""	""	""	""	""	""	""	""	""	""	"http://"	"fixme.com"	"http://www.w3.org/2002/07/owl#Ontology"	""	""	""	""	""
"CLASS"	"OSLO-Abstracten"	"Kast"	"{3EF2F3D8-F751-4012-8E69-2A37C90B436C}"	""	""	""	""	"Kast"	"Abstracte voor allerlei types kasten."	""	"Kast"	"Abstracte voor allerlei types kasten."	""	""	"true"	"https://wegenenverkeer.data.vlaanderen.be/ns/abstracten#"	"Kast"	"http://www.w3.org/2000/01/rdf-schema#Class"	""	""	"https://wegenenverkeer.data.vlaanderen.be/ns/abstracten#Behuizing"	""	""
"CLASS"	"OSLO-Abstracten"	"LEDBord"	"{30D8DAD3-4B69-42d6-91EC-803D75A9808D}"	"Verkeersbord"	""	""	""	"LED-bord"	"Abstracte klasse die de gemeenschappelijke eigenschappen van verschillende types dynamische verkeersborden groepeert."	""	"LED-bord"	"Abstracte klasse die de gemeenschappelijke eigenschappen van verschillende types dynamische verkeersborden groepeert."	""	""	"true"	"https://wegenenverkeer.data.vlaanderen.be/ns/abstracten#"	"LEDBord"	"http://www.w3.org/2000/01/rdf-schema#Class"	""	""	"https://wegenenverkeer.data.vlaanderen.be/ns/implementatieelement#AIMNaamObject, https://wegenenverkeer.data.vlaanderen.be/ns/abstracten#Verkeersbord"	""	""
"CLASS"	"OSLO-Onderdeel"	"DynBordExternePU"	"{817EA5D2-2ED3-447c-8340-E808283DBBB8}"	""	""	""	""	"Processing unit voor dynamisch borden"	"Externe stuureenheid die buiten het dynamisch bord bevestigd is, in de buurt van de openbare weg. Het betreft dus geen stuureenheid in een serverroom, noch een stuureenheid op het bord zelf."	""	"Processing unit voor dynamisch borden"	"Externe stuureenheid die buiten het dynamisch bord bevestigd is, in de buurt van de openbare weg. Het betreft dus geen stuureenheid in een serverroom, noch een stuureenheid op het bord zelf."	""	""	"true"	"https://wegenenverkeer.data.vlaanderen.be/ns/onderdeel#"	"DynBordExternePU"	"http://www.w3.org/2000/01/rdf-schema#Class"	""	""	"https://wegenenverkeer.data.vlaanderen.be/ns/abstracten#PU"	""	""
"CLASS"	"OSLO-Installatie"	"VerkeersbordVerkeersteken"	"{87DB68D7-8603-4652-A0DA-38F1822E7CCF}"	"Verkeersteken"	""	""	""	"Verkeersbord - verkeersteken"	"De voorstelling door middel van een verkeersbord van een aanwijzing ten behoeve van de weggebruikers die verbonden wordt aan het aankondigen of opleggen van een bepaalde verkeersmaatregel zoals bepaald in de wegcode."	""	"Verkeersbord - verkeersteken"	"De voorstelling door middel van een verkeersbord van een aanwijzing ten behoeve van de weggebruikers die verbonden wordt aan het aankondigen of opleggen van een bepaalde verkeersmaatregel zoals bepaald in de wegcode."	""	""	"true"	"https://wegenenverkeer.data.vlaanderen.be/ns/installatie#"	"VerkeersbordVerkeersteken"	"http://www.w3.org/2000/01/rdf-schema#Class"	""	""	"https://wegenenverkeer.data.vlaanderen.be/ns/abstracten#Verkeersteken"	""	""
"CLASS"	"OSLO-Installatie"	"VerkeersbordConcept"	"{34557462-849E-4d1b-8ECA-3A28ED3893C6}"	""	""	""	""	"Verkeersbordconcept"	"Inhoudelijke definitie van de betekenis van een verkeersbord zoals opgenomen in de wegcode."	""	"Verkeersbordconcept"	"Inhoudelijke definitie van de betekenis van een verkeersbord zoals opgenomen in de wegcode."	""	""	"true"	"https://wegenenverkeer.data.vlaanderen.be/ns/installatie#"	"VerkeersbordConcept"	"http://www.w3.org/2000/01/rdf-schema#Class"	""	""	"https://wegenenverkeer.data.vlaanderen.be/ns/implementatieelement#AIMObject"	""	""
"CLASS"	"OSLO-Abstracten"	"Verkeersteken"	"{1411397B-0D16-457a-BD83-C7C2F922AAB7}"	""	""	""	""	"Verkeersteken"	"Abstracte klasse voor aanwijzingen ten behoeve van de weggebruikers die verbonden wordt aan het aankondigen of opleggen van een bepaalde verkeersmaatregel zoals bepaald in de wegcode."	""	"Verkeersteken"	"Abstracte klasse voor aanwijzingen ten behoeve van de weggebruikers die verbonden wordt aan het aankondigen of opleggen van een bepaalde verkeersmaatregel zoals bepaald in de wegcode."	""	""	"true"	"https://wegenenverkeer.data.vlaanderen.be/ns/abstracten#"	"Verkeersteken"	"http://www.w3.org/2000/01/rdf-schema#Class"	""	""	"https://wegenenverkeer.data.vlaanderen.be/ns/implementatieelement#AIMObject"	""	""
"CLASS"	"OSLO-Abstracten"	"Verkeersbord"	"{C1E19938-882F-4614-A16C-1F94A626E046}"	""	""	""	""	"Verkeersbord"	"Abstracte klasse voor borden die een fysieke drager van verkeerstekens kunnen zijn waarvan de betekenis bepaald wordt door een verkeersbordconcept. "	""	"Verkeersbord"	"Abstracte klasse voor borden die een fysieke drager van verkeerstekens kunnen zijn waarvan de betekenis bepaald wordt door een verkeersbordconcept. "	""	""	"true"	"https://wegenenverkeer.data.vlaanderen.be/ns/abstracten#"	"Verkeersbord"	"http://www.w3.org/2000/01/rdf-schema#Class"	""	""	""	""	""
"CLASS"	"OSLO-Onderdeel"	"Wegkantkast"	"{1E3854F9-85CD-460f-A71B-F0DC5126B14A}"	""	""	""	""	"Wegkantkast"	"Behuizing in de vorm van een kast typisch gebruikt buiten, langs de kant van de weg."	""	"Wegkantkast"	"Behuizing in de vorm van een kast typisch gebruikt buiten, langs de kant van de weg."	""	""	"true"	"https://wegenenverkeer.data.vlaanderen.be/ns/onderdeel#"	"Wegkantkast"	"http://www.w3.org/2000/01/rdf-schema#Class"	""	""	"https://wegenenverkeer.data.vlaanderen.be/ns/abstracten#Buitenkast"	""	""
"CLASS"	"OSLO-Onderdeel"	"Montagekast"	"{414E29D7-8BC4-4306-A670-4D62E071D768}"	""	""	""	""	"Montagekast"	"Een kleine kast voor binnen of buiten die net omwille van zijn beperkte omvang doorgaans aan een paal, muur of andere objecten bevestigd wordt."	""	"Montagekast"	"Een kleine kast voor binnen of buiten die net omwille van zijn beperkte omvang doorgaans aan een paal, muur of andere objecten bevestigd wordt."	""	""	"true"	"https://wegenenverkeer.data.vlaanderen.be/ns/onderdeel#"	"Montagekast"	"http://www.w3.org/2000/01/rdf-schema#Class"	""	""	"https://wegenenverkeer.data.vlaanderen.be/ns/abstracten#Buitenkast"	""	""
"CLASS"	"OSLO-Abstracten"	"DNBMeter"	"{9AFBE94E-93CD-4116-AEAE-FCFB37B231AE}"	""	""	""	""	"DNB meter"	"Abstracte voor elk toestel dat eigendom is van de distributienetbeheerder en in de installatie van de asset beheerder geplaatst wordt voor diverse metingen van doorgevoerde energie."	""	"DNB meter"	"Abstracte voor elk toestel dat eigendom is van de distributienetbeheerder en in de installatie van de asset beheerder geplaatst wordt voor diverse metingen van doorgevoerde energie."	""	""	"true"	"https://wegenenverkeer.data.vlaanderen.be/ns/abstracten#"	"DNBMeter"	"http://www.w3.org/2000/01/rdf-schema#Class"	""	""	"https://wegenenverkeer.data.vlaanderen.be/ns/abstracten#Energiemeter"	""	""
"CLASS"	"OSLO-Onderdeel"	"ForfaitaireAansluiting"	"{DFC38369-5E39-44a8-95CB-690115F81086}"	""	""	""	""	"Forfaitaire aansluiting"	"Een elektrische aansluiting waarbij met een forfaitair tarief gewerkt wordt, hierbij is er geen teller voorzien door de DNB."	""	"Forfaitaire aansluiting"	"Een elektrische aansluiting waarbij met een forfaitair tarief gewerkt wordt, hierbij is er geen teller voorzien door de DNB."	""	""	"true"	"https://wegenenverkeer.data.vlaanderen.be/ns/onderdeel#"	"ForfaitaireAansluiting"	"http://www.w3.org/2000/01/rdf-schema#Class"	""	""	"https://wegenenverkeer.data.vlaanderen.be/ns/implementatieelement#AIMNaamObject"	""	""
"CLASS"	"OSLO-Onderdeel"	"EnergiemeterDNB"	"{6EF6B2FA-1630-4351-BD93-43F945B51FAE}"	"DNBMeter"	""	""	""	"Energiemeter DNB"	"Toestel dat eigendom is van de distributienetbeheerder en in de installatie van de asset beheerder geplaatst wordt voor het meten van het energieverbruik van de betreffende installatie."	""	"Energiemeter DNB"	"Toestel dat eigendom is van de distributienetbeheerder en in de installatie van de asset beheerder geplaatst wordt voor het meten van het energieverbruik van de betreffende installatie."	""	""	"true"	"https://wegenenverkeer.data.vlaanderen.be/ns/onderdeel#"	"EnergiemeterDNB"	"http://www.w3.org/2000/01/rdf-schema#Class"	""	""	"https://wegenenverkeer.data.vlaanderen.be/ns/abstracten#DNBMeter"	""	""
"CLASS"	"OSLO-Onderdeel"	"DNBLaagspanning"	"{DAB4BD74-4508-4e7c-9301-7928132C8D78}"	""	""	""	""	"DNB laagspanning"	"Aansluiting op het laagspanningsnet van de distributienetbeheerder."	""	"DNB laagspanning"	"Aansluiting op het laagspanningsnet van de distributienetbeheerder."	""	""	"true"	"https://wegenenverkeer.data.vlaanderen.be/ns/onderdeel#"	"DNBLaagspanning"	"http://www.w3.org/2000/01/rdf-schema#Class"	""	""	"https://wegenenverkeer.data.vlaanderen.be/ns/abstracten#DNB"	""	""
"CLASS"	"OSLO-Abstracten"	"SteunStandaard"	"{D37D818D-FF1B-4e19-9E99-6D41A167325C}"	""	""	""	""	"Steun standaard"	"Abstracte voor de standaard steunen."	""	"Steun standaard"	"Abstracte voor de standaard steunen."	""	""	"true"	"https://wegenenverkeer.data.vlaanderen.be/ns/abstracten#"	"SteunStandaard"	"http://www.w3.org/2000/01/rdf-schema#Class"	""	""	"https://wegenenverkeer.data.vlaanderen.be/ns/implementatieelement#AIMNaamObject, https://wegenenverkeer.data.vlaanderen.be/ns/abstracten#EMDraagconstructie"	""	""
"CLASS"	"OSLO-Abstracten"	"Seinlantaarn"	"{56896F26-FA73-4923-982E-A14E75EEA01C}"	""	""	""	""	"Seinlantaarn"	"Abstracte voor het geheel van één of meerdere verkeerslichten die boven elkaar worden opgesteld en worden bevestigd op een steun,teneinde de beweging van een weggebruiker die een bepaald traject volgt,te verhinderen of toe te laten."	""	"Seinlantaarn"	"Abstracte voor het geheel van één of meerdere verkeerslichten die boven elkaar worden opgesteld en worden bevestigd op een steun,teneinde de beweging van een weggebruiker die een bepaald traject volgt,te verhinderen of toe te laten."	""	""	"true"	"https://wegenenverkeer.data.vlaanderen.be/ns/abstracten#"	"Seinlantaarn"	"http://www.w3.org/2000/01/rdf-schema#Class"	""	""	"https://wegenenverkeer.data.vlaanderen.be/ns/implementatieelement#AIMNaamObject"	""	""
"CLASS"	"OSLO-Onderdeel"	"Knipperlantaarn"	"{506DF1F1-1762-49d9-8378-48192C6B9085}"	"Seinlantaarn"	""	""	""	"Knipperlantaarn"	"Een lantaarn bestaande uit één of meerdere knipperende oranje-geel verkeerslichten bevestigd op een steun, teneinde de weggebruiker te waarschuwen."	""	"Knipperlantaarn"	"Een lantaarn bestaande uit één of meerdere knipperende oranje-geel verkeerslichten bevestigd op een steun, teneinde de weggebruiker te waarschuwen."	""	""	"true"	"https://wegenenverkeer.data.vlaanderen.be/ns/onderdeel#"	"Knipperlantaarn"	"http://www.w3.org/2000/01/rdf-schema#Class"	""	""	"https://wegenenverkeer.data.vlaanderen.be/ns/abstracten#Seinlantaarn"	""	""
"CLASS"	"OSLO-Onderdeel"	"RetroreflecterendVerkeersbord"	"{BADFBCD5-2049-415c-8C1B-ABF1F7EDC492}"	"Verkeersbord"	""	""	""	"Retroreflecterend verkeersbord"	"Verkeersbord met op het beeldvlak een tekening en/of tekst die worden weergegeven met een geëigend bekledingsmateriaal."	""	"Retroreflecterend verkeersbord"	"Verkeersbord met op het beeldvlak een tekening en/of tekst die worden weergegeven met een geëigend bekledingsmateriaal."	""	""	"true"	"https://wegenenverkeer.data.vlaanderen.be/ns/onderdeel#"	"RetroreflecterendVerkeersbord"	"http://www.w3.org/2000/01/rdf-schema#Class"	""	""	"https://wegenenverkeer.data.vlaanderen.be/ns/implementatieelement#AIMObject, https://wegenenverkeer.data.vlaanderen.be/ns/abstracten#Verkeersbord"	""	""
"CLASS"	"OSLO-Onderdeel"	"RechteSteun"	"{C973E78C-8683-4778-B1E2-FACE450CC6DB}"	""	""	""	""	"Rechte steun"	"Rechte paal voor het steun geven aan allerlei installaties. Dit omvat het volledige draagsysteem, zijnde de logische samenstelling van met elkaar verbonden onderdelen, bestemd voor het geven van mechanische sterkte en stabiliteit aan de installatie voor wegsignalering.
Afhankelijk van het gekozen model kan de rechte steun bestemd zijn voor: verkeerslichten (A-paal, D-paal en zwanenhals), variabele zone 30, bi-flash of andere installaties."	""	"Rechte steun"	"Rechte paal voor het steun geven aan allerlei installaties. Dit omvat het volledige draagsysteem, zijnde de logische samenstelling van met elkaar verbonden onderdelen, bestemd voor het geven van mechanische sterkte en stabiliteit aan de installatie voor wegsignalering.
Afhankelijk van het gekozen model kan de rechte steun bestemd zijn voor: verkeerslichten (A-paal, D-paal en zwanenhals), variabele zone 30, bi-flash of andere installaties."	""	""	"true"	"https://wegenenverkeer.data.vlaanderen.be/ns/onderdeel#"	"RechteSteun"	"http://www.w3.org/2000/01/rdf-schema#Class"	""	""	"https://wegenenverkeer.data.vlaanderen.be/ns/abstracten#VRIDraagconstructie"	""	""
"CLASS"	"OSLO-Abstracten"	"SoftwareToegang"	"{7E20EC09-A2A2-4c6f-B816-FE265A38B393}"	""	""	""	""	"Software toegang"	"Een abstracte waarmee een object kan connecteren naar software, al dan niet door gebruik te maken van de logische poort."	""	"Software toegang"	"Een abstracte waarmee een object kan connecteren naar software, al dan niet door gebruik te maken van de logische poort."	""	""	"true"	"https://wegenenverkeer.data.vlaanderen.be/ns/abstracten#"	"SoftwareToegang"	"http://www.w3.org/2000/01/rdf-schema#Class"	""	""	"https://wegenenverkeer.data.vlaanderen.be/ns/implementatieelement#AIMNaamObject"	""	""
"CLASS"	"OSLO-Onderdeel"	"Stroomkring"	"{F16C3FDF-8241-49d0-8159-A111054C6615}"	""	""	""	""	"Stroomkring"	"Ook wel vertrek of vertrekkende kabel genoemd. Afgezekerde elektrische geleiders waarmee de applicaties voorzien worden van de nodige voeding."	""	"Stroomkring"	"Ook wel vertrek of vertrekkende kabel genoemd. Afgezekerde elektrische geleiders waarmee de applicaties voorzien worden van de nodige voeding."	""	""	"true"	"https://wegenenverkeer.data.vlaanderen.be/ns/onderdeel#"	"Stroomkring"	"http://www.w3.org/2000/01/rdf-schema#Class"	""	""	"https://wegenenverkeer.data.vlaanderen.be/ns/implementatieelement#AIMNaamObject"	""	""
"CLASS"	"OSLO-Abstracten"	"Draagconstructie"	"{C1093B52-E90F-4b82-A3D3-DB7D8AAE1271}"	""	""	""	""	"Draagconstructie"	"Abstracte voor alle draagconstructies."	""	"Draagconstructie"	"Abstracte voor alle draagconstructies."	""	""	"true"	"https://wegenenverkeer.data.vlaanderen.be/ns/abstracten#"	"Draagconstructie"	"http://www.w3.org/2000/01/rdf-schema#Class"	""	""	""	""	""
"CLASS"	"OSLO-Onderdeel"	"DynBordZ30"	"{2DBA9F56-9737-4402-B442-14ADEC5DEFF2}"	"LEDBord"	""	""	""	"Dynamisch Zone-30 bord"	"Dynamisch verkeersbord dat verkeerstekens voor een zone 30 kan weergeven."	""	"Dynamisch Zone-30 bord"	"Dynamisch verkeersbord dat verkeerstekens voor een zone 30 kan weergeven."	""	""	"true"	"https://wegenenverkeer.data.vlaanderen.be/ns/onderdeel#"	"DynBordZ30"	"http://www.w3.org/2000/01/rdf-schema#Class"	""	""	"https://wegenenverkeer.data.vlaanderen.be/ns/abstracten#LEDBord"	""	""
"CLASS"	"OSLO-Onderdeel"	"Bevestigingsbeugel"	"{D74E2585-DC12-42d0-AA22-9A3F91C3F60F}"	""	""	""	""	"Bevestigingsbeugel"	"Verbindingsstuk waarmee een object kan vastgemaakt worden aan een steun of oppervlak."	""	"Bevestigingsbeugel"	"Verbindingsstuk waarmee een object kan vastgemaakt worden aan een steun of oppervlak."	""	""	"true"	"https://wegenenverkeer.data.vlaanderen.be/ns/onderdeel#"	"Bevestigingsbeugel"	"http://www.w3.org/2000/01/rdf-schema#Class"	""	""	"https://wegenenverkeer.data.vlaanderen.be/ns/implementatieelement#AIMNaamObject"	""	""
"CLASS"	"OSLO-Onderdeel"	"NetwerkModem"	"{AF204442-454E-4c65-A38E-88E90E319401}"	""	""	""	""	"Netwerkmodem"	"Een netwerkmodem legt een netwerkverbinding via een vast of mobiel telecomnetwerk; dit wordt enkel gebruikt bij het ontbreken van een netwerkswitch."	""	"Netwerkmodem"	"Een netwerkmodem legt een netwerkverbinding via een vast of mobiel telecomnetwerk; dit wordt enkel gebruikt bij het ontbreken van een netwerkswitch."	""	""	"true"	"https://wegenenverkeer.data.vlaanderen.be/ns/onderdeel#"	"NetwerkModem"	"http://www.w3.org/2000/01/rdf-schema#Class"	""	""	"https://wegenenverkeer.data.vlaanderen.be/ns/implementatieelement#AIMNaamObject"	""	""
"CLASS"	"OSLO-Abstracten"	"Behuizing"	"{E469FF22-9017-4ec5-A947-52822DE9317B}"	""	""	""	""	"Behuizing"	"Abstracte voor alle types van behuizing voor het beschermen van technieken."	""	"Behuizing"	"Abstracte voor alle types van behuizing voor het beschermen van technieken."	""	""	"true"	"https://wegenenverkeer.data.vlaanderen.be/ns/abstracten#"	"Behuizing"	"http://www.w3.org/2000/01/rdf-schema#Class"	""	""	"https://wegenenverkeer.data.vlaanderen.be/ns/implementatieelement#AIMNaamObject"	""	""
"CLASS"	"OSLO-Implementatieelement"	"AIMNaamObject"	"{D59E256E-CE07-4237-8AA7-1787263D9B99}"	""	""	""	""	"AIM naam object"	"Abstracte als de basisklasse voor elk OTL object dat benoemd wordt met een mensleesbare identificator."	""	"AIM naam object"	"Abstracte als de basisklasse voor elk OTL object dat benoemd wordt met een mensleesbare identificator."	""	""	"true"	"https://wegenenverkeer.data.vlaanderen.be/ns/implementatieelement#"	"AIMNaamObject"	"http://www.w3.org/2000/01/rdf-schema#Class"	""	""	"https://wegenenverkeer.data.vlaanderen.be/ns/implementatieelement#AIMObject"	""	""
"CLASS"	"OSLO-Implementatieelement"	"AIMObject"	"{1944BCBC-71F3-4d6b-BE2C-8277E513063B}"	""	""	""	""	"AIM object"	"Abstracte als de basisklasse voor alle uniek geïdentificeerde OTL objecten met de basiseigenschappen die elk OTL object minstens heeft."	""	"AIM object"	"Abstracte als de basisklasse voor alle uniek geïdentificeerde OTL objecten met de basiseigenschappen die elk OTL object minstens heeft."	""	""	"true"	"https://wegenenverkeer.data.vlaanderen.be/ns/implementatieelement#"	"AIMObject"	"http://www.w3.org/2000/01/rdf-schema#Class"	""	""	"https://wegenenverkeer.data.vlaanderen.be/ns/implementatieelement#AIMToestand, https://wegenenverkeer.data.vlaanderen.be/ns/implementatieelement#AIMDBStatus"	""	""
"CLASS"	"OSLO-Implementatieelement"	"AIMToestand"	"{EEA0572A-278A-4cc6-A34E-9AF9887001CE}"	""	""	""	""	"AIM Toestand"	"Voegt een attribuut toe aan de subklasse dat de huidige stand in de levenscyclus van het object aangeeft."	""	"AIM Toestand"	"Voegt een attribuut toe aan de subklasse dat de huidige stand in de levenscyclus van het object aangeeft."	""	""	"true"	"https://wegenenverkeer.data.vlaanderen.be/ns/implementatieelement#"	"AIMToestand"	"http://www.w3.org/2000/01/rdf-schema#Class"	""	""	""	""	""
"CLASS"	"OSLO-Implementatieelement"	"AIMDBStatus"	"{2624732D-993E-4201-8946-EFFD852BB979}"	""	""	""	""	"AIM databank status"	"Voegt een attribuut toe aan de subklasse dat aangeeft of de asset zichtbaar is in de databank of (zacht) verwijderd is."	""	"AIM databank status"	"Voegt een attribuut toe aan de subklasse dat aangeeft of de asset zichtbaar is in de databank of (zacht) verwijderd is."	""	""	"true"	"https://wegenenverkeer.data.vlaanderen.be/ns/implementatieelement#"	"AIMDBStatus"	"http://www.w3.org/2000/01/rdf-schema#Class"	""	""	""	""	""
"CLASS"	"OSLO-Abstracten"	"PU"	"{9423AEC3-7FAD-439a-960C-A19BC5DDE9D6}"	""	""	""	""	"PU"	"Abstracte klasse die allerhande stuureenheden groupeert (PLCs, controllers, etc.)."	""	"PU"	"Abstracte klasse die allerhande stuureenheden groupeert (PLCs, controllers, etc.)."	""	""	"true"	"https://wegenenverkeer.data.vlaanderen.be/ns/abstracten#"	"PU"	"http://www.w3.org/2000/01/rdf-schema#Class"	""	""	"https://wegenenverkeer.data.vlaanderen.be/ns/implementatieelement#AIMNaamObject"	""	""
"CLASS"	"OSLO-Abstracten"	"Buitenkast"	"{7C265C48-7FF9-432b-9E19-62FE0C0CC506}"	""	""	""	""	"Buitenkast"	"Abstracte voor kasten die typisch buiten staan en daarom bestand moeten zijn tegen de elementen en verfraaiing kunnen krijgen."	""	"Buitenkast"	"Abstracte voor kasten die typisch buiten staan en daarom bestand moeten zijn tegen de elementen en verfraaiing kunnen krijgen."	""	""	"true"	"https://wegenenverkeer.data.vlaanderen.be/ns/abstracten#"	"Buitenkast"	"http://www.w3.org/2000/01/rdf-schema#Class"	""	""	"https://wegenenverkeer.data.vlaanderen.be/ns/abstracten#Kast"	""	""
"CLASS"	"OSLO-Abstracten"	"Energiemeter"	"{4BE2E2B0-C4A7-426a-B7BB-6D145F8AC41F}"	""	""	""	""	"Energiemeter"	"Abstracte voor alle energiemeters."	""	"Energiemeter"	"Abstracte voor alle energiemeters."	""	""	"true"	"https://wegenenverkeer.data.vlaanderen.be/ns/abstracten#"	"Energiemeter"	"http://www.w3.org/2000/01/rdf-schema#Class"	""	""	"https://wegenenverkeer.data.vlaanderen.be/ns/implementatieelement#AIMNaamObject"	""	""
"CLASS"	"OSLO-Abstracten"	"DNB"	"{10780FA6-BAFA-4b40-9BA9-48553DA2B44A}"	""	""	""	""	"DNB"	"Een abstracte die de gegevens van de distributienetbeheerder bevat die bij een aansluiting horen."	""	"DNB"	"Een abstracte die de gegevens van de distributienetbeheerder bevat die bij een aansluiting horen."	""	""	"true"	"https://wegenenverkeer.data.vlaanderen.be/ns/abstracten#"	"DNB"	"http://www.w3.org/2000/01/rdf-schema#Class"	""	""	"https://wegenenverkeer.data.vlaanderen.be/ns/abstracten#Voedingspunt"	""	""
"CLASS"	"OSLO-Abstracten"	"Voedingspunt"	"{AEA5D7F2-A679-4388-B1BB-5E545F18DF3A}"	""	""	""	""	"Voedingspunt"	"Abstracte voor het aansluitpunt van de voeding."	""	"Voedingspunt"	"Abstracte voor het aansluitpunt van de voeding."	""	""	"true"	"https://wegenenverkeer.data.vlaanderen.be/ns/abstracten#"	"Voedingspunt"	"http://www.w3.org/2000/01/rdf-schema#Class"	""	""	"https://wegenenverkeer.data.vlaanderen.be/ns/implementatieelement#AIMNaamObject"	""	""
"CLASS"	"OSLO-Abstracten"	"EMDraagconstructie"	"{DC68A515-A623-423f-891B-34EAD1599AB8}"	""	""	""	""	"EM-draagconstructie"	"Abstracte voor een elektromechanisch (EM) dragend element (bv. paal, kolom, seinbrug, galgpaal) waaraan EM-toestellen bevestigd kunnen worden."	""	"EM-draagconstructie"	"Abstracte voor een elektromechanisch (EM) dragend element (bv. paal, kolom, seinbrug, galgpaal) waaraan EM-toestellen bevestigd kunnen worden."	""	""	"true"	"https://wegenenverkeer.data.vlaanderen.be/ns/abstracten#"	"EMDraagconstructie"	"http://www.w3.org/2000/01/rdf-schema#Class"	""	""	"https://wegenenverkeer.data.vlaanderen.be/ns/abstracten#Draagconstructie"	""	""
"CLASS"	"OSLO-Abstracten"	"VRIDraagconstructie"	"{A43B5DE6-5C6C-4063-B247-4509A5F20DCB}"	""	""	""	""	"Verkeersregelinstallatie draagconstructie"	"Abstracte voor een dragend element (bv. paal, kolom ) waaraan lantaarns met verkeerslichten bevestigd kunnen worden bij de verkeersregelinstallatie."	""	"Verkeersregelinstallatie draagconstructie"	"Abstracte voor een dragend element (bv. paal, kolom ) waaraan lantaarns met verkeerslichten bevestigd kunnen worden bij de verkeersregelinstallatie."	""	""	"true"	"https://wegenenverkeer.data.vlaanderen.be/ns/abstracten#"	"VRIDraagconstructie"	"http://www.w3.org/2000/01/rdf-schema#Class"	""	""	"https://wegenenverkeer.data.vlaanderen.be/ns/abstracten#SteunStandaard"	""	""
"DATATYPE"	"OSLO-Implementatieelement"	"DtcAfmetingBxlxhInMm"	"{F8BB44E1-1583-4e03-B656-7E52894DE726}"	""	""	""	""	"Afmeting bxlxh in millimeter"	"Complex datatype voor de afmeting van de breedte,de lengte en hoogte in millimeter."	""	"Afmeting bxlxh in millimeter"	"Complex datatype voor de afmeting van de breedte,de lengte en hoogte in millimeter."	""	""	"true"	"https://wegenenverkeer.data.vlaanderen.be/ns/implementatieelement#"	"DtcAfmetingBxlxhInMm"	"http://www.w3.org/2000/01/rdf-schema#Class"	""	""	""	""	""
"DATATYPE"	"OSLO-Implementatieelement"	"KwantWrdInMillimeter"	"{AE04A0C4-258A-4401-B823-305832B572AC}"	""	""	""	""	"Kwantitatieve waarde in millimeter"	"Een kwantitatieve waarde die een getal in millimeter uitdrukt."	""	"Kwantitatieve waarde in millimeter"	"Een kwantitatieve waarde die een getal in millimeter uitdrukt."	""	""	"true"	"https://wegenenverkeer.data.vlaanderen.be/ns/implementatieelement#"	"KwantWrdInMillimeter"	"http://www.w3.org/2000/01/rdf-schema#Class"	""	""	""	""	""
"DATATYPE"	"W3-RDF-Schema"	"Literal"	"{FBE7CE2F-907F-4558-A0CE-70C0A8A6AA32}"	""	""	""	""	"Literal"	"Beschrijft een constante."	"http://www.w3.org/2000/01/rdf-schema#Literal"	"Literal"	"Beschrijft een constante."	""	""	"true"	"http://www.w3.org/2000/01/rdf-schema#"	"Literal"	"http://www.w3.org/2000/01/rdf-schema#Class"	""	""	""	""	""
"DATATYPE"	"W3-XML-Schema"	"Decimal"	"{3300D9AD-B706-43fe-B750-0EB2D8679F90}"	""	""	""	""	"Decimaal getal"	"Beschrijft een decimaal getal volgens http://www.w3.org/2001/XMLSchema#decimal."	"https://www.w3.org/TR/xmlschema-2/#decimal"	"Decimaal getal"	"Beschrijft een decimaal getal volgens http://www.w3.org/2001/XMLSchema#decimal."	""	""	"true"	"http://www.w3.org/2001/XMLSchema#"	"decimal"	"http://www.w3.org/2000/01/rdf-schema#Class"	""	""	""	""	""
"DATATYPE"	"W3-XML-Schema"	"Boolean"	"{C66810D0-4F93-4948-83F5-165137DEBF82}"	""	""	""	""	"Boolean"	"Beschrijft een boolean volgens http://www.w3.org/2001/XMLSchema#boolean."	"https://www.w3.org/TR/xmlschema-2/#boolean"	"Boolean"	"Beschrijft een boolean volgens http://www.w3.org/2001/XMLSchema#boolean."	""	""	"true"	"http://www.w3.org/2001/XMLSchema#"	"boolean"	"http://www.w3.org/2000/01/rdf-schema#Class"	""	""	""	""	""
"DATATYPE"	"OSLO-Implementatieelement"	"DtcDocument"	"{441527E2-4B20-4bca-899E-9DC151A2A981}"	""	""	""	""	"Bestandsbijlage"	"Complex datatype voor alle bestandsbijlages."	""	"Bestandsbijlage"	"Complex datatype voor alle bestandsbijlages."	""	""	"true"	"https://wegenenverkeer.data.vlaanderen.be/ns/implementatieelement#"	"DtcDocument"	"http://www.w3.org/2000/01/rdf-schema#Class"	""	""	""	""	""
"DATATYPE"	"W3-XML-Schema"	"String"	"{9154C721-7D7C-4c11-8FBF-C56FAEF9A4DA}"	""	""	""	""	"String"	"Beschrijft een tekstregel volgens http://www.w3.org/2001/XMLSchema#string."	"https://www.w3.org/TR/xmlschema-2/#string"	"String"	"Beschrijft een tekstregel volgens http://www.w3.org/2001/XMLSchema#string."	""	""	"true"	"http://www.w3.org/2001/XMLSchema#"	"string"	"http://www.w3.org/2000/01/rdf-schema#Class"	""	""	""	""	""
