"EA-Type"	"EA-Package"	"EA-Name"	"EA-GUID"	"EA-Parent"	"EA-Domain"	"EA-Domain-GUID"	"EA-Range"	"label"	"definition"	"usage"	"ap-label-nl"	"ap-definition-nl"	"ap-usageNote-nl"	"ap-codelist"	"external term"	"namespace"	"localname"	"type"	"domain"	"range"	"parent"	"min card"	"max card"
"attribute"	"OSLO-Abstracten"	"afbeelding"	"{10D120C0-3E51-4917-9CAC-AABBB4AFD012}"	""	"Verkeersbord"	"{C1E19938-882F-4614-A16C-1F94A626E046}"	"DtcDocument"	"afbeelding"	"De afbeelding van het verkeersbord."	""	"afbeelding"	"De afbeelding van het verkeersbord."	""	""	"true"	"https://wegenenverkeer.data.vlaanderen.be/ns/abstracten#"	"Verkeersbord.afbeelding"	"http://www.w3.org/2002/07/owl#ObjectProperty"	"https://wegenenverkeer.data.vlaanderen.be/ns/abstracten#Verkeersbord"	"https://wegenenverkeer.data.vlaanderen.be/ns/implementatieelement#DtcDocument"	""	"0"	"*"
"attribute"	"OSLO-Abstracten"	"afmeting"	"{915FAA32-2BC6-4fd8-AC1E-C1F37710CB9D}"	""	"Verkeersbord"	"{C1E19938-882F-4614-A16C-1F94A626E046}"	"DtuAfmetingVerkeersbord"	"afmeting"	"De afmeting(en) van het verkeersbord."	""	"afmeting"	"De afmeting(en) van het verkeersbord."	""	""	"true"	"https://wegenenverkeer.data.vlaanderen.be/ns/abstracten#"	"Verkeersbord.afmeting"	"http://www.w3.org/2002/07/owl#ObjectProperty"	"https://wegenenverkeer.data.vlaanderen.be/ns/abstracten#Verkeersbord"	"https://wegenenverkeer.data.vlaanderen.be/ns/onderdeel#DtuAfmetingVerkeersbord"	""	"1"	"1"
"attribute"	"OSLO-Abstracten"	"fabricagevoorschrift"	"{AE190079-8B46-47bb-B098-EFFE2D1B253E}"	""	"Verkeersbord"	"{C1E19938-882F-4614-A16C-1F94A626E046}"	"String"	"fabricagevoorschrift"	"Het fabricagevoorschrift op het verkeersbord."	""	"fabricagevoorschrift"	"Het fabricagevoorschrift op het verkeersbord."	""	""	"true"	"https://wegenenverkeer.data.vlaanderen.be/ns/abstracten#"	"Verkeersbord.fabricagevoorschrift"	"http://www.w3.org/2002/07/owl#DatatypeProperty"	"https://wegenenverkeer.data.vlaanderen.be/ns/abstracten#Verkeersbord"	"http://www.w3.org/2001/XMLSchema#string"	""	"1"	"1"
"attribute"	"OSLO-Abstracten"	"operationeleStatus"	"{F66CAE98-0D4D-41d6-9721-FA7757AF0DBF}"	""	"Verkeersbord"	"{C1E19938-882F-4614-A16C-1F94A626E046}"	"KlOperationeleStatus"	"operationele status"	"De operationele status van het verkeersbord."	"Enkel te gebruiken wanneer een object 'in gebruik' is. Zie ook attribuut toestand overgeërfd van AIMToestand om de asset levenscyclus aan te duiden."	"operationele status"	"De operationele status van het verkeersbord."	""	""	"true"	"https://wegenenverkeer.data.vlaanderen.be/ns/abstracten#"	"Verkeersbord.operationeleStatus"	"http://www.w3.org/2002/07/owl#ObjectProperty"	"https://wegenenverkeer.data.vlaanderen.be/ns/abstracten#Verkeersbord"	"http://www.w3.org/2004/02/skos/core#Concept"	""	"1"	"1"
"attribute"	"OSLO-Abstracten"	"opstelhoogte"	"{98D63A2A-4F2D-4af9-B2E6-74D44A90C261}"	""	"Verkeersbord"	"{C1E19938-882F-4614-A16C-1F94A626E046}"	"KwantWrdInMeter"	"opstelhoogte"	"Afstand tussen het maaiveld en de onderrand van het bord."	""	"opstelhoogte"	"Afstand tussen het maaiveld en de onderrand van het bord."	""	""	"true"	"https://wegenenverkeer.data.vlaanderen.be/ns/abstracten#"	"Verkeersbord.opstelhoogte"	"http://www.w3.org/2002/07/owl#ObjectProperty"	"https://wegenenverkeer.data.vlaanderen.be/ns/abstracten#Verkeersbord"	"https://wegenenverkeer.data.vlaanderen.be/ns/implementatieelement#KwantWrdInMeter"	""	"1"	"1"
"attribute"	"OSLO-Onderdeel"	"elektrischSchema"	"{8D8A89D6-F48F-4c2b-AB61-00A896E33F87}"	""	"Wegkantkast"	"{1E3854F9-85CD-460f-A71B-F0DC5126B14A}"	"DtcDocument"	"elektrisch schema"	"Elektrisch aansluitschema van de kast."	""	"elektrisch schema"	"Elektrisch aansluitschema van de kast."	""	""	"true"	"https://wegenenverkeer.data.vlaanderen.be/ns/onderdeel#"	"Wegkantkast.elektrischSchema"	"http://www.w3.org/2002/07/owl#ObjectProperty"	"https://wegenenverkeer.data.vlaanderen.be/ns/onderdeel#Wegkantkast"	"https://wegenenverkeer.data.vlaanderen.be/ns/implementatieelement#DtcDocument"	""	"1"	"1"
"attribute"	"OSLO-Onderdeel"	"heeftMaaibescherming"	"{26E2E45C-FA96-43d4-9514-F5F1BFE21C4B}"	""	"Wegkantkast"	"{1E3854F9-85CD-460f-A71B-F0DC5126B14A}"	"Boolean"	"heeft maaibescherming"	"Geeft aan of de kast voorzien is van bescherming tegen schade bij het maaien van de omgeving rond de kast."	""	"heeft maaibescherming"	"Geeft aan of de kast voorzien is van bescherming tegen schade bij het maaien van de omgeving rond de kast."	""	""	"true"	"https://wegenenverkeer.data.vlaanderen.be/ns/onderdeel#"	"Wegkantkast.heeftMaaibescherming"	"http://www.w3.org/2002/07/owl#DatatypeProperty"	"https://wegenenverkeer.data.vlaanderen.be/ns/onderdeel#Wegkantkast"	"http://www.w3.org/2001/XMLSchema#boolean"	""	"1"	"1"
"attribute"	"OSLO-Onderdeel"	"mplan"	"{C8C927E2-0035-4d9c-AA9B-989DB8B98041}"	""	"Wegkantkast"	"{1E3854F9-85CD-460f-A71B-F0DC5126B14A}"	"DtcDocument"	"m-plan"	"Mechanisch plan van de volledige installatie. Er wordt één plan toegevoegd per installatie/techniek die op de kast is aangesloten."	"Bestanden van het type dwg of pdf."	"m-plan"	"Mechanisch plan van de volledige installatie. Er wordt één plan toegevoegd per installatie/techniek die op de kast is aangesloten."	""	""	"true"	"https://wegenenverkeer.data.vlaanderen.be/ns/onderdeel#"	"Wegkantkast.mplan"	"http://www.w3.org/2002/07/owl#ObjectProperty"	"https://wegenenverkeer.data.vlaanderen.be/ns/onderdeel#Wegkantkast"	"https://wegenenverkeer.data.vlaanderen.be/ns/implementatieelement#DtcDocument"	""	"1"	"*"
"attribute"	"OSLO-Onderdeel"	"type"	"{2F2F2170-5A55-4ae3-838F-F4549FC5092E}"	""	"Wegkantkast"	"{1E3854F9-85CD-460f-A71B-F0DC5126B14A}"	"KlWegkantkastType"	"type"	"Type van de wegkantkast volgens de gangbare types."	""	"type"	"Type van de wegkantkast volgens de gangbare types."	""	""	"true"	"https://wegenenverkeer.data.vlaanderen.be/ns/onderdeel#"	"Wegkantkast.type"	"http://www.w3.org/2002/07/owl#ObjectProperty"	"https://wegenenverkeer.data.vlaanderen.be/ns/onderdeel#Wegkantkast"	"http://www.w3.org/2004/02/skos/core#Concept"	""	"1"	"1"
"attribute"	"OSLO-Onderdeel"	"eplanMechanischPlan"	"{351FF143-FFB6-4e58-9B5C-05F0C666A152}"	""	"Montagekast"	"{414E29D7-8BC4-4306-A670-4D62E071D768}"	"DtcDocument"	"e-plan en m-plan"	"Elektrisch aansluitschema van de kast en mechanisch plan van de volledige installatie in de kast."	"Bestanden van het type dwg."	"e-plan en m-plan"	"Elektrisch aansluitschema van de kast en mechanisch plan van de volledige installatie in de kast."	""	""	"true"	"https://wegenenverkeer.data.vlaanderen.be/ns/onderdeel#"	"Montagekast.eplanMechanischPlan"	"http://www.w3.org/2002/07/owl#ObjectProperty"	"https://wegenenverkeer.data.vlaanderen.be/ns/onderdeel#Montagekast"	"https://wegenenverkeer.data.vlaanderen.be/ns/implementatieelement#DtcDocument"	""	"1"	"1"
"attribute"	"OSLO-Abstracten"	"meteropnameFrequentie"	"{786FDE85-8AA4-4ba0-BD02-4DDB55EC4BC6}"	""	"DNBMeter"	"{9AFBE94E-93CD-4116-AEAE-FCFB37B231AE}"	"KlEnergiemeterDNBMeteropnameFrequentie"	"meteropname frequentie"	"Frequentie waarmee de meterstand opgenomen wordt door de netbeheerder."	""	"meteropname frequentie"	"Frequentie waarmee de meterstand opgenomen wordt door de netbeheerder."	""	""	"true"	"https://wegenenverkeer.data.vlaanderen.be/ns/abstracten#"	"DNBMeter.meteropnameFrequentie"	"http://www.w3.org/2002/07/owl#ObjectProperty"	"https://wegenenverkeer.data.vlaanderen.be/ns/abstracten#DNBMeter"	"http://www.w3.org/2004/02/skos/core#Concept"	""	"1"	"1"
"attribute"	"OSLO-Onderdeel"	"isGecombineerdeEnergiemeter"	"{0E2B2D92-C3A9-4b69-9544-2575936378CA}"	""	"EnergiemeterDNB"	"{6EF6B2FA-1630-4351-BD93-43F945B51FAE}"	"Boolean"	"is gecombineerde energiemeter"	"Geeft aan of de meter naast de gewone verbruiksmeting ook reactief vermogen en piek metingen doet."	""	"is gecombineerde energiemeter"	"Geeft aan of de meter naast de gewone verbruiksmeting ook reactief vermogen en piek metingen doet."	""	""	"true"	"https://wegenenverkeer.data.vlaanderen.be/ns/onderdeel#"	"EnergiemeterDNB.isGecombineerdeEnergiemeter"	"http://www.w3.org/2002/07/owl#DatatypeProperty"	"https://wegenenverkeer.data.vlaanderen.be/ns/onderdeel#EnergiemeterDNB"	"http://www.w3.org/2001/XMLSchema#boolean"	""	"1"	"1"
"attribute"	"OSLO-Onderdeel"	"uurtarief"	"{A9A3607E-01D4-4b2a-90C1-331BBE23C6A9}"	""	"EnergiemeterDNB"	"{6EF6B2FA-1630-4351-BD93-43F945B51FAE}"	"KlEnergiemeterDNBUurtarief"	"uurtarief"	"Type uurtarief vb enkelvoudig, dubbelvoudig,..."	""	"uurtarief"	"Type uurtarief vb enkelvoudig, dubbelvoudig,..."	""	""	"true"	"https://wegenenverkeer.data.vlaanderen.be/ns/onderdeel#"	"EnergiemeterDNB.uurtarief"	"http://www.w3.org/2002/07/owl#ObjectProperty"	"https://wegenenverkeer.data.vlaanderen.be/ns/onderdeel#EnergiemeterDNB"	"http://www.w3.org/2004/02/skos/core#Concept"	""	"1"	"1"
"attribute"	"OSLO-Abstracten"	"beschermlaag"	"{55DBC56B-19CE-492d-8644-61B4C56209AE}"	""	"SteunStandaard"	"{D37D818D-FF1B-4e19-9E99-6D41A167325C}"	"KlDraagConstrBeschermlaag"	"beschermlaag"	"Type bescherming van de steun, bv. geschilderd of gegalvaniseerd."	""	"beschermlaag"	"Type bescherming van de steun, bv. geschilderd of gegalvaniseerd."	""	""	"true"	"https://wegenenverkeer.data.vlaanderen.be/ns/abstracten#"	"SteunStandaard.beschermlaag"	"http://www.w3.org/2002/07/owl#ObjectProperty"	"https://wegenenverkeer.data.vlaanderen.be/ns/abstracten#SteunStandaard"	"http://www.w3.org/2004/02/skos/core#Concept"	""	"1"	"1"
"attribute"	"OSLO-Abstracten"	"bijzonderTransport"	"{C079DAE9-8C05-4746-A9CD-F5BDDC074B61}"	""	"SteunStandaard"	"{D37D818D-FF1B-4e19-9E99-6D41A167325C}"	"KlDraagConstrBijzondertransport"	"bijzonder transport"	"Wijze waarop het object eventueel geschikt is om bijzonder transport mogelijk te maken."	""	"bijzonder transport"	"Wijze waarop het object eventueel geschikt is om bijzonder transport mogelijk te maken."	""	""	"true"	"https://wegenenverkeer.data.vlaanderen.be/ns/abstracten#"	"SteunStandaard.bijzonderTransport"	"http://www.w3.org/2002/07/owl#ObjectProperty"	"https://wegenenverkeer.data.vlaanderen.be/ns/abstracten#SteunStandaard"	"http://www.w3.org/2004/02/skos/core#Concept"	""	"1"	"1"
"attribute"	"OSLO-Abstracten"	"fabrikant"	"{97EF3339-B589-42bf-A0EE-B3AE0A481CD8}"	""	"SteunStandaard"	"{D37D818D-FF1B-4e19-9E99-6D41A167325C}"	"String"	"fabrikant"	"De fabrikant van de steun."	""	"fabrikant"	"De fabrikant van de steun."	""	""	"true"	"https://wegenenverkeer.data.vlaanderen.be/ns/abstracten#"	"SteunStandaard.fabrikant"	"http://www.w3.org/2002/07/owl#DatatypeProperty"	"https://wegenenverkeer.data.vlaanderen.be/ns/abstracten#SteunStandaard"	"http://www.w3.org/2001/XMLSchema#string"	""	"1"	"1"
"attribute"	"OSLO-Abstracten"	"hoogteBovenkant"	"{FF902AF1-5425-44a7-B16F-CDE9CC73287C}"	""	"SteunStandaard"	"{D37D818D-FF1B-4e19-9E99-6D41A167325C}"	"KwantWrdInMeter"	"hoogte bovenkant"	"Hoogte (in meter) van de bovenkant van de steun."	""	"hoogte bovenkant"	"Hoogte (in meter) van de bovenkant van de steun."	""	""	"true"	"https://wegenenverkeer.data.vlaanderen.be/ns/abstracten#"	"SteunStandaard.hoogteBovenkant"	"http://www.w3.org/2002/07/owl#ObjectProperty"	"https://wegenenverkeer.data.vlaanderen.be/ns/abstracten#SteunStandaard"	"https://wegenenverkeer.data.vlaanderen.be/ns/implementatieelement#KwantWrdInMeter"	""	"1"	"1"
"attribute"	"OSLO-Abstracten"	"kleur"	"{02626541-99D2-46a2-AE57-E5D605D23F13}"	""	"SteunStandaard"	"{D37D818D-FF1B-4e19-9E99-6D41A167325C}"	"DteKleurRAL"	"kleur"	"De RAL kleur van het uitwendig zichtbare gedeelte."	""	"kleur"	"De RAL kleur van het uitwendig zichtbare gedeelte."	""	""	"true"	"https://wegenenverkeer.data.vlaanderen.be/ns/abstracten#"	"SteunStandaard.kleur"	"http://www.w3.org/2002/07/owl#ObjectProperty"	"https://wegenenverkeer.data.vlaanderen.be/ns/abstracten#SteunStandaard"	"https://wegenenverkeer.data.vlaanderen.be/ns/implementatieelement#DteKleurRAL"	""	"1"	"1"
"attribute"	"OSLO-Abstracten"	"diameter"	"{84081018-1CA0-4edb-A352-977F87347DA6}"	""	"Seinlantaarn"	"{56896F26-FA73-4923-982E-A14E75EEA01C}"	"KlSeinlantaarnDiameter"	"diameter"	"Diameter (in mm) van de lens van de verkeerslichten waaruit de lantaarn is samengesteld."	""	"diameter"	"Diameter (in mm) van de lens van de verkeerslichten waaruit de lantaarn is samengesteld."	""	""	"true"	"https://wegenenverkeer.data.vlaanderen.be/ns/abstracten#"	"Seinlantaarn.diameter"	"http://www.w3.org/2002/07/owl#ObjectProperty"	"https://wegenenverkeer.data.vlaanderen.be/ns/abstracten#Seinlantaarn"	"http://www.w3.org/2004/02/skos/core#Concept"	""	"1"	"1"
"attribute"	"OSLO-Abstracten"	"heeftContrastscherm"	"{33DFB15F-98C4-4e21-B2D4-D96EC4D65774}"	""	"Seinlantaarn"	"{56896F26-FA73-4923-982E-A14E75EEA01C}"	"Boolean"	"heeft contrastscherm aanwezig"	"Aanduiding of er een contrastscherm aanwezig is op de lantaarn."	""	"heeft contrastscherm aanwezig"	"Aanduiding of er een contrastscherm aanwezig is op de lantaarn."	""	""	"true"	"https://wegenenverkeer.data.vlaanderen.be/ns/abstracten#"	"Seinlantaarn.heeftContrastscherm"	"http://www.w3.org/2002/07/owl#DatatypeProperty"	"https://wegenenverkeer.data.vlaanderen.be/ns/abstracten#Seinlantaarn"	"http://www.w3.org/2001/XMLSchema#boolean"	""	"1"	"1"
"attribute"	"OSLO-Abstracten"	"merk"	"{F7F70DF3-23F8-411a-A813-C0649485C044}"	""	"Seinlantaarn"	"{56896F26-FA73-4923-982E-A14E75EEA01C}"	"KlSeinlantaarnMerk"	"merk"	"Het merk van een de seinlantaarn."	""	"merk"	"Het merk van een de seinlantaarn."	""	""	"true"	"https://wegenenverkeer.data.vlaanderen.be/ns/abstracten#"	"Seinlantaarn.merk"	"http://www.w3.org/2002/07/owl#ObjectProperty"	"https://wegenenverkeer.data.vlaanderen.be/ns/abstracten#Seinlantaarn"	"http://www.w3.org/2004/02/skos/core#Concept"	""	"1"	"1"
"attribute"	"OSLO-Abstracten"	"modelnaam"	"{66315460-2B5E-454f-9ED6-D22C6E818CA6}"	""	"Seinlantaarn"	"{56896F26-FA73-4923-982E-A14E75EEA01C}"	"KlSeinlantaarnModelnaam"	"modelnaam"	"De modelnaam/product range van de seinlantaarn."	""	"modelnaam"	"De modelnaam/product range van de seinlantaarn."	""	""	"true"	"https://wegenenverkeer.data.vlaanderen.be/ns/abstracten#"	"Seinlantaarn.modelnaam"	"http://www.w3.org/2002/07/owl#ObjectProperty"	"https://wegenenverkeer.data.vlaanderen.be/ns/abstracten#Seinlantaarn"	"http://www.w3.org/2004/02/skos/core#Concept"	""	"1"	"1"
"attribute"	"OSLO-Abstracten"	"vormgeving"	"{6032931E-EE5F-4e43-87A3-DDCF699D94DC}"	""	"Seinlantaarn"	"{56896F26-FA73-4923-982E-A14E75EEA01C}"	"KlLantaarnVormgeving"	"vormgeving"	"Type vormgeving van de seinlantaarn."	""	"vormgeving"	"Type vormgeving van de seinlantaarn."	""	""	"true"	"https://wegenenverkeer.data.vlaanderen.be/ns/abstracten#"	"Seinlantaarn.vormgeving"	"http://www.w3.org/2002/07/owl#ObjectProperty"	"https://wegenenverkeer.data.vlaanderen.be/ns/abstracten#Seinlantaarn"	"http://www.w3.org/2004/02/skos/core#Concept"	""	"1"	"1"
"attribute"	"OSLO-Onderdeel"	"afwerkingsgraad"	"{EB2A145B-AE24-4a73-97A3-9A7DEE05DEE4}"	""	"RetroreflecterendVerkeersbord"	"{BADFBCD5-2049-415c-8C1B-ABF1F7EDC492}"	"KlRetroreflecterendVerkeersbordAfwerkingsgraad"	"afwerkingsgraad"	"De afwerkingsgraad van het retroreflecterend verkeersbord, volgens een keuzelijst op basis van SB250."	""	"afwerkingsgraad"	"De afwerkingsgraad van het retroreflecterend verkeersbord, volgens een keuzelijst op basis van SB250."	""	""	"true"	"https://wegenenverkeer.data.vlaanderen.be/ns/onderdeel#"	"RetroreflecterendVerkeersbord.afwerkingsgraad"	"http://www.w3.org/2002/07/owl#ObjectProperty"	"https://wegenenverkeer.data.vlaanderen.be/ns/onderdeel#RetroreflecterendVerkeersbord"	"http://www.w3.org/2004/02/skos/core#Concept"	""	"1"	"1"
"attribute"	"OSLO-Onderdeel"	"grootteorde"	"{8C358B1C-941D-4830-843A-7F079A0018D8}"	""	"RetroreflecterendVerkeersbord"	"{BADFBCD5-2049-415c-8C1B-ABF1F7EDC492}"	"KlRetroreflecterendVerkeersbordGrootteorde"	"grootteorde"	"De classificatie naar grootteorde van het verkeersbord, zoals gedefinieerd in SB250 hoofdstuk 10."	""	"grootteorde"	"De classificatie naar grootteorde van het verkeersbord, zoals gedefinieerd in SB250 hoofdstuk 10."	""	""	"true"	"https://wegenenverkeer.data.vlaanderen.be/ns/onderdeel#"	"RetroreflecterendVerkeersbord.grootteorde"	"http://www.w3.org/2002/07/owl#ObjectProperty"	"https://wegenenverkeer.data.vlaanderen.be/ns/onderdeel#RetroreflecterendVerkeersbord"	"http://www.w3.org/2004/02/skos/core#Concept"	""	"0"	"1"
"attribute"	"OSLO-Onderdeel"	"kleurAchterkant"	"{8BC0E5C7-E8FF-4e71-BDC2-EC375353CB15}"	""	"RetroreflecterendVerkeersbord"	"{BADFBCD5-2049-415c-8C1B-ABF1F7EDC492}"	"DteKleurRAL"	"kleur achterkant"	"De kleur van de achterkant van het retroreflecterend verkeersbord."	""	"kleur achterkant"	"De kleur van de achterkant van het retroreflecterend verkeersbord."	""	""	"true"	"https://wegenenverkeer.data.vlaanderen.be/ns/onderdeel#"	"RetroreflecterendVerkeersbord.kleurAchterkant"	"http://www.w3.org/2002/07/owl#ObjectProperty"	"https://wegenenverkeer.data.vlaanderen.be/ns/onderdeel#RetroreflecterendVerkeersbord"	"https://wegenenverkeer.data.vlaanderen.be/ns/implementatieelement#DteKleurRAL"	""	"1"	"1"
"attribute"	"OSLO-Onderdeel"	"merk"	"{01610C9C-967D-48d6-848B-1FFEAF8142DE}"	""	"RetroreflecterendVerkeersbord"	"{BADFBCD5-2049-415c-8C1B-ABF1F7EDC492}"	"KlRetroreflecterendVerkeersbordMerk"	"merk"	"De merknaam van het verkeersbord; duidt op de leverancier of producent van het verkeersbord."	"Te selecteren uit een keuzelijst."	"merk"	"De merknaam van het verkeersbord; duidt op de leverancier of producent van het verkeersbord."	""	""	"true"	"https://wegenenverkeer.data.vlaanderen.be/ns/onderdeel#"	"RetroreflecterendVerkeersbord.merk"	"http://www.w3.org/2002/07/owl#ObjectProperty"	"https://wegenenverkeer.data.vlaanderen.be/ns/onderdeel#RetroreflecterendVerkeersbord"	"http://www.w3.org/2004/02/skos/core#Concept"	""	"1"	"1"
"attribute"	"OSLO-Onderdeel"	"oppervlakte"	"{646D2A4D-E4C7-4872-833D-02B33E6B12ED}"	""	"RetroreflecterendVerkeersbord"	"{BADFBCD5-2049-415c-8C1B-ABF1F7EDC492}"	"KwantWrdInVierkanteMeter"	"oppervlakte"	"De oppervlakte van het beeldvlak van een verkeersbord."	""	"oppervlakte"	"De oppervlakte van het beeldvlak van een verkeersbord."	""	""	"true"	"https://wegenenverkeer.data.vlaanderen.be/ns/onderdeel#"	"RetroreflecterendVerkeersbord.oppervlakte"	"http://www.w3.org/2002/07/owl#ObjectProperty"	"https://wegenenverkeer.data.vlaanderen.be/ns/onderdeel#RetroreflecterendVerkeersbord"	"https://wegenenverkeer.data.vlaanderen.be/ns/implementatieelement#KwantWrdInVierkanteMeter"	""	"0"	"1"
"attribute"	"OSLO-Onderdeel"	"type"	"{F5546AE9-C74B-4f17-BAF8-68F817431CFD}"	""	"RechteSteun"	"{C973E78C-8683-4778-B1E2-FACE450CC6DB}"	"KlRechteSteunType"	"type"	"Het type verwijst naar de aanpassingen die gebeuren wanneer een andere techniek gebruik maakt van de rechte steun. Meestal gaat dit over een aanpassing in de lengte van het verjongde deel van de rechte steun."	""	"type"	"Het type verwijst naar de aanpassingen die gebeuren wanneer een andere techniek gebruik maakt van de rechte steun. Meestal gaat dit over een aanpassing in de lengte van het verjongde deel van de rechte steun."	""	""	"true"	"https://wegenenverkeer.data.vlaanderen.be/ns/onderdeel#"	"RechteSteun.type"	"http://www.w3.org/2002/07/owl#ObjectProperty"	"https://wegenenverkeer.data.vlaanderen.be/ns/onderdeel#RechteSteun"	"http://www.w3.org/2004/02/skos/core#Concept"	""	"1"	"1"
"attribute"	"OSLO-Onderdeel"	"stroomkringnummer"	"{EAEA7953-1A89-430e-A04C-46A7462C4CF4}"	""	"Stroomkring"	"{F16C3FDF-8241-49d0-8159-A111054C6615}"	"String"	"stroomkringnummer"	"De identificatie van de stroomkring."	""	"stroomkringnummer"	"De identificatie van de stroomkring."	""	""	"true"	"https://wegenenverkeer.data.vlaanderen.be/ns/onderdeel#"	"Stroomkring.stroomkringnummer"	"http://www.w3.org/2002/07/owl#DatatypeProperty"	"https://wegenenverkeer.data.vlaanderen.be/ns/onderdeel#Stroomkring"	"http://www.w3.org/2001/XMLSchema#string"	""	"1"	"1"
"attribute"	"OSLO-Onderdeel"	"merk"	"{D48B44BD-0287-4a76-AC31-97442CD1FE63}"	""	"DynBordZ30"	"{2DBA9F56-9737-4402-B442-14ADEC5DEFF2}"	"KlDynBordZ30Merk"	"merk"	"Merk van het dynamisch zone-30 bord."	""	"merk"	"Merk van het dynamisch zone-30 bord."	""	""	"true"	"https://wegenenverkeer.data.vlaanderen.be/ns/onderdeel#"	"DynBordZ30.merk"	"http://www.w3.org/2002/07/owl#ObjectProperty"	"https://wegenenverkeer.data.vlaanderen.be/ns/onderdeel#DynBordZ30"	"http://www.w3.org/2004/02/skos/core#Concept"	""	"1"	"1"
"attribute"	"OSLO-Onderdeel"	"modelnaam"	"{275F9441-C4E5-4986-83CC-D987147EC482}"	""	"DynBordZ30"	"{2DBA9F56-9737-4402-B442-14ADEC5DEFF2}"	"KlDynBordZ30Modelnaam"	"modelnaam"	"De modelnaam van het Z30-bord."	""	"modelnaam"	"De modelnaam van het Z30-bord."	""	""	"true"	"https://wegenenverkeer.data.vlaanderen.be/ns/onderdeel#"	"DynBordZ30.modelnaam"	"http://www.w3.org/2002/07/owl#ObjectProperty"	"https://wegenenverkeer.data.vlaanderen.be/ns/onderdeel#DynBordZ30"	"http://www.w3.org/2004/02/skos/core#Concept"	""	"1"	"1"
"attribute"	"OSLO-Onderdeel"	"berekeningsnota"	"{5FA183E5-4A99-4b7f-89E1-87EB8DECE27D}"	""	"Bevestigingsbeugel"	"{D74E2585-DC12-42d0-AA22-9A3F91C3F60F}"	"DtcDocument"	"berekeningsnota"	"Document met de berekeningsnota van de bevestigingsbeugel."	"Bestanden van het type xlsx of pdf."	"berekeningsnota"	"Document met de berekeningsnota van de bevestigingsbeugel."	""	""	"true"	"https://wegenenverkeer.data.vlaanderen.be/ns/onderdeel#"	"Bevestigingsbeugel.berekeningsnota"	"http://www.w3.org/2002/07/owl#ObjectProperty"	"https://wegenenverkeer.data.vlaanderen.be/ns/onderdeel#Bevestigingsbeugel"	"https://wegenenverkeer.data.vlaanderen.be/ns/implementatieelement#DtcDocument"	""	"1"	"*"
"attribute"	"OSLO-Onderdeel"	"constructieEnMontageplan"	"{68EE6D12-9DDD-41fd-8C5F-CA0D748260FA}"	""	"Bevestigingsbeugel"	"{D74E2585-DC12-42d0-AA22-9A3F91C3F60F}"	"DtcDocument"	"constructie en montageplan"	"Document met het constructie- en montageplan van de bevestigingsbeugel."	"Bestanden van het type dwg of pdf."	"constructie en montageplan"	"Document met het constructie- en montageplan van de bevestigingsbeugel."	""	""	"true"	"https://wegenenverkeer.data.vlaanderen.be/ns/onderdeel#"	"Bevestigingsbeugel.constructieEnMontageplan"	"http://www.w3.org/2002/07/owl#ObjectProperty"	"https://wegenenverkeer.data.vlaanderen.be/ns/onderdeel#Bevestigingsbeugel"	"https://wegenenverkeer.data.vlaanderen.be/ns/implementatieelement#DtcDocument"	""	"1"	"*"
"attribute"	"OSLO-Onderdeel"	"isVerzegeld"	"{0089DC4E-FECB-4c63-9BE4-45B2563C930B}"	""	"Bevestigingsbeugel"	"{D74E2585-DC12-42d0-AA22-9A3F91C3F60F}"	"Boolean"	"is verzegeld"	"Geeft aan of de bevestigingsbeugel verzegeld is tegen het ongemerkt losmaken ervan."	""	"is verzegeld"	"Geeft aan of de bevestigingsbeugel verzegeld is tegen het ongemerkt losmaken ervan."	""	""	"true"	"https://wegenenverkeer.data.vlaanderen.be/ns/onderdeel#"	"Bevestigingsbeugel.isVerzegeld"	"http://www.w3.org/2002/07/owl#DatatypeProperty"	"https://wegenenverkeer.data.vlaanderen.be/ns/onderdeel#Bevestigingsbeugel"	"http://www.w3.org/2001/XMLSchema#boolean"	""	"1"	"1"
"attribute"	"OSLO-Onderdeel"	"type"	"{9D33E154-BA84-4d89-AAA7-DEF55AE20AEF}"	""	"Bevestigingsbeugel"	"{D74E2585-DC12-42d0-AA22-9A3F91C3F60F}"	"KlBevestigingsbeugelType"	"type"	"Het type van de bevestigingsbeugel."	""	"type"	"Het type van de bevestigingsbeugel."	""	""	"true"	"https://wegenenverkeer.data.vlaanderen.be/ns/onderdeel#"	"Bevestigingsbeugel.type"	"http://www.w3.org/2002/07/owl#ObjectProperty"	"https://wegenenverkeer.data.vlaanderen.be/ns/onderdeel#Bevestigingsbeugel"	"http://www.w3.org/2004/02/skos/core#Concept"	""	"1"	"1"
"attribute"	"OSLO-Onderdeel"	"ipAdres"	"{94879BD1-DB62-4be7-9E4F-CB99055EBAC6}"	""	"NetwerkModem"	"{AF204442-454E-4c65-A38E-88E90E319401}"	"DteIPv4Adres"	"ip adres"	"IP-adres van de netwerkmodem."	""	"ip adres"	"IP-adres van de netwerkmodem."	""	""	"true"	"https://wegenenverkeer.data.vlaanderen.be/ns/onderdeel#"	"NetwerkModem.ipAdres"	"http://www.w3.org/2002/07/owl#ObjectProperty"	"https://wegenenverkeer.data.vlaanderen.be/ns/onderdeel#NetwerkModem"	"https://wegenenverkeer.data.vlaanderen.be/ns/implementatieelement#DteIPv4Adres"	""	"1"	"1"
"attribute"	"OSLO-Abstracten"	"adres"	"{CA841953-9898-4de4-8CCB-11473366403C}"	""	"Behuizing"	"{E469FF22-9017-4ec5-A947-52822DE9317B}"	"DtcAdres"	"adres"	"Adres (aanduiding van de locatie) van de behuizing. Indien deze geen adres heeft, wordt net zoals door Fluvius voor cabines, het adres van een nabijgelegen straat genomen."	""	"adres"	"Adres (aanduiding van de locatie) van de behuizing. Indien deze geen adres heeft, wordt net zoals door Fluvius voor cabines, het adres van een nabijgelegen straat genomen."	""	""	"true"	"https://wegenenverkeer.data.vlaanderen.be/ns/abstracten#"	"Behuizing.adres"	"http://www.w3.org/2002/07/owl#ObjectProperty"	"https://wegenenverkeer.data.vlaanderen.be/ns/abstracten#Behuizing"	"https://wegenenverkeer.data.vlaanderen.be/ns/implementatieelement#DtcAdres"	""	"1"	"1"
"attribute"	"OSLO-Implementatieelement"	"naam"	"{D38DAFC2-1A8A-4612-9A83-27D87EE844B6}"	""	"AIMNaamObject"	"{D59E256E-CE07-4237-8AA7-1787263D9B99}"	"String"	"naam"	"De mensleesbare naam van een asset zoals dit bv. ook terug te vinden is op een etiket op het object zelf. De assetbeheerder kent deze naam toe of geeft de opdracht om deze toe te kennen. Indien een object een algemeen gangbare naam heeft zoals bv. bij een waterloop dan wordt deze gebruikt."	""	"naam"	"De mensleesbare naam van een asset zoals dit bv. ook terug te vinden is op een etiket op het object zelf. De assetbeheerder kent deze naam toe of geeft de opdracht om deze toe te kennen. Indien een object een algemeen gangbare naam heeft zoals bv. bij een waterloop dan wordt deze gebruikt."	""	""	"true"	"https://wegenenverkeer.data.vlaanderen.be/ns/implementatieelement#"	"AIMNaamObject.naam"	"http://www.w3.org/2002/07/owl#DatatypeProperty"	"https://wegenenverkeer.data.vlaanderen.be/ns/implementatieelement#AIMNaamObject"	"http://www.w3.org/2001/XMLSchema#string"	""	"1"	"1"
