"EA-Type"	"EA-Package"	"EA-Name"	"EA-GUID"	"EA-Parent"	"EA-Domain"	"EA-Domain-GUID"	"EA-Range"	"label"	"definition"	"usage"	"ap-label-nl"	"ap-definition-nl"	"ap-usageNote-nl"	"ap-codelist"	"external term"	"namespace"	"localname"	"type"	"domain"	"range"	"parent"	"min card"	"max card"
"Package"	""	"OSLO-Rioleringsgroepering"	"{C29F45B4-2485-459b-8E5A-47DF4B80B2FB}"	""	""	""	""	""	""	""	""	""	""	""	""	"http://"	"fixme.com"	"http://www.w3.org/2002/07/owl#Ontology"	""	""	""	""	""
"CLASS"	"OSLO-Abstracten"	"WaterloopRelatie"	"{C81481D9-7417-48f8-A935-7605EF570082}"	""	""	""	""	"Waterloop relatie"	"Abstracte om de gemeenschappelijke relaties van de verschillende soorten waterlopen onder 1 noemer te houden."	""	"Waterloop relatie"	"Abstracte om de gemeenschappelijke relaties van de verschillende soorten waterlopen onder 1 noemer te houden."	""	""	"true"	"https://wegenenverkeer-test.data.vlaanderen.be/ns/abstracten#"	"WaterloopRelatie"	"http://www.w3.org/2000/01/rdf-schema#Class"	""	""	""	""	""
"CLASS"	"OSLO-Installatie"	"Riolering"	"{C1BC609F-3833-4730-B98C-81AF66ABBFE4}"	""	""	""	""	"Riolering"	"De groepering van de objecten die behoren tot de riolering."	""	"Riolering"	"De groepering van de objecten die behoren tot de riolering."	""	""	"true"	"https://wegenenverkeer-test.data.vlaanderen.be/ns/installatie#"	"Riolering"	"http://www.w3.org/2000/01/rdf-schema#Class"	""	""	""	""	""
"CLASS"	"OSLO-Abstracten"	"LinkendElement"	"{C21947AD-F6DC-4c97-8495-E1CF9D7DE221}"	""	""	""	""	"Linkend element"	"Abstracte bedoeld om alle eigenschappen en relaties van linkende elementen te groeperen. Linkende elementen zijn objecten die aansluiten op een buis."	""	"Linkend element"	"Abstracte bedoeld om alle eigenschappen en relaties van linkende elementen te groeperen. Linkende elementen zijn objecten die aansluiten op een buis."	""	""	"true"	"https://wegenenverkeer-test.data.vlaanderen.be/ns/abstracten#"	"LinkendElement"	"http://www.w3.org/2000/01/rdf-schema#Class"	""	""	""	""	""
"CLASS"	"OSLO-Abstracten"	"Buis"	"{71FC81DE-8AEC-4f3c-A5EB-409F128BB989}"	""	""	""	""	"Buis"	"Abstracte om de gemeenschappelijke eigenschappen en relaties van de verschillende soorten buizen onder één noemer te houden."	""	"Buis"	"Abstracte om de gemeenschappelijke eigenschappen en relaties van de verschillende soorten buizen onder één noemer te houden."	""	""	"true"	"https://wegenenverkeer-test.data.vlaanderen.be/ns/abstracten#"	"Buis"	"http://www.w3.org/2000/01/rdf-schema#Class"	""	""	""	""	""
"CLASS"	"OSLO-Abstracten"	"PutRelatie"	"{0DACE256-8500-4cfc-8C13-97A76763C968}"	""	""	""	""	"Put relatie"	"Abstracte om de relaties van de verschillende soorten putten te groeperen."	""	"Put relatie"	"Abstracte om de relaties van de verschillende soorten putten te groeperen."	""	""	"true"	"https://wegenenverkeer-test.data.vlaanderen.be/ns/abstracten#"	"PutRelatie"	"http://www.w3.org/2000/01/rdf-schema#Class"	""	""	""	""	""
"CLASS"	"OSLO-Onderdeel"	"HoortBij"	"{43B11E61-958D-4a8f-A983-3C012ACA45C0}"	""	""	""	""	"Hoort bij"	"De relatie geeft aan dat een onderdeel of collectie behoort bij, deel van of lid van een (andere) groep of collectie is."	""	"Hoort bij"	"De relatie geeft aan dat een onderdeel of collectie behoort bij, deel van of lid van een (andere) groep of collectie is."	""	""	"true"	"https://wegenenverkeer-test.data.vlaanderen.be/ns/Onderdeel#"	"HoortBij"	"http://www.w3.org/2000/01/rdf-schema#Class"	""	""	""	""	""
"CLASS"	"OSLO-Onderdeel"	"SluitAanOp"	"{81328BD8-BCDE-4489-A4CD-1D1011BEFC91}"	""	""	""	""	"Sluit aan op"	"Deze relatie geeft aan hoe 2 onderdelen in horizontale zin elkaar opvolgen. Dit wordt gebruikt om een topologische netwerk op te bouwen. Enkel in gebruik bij afschermende constructies en riolering/waterlopen. Deze relatie heeft steeds een richting van het opwaartse naar het afwaartse onderdeel."	""	"Sluit aan op"	"Deze relatie geeft aan hoe 2 onderdelen in horizontale zin elkaar opvolgen. Dit wordt gebruikt om een topologische netwerk op te bouwen. Enkel in gebruik bij afschermende constructies en riolering/waterlopen. Deze relatie heeft steeds een richting van het opwaartse naar het afwaartse onderdeel."	""	""	"true"	"https://wegenenverkeer-test.data.vlaanderen.be/ns/Onderdeel#"	"SluitAanOp"	"http://www.w3.org/2000/01/rdf-schema#Class"	""	""	""	""	""
"ENUMERATION"	"OSLO-Implementatieelement"	"KlAlgMimeType"	"{9BCD2B4C-9CAB-4988-A052-6C4B006D450A}"	""	""	""	""	"AlgMimeType"	"De mime types van bestanden (AWVDocument) beperkt tot mime types voor toegelaten bestandstypen."	""	"AlgMimeType"	"De mime types van bestanden (AWVDocument) beperkt tot mime types voor toegelaten bestandstypen."	""	"https://wegenenverkeer.data.vlaanderen.be/id/conceptscheme/AlgMimeType"	"true"	"http://www.w3.org/2004/02/skos/core#"	"Concept"	"http://www.w3.org/2000/01/rdf-schema#Class"	""	""	""	""	""
"ENUMERATION"	"OSLO-Onderdeel"	"KlRioleringEigenaar"	"{50600B04-30A3-48e8-BC28-F60408F29640}"	""	""	""	""	"Riolering eigenaar"	"Mogelijke eigenaars van de riolering."	""	"Riolering eigenaar"	"Mogelijke eigenaars van de riolering."	""	"https://wegenenverkeer.data.vlaanderen.be/id/conceptscheme/RioleringEigenaar"	"true"	"http://www.w3.org/2004/02/skos/core#"	"Concept"	"http://www.w3.org/2000/01/rdf-schema#Class"	""	""	""	""	""
"ENUMERATION"	"OSLO-Onderdeel"	"KlRioleringVorm"	"{ADF6CDE3-502C-46bb-9547-EC6E58655245}"	""	""	""	""	"Riolering vorm"	"Vormen van de riolering."	""	"Riolering vorm"	"Vormen van de riolering."	""	"https://wegenenverkeer.data.vlaanderen.be/id/conceptscheme/RioleringVorm"	"true"	"http://www.w3.org/2004/02/skos/core#"	"Concept"	"http://www.w3.org/2000/01/rdf-schema#Class"	""	""	""	""	""
"ENUMERATION"	"OSLO-Onderdeel"	"KlRioleringStelsel"	"{BBA34067-8DF0-4ed6-BFE9-17C59D33972C}"	""	""	""	""	"Riolering stelsel"	"Stelsels van de riool."	""	"Riolering stelsel"	"Stelsels van de riool."	""	"https://wegenenverkeer.data.vlaanderen.be/id/conceptscheme/RioleringStelsel"	"true"	"http://www.w3.org/2004/02/skos/core#"	"Concept"	"http://www.w3.org/2000/01/rdf-schema#Class"	""	""	""	""	""
"ENUMERATION"	"OSLO-Onderdeel"	"KlRioleringBeheerder"	"{FBFF58C4-5968-40ab-B070-5367BD5AB2B3}"	""	""	""	""	"Riolering beheerder"	"Mogelijke beheerders van de riolering."	""	"Riolering beheerder"	"Mogelijke beheerders van de riolering."	""	"https://wegenenverkeer.data.vlaanderen.be/id/conceptscheme/RioleringBeheerder"	"true"	"http://www.w3.org/2004/02/skos/core#"	"Concept"	"http://www.w3.org/2000/01/rdf-schema#Class"	""	""	""	""	""
"attribute"	"OSLO-Installatie"	"rioleringsbeheerder"	"{11349BD8-B2CD-40ed-B020-A0A3DCB4B421}"	""	"Riolering"	"{C1BC609F-3833-4730-B98C-81AF66ABBFE4}"	"KlRioleringBeheerder"	"rioleringsbeheerder"	"De beheerder van de rioleringsinfrastructuur."	""	"rioleringsbeheerder"	"De beheerder van de rioleringsinfrastructuur."	""	""	"true"	"https://wegenenverkeer-test.data.vlaanderen.be/ns/installatie#"	"Riolering.rioleringsbeheerder"	"http://www.w3.org/2002/07/owl#ObjectProperty"	"https://wegenenverkeer-test.data.vlaanderen.be/ns/installatie#Riolering"	"http://www.w3.org/2004/02/skos/core#Concept"	""	"1"	"1"
"attribute"	"OSLO-Installatie"	"rioleringseigenaar"	"{714AD159-3A0F-4a91-BF47-F7347592E2B7}"	""	"Riolering"	"{C1BC609F-3833-4730-B98C-81AF66ABBFE4}"	"KlRioleringEigenaar"	"rioleringseigenaar"	"De eigenaar van de rioleringsinfrastructuur zoals deze gekend is binnen AWIS 2.0."	""	"rioleringseigenaar"	"De eigenaar van de rioleringsinfrastructuur zoals deze gekend is binnen AWIS 2.0."	""	""	"true"	"https://wegenenverkeer-test.data.vlaanderen.be/ns/installatie#"	"Riolering.rioleringseigenaar"	"http://www.w3.org/2002/07/owl#ObjectProperty"	"https://wegenenverkeer-test.data.vlaanderen.be/ns/installatie#Riolering"	"http://www.w3.org/2004/02/skos/core#Concept"	""	"1"	"1"
"attribute"	"OSLO-Installatie"	"rioleringsstelsel"	"{CE7F8C01-6B75-4383-9667-91BCCA946440}"	""	"Riolering"	"{C1BC609F-3833-4730-B98C-81AF66ABBFE4}"	"KlRioleringStelsel"	"rioleringsstelsel"	"Geeft aan wat voor afvoerwater er door de riolering afgevoerd wordt."	""	"rioleringsstelsel"	"Geeft aan wat voor afvoerwater er door de riolering afgevoerd wordt."	""	""	"true"	"https://wegenenverkeer-test.data.vlaanderen.be/ns/installatie#"	"Riolering.rioleringsstelsel"	"http://www.w3.org/2002/07/owl#ObjectProperty"	"https://wegenenverkeer-test.data.vlaanderen.be/ns/installatie#Riolering"	"http://www.w3.org/2004/02/skos/core#Concept"	""	"1"	"1"
"attribute"	"OSLO-Abstracten"	"technischeFiche"	"{310BAEC8-42E9-4a15-87D8-7DCF2286AF8A}"	""	"LinkendElement"	"{C21947AD-F6DC-4c97-8495-E1CF9D7DE221}"	"DtcAWVDocument"	"technische fiche"	"De technische fiche van een linkend element."	""	"technische fiche"	"De technische fiche van een linkend element."	""	""	"true"	"https://wegenenverkeer-test.data.vlaanderen.be/ns/abstracten#"	"LinkendElement.technischeFiche"	"http://www.w3.org/2002/07/owl#ObjectProperty"	"https://wegenenverkeer-test.data.vlaanderen.be/ns/abstracten#LinkendElement"	"https://wegenenverkeer-test.data.vlaanderen.be/ns/implementatieelement#DtcAWVDocument"	""	"1"	"*"
"attribute"	"OSLO-Abstracten"	"bokAfwaarts"	"{C03A74B0-211E-475a-80A7-512B6EE869B2}"	""	"Buis"	"{71FC81DE-8AEC-4f3c-A5EB-409F128BB989}"	"KwantWrdInMeterTAW"	"bok afwaarts"	"Peil in meter-TAW van de vloei aan de afwaartse kant van de buis."	""	"bok afwaarts"	"Peil in meter-TAW van de vloei aan de afwaartse kant van de buis."	""	""	"true"	"https://wegenenverkeer-test.data.vlaanderen.be/ns/abstracten#"	"Buis.bokAfwaarts"	"http://www.w3.org/2002/07/owl#ObjectProperty"	"https://wegenenverkeer-test.data.vlaanderen.be/ns/abstracten#Buis"	"https://wegenenverkeer-test.data.vlaanderen.be/ns/implementatieelement#KwantWrdInMeterTAW"	""	"1"	"1"
"attribute"	"OSLO-Abstracten"	"bokOpwaarts"	"{6F7A411F-9E0F-476b-9096-AF555F4A7D4B}"	""	"Buis"	"{71FC81DE-8AEC-4f3c-A5EB-409F128BB989}"	"KwantWrdInMeterTAW"	"bok opwaarts"	"Peil in meter-TAW van de vloei aan de opwaartse kant van de buis."	""	"bok opwaarts"	"Peil in meter-TAW van de vloei aan de opwaartse kant van de buis."	""	""	"true"	"https://wegenenverkeer-test.data.vlaanderen.be/ns/abstracten#"	"Buis.bokOpwaarts"	"http://www.w3.org/2002/07/owl#ObjectProperty"	"https://wegenenverkeer-test.data.vlaanderen.be/ns/abstracten#Buis"	"https://wegenenverkeer-test.data.vlaanderen.be/ns/implementatieelement#KwantWrdInMeterTAW"	""	"1"	"1"
"attribute"	"OSLO-Abstracten"	"breedte"	"{5F80F989-1DF5-4a83-8E51-9AE4909685C8}"	""	"Buis"	"{71FC81DE-8AEC-4f3c-A5EB-409F128BB989}"	"KwantWrdInMillimeter"	"breedte"	"De breedte van de buis in millimeter."	""	"breedte"	"De breedte van de buis in millimeter."	""	""	"true"	"https://wegenenverkeer-test.data.vlaanderen.be/ns/abstracten#"	"Buis.breedte"	"http://www.w3.org/2002/07/owl#ObjectProperty"	"https://wegenenverkeer-test.data.vlaanderen.be/ns/abstracten#Buis"	"https://wegenenverkeer-test.data.vlaanderen.be/ns/implementatieelement#KwantWrdInMillimeter"	""	"1"	"1"
"attribute"	"OSLO-Abstracten"	"diepteAfwaarts"	"{19E9E981-2449-487d-A2C6-F6F5F98E3029}"	""	"Buis"	"{71FC81DE-8AEC-4f3c-A5EB-409F128BB989}"	"KwantWrdInMeter"	"diepte afwaarts"	"Diepte van de vloei aan de afwaartse kant van de buis tov de bovenkant van het deksel."	""	"diepte afwaarts"	"Diepte van de vloei aan de afwaartse kant van de buis tov de bovenkant van het deksel."	""	""	"true"	"https://wegenenverkeer-test.data.vlaanderen.be/ns/abstracten#"	"Buis.diepteAfwaarts"	"http://www.w3.org/2002/07/owl#ObjectProperty"	"https://wegenenverkeer-test.data.vlaanderen.be/ns/abstracten#Buis"	"https://wegenenverkeer-test.data.vlaanderen.be/ns/implementatieelement#KwantWrdInMeter"	""	"1"	"1"
"attribute"	"OSLO-Abstracten"	"diepteOpwaarts"	"{C73ADBA1-AB34-48f0-8210-F2ACD8326DCD}"	""	"Buis"	"{71FC81DE-8AEC-4f3c-A5EB-409F128BB989}"	"KwantWrdInMeter"	"diepte opwaarts"	"De diepte van de vloei aan de opwaartse kant van de buis tov de bovenkant van het deksel."	""	"diepte opwaarts"	"De diepte van de vloei aan de opwaartse kant van de buis tov de bovenkant van het deksel."	""	""	"true"	"https://wegenenverkeer-test.data.vlaanderen.be/ns/abstracten#"	"Buis.diepteOpwaarts"	"http://www.w3.org/2002/07/owl#ObjectProperty"	"https://wegenenverkeer-test.data.vlaanderen.be/ns/abstracten#Buis"	"https://wegenenverkeer-test.data.vlaanderen.be/ns/implementatieelement#KwantWrdInMeter"	""	"1"	"1"
"attribute"	"OSLO-Abstracten"	"helling"	"{48691ACA-9688-4656-B6C4-F6A509E835DE}"	""	"Buis"	"{71FC81DE-8AEC-4f3c-A5EB-409F128BB989}"	"KwantWrdInPromille"	"helling"	"De helling van de buis in de lengterichting, uitgedrukt in ."	""	"helling"	"De helling van de buis in de lengterichting, uitgedrukt in ."	""	""	"true"	"https://wegenenverkeer-test.data.vlaanderen.be/ns/abstracten#"	"Buis.helling"	"http://www.w3.org/2002/07/owl#ObjectProperty"	"https://wegenenverkeer-test.data.vlaanderen.be/ns/abstracten#Buis"	"https://wegenenverkeer-test.data.vlaanderen.be/ns/implementatieelement#KwantWrdInPromille"	""	"1"	"1"
"attribute"	"OSLO-Abstracten"	"hoogteBinnenzijde"	"{42B6E640-1EED-408f-BAD9-4E63A5CE0472}"	""	"Buis"	"{71FC81DE-8AEC-4f3c-A5EB-409F128BB989}"	"KwantWrdInMillimeter"	"hoogte binnenzijde"	"De hoogte van de binnenzijde van de buis in millimeter. Bij cirkelvormige buizen is dit de binnendiameter."	""	"hoogte binnenzijde"	"De hoogte van de binnenzijde van de buis in millimeter. Bij cirkelvormige buizen is dit de binnendiameter."	""	""	"true"	"https://wegenenverkeer-test.data.vlaanderen.be/ns/abstracten#"	"Buis.hoogteBinnenzijde"	"http://www.w3.org/2002/07/owl#ObjectProperty"	"https://wegenenverkeer-test.data.vlaanderen.be/ns/abstracten#Buis"	"https://wegenenverkeer-test.data.vlaanderen.be/ns/implementatieelement#KwantWrdInMillimeter"	""	"1"	"1"
"attribute"	"OSLO-Abstracten"	"hoogteBuitenzijde"	"{BF2ABF5B-7035-43ce-B139-1BCA9AB5171F}"	""	"Buis"	"{71FC81DE-8AEC-4f3c-A5EB-409F128BB989}"	"KwantWrdInMillimeter"	"hoogte buitenzijde"	"De hoogte van de buitenzijde van een buis in millimeter. Bij cirkelvormige buizen is dit de buitendiameter."	""	"hoogte buitenzijde"	"De hoogte van de buitenzijde van een buis in millimeter. Bij cirkelvormige buizen is dit de buitendiameter."	""	""	"true"	"https://wegenenverkeer-test.data.vlaanderen.be/ns/abstracten#"	"Buis.hoogteBuitenzijde"	"http://www.w3.org/2002/07/owl#ObjectProperty"	"https://wegenenverkeer-test.data.vlaanderen.be/ns/abstracten#Buis"	"https://wegenenverkeer-test.data.vlaanderen.be/ns/implementatieelement#KwantWrdInMillimeter"	""	"1"	"1"
"attribute"	"OSLO-Abstracten"	"isManToegankelijk"	"{48E6BF0D-9750-4f11-9A46-5811925819B5}"	""	"Buis"	"{71FC81DE-8AEC-4f3c-A5EB-409F128BB989}"	"Boolean"	"is man toegankelijk"	"Bepaalt of de buis toegankelijk is voor een persoon."	""	"is man toegankelijk"	"Bepaalt of de buis toegankelijk is voor een persoon."	""	""	"true"	"https://wegenenverkeer-test.data.vlaanderen.be/ns/abstracten#"	"Buis.isManToegankelijk"	"http://www.w3.org/2002/07/owl#DatatypeProperty"	"https://wegenenverkeer-test.data.vlaanderen.be/ns/abstracten#Buis"	"http://www.w3.org/2001/XMLSchema#boolean"	""	"1"	"1"
"attribute"	"OSLO-Abstracten"	"isOpgevuld"	"{0A12D043-A70C-4423-B167-D31403DEA87A}"	""	"Buis"	"{71FC81DE-8AEC-4f3c-A5EB-409F128BB989}"	"Boolean"	"is opgevuld"	"Geeft aan of de buis gestabileerd/opgevuld is of niet."	""	"is opgevuld"	"Geeft aan of de buis gestabileerd/opgevuld is of niet."	""	""	"true"	"https://wegenenverkeer-test.data.vlaanderen.be/ns/abstracten#"	"Buis.isOpgevuld"	"http://www.w3.org/2002/07/owl#DatatypeProperty"	"https://wegenenverkeer-test.data.vlaanderen.be/ns/abstracten#Buis"	"http://www.w3.org/2001/XMLSchema#boolean"	""	"1"	"1"
"attribute"	"OSLO-Abstracten"	"lengte"	"{45A33CA4-3CD4-475c-80D2-E4681F93A398}"	""	"Buis"	"{71FC81DE-8AEC-4f3c-A5EB-409F128BB989}"	"KwantWrdInMeter"	"lengte"	"De totale lengte in meter van de buis tussen opwaartse en afwaartse put."	""	"lengte"	"De totale lengte in meter van de buis tussen opwaartse en afwaartse put."	""	""	"true"	"https://wegenenverkeer-test.data.vlaanderen.be/ns/abstracten#"	"Buis.lengte"	"http://www.w3.org/2002/07/owl#ObjectProperty"	"https://wegenenverkeer-test.data.vlaanderen.be/ns/abstracten#Buis"	"https://wegenenverkeer-test.data.vlaanderen.be/ns/implementatieelement#KwantWrdInMeter"	""	"1"	"1"
"attribute"	"OSLO-Abstracten"	"technischeFiche"	"{EA0EF292-6DDC-4938-8D43-DDDBE4533E5D}"	""	"Buis"	"{71FC81DE-8AEC-4f3c-A5EB-409F128BB989}"	"DtcAWVDocument"	"technische fiche"	"De technische fiche van de buis."	"Bestanden van het type xlsx of pdf."	"technische fiche"	"De technische fiche van de buis."	""	""	"true"	"https://wegenenverkeer-test.data.vlaanderen.be/ns/abstracten#"	"Buis.technischeFiche"	"http://www.w3.org/2002/07/owl#ObjectProperty"	"https://wegenenverkeer-test.data.vlaanderen.be/ns/abstracten#Buis"	"https://wegenenverkeer-test.data.vlaanderen.be/ns/implementatieelement#DtcAWVDocument"	""	"1"	"*"
"attribute"	"OSLO-Abstracten"	"vorm"	"{436BDC27-3632-441c-80B9-45E3212C68C2}"	""	"Buis"	"{71FC81DE-8AEC-4f3c-A5EB-409F128BB989}"	"KlRioleringVorm"	"vorm"	"Bepaalt de vorm van de buis."	""	"vorm"	"Bepaalt de vorm van de buis."	""	""	"true"	"https://wegenenverkeer-test.data.vlaanderen.be/ns/abstracten#"	"Buis.vorm"	"http://www.w3.org/2002/07/owl#ObjectProperty"	"https://wegenenverkeer-test.data.vlaanderen.be/ns/abstracten#Buis"	"http://www.w3.org/2004/02/skos/core#Concept"	""	"1"	"1"
"attribute"	"OSLO-Implementatieelement"	"video-avi"	"{0C34E3DB-9410-4b19-B95D-404AC5E8E964}"	""	"KlAlgMimeType"	"{9BCD2B4C-9CAB-4988-A052-6C4B006D450A}"	""	""	""	""	""	"TODO"	""	""	"true"	"https://wegenenverkeer-test.data.vlaanderen.be/ns/implementatieelement/KlAlgMimeType/"	"https://wegenenverkeer-test.data.vlaanderen.be/ns/implementatieelement/KlAlgMimeType/video-avi"	"http://www.w3.org/2004/02/skos/core#Concept"	""	""	""	""	""
"attribute"	"OSLO-Implementatieelement"	"text-csv"	"{9919445E-7A80-41a9-BBC3-6A3D8CC52D61}"	""	"KlAlgMimeType"	"{9BCD2B4C-9CAB-4988-A052-6C4B006D450A}"	""	""	""	""	""	"TODO"	""	""	"true"	"https://wegenenverkeer-test.data.vlaanderen.be/ns/implementatieelement/KlAlgMimeType/"	"https://wegenenverkeer-test.data.vlaanderen.be/ns/implementatieelement/KlAlgMimeType/text-csv"	"http://www.w3.org/2004/02/skos/core#Concept"	""	""	""	""	""
"attribute"	"OSLO-Implementatieelement"	"application-vnd.openxmlformats-officedocument.wordprocessingml.document"	"{FFC65031-9A78-499e-AF8F-86D00E36EFD9}"	""	"KlAlgMimeType"	"{9BCD2B4C-9CAB-4988-A052-6C4B006D450A}"	""	""	""	""	""	"TODO"	""	""	"true"	"https://wegenenverkeer-test.data.vlaanderen.be/ns/implementatieelement/KlAlgMimeType/"	"https://wegenenverkeer-test.data.vlaanderen.be/ns/implementatieelement/KlAlgMimeType/application-vnd.openxmlformats-officedocument.wordprocessingml.document"	"http://www.w3.org/2004/02/skos/core#Concept"	""	""	""	""	""
"attribute"	"OSLO-Implementatieelement"	"text-html"	"{6D6161F5-FCB6-4c28-A589-AAD718F79A19}"	""	"KlAlgMimeType"	"{9BCD2B4C-9CAB-4988-A052-6C4B006D450A}"	""	""	""	""	""	"TODO"	""	""	"true"	"https://wegenenverkeer-test.data.vlaanderen.be/ns/implementatieelement/KlAlgMimeType/"	"https://wegenenverkeer-test.data.vlaanderen.be/ns/implementatieelement/KlAlgMimeType/text-html"	"http://www.w3.org/2004/02/skos/core#Concept"	""	""	""	""	""
"attribute"	"OSLO-Implementatieelement"	"image-jpeg"	"{F1BCF1E4-2A9B-4bfd-BFB7-FAB134FF5D5E}"	""	"KlAlgMimeType"	"{9BCD2B4C-9CAB-4988-A052-6C4B006D450A}"	""	""	""	""	""	"TODO"	""	""	"true"	"https://wegenenverkeer-test.data.vlaanderen.be/ns/implementatieelement/KlAlgMimeType/"	"https://wegenenverkeer-test.data.vlaanderen.be/ns/implementatieelement/KlAlgMimeType/image-jpeg"	"http://www.w3.org/2004/02/skos/core#Concept"	""	""	""	""	""
"attribute"	"OSLO-Implementatieelement"	"application-pdf"	"{C4A6E2FF-E6BE-49d4-98BF-DFB2460616C3}"	""	"KlAlgMimeType"	"{9BCD2B4C-9CAB-4988-A052-6C4B006D450A}"	""	""	""	""	""	"TODO"	""	""	"true"	"https://wegenenverkeer-test.data.vlaanderen.be/ns/implementatieelement/KlAlgMimeType/"	"https://wegenenverkeer-test.data.vlaanderen.be/ns/implementatieelement/KlAlgMimeType/application-pdf"	"http://www.w3.org/2004/02/skos/core#Concept"	""	""	""	""	""
"attribute"	"OSLO-Implementatieelement"	"applicatio-rtf"	"{D9ED4569-88A6-4d74-8708-1CAC50C96BD4}"	""	"KlAlgMimeType"	"{9BCD2B4C-9CAB-4988-A052-6C4B006D450A}"	""	""	""	""	""	"TODO"	""	""	"true"	"https://wegenenverkeer-test.data.vlaanderen.be/ns/implementatieelement/KlAlgMimeType/"	"https://wegenenverkeer-test.data.vlaanderen.be/ns/implementatieelement/KlAlgMimeType/applicatio-rtf"	"http://www.w3.org/2004/02/skos/core#Concept"	""	""	""	""	""
"attribute"	"OSLO-Implementatieelement"	"image-tiff"	"{6FA9DD3E-4326-4122-8030-CA10B899BAB3}"	""	"KlAlgMimeType"	"{9BCD2B4C-9CAB-4988-A052-6C4B006D450A}"	""	""	""	""	""	"TODO"	""	""	"true"	"https://wegenenverkeer-test.data.vlaanderen.be/ns/implementatieelement/KlAlgMimeType/"	"https://wegenenverkeer-test.data.vlaanderen.be/ns/implementatieelement/KlAlgMimeType/image-tiff"	"http://www.w3.org/2004/02/skos/core#Concept"	""	""	""	""	""
"attribute"	"OSLO-Implementatieelement"	"application-vnd.openxmlformats-officedocument.spreadsheetml.sheet"	"{8E794137-21E7-4ed0-BD52-645B7892650E}"	""	"KlAlgMimeType"	"{9BCD2B4C-9CAB-4988-A052-6C4B006D450A}"	""	""	""	""	""	"TODO"	""	""	"true"	"https://wegenenverkeer-test.data.vlaanderen.be/ns/implementatieelement/KlAlgMimeType/"	"https://wegenenverkeer-test.data.vlaanderen.be/ns/implementatieelement/KlAlgMimeType/application-vnd.openxmlformats-officedocument.spreadsheetml.sheet"	"http://www.w3.org/2004/02/skos/core#Concept"	""	""	""	""	""
"attribute"	"OSLO-Implementatieelement"	"application-xml"	"{41FC7DE7-E2DF-4125-B50A-EFED62032A88}"	""	"KlAlgMimeType"	"{9BCD2B4C-9CAB-4988-A052-6C4B006D450A}"	""	""	""	""	""	"TODO"	""	""	"true"	"https://wegenenverkeer-test.data.vlaanderen.be/ns/implementatieelement/KlAlgMimeType/"	"https://wegenenverkeer-test.data.vlaanderen.be/ns/implementatieelement/KlAlgMimeType/application-xml"	"http://www.w3.org/2004/02/skos/core#Concept"	""	""	""	""	""
"attribute"	"OSLO-Implementatieelement"	"application-zip"	"{E075A95A-9402-41b7-874D-DEA9CC89ED3D}"	""	"KlAlgMimeType"	"{9BCD2B4C-9CAB-4988-A052-6C4B006D450A}"	""	""	""	""	""	"TODO"	""	""	"true"	"https://wegenenverkeer-test.data.vlaanderen.be/ns/implementatieelement/KlAlgMimeType/"	"https://wegenenverkeer-test.data.vlaanderen.be/ns/implementatieelement/KlAlgMimeType/application-zip"	"http://www.w3.org/2004/02/skos/core#Concept"	""	""	""	""	""
"attribute"	"OSLO-Implementatieelement"	"application-acad"	"{E78B1E33-930B-46f9-9590-325750CDA6A0}"	""	"KlAlgMimeType"	"{9BCD2B4C-9CAB-4988-A052-6C4B006D450A}"	""	""	""	""	""	"TODO"	""	""	"true"	"https://wegenenverkeer-test.data.vlaanderen.be/ns/implementatieelement/KlAlgMimeType/"	"https://wegenenverkeer-test.data.vlaanderen.be/ns/implementatieelement/KlAlgMimeType/application-acad"	"http://www.w3.org/2004/02/skos/core#Concept"	""	""	""	""	""
"attribute"	"OSLO-Implementatieelement"	"application-acadmap"	"{F119FA96-FA0B-4732-B0E7-796C998D9CE9}"	""	"KlAlgMimeType"	"{9BCD2B4C-9CAB-4988-A052-6C4B006D450A}"	""	""	""	""	""	"TODO"	""	""	"true"	"https://wegenenverkeer-test.data.vlaanderen.be/ns/implementatieelement/KlAlgMimeType/"	"https://wegenenverkeer-test.data.vlaanderen.be/ns/implementatieelement/KlAlgMimeType/application-acadmap"	"http://www.w3.org/2004/02/skos/core#Concept"	""	""	""	""	""
"attribute"	"OSLO-Implementatieelement"	"text-rtf"	"{CA431C6F-9A0A-4420-AE95-C77FAC371127}"	""	"KlAlgMimeType"	"{9BCD2B4C-9CAB-4988-A052-6C4B006D450A}"	""	""	""	""	""	"TODO"	""	""	"true"	"https://wegenenverkeer-test.data.vlaanderen.be/ns/implementatieelement/KlAlgMimeType/"	"https://wegenenverkeer-test.data.vlaanderen.be/ns/implementatieelement/KlAlgMimeType/text-rtf"	"http://www.w3.org/2004/02/skos/core#Concept"	""	""	""	""	""
"attribute"	"OSLO-Implementatieelement"	"text-xml"	"{F9E5A17E-1A5F-400f-91F2-DCBB0B8D3FC0}"	""	"KlAlgMimeType"	"{9BCD2B4C-9CAB-4988-A052-6C4B006D450A}"	""	""	""	""	""	"TODO"	""	""	"true"	"https://wegenenverkeer-test.data.vlaanderen.be/ns/implementatieelement/KlAlgMimeType/"	"https://wegenenverkeer-test.data.vlaanderen.be/ns/implementatieelement/KlAlgMimeType/text-xml"	"http://www.w3.org/2004/02/skos/core#Concept"	""	""	""	""	""
"attribute"	"OSLO-Onderdeel"	"rechthoekig"	"{EC8D1196-BD45-4081-8A25-83F3DC60E649}"	""	"KlRioleringVorm"	"{ADF6CDE3-502C-46bb-9547-EC6E58655245}"	""	""	""	""	""	"TODO"	""	""	"true"	"https://wegenenverkeer-test.data.vlaanderen.be/ns/Onderdeel/KlRioleringVorm/"	"https://wegenenverkeer-test.data.vlaanderen.be/ns/Onderdeel/KlRioleringVorm/rechthoekig"	"http://www.w3.org/2004/02/skos/core#Concept"	""	""	""	""	""
"attribute"	"OSLO-Onderdeel"	"cirkelvormig"	"{2A87798C-4B24-42d5-9087-7D6F7DDE7AC6}"	""	"KlRioleringVorm"	"{ADF6CDE3-502C-46bb-9547-EC6E58655245}"	""	""	""	""	""	"TODO"	""	""	"true"	"https://wegenenverkeer-test.data.vlaanderen.be/ns/Onderdeel/KlRioleringVorm/"	"https://wegenenverkeer-test.data.vlaanderen.be/ns/Onderdeel/KlRioleringVorm/cirkelvormig"	"http://www.w3.org/2004/02/skos/core#Concept"	""	""	""	""	""
"attribute"	"OSLO-Onderdeel"	"andere"	"{82BAACC2-4EEF-4b52-BFAD-F80BB0B12D4D}"	""	"KlRioleringVorm"	"{ADF6CDE3-502C-46bb-9547-EC6E58655245}"	""	""	""	""	""	"TODO"	""	""	"true"	"https://wegenenverkeer-test.data.vlaanderen.be/ns/Onderdeel/KlRioleringVorm/"	"https://wegenenverkeer-test.data.vlaanderen.be/ns/Onderdeel/KlRioleringVorm/andere"	"http://www.w3.org/2004/02/skos/core#Concept"	""	""	""	""	""
"attribute"	"OSLO-Onderdeel"	"driehoekig"	"{6D75AB1B-AB27-4272-BA7B-E890E0E66658}"	""	"KlRioleringVorm"	"{ADF6CDE3-502C-46bb-9547-EC6E58655245}"	""	""	""	""	""	"TODO"	""	""	"true"	"https://wegenenverkeer-test.data.vlaanderen.be/ns/Onderdeel/KlRioleringVorm/"	"https://wegenenverkeer-test.data.vlaanderen.be/ns/Onderdeel/KlRioleringVorm/driehoekig"	"http://www.w3.org/2004/02/skos/core#Concept"	""	""	""	""	""
