"EA-Type"	"EA-Package"	"EA-Name"	"EA-GUID"	"EA-Parent"	"EA-Domain"	"EA-Domain-GUID"	"EA-Range"	"label"	"definition"	"usage"	"ap-label-nl"	"ap-definition-nl"	"ap-usageNote-nl"	"ap-codelist"	"external term"	"namespace"	"localname"	"type"	"domain"	"range"	"parent"	"min card"	"max card"
"Package"	""	"OSLO-Draagconstructies"	"{FEDB01A9-0146-4ca9-9D6F-439A5AD05C6C}"	""	""	""	""	""	""	""	""	""	""	""	""	"http://"	"fixme.com"	"http://www.w3.org/2002/07/owl#Ontology"	""	""	""	""	""
"CLASS"	"OSLO-Onderdeel"	"RetroReflecterendeFolie"	"{3165C0DA-9B0D-4ded-B574-661803CAA6F3}"	""	""	""	""	"Retroreflecterende folie"	"Retroreflecterend bekledingsmateriaal,bijvoorbeeld van een divergentiepuntbebakeningselement,retroreflecterende koker,of het beeldvlak van een retroreflecterend verkeersbord."	""	"Retroreflecterende folie"	"Retroreflecterend bekledingsmateriaal,bijvoorbeeld van een divergentiepuntbebakeningselement,retroreflecterende koker,of het beeldvlak van een retroreflecterend verkeersbord."	""	""	"true"	"https://wegenenverkeer-test.data.vlaanderen.be/ns/onderdeel#"	"RetroReflecterendeFolie"	"http://www.w3.org/2000/01/rdf-schema#Class"	""	""	"https://wegenenverkeer-test.data.vlaanderen.be/ns/implementatieelement#AIMObject"	""	""
"CLASS"	"OSLO-Abstracten"	"BekledingComponent"	"{F7EE31EA-0752-49bc-A974-6802DCA24FDE}"	""	""	""	""	"Bekleding component"	"TODO"	""	"Bekleding component"	"TODO"	""	""	"true"	"https://wegenenverkeer-test.data.vlaanderen.be/ns/abstracten#"	"BekledingComponent"	"http://www.w3.org/2000/01/rdf-schema#Class"	""	""	""	""	""
"CLASS"	"OSLO-Abstracten"	"ConstructieElement"	"{171178B4-24D7-4d6e-8C77-13A122A5D6CE}"	""	""	""	""	"Constructie element"	"Abstracte voor de verschillende constructie elementen."	""	"Constructie element"	"Abstracte voor de verschillende constructie elementen."	""	""	"true"	"https://wegenenverkeer-test.data.vlaanderen.be/ns/abstracten#"	"ConstructieElement"	"http://www.w3.org/2000/01/rdf-schema#Class"	""	""	"https://wegenenverkeer-test.data.vlaanderen.be/ns/implementatieelement#AIMObject"	""	""
"CLASS"	"OSLO-Onderdeel"	"Montagekast"	"{87796D6B-6388-4fb2-A99E-D4F6B8FC14A0}"	""	""	""	""	"Montagekast"	"Een kleine kast voor binnen of buiten die net omwille van zijn beperkte omvang doorgaans aan een paal,muur of andere objecten bevestigd wordt."	""	"Montagekast"	"Een kleine kast voor binnen of buiten die net omwille van zijn beperkte omvang doorgaans aan een paal,muur of andere objecten bevestigd wordt."	""	""	"true"	"https://wegenenverkeer-test.data.vlaanderen.be/ns/onderdeel#"	"Montagekast"	"http://www.w3.org/2000/01/rdf-schema#Class"	""	""	"https://wegenenverkeer-test.data.vlaanderen.be/ns/abstracten#Buitenkast"	""	""
"CLASS"	"OSLO-Onderdeel"	"RetroReflecterendeKoker"	"{EACFE19C-7F77-47d6-A6DB-C5C247708269}"	""	""	""	""	"Retro reflecterende koker"	"Een kunststoffen koker bevestigd rond een steun om de zichtbaarheid van verkeerseilanden te verhogen"	""	"Retro reflecterende koker"	"Een kunststoffen koker bevestigd rond een steun om de zichtbaarheid van verkeerseilanden te verhogen"	""	""	"true"	"https://wegenenverkeer-test.data.vlaanderen.be/ns/onderdeel#"	"RetroReflecterendeKoker"	"http://www.w3.org/2000/01/rdf-schema#Class"	""	""	"https://wegenenverkeer-test.data.vlaanderen.be/ns/implementatieelement#AIMObject"	""	""
"CLASS"	"OSLO-Abstracten"	"VRIDraagConstructie"	"{8FBED83D-3A61-46ae-AF00-F4C5DCCD2641}"	"SteunStandaard"	""	""	""	"Verkeersregelinstallatie draagconstructie"	"Abstracte voor een dragend element (bv. paal,kolom,& ) waaraan lantaarns met verkeerslichten bevestigd kunnen worden bij de verkeersregelinstallatie."	""	"Verkeersregelinstallatie draagconstructie"	"Abstracte voor een dragend element (bv. paal,kolom,& ) waaraan lantaarns met verkeerslichten bevestigd kunnen worden bij de verkeersregelinstallatie."	""	""	"true"	"https://wegenenverkeer-test.data.vlaanderen.be/ns/abstracten#"	"VRIDraagConstructie"	"http://www.w3.org/2000/01/rdf-schema#Class"	""	""	"https://wegenenverkeer-test.data.vlaanderen.be/ns/abstracten#SteunStandaard"	""	""
"CLASS"	"OSLO-Onderdeel"	"Bevestigingsbeugel"	"{FD3172F2-46B4-4c04-A62D-A7C4D36A6C93}"	""	""	""	""	"Bevestigingsbeugel"	"Verbindingsstuk waarmee een object kan vastgemaakt worden aan een steun of oppervlak"	""	"Bevestigingsbeugel"	"Verbindingsstuk waarmee een object kan vastgemaakt worden aan een steun of oppervlak"	""	""	"true"	"https://wegenenverkeer-test.data.vlaanderen.be/ns/onderdeel#"	"Bevestigingsbeugel"	"http://www.w3.org/2000/01/rdf-schema#Class"	""	""	"https://wegenenverkeer-test.data.vlaanderen.be/ns/implementatieelement#AIMNaamObject"	""	""
"CLASS"	"OSLO-Onderdeel"	"WVLichtmast"	"{D2E033EA-E108-49a8-96FA-DDD5C72D6B77}"	"WVDraagConstructie, Lichtmast"	""	""	""	"WV lichtmast"	"Paal voorzien van armen voor het bevestigen van verlichtingstoestellen,inclusief deurtje,klemmenblok,montagekastje,bevestigingsmaterialen (bv. voetplaten) en fundering of verankeringsmassief."	""	"WV lichtmast"	"Paal voorzien van armen voor het bevestigen van verlichtingstoestellen,inclusief deurtje,klemmenblok,montagekastje,bevestigingsmaterialen (bv. voetplaten) en fundering of verankeringsmassief."	""	""	"true"	"https://wegenenverkeer-test.data.vlaanderen.be/ns/onderdeel#"	"WVLichtmast"	"http://www.w3.org/2000/01/rdf-schema#Class"	""	""	"https://wegenenverkeer-test.data.vlaanderen.be/ns/onderdeel#Lichtmast, https://wegenenverkeer-test.data.vlaanderen.be/ns/abstracten#WVDraagConstructie"	""	""
"CLASS"	"OSLO-Onderdeel"	"Verkeersbordsteun"	"{5D2474BE-6EA6-4a01-91DF-577378DBE5C1}"	"Draagconstructie"	""	""	""	"Verkeersbordsteun"	"Draagconstructie voor een verkeersbord in de vorm van één of meer steunpalen,vakwerksteunen of seinbruggen."	""	"Verkeersbordsteun"	"Draagconstructie voor een verkeersbord in de vorm van één of meer steunpalen,vakwerksteunen of seinbruggen."	""	""	"true"	"https://wegenenverkeer-test.data.vlaanderen.be/ns/onderdeel#"	"Verkeersbordsteun"	"http://www.w3.org/2000/01/rdf-schema#Class"	""	""	"https://wegenenverkeer-test.data.vlaanderen.be/ns/implementatieelement#AIMNaamObject, https://wegenenverkeer-test.data.vlaanderen.be/ns/abstracten#Draagconstructie"	""	""
"CLASS"	"OSLO-Onderdeel"	"Seinbrug"	"{A309238B-2D6A-4320-AB49-EEC285E800E5}"	"VRIDraagConstructie"	""	""	""	"Seinbrug"	"Metalen constructie bestaande uit 2 of meer verticale steunen met voetplaat en uit een enkele of een dubbel uitgevoerde horizontale dwarsverbinding,allen kokervormig met rechthoekige doorsnede. Ook wel portiek of portaal genoemd"	""	"Seinbrug"	"Metalen constructie bestaande uit 2 of meer verticale steunen met voetplaat en uit een enkele of een dubbel uitgevoerde horizontale dwarsverbinding,allen kokervormig met rechthoekige doorsnede. Ook wel portiek of portaal genoemd"	""	""	"true"	"https://wegenenverkeer-test.data.vlaanderen.be/ns/onderdeel#"	"Seinbrug"	"http://www.w3.org/2000/01/rdf-schema#Class"	""	""	"https://wegenenverkeer-test.data.vlaanderen.be/ns/abstracten#VRIDraagConstructie"	""	""
"CLASS"	"OSLO-Abstracten"	"SteunStandaard"	"{29D02C85-5EC3-4a4f-B681-810D31B38378}"	"Draagconstructie"	""	""	""	"Steun standaard"	"Abstracte voor de standaard steunen."	""	"Steun standaard"	"Abstracte voor de standaard steunen."	""	""	"true"	"https://wegenenverkeer-test.data.vlaanderen.be/ns/abstracten#"	"SteunStandaard"	"http://www.w3.org/2000/01/rdf-schema#Class"	""	""	"https://wegenenverkeer-test.data.vlaanderen.be/ns/implementatieelement#AIMNaamObject, https://wegenenverkeer-test.data.vlaanderen.be/ns/abstracten#Draagconstructie"	""	""
"CLASS"	"OSLO-Onderdeel"	"Galgpaal"	"{6FA3E59B-4701-400e-A54F-781E4D83C47E}"	"VRIDraagConstructie"	""	""	""	"Galgpaal"	"De galgpalen zijn bestemd voor het bevestigen van verkeerslichten, signaalborden, wegwijzers boven het wegdek. Bovendien laten zij het bevestigen toe van één of meerdere lantaarns van het type 200 op de paalschacht. De draagwijdte van de arm moet kunnen reiken tot 9 m. De galgpalen beantwoorden aan SB270-51-6.15"	""	"Galgpaal"	"De galgpalen zijn bestemd voor het bevestigen van verkeerslichten, signaalborden, wegwijzers boven het wegdek. Bovendien laten zij het bevestigen toe van één of meerdere lantaarns van het type 200 op de paalschacht. De draagwijdte van de arm moet kunnen reiken tot 9 m. De galgpalen beantwoorden aan SB270-51-6.15"	""	""	"true"	"https://wegenenverkeer-test.data.vlaanderen.be/ns/onderdeel#"	"Galgpaal"	"http://www.w3.org/2000/01/rdf-schema#Class"	""	""	"https://wegenenverkeer-test.data.vlaanderen.be/ns/abstracten#VRIDraagConstructie"	""	""
"CLASS"	"OSLO-Onderdeel"	"BoogpaalVerkeerslicht"	"{30AF3977-C39A-49fd-B838-0E670E07235F}"	"VRIDraagConstructie"	""	""	""	"Boogpaal verkeerslicht"	"Paal bestemd voor het bevestigen van seinlantaarns boven het wegdek. Geschikt voor het bevestigen van ten hoogste 4 seinlantaarns van het type 300 en van één of meerdere lantaarns van het type 200 op de paalschacht. De vrije hoogte ten opzichte van het wegdek bedraagt onder de lantaarns 6.500 milmeter voor palen met grote draagwijdte (7,5 m overspanning) en 5.500 mm voor de palen met middelgrote draagwijdte (3,5 m overspanning)."	""	"Boogpaal verkeerslicht"	"Paal bestemd voor het bevestigen van seinlantaarns boven het wegdek. Geschikt voor het bevestigen van ten hoogste 4 seinlantaarns van het type 300 en van één of meerdere lantaarns van het type 200 op de paalschacht. De vrije hoogte ten opzichte van het wegdek bedraagt onder de lantaarns 6.500 milmeter voor palen met grote draagwijdte (7,5 m overspanning) en 5.500 mm voor de palen met middelgrote draagwijdte (3,5 m overspanning)."	""	""	"true"	"https://wegenenverkeer-test.data.vlaanderen.be/ns/onderdeel#"	"BoogpaalVerkeerslicht"	"http://www.w3.org/2000/01/rdf-schema#Class"	""	""	"https://wegenenverkeer-test.data.vlaanderen.be/ns/abstracten#VRIDraagConstructie"	""	""
"CLASS"	"OSLO-Onderdeel"	"RechteSteun"	"{4D941069-8D5E-4be3-B069-BC713852766B}"	"VRIDraagConstructie"	""	""	""	"Rechte steun"	"Rechte paal voor het steun geven aan allerlei installaties. Dit omvat het volledige draagsysteem, zijnde de logische samenstelling van met elkaar verbonden onderdelen, bestemd voor het geven van mechanische sterkte en stabiliteit aan de installatie voor wegsignalering.
Afhankelijk van het gekozen modek kan de rechte steun bestemd zijn voor:
Verkeerslichten (A-paal, D-paal en zwanehals), variabele zone 30, bi-flash of andere installaties."	""	"Rechte steun"	"Rechte paal voor het steun geven aan allerlei installaties. Dit omvat het volledige draagsysteem, zijnde de logische samenstelling van met elkaar verbonden onderdelen, bestemd voor het geven van mechanische sterkte en stabiliteit aan de installatie voor wegsignalering.
Afhankelijk van het gekozen modek kan de rechte steun bestemd zijn voor:
Verkeerslichten (A-paal, D-paal en zwanehals), variabele zone 30, bi-flash of andere installaties."	""	""	"true"	"https://wegenenverkeer-test.data.vlaanderen.be/ns/onderdeel#"	"RechteSteun"	"http://www.w3.org/2000/01/rdf-schema#Class"	""	""	"https://wegenenverkeer-test.data.vlaanderen.be/ns/abstracten#VRIDraagConstructie"	""	""
"CLASS"	"OSLO-Onderdeel"	"Lichtmast"	"{DD864976-7678-4d31-B3F0-61BEFD49D6B3}"	"Draagconstructie"	""	""	""	"Lichtmast"	"Paal waarop een verlichtingstoestel of andere toestellen zoals een camera bevestigd kunnen worden. Omvat het deurtje, klemmenblok, montagekastje, bevestigingsmaterialen (bv. voetplaten) en fundering of verankeringsmassief. Indien de paal gebruikt wordt voor wegverlichting moet het objecttype WVLichtmast gebruikt worden."	""	"Lichtmast"	"Paal waarop een verlichtingstoestel of andere toestellen zoals een camera bevestigd kunnen worden. Omvat het deurtje, klemmenblok, montagekastje, bevestigingsmaterialen (bv. voetplaten) en fundering of verankeringsmassief. Indien de paal gebruikt wordt voor wegverlichting moet het objecttype WVLichtmast gebruikt worden."	""	""	"true"	"https://wegenenverkeer-test.data.vlaanderen.be/ns/onderdeel#"	"Lichtmast"	"http://www.w3.org/2000/01/rdf-schema#Class"	""	""	"https://wegenenverkeer-test.data.vlaanderen.be/ns/implementatieelement#AIMNaamObject, https://wegenenverkeer-test.data.vlaanderen.be/ns/abstracten#Draagconstructie"	""	""
"CLASS"	"OSLO-Abstracten"	"Draagconstructie"	"{E7914198-5433-440f-981E-CF1FFDEBD085}"	""	""	""	""	"Draagconstructie"	"Abstracte voor alle draagconstructies."	""	"Draagconstructie"	"Abstracte voor alle draagconstructies."	""	""	"true"	"https://wegenenverkeer-test.data.vlaanderen.be/ns/abstracten#"	"Draagconstructie"	"http://www.w3.org/2000/01/rdf-schema#Class"	""	""	""	""	""
"CLASS"	"OSLO-Abstracten"	"WVDraagConstructie"	"{CB8ADCF5-A266-4c9c-89C4-85A5E2D3D330}"	"Draagconstructie"	""	""	""	"WV draagconstructie"	"Abstracte voor een dragend element (bv. paal, kolom, seinbrug, galgpaal,) waaraan verlichting bevestigd kan worden om het verlichtingstoestel op de gewenste plaats boven/naast het wegdek (hoogte, afstand tot rand van de weg,) te brengen met als doel het wegoppervlak optimaal te kunnen verlichten"	""	"WV draagconstructie"	"Abstracte voor een dragend element (bv. paal, kolom, seinbrug, galgpaal,) waaraan verlichting bevestigd kan worden om het verlichtingstoestel op de gewenste plaats boven/naast het wegdek (hoogte, afstand tot rand van de weg,) te brengen met als doel het wegoppervlak optimaal te kunnen verlichten"	""	""	"true"	"https://wegenenverkeer-test.data.vlaanderen.be/ns/abstracten#"	"WVDraagConstructie"	"http://www.w3.org/2000/01/rdf-schema#Class"	""	""	"https://wegenenverkeer-test.data.vlaanderen.be/ns/abstracten#Draagconstructie"	""	""
"CLASS"	"OSLO-Implementatieelement"	"AIMObject"	"{9AF587FA-A5CF-4b0c-8A23-CF75F280760F}"	""	""	""	""	"AIM object"	"Abstracte als de basisklasse voor alle uniek geïdentificeerde OTL objecten met de basiseigenschappen die elk OTL object minstens heeft."	""	"AIM object"	"Abstracte als de basisklasse voor alle uniek geïdentificeerde OTL objecten met de basiseigenschappen die elk OTL object minstens heeft."	""	""	"true"	"https://wegenenverkeer-test.data.vlaanderen.be/ns/implementatieelement#"	"AIMObject"	"http://www.w3.org/2000/01/rdf-schema#Class"	""	""	"https://wegenenverkeer-test.data.vlaanderen.be/ns/implementatieelement#AIMToestand, https://wegenenverkeer-test.data.vlaanderen.be/ns/implementatieelement#AIMStatus"	""	""
"CLASS"	"OSLO-Implementatieelement"	"AIMToestand"	"{9418C0E6-C48A-44df-ABF7-C6E3B7FF5FC4}"	""	""	""	""	"AIM Toestand"	"Voegt een atribuut toe aan de subklasse die overerft van de abstracte waarmee die een moment in de levenscyclus van het object aangeeft."	""	"AIM Toestand"	"Voegt een atribuut toe aan de subklasse die overerft van de abstracte waarmee die een moment in de levenscyclus van het object aangeeft."	""	""	"true"	"https://wegenenverkeer-test.data.vlaanderen.be/ns/implementatieelement#"	"AIMToestand"	"http://www.w3.org/2000/01/rdf-schema#Class"	""	""	""	""	""
"CLASS"	"OSLO-Implementatieelement"	"AIMStatus"	"{75C21F07-BAE5-412e-AD87-520DD947D510}"	""	""	""	""	"AIM Status"	"Voegt een atribuut met de status (actief/inactief) toe aan de subklasse die overerft van de abstracte."	""	"AIM Status"	"Voegt een atribuut met de status (actief/inactief) toe aan de subklasse die overerft van de abstracte."	""	""	"true"	"https://wegenenverkeer-test.data.vlaanderen.be/ns/implementatieelement#"	"AIMStatus"	"http://www.w3.org/2000/01/rdf-schema#Class"	""	""	""	""	""
"CLASS"	"OSLO-Abstracten"	"Buitenkast"	"{49F937A2-8C90-497c-9A0D-7182273D8DC1}"	""	""	""	""	"Buitenkast"	"Abstracte voor katen die typisch buiten staan en daarom verfraaiing kunnen krijgen."	""	"Buitenkast"	"Abstracte voor katen die typisch buiten staan en daarom verfraaiing kunnen krijgen."	""	""	"true"	"https://wegenenverkeer-test.data.vlaanderen.be/ns/abstracten#"	"Buitenkast"	"http://www.w3.org/2000/01/rdf-schema#Class"	""	""	"https://wegenenverkeer-test.data.vlaanderen.be/ns/abstracten#Kast"	""	""
"CLASS"	"OSLO-Abstracten"	"Kast"	"{7B0BF92A-BCCB-4c44-AAD0-92E4C9745E3A}"	""	""	""	""	"Kast"	"Abstracte voor allerlei types kasten."	""	"Kast"	"Abstracte voor allerlei types kasten."	""	""	"true"	"https://wegenenverkeer-test.data.vlaanderen.be/ns/abstracten#"	"Kast"	"http://www.w3.org/2000/01/rdf-schema#Class"	""	""	"https://wegenenverkeer-test.data.vlaanderen.be/ns/abstracten#Behuizing"	""	""
"CLASS"	"OSLO-Abstracten"	"Behuizing"	"{0EED355E-1562-4941-BAA6-9A653E054A32}"	""	""	""	""	"Behuizing"	"Abstracte voor alle types van behuizing voor het beschermen van technieken."	""	"Behuizing"	"Abstracte voor alle types van behuizing voor het beschermen van technieken."	""	""	"true"	"https://wegenenverkeer-test.data.vlaanderen.be/ns/abstracten#"	"Behuizing"	"http://www.w3.org/2000/01/rdf-schema#Class"	""	""	"https://wegenenverkeer-test.data.vlaanderen.be/ns/implementatieelement#AIMNaamObject"	""	""
"CLASS"	"OSLO-Implementatieelement"	"AIMNaamObject"	"{493E85C9-60EF-4aff-9C4C-5C45D59C0E64}"	""	""	""	""	"AIM naam object"	"Abstracte als de basisklasse voor elk OTL object dat benoemd wordt met een mensleesbare identificator."	""	"AIM naam object"	"Abstracte als de basisklasse voor elk OTL object dat benoemd wordt met een mensleesbare identificator."	""	""	"true"	"https://wegenenverkeer-test.data.vlaanderen.be/ns/implementatieelement#"	"AIMNaamObject"	"http://www.w3.org/2000/01/rdf-schema#Class"	""	""	"https://wegenenverkeer-test.data.vlaanderen.be/ns/implementatieelement#AIMObject"	""	""
"DATATYPE"	"OSLO-Implementatieelement"	"DtcIdentificator"	"{166F8539-73F1-4112-B479-1654B795E2C2}"	""	""	""	""	"identificator"	"Complex datatype voor de identificator van een object volgens de bron van de identificator."	""	"identificator"	"Complex datatype voor de identificator van een object volgens de bron van de identificator."	""	""	"true"	"https://wegenenverkeer-test.data.vlaanderen.be/ns/implementatieelement#"	"DtcIdentificator"	"http://www.w3.org/2000/01/rdf-schema#Class"	""	""	""	""	""
"DATATYPE"	"W3-XML-Schema"	"String"	"{81376A9B-DB07-4798-87F6-B226CAC2C5C8}"	""	""	""	""	"String"	"Beschrijft een tekstregel volgens http://www.w3.org/2001/XMLSchema#string"	"https://www.w3.org/TR/xmlschema-2/#string"	"String"	"Beschrijft een tekstregel volgens http://www.w3.org/2001/XMLSchema#string"	""	""	"true"	"http://www.w3.org/2001/XMLSchema#"	"string"	"http://www.w3.org/2000/01/rdf-schema#Class"	""	""	""	""	""
"DATATYPE"	"W3-XML-Schema"	"Date"	"{6EA0E47B-3163-404d-A035-56A88051BC31}"	""	""	""	""	"Datum"	"Beschrijft een datum volgens http://www.w3.org/2001/XMLSchema#date"	"https://www.w3.org/TR/xmlschema-2/#date"	"Datum"	"Beschrijft een datum volgens http://www.w3.org/2001/XMLSchema#date"	""	""	"true"	"http://www.w3.org/2001/XMLSchema#"	"date"	"http://www.w3.org/2000/01/rdf-schema#Class"	""	""	""	""	""
"DATATYPE"	"W3-XML-Schema"	"AnyURI"	"{81711512-9AAA-4861-841D-A6A67FB29FD1}"	""	""	""	""	"URI"	"Een tekstwaarde die een verwijzing naar meer informatie van het element bevat volgens http://www.w3.org/2001/XMLSchema#anyURI ."	"https://www.w3.org/TR/xmlschema-2/#anyURI"	"URI"	"Een tekstwaarde die een verwijzing naar meer informatie van het element bevat volgens http://www.w3.org/2001/XMLSchema#anyURI ."	""	""	"true"	"http://www.w3.org/2001/XMLSchema#"	"anyURI"	"http://www.w3.org/2000/01/rdf-schema#Class"	""	""	""	""	""
"DATATYPE"	"W3-XML-Schema"	"Boolean"	"{9E1833BF-210A-4b48-8326-8A00413463CD}"	""	""	""	""	"Boolean"	"Beschrijft een boolean volgens http://www.w3.org/2001/XMLSchema#boolean"	"https://www.w3.org/TR/xmlschema-2/#boolean"	"Boolean"	"Beschrijft een boolean volgens http://www.w3.org/2001/XMLSchema#boolean"	""	""	"true"	"http://www.w3.org/2001/XMLSchema#"	"boolean"	"http://www.w3.org/2000/01/rdf-schema#Class"	""	""	""	""	""
"DATATYPE"	"OSLO-Implementatieelement"	"DtcDocument"	"{57E2B78E-3BA6-4465-85AB-B3C47F14D47F}"	""	""	""	""	"Bestandsbijlage"	"Complex datatype voor alle bestandsbijlages"	""	"Bestandsbijlage"	"Complex datatype voor alle bestandsbijlages"	""	""	"true"	"https://wegenenverkeer-test.data.vlaanderen.be/ns/implementatieelement#"	"DtcDocument"	"http://www.w3.org/2000/01/rdf-schema#Class"	""	""	""	""	""
"DATATYPE"	"OSLO-Implementatieelement"	"DteTekstblok"	"{D24614D8-8D4E-4112-B139-315B96C73DBB}"	""	""	""	""	"Tekstblok"	"Een tekst welke uit meerdere zinnen bestaat,en ook regeleindes kan bevatten. Een tekstblok bevat maximaal 65.000 karakters."	""	"Tekstblok"	"Een tekst welke uit meerdere zinnen bestaat,en ook regeleindes kan bevatten. Een tekstblok bevat maximaal 65.000 karakters."	""	""	"true"	"https://wegenenverkeer-test.data.vlaanderen.be/ns/implementatieelement#"	"DteTekstblok"	"http://www.w3.org/2000/01/rdf-schema#Class"	""	""	""	""	""
"DATATYPE"	"OSLO-Implementatieelement"	"DtcAfmetingBxlxhInMm"	"{48E30B98-FAF7-4c55-9015-6DA3B021103B}"	""	""	""	""	"Afmeting bxlxh in millimeter"	"De afmeting van de breedte,de lengte en hoogte in millimeter."	""	"Afmeting bxlxh in millimeter"	"De afmeting van de breedte,de lengte en hoogte in millimeter."	""	""	"true"	"https://wegenenverkeer-test.data.vlaanderen.be/ns/implementatieelement#"	"DtcAfmetingBxlxhInMm"	"http://www.w3.org/2000/01/rdf-schema#Class"	""	""	""	""	""
"DATATYPE"	"OSLO-Implementatieelement"	"KwantWrdInMillimeter"	"{9150A7F6-E98A-4c9f-8C02-580A898B2243}"	""	""	""	""	"Kwantitatieve waarde in millimeter"	"Een kwantitatieve waarde die een getal in millimeter uitdrukt."	""	"Kwantitatieve waarde in millimeter"	"Een kwantitatieve waarde die een getal in millimeter uitdrukt."	""	""	"true"	"https://wegenenverkeer-test.data.vlaanderen.be/ns/implementatieelement#"	"KwantWrdInMillimeter"	"http://www.w3.org/2000/01/rdf-schema#Class"	""	""	""	""	""
"DATATYPE"	"W3-RDF-Schema"	"Literal"	"{E901A017-A1F0-4073-9405-C71F670C7CBA}"	""	""	""	""	"Literal"	"Beschrijft een constante."	"http://www.w3.org/2000/01/rdf-schema#Literal"	"Literal"	"Beschrijft een constante."	""	""	"true"	"http://www.w3.org/2000/01/rdf-schema#"	"Literal"	"http://www.w3.org/2000/01/rdf-schema#Class"	""	""	""	""	""
"DATATYPE"	"W3-XML-Schema"	"Decimal"	"{B5FC49E6-0E60-4fdf-950A-209E703D5C63}"	""	""	""	""	"Decimaal getal"	"Beschrijft een decimaal getal volgens http://www.w3.org/2001/XMLSchema#decimal"	"https://www.w3.org/TR/xmlschema-2/#decimal"	"Decimaal getal"	"Beschrijft een decimaal getal volgens http://www.w3.org/2001/XMLSchema#decimal"	""	""	"true"	"http://www.w3.org/2001/XMLSchema#"	"decimal"	"http://www.w3.org/2000/01/rdf-schema#Class"	""	""	""	""	""
"DATATYPE"	"OSLO-Implementatieelement"	"KwantWrdInJaar"	"{EC25C511-270E-4029-9995-CA9FB16A1DA4}"	""	""	""	""	"Kwantitatieve waarde in aantal jaar"	"Een kwantitatieve waarde die een getal in aantal jaar uitdrukt."	""	"Kwantitatieve waarde in aantal jaar"	"Een kwantitatieve waarde die een getal in aantal jaar uitdrukt."	""	""	"true"	"https://wegenenverkeer-test.data.vlaanderen.be/ns/implementatieelement#"	"KwantWrdInJaar"	"http://www.w3.org/2000/01/rdf-schema#Class"	""	""	""	""	""
"DATATYPE"	"W3-XML-Schema"	"NonNegativeInteger"	"{980E8EE1-D9EE-417d-AF7A-8217CD9CCC74}"	""	""	""	""	"Natuurlijk getal"	"Beschrijft een natuurlijk getal volgens http://www.w3.org/2001/XMLSchema#nonNegativeInteger"	"https://www.w3.org/TR/xmlschema-2/#nonNegativeInteger"	"Natuurlijk getal"	"Beschrijft een natuurlijk getal volgens http://www.w3.org/2001/XMLSchema#nonNegativeInteger"	""	""	"true"	"http://www.w3.org/2001/XMLSchema#"	"nonNegativeInteger"	"http://www.w3.org/2000/01/rdf-schema#Class"	""	""	""	""	""
"DATATYPE"	"OSLO-Implementatieelement"	"DtcAdres"	"{281D2EBE-A38A-44a2-987B-2C818171A6FF}"	""	""	""	""	"Adres"	"De aanduiding van een bepaalde locatie,doorgaans van een huis,woning,gebouw of faciliteit,op de aarde."	""	"Adres"	"De aanduiding van een bepaalde locatie,doorgaans van een huis,woning,gebouw of faciliteit,op de aarde."	""	""	"true"	"https://wegenenverkeer-test.data.vlaanderen.be/ns/implementatieelement#"	"DtcAdres"	"http://www.w3.org/2000/01/rdf-schema#Class"	""	""	""	""	""
"DATATYPE"	"OSLO-Implementatieelement"	"KwantWrdInMeter"	"{5A5DD566-BCF9-4770-8AF4-2BAD1E33CAC9}"	""	""	""	""	"Kwantitatieve waarde in meter"	"Een kwantitatieve waarde die een getal in meter uitdrukt."	""	"Kwantitatieve waarde in meter"	"Een kwantitatieve waarde die een getal in meter uitdrukt."	""	""	"true"	"https://wegenenverkeer-test.data.vlaanderen.be/ns/implementatieelement#"	"KwantWrdInMeter"	"http://www.w3.org/2000/01/rdf-schema#Class"	""	""	""	""	""
"DATATYPE"	"OSLO-Implementatieelement"	"DteKleurRAL"	"{7BB5F473-56A3-4493-84F4-37DDBDB204E7}"	""	""	""	""	"RAL-kleur"	"Beschrijft een kleur volgens het RAL klassificatiesysteem. De waarde is een natuurlijk getal tussen 1000 en 9999."	""	"RAL-kleur"	"Beschrijft een kleur volgens het RAL klassificatiesysteem. De waarde is een natuurlijk getal tussen 1000 en 9999."	""	""	"true"	"https://wegenenverkeer-test.data.vlaanderen.be/ns/implementatieelement#"	"DteKleurRAL"	"http://www.w3.org/2000/01/rdf-schema#Class"	""	""	""	""	""
"DATATYPE"	"OSLO-Onderdeel"	"DtuWvLichtmastBevsToestelMethode"	"{9BFDCBD1-4E09-4cd8-AAF8-ECFF797EBABB}"	""	""	""	""	"Bevestiging wegverlichtingstoestel"	"Union datatype voor de wijze waarop verlichtingstoestellen bevestigd zijn op een lichtmast,indien dit een standaard methode is dan kan deze geselecteerd worden uit een keuzelijst. Bij afwijkende methode kan de methode toegelicht worden."	""	"Bevestiging wegverlichtingstoestel"	"Union datatype voor de wijze waarop verlichtingstoestellen bevestigd zijn op een lichtmast,indien dit een standaard methode is dan kan deze geselecteerd worden uit een keuzelijst. Bij afwijkende methode kan de methode toegelicht worden."	""	""	"true"	"https://wegenenverkeer-test.data.vlaanderen.be/ns/onderdeel#"	"DtuWvLichtmastBevsToestelMethode"	"http://www.w3.org/2000/01/rdf-schema#Class"	""	""	""	""	""
