"EA-Type"	"EA-Package"	"EA-Name"	"EA-GUID"	"EA-Parent"	"EA-Domain"	"EA-Domain-GUID"	"EA-Range"	"label"	"definition"	"usage"	"ap-label-nl"	"ap-definition-nl"	"ap-usageNote-nl"	"ap-codelist"	"external term"	"namespace"	"localname"	"type"	"domain"	"range"	"parent"	"min card"	"max card"
"attribute"	"OSLO-Onderdeel"	"materiaalKarakteristiek"	"{E1610EB4-DE28-414d-B5BF-1DEAD4EA171E}"	""	"GeluidswerendeConstructie"	"{F1533883-16B7-43df-A48D-1ED1050AA0F5}"	"GCMateriaalKarakteristiek"	"Materiaal karakteristiek"	"Het materiaal van de geluidswerende constructie en het geluidskarakterisitiek van het materiaal."	""	"Materiaal karakteristiek"	"Het materiaal van de geluidswerende constructie en het geluidskarakterisitiek van het materiaal."	""	""	"true"	"https://data.vlaanderen.be/ns/wegenenverkeer/onderdeel#"	"geluidswerendeconstructie.materiaalkarakteristiek"	"http://www.w3.org/2002/07/owl#ObjectProperty"	"https://data.vlaanderen.be/ns/wegenenverkeer/onderdeel#GeluidswerendeConstructie"	"https://data.vlaanderen.be/ns/wegenenverkeer/onderdeel#GCMateriaalKarakteristiek"	""	"1"	"n"
"attribute"	"OSLO-Onderdeel"	"minimaleDikteSchermelement"	"{7041E698-4C45-4d45-9680-6FC37538BC3F}"	""	"GeluidswerendeConstructie"	"{F1533883-16B7-43df-A48D-1ED1050AA0F5}"	"Centimeter"	"Minimale dikte schermelement"	"De minimale dikte van het schermelement in centimeter."	""	"Minimale dikte schermelement"	"De minimale dikte van het schermelement in centimeter."	""	""	"true"	"https://data.vlaanderen.be/ns/wegenenverkeer/onderdeel#"	"geluidswerendeconstructie.minimaledikteschermelement"	"http://www.w3.org/2002/07/owl#ObjectProperty"	"https://data.vlaanderen.be/ns/wegenenverkeer/onderdeel#GeluidswerendeConstructie"	"https://wegenenverkeer.data.vlaanderen.be/ns/implementatieelement#Centimeter"	""	"1"	"1"
"attribute"	"OSLO-Onderdeel"	"opstelling"	"{8D93958E-2DA7-4861-82C9-7025080AF518}"	""	"GeluidswerendeConstructie"	"{F1533883-16B7-43df-A48D-1ED1050AA0F5}"	"LEGCOpstelling"	"Opstelling"	"De wijze waarop de geluidswerende constructie is geplaatst ten opzichte van de weg."	""	"Opstelling"	"De wijze waarop de geluidswerende constructie is geplaatst ten opzichte van de weg."	""	""	"true"	"https://data.vlaanderen.be/ns/wegenenverkeer/onderdeel#"	"geluidswerendeconstructie.opstelling"	"http://www.w3.org/2002/07/owl#ObjectProperty"	"https://data.vlaanderen.be/ns/wegenenverkeer/onderdeel#GeluidswerendeConstructie"	"http://www.w3.org/2004/02/skos/core#Concept"	""	"1"	"1"
"attribute"	"OSLO-Onderdeel"	"overzichtSchermhoogte"	"{F1F2D1B9-4073-42b6-9698-CC0D9CD6537B}"	""	"GeluidswerendeConstructie"	"{F1533883-16B7-43df-A48D-1ED1050AA0F5}"	"OverzichtSchermhoogte"	"Overzicht schermhoogte"	"De meest voorkomende schermhoogte volgens bestek."	""	"Overzicht schermhoogte"	"De meest voorkomende schermhoogte volgens bestek."	""	""	"true"	"https://data.vlaanderen.be/ns/wegenenverkeer/onderdeel#"	"geluidswerendeconstructie.overzichtschermhoogte"	"http://www.w3.org/2002/07/owl#ObjectProperty"	"https://data.vlaanderen.be/ns/wegenenverkeer/onderdeel#GeluidswerendeConstructie"	"https://data.vlaanderen.be/ns/wegenenverkeer/onderdeel#OverzichtSchermhoogte"	""	"1"	"1"
"attribute"	"OSLO-Onderdeel"	"schermelement"	"{A385E03C-9573-461b-9938-3277CD73FF60}"	""	"GeluidswerendeConstructie"	"{F1533883-16B7-43df-A48D-1ED1050AA0F5}"	"LEGCSchermelementType"	"Schermelement"	"Het type van schermelement."	""	"Schermelement"	"Het type van schermelement."	""	""	"true"	"https://data.vlaanderen.be/ns/wegenenverkeer/onderdeel#"	"geluidswerendeconstructie.schermelement"	"http://www.w3.org/2002/07/owl#ObjectProperty"	"https://data.vlaanderen.be/ns/wegenenverkeer/onderdeel#GeluidswerendeConstructie"	"http://www.w3.org/2004/02/skos/core#Concept"	""	"1"	"n"
"attribute"	"OSLO-Onderdeel"	"schermtype"	"{8E56C207-A600-4d99-90E5-653CEA1113EB}"	""	"GeluidswerendeConstructie"	"{F1533883-16B7-43df-A48D-1ED1050AA0F5}"	"LEGCSchermtype"	"Schermtype"	"Keuzelijst attribuut om vlak of niet-vlak te bepalen van het scherm. Een vlak scherm zijn alle schermtypes die getest kunnen worden volgens de normen NBN EN 1793-1 NBN EN 1793-2.
De niet-vlakke schermen zijn de schermen die niet kunnen getest worden volgens de normen NBN EN 1793-1 NBN EN 1793-2."	""	"Schermtype"	"Keuzelijst attribuut om vlak of niet-vlak te bepalen van het scherm. Een vlak scherm zijn alle schermtypes die getest kunnen worden volgens de normen NBN EN 1793-1 NBN EN 1793-2.
De niet-vlakke schermen zijn de schermen die niet kunnen getest worden volgens de normen NBN EN 1793-1 NBN EN 1793-2."	""	""	"true"	"https://data.vlaanderen.be/ns/wegenenverkeer/onderdeel#"	"geluidswerendeconstructie.schermtype"	"http://www.w3.org/2002/07/owl#ObjectProperty"	"https://data.vlaanderen.be/ns/wegenenverkeer/onderdeel#GeluidswerendeConstructie"	"http://www.w3.org/2004/02/skos/core#Concept"	""	"1"	"n"
"attribute"	"OSLO-Onderdeel"	"statischeBelasting"	"{ED2C07F8-6FB7-44b5-A783-3CEC956B2D91}"	""	"GeluidswerendeConstructie"	"{F1533883-16B7-43df-A48D-1ED1050AA0F5}"	"Integer"	"Statische belasting"	"Geheel getal voor de aanduiding van de belasting zonder dynamisch effect, bv. eigengewicht."	""	"Statische belasting"	"Geheel getal voor de aanduiding van de belasting zonder dynamisch effect, bv. eigengewicht."	""	""	"true"	"https://data.vlaanderen.be/ns/wegenenverkeer/onderdeel#"	"geluidswerendeconstructie.statischebelasting"	"http://www.w3.org/2002/07/owl#DatatypeProperty"	"https://data.vlaanderen.be/ns/wegenenverkeer/onderdeel#GeluidswerendeConstructie"	"http://www.w3.org/2001/XMLSchema#integer"	""	"1"	"1"
"attribute"	"OSLO-Onderdeel"	"totaleLengte"	"{63CE420F-E116-4394-A3AA-10CF68A02A08}"	""	"GeluidswerendeConstructie"	"{F1533883-16B7-43df-A48D-1ED1050AA0F5}"	"KwantWrdInMeter"	"Totale lengte"	"De totale lengte van de geluidswerende constructie in meter."	""	"Totale lengte"	"De totale lengte van de geluidswerende constructie in meter."	""	""	"true"	"https://data.vlaanderen.be/ns/wegenenverkeer/onderdeel#"	"geluidswerendeconstructie.totalelengte"	"http://www.w3.org/2002/07/owl#ObjectProperty"	"https://data.vlaanderen.be/ns/wegenenverkeer/onderdeel#GeluidswerendeConstructie"	"https://wegenenverkeer.data.vlaanderen.be/ns/implementatieelement#KwantWrdInMeter"	""	"1"	"1"
"attribute"	"OSLO-Onderdeel"	"windbelasting"	"{B6BC2E83-5843-4b65-8531-347175F337ED}"	""	"GeluidswerendeConstructie"	"{F1533883-16B7-43df-A48D-1ED1050AA0F5}"	"Integer"	"Windbelasting"	"Geheel getal voor de aanduiding van de belasting door de wind volgens de norm NBN EN 1994-1-4."	""	"Windbelasting"	"Geheel getal voor de aanduiding van de belasting door de wind volgens de norm NBN EN 1994-1-4."	""	""	"true"	"https://data.vlaanderen.be/ns/wegenenverkeer/onderdeel#"	"geluidswerendeconstructie.windbelasting"	"http://www.w3.org/2002/07/owl#DatatypeProperty"	"https://data.vlaanderen.be/ns/wegenenverkeer/onderdeel#GeluidswerendeConstructie"	"http://www.w3.org/2001/XMLSchema#integer"	""	"1"	"1"
"attribute"	"OSLO-Abstracten"	"breedte"	"{55CC48D8-1F4F-43dd-AE84-DED51D3BFB04}"	""	"AfwijkendeKantopsluiting"	"{E6B81AC2-63A3-4bc3-97F7-0142D136327D}"	"Centimeter"	"Breedte"	"De breedte van de afwijkende kantopsluiting in centimeter
."	""	"Breedte"	"De breedte van de afwijkende kantopsluiting in centimeter
."	""	""	"true"	"https://data.vlaanderen.be/ns/wegenenverkeer/abstracten#"	"afwijkendekantopsluiting.breedte"	"http://www.w3.org/2002/07/owl#ObjectProperty"	"https://data.vlaanderen.be/ns/wegenenverkeer/abstracten#AfwijkendeKantopsluiting"	"https://wegenenverkeer.data.vlaanderen.be/ns/implementatieelement#Centimeter"	""	"1"	"1"
"attribute"	"OSLO-Abstracten"	"dikte"	"{F3235E44-A025-4d69-8EB6-64D66E57ECC1}"	""	"AfwijkendeKantopsluiting"	"{E6B81AC2-63A3-4bc3-97F7-0142D136327D}"	"Centimeter"	"Dikte"	"De dikte van de afwijkende kantopsluiting in centimeter
."	""	"Dikte"	"De dikte van de afwijkende kantopsluiting in centimeter
."	""	""	"true"	"https://data.vlaanderen.be/ns/wegenenverkeer/abstracten#"	"afwijkendekantopsluiting.dikte"	"http://www.w3.org/2002/07/owl#ObjectProperty"	"https://data.vlaanderen.be/ns/wegenenverkeer/abstracten#AfwijkendeKantopsluiting"	"https://wegenenverkeer.data.vlaanderen.be/ns/implementatieelement#Centimeter"	""	"1"	"1"
"attribute"	"OSLO-Abstracten"	"geprefabriceerd"	"{0B2C1344-56B6-42a8-8948-CBFDE49ACC1C}"	""	"AfwijkendeKantopsluiting"	"{E6B81AC2-63A3-4bc3-97F7-0142D136327D}"	"Boolean"	"Geprefabriceerd"	"Aanduiding of de kantopsluiting al dan niet is geprefabriceerd."	""	"Geprefabriceerd"	"Aanduiding of de kantopsluiting al dan niet is geprefabriceerd."	""	""	"true"	"https://data.vlaanderen.be/ns/wegenenverkeer/abstracten#"	"afwijkendekantopsluiting.geprefabriceerd"	"http://www.w3.org/2002/07/owl#DatatypeProperty"	"https://data.vlaanderen.be/ns/wegenenverkeer/abstracten#AfwijkendeKantopsluiting"	"http://www.w3.org/2001/XMLSchema#boolean"	""	"1"	"1"
"attribute"	"OSLO-Abstracten"	"kleur"	"{D3C60297-D342-4de8-BEF8-584FB6F6B4A2}"	""	"AfwijkendeKantopsluiting"	"{E6B81AC2-63A3-4bc3-97F7-0142D136327D}"	"LEKantopsluitingKleur"	"Kleur"	"De kleur van de afwijkende kantopsluiting."	""	"Kleur"	"De kleur van de afwijkende kantopsluiting."	""	""	"true"	"https://data.vlaanderen.be/ns/wegenenverkeer/abstracten#"	"afwijkendekantopsluiting.kleur"	"http://www.w3.org/2002/07/owl#ObjectProperty"	"https://data.vlaanderen.be/ns/wegenenverkeer/abstracten#AfwijkendeKantopsluiting"	"http://www.w3.org/2004/02/skos/core#Concept"	""	"1"	"1"
"attribute"	"OSLO-Abstracten"	"lengte"	"{98E482FA-6BA2-44bb-967C-66D65E5D8909}"	""	"AfwijkendeKantopsluiting"	"{E6B81AC2-63A3-4bc3-97F7-0142D136327D}"	"Centimeter"	"Lengte"	"De lengte van de afwijkende kantopsluiting in centimeter
."	""	"Lengte"	"De lengte van de afwijkende kantopsluiting in centimeter
."	""	""	"true"	"https://data.vlaanderen.be/ns/wegenenverkeer/abstracten#"	"afwijkendekantopsluiting.lengte"	"http://www.w3.org/2002/07/owl#ObjectProperty"	"https://data.vlaanderen.be/ns/wegenenverkeer/abstracten#AfwijkendeKantopsluiting"	"https://wegenenverkeer.data.vlaanderen.be/ns/implementatieelement#Centimeter"	""	"1"	"1"
"attribute"	"OSLO-Abstracten"	"oppervlaktebehandeling"	"{95B8D47D-4C36-4489-A65F-03D85B20DE6E}"	""	"AfwijkendeKantopsluiting"	"{E6B81AC2-63A3-4bc3-97F7-0142D136327D}"	"Boolean"	"Oppervlaktebehandeling"	"Aanduiding of er een oppervlaktebehandeling is uitgevoerd op de afwijkende kantopsluiting
."	""	"Oppervlaktebehandeling"	"Aanduiding of er een oppervlaktebehandeling is uitgevoerd op de afwijkende kantopsluiting
."	""	""	"true"	"https://data.vlaanderen.be/ns/wegenenverkeer/abstracten#"	"afwijkendekantopsluiting.oppervlaktebehandeling"	"http://www.w3.org/2002/07/owl#DatatypeProperty"	"https://data.vlaanderen.be/ns/wegenenverkeer/abstracten#AfwijkendeKantopsluiting"	"http://www.w3.org/2001/XMLSchema#boolean"	""	"1"	"1"
"attribute"	"OSLO-Abstracten"	"soort"	"{E21B646E-C291-4566-891E-9B427B93A586}"	""	"AfwijkendeKantopsluiting"	"{E6B81AC2-63A3-4bc3-97F7-0142D136327D}"	"LEKantopsluitingSoort"	"Soort"	"De soort van de afwijkende kantopsluiting."	""	"Soort"	"De soort van de afwijkende kantopsluiting."	""	""	"true"	"https://data.vlaanderen.be/ns/wegenenverkeer/abstracten#"	"afwijkendekantopsluiting.soort"	"http://www.w3.org/2002/07/owl#ObjectProperty"	"https://data.vlaanderen.be/ns/wegenenverkeer/abstracten#AfwijkendeKantopsluiting"	"http://www.w3.org/2004/02/skos/core#Concept"	""	"1"	"1"
"attribute"	"OSLO-Abstracten"	"technischeFicheAfwijking"	"{0D6440C8-35EB-47e7-BDC8-AB9C810A500B}"	""	"AfwijkendeKantopsluiting"	"{E6B81AC2-63A3-4bc3-97F7-0142D136327D}"	"AlgDocumenttype"	"Technische fiche afwijking"	"De technische fiche van de afwijkende kantopsluiting"	""	"Technische fiche afwijking"	"De technische fiche van de afwijkende kantopsluiting"	""	""	"true"	"https://data.vlaanderen.be/ns/wegenenverkeer/abstracten#"	"afwijkendekantopsluiting.technischeficheafwijking"	"http://www.w3.org/2002/07/owl#ObjectProperty"	"https://data.vlaanderen.be/ns/wegenenverkeer/abstracten#AfwijkendeKantopsluiting"	"http://www.w3.org/2004/02/skos/core#Concept"	""	"1"	"n"
"attribute"	"OSLO-Installatie"	"dwarsprofiel"	"{414701B0-5350-477d-B2ED-7A0F666304D3}"	""	"Baanlichaam"	"{5626506C-7A3F-46f4-8C06-9C52996A4696}"	"AlgDocumenttype"	"Dwarsprofiel"	"Een dwarsprofiel is een doorsnijding van een terrein of constructie met een verticaal vlak, aangebracht loodrecht op de as ervan."	""	"Dwarsprofiel"	"Een dwarsprofiel is een doorsnijding van een terrein of constructie met een verticaal vlak, aangebracht loodrecht op de as ervan."	""	""	"true"	"https://data.vlaanderen.be/ns/wegenenverkeer/installatie#"	"baanlichaam.dwarsprofiel"	"http://www.w3.org/2002/07/owl#ObjectProperty"	"https://data.vlaanderen.be/ns/wegenenverkeer/installatie#Baanlichaam"	"http://www.w3.org/2004/02/skos/core#Concept"	""	"1"	"1"
"attribute"	"OSLO-Installatie"	"horizontaleLigging"	"{D1C0B093-61E7-4572-B699-6CB4A5ED3474}"	""	"Baanlichaam"	"{5626506C-7A3F-46f4-8C06-9C52996A4696}"	"AlgDocumenttype"	"Horizontale ligging"	"De horizontale ligging van het baanlichaam als document bijlage."	""	"Horizontale ligging"	"De horizontale ligging van het baanlichaam als document bijlage."	""	""	"true"	"https://data.vlaanderen.be/ns/wegenenverkeer/installatie#"	"baanlichaam.horizontaleligging"	"http://www.w3.org/2002/07/owl#ObjectProperty"	"https://data.vlaanderen.be/ns/wegenenverkeer/installatie#Baanlichaam"	"http://www.w3.org/2004/02/skos/core#Concept"	""	"1"	"1"
"attribute"	"OSLO-Installatie"	"langsprofiel"	"{254DE162-1190-4697-9FA2-A76D144FFF37}"	""	"Baanlichaam"	"{5626506C-7A3F-46f4-8C06-9C52996A4696}"	"AlgDocumenttype"	"Langsprofiel"	"Een langsprofiel is een doorsnijding van een terrein of constructie met een verticaal vlak, aangebracht in de lengterichting van de as ervan."	""	"Langsprofiel"	"Een langsprofiel is een doorsnijding van een terrein of constructie met een verticaal vlak, aangebracht in de lengterichting van de as ervan."	""	""	"true"	"https://data.vlaanderen.be/ns/wegenenverkeer/installatie#"	"baanlichaam.langsprofiel"	"http://www.w3.org/2002/07/owl#ObjectProperty"	"https://data.vlaanderen.be/ns/wegenenverkeer/installatie#Baanlichaam"	"http://www.w3.org/2004/02/skos/core#Concept"	""	"1"	"1"
"attribute"	"OSLO-Abstracten"	"breedte"	"{B1B6FB14-B0BF-4d8e-94BF-3AC5CCC7D360}"	""	"Laag"	"{58E7E3BD-A9A9-4e04-957D-942F897D7ED8}"	"KwantWrdInMeter"	"Breedte"	"De gemiddelde breedte van een laag in meter."	""	"Breedte"	"De gemiddelde breedte van een laag in meter."	""	""	"true"	"https://data.vlaanderen.be/ns/wegenenverkeer/abstracten#"	"laag.breedte"	"http://www.w3.org/2002/07/owl#ObjectProperty"	"https://data.vlaanderen.be/ns/wegenenverkeer/abstracten#Laag"	"https://wegenenverkeer.data.vlaanderen.be/ns/implementatieelement#KwantWrdInMeter"	""	"1"	"1"
"attribute"	"OSLO-Abstracten"	"laagRol"	"{33674684-62D6-4803-BB1B-B97DB1D918FF}"	""	"Laag"	"{58E7E3BD-A9A9-4e04-957D-942F897D7ED8}"	"LaagRol"	"Laagrol"	"De functie die de laag vervult in de verticale opbouw."	""	"Laagrol"	"De functie die de laag vervult in de verticale opbouw."	""	""	"true"	"https://data.vlaanderen.be/ns/wegenenverkeer/abstracten#"	"laag.laagrol"	"http://www.w3.org/2002/07/owl#ObjectProperty"	"https://data.vlaanderen.be/ns/wegenenverkeer/abstracten#Laag"	"http://www.w3.org/2004/02/skos/core#Concept"	""	"1"	"1"
"attribute"	"OSLO-Abstracten"	"lengte"	"{FA08A6B6-30C4-403d-889C-CC68626FB900}"	""	"Laag"	"{58E7E3BD-A9A9-4e04-957D-942F897D7ED8}"	"KwantWrdInMeter"	"Lengte"	"De gemiddelde lengte van een laag in meter."	""	"Lengte"	"De gemiddelde lengte van een laag in meter."	""	""	"true"	"https://data.vlaanderen.be/ns/wegenenverkeer/abstracten#"	"laag.lengte"	"http://www.w3.org/2002/07/owl#ObjectProperty"	"https://data.vlaanderen.be/ns/wegenenverkeer/abstracten#Laag"	"https://wegenenverkeer.data.vlaanderen.be/ns/implementatieelement#KwantWrdInMeter"	""	"1"	"1"
"attribute"	"OSLO-Abstracten"	"oppervlakte"	"{8CAD8483-C674-4d8c-9D55-DAE3BA4C9B67}"	""	"Laag"	"{58E7E3BD-A9A9-4e04-957D-942F897D7ED8}"	"VierkanteMeter"	"Oppervlakte"	"De oppervlakte van een laag in m²."	""	"Oppervlakte"	"De oppervlakte van een laag in m²."	""	""	"true"	"https://data.vlaanderen.be/ns/wegenenverkeer/abstracten#"	"laag.oppervlakte"	"http://www.w3.org/2002/07/owl#ObjectProperty"	"https://data.vlaanderen.be/ns/wegenenverkeer/abstracten#Laag"	"https://wegenenverkeer.data.vlaanderen.be/ns/implementatieelement#VierkanteMeter"	""	"1"	"1"
"attribute"	"OSLO-Abstracten"	"certificaathouder"	"{7FD30A11-0345-4dc0-8E76-41EC38DA5228}"	""	"AfschermendeConstructie"	"{4B0764F9-6532-4c7a-BA45-17608719C789}"	"String"	"Certificaathouder"	"De houder van het uitvoeringscertificaat."	""	"Certificaathouder"	"De houder van het uitvoeringscertificaat."	""	""	"true"	"https://data.vlaanderen.be/ns/wegenenverkeer/abstracten#"	"afschermendeconstructie.certificaathouder"	"http://www.w3.org/2002/07/owl#DatatypeProperty"	"https://data.vlaanderen.be/ns/wegenenverkeer/abstracten#AfschermendeConstructie"	"http://www.w3.org/2001/XMLSchema#string"	""	"1"	"1"
"attribute"	"OSLO-Abstracten"	"funderingswijze"	"{493DD753-E3B3-41ad-B953-53166A4F9A67}"	""	"AfschermendeConstructie"	"{4B0764F9-6532-4c7a-BA45-17608719C789}"	"LEACFunderingswijze"	"Funderingswijze"	"De manier waarop de afschermende constructie gemonteerd wordt."	""	"Funderingswijze"	"De manier waarop de afschermende constructie gemonteerd wordt."	""	""	"true"	"https://data.vlaanderen.be/ns/wegenenverkeer/abstracten#"	"afschermendeconstructie.funderingswijze"	"http://www.w3.org/2002/07/owl#ObjectProperty"	"https://data.vlaanderen.be/ns/wegenenverkeer/abstracten#AfschermendeConstructie"	"http://www.w3.org/2004/02/skos/core#Concept"	""	"1"	"1"
"attribute"	"OSLO-Abstracten"	"materiaal"	"{BB9F1D5E-8A2F-4a95-97CA-F31D90EEACA3}"	""	"AfschermendeConstructie"	"{4B0764F9-6532-4c7a-BA45-17608719C789}"	"LEACMateriaal"	"Materiaal"	"Het gebruikte materiaal voor de afschermende constructie."	""	"Materiaal"	"Het gebruikte materiaal voor de afschermende constructie."	""	""	"true"	"https://data.vlaanderen.be/ns/wegenenverkeer/abstracten#"	"afschermendeconstructie.materiaal"	"http://www.w3.org/2002/07/owl#ObjectProperty"	"https://data.vlaanderen.be/ns/wegenenverkeer/abstracten#AfschermendeConstructie"	"http://www.w3.org/2004/02/skos/core#Concept"	""	"1"	"1"
"attribute"	"OSLO-Abstracten"	"permanent"	"{359EB0CE-509B-447e-8AAB-2139E255D1C0}"	""	"AfschermendeConstructie"	"{4B0764F9-6532-4c7a-BA45-17608719C789}"	"Boolean"	"Permanent"	"Vermelding of de afschermende constructie al dan niet van permanente aard is."	""	"Permanent"	"Vermelding of de afschermende constructie al dan niet van permanente aard is."	""	""	"true"	"https://data.vlaanderen.be/ns/wegenenverkeer/abstracten#"	"afschermendeconstructie.permanent"	"http://www.w3.org/2002/07/owl#DatatypeProperty"	"https://data.vlaanderen.be/ns/wegenenverkeer/abstracten#AfschermendeConstructie"	"http://www.w3.org/2001/XMLSchema#boolean"	""	"1"	"1"
"attribute"	"OSLO-Abstracten"	"productidentificatiecode"	"{A6BCB7F8-0220-44bd-AAE3-B1AD48796FC9}"	""	"AfschermendeConstructie"	"{4B0764F9-6532-4c7a-BA45-17608719C789}"	"Productidentificatiecode"	"Productidentificatiecode"	"De productidentificatiecode voor het bepalen van de code van het gebruikte product (bv. COPRO/BENOR)."	""	"Productidentificatiecode"	"De productidentificatiecode voor het bepalen van de code van het gebruikte product (bv. COPRO/BENOR)."	""	""	"true"	"https://data.vlaanderen.be/ns/wegenenverkeer/abstracten#"	"afschermendeconstructie.productidentificatiecode"	"http://www.w3.org/2002/07/owl#ObjectProperty"	"https://data.vlaanderen.be/ns/wegenenverkeer/abstracten#AfschermendeConstructie"	"https://wegenenverkeer.data.vlaanderen.be/ns/implementatieelement#Productidentificatiecode"	""	"1"	"1"
"attribute"	"OSLO-Abstracten"	"uitvoeringscertificatie"	"{AF210BF7-0A35-4e20-945F-BB13DA3ABADA}"	""	"AfschermendeConstructie"	"{4B0764F9-6532-4c7a-BA45-17608719C789}"	"AlgDocumenttype"	"Uitvoeringscertificatie"	"Documentatie van het certificaat."	""	"Uitvoeringscertificatie"	"Documentatie van het certificaat."	""	""	"true"	"https://data.vlaanderen.be/ns/wegenenverkeer/abstracten#"	"afschermendeconstructie.uitvoeringscertificatie"	"http://www.w3.org/2002/07/owl#ObjectProperty"	"https://data.vlaanderen.be/ns/wegenenverkeer/abstracten#AfschermendeConstructie"	"http://www.w3.org/2004/02/skos/core#Concept"	""	"1"	"1"
"attribute"	"OSLO-Abstracten"	"video"	"{E2C2B6DC-461B-486e-BE30-DEC6A1B6DEB8}"	""	"AfschermendeConstructie"	"{4B0764F9-6532-4c7a-BA45-17608719C789}"	"AlgDocumenttype"	"Video"	"Video van de testen op afschermende constructies."	""	"Video"	"Video van de testen op afschermende constructies."	""	""	"true"	"https://data.vlaanderen.be/ns/wegenenverkeer/abstracten#"	"afschermendeconstructie.video"	"http://www.w3.org/2002/07/owl#ObjectProperty"	"https://data.vlaanderen.be/ns/wegenenverkeer/abstracten#AfschermendeConstructie"	"http://www.w3.org/2004/02/skos/core#Concept"	""	"1"	"n"
