"EA-Type"	"EA-Package"	"EA-Name"	"EA-GUID"	"EA-Parent"	"EA-Domain"	"EA-Domain-GUID"	"EA-Range"	"label"	"definition"	"usage"	"ap-label-nl"	"ap-definition-nl"	"ap-usageNote-nl"	"ap-codelist"	"external term"	"namespace"	"localname"	"type"	"domain"	"range"	"parent"	"min card"	"max card"
"Package"	""	"OSLO-Lijnvormige-elementen"	"{AF4B4D14-F787-420b-8EF5-70532180A344}"	""	""	""	""	""	""	""	""	""	""	""	""	"http://"	"fixme.com"	"http://www.w3.org/2002/07/owl#Ontology"	""	""	""	""	""
"CLASS"	"OSLO-Abstracten"	"GestandariseerdeKantopsluitingType"	"{2AD102A8-DADB-4299-98B8-8E62C0B5FD1F}"	""	""	""	""	"Gestandariseerde kantopsluiting type"	"Abstracte van de gemeenschappelijke eigenschappen voor de gestandariseerde kantopsluiting types"	""	"Gestandariseerde kantopsluiting type"	"Abstracte van de gemeenschappelijke eigenschappen voor de gestandariseerde kantopsluiting types"	""	""	"true"	"https://data.vlaanderen.be/ns/wegenenverkeer/abstracten#"	"GestandariseerdeKantopsluitingType"	"http://www.w3.org/2000/01/rdf-schema#Class"	""	""	""	""	""
"CLASS"	"OSLO-Onderdeel"	"TrottoirbandAfw"	"{519FE46D-7161-46f7-AC03-841D9E827E50}"	"AfwijkendeKantopsluiting"	""	""	""	"Afwijkende trottoirband"	"Kantopsluiting bestemd om de rand van de verharding te beschermen en te versterken."	""	"Afwijkende trottoirband"	"Kantopsluiting bestemd om de rand van de verharding te beschermen en te versterken."	""	""	"true"	"https://data.vlaanderen.be/ns/wegenenverkeer/onderdeel#"	"TrottoirbandAfw"	"http://www.w3.org/2000/01/rdf-schema#Class"	""	""	"https://data.vlaanderen.be/ns/wegenenverkeer/abstracten#AfwijkendeKantopsluiting"	""	""
"CLASS"	"OSLO-Onderdeel"	"WatergreppelAfw"	"{1455340D-C3E8-4667-B99E-1F8291404695}"	"AfwijkendeKantopsluiting"	""	""	""	"Afwijkende watergreppel"	"Kantopsluiting bestemd om water van de verharding op te vangen en af te voeren."	""	"Afwijkende watergreppel"	"Kantopsluiting bestemd om water van de verharding op te vangen en af te voeren."	""	""	"true"	"https://data.vlaanderen.be/ns/wegenenverkeer/onderdeel#"	"WatergreppelAfw"	"http://www.w3.org/2000/01/rdf-schema#Class"	""	""	"https://data.vlaanderen.be/ns/wegenenverkeer/abstracten#AfwijkendeKantopsluiting"	""	""
"CLASS"	"OSLO-Onderdeel"	"TrottoirbandWatergreppelAfw"	"{5E3CD29C-631F-4a5b-9820-4B7E09BA6686}"	"AfwijkendeKantopsluiting"	""	""	""	"Afwijkende trottoirband-watergreppel"	"Kantopsluiting die een trottoirband en een watergreppel combineert in een geheel."	""	"Afwijkende trottoirband-watergreppel"	"Kantopsluiting die een trottoirband en een watergreppel combineert in een geheel."	""	""	"true"	"https://data.vlaanderen.be/ns/wegenenverkeer/onderdeel#"	"TrottoirbandWatergreppelAfw"	"http://www.w3.org/2000/01/rdf-schema#Class"	""	""	"https://data.vlaanderen.be/ns/wegenenverkeer/abstracten#AfwijkendeKantopsluiting"	""	""
"CLASS"	"OSLO-Onderdeel"	"KantstrookAfw"	"{AA4FF97F-F25D-4673-9FB3-60629AC48646}"	"AfwijkendeKantopsluiting"	""	""	""	"Afwijkende kantstrook"	"Kantopsluiting bestemd om de verharding steun te geven."	""	"Afwijkende kantstrook"	"Kantopsluiting bestemd om de verharding steun te geven."	""	""	"true"	"https://data.vlaanderen.be/ns/wegenenverkeer/onderdeel#"	"KantstrookAfw"	"http://www.w3.org/2000/01/rdf-schema#Class"	""	""	"https://data.vlaanderen.be/ns/wegenenverkeer/abstracten#AfwijkendeKantopsluiting"	""	""
"CLASS"	"OSLO-Onderdeel"	"SchampkantAfw"	"{848EBDAB-D754-457f-BD5B-0A43CBB016A3}"	"AfwijkendeKantopsluiting"	""	""	""	"Afwijkend schampkant"	"Kantopsluiting die zones van voertuigenverkeer onderling of voertuigenzones van andere
verkeerszones scheidt en de overschrijding door voertuigen bemoeilijkt maar geen voertuigkerende
functie heeft."	""	"Afwijkend schampkant"	"Kantopsluiting die zones van voertuigenverkeer onderling of voertuigenzones van andere
verkeerszones scheidt en de overschrijding door voertuigen bemoeilijkt maar geen voertuigkerende
functie heeft."	""	""	"true"	"https://data.vlaanderen.be/ns/wegenenverkeer/onderdeel#"	"SchampkantAfw"	"http://www.w3.org/2000/01/rdf-schema#Class"	""	""	"https://data.vlaanderen.be/ns/wegenenverkeer/abstracten#AfwijkendeKantopsluiting"	""	""
"CLASS"	"OSLO-Onderdeel"	"SchampkantStdType"	"{2D0CDEA7-5803-4329-9F91-0F3405EBF290}"	"GestandariseerdeKantopsluitingType"	""	""	""	"Gestandaardiseerde schampkant type"	"Type object als template voor eigenschappen van de gestandaardiseerde schampkant."	""	"Gestandaardiseerde schampkant type"	"Type object als template voor eigenschappen van de gestandaardiseerde schampkant."	""	""	"true"	"https://data.vlaanderen.be/ns/wegenenverkeer/onderdeel#"	"SchampkantStdType"	"http://www.w3.org/2000/01/rdf-schema#Class"	""	""	"https://data.vlaanderen.be/ns/wegenenverkeer/abstracten#GestandariseerdeKantopsluitingType"	""	""
"CLASS"	"OSLO-Onderdeel"	"KantstrookStdType"	"{12BDFC88-187F-4f55-AC9D-ADA4D54EE8A5}"	"GestandariseerdeKantopsluitingType"	""	""	""	"Gestandaardiseerde kantstrook type"	"Type object als template voor eigenschappen van de gestandaardiseerde kantstrook."	""	"Gestandaardiseerde kantstrook type"	"Type object als template voor eigenschappen van de gestandaardiseerde kantstrook."	""	""	"true"	"https://data.vlaanderen.be/ns/wegenenverkeer/onderdeel#"	"KantstrookStdType"	"http://www.w3.org/2000/01/rdf-schema#Class"	""	""	"https://data.vlaanderen.be/ns/wegenenverkeer/abstracten#GestandariseerdeKantopsluitingType"	""	""
"CLASS"	"OSLO-Onderdeel"	"TrottoirbandWatergreppelStdType"	"{938FDC76-692D-473c-A41E-C38C325BBA9C}"	"GestandariseerdeKantopsluitingType"	""	""	""	"Gestandaardiseerde trottoirband-watergreppel type"	"Type object als template voor eigenschappen van de gestandaardiseerde trottoirband_watergreppel."	""	"Gestandaardiseerde trottoirband-watergreppel type"	"Type object als template voor eigenschappen van de gestandaardiseerde trottoirband_watergreppel."	""	""	"true"	"https://data.vlaanderen.be/ns/wegenenverkeer/onderdeel#"	"TrottoirbandWatergreppelStdType"	"http://www.w3.org/2000/01/rdf-schema#Class"	""	""	"https://data.vlaanderen.be/ns/wegenenverkeer/abstracten#GestandariseerdeKantopsluitingType"	""	""
"CLASS"	"OSLO-Onderdeel"	"WatergreppelStdType"	"{74826583-7C71-4cab-91CB-00051DC8E836}"	"GestandariseerdeKantopsluitingType"	""	""	""	"Gestandaardiseerde watergreppel type"	"Type object als template voor eigenschappen van de gestandaardiseerde watergreppel."	""	"Gestandaardiseerde watergreppel type"	"Type object als template voor eigenschappen van de gestandaardiseerde watergreppel."	""	""	"true"	"https://data.vlaanderen.be/ns/wegenenverkeer/onderdeel#"	"WatergreppelStdType"	"http://www.w3.org/2000/01/rdf-schema#Class"	""	""	"https://data.vlaanderen.be/ns/wegenenverkeer/abstracten#GestandariseerdeKantopsluitingType"	""	""
"CLASS"	"OSLO-Onderdeel"	"TrottoirbandStdType"	"{68C08F9A-31E6-4fbd-8E53-5A26F16EFCD5}"	"GestandariseerdeKantopsluitingType"	""	""	""	"Gestandaardiseerde trottoirband type"	"Type object als template voor eigenschappen van de gestandaardiseerde trottoirband."	""	"Gestandaardiseerde trottoirband type"	"Type object als template voor eigenschappen van de gestandaardiseerde trottoirband."	""	""	"true"	"https://data.vlaanderen.be/ns/wegenenverkeer/onderdeel#"	"TrottoirbandStdType"	"http://www.w3.org/2000/01/rdf-schema#Class"	""	""	"https://data.vlaanderen.be/ns/wegenenverkeer/abstracten#GestandariseerdeKantopsluitingType"	""	""
"CLASS"	"OSLO-Onderdeel"	"TrottoirbandWatergreppelStd"	"{7832E442-3AB4-433a-9EAB-BC97220B629B}"	"GestandaardiseerdeKantopsluiting"	""	""	""	"Gestandaardiseerdetrottoirband-watergreppel"	"Kantopsluiting die een trottoirband en een watergreppel combineert in een geheel."	""	"Gestandaardiseerdetrottoirband-watergreppel"	"Kantopsluiting die een trottoirband en een watergreppel combineert in een geheel."	""	""	"true"	"https://data.vlaanderen.be/ns/wegenenverkeer/onderdeel#"	"TrottoirbandWatergreppelStd"	"http://www.w3.org/2000/01/rdf-schema#Class"	""	""	"https://data.vlaanderen.be/ns/wegenenverkeer/abstracten#GestandaardiseerdeKantopsluiting"	""	""
"CLASS"	"OSLO-Onderdeel"	"SchampkantStd"	"{0D076C20-7666-4afc-9ED9-5DE78D58D296}"	"GestandaardiseerdeKantopsluiting"	""	""	""	"Gestandaardiseerde schampkant"	"Kantopsluiting die zones van voertuigenverkeer onderling of voertuigenzones van andere
verkeerszones scheidt en de overschrijding door voertuigen bemoeilijkt maar geen voertuigkerende
functie heeft."	""	"Gestandaardiseerde schampkant"	"Kantopsluiting die zones van voertuigenverkeer onderling of voertuigenzones van andere
verkeerszones scheidt en de overschrijding door voertuigen bemoeilijkt maar geen voertuigkerende
functie heeft."	""	""	"true"	"https://data.vlaanderen.be/ns/wegenenverkeer/onderdeel#"	"SchampkantStd"	"http://www.w3.org/2000/01/rdf-schema#Class"	""	""	"https://data.vlaanderen.be/ns/wegenenverkeer/abstracten#GestandaardiseerdeKantopsluiting"	""	""
"CLASS"	"OSLO-Onderdeel"	"KantstrookStd"	"{7CC57DCE-6CF7-4a2d-AB91-871448B40312}"	"GestandaardiseerdeKantopsluiting"	""	""	""	"Gestandaardiseerde Kantstrook"	"Kantopsluiting bestemd om de verharding steun te geven."	""	"Gestandaardiseerde Kantstrook"	"Kantopsluiting bestemd om de verharding steun te geven."	""	""	"true"	"https://data.vlaanderen.be/ns/wegenenverkeer/onderdeel#"	"KantstrookStd"	"http://www.w3.org/2000/01/rdf-schema#Class"	""	""	"https://data.vlaanderen.be/ns/wegenenverkeer/abstracten#GestandaardiseerdeKantopsluiting"	""	""
"CLASS"	"OSLO-Onderdeel"	"WatergreppelStd"	"{30579EB6-6BEA-4e5b-A866-F60F55931C61}"	"GestandaardiseerdeKantopsluiting"	""	""	""	"Gestandaardiseerde watergreppel"	"Kantopsluiting bestemd om water van de verharding op te vangen en af te voeren."	""	"Gestandaardiseerde watergreppel"	"Kantopsluiting bestemd om water van de verharding op te vangen en af te voeren."	""	""	"true"	"https://data.vlaanderen.be/ns/wegenenverkeer/onderdeel#"	"WatergreppelStd"	"http://www.w3.org/2000/01/rdf-schema#Class"	""	""	"https://data.vlaanderen.be/ns/wegenenverkeer/abstracten#GestandaardiseerdeKantopsluiting"	""	""
"CLASS"	"OSLO-Onderdeel"	"TrottoirbandStd"	"{BC5D8392-95AC-4118-B47A-FD497C000E5A}"	"GestandaardiseerdeKantopsluiting"	""	""	""	"Gestandaardiseerde trottoirband"	"Kantopsluiting bestemd om de rand van de verharding te beschermen en te versterken."	""	"Gestandaardiseerde trottoirband"	"Kantopsluiting bestemd om de rand van de verharding te beschermen en te versterken."	""	""	"true"	"https://data.vlaanderen.be/ns/wegenenverkeer/onderdeel#"	"TrottoirbandStd"	"http://www.w3.org/2000/01/rdf-schema#Class"	""	""	"https://data.vlaanderen.be/ns/wegenenverkeer/abstracten#GestandaardiseerdeKantopsluiting"	""	""
"DATATYPE"	"OSLO-Onderdeel"	"GCMateriaalKarakteristiek"	"{B9A9B255-F2CB-4711-8241-E9F25F63453D}"	""	""	""	""	"Materiaal karakteristiek"	"Het materiaal en zijn geluidskarakteristiek van de geluidswerende constructie."	""	"Materiaal karakteristiek"	"Het materiaal en zijn geluidskarakteristiek van de geluidswerende constructie."	""	""	"true"	"https://data.vlaanderen.be/ns/wegenenverkeer/onderdeel#"	"GCMateriaalKarakteristiek"	"http://www.w3.org/2000/01/rdf-schema#Class"	""	""	""	""	""
"DATATYPE"	"OSLO-Onderdeel"	"OverzichtSchermhoogte"	"{7F4E5A53-BBB3-47c2-91B8-90B6BF9A93EF}"	""	""	""	""	"Overzicht schermhoogte."	"Het overzicht met betrekking tot de  schermhoogte."	""	"Overzicht schermhoogte."	"Het overzicht met betrekking tot de  schermhoogte."	""	""	"true"	"https://data.vlaanderen.be/ns/wegenenverkeer/onderdeel#"	"OverzichtSchermhoogte"	"http://www.w3.org/2000/01/rdf-schema#Class"	""	""	""	""	""
"CLASS"	"OSLO-Abstracten"	"AansluitendeConstructies"	"{0F7919D1-997B-45a5-973A-482A6E5131AA}"	"AfschermendeConstructie"	""	""	""	"Aansluitende constructies"	"Abstracte die alle aansluitende constructies samenbundelt."	""	"Aansluitende constructies"	"Abstracte die alle aansluitende constructies samenbundelt."	""	""	"true"	"https://data.vlaanderen.be/ns/wegenenverkeer/abstracten#"	"AansluitendeConstructies"	"http://www.w3.org/2000/01/rdf-schema#Class"	""	""	"https://data.vlaanderen.be/ns/wegenenverkeer/abstracten#AfschermendeConstructie"	""	""
"CLASS"	"OSLO-Abstracten"	"VegetatieElement"	"{AD10D488-167D-4022-B9E1-B9F509DED2DA}"	""	""	""	""	"Vegetatie element"	"Solitaire plant in de ruimte."	""	"Vegetatie element"	"Solitaire plant in de ruimte."	""	""	"true"	"https://data.vlaanderen.be/ns/wegenenverkeer/abstracten#"	"VegetatieElement"	"http://www.w3.org/2000/01/rdf-schema#Class"	""	""	"https://wegenenverkeer.data.vlaanderen.be/ns/implementatieelement#AWVObject"	""	""
"CLASS"	"OSLO-Installatie"	"Wegberm"	"{32E6A774-CEA0-4726-986D-B7409A744BC2}"	""	""	""	""	"Wegberm"	"Gedeelte van het wegplatform dat buiten de rijbanen ligt. Een wegberm kan sloten en bijzonder ingerichte onderdelen bevatten."	""	"Wegberm"	"Gedeelte van het wegplatform dat buiten de rijbanen ligt. Een wegberm kan sloten en bijzonder ingerichte onderdelen bevatten."	""	""	"true"	"https://data.vlaanderen.be/ns/wegenenverkeer/installatie#"	"Wegberm"	"http://www.w3.org/2000/01/rdf-schema#Class"	""	""	"https://wegenenverkeer.data.vlaanderen.be/ns/implementatieelement#AWVObject, https://data.vlaanderen.be/ns/wegenenverkeer/abstracten#TerreinDeel"	""	""
"DATATYPE"	"OSLO-Onderdeel"	"TrottoirbandVorm"	"{706DCB6C-DEA9-42ec-88FC-792FD565899A}"	""	""	""	""	"Trottoirband vorm"	""	""	"Trottoirband vorm"	"TODO"	""	""	"true"	"https://data.vlaanderen.be/ns/wegenenverkeer/onderdeel#"	"TrottoirbandVorm"	"http://www.w3.org/2000/01/rdf-schema#Class"	""	""	""	""	""
"CLASS"	"OSLO-Onderdeel"	"Motorvangplank"	"{DFADA3BC-AD0E-485f-811E-039F7C168A25}"	""	""	""	""	"Motorvangplank"	"Een constructie geïnstalleerd aan een geleideconstructie of in de onmiddellijke omgeving ervan, met als doel de ernst van een botsing van een motorrijder met de geleideconstructie te reduceren."	""	"Motorvangplank"	"Een constructie geïnstalleerd aan een geleideconstructie of in de onmiddellijke omgeving ervan, met als doel de ernst van een botsing van een motorrijder met de geleideconstructie te reduceren."	""	""	"true"	"https://data.vlaanderen.be/ns/wegenenverkeer/onderdeel#"	"Motorvangplank"	"http://www.w3.org/2000/01/rdf-schema#Class"	""	""	"https://wegenenverkeer.data.vlaanderen.be/ns/proefenmeting#ProefAPrioriMotorvangplank, https://wegenenverkeer.data.vlaanderen.be/ns/implementatieelement#AWVObject"	""	""
"CLASS"	"OSLO-Onderdeel"	"GetesteBeginconstructie"	"{D500834E-DD9F-4c86-A3A2-AEF0A4C8EC3C}"	"Beginstuk"	""	""	""	"Geteste beginconstructie"	"Een gecertficeerd begin aan een geleideconstructie, met als doel de ernst van een frontale botsing te reduceren aan de stroomopwaartse zijde ten opzichte van de meest nabij gelegen rijstrook."	""	"Geteste beginconstructie"	"Een gecertficeerd begin aan een geleideconstructie, met als doel de ernst van een frontale botsing te reduceren aan de stroomopwaartse zijde ten opzichte van de meest nabij gelegen rijstrook."	""	""	"true"	"https://data.vlaanderen.be/ns/wegenenverkeer/onderdeel#"	"GetesteBeginconstructie"	"http://www.w3.org/2000/01/rdf-schema#Class"	""	""	"https://wegenenverkeer.data.vlaanderen.be/ns/proefenmeting#ProefAPrioriGetesteBeginconstructie, https://data.vlaanderen.be/ns/wegenenverkeer/abstracten#Beginstuk"	""	""
"CLASS"	"OSLO-Onderdeel"	"NietGetestBeginstuk"	"{AEAE1D71-CC25-4a1b-9ED6-0219428A8939}"	"Beginstuk"	""	""	""	"Niet getest beginstuk"	"Een niet-gecertificeerd begin aan een geleideconstructie, aan de stroomopwaartse zijde ten opzichte van de meest nabij gelegen rijstrook."	""	"Niet getest beginstuk"	"Een niet-gecertificeerd begin aan een geleideconstructie, aan de stroomopwaartse zijde ten opzichte van de meest nabij gelegen rijstrook."	""	""	"true"	"https://data.vlaanderen.be/ns/wegenenverkeer/onderdeel#"	"NietGetestBeginstuk"	"http://www.w3.org/2000/01/rdf-schema#Class"	""	""	"https://data.vlaanderen.be/ns/wegenenverkeer/abstracten#Beginstuk"	""	""
"CLASS"	"OSLO-Abstracten"	"Beginstuk"	"{D5C3A2EA-E02C-4121-B6CE-2909E6135BE4}"	"AansluitendeConstructies"	""	""	""	"Beginstuk"	"Een stuk aan het uiteinde van een geleideconstructie, met als doel een frontale botsing te reduceren gericht naar het naderende verkeer."	""	"Beginstuk"	"Een stuk aan het uiteinde van een geleideconstructie, met als doel een frontale botsing te reduceren gericht naar het naderende verkeer."	""	""	"true"	"https://data.vlaanderen.be/ns/wegenenverkeer/abstracten#"	"Beginstuk"	"http://www.w3.org/2000/01/rdf-schema#Class"	""	""	"https://data.vlaanderen.be/ns/wegenenverkeer/abstracten#AansluitendeConstructies"	""	""
"CLASS"	"OSLO-Onderdeel"	"Overgangsconstructie"	"{CA188375-2276-4ff1-9CEF-C79A0837DC8B}"	"AansluitendeConstructies"	""	""	""	"Overgangsconstructie"	"Verbinding tussen twee afschermende constructies voor wegen van verschillende ontwerpen en/of prestatiekenmerken."	""	"Overgangsconstructie"	"Verbinding tussen twee afschermende constructies voor wegen van verschillende ontwerpen en/of prestatiekenmerken."	""	""	"true"	"https://data.vlaanderen.be/ns/wegenenverkeer/onderdeel#"	"Overgangsconstructie"	"http://www.w3.org/2000/01/rdf-schema#Class"	""	""	"https://wegenenverkeer.data.vlaanderen.be/ns/proefenmeting#ProefAPrioriOvergangsconstructie, https://data.vlaanderen.be/ns/wegenenverkeer/abstracten#AansluitendeConstructies"	""	""
"CLASS"	"OSLO-Onderdeel"	"Geleideconstructie"	"{B7DF148E-8EC0-4b49-ABDB-7E51205C281D}"	"AansluitendeConstructies"	""	""	""	"Geleideconstructie"	"Een doorlopende afschermende constructie voor voertuigen geïnstalleerd langs de weg of in de middenberm."	""	"Geleideconstructie"	"Een doorlopende afschermende constructie voor voertuigen geïnstalleerd langs de weg of in de middenberm."	""	""	"true"	"https://data.vlaanderen.be/ns/wegenenverkeer/onderdeel#"	"Geleideconstructie"	"http://www.w3.org/2000/01/rdf-schema#Class"	""	""	"https://wegenenverkeer.data.vlaanderen.be/ns/proefenmeting#ProefAPrioriGeleideConstructie, https://data.vlaanderen.be/ns/wegenenverkeer/abstracten#AansluitendeConstructies"	""	""
"CLASS"	"OSLO-Onderdeel"	"Eindstuk"	"{1DA79099-63C3-4756-8A8F-9F77D3B8EA2F}"	"AfschermendeConstructie"	""	""	""	"Eindstuk"	"Een niet-gecertificeerd einde aan een geleideconstructie, aan de stroomafwaartse zijde ten opzichte van de meest nabij gelegen rijstrook."	""	"Eindstuk"	"Een niet-gecertificeerd einde aan een geleideconstructie, aan de stroomafwaartse zijde ten opzichte van de meest nabij gelegen rijstrook."	""	""	"true"	"https://data.vlaanderen.be/ns/wegenenverkeer/onderdeel#"	"Eindstuk"	"http://www.w3.org/2000/01/rdf-schema#Class"	""	""	"https://data.vlaanderen.be/ns/wegenenverkeer/abstracten#AfschermendeConstructie"	""	""
"CLASS"	"OSLO-Onderdeel"	"Obstakelbeveiliger"	"{73227334-B898-4b76-96A8-22B2D938AC67}"	"AansluitendeConstructies"	""	""	""	"Obstakelbeveiliger"	"Een energie-absorberende constructie voor voertuigen, geïnstalleerd vóór één of meerdere obstakels, met als doel de ernst van een botsing te reduceren."	""	"Obstakelbeveiliger"	"Een energie-absorberende constructie voor voertuigen, geïnstalleerd vóór één of meerdere obstakels, met als doel de ernst van een botsing te reduceren."	""	""	"true"	"https://data.vlaanderen.be/ns/wegenenverkeer/onderdeel#"	"Obstakelbeveiliger"	"http://www.w3.org/2000/01/rdf-schema#Class"	""	""	"https://wegenenverkeer.data.vlaanderen.be/ns/proefenmeting#ProefAPrioriObstakelbeveiliger, https://data.vlaanderen.be/ns/wegenenverkeer/abstracten#AansluitendeConstructies"	""	""
"DATATYPE"	"OSLO-Proefenmeting"	"GeluidstestRapport"	"{B2BF9ACF-E5A1-44ba-8557-135C743616DF}"	""	""	""	""	"Geluidstest rapport"	"Het geluidstestrapport."	""	"Geluidstest rapport"	"Het geluidstestrapport."	""	""	"true"	"https://wegenenverkeer.data.vlaanderen.be/ns/proefenmeting#"	"GeluidstestRapport"	"http://www.w3.org/2000/01/rdf-schema#Class"	""	""	""	""	""
"CLASS"	"OSLO-Onderdeel"	"Zonnepaneel"	"{AA295A49-DA4F-4de1-889A-151AFBE2BAF4}"	""	""	""	""	"Zonnepaneel"	"Ook wel fotovoltaïsche cellen of zonnecellen.
Toestel om elektrische energie op te wekken uit zonlicht met als doel het voeden van een installatie."	""	"Zonnepaneel"	"Ook wel fotovoltaïsche cellen of zonnecellen.
Toestel om elektrische energie op te wekken uit zonlicht met als doel het voeden van een installatie."	""	""	"true"	"https://data.vlaanderen.be/ns/wegenenverkeer/onderdeel#"	"Zonnepaneel"	"http://www.w3.org/2000/01/rdf-schema#Class"	""	""	"https://wegenenverkeer.data.vlaanderen.be/ns/implementatieelement#AWVObject, https://data.vlaanderen.be/ns/wegenenverkeer/abstracten#TypenaamObject, https://data.vlaanderen.be/ns/wegenenverkeer/abstracten#Voedingspunt"	""	""
"CLASS"	"OSLO-Onderdeel"	"Pictogram"	"{7C88131E-C34D-40ba-BEC9-48F64B96DABB}"	""	""	""	""	"Pictogram"	"Een bord dat een symbool of afbeelding bevat dat de plaats inneemt van een tekst."	""	"Pictogram"	"Een bord dat een symbool of afbeelding bevat dat de plaats inneemt van een tekst."	""	""	"true"	"https://data.vlaanderen.be/ns/wegenenverkeer/onderdeel#"	"Pictogram"	"http://www.w3.org/2000/01/rdf-schema#Class"	""	""	"https://wegenenverkeer.data.vlaanderen.be/ns/implementatieelement#AWVObject"	""	""
"CLASS"	"OSLO-Abstracten"	"LijnvormigeElementen"	"{728C6382-F0D6-4b33-BC97-8F490C8702E0}"	""	""	""	""	"Lijnvormige elementen"	"Abstracte als verzameling voor de gemeenschappelijke eigenschappen van lijnvormige elementen."	""	"Lijnvormige elementen"	"Abstracte als verzameling voor de gemeenschappelijke eigenschappen van lijnvormige elementen."	""	""	"true"	"https://data.vlaanderen.be/ns/wegenenverkeer/abstracten#"	"LijnvormigeElementen"	"http://www.w3.org/2000/01/rdf-schema#Class"	""	""	"https://wegenenverkeer.data.vlaanderen.be/ns/implementatieelement#AWVObject"	""	""
"CLASS"	"OSLO-Installatie"	"Gronddam"	"{F3591EF0-2975-4b71-B4DB-13AD2C47410E}"	""	""	""	""	"Gronddam"	"Gronddammen zijn trapeziumvormige constructies bestaande uit zand, grond of steenachtige materialen. De onderkant van de gronddam wordt direct op het bestaand maaiveld aangebracht of op een vooraf aangebrachte grondverbetering."	""	"Gronddam"	"Gronddammen zijn trapeziumvormige constructies bestaande uit zand, grond of steenachtige materialen. De onderkant van de gronddam wordt direct op het bestaand maaiveld aangebracht of op een vooraf aangebrachte grondverbetering."	""	""	"true"	"https://data.vlaanderen.be/ns/wegenenverkeer/installatie#"	"Gronddam"	"http://www.w3.org/2000/01/rdf-schema#Class"	""	""	"https://wegenenverkeer.data.vlaanderen.be/ns/implementatieelement#AWVObject"	""	""
"CLASS"	"OSLO-Onderdeel"	"Opening"	"{423974A6-E842-405d-BFFF-9B6647EA8DDB}"	""	""	""	""	"Opening"	"Doorgangen voorzien als vluchtmogelijkheid met dezelfde akoestische kwaliteitseisen als de voorgestelde schermen bezitten."	""	"Opening"	"Doorgangen voorzien als vluchtmogelijkheid met dezelfde akoestische kwaliteitseisen als de voorgestelde schermen bezitten."	""	""	"true"	"https://data.vlaanderen.be/ns/wegenenverkeer/onderdeel#"	"Opening"	"http://www.w3.org/2000/01/rdf-schema#Class"	""	""	"https://wegenenverkeer.data.vlaanderen.be/ns/implementatieelement#AWVObject"	""	""
"CLASS"	"OSLO-Onderdeel"	"GeluidswerendeConstructie"	"{F1533883-16B7-43df-A48D-1ED1050AA0F5}"	"LijnvormigeElementen"	""	""	""	"Geluidswerende constructie"	"Een geluidswerende wandvormige constructie bestaande uit een desgevallend geluidsisolerend materiaal en/of geluidsabsorberend materiaal en voorzien van de nodige structuren om de bouwkundige stabiliteit te verzekeren.
"	""	"Geluidswerende constructie"	"Een geluidswerende wandvormige constructie bestaande uit een desgevallend geluidsisolerend materiaal en/of geluidsabsorberend materiaal en voorzien van de nodige structuren om de bouwkundige stabiliteit te verzekeren.
"	""	""	"true"	"https://data.vlaanderen.be/ns/wegenenverkeer/onderdeel#"	"GeluidswerendeConstructie"	"http://www.w3.org/2000/01/rdf-schema#Class"	""	""	"https://wegenenverkeer.data.vlaanderen.be/ns/proefenmeting#ProefAPrioriGeluidswerendeConstructie, https://wegenenverkeer.data.vlaanderen.be/ns/proefenmeting#ProefAPosterioriGeluidswerendeConstructie, https://data.vlaanderen.be/ns/wegenenverkeer/abstracten#LijnvormigeElementen"	""	""
"CLASS"	"OSLO-Abstracten"	"GestandaardiseerdeKantopsluiting"	"{2D14D96A-5311-422b-8C59-9402D4EE71DA}"	"Kantopsluiting"	""	""	""	"Gestandaardiseerde kantopsluiting"	"Abstracte voor een kantopsluiting die voldoet aan een bepaalde standaard."	""	"Gestandaardiseerde kantopsluiting"	"Abstracte voor een kantopsluiting die voldoet aan een bepaalde standaard."	""	""	"true"	"https://data.vlaanderen.be/ns/wegenenverkeer/abstracten#"	"GestandaardiseerdeKantopsluiting"	"http://www.w3.org/2000/01/rdf-schema#Class"	""	""	"https://data.vlaanderen.be/ns/wegenenverkeer/abstracten#Kantopsluiting"	""	""
"CLASS"	"OSLO-Abstracten"	"AfwijkendeKantopsluiting"	"{E6B81AC2-63A3-4bc3-97F7-0142D136327D}"	"Kantopsluiting"	""	""	""	"Afwijkende kantopsluiting"	"Abstracte voor een lijnvormig element dat niet voldoet aan een bepaalde standaard."	""	"Afwijkende kantopsluiting"	"Abstracte voor een lijnvormig element dat niet voldoet aan een bepaalde standaard."	""	""	"true"	"https://data.vlaanderen.be/ns/wegenenverkeer/abstracten#"	"AfwijkendeKantopsluiting"	"http://www.w3.org/2000/01/rdf-schema#Class"	""	""	"https://data.vlaanderen.be/ns/wegenenverkeer/abstracten#Kantopsluiting"	""	""
"CLASS"	"OSLO-Installatie"	"Baanlichaam"	"{5626506C-7A3F-46f4-8C06-9C52996A4696}"	""	""	""	""	"Baanlichaam"	"De lagen tussen het baanbed en het baanoppervlak."	""	"Baanlichaam"	"De lagen tussen het baanbed en het baanoppervlak."	""	""	"true"	"https://data.vlaanderen.be/ns/wegenenverkeer/installatie#"	"Baanlichaam"	"http://www.w3.org/2000/01/rdf-schema#Class"	""	""	"https://wegenenverkeer.data.vlaanderen.be/ns/implementatieelement#AWVObject"	""	""
