"EA-Type"	"EA-Package"	"EA-Name"	"EA-GUID"	"EA-Parent"	"EA-Domain"	"EA-Domain-GUID"	"EA-Range"	"label"	"definition"	"usage"	"ap-label-nl"	"ap-definition-nl"	"ap-usageNote-nl"	"ap-codelist"	"external term"	"namespace"	"localname"	"type"	"domain"	"range"	"parent"	"min card"	"max card"
"Package"	""	"OSLO-Ventilatie"	"{E725139A-F75A-4015-8FFD-8CCD9F831ED5}"	""	""	""	""	""	""	""	""	""	""	""	""	"http://"	"fixme.com"	"http://www.w3.org/2002/07/owl#Ontology"	""	""	""	""	""
"CLASS"	"OSLO-Implementatieelement"	"AWVNaamObject"	"{5C144615-47A1-4f8b-A119-B293BCFD84B5}"	"AWVObject"	""	""	""	"AWV naam object"	"Abstracte als de basisklasse voor elk OTL object dat benoemd wordt met een mensleesbare identificator. "	""	"AWV naam object"	"Abstracte als de basisklasse voor elk OTL object dat benoemd wordt met een mensleesbare identificator. "	""	""	"true"	"https://wegenenverkeer-test.data.vlaanderen.be/ns/implementatieelement#"	"AWVNaamObject"	"http://www.w3.org/2000/01/rdf-schema#Class"	""	""	"https://wegenenverkeer-test.data.vlaanderen.be/ns/implementatieelement#AWVObject"	""	""
"CLASS"	"OSLO-Abstracten"	"Controller"	"{ED1033C8-5031-478c-AA2F-4276A684A423}"	"AWVNaamObject"	""	""	""	"Controller"	"Abstracte voor allerlei types van controllers."	""	"Controller"	"Abstracte voor allerlei types van controllers."	""	""	"true"	"https://wegenenverkeer-test.data.vlaanderen.be/ns/abstracten#"	"Controller"	"http://www.w3.org/2000/01/rdf-schema#Class"	""	""	"https://wegenenverkeer-test.data.vlaanderen.be/ns/implementatieelement#AWVNaamObject"	""	""
"CLASS"	"OSLO-Implementatieelement"	"AWVObject"	"{C3CBD401-EC86-4363-9821-CCE89EB2F0A9}"	""	""	""	""	"AWV object"	"Abstracte als de basisklasse (super class) voor alle uniek geïdentificeerde OTL objecten met de basiseigenschappen die elk OTL object minstens heeft."	""	"AWV object"	"Abstracte als de basisklasse (super class) voor alle uniek geïdentificeerde OTL objecten met de basiseigenschappen die elk OTL object minstens heeft."	""	""	"true"	"https://wegenenverkeer-test.data.vlaanderen.be/ns/implementatieelement#"	"AWVObject"	"http://www.w3.org/2000/01/rdf-schema#Class"	""	""	""	""	""
"CLASS"	"OSLO-Onderdeel"	"IOKaart"	"{3ABC664E-5A1A-4e30-B70F-F5748EF344ED}"	"AWVObject"	""	""	""	"IO-Kaart"	"TODO"	""	"IO-Kaart"	"TODO"	""	""	"true"	"https://wegenenverkeer-test.data.vlaanderen.be/ns/onderdeel#"	"IOKaart"	"http://www.w3.org/2000/01/rdf-schema#Class"	""	""	"https://wegenenverkeer-test.data.vlaanderen.be/ns/implementatieelement#AWVObject"	""	""
"CLASS"	"OSLO-Abstracten"	"Ventilatie"	"{8CB2408F-97EE-461e-9137-75C7F7C2E214}"	"AWVObject"	""	""	""	"Ventilatie"	"TODO"	""	"Ventilatie"	"TODO"	""	""	"true"	"https://wegenenverkeer-test.data.vlaanderen.be/ns/abstracten#"	"Ventilatie"	"http://www.w3.org/2000/01/rdf-schema#Class"	""	""	"https://wegenenverkeer-test.data.vlaanderen.be/ns/implementatieelement#AWVObject"	""	""
"CLASS"	"OSLO-Onderdeel"	"Stroomkring"	"{9E56032E-DD28-4ef8-8DCF-FF35647F878A}"	"AWVNaamObject"	""	""	""	"Stroomkring"	"Ook wel vertrek of vertrekkende kabel genoemd. Afgezekerde elektrische geleiders waarmee de applicaties voorzien worden van de nodige voeding"	""	"Stroomkring"	"Ook wel vertrek of vertrekkende kabel genoemd. Afgezekerde elektrische geleiders waarmee de applicaties voorzien worden van de nodige voeding"	""	""	"true"	"https://wegenenverkeer-test.data.vlaanderen.be/ns/onderdeel#"	"Stroomkring"	"http://www.w3.org/2000/01/rdf-schema#Class"	""	""	"https://wegenenverkeer-test.data.vlaanderen.be/ns/implementatieelement#AWVNaamObject"	""	""
"CLASS"	"OSLO-Abstracten"	"ConstructieElement"	"{917FBCD6-FAE5-4b0a-94ED-2D7B8053BE7C}"	"AWVObject"	""	""	""	"Constructie element"	"Abstracte voor de verschillende constructie elementen."	""	"Constructie element"	"Abstracte voor de verschillende constructie elementen."	""	""	"true"	"https://wegenenverkeer-test.data.vlaanderen.be/ns/abstracten#"	"ConstructieElement"	"http://www.w3.org/2000/01/rdf-schema#Class"	""	""	"https://wegenenverkeer-test.data.vlaanderen.be/ns/implementatieelement#AWVObject"	""	""
"CLASS"	"OSLO-Onderdeel"	"PLC"	"{387EDE6E-A7C0-48a6-B1B2-996DABF755B2}"	"Controller"	""	""	""	"PLC"	"TODO"	""	"PLC"	"TODO"	""	""	"true"	"https://wegenenverkeer-test.data.vlaanderen.be/ns/onderdeel#"	"PLC"	"http://www.w3.org/2000/01/rdf-schema#Class"	""	""	"https://wegenenverkeer-test.data.vlaanderen.be/ns/abstracten#Controller"	""	""
"CLASS"	"OSLO-Onderdeel"	"Bevestigingsbeugel"	"{D74E2585-DC12-42d0-AA22-9A3F91C3F60F}"	"AWVNaamObject"	""	""	""	"Bevestigingsbeugel"	"Verbindingsstuk waarmee een object kan vastgemaakt worden aan een steun of oppervlak"	""	"Bevestigingsbeugel"	"Verbindingsstuk waarmee een object kan vastgemaakt worden aan een steun of oppervlak"	""	""	"true"	"https://wegenenverkeer-test.data.vlaanderen.be/ns/onderdeel#"	"Bevestigingsbeugel"	"http://www.w3.org/2000/01/rdf-schema#Class"	""	""	"https://wegenenverkeer-test.data.vlaanderen.be/ns/implementatieelement#AWVNaamObject"	""	""
"CLASS"	"OSLO-Onderdeel"	"Ventilator"	"{813E7075-ADB5-4129-8834-0DFDB76B5271}"	"Ventilatie"	""	""	""	"Ventilator"	"TODO"	""	"Ventilator"	"TODO"	""	""	"true"	"https://wegenenverkeer-test.data.vlaanderen.be/ns/onderdeel#"	"Ventilator"	"http://www.w3.org/2000/01/rdf-schema#Class"	""	""	"https://wegenenverkeer-test.data.vlaanderen.be/ns/abstracten#Ventilatie"	""	""
"CLASS"	"OSLO-Onderdeel"	"Overdrukventilator"	"{2F395602-AFA7-4f5e-B2D9-52F3C6CEF613}"	"Ventilatie"	""	""	""	"Overdrukventilator"	"TODO"	""	"Overdrukventilator"	"TODO"	""	""	"true"	"https://wegenenverkeer-test.data.vlaanderen.be/ns/onderdeel#"	"Overdrukventilator"	"http://www.w3.org/2000/01/rdf-schema#Class"	""	""	"https://wegenenverkeer-test.data.vlaanderen.be/ns/abstracten#Ventilatie"	""	""
"CLASS"	"OSLO-Onderdeel"	"Bevestiging"	"{851E2395-627F-4352-8324-2E91CD6B80DE}"	""	""	""	""	"Bevestiging"	"Deze relatie geeft aan dat twee onderdelen direct fysiek op elkaar bevestigd zijn. Dit kan zowel aan de buitenkant als aan de binnenkant zijn zoals bv. een camera aan een paal of een laagspanningsbord in een kast. Deze relatie heeft geen richting."	""	"Bevestiging"	"Deze relatie geeft aan dat twee onderdelen direct fysiek op elkaar bevestigd zijn. Dit kan zowel aan de buitenkant als aan de binnenkant zijn zoals bv. een camera aan een paal of een laagspanningsbord in een kast. Deze relatie heeft geen richting."	""	""	"true"	"https://wegenenverkeer-test.data.vlaanderen.be/ns/onderdeel#"	"Bevestiging"	"http://www.w3.org/2000/01/rdf-schema#Class"	""	""	""	""	""
"CLASS"	"OSLO-Onderdeel"	"Sturing"	"{13A4F9E6-F804-4033-81E8-9BC04BDF0DE7}"	""	""	""	""	"Sturing"	"Deze relatie geeft aan of er een of andere vorm van dataverkeer is tussen 2 onderdelen. Een wegverlichtingstoestel dat aan staat wordt ook als sturing beschouwd, in dit geval is het een lang ononderbroken elektrisch aan-signaal. Deze relatie heeft geen richting."	""	"Sturing"	"Deze relatie geeft aan of er een of andere vorm van dataverkeer is tussen 2 onderdelen. Een wegverlichtingstoestel dat aan staat wordt ook als sturing beschouwd, in dit geval is het een lang ononderbroken elektrisch aan-signaal. Deze relatie heeft geen richting."	""	""	"true"	"https://wegenenverkeer-test.data.vlaanderen.be/ns/onderdeel#"	"Sturing"	"http://www.w3.org/2000/01/rdf-schema#Class"	""	""	""	""	""
"CLASS"	"OSLO-Onderdeel"	"Voedt"	"{8AA83131-996E-4433-96B7-609D2D41C2F7}"	""	""	""	""	"Voedt"	"Deze relatie wordt enkel gelegd naar onderdelen die permanent onder spanning staan in normaal bedrijf. Aan deze relatie wordt steeds een richting toegekend van de voedinggever naar de ontvanger."	""	"Voedt"	"Deze relatie wordt enkel gelegd naar onderdelen die permanent onder spanning staan in normaal bedrijf. Aan deze relatie wordt steeds een richting toegekend van de voedinggever naar de ontvanger."	""	""	"true"	"https://wegenenverkeer-test.data.vlaanderen.be/ns/onderdeel#"	"Voedt"	"http://www.w3.org/2000/01/rdf-schema#Class"	""	""	""	""	""
"DATATYPE"	"OSLO-Implementatieelement"	"DtcAWVIdentificator"	"{0A270AE5-3C56-44b7-8B06-DBC66BD6EB66}"	""	""	""	""	"AWV-identificator"	"Complex datatype voor de identifictor van het AWV-object."	""	"AWV-identificator"	"Complex datatype voor de identifictor van het AWV-object."	""	""	"true"	"https://wegenenverkeer-test.data.vlaanderen.be/ns/implementatieelement#"	"DtcAWVIdentificator"	"http://www.w3.org/2000/01/rdf-schema#Class"	""	""	""	""	""
"DATATYPE"	"OSLO-Implementatieelement"	"DtcDocument"	"{441527E2-4B20-4bca-899E-9DC151A2A981}"	""	""	""	""	"Bestandsbijlage"	"Complex datatype voor alle bestandsbijlages"	""	"Bestandsbijlage"	"Complex datatype voor alle bestandsbijlages"	""	""	"true"	"https://wegenenverkeer-test.data.vlaanderen.be/ns/implementatieelement#"	"DtcDocument"	"http://www.w3.org/2000/01/rdf-schema#Class"	""	""	""	""	""
"ENUMERATION"	"OSLO-Implementatieelement"	"KlAlgMimeType"	"{9BCD2B4C-9CAB-4988-A052-6C4B006D450A}"	""	""	""	""	"Mimetype"	"De mime types van bestanden (AWVDocument) beperkt tot mime types voor toegelaten bestandstypen."	""	"Mimetype"	"De mime types van bestanden (AWVDocument) beperkt tot mime types voor toegelaten bestandstypen."	""	"https://wegenenverkeer-test.data.vlaanderen.be/id/conceptscheme/KlAlgMimeType"	"true"	"http://www.w3.org/2004/02/skos/core#"	"Concept"	"http://www.w3.org/2000/01/rdf-schema#Class"	""	""	""	""	""
"DATATYPE"	"OSLO-Implementatieelement"	"DteIPv4Adres"	"{AF96DFD7-4CAA-488b-A873-A338795310EB}"	""	""	""	""	"IPv4-adres"	"Beschrijft een ip-adres volgens de ipv4 specificatie."	""	"IPv4-adres"	"Beschrijft een ip-adres volgens de ipv4 specificatie."	""	""	"true"	"https://wegenenverkeer-test.data.vlaanderen.be/ns/implementatieelement#"	"DteIPv4Adres"	"http://www.w3.org/2000/01/rdf-schema#Class"	""	""	""	""	""
"DATATYPE"	"OSLO-Implementatieelement"	"DteTekstblok"	"{E5E67991-BD15-468d-A90F-26B3A0821EF1}"	""	""	""	""	"Tekstblok"	"Een tekst welke uit meerdere zinnen bestaat, en ook regeleindes kan bevatten. Een tekstblok bevat maximaal 65.000 karakters."	""	"Tekstblok"	"Een tekst welke uit meerdere zinnen bestaat, en ook regeleindes kan bevatten. Een tekstblok bevat maximaal 65.000 karakters."	""	""	"true"	"https://wegenenverkeer-test.data.vlaanderen.be/ns/implementatieelement#"	"DteTekstblok"	"http://www.w3.org/2000/01/rdf-schema#Class"	""	""	""	""	""
"DATATYPE"	"OSLO-Implementatieelement"	"KwantWrdInWatt"	"{003FB507-CE8D-44a3-B5A2-D509E3D76463}"	""	""	""	""	"Kwantitatieve waarde in Watt"	"Een kwantitatieve waarde die een getal in Watt uitdrukt."	""	"Kwantitatieve waarde in Watt"	"Een kwantitatieve waarde die een getal in Watt uitdrukt."	""	""	"true"	"https://wegenenverkeer-test.data.vlaanderen.be/ns/implementatieelement#"	"KwantWrdInWatt"	"http://www.w3.org/2000/01/rdf-schema#Class"	""	""	""	""	""
"DATATYPE"	"OSLO-Implementatieelement"	"KwantWrdInKubiekeMeter"	"{1AF0D461-DFD1-4a5d-BF31-2A3D2E183A2C}"	""	""	""	""	"Kwantitatieve waarde in kubieke meter"	"Een kwantitatieve waarde die een getal in kubieke meter uitdrukt."	""	"Kwantitatieve waarde in kubieke meter"	"Een kwantitatieve waarde die een getal in kubieke meter uitdrukt."	""	""	"true"	"https://wegenenverkeer-test.data.vlaanderen.be/ns/implementatieelement#"	"KwantWrdInKubiekeMeter"	"http://www.w3.org/2000/01/rdf-schema#Class"	""	""	""	""	""
"DATATYPE"	"OSLO-Implementatieelement"	"KwantWrdInProcent"	"{5E41C6DB-91FF-49cc-A92E-9F52EEBDBD8B}"	""	""	""	""	"Kwantitatieve waarde in procent"	"Een kwantitatieve waarde die een getal in procent uitdrukt."	""	"Kwantitatieve waarde in procent"	"Een kwantitatieve waarde die een getal in procent uitdrukt."	""	""	"true"	"https://wegenenverkeer-test.data.vlaanderen.be/ns/implementatieelement#"	"KwantWrdInProcent"	"http://www.w3.org/2000/01/rdf-schema#Class"	""	""	""	""	""
"DATATYPE"	"OSLO-Implementatieelement"	"KwantWrdInVolt"	"{626F9E60-BDB9-449d-9A52-1A576DEBC804}"	""	""	""	""	"Kwantitatieve waarde in Volt"	"Een kwantitatieve waarde die een getal in Volt uitdrukt."	""	"Kwantitatieve waarde in Volt"	"Een kwantitatieve waarde die een getal in Volt uitdrukt."	""	""	"true"	"https://wegenenverkeer-test.data.vlaanderen.be/ns/implementatieelement#"	"KwantWrdInVolt"	"http://www.w3.org/2000/01/rdf-schema#Class"	""	""	""	""	""
"DATATYPE"	"OSLO-Implementatieelement"	"KwantWrdInMillimeter"	"{AE04A0C4-258A-4401-B823-305832B572AC}"	""	""	""	""	"Kwantitatieve waarde in millimeter"	"Een kwantitatieve waarde die een getal in millimeter uitdrukt."	""	"Kwantitatieve waarde in millimeter"	"Een kwantitatieve waarde die een getal in millimeter uitdrukt."	""	""	"true"	"https://wegenenverkeer-test.data.vlaanderen.be/ns/implementatieelement#"	"KwantWrdInMillimeter"	"http://www.w3.org/2000/01/rdf-schema#Class"	""	""	""	""	""
"ENUMERATION"	"OSLO-Onderdeel"	"KlVentilatorRichting"	"{1E1D73D2-C3EE-4315-8A54-1E79D3F881BA}"	""	""	""	""	"Ventilator richting"	"TODO"	""	"Ventilator richting"	"TODO"	""	"https://wegenenverkeer-test.data.vlaanderen.be/id/conceptscheme/KlVentilatorRichting"	"true"	"http://www.w3.org/2004/02/skos/core#"	"Concept"	"http://www.w3.org/2000/01/rdf-schema#Class"	""	""	""	""	""
"ENUMERATION"	"OSLO-Onderdeel"	"KlIOType"	"{29A7FB62-B9D3-486e-A6CF-B86DFE1CAB42}"	""	""	""	""	"IO type"	"TODO"	""	"IO type"	"TODO"	""	"https://wegenenverkeer-test.data.vlaanderen.be/id/conceptscheme/KlIOType"	"true"	"http://www.w3.org/2004/02/skos/core#"	"Concept"	"http://www.w3.org/2000/01/rdf-schema#Class"	""	""	""	""	""
"ENUMERATION"	"OSLO-Onderdeel"	"KlIOBitSnelheid"	"{36B747D5-14D1-4ad5-BF61-D0FB3A76CEEC}"	""	""	""	""	"IO bit snelheid"	"TODO"	""	"IO bit snelheid"	"TODO"	""	"https://wegenenverkeer-test.data.vlaanderen.be/id/conceptscheme/KlIOBitSnelheid"	"true"	"http://www.w3.org/2004/02/skos/core#"	"Concept"	"http://www.w3.org/2000/01/rdf-schema#Class"	""	""	""	""	""
"ENUMERATION"	"OSLO-Onderdeel"	"KlPLCModelnaam"	"{58CD147C-BCE9-46f7-9845-463F78099217}"	""	""	""	""	"PLC model"	"TODO"	""	"PLC model"	"TODO"	""	"https://wegenenverkeer-test.data.vlaanderen.be/id/conceptscheme/KlPLCModelnaam"	"true"	"http://www.w3.org/2004/02/skos/core#"	"Concept"	"http://www.w3.org/2000/01/rdf-schema#Class"	""	""	""	""	""
"ENUMERATION"	"OSLO-Onderdeel"	"KlIOSignaaltype"	"{AC27D3F0-DC0A-4a64-B1E1-D452878068F1}"	""	""	""	""	"IO signaaltype"	"TODO"	""	"IO signaaltype"	"TODO"	""	"https://wegenenverkeer-test.data.vlaanderen.be/id/conceptscheme/KlIOSignaaltype"	"true"	"http://www.w3.org/2004/02/skos/core#"	"Concept"	"http://www.w3.org/2000/01/rdf-schema#Class"	""	""	""	""	""
"ENUMERATION"	"OSLO-Onderdeel"	"KlPLCMerk"	"{E1176C80-4212-4282-B9C9-0E598AE01909}"	""	""	""	""	"PLC merk"	"TODO"	""	"PLC merk"	"TODO"	""	"https://wegenenverkeer-test.data.vlaanderen.be/id/conceptscheme/KlPLCMerk"	"true"	"http://www.w3.org/2004/02/skos/core#"	"Concept"	"http://www.w3.org/2000/01/rdf-schema#Class"	""	""	""	""	""
"ENUMERATION"	"OSLO-Onderdeel"	"KlBevestigingsbeugelType"	"{A177B525-C717-4928-8A6D-D11A6457A20A}"	""	""	""	""	"Bevestigingsbeugel type"	"Types van bevestigingsbeugel."	""	"Bevestigingsbeugel type"	"Types van bevestigingsbeugel."	""	"https://wegenenverkeer-test.data.vlaanderen.be/id/conceptscheme/KlBevestigingsbeugelType"	"true"	"http://www.w3.org/2004/02/skos/core#"	"Concept"	"http://www.w3.org/2000/01/rdf-schema#Class"	""	""	""	""	""
"DATATYPE"	"W3-RDF-Schema"	"Literal"	"{FBE7CE2F-907F-4558-A0CE-70C0A8A6AA32}"	""	""	""	""	"Literal"	"Beschrijft een constante."	"https://www.w3.org/2000/01/rdf-schema#Literal"	"Literal"	"Beschrijft een constante."	""	""	"true"	"https://www.w3.org/2000/01/rdf-schema#"	"Literal"	"http://www.w3.org/2000/01/rdf-schema#Class"	""	""	""	""	""
"DATATYPE"	"W3-XML-Schema"	"DateTime"	"{0DD21E21-29CC-461d-BC1D-FC45931957F0}"	""	""	""	""	"Datumtijd"	"Beschrijft een datumtijd volgens https://www.w3.org/2001/XMLSchema#datetime"	"https://www.w3.org/2001/XMLSchema#datetime"	"Datumtijd"	"Beschrijft een datumtijd volgens https://www.w3.org/2001/XMLSchema#datetime"	""	""	"true"	"https://www.w3.org/2001/XMLSchema#"	"datetime"	"http://www.w3.org/2000/01/rdf-schema#Class"	""	""	""	""	""
"DATATYPE"	"W3-XML-Schema"	"Integer"	"{2CD576D2-B0D2-4c75-AF0D-5AFE65067E53}"	""	""	""	""	"Geheel getal"	"Beschrijft een geheel getal volgens https://www.w3.org/2001/XMLSchema#integer"	"https://www.w3.org/2001/XMLSchema#integer"	"Geheel getal"	"Beschrijft een geheel getal volgens https://www.w3.org/2001/XMLSchema#integer"	""	""	"true"	"https://www.w3.org/2001/XMLSchema#"	"integer"	"http://www.w3.org/2000/01/rdf-schema#Class"	""	""	""	""	""
"DATATYPE"	"W3-XML-Schema"	"Decimal"	"{3300D9AD-B706-43fe-B750-0EB2D8679F90}"	""	""	""	""	"Decimaal getal"	"Beschrijft een decimaal getal volgens https://www.w3.org/2001/XMLSchema#decimal"	"https://www.w3.org/2001/XMLSchema#decimal"	"Decimaal getal"	"Beschrijft een decimaal getal volgens https://www.w3.org/2001/XMLSchema#decimal"	""	""	"true"	"https://www.w3.org/2001/XMLSchema#"	"decimal"	"http://www.w3.org/2000/01/rdf-schema#Class"	""	""	""	""	""
"DATATYPE"	"W3-XML-Schema"	"Date"	"{518CF17E-69E2-4b04-BFC0-208BB4C618A2}"	""	""	""	""	"Datum"	"Beschrijft een datum volgens https://www.w3.org/2001/XMLSchema#date"	"https://www.w3.org/2001/XMLSchema#date"	"Datum"	"Beschrijft een datum volgens https://www.w3.org/2001/XMLSchema#date"	""	""	"true"	"https://www.w3.org/2001/XMLSchema#"	"date"	"http://www.w3.org/2000/01/rdf-schema#Class"	""	""	""	""	""
"DATATYPE"	"W3-XML-Schema"	"AnyURI"	"{720ACC1F-344F-43bb-9B65-5467749150DD}"	""	""	""	""	"URI"	"Een tekstwaarde die een verwijzing naar meer informatie van het element bevat volgens https://www.w3.org/2001/XMLSchema#anyURI ."	"https://www.w3.org/2001/XMLSchema#anyURI"	"URI"	"Een tekstwaarde die een verwijzing naar meer informatie van het element bevat volgens https://www.w3.org/2001/XMLSchema#anyURI ."	""	""	"true"	"https://www.w3.org/2001/XMLSchema#"	"anyURI"	"http://www.w3.org/2000/01/rdf-schema#Class"	""	""	""	""	""
"DATATYPE"	"W3-XML-Schema"	"String"	"{9154C721-7D7C-4c11-8FBF-C56FAEF9A4DA}"	""	""	""	""	"String"	"Beschrijft een tekstregel volgens https://www.w3.org/2001/XMLSchema#string"	"https://www.w3.org/2001/XMLSchema#string"	"String"	"Beschrijft een tekstregel volgens https://www.w3.org/2001/XMLSchema#string"	""	""	"true"	"https://www.w3.org/2001/XMLSchema#"	"string"	"http://www.w3.org/2000/01/rdf-schema#Class"	""	""	""	""	""
"DATATYPE"	"W3-XML-Schema"	"Boolean"	"{C66810D0-4F93-4948-83F5-165137DEBF82}"	""	""	""	""	"Boolean"	"Beschrijft een boolean volgens https://www.w3.org/2001/XMLSchema#boolean"	"https://www.w3.org/2001/XMLSchema#boolean"	"Boolean"	"Beschrijft een boolean volgens https://www.w3.org/2001/XMLSchema#boolean"	""	""	"true"	"https://www.w3.org/2001/XMLSchema#"	"boolean"	"http://www.w3.org/2000/01/rdf-schema#Class"	""	""	""	""	""
"attribute"	"OSLO-Implementatieelement"	"naam"	"{0934DA42-F4E9-485b-BCE5-09CDF6AB792B}"	""	"AWVNaamObject"	"{5C144615-47A1-4f8b-A119-B293BCFD84B5}"	"String"	"naam"	"De mensleesbare naam van een AWVObject zoals dit bv. ook terug te vinden is op een etiket op het object zelf. AWV kent deze naam toe of geeft de opdracht om deze toe te kennen. Indien een object een algemeen gangbare naam heeft zoals bv. bij een waterloop dan wordt deze gebruikt."	""	"naam"	"De mensleesbare naam van een AWVObject zoals dit bv. ook terug te vinden is op een etiket op het object zelf. AWV kent deze naam toe of geeft de opdracht om deze toe te kennen. Indien een object een algemeen gangbare naam heeft zoals bv. bij een waterloop dan wordt deze gebruikt."	""	""	"true"	"https://wegenenverkeer-test.data.vlaanderen.be/ns/implementatieelement#"	"AWVNaamObject.naam"	"http://www.w3.org/2002/07/owl#DatatypeProperty"	"https://wegenenverkeer-test.data.vlaanderen.be/ns/implementatieelement#AWVNaamObject"	"http://www.w3.org/2001/XMLSchema#string"	""	"1"	"1"
"attribute"	"OSLO-Abstracten"	"batchnummer"	"{8C629A1B-8258-4536-92EC-AE9BD1336A06}"	""	"Controller"	"{ED1033C8-5031-478c-AA2F-4276A684A423}"	"String"	"batchnummer"	"Nummer van de batch"	""	"batchnummer"	"Nummer van de batch"	""	""	"true"	"https://wegenenverkeer-test.data.vlaanderen.be/ns/abstracten#"	"Controller.batchnummer"	"http://www.w3.org/2002/07/owl#DatatypeProperty"	"https://wegenenverkeer-test.data.vlaanderen.be/ns/abstracten#Controller"	"http://www.w3.org/2001/XMLSchema#string"	""	"1"	"1"
"attribute"	"OSLO-Abstracten"	"dNSNaam"	"{49A98FCE-B305-4f77-961D-2F85D5770A20}"	""	"Controller"	"{ED1033C8-5031-478c-AA2F-4276A684A423}"	"String"	"DNS-naam"	"DNS-naam van de controller"	""	"DNS-naam"	"DNS-naam van de controller"	""	""	"true"	"https://wegenenverkeer-test.data.vlaanderen.be/ns/abstracten#"	"Controller.dNSNaam"	"http://www.w3.org/2002/07/owl#DatatypeProperty"	"https://wegenenverkeer-test.data.vlaanderen.be/ns/abstracten#Controller"	"http://www.w3.org/2001/XMLSchema#string"	""	"1"	"1"
"attribute"	"OSLO-Abstracten"	"firmwareversie"	"{0250BDD7-C64B-4fc2-94E1-5D77AA33D395}"	""	"Controller"	"{ED1033C8-5031-478c-AA2F-4276A684A423}"	"String"	"firmwareversie"	"Firmwareversie van de controller"	""	"firmwareversie"	"Firmwareversie van de controller"	""	""	"true"	"https://wegenenverkeer-test.data.vlaanderen.be/ns/abstracten#"	"Controller.firmwareversie"	"http://www.w3.org/2002/07/owl#DatatypeProperty"	"https://wegenenverkeer-test.data.vlaanderen.be/ns/abstracten#Controller"	"http://www.w3.org/2001/XMLSchema#string"	""	"1"	"1"
"attribute"	"OSLO-Abstracten"	"iPAdres"	"{476E5912-5326-435b-B145-C40E274935EE}"	""	"Controller"	"{ED1033C8-5031-478c-AA2F-4276A684A423}"	"DteIPv4Adres"	"IP-adres"	"IP-adres van de controller"	""	"IP-adres"	"IP-adres van de controller"	""	""	"true"	"https://wegenenverkeer-test.data.vlaanderen.be/ns/abstracten#"	"Controller.iPAdres"	"http://www.w3.org/2002/07/owl#ObjectProperty"	"https://wegenenverkeer-test.data.vlaanderen.be/ns/abstracten#Controller"	"https://wegenenverkeer-test.data.vlaanderen.be/ns/implementatieelement#DteIPv4Adres"	""	"1"	"1"
"attribute"	"OSLO-Abstracten"	"serienummer"	"{707C153E-2697-42c5-A74D-C44FA31D3ECA}"	""	"Controller"	"{ED1033C8-5031-478c-AA2F-4276A684A423}"	"String"	"serienummer"	"Serienummer van de controller"	""	"serienummer"	"Serienummer van de controller"	""	""	"true"	"https://wegenenverkeer-test.data.vlaanderen.be/ns/abstracten#"	"Controller.serienummer"	"http://www.w3.org/2002/07/owl#DatatypeProperty"	"https://wegenenverkeer-test.data.vlaanderen.be/ns/abstracten#Controller"	"http://www.w3.org/2001/XMLSchema#string"	""	"1"	"1"
"attribute"	"OSLO-Implementatieelement"	"datumOprichtingObject"	"{BDF3B5DA-2C71-43b0-8AF1-9CBB8C9059DB}"	""	"AWVObject"	"{C3CBD401-EC86-4363-9821-CCE89EB2F0A9}"	"Date"	"datum oprichting object"	"Datum van de oprichting van het object"	""	"datum oprichting object"	"Datum van de oprichting van het object"	""	""	"true"	"https://wegenenverkeer-test.data.vlaanderen.be/ns/implementatieelement#"	"AWVObject.datumOprichtingObject"	"http://www.w3.org/2002/07/owl#DatatypeProperty"	"https://wegenenverkeer-test.data.vlaanderen.be/ns/implementatieelement#AWVObject"	"http://www.w3.org/2001/XMLSchema#date"	""	"1"	"1"
"attribute"	"OSLO-Implementatieelement"	"id"	"{B43EDD99-BBCC-4818-B6BA-0C9DBF96FA24}"	""	"AWVObject"	"{C3CBD401-EC86-4363-9821-CCE89EB2F0A9}"	"DtcAWVIdentificator"	"id"	"De identificator van het object. Zodra een object bestaat binnen de omgeving van AWV moet de id gebruikt worden zoals die daar gekend is. Bij aanlevering van nieuwe objecten wordt een lokale-id (zoals gekend bij de aannemer) ingevuld."	""	"id"	"De identificator van het object. Zodra een object bestaat binnen de omgeving van AWV moet de id gebruikt worden zoals die daar gekend is. Bij aanlevering van nieuwe objecten wordt een lokale-id (zoals gekend bij de aannemer) ingevuld."	""	""	"true"	"https://wegenenverkeer-test.data.vlaanderen.be/ns/implementatieelement#"	"AWVObject.id"	"http://www.w3.org/2002/07/owl#ObjectProperty"	"https://wegenenverkeer-test.data.vlaanderen.be/ns/implementatieelement#AWVObject"	"https://wegenenverkeer-test.data.vlaanderen.be/ns/implementatieelement#DtcAWVIdentificator"	""	"1"	"*"
"attribute"	"OSLO-Implementatieelement"	"notitie"	"{C5D72798-B8FE-4b73-8F50-506AE8241477}"	""	"AWVObject"	"{C3CBD401-EC86-4363-9821-CCE89EB2F0A9}"	"String"	"notitie"	"Extra notitie voor het AWV object."	""	"notitie"	"Extra notitie voor het AWV object."	""	""	"true"	"https://wegenenverkeer-test.data.vlaanderen.be/ns/implementatieelement#"	"AWVObject.notitie"	"http://www.w3.org/2002/07/owl#DatatypeProperty"	"https://wegenenverkeer-test.data.vlaanderen.be/ns/implementatieelement#AWVObject"	"http://www.w3.org/2001/XMLSchema#string"	""	"1"	"1"
"attribute"	"OSLO-Implementatieelement"	"typeURI"	"{E1765146-77A7-479e-8478-D814329806B4}"	""	"AWVObject"	"{C3CBD401-EC86-4363-9821-CCE89EB2F0A9}"	"AnyURI"	"uri type"	"De URI van het AWV Object volgens https://www.w3.org/2001/XMLSchema#anyURI ."	""	"uri type"	"De URI van het AWV Object volgens https://www.w3.org/2001/XMLSchema#anyURI ."	""	""	"true"	"https://wegenenverkeer-test.data.vlaanderen.be/ns/implementatieelement#"	"AWVObject.typeURI"	"http://www.w3.org/2002/07/owl#ObjectProperty"	"https://wegenenverkeer-test.data.vlaanderen.be/ns/implementatieelement#AWVObject"	"https://www.w3.org/2001/XMLSchema#anyURI"	""	"1"	"1"
"attribute"	"OSLO-Onderdeel"	"adres"	"{D409F9DC-9F2A-4f99-BFD7-EC200AE69E3E}"	""	"IOKaart"	"{3ABC664E-5A1A-4e30-B70F-F5748EF344ED}"	"String"	"adres"	"TODO"	""	"adres"	"TODO"	""	""	"true"	"https://wegenenverkeer-test.data.vlaanderen.be/ns/onderdeel#"	"IOKaart.adres"	"http://www.w3.org/2002/07/owl#DatatypeProperty"	"https://wegenenverkeer-test.data.vlaanderen.be/ns/onderdeel#IOKaart"	"http://www.w3.org/2001/XMLSchema#string"	""	"1"	"1"
"attribute"	"OSLO-Onderdeel"	"bitsnelheid"	"{996951F3-CE0A-4097-BA8B-5A6D97FD135C}"	""	"IOKaart"	"{3ABC664E-5A1A-4e30-B70F-F5748EF344ED}"	"KlIOBitSnelheid"	"bitsnelheid"	"TODO"	""	"bitsnelheid"	"TODO"	""	""	"true"	"https://wegenenverkeer-test.data.vlaanderen.be/ns/onderdeel#"	"IOKaart.bitsnelheid"	"http://www.w3.org/2002/07/owl#ObjectProperty"	"https://wegenenverkeer-test.data.vlaanderen.be/ns/onderdeel#IOKaart"	"http://www.w3.org/2004/02/skos/core#Concept"	""	"1"	"1"
