"EA-Type"	"EA-Package"	"EA-Name"	"EA-GUID"	"EA-Parent"	"EA-Domain"	"EA-Domain-GUID"	"EA-Range"	"label"	"definition"	"usage"	"ap-label-nl"	"ap-definition-nl"	"ap-usageNote-nl"	"ap-codelist"	"external term"	"namespace"	"localname"	"type"	"domain"	"range"	"parent"	"min card"	"max card"
"ENUMERATION"	"OSLO-Installatie"	"KlWegbermBIO"	"{CF98024C-03CD-4a49-9260-B542F317BADD}"	""	""	""	""	"Wegberm BIO"	"Bijzonder ingerichte onderdelen van de wegbermen."	""	"Wegberm BIO"	"Bijzonder ingerichte onderdelen van de wegbermen."	""	"https://wegenenverkeer-test.data.vlaanderen.be/id/conceptscheme/KlWegbermBIO"	"true"	"http://www.w3.org/2004/02/skos/core#"	"Concept"	"http://www.w3.org/2000/01/rdf-schema#Class"	""	""	""	""	""
"ENUMERATION"	"OSLO-Installatie"	"KlWegbermType"	"{F94848AB-B225-41e3-8A9B-32ED6CDAAEC1}"	""	""	""	""	"Wegberm type"	"Types van wegberm die de plaats ten opzichte van de weg aangeven."	""	"Wegberm type"	"Types van wegberm die de plaats ten opzichte van de weg aangeven."	""	"https://wegenenverkeer-test.data.vlaanderen.be/id/conceptscheme/KlWegbermType"	"true"	"http://www.w3.org/2004/02/skos/core#"	"Concept"	"http://www.w3.org/2000/01/rdf-schema#Class"	""	""	""	""	""
"ENUMERATION"	"OSLO-Onderdeel"	"KlLEACSnelheidsklasse"	"{5CD4E9E3-01DC-436c-A671-2CAA4424E9F3}"	""	""	""	""	"Snelheidsklasse"	"De verschillende snelheidsklasses van afschermende constructies"	""	"Snelheidsklasse"	"De verschillende snelheidsklasses van afschermende constructies"	""	"https://wegenenverkeer-test.data.vlaanderen.be/id/conceptscheme/KlLEACSnelheidsklasse"	"true"	"http://www.w3.org/2004/02/skos/core#"	"Concept"	"http://www.w3.org/2000/01/rdf-schema#Class"	""	""	""	""	""
"ENUMERATION"	"OSLO-Onderdeel"	"KlLEACUitbuigingstype"	"{AA06E6FE-B42C-4b04-A4E6-7EB2F6CE3EB9}"	""	""	""	""	"Uitbuigingstype"	"De mogelijke uitbuigingstypes."	""	"Uitbuigingstype"	"De mogelijke uitbuigingstypes."	""	"https://wegenenverkeer-test.data.vlaanderen.be/id/conceptscheme/KlLEACUitbuigingstype"	"true"	"http://www.w3.org/2004/02/skos/core#"	"Concept"	"http://www.w3.org/2000/01/rdf-schema#Class"	""	""	""	""	""
"ENUMERATION"	"OSLO-Onderdeel"	"KlLEACWerkingsbreedte"	"{673FF2D6-3F13-4cff-988C-D7FE0EB38979}"	""	""	""	""	"Werkingsbreedte"	"De verschillende mogelijke werkingsbreedtes."	""	"Werkingsbreedte"	"De verschillende mogelijke werkingsbreedtes."	""	"https://wegenenverkeer-test.data.vlaanderen.be/id/conceptscheme/KlLEACWerkingsbreedte"	"true"	"http://www.w3.org/2004/02/skos/core#"	"Concept"	"http://www.w3.org/2000/01/rdf-schema#Class"	""	""	""	""	""
"ENUMERATION"	"OSLO-Onderdeel"	"KlLEACTypeEindstuk"	"{2475E6DA-5F08-4a4e-B546-59920C6A9479}"	""	""	""	""	"Type eindstuk"	"De verschillende types eindstukken"	""	"Type eindstuk"	"De verschillende types eindstukken"	""	"https://wegenenverkeer-test.data.vlaanderen.be/id/conceptscheme/KlLEACTypeEindstuk"	"true"	"http://www.w3.org/2004/02/skos/core#"	"Concept"	"http://www.w3.org/2000/01/rdf-schema#Class"	""	""	""	""	""
"ENUMERATION"	"OSLO-Onderdeel"	"KlLEACObstakelbeveiligerType"	"{CEA3AB68-8733-4583-B584-99DC2B377B24}"	""	""	""	""	"Obstakelbeveiliger type"	"De verschillende types van obstakelbeveiliger"	""	"Obstakelbeveiliger type"	"De verschillende types van obstakelbeveiliger"	""	"https://wegenenverkeer-test.data.vlaanderen.be/id/conceptscheme/KlLEACObstakelbeveiligerType"	"true"	"http://www.w3.org/2004/02/skos/core#"	"Concept"	"http://www.w3.org/2000/01/rdf-schema#Class"	""	""	""	""	""
"ENUMERATION"	"OSLO-Onderdeel"	"KlPictogramSymbool"	"{C7541215-CD70-4886-8887-F523F874D312}"	""	""	""	""	"Pictogram symbool"	"De mogelijke symbolen op het pictogram."	""	"Pictogram symbool"	"De mogelijke symbolen op het pictogram."	""	"https://wegenenverkeer-test.data.vlaanderen.be/id/conceptscheme/KlPictogramSymbool"	"true"	"http://www.w3.org/2004/02/skos/core#"	"Concept"	"http://www.w3.org/2000/01/rdf-schema#Class"	""	""	""	""	""
"ENUMERATION"	"OSLO-Onderdeel"	"KlHelling"	"{85CAE7C2-41CE-4d08-87FC-C86657FBA8D4}"	""	""	""	""	"Helling"	"Kwarten voor het bepalen van de hellingsgraad."	""	"Helling"	"Kwarten voor het bepalen van de hellingsgraad."	""	"https://wegenenverkeer-test.data.vlaanderen.be/id/conceptscheme/KlHelling"	"true"	"http://www.w3.org/2004/02/skos/core#"	"Concept"	"http://www.w3.org/2000/01/rdf-schema#Class"	""	""	""	""	""
"ENUMERATION"	"OSLO-Onderdeel"	"KlLEGCOpeningType"	"{4123B71F-E6E7-4bd4-8AB8-18E99248F8FC}"	""	""	""	""	"Opening type"	"Types van opening."	""	"Opening type"	"Types van opening."	""	"https://wegenenverkeer-test.data.vlaanderen.be/id/conceptscheme/KlLEGCOpeningType"	"true"	"http://www.w3.org/2004/02/skos/core#"	"Concept"	"http://www.w3.org/2000/01/rdf-schema#Class"	""	""	""	""	""
"ENUMERATION"	"OSLO-Onderdeel"	"KlLEGCFundering"	"{B6A341DA-CC2A-40fa-8909-EF959D20B76D}"	""	""	""	""	"Fundering"	"De funderingswijzen van de geluidswerende constructie."	""	"Fundering"	"De funderingswijzen van de geluidswerende constructie."	""	"https://wegenenverkeer-test.data.vlaanderen.be/id/conceptscheme/KlLEGCFundering"	"true"	"http://www.w3.org/2004/02/skos/core#"	"Concept"	"http://www.w3.org/2000/01/rdf-schema#Class"	""	""	""	""	""
"ENUMERATION"	"OSLO-Onderdeel"	"KlLEGCGeluidskarakteristiek"	"{587B7E4D-39C8-438a-8D40-E3A91CBD3BFA}"	""	""	""	""	"Geluidskarakteristiek"	"De geluidskarakteristieken van de geluidswerende constructie."	""	"Geluidskarakteristiek"	"De geluidskarakteristieken van de geluidswerende constructie."	""	"https://wegenenverkeer-test.data.vlaanderen.be/id/conceptscheme/KlLEGCGeluidskarakteristiek"	"true"	"http://www.w3.org/2004/02/skos/core#"	"Concept"	"http://www.w3.org/2000/01/rdf-schema#Class"	""	""	""	""	""
"ENUMERATION"	"OSLO-Onderdeel"	"KlLEGCMateriaal"	"{1CA72B26-AD04-4e3a-A015-E597BBCCCEF2}"	""	""	""	""	"Materiaal"	"Materialen van de geluidswerende constructie."	""	"Materiaal"	"Materialen van de geluidswerende constructie."	""	"https://wegenenverkeer-test.data.vlaanderen.be/id/conceptscheme/KlLEGCMateriaal"	"true"	"http://www.w3.org/2004/02/skos/core#"	"Concept"	"http://www.w3.org/2000/01/rdf-schema#Class"	""	""	""	""	""
"ENUMERATION"	"OSLO-Onderdeel"	"KlLEGCOpstelling"	"{1961D153-242E-4d85-AB56-8286C95FFB91}"	""	""	""	""	"Opstelling"	"De opstellingen van de geluidswerende constructie."	""	"Opstelling"	"De opstellingen van de geluidswerende constructie."	""	"https://wegenenverkeer-test.data.vlaanderen.be/id/conceptscheme/KlLEGCOpstelling"	"true"	"http://www.w3.org/2004/02/skos/core#"	"Concept"	"http://www.w3.org/2000/01/rdf-schema#Class"	""	""	""	""	""
"ENUMERATION"	"OSLO-Onderdeel"	"KlLEGCSchermelementType"	"{3A97F778-2DA6-4343-99BE-7BC5D84CD2ED}"	""	""	""	""	"Schermelement type"	"Schermelement types."	""	"Schermelement type"	"Schermelement types."	""	"https://wegenenverkeer-test.data.vlaanderen.be/id/conceptscheme/KlLEGCSchermelementType"	"true"	"http://www.w3.org/2004/02/skos/core#"	"Concept"	"http://www.w3.org/2000/01/rdf-schema#Class"	""	""	""	""	""
"ENUMERATION"	"OSLO-Onderdeel"	"KlLEGCSchermtype"	"{0708F382-C199-45a9-A223-8ADB33A562F6}"	""	""	""	""	"Schermtype"	"De mogelijke schermtypes (vlak,niet-vlak)"	""	"Schermtype"	"De mogelijke schermtypes (vlak,niet-vlak)"	""	"https://wegenenverkeer-test.data.vlaanderen.be/id/conceptscheme/KlLEGCSchermtype"	"true"	"http://www.w3.org/2004/02/skos/core#"	"Concept"	"http://www.w3.org/2000/01/rdf-schema#Class"	""	""	""	""	""
"ENUMERATION"	"OSLO-Onderdeel"	"KlLaagRol"	"{E129FCA0-59D4-4482-8E84-521BFA488DB2}"	""	""	""	""	"Laag rol"	"De mogelijke rollen van de laag."	""	"Laag rol"	"De mogelijke rollen van de laag."	""	"https://wegenenverkeer-test.data.vlaanderen.be/id/conceptscheme/KlLaagRol"	"true"	"http://www.w3.org/2004/02/skos/core#"	"Concept"	"http://www.w3.org/2000/01/rdf-schema#Class"	""	""	""	""	""
"CLASS"	"OSLO-Onderdeel"	"HoortBij"	"{AFA96837-CD03-43ac-94CB-377B25E9C1ED}"	""	""	""	""	"Hoort bij"	"De relatie geeft aan dat een onderdeel of collectie behoort bij,deel van of lid van een (andere) groep of collectie is."	""	"Hoort bij"	"De relatie geeft aan dat een onderdeel of collectie behoort bij,deel van of lid van een (andere) groep of collectie is."	""	""	"true"	"https://wegenenverkeer-test.data.vlaanderen.be/ns/onderdeel#"	"HoortBij"	"http://www.w3.org/2000/01/rdf-schema#Class"	""	""	"https://wegenenverkeer-test.data.vlaanderen.be/ns/implementatieelement#DirectioneleRelatie"	""	""
"CLASS"	"OSLO-Onderdeel"	"SluitAanOp"	"{7D8E701E-EAE3-4400-8FD4-4C19C9D59D61}"	""	""	""	""	"Sluit aan op"	"Deze relatie geeft aan hoe 2 onderdelen in horizontale zin elkaar opvolgen. Dit wordt gebruikt om een topologische netwerk op te bouwen. Enkel in gebruik bij afschermende constructies en riolering/waterlopen. Deze relatie heeft steeds een richting van het opwaartse naar het afwaartse onderdeel."	""	"Sluit aan op"	"Deze relatie geeft aan hoe 2 onderdelen in horizontale zin elkaar opvolgen. Dit wordt gebruikt om een topologische netwerk op te bouwen. Enkel in gebruik bij afschermende constructies en riolering/waterlopen. Deze relatie heeft steeds een richting van het opwaartse naar het afwaartse onderdeel."	""	""	"true"	"https://wegenenverkeer-test.data.vlaanderen.be/ns/onderdeel#"	"SluitAanOp"	"http://www.w3.org/2000/01/rdf-schema#Class"	""	""	"https://wegenenverkeer-test.data.vlaanderen.be/ns/implementatieelement#DirectioneleRelatie"	""	""
"CLASS"	"OSLO-Onderdeel"	"Bevestiging"	"{8882062D-87DF-4f16-B0C6-AD8CDB4FFEA9}"	""	""	""	""	"Bevestiging"	"Deze relatie geeft aan dat twee onderdelen direct fysiek op elkaar bevestigd zijn. Dit kan zowel aan de buitenkant als aan de binnenkant zijn zoals bv. een camera aan een paal of een laagspanningsbord in een kast. Deze relatie heeft geen richting."	""	"Bevestiging"	"Deze relatie geeft aan dat twee onderdelen direct fysiek op elkaar bevestigd zijn. Dit kan zowel aan de buitenkant als aan de binnenkant zijn zoals bv. een camera aan een paal of een laagspanningsbord in een kast. Deze relatie heeft geen richting."	""	""	"true"	"https://wegenenverkeer-test.data.vlaanderen.be/ns/onderdeel#"	"Bevestiging"	"http://www.w3.org/2000/01/rdf-schema#Class"	""	""	"https://wegenenverkeer-test.data.vlaanderen.be/ns/implementatieelement#NietDirectioneleRelatie"	""	""
"CLASS"	"OSLO-Onderdeel"	"LigtOp"	"{68C966A6-BDB9-4357-B1A2-36BB4D8D03DC}"	""	""	""	""	"Ligt op"	"Deze relatie geeft aan dat 2 onderdelen direct fysiek op elkaar liggen. Deze relatie heeft een richting en gaat van het bovenste naar het onderste onderdeel."	""	"Ligt op"	"Deze relatie geeft aan dat 2 onderdelen direct fysiek op elkaar liggen. Deze relatie heeft een richting en gaat van het bovenste naar het onderste onderdeel."	""	""	"true"	"https://wegenenverkeer-test.data.vlaanderen.be/ns/onderdeel#"	"LigtOp"	"http://www.w3.org/2000/01/rdf-schema#Class"	""	""	"https://wegenenverkeer-test.data.vlaanderen.be/ns/implementatieelement#DirectioneleRelatie"	""	""
"attribute"	"OSLO-Onderdeel"	"uitzettingswaarde"	"{1F4B828D-DD4E-4bba-B0D6-46AF7E57A222}"	""	"Dilatatie"	"{D462D9EC-38B6-4d71-8F06-285980132893}"	"KlLEACUitzettingswaardeDilatatie"	"Uitzettingswaarde"	"De grootst mogelijke uitzetting die mogelijk is voor een bepaalde dilatatieoplossing."	""	"Uitzettingswaarde"	"De grootst mogelijke uitzetting die mogelijk is voor een bepaalde dilatatieoplossing."	""	""	"true"	"https://wegenenverkeer-test.data.vlaanderen.be/ns/onderdeel#"	"Dilatatie.uitzettingswaarde"	"http://www.w3.org/2002/07/owl#ObjectProperty"	"https://wegenenverkeer-test.data.vlaanderen.be/ns/onderdeel#Dilatatie"	"http://www.w3.org/2004/02/skos/core#Concept"	""	"1"	"1"
"attribute"	"OSLO-Onderdeel"	"grootteorde"	"{A34B4C58-79B0-48bf-A2A6-7028B412778B}"	""	"RetroreflecterendVerkeersbord"	"{3357BF71-C0AA-4429-B328-260F39B3936D}"	"KlRetroreflecterendVerkeersbordGrootteorde"	"grootteorde"	"De classificatie naar grootteorde van het verkeersbord, zoals gedefinieerd in SB250 hoofstuk 10."	""	"grootteorde"	"De classificatie naar grootteorde van het verkeersbord, zoals gedefinieerd in SB250 hoofstuk 10."	""	""	"true"	"https://wegenenverkeer-test.data.vlaanderen.be/ns/onderdeel#"	"RetroreflecterendVerkeersbord.grootteorde"	"http://www.w3.org/2002/07/owl#ObjectProperty"	"https://wegenenverkeer-test.data.vlaanderen.be/ns/onderdeel#RetroreflecterendVerkeersbord"	"http://www.w3.org/2004/02/skos/core#Concept"	""	"0"	"1"
"attribute"	"OSLO-Onderdeel"	"kleurAchterkant"	"{C6CC23DD-0C47-49f1-B2A2-3C4D919062EA}"	""	"RetroreflecterendVerkeersbord"	"{3357BF71-C0AA-4429-B328-260F39B3936D}"	"DteKleurRAL"	"kleur achterkant"	"De kleur van de achterkant van het retroreflecterend verkeersbord."	""	"kleur achterkant"	"De kleur van de achterkant van het retroreflecterend verkeersbord."	""	""	"true"	"https://wegenenverkeer-test.data.vlaanderen.be/ns/onderdeel#"	"RetroreflecterendVerkeersbord.kleurAchterkant"	"http://www.w3.org/2002/07/owl#ObjectProperty"	"https://wegenenverkeer-test.data.vlaanderen.be/ns/onderdeel#RetroreflecterendVerkeersbord"	"https://wegenenverkeer-test.data.vlaanderen.be/ns/implementatieelement#DteKleurRAL"	""	"1"	"1"
"attribute"	"OSLO-Onderdeel"	"merk"	"{6434417E-0864-4f7e-8408-191B116EFA96}"	""	"RetroreflecterendVerkeersbord"	"{3357BF71-C0AA-4429-B328-260F39B3936D}"	"KlRetroreflecterendVerkeersbordMerk"	"Merk"	"De merknaam van het verkeersbord; duidt op de leverancier of producent van het verkeersbord."	"Te selecteren uit een keuzelijst."	"Merk"	"De merknaam van het verkeersbord; duidt op de leverancier of producent van het verkeersbord."	""	""	"true"	"https://wegenenverkeer-test.data.vlaanderen.be/ns/onderdeel#"	"RetroreflecterendVerkeersbord.merk"	"http://www.w3.org/2002/07/owl#ObjectProperty"	"https://wegenenverkeer-test.data.vlaanderen.be/ns/onderdeel#RetroreflecterendVerkeersbord"	"http://www.w3.org/2004/02/skos/core#Concept"	""	"1"	"1"
"attribute"	"OSLO-Onderdeel"	"oppervlakte"	"{30D6529A-9F0C-4f51-A684-920A37F435A2}"	""	"RetroreflecterendVerkeersbord"	"{3357BF71-C0AA-4429-B328-260F39B3936D}"	"KwantWrdInVierkanteMeter"	"oppervlakte"	"De oppervlakte van het beeldvlak van een verkeersbord."	""	"oppervlakte"	"De oppervlakte van het beeldvlak van een verkeersbord."	""	""	"true"	"https://wegenenverkeer-test.data.vlaanderen.be/ns/onderdeel#"	"RetroreflecterendVerkeersbord.oppervlakte"	"http://www.w3.org/2002/07/owl#ObjectProperty"	"https://wegenenverkeer-test.data.vlaanderen.be/ns/onderdeel#RetroreflecterendVerkeersbord"	"https://wegenenverkeer-test.data.vlaanderen.be/ns/implementatieelement#KwantWrdInVierkanteMeter"	""	"0"	"1"
"attribute"	"OSLO-Onderdeel"	"merk"	"{0DA1F733-BB38-45a5-BCA7-9C8D2712E5AC}"	""	"Zonnepaneel"	"{F5A43201-B397-4cab-AED2-4B594206FC81}"	"KlZonnepaneelMerk"	"merk"	"Merk van het zonnepaneel."	""	"merk"	"Merk van het zonnepaneel."	""	""	"true"	"https://wegenenverkeer-test.data.vlaanderen.be/ns/onderdeel#"	"Zonnepaneel.merk"	"http://www.w3.org/2002/07/owl#ObjectProperty"	"https://wegenenverkeer-test.data.vlaanderen.be/ns/onderdeel#Zonnepaneel"	"http://www.w3.org/2004/02/skos/core#Concept"	""	"1"	"1"
"attribute"	"OSLO-Onderdeel"	"modelnaam"	"{5AE6FBC5-A594-4977-A645-8C7480C9657E}"	""	"Zonnepaneel"	"{F5A43201-B397-4cab-AED2-4B594206FC81}"	"KlZonnepaneelModelnaam"	"modelnaam"	"Modelnaam van zonnepaneel."	""	"modelnaam"	"Modelnaam van zonnepaneel."	""	""	"true"	"https://wegenenverkeer-test.data.vlaanderen.be/ns/onderdeel#"	"Zonnepaneel.modelnaam"	"http://www.w3.org/2002/07/owl#ObjectProperty"	"https://wegenenverkeer-test.data.vlaanderen.be/ns/onderdeel#Zonnepaneel"	"http://www.w3.org/2004/02/skos/core#Concept"	""	"1"	"1"
"attribute"	"OSLO-Onderdeel"	"vermogen"	"{2EEB3E4C-EEE0-479b-AF6D-99190B01EC13}"	""	"Zonnepaneel"	"{F5A43201-B397-4cab-AED2-4B594206FC81}"	"KwantWrdInWatt"	"vermogen"	"Vermogen van het  zonnepaneel in Watt"	""	"vermogen"	"Vermogen van het  zonnepaneel in Watt"	""	""	"true"	"https://wegenenverkeer-test.data.vlaanderen.be/ns/onderdeel#"	"Zonnepaneel.vermogen"	"http://www.w3.org/2002/07/owl#ObjectProperty"	"https://wegenenverkeer-test.data.vlaanderen.be/ns/onderdeel#Zonnepaneel"	"https://wegenenverkeer-test.data.vlaanderen.be/ns/implementatieelement#KwantWrdInWatt"	""	"1"	"1"
"attribute"	"OSLO-Onderdeel"	"aantalRijenBetonstraatsteen"	"{0ADCE138-82DB-44fb-9FFC-8EB13A101446}"	""	"WatergreppelAfw"	"{B4F1D8E1-4573-452f-819F-D0B992B053C4}"	"Integer"	"aantal rijen betonstraatsteen"	"Het aantal rijen betonstraatsteen waaruit de watergreppel is opgebouwd."	""	"aantal rijen betonstraatsteen"	"Het aantal rijen betonstraatsteen waaruit de watergreppel is opgebouwd."	""	""	"true"	"https://wegenenverkeer-test.data.vlaanderen.be/ns/onderdeel#"	"WatergreppelAfw.aantalRijenBetonstraatsteen"	"http://www.w3.org/2002/07/owl#DatatypeProperty"	"https://wegenenverkeer-test.data.vlaanderen.be/ns/onderdeel#WatergreppelAfw"	"http://www.w3.org/2001/XMLSchema#integer"	""	"1"	"1"
"attribute"	"OSLO-Onderdeel"	"aantalRijenBetonstraatsteen"	"{07F9754E-9F50-45d3-BBDB-BA715D2ABB1C}"	""	"KantstrookAfw"	"{1FAECF33-84E6-4447-9658-C41C3EE92056}"	"Integer"	"aantal rijen betonstraatsteen"	"Het aantal rijen betonstraatsteen waaruit de kantstrook is opgebouwd."	""	"aantal rijen betonstraatsteen"	"Het aantal rijen betonstraatsteen waaruit de kantstrook is opgebouwd."	""	""	"true"	"https://wegenenverkeer-test.data.vlaanderen.be/ns/onderdeel#"	"KantstrookAfw.aantalRijenBetonstraatsteen"	"http://www.w3.org/2002/07/owl#DatatypeProperty"	"https://wegenenverkeer-test.data.vlaanderen.be/ns/onderdeel#KantstrookAfw"	"http://www.w3.org/2001/XMLSchema#integer"	""	"1"	"1"
"attribute"	"OSLO-Onderdeel"	"norm"	"{A89FF710-7DB7-48a6-B194-0195933F1940}"	""	"TrottoirbandWatergreppelStd"	"{9143F045-2170-4a63-96A7-B4BE3FEE8F0D}"	"DtcLENorm"	"norm"	"De gestandaardiseerde trottoirband_watergreppel volgens aangeduide norm."	""	"norm"	"De gestandaardiseerde trottoirband_watergreppel volgens aangeduide norm."	""	""	"true"	"https://wegenenverkeer-test.data.vlaanderen.be/ns/onderdeel#"	"TrottoirbandWatergreppelStd.norm"	"http://www.w3.org/2002/07/owl#ObjectProperty"	"https://wegenenverkeer-test.data.vlaanderen.be/ns/onderdeel#TrottoirbandWatergreppelStd"	"https://wegenenverkeer-test.data.vlaanderen.be/ns/onderdeel#DtcLENorm"	""	"1"	"1"
"attribute"	"OSLO-Onderdeel"	"type"	"{BA76434B-5B42-42e0-AC9B-D02AEC9F4BB0}"	""	"TrottoirbandWatergreppelStd"	"{9143F045-2170-4a63-96A7-B4BE3FEE8F0D}"	"KlLETrottoirbandWatergreppelType"	"type"	"Het type van gestandaardiseerde trottoirband_watergreppel"	""	"type"	"Het type van gestandaardiseerde trottoirband_watergreppel"	""	""	"true"	"https://wegenenverkeer-test.data.vlaanderen.be/ns/onderdeel#"	"TrottoirbandWatergreppelStd.type"	"http://www.w3.org/2002/07/owl#ObjectProperty"	"https://wegenenverkeer-test.data.vlaanderen.be/ns/onderdeel#TrottoirbandWatergreppelStd"	"http://www.w3.org/2004/02/skos/core#Concept"	""	"1"	"1"
"attribute"	"OSLO-Onderdeel"	"vorm"	"{0A408C52-FC6F-45ad-9190-B300D62949E5}"	""	"TrottoirbandWatergreppelStd"	"{9143F045-2170-4a63-96A7-B4BE3FEE8F0D}"	"DtcTrottoirbandVorm"	"vorm"	"De vorm van de gestandaardiseerde trottoirband_watergreppel."	""	"vorm"	"De vorm van de gestandaardiseerde trottoirband_watergreppel."	""	""	"true"	"https://wegenenverkeer-test.data.vlaanderen.be/ns/onderdeel#"	"TrottoirbandWatergreppelStd.vorm"	"http://www.w3.org/2002/07/owl#ObjectProperty"	"https://wegenenverkeer-test.data.vlaanderen.be/ns/onderdeel#TrottoirbandWatergreppelStd"	"https://wegenenverkeer-test.data.vlaanderen.be/ns/onderdeel#DtcTrottoirbandVorm"	""	"1"	"1"
"attribute"	"OSLO-Onderdeel"	"breedte"	"{BF5E0D4A-E874-4a7f-9D80-D0ECF65617C9}"	""	"SchampkantStd"	"{24165D65-2DB1-421d-8EEE-80301419D1D5}"	"KwantWrdInCentimeter"	"breedte"	"De breedte van de gestandaardiseerde schampkant in centimeter."	""	"breedte"	"De breedte van de gestandaardiseerde schampkant in centimeter."	""	""	"true"	"https://wegenenverkeer-test.data.vlaanderen.be/ns/onderdeel#"	"SchampkantStd.breedte"	"http://www.w3.org/2002/07/owl#ObjectProperty"	"https://wegenenverkeer-test.data.vlaanderen.be/ns/onderdeel#SchampkantStd"	"https://wegenenverkeer-test.data.vlaanderen.be/ns/implementatieelement#KwantWrdInCentimeter"	""	"1"	"1"
"attribute"	"OSLO-Onderdeel"	"dikte"	"{E4281655-58E4-4911-A3F7-7DE708578C4E}"	""	"SchampkantStd"	"{24165D65-2DB1-421d-8EEE-80301419D1D5}"	"KwantWrdInCentimeter"	"dikte"	"De dikte van de gestandaardiseerde schampkant in centimeter."	""	"dikte"	"De dikte van de gestandaardiseerde schampkant in centimeter."	""	""	"true"	"https://wegenenverkeer-test.data.vlaanderen.be/ns/onderdeel#"	"SchampkantStd.dikte"	"http://www.w3.org/2002/07/owl#ObjectProperty"	"https://wegenenverkeer-test.data.vlaanderen.be/ns/onderdeel#SchampkantStd"	"https://wegenenverkeer-test.data.vlaanderen.be/ns/implementatieelement#KwantWrdInCentimeter"	""	"1"	"1"
"attribute"	"OSLO-Onderdeel"	"norm"	"{37055BE2-0BCB-4366-B179-8E512518E1A7}"	""	"SchampkantStd"	"{24165D65-2DB1-421d-8EEE-80301419D1D5}"	"DtcLENorm"	"norm"	"De gestandardiseerde schampkant volgens aangeduide norm."	""	"norm"	"De gestandardiseerde schampkant volgens aangeduide norm."	""	""	"true"	"https://wegenenverkeer-test.data.vlaanderen.be/ns/onderdeel#"	"SchampkantStd.norm"	"http://www.w3.org/2002/07/owl#ObjectProperty"	"https://wegenenverkeer-test.data.vlaanderen.be/ns/onderdeel#SchampkantStd"	"https://wegenenverkeer-test.data.vlaanderen.be/ns/onderdeel#DtcLENorm"	""	"1"	"1"
"attribute"	"OSLO-Onderdeel"	"type"	"{FAC871B3-DB67-4680-BF7F-7C40E701ABBA}"	""	"SchampkantStd"	"{24165D65-2DB1-421d-8EEE-80301419D1D5}"	"KlLESchampkantType"	"type"	"Het type van gestandaardiseerde schampkant."	""	"type"	"Het type van gestandaardiseerde schampkant."	""	""	"true"	"https://wegenenverkeer-test.data.vlaanderen.be/ns/onderdeel#"	"SchampkantStd.type"	"http://www.w3.org/2002/07/owl#ObjectProperty"	"https://wegenenverkeer-test.data.vlaanderen.be/ns/onderdeel#SchampkantStd"	"http://www.w3.org/2004/02/skos/core#Concept"	""	"1"	"1"
"attribute"	"OSLO-Onderdeel"	"breedte"	"{857462FB-DBB0-4e7a-952E-196A5444D0DD}"	""	"KantstrookStd"	"{56B85002-C5FF-417d-AFC4-AD71E9CCE82D}"	"KwantWrdInCentimeter"	"breedte"	"De breedte van de gestandaardiseerde kantstrook in centimeter."	""	"breedte"	"De breedte van de gestandaardiseerde kantstrook in centimeter."	""	""	"true"	"https://wegenenverkeer-test.data.vlaanderen.be/ns/onderdeel#"	"KantstrookStd.breedte"	"http://www.w3.org/2002/07/owl#ObjectProperty"	"https://wegenenverkeer-test.data.vlaanderen.be/ns/onderdeel#KantstrookStd"	"https://wegenenverkeer-test.data.vlaanderen.be/ns/implementatieelement#KwantWrdInCentimeter"	""	"1"	"1"
"attribute"	"OSLO-Onderdeel"	"dikte"	"{658A87D8-2A33-441a-B04C-F847E5E47114}"	""	"KantstrookStd"	"{56B85002-C5FF-417d-AFC4-AD71E9CCE82D}"	"KwantWrdInCentimeter"	"dikte"	"De dikte van de gestandaardiseerde kantstrook in centimeter"	""	"dikte"	"De dikte van de gestandaardiseerde kantstrook in centimeter"	""	""	"true"	"https://wegenenverkeer-test.data.vlaanderen.be/ns/onderdeel#"	"KantstrookStd.dikte"	"http://www.w3.org/2002/07/owl#ObjectProperty"	"https://wegenenverkeer-test.data.vlaanderen.be/ns/onderdeel#KantstrookStd"	"https://wegenenverkeer-test.data.vlaanderen.be/ns/implementatieelement#KwantWrdInCentimeter"	""	"1"	"1"
"attribute"	"OSLO-Onderdeel"	"norm"	"{BC36F4DE-CE1D-4c7d-981F-D1EAEC6C226C}"	""	"KantstrookStd"	"{56B85002-C5FF-417d-AFC4-AD71E9CCE82D}"	"DtcLENorm"	"norm"	"De gestandardiseerd kantstrook volgens aangeduide norm."	""	"norm"	"De gestandardiseerd kantstrook volgens aangeduide norm."	""	""	"true"	"https://wegenenverkeer-test.data.vlaanderen.be/ns/onderdeel#"	"KantstrookStd.norm"	"http://www.w3.org/2002/07/owl#ObjectProperty"	"https://wegenenverkeer-test.data.vlaanderen.be/ns/onderdeel#KantstrookStd"	"https://wegenenverkeer-test.data.vlaanderen.be/ns/onderdeel#DtcLENorm"	""	"1"	"1"
"attribute"	"OSLO-Onderdeel"	"type"	"{6E836B67-BB0C-43c0-8B3A-66B52D24C34E}"	""	"KantstrookStd"	"{56B85002-C5FF-417d-AFC4-AD71E9CCE82D}"	"KlLEKantstrookType"	"type"	"Het type van gestandaardiseerde kantstrook."	""	"type"	"Het type van gestandaardiseerde kantstrook."	""	""	"true"	"https://wegenenverkeer-test.data.vlaanderen.be/ns/onderdeel#"	"KantstrookStd.type"	"http://www.w3.org/2002/07/owl#ObjectProperty"	"https://wegenenverkeer-test.data.vlaanderen.be/ns/onderdeel#KantstrookStd"	"http://www.w3.org/2004/02/skos/core#Concept"	""	"1"	"1"
"attribute"	"OSLO-Onderdeel"	"isVerholen"	"{A3CBBAD2-9A99-4c51-B661-F9423D521BE0}"	""	"WatergreppelStd"	"{4A5376EF-0260-4eba-84E0-17B2FC2BFE63}"	"Boolean"	"Is verholen"	"Aanduiding of de watergreppel verholen is. Verholen goten hebben een kleine sleufopening en een grote afvoercapaciteit."	""	"Is verholen"	"Aanduiding of de watergreppel verholen is. Verholen goten hebben een kleine sleufopening en een grote afvoercapaciteit."	""	""	"true"	"https://wegenenverkeer-test.data.vlaanderen.be/ns/onderdeel#"	"WatergreppelStd.isVerholen"	"http://www.w3.org/2002/07/owl#DatatypeProperty"	"https://wegenenverkeer-test.data.vlaanderen.be/ns/onderdeel#WatergreppelStd"	"http://www.w3.org/2001/XMLSchema#boolean"	""	"1"	"1"
"attribute"	"OSLO-Onderdeel"	"norm"	"{C81FB1BE-FB43-463a-AA6D-82998C30530F}"	""	"WatergreppelStd"	"{4A5376EF-0260-4eba-84E0-17B2FC2BFE63}"	"DtcLENorm"	"norm"	"De gestandaardiseerde watergreppel volgens aangeduide norm."	""	"norm"	"De gestandaardiseerde watergreppel volgens aangeduide norm."	""	""	"true"	"https://wegenenverkeer-test.data.vlaanderen.be/ns/onderdeel#"	"WatergreppelStd.norm"	"http://www.w3.org/2002/07/owl#ObjectProperty"	"https://wegenenverkeer-test.data.vlaanderen.be/ns/onderdeel#WatergreppelStd"	"https://wegenenverkeer-test.data.vlaanderen.be/ns/onderdeel#DtcLENorm"	""	"1"	"1"
"attribute"	"OSLO-Onderdeel"	"type"	"{5706FDCC-E2A6-4409-B64D-165FCD9B935D}"	""	"WatergreppelStd"	"{4A5376EF-0260-4eba-84E0-17B2FC2BFE63}"	"KlLEWatergreppelType"	"type"	"Het type van gestandaardiseerde watergreppel."	""	"type"	"Het type van gestandaardiseerde watergreppel."	""	""	"true"	"https://wegenenverkeer-test.data.vlaanderen.be/ns/onderdeel#"	"WatergreppelStd.type"	"http://www.w3.org/2002/07/owl#ObjectProperty"	"https://wegenenverkeer-test.data.vlaanderen.be/ns/onderdeel#WatergreppelStd"	"http://www.w3.org/2004/02/skos/core#Concept"	""	"1"	"1"
