"EA-Type"	"EA-Package"	"EA-Name"	"EA-GUID"	"EA-Parent"	"EA-Domain"	"EA-Domain-GUID"	"EA-Range"	"label"	"definition"	"usage"	"ap-label-nl"	"ap-definition-nl"	"ap-usageNote-nl"	"ap-codelist"	"external term"	"namespace"	"localname"	"type"	"domain"	"range"	"parent"	"min card"	"max card"
"Package"	""	"OSLO-Lijnvormige-elementen"	"{1105CEF2-95A6-4e7b-A77D-4CBC3BF328E9}"	""	""	""	""	""	""	""	""	""	""	""	""	"http://"	"fixme.com"	"http://www.w3.org/2002/07/owl#Ontology"	""	""	""	""	""
"CLASS"	"OSLO-Onderdeel"	"Dilatatie"	"{D462D9EC-38B6-4d71-8F06-285980132893}"	""	""	""	""	"Dilatatie"	"Dilataties zijn bedoeld om ervoor te zorgen dat bouwconstructies vrij kunnen krimpen en uitzetten bij onder andere temperatuurwisselingen."	""	"Dilatatie"	"Dilataties zijn bedoeld om ervoor te zorgen dat bouwconstructies vrij kunnen krimpen en uitzetten bij onder andere temperatuurwisselingen."	""	""	"true"	"https://wegenenverkeer-test.data.vlaanderen.be/ns/onderdeel#"	"Dilatatie"	"http://www.w3.org/2000/01/rdf-schema#Class"	""	""	""	""	""
"CLASS"	"OSLO-Onderdeel"	"RetroreflecterendVerkeersbord"	"{3357BF71-C0AA-4429-B328-260F39B3936D}"	""	""	""	""	"Retroreflecterend verkeersbord"	"Verkeersbord met op het beeldvlak een tekening en/of tekst die worden weergegeven met een geëigend bekledingsmateriaal."	""	"Retroreflecterend verkeersbord"	"Verkeersbord met op het beeldvlak een tekening en/of tekst die worden weergegeven met een geëigend bekledingsmateriaal."	""	""	"true"	"https://wegenenverkeer-test.data.vlaanderen.be/ns/onderdeel#"	"RetroreflecterendVerkeersbord"	"http://www.w3.org/2000/01/rdf-schema#Class"	""	""	"https://wegenenverkeer-test.data.vlaanderen.be/ns/implementatieelement#AIMObject, https://wegenenverkeer-test.data.vlaanderen.be/ns/abstracten#Verkeersbord"	""	""
"CLASS"	"OSLO-Onderdeel"	"ReflectorInLijnvormigElement"	"{933A1A46-2DDA-47e8-A981-037775177380}"	""	""	""	""	"Reflector in lijnvormig element"	"Een reflector dat deel uitmaakt van een constructie met als doel de zichtbaarheid van deze constructie te verhogen."	""	"Reflector in lijnvormig element"	"Een reflector dat deel uitmaakt van een constructie met als doel de zichtbaarheid van deze constructie te verhogen."	""	""	"true"	"https://wegenenverkeer-test.data.vlaanderen.be/ns/onderdeel#"	"ReflectorInLijnvormigElement"	"http://www.w3.org/2000/01/rdf-schema#Class"	""	""	"https://wegenenverkeer-test.data.vlaanderen.be/ns/abstracten#Bebakening"	""	""
"CLASS"	"OSLO-Onderdeel"	"Zonnepaneel"	"{F5A43201-B397-4cab-AED2-4B594206FC81}"	""	""	""	""	"Zonnepaneel"	"Ook wel fotovoltaïsche cellen of zonnecellen.
Toestel om elektrische energie op te wekken uit zonlicht met als doel het voeden van een installatie."	""	"Zonnepaneel"	"Ook wel fotovoltaïsche cellen of zonnecellen.
Toestel om elektrische energie op te wekken uit zonlicht met als doel het voeden van een installatie."	""	""	"true"	"https://wegenenverkeer-test.data.vlaanderen.be/ns/onderdeel#"	"Zonnepaneel"	"http://www.w3.org/2000/01/rdf-schema#Class"	""	""	"https://wegenenverkeer-test.data.vlaanderen.be/ns/abstracten#Voedingspunt"	""	""
"CLASS"	"OSLO-Onderdeel"	"TrottoirbandAfw"	"{2AFFD0E7-0E17-4e45-90B3-21F6E8AFBF07}"	"AfwijkendeKantopsluiting"	""	""	""	"Afwijkende trottoirband"	"Kantopsluiting bestemd om de rand van de verharding te beschermen en te versterken."	""	"Afwijkende trottoirband"	"Kantopsluiting bestemd om de rand van de verharding te beschermen en te versterken."	""	""	"true"	"https://wegenenverkeer-test.data.vlaanderen.be/ns/onderdeel#"	"TrottoirbandAfw"	"http://www.w3.org/2000/01/rdf-schema#Class"	""	""	"https://wegenenverkeer-test.data.vlaanderen.be/ns/abstracten#AfwijkendeKantopsluiting"	""	""
"CLASS"	"OSLO-Onderdeel"	"WatergreppelAfw"	"{B4F1D8E1-4573-452f-819F-D0B992B053C4}"	"AfwijkendeKantopsluiting"	""	""	""	"Afwijkende watergreppel"	"Kantopsluiting bestemd om water van de verharding op te vangen en af te voeren."	""	"Afwijkende watergreppel"	"Kantopsluiting bestemd om water van de verharding op te vangen en af te voeren."	""	""	"true"	"https://wegenenverkeer-test.data.vlaanderen.be/ns/onderdeel#"	"WatergreppelAfw"	"http://www.w3.org/2000/01/rdf-schema#Class"	""	""	"https://wegenenverkeer-test.data.vlaanderen.be/ns/abstracten#AfwijkendeKantopsluiting"	""	""
"CLASS"	"OSLO-Onderdeel"	"TrottoirbandWatergreppelAfw"	"{C0D36493-69F1-49b4-86D7-6F940B9EC83B}"	"AfwijkendeKantopsluiting"	""	""	""	"Afwijkende trottoirband-watergreppel"	"Kantopsluiting die een trottoirband en een watergreppel combineert in een geheel."	""	"Afwijkende trottoirband-watergreppel"	"Kantopsluiting die een trottoirband en een watergreppel combineert in een geheel."	""	""	"true"	"https://wegenenverkeer-test.data.vlaanderen.be/ns/onderdeel#"	"TrottoirbandWatergreppelAfw"	"http://www.w3.org/2000/01/rdf-schema#Class"	""	""	"https://wegenenverkeer-test.data.vlaanderen.be/ns/abstracten#AfwijkendeKantopsluiting"	""	""
"CLASS"	"OSLO-Onderdeel"	"KantstrookAfw"	"{1FAECF33-84E6-4447-9658-C41C3EE92056}"	"AfwijkendeKantopsluiting"	""	""	""	"Afwijkende kantstrook"	"Kantopsluiting bestemd om de verharding steun te geven."	""	"Afwijkende kantstrook"	"Kantopsluiting bestemd om de verharding steun te geven."	""	""	"true"	"https://wegenenverkeer-test.data.vlaanderen.be/ns/onderdeel#"	"KantstrookAfw"	"http://www.w3.org/2000/01/rdf-schema#Class"	""	""	"https://wegenenverkeer-test.data.vlaanderen.be/ns/abstracten#AfwijkendeKantopsluiting"	""	""
"CLASS"	"OSLO-Onderdeel"	"SchampkantAfw"	"{3C3C5E2A-28DD-4b6f-B610-7F29D09ACC0C}"	"AfwijkendeKantopsluiting"	""	""	""	"Afwijkende schampkant"	"Kantopsluiting die zones van voertuigenverkeer onderling of voertuigenzones van andere
verkeerszones scheidt en de overschrijding door voertuigen bemoeilijkt maar geen voertuigkerende
functie heeft."	""	"Afwijkende schampkant"	"Kantopsluiting die zones van voertuigenverkeer onderling of voertuigenzones van andere
verkeerszones scheidt en de overschrijding door voertuigen bemoeilijkt maar geen voertuigkerende
functie heeft."	""	""	"true"	"https://wegenenverkeer-test.data.vlaanderen.be/ns/onderdeel#"	"SchampkantAfw"	"http://www.w3.org/2000/01/rdf-schema#Class"	""	""	"https://wegenenverkeer-test.data.vlaanderen.be/ns/abstracten#AfwijkendeKantopsluiting"	""	""
"CLASS"	"OSLO-Onderdeel"	"TrottoirbandWatergreppelStd"	"{9143F045-2170-4a63-96A7-B4BE3FEE8F0D}"	"GestandaardiseerdeKantopsluiting"	""	""	""	"Gestandaardiseerde trottoirband-watergreppel"	"Kantopsluiting die een trottoirband en een watergreppel combineert in een geheel."	""	"Gestandaardiseerde trottoirband-watergreppel"	"Kantopsluiting die een trottoirband en een watergreppel combineert in een geheel."	""	""	"true"	"https://wegenenverkeer-test.data.vlaanderen.be/ns/onderdeel#"	"TrottoirbandWatergreppelStd"	"http://www.w3.org/2000/01/rdf-schema#Class"	""	""	"https://wegenenverkeer-test.data.vlaanderen.be/ns/abstracten#GestandaardiseerdeKantopsluiting"	""	""
"CLASS"	"OSLO-Onderdeel"	"SchampkantStd"	"{24165D65-2DB1-421d-8EEE-80301419D1D5}"	"GestandaardiseerdeKantopsluiting"	""	""	""	"Gestandaardiseerde schampkant"	"Kantopsluiting die zones van voertuigenverkeer onderling of voertuigenzones van andere
verkeerszones scheidt en de overschrijding door voertuigen bemoeilijkt maar geen voertuigkerende
functie heeft."	""	"Gestandaardiseerde schampkant"	"Kantopsluiting die zones van voertuigenverkeer onderling of voertuigenzones van andere
verkeerszones scheidt en de overschrijding door voertuigen bemoeilijkt maar geen voertuigkerende
functie heeft."	""	""	"true"	"https://wegenenverkeer-test.data.vlaanderen.be/ns/onderdeel#"	"SchampkantStd"	"http://www.w3.org/2000/01/rdf-schema#Class"	""	""	"https://wegenenverkeer-test.data.vlaanderen.be/ns/abstracten#GestandaardiseerdeKantopsluiting"	""	""
"CLASS"	"OSLO-Onderdeel"	"KantstrookStd"	"{56B85002-C5FF-417d-AFC4-AD71E9CCE82D}"	"GestandaardiseerdeKantopsluiting"	""	""	""	"Gestandaardiseerde Kantstrook"	"Kantopsluiting bestemd om de verharding steun te geven."	""	"Gestandaardiseerde Kantstrook"	"Kantopsluiting bestemd om de verharding steun te geven."	""	""	"true"	"https://wegenenverkeer-test.data.vlaanderen.be/ns/onderdeel#"	"KantstrookStd"	"http://www.w3.org/2000/01/rdf-schema#Class"	""	""	"https://wegenenverkeer-test.data.vlaanderen.be/ns/abstracten#GestandaardiseerdeKantopsluiting"	""	""
"CLASS"	"OSLO-Onderdeel"	"WatergreppelStd"	"{4A5376EF-0260-4eba-84E0-17B2FC2BFE63}"	"GestandaardiseerdeKantopsluiting"	""	""	""	"Gestandaardiseerde watergreppel"	"Kantopsluiting bestemd om water van de verharding op te vangen en af te voeren."	""	"Gestandaardiseerde watergreppel"	"Kantopsluiting bestemd om water van de verharding op te vangen en af te voeren."	""	""	"true"	"https://wegenenverkeer-test.data.vlaanderen.be/ns/onderdeel#"	"WatergreppelStd"	"http://www.w3.org/2000/01/rdf-schema#Class"	""	""	"https://wegenenverkeer-test.data.vlaanderen.be/ns/abstracten#GestandaardiseerdeKantopsluiting"	""	""
"CLASS"	"OSLO-Onderdeel"	"TrottoirbandStd"	"{3DB3C498-AA30-49ee-9FE0-1AC3E4B1E9BE}"	"GestandaardiseerdeKantopsluiting"	""	""	""	"Gestandaardiseerde trottoirband"	"Kantopsluiting bestemd om de rand van de verharding te beschermen en te versterken."	""	"Gestandaardiseerde trottoirband"	"Kantopsluiting bestemd om de rand van de verharding te beschermen en te versterken."	""	""	"true"	"https://wegenenverkeer-test.data.vlaanderen.be/ns/onderdeel#"	"TrottoirbandStd"	"http://www.w3.org/2000/01/rdf-schema#Class"	""	""	"https://wegenenverkeer-test.data.vlaanderen.be/ns/abstracten#GestandaardiseerdeKantopsluiting"	""	""
"CLASS"	"OSLO-Abstracten"	"AansluitendeConstructie"	"{3E0FCE31-4342-434d-A9B8-32712E14DF84}"	"AfschermendeConstructie"	""	""	""	"Aansluitende constructie"	"Abstracte die alle aansluitende constructies bundelt."	""	"Aansluitende constructie"	"Abstracte die alle aansluitende constructies bundelt."	""	""	"true"	"https://wegenenverkeer-test.data.vlaanderen.be/ns/abstracten#"	"AansluitendeConstructie"	"http://www.w3.org/2000/01/rdf-schema#Class"	""	""	"https://wegenenverkeer-test.data.vlaanderen.be/ns/abstracten#AfschermendeConstructie"	""	""
"CLASS"	"OSLO-Abstracten"	"VegetatieElement"	"{830C69E5-4D0C-4d23-AE2D-1CCAD85E8E6F}"	""	""	""	""	"Vegetatie element"	"Abstracte om alle gemeenschappelijke eigenschappen en relaties van de solitaire plant in de ruimte onder 1 noemer te plaatsen."	""	"Vegetatie element"	"Abstracte om alle gemeenschappelijke eigenschappen en relaties van de solitaire plant in de ruimte onder 1 noemer te plaatsen."	""	""	"true"	"https://wegenenverkeer-test.data.vlaanderen.be/ns/abstracten#"	"VegetatieElement"	"http://www.w3.org/2000/01/rdf-schema#Class"	""	""	"https://wegenenverkeer-test.data.vlaanderen.be/ns/implementatieelement#AIMObject"	""	""
"CLASS"	"OSLO-Installatie"	"Wegberm"	"{FA6DE478-4F58-4f03-9CC1-3FF8327E5B69}"	""	""	""	""	"Wegberm"	"Gedeelte van het wegplatform dat buiten de rijbanen ligt. Een wegberm kan sloten en bijzonder ingerichte onderdelen bevatten."	""	"Wegberm"	"Gedeelte van het wegplatform dat buiten de rijbanen ligt. Een wegberm kan sloten en bijzonder ingerichte onderdelen bevatten."	""	""	"true"	"https://wegenenverkeer-test.data.vlaanderen.be/ns/installatie#"	"Wegberm"	"http://www.w3.org/2000/01/rdf-schema#Class"	""	""	"https://wegenenverkeer-test.data.vlaanderen.be/ns/implementatieelement#AIMObject, https://wegenenverkeer-test.data.vlaanderen.be/ns/abstracten#TerreinDeel"	""	""
"CLASS"	"OSLO-Onderdeel"	"Motorvangplank"	"{BCD716FE-F9A8-4a76-884D-55A6DE88830F}"	""	""	""	""	"Motorvangplank"	"Een constructie geïnstalleerd aan een geleideconstructie of in de onmiddellijke omgeving ervan,met als doel de ernst van een botsing van een motorrijder met de geleideconstructie te reduceren."	""	"Motorvangplank"	"Een constructie geïnstalleerd aan een geleideconstructie of in de onmiddellijke omgeving ervan,met als doel de ernst van een botsing van een motorrijder met de geleideconstructie te reduceren."	""	""	"true"	"https://wegenenverkeer-test.data.vlaanderen.be/ns/onderdeel#"	"Motorvangplank"	"http://www.w3.org/2000/01/rdf-schema#Class"	""	""	"https://wegenenverkeer-test.data.vlaanderen.be/ns/implementatieelement#AIMObject"	""	""
"CLASS"	"OSLO-Onderdeel"	"GetesteBeginconstructie"	"{5534BB26-E857-4ee5-A6AE-21697DFB6848}"	"Beginstuk"	""	""	""	"Geteste beginconstructie"	"Een gecertficeerd begin aan een geleideconstructie,met als doel de ernst van een frontale botsing te reduceren aan de stroomopwaartse zijde ten opzichte van de meest nabij gelegen rijstrook."	""	"Geteste beginconstructie"	"Een gecertficeerd begin aan een geleideconstructie,met als doel de ernst van een frontale botsing te reduceren aan de stroomopwaartse zijde ten opzichte van de meest nabij gelegen rijstrook."	""	""	"true"	"https://wegenenverkeer-test.data.vlaanderen.be/ns/onderdeel#"	"GetesteBeginconstructie"	"http://www.w3.org/2000/01/rdf-schema#Class"	""	""	"https://wegenenverkeer-test.data.vlaanderen.be/ns/abstracten#Beginstuk"	""	""
"CLASS"	"OSLO-Onderdeel"	"NietGetestBeginstuk"	"{9210C31C-FA68-404d-96AC-F07231BE7716}"	"Beginstuk"	""	""	""	"Niet getest beginstuk"	"Een niet-gecertificeerd begin aan een geleideconstructie,aan de stroomopwaartse zijde ten opzichte van de meest nabij gelegen rijstrook."	""	"Niet getest beginstuk"	"Een niet-gecertificeerd begin aan een geleideconstructie,aan de stroomopwaartse zijde ten opzichte van de meest nabij gelegen rijstrook."	""	""	"true"	"https://wegenenverkeer-test.data.vlaanderen.be/ns/onderdeel#"	"NietGetestBeginstuk"	"http://www.w3.org/2000/01/rdf-schema#Class"	""	""	"https://wegenenverkeer-test.data.vlaanderen.be/ns/abstracten#Beginstuk"	""	""
"CLASS"	"OSLO-Abstracten"	"Beginstuk"	"{B142C119-01FA-48d6-8E43-6E22904C6E4F}"	""	""	""	""	"Beginstuk"	"Abstracte voor een stuk aan het uiteinde van een geleideconstructie,met als doel een frontale botsing te reduceren gericht naar het naderende verkeer."	""	"Beginstuk"	"Abstracte voor een stuk aan het uiteinde van een geleideconstructie,met als doel een frontale botsing te reduceren gericht naar het naderende verkeer."	""	""	"true"	"https://wegenenverkeer-test.data.vlaanderen.be/ns/abstracten#"	"Beginstuk"	"http://www.w3.org/2000/01/rdf-schema#Class"	""	""	""	""	""
"CLASS"	"OSLO-Onderdeel"	"Overgangsconstructie"	"{D6C1FCA3-D770-4e0e-BC0D-D76A7DD3A685}"	"AansluitendeConstructie"	""	""	""	"Overgangsconstructie"	"Verbinding tussen twee afschermende constructies voor wegen van verschillende ontwerpen en/of prestatiekenmerken."	""	"Overgangsconstructie"	"Verbinding tussen twee afschermende constructies voor wegen van verschillende ontwerpen en/of prestatiekenmerken."	""	""	"true"	"https://wegenenverkeer-test.data.vlaanderen.be/ns/onderdeel#"	"Overgangsconstructie"	"http://www.w3.org/2000/01/rdf-schema#Class"	""	""	"https://wegenenverkeer-test.data.vlaanderen.be/ns/abstracten#AansluitendeConstructie"	""	""
"CLASS"	"OSLO-Onderdeel"	"Geleideconstructie"	"{65033CCD-2341-44b6-A430-1D02B6DF2679}"	"AansluitendeConstructie"	""	""	""	"Geleideconstructie"	"Een doorlopende afschermende constructie voor voertuigen geïnstalleerd langs de weg of in de middenberm."	""	"Geleideconstructie"	"Een doorlopende afschermende constructie voor voertuigen geïnstalleerd langs de weg of in de middenberm."	""	""	"true"	"https://wegenenverkeer-test.data.vlaanderen.be/ns/onderdeel#"	"Geleideconstructie"	"http://www.w3.org/2000/01/rdf-schema#Class"	""	""	"https://wegenenverkeer-test.data.vlaanderen.be/ns/abstracten#AansluitendeConstructie"	""	""
"CLASS"	"OSLO-Onderdeel"	"Eindstuk"	"{4A2D7442-312E-4ee7-99CA-2412E4807AD4}"	"AfschermendeConstructie"	""	""	""	"Eindstuk"	"Een niet-gecertificeerd einde aan een geleideconstructie,aan de stroomafwaartse zijde ten opzichte van de meest nabij gelegen rijstrook."	""	"Eindstuk"	"Een niet-gecertificeerd einde aan een geleideconstructie,aan de stroomafwaartse zijde ten opzichte van de meest nabij gelegen rijstrook."	""	""	"true"	"https://wegenenverkeer-test.data.vlaanderen.be/ns/onderdeel#"	"Eindstuk"	"http://www.w3.org/2000/01/rdf-schema#Class"	""	""	"https://wegenenverkeer-test.data.vlaanderen.be/ns/abstracten#AfschermendeConstructie"	""	""
"CLASS"	"OSLO-Onderdeel"	"Obstakelbeveiliger"	"{72CF6BCB-A5F5-44e8-BDEF-C24C89DE4941}"	"AfschermendeConstructie"	""	""	""	"Obstakelbeveiliger"	"Een energie-absorberende constructie voor voertuigen,geïnstalleerd vóór één of meerdere obstakels,met als doel de ernst van een botsing te reduceren."	""	"Obstakelbeveiliger"	"Een energie-absorberende constructie voor voertuigen,geïnstalleerd vóór één of meerdere obstakels,met als doel de ernst van een botsing te reduceren."	""	""	"true"	"https://wegenenverkeer-test.data.vlaanderen.be/ns/onderdeel#"	"Obstakelbeveiliger"	"http://www.w3.org/2000/01/rdf-schema#Class"	""	""	"https://wegenenverkeer-test.data.vlaanderen.be/ns/abstracten#AfschermendeConstructie"	""	""
"CLASS"	"OSLO-Onderdeel"	"Pictogram"	"{3C28F52A-9634-4f6b-B06C-5413461DAA00}"	""	""	""	""	"Pictogram"	"Een bord dat een symbool of afbeelding bevat dat de plaats inneemt van een tekst."	""	"Pictogram"	"Een bord dat een symbool of afbeelding bevat dat de plaats inneemt van een tekst."	""	""	"true"	"https://wegenenverkeer-test.data.vlaanderen.be/ns/onderdeel#"	"Pictogram"	"http://www.w3.org/2000/01/rdf-schema#Class"	""	""	"https://wegenenverkeer-test.data.vlaanderen.be/ns/implementatieelement#AIMObject"	""	""
"CLASS"	"OSLO-Abstracten"	"LijnvormigElement"	"{6121E3D6-A3CB-48a1-941F-BEDD49BB1277}"	""	""	""	""	"Lijnvormig element"	"Abstracte voor de gemeenschappelijke eigenschappen en relaties van lijnvormige elementen."	""	"Lijnvormig element"	"Abstracte voor de gemeenschappelijke eigenschappen en relaties van lijnvormige elementen."	""	""	"true"	"https://wegenenverkeer-test.data.vlaanderen.be/ns/abstracten#"	"LijnvormigElement"	"http://www.w3.org/2000/01/rdf-schema#Class"	""	""	"https://wegenenverkeer-test.data.vlaanderen.be/ns/implementatieelement#AIMObject"	""	""
"CLASS"	"OSLO-Installatie"	"Gronddam"	"{32F089A6-4E2A-4382-BC05-40D104965A16}"	""	""	""	""	"Gronddam"	"Gronddammen zijn trapeziumvormige constructies bestaande uit zand,grond of steenachtige materialen. De onderkant van de gronddam wordt direct op het bestaand maaiveld aangebracht of op een vooraf aangebrachte grondverbetering."	""	"Gronddam"	"Gronddammen zijn trapeziumvormige constructies bestaande uit zand,grond of steenachtige materialen. De onderkant van de gronddam wordt direct op het bestaand maaiveld aangebracht of op een vooraf aangebrachte grondverbetering."	""	""	"true"	"https://wegenenverkeer-test.data.vlaanderen.be/ns/installatie#"	"Gronddam"	"http://www.w3.org/2000/01/rdf-schema#Class"	""	""	"https://wegenenverkeer-test.data.vlaanderen.be/ns/implementatieelement#AIMObject"	""	""
"CLASS"	"OSLO-Onderdeel"	"Doorgang"	"{0E67D6CC-0FCF-497a-93DC-75F67DA28F24}"	""	""	""	""	"Doorgang"	"Doorgangen voorzien als vluchtmogelijkheid met dezelfde akoestische kwaliteitseisen als de voorgestelde schermen bezitten."	""	"Doorgang"	"Doorgangen voorzien als vluchtmogelijkheid met dezelfde akoestische kwaliteitseisen als de voorgestelde schermen bezitten."	""	""	"true"	"https://wegenenverkeer-test.data.vlaanderen.be/ns/onderdeel#"	"Doorgang"	"http://www.w3.org/2000/01/rdf-schema#Class"	""	""	"https://wegenenverkeer-test.data.vlaanderen.be/ns/implementatieelement#AIMObject"	""	""
"CLASS"	"OSLO-Onderdeel"	"GeluidswerendeConstructie"	"{9E8E6E6A-B93E-4798-BFDC-4957F010D21F}"	"LijnvormigElement"	""	""	""	"Geluidswerende constructie"	"Een geluidswerende wandvormige constructie bestaande uit een desgevallend geluidsisolerend materiaal en/of geluidsabsorberend materiaal en voorzien van de nodige structuren om de bouwkundige stabiliteit te verzekeren."	""	"Geluidswerende constructie"	"Een geluidswerende wandvormige constructie bestaande uit een desgevallend geluidsisolerend materiaal en/of geluidsabsorberend materiaal en voorzien van de nodige structuren om de bouwkundige stabiliteit te verzekeren."	""	""	"true"	"https://wegenenverkeer-test.data.vlaanderen.be/ns/onderdeel#"	"GeluidswerendeConstructie"	"http://www.w3.org/2000/01/rdf-schema#Class"	""	""	"https://wegenenverkeer-test.data.vlaanderen.be/ns/abstracten#LijnvormigElement"	""	""
"CLASS"	"OSLO-Abstracten"	"GestandaardiseerdeKantopsluiting"	"{F53549F6-187E-4754-8018-F51743815AF5}"	"Kantopsluiting"	""	""	""	"Gestandaardiseerde kantopsluiting"	"Abstracte voor een kantopsluiting die voldoet aan een bepaalde standaard."	""	"Gestandaardiseerde kantopsluiting"	"Abstracte voor een kantopsluiting die voldoet aan een bepaalde standaard."	""	""	"true"	"https://wegenenverkeer-test.data.vlaanderen.be/ns/abstracten#"	"GestandaardiseerdeKantopsluiting"	"http://www.w3.org/2000/01/rdf-schema#Class"	""	""	"https://wegenenverkeer-test.data.vlaanderen.be/ns/abstracten#Kantopsluiting"	""	""
"CLASS"	"OSLO-Abstracten"	"AfwijkendeKantopsluiting"	"{EADCA01F-1948-4229-92EA-B2CEE57554E6}"	"Kantopsluiting"	""	""	""	"Afwijkende kantopsluiting"	"Abstracte voor een lijnvormig element dat niet voldoet aan een bepaalde standaard."	""	"Afwijkende kantopsluiting"	"Abstracte voor een lijnvormig element dat niet voldoet aan een bepaalde standaard."	""	""	"true"	"https://wegenenverkeer-test.data.vlaanderen.be/ns/abstracten#"	"AfwijkendeKantopsluiting"	"http://www.w3.org/2000/01/rdf-schema#Class"	""	""	"https://wegenenverkeer-test.data.vlaanderen.be/ns/abstracten#Kantopsluiting"	""	""
"CLASS"	"OSLO-Installatie"	"Baanlichaam"	"{3E3B2BD9-C160-4b4b-8F53-523B8E16523F}"	""	""	""	""	"Baanlichaam"	"De lagen tussen het baanbed en het baanoppervlak."	""	"Baanlichaam"	"De lagen tussen het baanbed en het baanoppervlak."	""	""	"true"	"https://wegenenverkeer-test.data.vlaanderen.be/ns/installatie#"	"Baanlichaam"	"http://www.w3.org/2000/01/rdf-schema#Class"	""	""	"https://wegenenverkeer-test.data.vlaanderen.be/ns/implementatieelement#AIMObject"	""	""
"CLASS"	"OSLO-Abstracten"	"Laag"	"{70756F26-9B6F-4fec-9837-2006A2A36FEB}"	""	""	""	""	"Laag"	"Abstracte voor de gemeenschappelijke eigenschappen van de onderliggende verhardings- en funderings-onderdelen."	""	"Laag"	"Abstracte voor de gemeenschappelijke eigenschappen van de onderliggende verhardings- en funderings-onderdelen."	""	""	"true"	"https://wegenenverkeer-test.data.vlaanderen.be/ns/abstracten#"	"Laag"	"http://www.w3.org/2000/01/rdf-schema#Class"	""	""	"https://wegenenverkeer-test.data.vlaanderen.be/ns/implementatieelement#AIMObject"	""	""
"CLASS"	"OSLO-Abstracten"	"AfschermendeConstructie"	"{9BDE2CBE-717B-44ed-A682-EB6548E78E44}"	"LijnvormigElement"	""	""	""	"Afschermende constructie"	"Abstracte die,een lijn- of puntvormige constructie geïnstalleerd langs de weg om een kerend vermogen te bieden aan een dwalend voertuig,samenvat."	""	"Afschermende constructie"	"Abstracte die,een lijn- of puntvormige constructie geïnstalleerd langs de weg om een kerend vermogen te bieden aan een dwalend voertuig,samenvat."	""	""	"true"	"https://wegenenverkeer-test.data.vlaanderen.be/ns/abstracten#"	"AfschermendeConstructie"	"http://www.w3.org/2000/01/rdf-schema#Class"	""	""	"https://wegenenverkeer-test.data.vlaanderen.be/ns/abstracten#LijnvormigElement"	""	""
"CLASS"	"OSLO-Abstracten"	"Kantopsluiting"	"{746BFA3E-3FA1-48ff-A5C6-87A41AA3C8C8}"	"LijnvormigElement"	""	""	""	"Kantopsluiting"	"Abstracte voor de gemeenschappelijke de eigenschappen en relaties voor de kantopsluiting."	""	"Kantopsluiting"	"Abstracte voor de gemeenschappelijke de eigenschappen en relaties voor de kantopsluiting."	""	""	"true"	"https://wegenenverkeer-test.data.vlaanderen.be/ns/abstracten#"	"Kantopsluiting"	"http://www.w3.org/2000/01/rdf-schema#Class"	""	""	"https://wegenenverkeer-test.data.vlaanderen.be/ns/abstracten#LijnvormigElement"	""	""
"CLASS"	"OSLO-Implementatieelement"	"AIMObject"	"{9AF587FA-A5CF-4b0c-8A23-CF75F280760F}"	""	""	""	""	"AIM object"	"Abstracte als de basisklasse voor alle uniek geïdentificeerde OTL objecten met de basiseigenschappen die elk OTL object minstens heeft."	""	"AIM object"	"Abstracte als de basisklasse voor alle uniek geïdentificeerde OTL objecten met de basiseigenschappen die elk OTL object minstens heeft."	""	""	"true"	"https://wegenenverkeer-test.data.vlaanderen.be/ns/implementatieelement#"	"AIMObject"	"http://www.w3.org/2000/01/rdf-schema#Class"	""	""	"https://wegenenverkeer-test.data.vlaanderen.be/ns/implementatieelement#AIMToestand, https://wegenenverkeer-test.data.vlaanderen.be/ns/implementatieelement#AIMStatus"	""	""
"CLASS"	"OSLO-Implementatieelement"	"AIMToestand"	"{9418C0E6-C48A-44df-ABF7-C6E3B7FF5FC4}"	""	""	""	""	"AIM Toestand"	"Voegt een atribuut toe aan de subklasse die overerft van de abstracte waarmee die een moment in de levenscyclus van het object aangeeft."	""	"AIM Toestand"	"Voegt een atribuut toe aan de subklasse die overerft van de abstracte waarmee die een moment in de levenscyclus van het object aangeeft."	""	""	"true"	"https://wegenenverkeer-test.data.vlaanderen.be/ns/implementatieelement#"	"AIMToestand"	"http://www.w3.org/2000/01/rdf-schema#Class"	""	""	""	""	""
"CLASS"	"OSLO-Implementatieelement"	"AIMStatus"	"{75C21F07-BAE5-412e-AD87-520DD947D510}"	""	""	""	""	"AIM Status"	"Voegt een atribuut met de status (actief/inactief) toe aan de subklasse die overerft van de abstracte."	""	"AIM Status"	"Voegt een atribuut met de status (actief/inactief) toe aan de subklasse die overerft van de abstracte."	""	""	"true"	"https://wegenenverkeer-test.data.vlaanderen.be/ns/implementatieelement#"	"AIMStatus"	"http://www.w3.org/2000/01/rdf-schema#Class"	""	""	""	""	""
"CLASS"	"OSLO-Abstracten"	"Verkeersbord"	"{4896706C-A9CE-4d3a-B5D5-AD1228219C69}"	""	""	""	""	"Verkeersbord"	"Fysieke drager van het verkeersteken waarvan de betekenis bepaald wordt door een verkeersbordconcept."	""	"Verkeersbord"	"Fysieke drager van het verkeersteken waarvan de betekenis bepaald wordt door een verkeersbordconcept."	""	""	"true"	"https://wegenenverkeer-test.data.vlaanderen.be/ns/abstracten#"	"Verkeersbord"	"http://www.w3.org/2000/01/rdf-schema#Class"	""	""	""	""	""
