"EA-Type"	"EA-Package"	"EA-Name"	"EA-GUID"	"EA-Parent"	"EA-Domain"	"EA-Domain-GUID"	"EA-Range"	"label"	"definition"	"usage"	"ap-label-nl"	"ap-definition-nl"	"ap-usageNote-nl"	"ap-codelist"	"external term"	"namespace"	"localname"	"type"	"domain"	"range"	"parent"	"min card"	"max card"
"Package"	""	"OSLO-Optisch-Transport-Netwerk"	"{FEDB01A9-0146-4ca9-9D6F-439A5AD05C6C}"	""	""	""	""	""	""	""	""	""	""	""	""	"http://"	"fixme.com"	"http://www.w3.org/2002/07/owl#Ontology"	""	""	""	""	""
"CLASS"	"OSLO-Abstracten"	"Kast"	"{7B0BF92A-BCCB-4c44-AAD0-92E4C9745E3A}"	"Behuizing"	""	""	""	"Kast"	"Abstracte voor allerlei types kasten."	""	"Kast"	"Abstracte voor allerlei types kasten."	""	""	"true"	"https://wegenenverkeer-test.data.vlaanderen.be/ns/abstracten#"	"Kast"	"http://www.w3.org/2000/01/rdf-schema#Class"	""	""	"https://wegenenverkeer-test.data.vlaanderen.be/ns/abstracten#Behuizing"	""	""
"CLASS"	"OSLO-Abstracten"	"Inloopbehuizing"	"{61F071D1-1881-46a7-874B-DCA9B478BEC5}"	"Behuizing"	""	""	""	"Inloopbehuizing"	"Een behuizing voor het beschermen van technieken en materialen waarin het omwille van de grootte en toegankelijkheid mogelijk is om rond te lopen."	""	"Inloopbehuizing"	"Een behuizing voor het beschermen van technieken en materialen waarin het omwille van de grootte en toegankelijkheid mogelijk is om rond te lopen."	""	""	"true"	"https://wegenenverkeer-test.data.vlaanderen.be/ns/abstracten#"	"Inloopbehuizing"	"http://www.w3.org/2000/01/rdf-schema#Class"	""	""	"https://wegenenverkeer-test.data.vlaanderen.be/ns/abstracten#Behuizing"	""	""
"CLASS"	"OSLO-Abstracten"	"Behuizing"	"{0EED355E-1562-4941-BAA6-9A653E054A32}"	"AIMNaamObject"	""	""	""	"Behuizing"	"Abstracte voor alle types van behuizing voor het beschermen van technieken."	""	"Behuizing"	"Abstracte voor alle types van behuizing voor het beschermen van technieken."	""	""	"true"	"https://wegenenverkeer-test.data.vlaanderen.be/ns/abstracten#"	"Behuizing"	"http://www.w3.org/2000/01/rdf-schema#Class"	""	""	"https://wegenenverkeer-test.data.vlaanderen.be/ns/implementatieelement#AIMNaamObject"	""	""
"CLASS"	"OSLO-Onderdeel"	"KabelnetToegang"	"{6B42148D-03ED-44c8-81DF-042BA4A0299C}"	""	""	""	""	"Kabelnet toegang"	"Knooppunt van Kabelnet dat toegang geeft tot de informatie die in Kabelnet bewaard wordt."	""	"Kabelnet toegang"	"Knooppunt van Kabelnet dat toegang geeft tot de informatie die in Kabelnet bewaard wordt."	""	""	"true"	"https://wegenenverkeer-test.data.vlaanderen.be/ns/onderdeel#"	"KabelnetToegang"	"http://www.w3.org/2000/01/rdf-schema#Class"	""	""	""	""	""
"CLASS"	"OSLO-Implementatieelement"	"AIMNaamObject"	"{493E85C9-60EF-4aff-9C4C-5C45D59C0E64}"	"AIMObject"	""	""	""	"AIM naam object"	"Abstracte als de basisklasse voor elk OTL object dat benoemd wordt met een mensleesbare identificator."	""	"AIM naam object"	"Abstracte als de basisklasse voor elk OTL object dat benoemd wordt met een mensleesbare identificator."	""	""	"true"	"https://wegenenverkeer-test.data.vlaanderen.be/ns/implementatieelement#"	"AIMNaamObject"	"http://www.w3.org/2000/01/rdf-schema#Class"	""	""	"https://wegenenverkeer-test.data.vlaanderen.be/ns/implementatieelement#AIMObject"	""	""
"CLASS"	"OSLO-Implementatieelement"	"NaampadObject"	"{79135DEF-C20F-4371-A26D-1657F2A30BF6}"	"AIMNaamObject"	""	""	""	"Naampad object"	"Abstracte als de basisklasse voor elk OTL object dat gebruik maakt van een naampad."	""	"Naampad object"	"Abstracte als de basisklasse voor elk OTL object dat gebruik maakt van een naampad."	""	""	"true"	"https://wegenenverkeer-test.data.vlaanderen.be/ns/implementatieelement#"	"NaampadObject"	"http://www.w3.org/2000/01/rdf-schema#Class"	""	""	"https://wegenenverkeer-test.data.vlaanderen.be/ns/implementatieelement#AIMNaamObject"	""	""
"CLASS"	"OSLO-Installatie"	"Link"	"{BA843DEE-9DA2-40cb-83D9-C0DD877D93D7}"	"NaampadObject"	""	""	""	"Link"	"TODO"	""	"Link"	"TODO"	""	""	"true"	"https://wegenenverkeer-test.data.vlaanderen.be/ns/installatie#"	"Link"	"http://www.w3.org/2000/01/rdf-schema#Class"	""	""	"https://wegenenverkeer-test.data.vlaanderen.be/ns/implementatieelement#NaampadObject"	""	""
"CLASS"	"OSLO-Installatie"	"Pad"	"{7341BFDC-0753-4468-AE8E-799B3C33AB0C}"	"NaampadObject"	""	""	""	"Pad"	"TODO"	""	"Pad"	"TODO"	""	""	"true"	"https://wegenenverkeer-test.data.vlaanderen.be/ns/installatie#"	"Pad"	"http://www.w3.org/2000/01/rdf-schema#Class"	""	""	"https://wegenenverkeer-test.data.vlaanderen.be/ns/implementatieelement#NaampadObject"	""	""
"CLASS"	"OSLO-Implementatieelement"	"AIMObject"	"{9AF587FA-A5CF-4b0c-8A23-CF75F280760F}"	""	""	""	""	"AIM object"	"Abstracte als de basisklasse voor alle uniek geïdentificeerde OTL objecten met de basiseigenschappen die elk OTL object minstens heeft."	""	"AIM object"	"Abstracte als de basisklasse voor alle uniek geïdentificeerde OTL objecten met de basiseigenschappen die elk OTL object minstens heeft."	""	""	"true"	"https://wegenenverkeer-test.data.vlaanderen.be/ns/implementatieelement#"	"AIMObject"	"http://www.w3.org/2000/01/rdf-schema#Class"	""	""	"https://wegenenverkeer-test.data.vlaanderen.be/ns/implementatieelement#AIMToestand, https://wegenenverkeer-test.data.vlaanderen.be/ns/implementatieelement#AIMStatus"	""	""
"CLASS"	"OSLO-Implementatieelement"	"Derdenobject"	"{93363643-7387-49bf-B147-2D6301A30B0A}"	""	""	""	""	"Derdenobject"	"Object niet in eigendom van de assetbeheerder dat zonder verdere typering bewaard wordt om relaties met getypeerde assets te kunnen beheren."	""	"Derdenobject"	"Object niet in eigendom van de assetbeheerder dat zonder verdere typering bewaard wordt om relaties met getypeerde assets te kunnen beheren."	""	""	"true"	"https://wegenenverkeer-test.data.vlaanderen.be/ns/implementatieelement#"	"Derdenobject"	"http://www.w3.org/2000/01/rdf-schema#Class"	""	""	"https://wegenenverkeer-test.data.vlaanderen.be/ns/implementatieelement#AIMToestand, https://wegenenverkeer-test.data.vlaanderen.be/ns/implementatieelement#AIMStatus"	""	""
"CLASS"	"OSLO-Onderdeel"	"Patchpaneel"	"{7FAC5FC3-8AA2-4ddd-8141-5D8875382E42}"	"AIMNaamObject"	""	""	""	"Patchpaneel"	"TODO"	""	"Patchpaneel"	"TODO"	""	""	"true"	"https://wegenenverkeer-test.data.vlaanderen.be/ns/onderdeel#"	"Patchpaneel"	"http://www.w3.org/2000/01/rdf-schema#Class"	""	""	"https://wegenenverkeer-test.data.vlaanderen.be/ns/implementatieelement#AIMNaamObject"	""	""
"CLASS"	"OSLO-Onderdeel"	"Netwerkpoort"	"{E9E83B11-698E-46a5-B104-F3A72B9A1A08}"	"AIMNaamObject"	""	""	""	"Netwerkpoort"	"Is de ingang van het toestel samen met component die erop zit bv. SFP,XFP,..."	""	"Netwerkpoort"	"Is de ingang van het toestel samen met component die erop zit bv. SFP,XFP,..."	""	""	"true"	"https://wegenenverkeer-test.data.vlaanderen.be/ns/onderdeel#"	"Netwerkpoort"	"http://www.w3.org/2000/01/rdf-schema#Class"	""	""	"https://wegenenverkeer-test.data.vlaanderen.be/ns/implementatieelement#AIMNaamObject"	""	""
"CLASS"	"OSLO-Installatie"	"Zpad"	"{54E8C2F7-A8D8-4d0d-BA14-407C94F0AB44}"	"NaampadObject"	""	""	""	"Zpad"	"TODO"	""	"Zpad"	"TODO"	""	""	"true"	"https://wegenenverkeer-test.data.vlaanderen.be/ns/installatie#"	"Zpad"	"http://www.w3.org/2000/01/rdf-schema#Class"	""	""	"https://wegenenverkeer-test.data.vlaanderen.be/ns/implementatieelement#NaampadObject"	""	""
"CLASS"	"OSLO-Onderdeel"	"Netwerkkaart"	"{877979EE-93E8-428b-B68E-C9EDB79F4D73}"	"AIMNaamObject"	""	""	""	"Netwerkkaart"	"TODO"	""	"Netwerkkaart"	"TODO"	""	""	"true"	"https://wegenenverkeer-test.data.vlaanderen.be/ns/onderdeel#"	"Netwerkkaart"	"http://www.w3.org/2000/01/rdf-schema#Class"	""	""	"https://wegenenverkeer-test.data.vlaanderen.be/ns/implementatieelement#AIMNaamObject"	""	""
"CLASS"	"OSLO-Onderdeel"	"Netwerkelement"	"{7FE6B342-6295-44cd-81CD-3EF9B3521944}"	"AIMNaamObject"	""	""	""	"Netwerkelement"	"TODO"	""	"Netwerkelement"	"TODO"	""	""	"true"	"https://wegenenverkeer-test.data.vlaanderen.be/ns/onderdeel#"	"Netwerkelement"	"http://www.w3.org/2000/01/rdf-schema#Class"	""	""	"https://wegenenverkeer-test.data.vlaanderen.be/ns/implementatieelement#AIMNaamObject"	""	""
"CLASS"	"OSLO-Onderdeel"	"Rack"	"{B7744D88-0071-4e8f-9CFF-922EEF7D2D9F}"	"AIMNaamObject"	""	""	""	"Rack"	"Interne draagstructuur binnen een behuizing voor (elektromechanische) toestellen."	""	"Rack"	"Interne draagstructuur binnen een behuizing voor (elektromechanische) toestellen."	""	""	"true"	"https://wegenenverkeer-test.data.vlaanderen.be/ns/onderdeel#"	"Rack"	"http://www.w3.org/2000/01/rdf-schema#Class"	""	""	"https://wegenenverkeer-test.data.vlaanderen.be/ns/implementatieelement#AIMNaamObject"	""	""
"CLASS"	"OSLO-Onderdeel"	"UPS"	"{41CFC039-5514-475b-9BD8-2487D3BE9DF6}"	""	""	""	""	"UPS"	"De UPS (Uninterruptable Power Supply = niet onderbreekbare voeding) zal elektrische energie leveren van een vastgelegde kwaliteit, onafhankelijk van de beschikbaarheid van een betrouwbare netspanning. Indien het openbare net niet langer bruikbaar is om als energiebron te fungeren, wordt de energievoorziening overgenomen door de accubatterij. Deze zal gedurende een bepaalde tijd, afhankelijk van de capaciteit, de stroomvoorziening verzorgen. De UPS dient om de (minimale) voeding ononderbroken te verzekeren"	""	"UPS"	"De UPS (Uninterruptable Power Supply = niet onderbreekbare voeding) zal elektrische energie leveren van een vastgelegde kwaliteit, onafhankelijk van de beschikbaarheid van een betrouwbare netspanning. Indien het openbare net niet langer bruikbaar is om als energiebron te fungeren, wordt de energievoorziening overgenomen door de accubatterij. Deze zal gedurende een bepaalde tijd, afhankelijk van de capaciteit, de stroomvoorziening verzorgen. De UPS dient om de (minimale) voeding ononderbroken te verzekeren"	""	""	"true"	"https://wegenenverkeer-test.data.vlaanderen.be/ns/onderdeel#"	"UPS"	"http://www.w3.org/2000/01/rdf-schema#Class"	""	""	"https://wegenenverkeer-test.data.vlaanderen.be/ns/abstracten#Voedingspunt"	""	""
"CLASS"	"OSLO-Implementatieelement"	"AIMToestand"	"{9418C0E6-C48A-44df-ABF7-C6E3B7FF5FC4}"	""	""	""	""	"AIM Toestand"	"Voegt een atribuut toe aan de subklasse die overerft van de abstracte waarmee die een moment in de levenscyclus van het object aangeeft."	""	"AIM Toestand"	"Voegt een atribuut toe aan de subklasse die overerft van de abstracte waarmee die een moment in de levenscyclus van het object aangeeft."	""	""	"true"	"https://wegenenverkeer-test.data.vlaanderen.be/ns/implementatieelement#"	"AIMToestand"	"http://www.w3.org/2000/01/rdf-schema#Class"	""	""	""	""	""
"CLASS"	"OSLO-Implementatieelement"	"AIMStatus"	"{75C21F07-BAE5-412e-AD87-520DD947D510}"	""	""	""	""	"AIM Status"	"Voegt een atribuut met de status (actief/inactief) toe aan de subklasse die overerft van de abstracte."	""	"AIM Status"	"Voegt een atribuut met de status (actief/inactief) toe aan de subklasse die overerft van de abstracte."	""	""	"true"	"https://wegenenverkeer-test.data.vlaanderen.be/ns/implementatieelement#"	"AIMStatus"	"http://www.w3.org/2000/01/rdf-schema#Class"	""	""	""	""	""
"CLASS"	"OSLO-Abstracten"	"Voedingspunt"	"{7AFFB706-8ED3-4a66-A281-8408764C316C}"	""	""	""	""	"Voedingspunt"	"Abstracte voor het aansluitpunt van de voeding"	""	"Voedingspunt"	"Abstracte voor het aansluitpunt van de voeding"	""	""	"true"	"https://wegenenverkeer-test.data.vlaanderen.be/ns/abstracten#"	"Voedingspunt"	"http://www.w3.org/2000/01/rdf-schema#Class"	""	""	"https://wegenenverkeer-test.data.vlaanderen.be/ns/implementatieelement#AIMNaamObject"	""	""
"DATATYPE"	"OSLO-Implementatieelement"	"DtcAfmetingBxlxhInMm"	"{48E30B98-FAF7-4c55-9015-6DA3B021103B}"	""	""	""	""	"Afmeting bxlxh in millimeter"	"De afmeting van de breedte,de lengte en hoogte in millimeter."	""	"Afmeting bxlxh in millimeter"	"De afmeting van de breedte,de lengte en hoogte in millimeter."	""	""	"true"	"https://wegenenverkeer-test.data.vlaanderen.be/ns/implementatieelement#"	"DtcAfmetingBxlxhInMm"	"http://www.w3.org/2000/01/rdf-schema#Class"	""	""	""	""	""
"DATATYPE"	"OSLO-Implementatieelement"	"KwantWrdInMillimeter"	"{9150A7F6-E98A-4c9f-8C02-580A898B2243}"	""	""	""	""	"Kwantitatieve waarde in millimeter"	"Een kwantitatieve waarde die een getal in millimeter uitdrukt."	""	"Kwantitatieve waarde in millimeter"	"Een kwantitatieve waarde die een getal in millimeter uitdrukt."	""	""	"true"	"https://wegenenverkeer-test.data.vlaanderen.be/ns/implementatieelement#"	"KwantWrdInMillimeter"	"http://www.w3.org/2000/01/rdf-schema#Class"	""	""	""	""	""
"DATATYPE"	"W3-RDF-Schema"	"Literal"	"{E901A017-A1F0-4073-9405-C71F670C7CBA}"	""	""	""	""	"Literal"	"Beschrijft een constante."	"http://www.w3.org/2000/01/rdf-schema#Literal"	"Literal"	"Beschrijft een constante."	""	""	"true"	"http://www.w3.org/2000/01/rdf-schema#"	"Literal"	"http://www.w3.org/2000/01/rdf-schema#Class"	""	""	""	""	""
"DATATYPE"	"W3-XML-Schema"	"Decimal"	"{B5FC49E6-0E60-4fdf-950A-209E703D5C63}"	""	""	""	""	"Decimaal getal"	"Beschrijft een decimaal getal volgens http://www.w3.org/2001/XMLSchema#decimal"	"https://www.w3.org/TR/xmlschema-2/#decimal"	"Decimaal getal"	"Beschrijft een decimaal getal volgens http://www.w3.org/2001/XMLSchema#decimal"	""	""	"true"	"http://www.w3.org/2001/XMLSchema#"	"decimal"	"http://www.w3.org/2000/01/rdf-schema#Class"	""	""	""	""	""
"DATATYPE"	"W3-XML-Schema"	"Boolean"	"{9E1833BF-210A-4b48-8326-8A00413463CD}"	""	""	""	""	"Boolean"	"Beschrijft een boolean volgens http://www.w3.org/2001/XMLSchema#boolean"	"https://www.w3.org/TR/xmlschema-2/#boolean"	"Boolean"	"Beschrijft een boolean volgens http://www.w3.org/2001/XMLSchema#boolean"	""	""	"true"	"http://www.w3.org/2001/XMLSchema#"	"boolean"	"http://www.w3.org/2000/01/rdf-schema#Class"	""	""	""	""	""
"DATATYPE"	"OSLO-Implementatieelement"	"DtcDocument"	"{57E2B78E-3BA6-4465-85AB-B3C47F14D47F}"	""	""	""	""	"Bestandsbijlage"	"Complex datatype voor alle bestandsbijlages"	""	"Bestandsbijlage"	"Complex datatype voor alle bestandsbijlages"	""	""	"true"	"https://wegenenverkeer-test.data.vlaanderen.be/ns/implementatieelement#"	"DtcDocument"	"http://www.w3.org/2000/01/rdf-schema#Class"	""	""	""	""	""
"DATATYPE"	"W3-XML-Schema"	"String"	"{81376A9B-DB07-4798-87F6-B226CAC2C5C8}"	""	""	""	""	"String"	"Beschrijft een tekstregel volgens http://www.w3.org/2001/XMLSchema#string"	"https://www.w3.org/TR/xmlschema-2/#string"	"String"	"Beschrijft een tekstregel volgens http://www.w3.org/2001/XMLSchema#string"	""	""	"true"	"http://www.w3.org/2001/XMLSchema#"	"string"	"http://www.w3.org/2000/01/rdf-schema#Class"	""	""	""	""	""
"DATATYPE"	"OSLO-Implementatieelement"	"DteTekstblok"	"{D24614D8-8D4E-4112-B139-315B96C73DBB}"	""	""	""	""	"Tekstblok"	"Een tekst welke uit meerdere zinnen bestaat,en ook regeleindes kan bevatten. Een tekstblok bevat maximaal 65.000 karakters."	""	"Tekstblok"	"Een tekst welke uit meerdere zinnen bestaat,en ook regeleindes kan bevatten. Een tekstblok bevat maximaal 65.000 karakters."	""	""	"true"	"https://wegenenverkeer-test.data.vlaanderen.be/ns/implementatieelement#"	"DteTekstblok"	"http://www.w3.org/2000/01/rdf-schema#Class"	""	""	""	""	""
"DATATYPE"	"W3-XML-Schema"	"AnyURI"	"{81711512-9AAA-4861-841D-A6A67FB29FD1}"	""	""	""	""	"URI"	"Een tekstwaarde die een verwijzing naar meer informatie van het element bevat volgens http://www.w3.org/2001/XMLSchema#anyURI ."	"https://www.w3.org/TR/xmlschema-2/#anyURI"	"URI"	"Een tekstwaarde die een verwijzing naar meer informatie van het element bevat volgens http://www.w3.org/2001/XMLSchema#anyURI ."	""	""	"true"	"http://www.w3.org/2001/XMLSchema#"	"anyURI"	"http://www.w3.org/2000/01/rdf-schema#Class"	""	""	""	""	""
"DATATYPE"	"OSLO-Implementatieelement"	"KwantWrdInJaar"	"{EC25C511-270E-4029-9995-CA9FB16A1DA4}"	""	""	""	""	"Kwantitatieve waarde in aantal jaar"	"Een kwantitatieve waarde die een getal in aantal jaar uitdrukt."	""	"Kwantitatieve waarde in aantal jaar"	"Een kwantitatieve waarde die een getal in aantal jaar uitdrukt."	""	""	"true"	"https://wegenenverkeer-test.data.vlaanderen.be/ns/implementatieelement#"	"KwantWrdInJaar"	"http://www.w3.org/2000/01/rdf-schema#Class"	""	""	""	""	""
"DATATYPE"	"W3-XML-Schema"	"NonNegativeInteger"	"{980E8EE1-D9EE-417d-AF7A-8217CD9CCC74}"	""	""	""	""	"Natuurlijk getal"	"Beschrijft een natuurlijk getal volgens http://www.w3.org/2001/XMLSchema#nonNegativeInteger"	"https://www.w3.org/TR/xmlschema-2/#nonNegativeInteger"	"Natuurlijk getal"	"Beschrijft een natuurlijk getal volgens http://www.w3.org/2001/XMLSchema#nonNegativeInteger"	""	""	"true"	"http://www.w3.org/2001/XMLSchema#"	"nonNegativeInteger"	"http://www.w3.org/2000/01/rdf-schema#Class"	""	""	""	""	""
"DATATYPE"	"OSLO-Implementatieelement"	"DtcAdres"	"{281D2EBE-A38A-44a2-987B-2C818171A6FF}"	""	""	""	""	"Adres"	"De aanduiding van een bepaalde locatie,doorgaans van een huis,woning,gebouw of faciliteit,op de aarde."	""	"Adres"	"De aanduiding van een bepaalde locatie,doorgaans van een huis,woning,gebouw of faciliteit,op de aarde."	""	""	"true"	"https://wegenenverkeer-test.data.vlaanderen.be/ns/implementatieelement#"	"DtcAdres"	"http://www.w3.org/2000/01/rdf-schema#Class"	""	""	""	""	""
"DATATYPE"	"OSLO-Implementatieelement"	"DtcIdentificator"	"{166F8539-73F1-4112-B479-1654B795E2C2}"	""	""	""	""	"identificator"	"Complex datatype voor de identificator van een object volgens de bron van de identificator."	""	"identificator"	"Complex datatype voor de identificator van een object volgens de bron van de identificator."	""	""	"true"	"https://wegenenverkeer-test.data.vlaanderen.be/ns/implementatieelement#"	"DtcIdentificator"	"http://www.w3.org/2000/01/rdf-schema#Class"	""	""	""	""	""
"DATATYPE"	"W3-XML-Schema"	"Date"	"{6EA0E47B-3163-404d-A035-56A88051BC31}"	""	""	""	""	"Datum"	"Beschrijft een datum volgens http://www.w3.org/2001/XMLSchema#date"	"https://www.w3.org/TR/xmlschema-2/#date"	"Datum"	"Beschrijft een datum volgens http://www.w3.org/2001/XMLSchema#date"	""	""	"true"	"http://www.w3.org/2001/XMLSchema#"	"date"	"http://www.w3.org/2000/01/rdf-schema#Class"	""	""	""	""	""
"DATATYPE"	"OSLO-Implementatieelement"	"DtcAfmetingBxlxhInM"	"{E27556D0-834E-4012-8745-A44F565E3234}"	""	""	""	""	"Afmeting bxlxh in meter"	"De afmeting van de breedte,de lengte en hoogte in meter."	""	"Afmeting bxlxh in meter"	"De afmeting van de breedte,de lengte en hoogte in meter."	""	""	"true"	"https://wegenenverkeer-test.data.vlaanderen.be/ns/implementatieelement#"	"DtcAfmetingBxlxhInM"	"http://www.w3.org/2000/01/rdf-schema#Class"	""	""	""	""	""
"DATATYPE"	"OSLO-Implementatieelement"	"KwantWrdInMeter"	"{5A5DD566-BCF9-4770-8AF4-2BAD1E33CAC9}"	""	""	""	""	"Kwantitatieve waarde in meter"	"Een kwantitatieve waarde die een getal in meter uitdrukt."	""	"Kwantitatieve waarde in meter"	"Een kwantitatieve waarde die een getal in meter uitdrukt."	""	""	"true"	"https://wegenenverkeer-test.data.vlaanderen.be/ns/implementatieelement#"	"KwantWrdInMeter"	"http://www.w3.org/2000/01/rdf-schema#Class"	""	""	""	""	""
"DATATYPE"	"W3-XML-Schema"	"Integer"	"{A7F2B297-CC86-4b9f-8931-8977182E38B9}"	""	""	""	""	"Geheel getal"	"Beschrijft een geheel getal volgens http://www.w3.org/2001/XMLSchema#integer"	"https://www.w3.org/TR/xmlschema-2/#integer"	"Geheel getal"	"Beschrijft een geheel getal volgens http://www.w3.org/2001/XMLSchema#integer"	""	""	"true"	"http://www.w3.org/2001/XMLSchema#"	"integer"	"http://www.w3.org/2000/01/rdf-schema#Class"	""	""	""	""	""
"DATATYPE"	"OSLO-Implementatieelement"	"DteIPv4Adres"	"{BFF2C0A6-0871-42f9-AA84-A09C0322147B}"	""	""	""	""	"IPv4-adres"	"Beschrijft een ip-adres volgens de ipv4 specificatie."	""	"IPv4-adres"	"Beschrijft een ip-adres volgens de ipv4 specificatie."	""	""	"true"	"https://wegenenverkeer-test.data.vlaanderen.be/ns/implementatieelement#"	"DteIPv4Adres"	"http://www.w3.org/2000/01/rdf-schema#Class"	""	""	""	""	""
"DATATYPE"	"OSLO-Implementatieelement"	"KwantWrdInCentimeter"	"{361F1AD7-40E3-4f04-9E63-FB28D256ADB4}"	""	""	""	""	"Kwantitatieve waarde in centimeter"	"Een kwantitatieve waarde die een getal in centimeter uitdrukt."	""	"Kwantitatieve waarde in centimeter"	"Een kwantitatieve waarde die een getal in centimeter uitdrukt."	""	""	"true"	"https://wegenenverkeer-test.data.vlaanderen.be/ns/implementatieelement#"	"KwantWrdInCentimeter"	"http://www.w3.org/2000/01/rdf-schema#Class"	""	""	""	""	""
"DATATYPE"	"OSLO-Implementatieelement"	"KwantWrdInkWh"	"{FE7C42DE-7F02-4c91-BB88-E3F871ED1F6D}"	""	""	""	""	"Kwantitatieve waarde in kWh"	"Een kwantitatieve waarde die een getal in kiloWattUur uitdrukt."	""	"Kwantitatieve waarde in kWh"	"Een kwantitatieve waarde die een getal in kiloWattUur uitdrukt."	""	""	"true"	"https://wegenenverkeer-test.data.vlaanderen.be/ns/implementatieelement#"	"KwantWrdInkWh"	"http://www.w3.org/2000/01/rdf-schema#Class"	""	""	""	""	""
"DATATYPE"	"OSLO-Implementatieelement"	"KwantWrdInWatt"	"{965B8BD0-3AE0-47f8-A59A-5F32E0CCD17D}"	""	""	""	""	"Kwantitatieve waarde in Watt"	"Een kwantitatieve waarde die een getal in Watt uitdrukt."	""	"Kwantitatieve waarde in Watt"	"Een kwantitatieve waarde die een getal in Watt uitdrukt."	""	""	"true"	"https://wegenenverkeer-test.data.vlaanderen.be/ns/implementatieelement#"	"KwantWrdInWatt"	"http://www.w3.org/2000/01/rdf-schema#Class"	""	""	""	""	""
"ENUMERATION"	"OSLO-Implementatieelement"	"KlAlgMimeType"	"{496B7249-B6CF-40c8-A829-8A8BA73784A8}"	""	""	""	""	"Mimetype"	"De mime types van bestanden (AWVDocument) beperkt tot mime types voor toegelaten bestandstypen."	""	"Mimetype"	"De mime types van bestanden (AWVDocument) beperkt tot mime types voor toegelaten bestandstypen."	""	"https://wegenenverkeer-test.data.vlaanderen.be/id/conceptscheme/KlAlgMimeType"	"true"	"http://www.w3.org/2004/02/skos/core#"	"Concept"	"http://www.w3.org/2000/01/rdf-schema#Class"	""	""	""	""	""
"ENUMERATION"	"OSLO-Onderdeel"	"KlAlgMateriaal"	"{5BD5C4D7-BB7C-453e-AB38-87BF140891AF}"	""	""	""	""	"Materiaal soorten"	"Het materiaal waaruit een object voornamelijk gebouwd is."	""	"Materiaal soorten"	"Het materiaal waaruit een object voornamelijk gebouwd is."	""	"https://wegenenverkeer-test.data.vlaanderen.be/id/conceptscheme/KlAlgMateriaal"	"true"	"http://www.w3.org/2004/02/skos/core#"	"Concept"	"http://www.w3.org/2000/01/rdf-schema#Class"	""	""	""	""	""
"ENUMERATION"	"OSLO-Implementatieelement"	"KlAlgGemeente"	"{3CF138FD-381B-4cf9-A15B-2A824AB07BCB}"	""	""	""	""	"Gemeente"	"Lijst van gemeentes in Vlaanderen."	""	"Gemeente"	"Lijst van gemeentes in Vlaanderen."	""	"https://wegenenverkeer-test.data.vlaanderen.be/id/conceptscheme/KlAlgGemeente"	"true"	"http://www.w3.org/2004/02/skos/core#"	"Concept"	"http://www.w3.org/2000/01/rdf-schema#Class"	""	""	""	""	""
"ENUMERATION"	"OSLO-Implementatieelement"	"KlAlgProvincie"	"{CF268148-8581-4c55-A2A3-3DFED5723CE0}"	""	""	""	""	"Provincie"	"Lijst van provincies in Vlaanderen"	""	"Provincie"	"Lijst van provincies in Vlaanderen"	""	"https://wegenenverkeer-test.data.vlaanderen.be/id/conceptscheme/KlAlgProvincie"	"true"	"http://www.w3.org/2004/02/skos/core#"	"Concept"	"http://www.w3.org/2000/01/rdf-schema#Class"	""	""	""	""	""
"ENUMERATION"	"OSLO-Implementatieelement"	"KlAIMToestand"	"{B660858D-225E-4313-A2A1-664AFD652A5F}"	""	""	""	""	"AIM toestand"	"Keuzelijst met fasen uit de levenscyclus van een object om de toestand op een moment mee vast te leggen."	""	"AIM toestand"	"Keuzelijst met fasen uit de levenscyclus van een object om de toestand op een moment mee vast te leggen."	""	"https://wegenenverkeer-test.data.vlaanderen.be/id/conceptscheme/KlAIMToestand"	"true"	"http://www.w3.org/2004/02/skos/core#"	"Concept"	"http://www.w3.org/2000/01/rdf-schema#Class"	""	""	""	""	""
"ENUMERATION"	"OSLO-Onderdeel"	"KlCabineMerk"	"{43BD9A31-A661-434b-90DF-CBADC7FE3580}"	""	""	""	""	"Cabine merk"	"Merknamen voor cabines"	""	"Cabine merk"	"Merknamen voor cabines"	""	"https://wegenenverkeer-test.data.vlaanderen.be/id/conceptscheme/KlCabineMerk"	"true"	"http://www.w3.org/2004/02/skos/core#"	"Concept"	"http://www.w3.org/2000/01/rdf-schema#Class"	""	""	""	""	""
"ENUMERATION"	"OSLO-Onderdeel"	"KlCabineModelnaam"	"{C637264C-FA67-431a-9CA8-CDAE7ADAD61C}"	""	""	""	""	"Cabine modelnaam"	"Modelnamen voor cabines"	""	"Cabine modelnaam"	"Modelnamen voor cabines"	""	"https://wegenenverkeer-test.data.vlaanderen.be/id/conceptscheme/KlCabineModelnaam"	"true"	"http://www.w3.org/2004/02/skos/core#"	"Concept"	"http://www.w3.org/2000/01/rdf-schema#Class"	""	""	""	""	""
"ENUMERATION"	"OSLO-Onderdeel"	"KlKabelnettoegangNetwerksoort"	"{AD5DD1F6-9EE3-4e7a-B4F9-4717C1ACF4D9}"	""	""	""	""	"Kabelnet toegang netwerksoort"	"TODO"	""	"Kabelnet toegang netwerksoort"	"TODO"	""	"https://wegenenverkeer-test.data.vlaanderen.be/id/conceptscheme/KlKabelnettoegangNetwerksoort"	"true"	"http://www.w3.org/2004/02/skos/core#"	"Concept"	"http://www.w3.org/2000/01/rdf-schema#Class"	""	""	""	""	""
"ENUMERATION"	"OSLO-Installatie"	"KlPadNetwerkprotectie"	"{3E1575A5-F909-419c-9584-8CAC3764537B}"	""	""	""	""	"Pad netwerkprotectie"	"TODO"	""	"Pad netwerkprotectie"	"TODO"	""	"https://wegenenverkeer-test.data.vlaanderen.be/id/conceptscheme/KlPadNetwerkprotectie"	"true"	"http://www.w3.org/2004/02/skos/core#"	"Concept"	"http://www.w3.org/2000/01/rdf-schema#Class"	""	""	""	""	""
"ENUMERATION"	"OSLO-Onderdeel"	"KlPatchpaneelCapaciteit"	"{C03148B9-FCA5-47d5-8367-A38D79EAFFD0}"	""	""	""	""	"Patchpaneel capaciteit"	"TODO"	""	"Patchpaneel capaciteit"	"TODO"	""	"https://wegenenverkeer-test.data.vlaanderen.be/id/conceptscheme/KlPatchpaneelCapaciteit"	"true"	"http://www.w3.org/2004/02/skos/core#"	"Concept"	"http://www.w3.org/2000/01/rdf-schema#Class"	""	""	""	""	""
"ENUMERATION"	"OSLO-Onderdeel"	"KlPatchpaneelType"	"{D449C874-AE81-411a-A398-4D35DDB72A65}"	""	""	""	""	"Patchpaneel type"	"TODO"	""	"Patchpaneel type"	"TODO"	""	"https://wegenenverkeer-test.data.vlaanderen.be/id/conceptscheme/KlPatchpaneelType"	"true"	"http://www.w3.org/2004/02/skos/core#"	"Concept"	"http://www.w3.org/2000/01/rdf-schema#Class"	""	""	""	""	""
