"EA-Type"	"EA-Package"	"EA-Name"	"EA-GUID"	"EA-Parent"	"EA-Domain"	"EA-Domain-GUID"	"EA-Range"	"label"	"definition"	"usage"	"ap-label-nl"	"ap-definition-nl"	"ap-usageNote-nl"	"ap-codelist"	"external term"	"namespace"	"localname"	"type"	"domain"	"range"	"parent"	"min card"	"max card"
"Package"	""	"OSLO-Complexe-datatypes"	"{017CDDD5-DE50-42db-B5F4-ACFE97114C7C}"	""	""	""	""	""	""	""	""	""	""	""	""	"http://"	"fixme.com"	"http://www.w3.org/2002/07/owl#Ontology"	""	""	""	""	""
"DATATYPE"	"OSLO-Implementatieelement"	"DtcIdentificator"	"{3C1A9CE1-8B09-4751-B7FE-9D35685E30AD}"	""	""	""	""	"Identificator"	"Complex datatype voor de identificator van een object volgens de bron van de identificator."	""	"Identificator"	"Complex datatype voor de identificator van een object volgens de bron van de identificator."	""	""	"true"	"https://wegenenverkeer-test.data.vlaanderen.be/ns/implementatieelement#"	"DtcIdentificator"	"http://www.w3.org/2000/01/rdf-schema#Class"	""	""	""	""	""
"DATATYPE"	"OSLO-Implementatieelement"	"DtcAdres"	"{D25468E4-BB77-4379-AF28-346E62D4D13E}"	""	""	""	""	"Adres"	"Complex datatype voor de aanduiding van een bepaalde locatie,doorgaans van een huis,woning,gebouw of faciliteit,op de aarde."	""	"Adres"	"Complex datatype voor de aanduiding van een bepaalde locatie,doorgaans van een huis,woning,gebouw of faciliteit,op de aarde."	""	""	"true"	"https://wegenenverkeer-test.data.vlaanderen.be/ns/implementatieelement#"	"DtcAdres"	"http://www.w3.org/2000/01/rdf-schema#Class"	""	""	""	""	""
"DATATYPE"	"OSLO-Implementatieelement"	"DtcContactinfo"	"{29E3E67E-9595-4fd7-8293-C679B40A2052}"	""	""	""	""	"Contactinfo"	"Complex datatype voor de informatie zoals email,telefoon,adres die toelaat om iemand of iets te contacteren."	""	"Contactinfo"	"Complex datatype voor de informatie zoals email,telefoon,adres die toelaat om iemand of iets te contacteren."	""	""	"true"	"https://schema.org/"	"ContactPoint"	"http://www.w3.org/2000/01/rdf-schema#Class"	""	""	""	""	""
"DATATYPE"	"OSLO-Implementatieelement"	"DtcTijdsduur"	"{3CC77960-E698-495b-A0AC-72EA76E5D136}"	""	""	""	""	"Tijdsduur"	"Complex datatype voor de instelling van een tijdsbepaling."	""	"Tijdsduur"	"Complex datatype voor de instelling van een tijdsbepaling."	""	""	"true"	"https://wegenenverkeer-test.data.vlaanderen.be/ns/implementatieelement#"	"DtcTijdsduur"	"http://www.w3.org/2000/01/rdf-schema#Class"	""	""	""	""	""
"DATATYPE"	"OSLO-Implementatieelement"	"DtcDocument"	"{E0B6DD17-B56B-4a53-95B5-9049B1EC980E}"	""	""	""	""	"Bestandsbijlage"	"Complex datatype voor alle bestandsbijlages"	""	"Bestandsbijlage"	"Complex datatype voor alle bestandsbijlages"	""	""	"true"	"https://wegenenverkeer-test.data.vlaanderen.be/ns/implementatieelement#"	"DtcDocument"	"http://www.w3.org/2000/01/rdf-schema#Class"	""	""	""	""	""
"DATATYPE"	"OSLO-Implementatieelement"	"DtcAfmetingBxlInM"	"{3A516EB8-D7B8-4b15-8A62-EB5F7D23FB48}"	""	""	""	""	"Afmeting bxl in meter"	"Complex datatype voor de afmeting van de breedte en de lengte in meter."	""	"Afmeting bxl in meter"	"Complex datatype voor de afmeting van de breedte en de lengte in meter."	""	""	"true"	"https://wegenenverkeer-test.data.vlaanderen.be/ns/implementatieelement#"	"DtcAfmetingBxlInM"	"http://www.w3.org/2000/01/rdf-schema#Class"	""	""	""	""	""
"DATATYPE"	"OSLO-Implementatieelement"	"DtcAfmetingZijdeInMm"	"{4A496C0B-4D35-4f25-984E-72C211058D7A}"	""	""	""	""	"Afmeting zijde in millimeter"	"Complex datatype voor de afmeting van een zijde in millimeter."	""	"Afmeting zijde in millimeter"	"Complex datatype voor de afmeting van een zijde in millimeter."	""	""	"true"	"https://wegenenverkeer-test.data.vlaanderen.be/ns/implementatieelement#"	"DtcAfmetingZijdeInMm"	"http://www.w3.org/2000/01/rdf-schema#Class"	""	""	""	""	""
"DATATYPE"	"OSLO-Implementatieelement"	"DtcAfmetingBxlInCm"	"{7D49304D-2707-4623-ADD6-BC58AC5B1E39}"	""	""	""	""	"Afmeting bxl in centimeter."	"Complex datatype voor de afmeting van de breedte en de lengte in centimeter."	""	"Afmeting bxl in centimeter."	"Complex datatype voor de afmeting van de breedte en de lengte in centimeter."	""	""	"true"	"https://wegenenverkeer-test.data.vlaanderen.be/ns/implementatieelement#"	"DtcAfmetingBxlInCm"	"http://www.w3.org/2000/01/rdf-schema#Class"	""	""	""	""	""
"DATATYPE"	"OSLO-Implementatieelement"	"DtcAfmetingDiameterInCm"	"{F55859B6-3D32-4ceb-8B17-B0ACA6675083}"	""	""	""	""	"Afmeting diameter in centimeter"	"Complex datatype voor de afmeting van een diameter in centimeter."	""	"Afmeting diameter in centimeter"	"Complex datatype voor de afmeting van een diameter in centimeter."	""	""	"true"	"https://wegenenverkeer-test.data.vlaanderen.be/ns/implementatieelement#"	"DtcAfmetingDiameterInCm"	"http://www.w3.org/2000/01/rdf-schema#Class"	""	""	""	""	""
"DATATYPE"	"OSLO-Implementatieelement"	"DtcOpeningsurenSpecificatie"	"{FF5B19BC-C030-41b0-8FE1-15C481449CBC}"	""	""	""	""	"Openingsurenspecificatie"	"Complex datatype dat de openingsuren volgens https://schema.org/OpeningHoursSpecification specifieert."	""	"Openingsurenspecificatie"	"Complex datatype dat de openingsuren volgens https://schema.org/OpeningHoursSpecification specifieert."	""	""	"true"	"https://schema.org/"	"OpeningHoursSpecification"	"http://www.w3.org/2000/01/rdf-schema#Class"	""	""	""	""	""
"DATATYPE"	"OSLO-Implementatieelement"	"DtcAfmetingBxhInMm"	"{490FE43F-D7A8-4149-B709-52F50DA76BA0}"	""	""	""	""	"Afmeting bxh in millimeter"	"Complex datatype voor de afmeting van de breedte en hoogte in millimeter."	""	"Afmeting bxh in millimeter"	"Complex datatype voor de afmeting van de breedte en hoogte in millimeter."	""	""	"true"	"https://wegenenverkeer-test.data.vlaanderen.be/ns/implementatieelement#"	"DtcAfmetingBxhInMm"	"http://www.w3.org/2000/01/rdf-schema#Class"	""	""	""	""	""
"DATATYPE"	"OSLO-Implementatieelement"	"DtcAfmetingDiameterInMm"	"{44147148-1192-48b1-B6D1-21E5CB397CB3}"	""	""	""	""	"Afmeting diameter in millimeter"	"Complex datatype voor de afmeting van een diameter in millimeter."	""	"Afmeting diameter in millimeter"	"Complex datatype voor de afmeting van een diameter in millimeter."	""	""	"true"	"https://wegenenverkeer-test.data.vlaanderen.be/ns/implementatieelement#"	"DtcAfmetingDiameterInMm"	"http://www.w3.org/2000/01/rdf-schema#Class"	""	""	""	""	""
"DATATYPE"	"OSLO-Implementatieelement"	"DtcAfmetingBxhInM"	"{07758F73-4BF8-4cdd-B36C-F51C41F20FEB}"	""	""	""	""	"Afmeting bxh in meter"	"Complex datatype voor de afmeting van de breedte en hoogte in meter."	""	"Afmeting bxh in meter"	"Complex datatype voor de afmeting van de breedte en hoogte in meter."	""	""	"true"	"https://wegenenverkeer-test.data.vlaanderen.be/ns/implementatieelement#"	"DtcAfmetingBxhInM"	"http://www.w3.org/2000/01/rdf-schema#Class"	""	""	""	""	""
"DATATYPE"	"OSLO-Implementatieelement"	"DtcNatuurlijkPersoon"	"{E0DEE86F-C469-4013-8058-AAF7A3643B36}"	""	""	""	""	"Natuurlijk persoon"	"Complex datatype dat een natuurlijk persoon beschrijft."	""	"Natuurlijk persoon"	"Complex datatype dat een natuurlijk persoon beschrijft."	""	""	"true"	"https://wegenenverkeer-test.data.vlaanderen.be/ns/implementatieelement#"	"DtcNatuurlijkPersoon"	"http://www.w3.org/2000/01/rdf-schema#Class"	""	""	""	""	""
"DATATYPE"	"OSLO-Implementatieelement"	"DtcAfmetingBxlxhInM"	"{082F2897-BF55-4124-BC67-667113E143E6}"	""	""	""	""	"Afmeting bxlxh in meter"	"Complex datatype voor de afmeting van de breedte,de lengte en hoogte in meter."	""	"Afmeting bxlxh in meter"	"Complex datatype voor de afmeting van de breedte,de lengte en hoogte in meter."	""	""	"true"	"https://wegenenverkeer-test.data.vlaanderen.be/ns/implementatieelement#"	"DtcAfmetingBxlxhInM"	"http://www.w3.org/2000/01/rdf-schema#Class"	""	""	""	""	""
"DATATYPE"	"OSLO-Implementatieelement"	"DtcRechtspersoon"	"{E2DBAD74-7812-417e-8500-A0B2C1D40228}"	""	""	""	""	"Rechtspersoon"	"Complex datatype voor een rechtspersoon."	""	"Rechtspersoon"	"Complex datatype voor een rechtspersoon."	""	""	"true"	"https://wegenenverkeer-test.data.vlaanderen.be/ns/implementatieelement#"	"DtcRechtspersoon"	"http://www.w3.org/2000/01/rdf-schema#Class"	""	""	""	""	""
"DATATYPE"	"OSLO-Implementatieelement"	"DtcProductidentificatiecode"	"{CD005411-59DD-4a79-83B5-C0E9B06A2F0D}"	""	""	""	""	"Productidentificatiecode"	"Complex datatype dat alle nodige informatie van het product capteert."	""	"Productidentificatiecode"	"Complex datatype dat alle nodige informatie van het product capteert."	""	""	"true"	"https://wegenenverkeer-test.data.vlaanderen.be/ns/implementatieelement#"	"DtcProductidentificatiecode"	"http://www.w3.org/2000/01/rdf-schema#Class"	""	""	""	""	""
"DATATYPE"	"OSLO-Implementatieelement"	"DtcAfmetingBxlxhInMm"	"{6C1B1766-6F35-40dd-8DA1-9BCB8FA11CA0}"	""	""	""	""	"Afmeting bxlxh in millimeter"	"Complex datatype voor de afmeting van de breedte,de lengte en hoogte in millimeter."	""	"Afmeting bxlxh in millimeter"	"Complex datatype voor de afmeting van de breedte,de lengte en hoogte in millimeter."	""	""	"true"	"https://wegenenverkeer-test.data.vlaanderen.be/ns/implementatieelement#"	"DtcAfmetingBxlxhInMm"	"http://www.w3.org/2000/01/rdf-schema#Class"	""	""	""	""	""
"DATATYPE"	"OSLO-Levenscyclus"	"DtcMaaien"	"{9D960712-5666-40de-AA1D-89AF3AA70C53}"	""	""	""	""	"Maaien"	"Complex datatype voor de eigenschappen van maaien."	""	"Maaien"	"Complex datatype voor de eigenschappen van maaien."	""	""	"true"	"https://wegenenverkeer-test.data.vlaanderen.be/ns/levenscyclus#"	"DtcMaaien"	"http://www.w3.org/2000/01/rdf-schema#Class"	""	""	""	""	""
"DATATYPE"	"OSLO-Onderdeel"	"DtcLENorm"	"{D84A22F4-D42E-4313-AFBC-7B25EE37EFC5}"	""	""	""	""	"Norm van het lijnvormig element"	"Complex datatype voor de norm van het lijnvormig element."	""	"Norm van het lijnvormig element"	"Complex datatype voor de norm van het lijnvormig element."	""	""	"true"	"https://wegenenverkeer-test.data.vlaanderen.be/ns/onderdeel#"	"DtcLENorm"	"http://www.w3.org/2000/01/rdf-schema#Class"	""	""	""	""	""
"DATATYPE"	"OSLO-Onderdeel"	"DtcTrottoirbandVorm"	"{7A6A2172-E0E0-47ae-8096-AA0EABBC8388}"	""	""	""	""	"Trottoirband vorm"	"Complex datatype voor de vorm van een trotoirband."	""	"Trottoirband vorm"	"Complex datatype voor de vorm van een trotoirband."	""	""	"true"	"https://wegenenverkeer-test.data.vlaanderen.be/ns/onderdeel#"	"DtcTrottoirbandVorm"	"http://www.w3.org/2000/01/rdf-schema#Class"	""	""	""	""	""
"DATATYPE"	"OSLO-Onderdeel"	"DtcGCMateriaalKarakteristiek"	"{5DF403AA-F73D-4013-94EC-E0A969BC2B8E}"	""	""	""	""	"Materiaal karakteristiek"	"Complex datatype voor het materiaal en zijn geluidskarakteristiek van de geluidswerende constructie."	""	"Materiaal karakteristiek"	"Complex datatype voor het materiaal en zijn geluidskarakteristiek van de geluidswerende constructie."	""	""	"true"	"https://wegenenverkeer-test.data.vlaanderen.be/ns/onderdeel#"	"DtcGCMateriaalKarakteristiek"	"http://www.w3.org/2000/01/rdf-schema#Class"	""	""	""	""	""
"DATATYPE"	"OSLO-Onderdeel"	"DtcMarkeringOpvatting"	"{F669B3DB-480D-4b3d-B86D-FC5ACFEE67D3}"	""	""	""	""	"Markering opvatting"	"Complex datatype voor de opvatting van een markering."	""	"Markering opvatting"	"Complex datatype voor de opvatting van een markering."	""	""	"true"	"https://wegenenverkeer-test.data.vlaanderen.be/ns/onderdeel#"	"DtcMarkeringOpvatting"	"http://www.w3.org/2000/01/rdf-schema#Class"	""	""	""	""	""
"DATATYPE"	"OSLO-Onderdeel"	"DtcVegetatieSoortnaam"	"{8A57F63A-44EE-421e-915A-AC0B49ACFE3E}"	""	""	""	""	"Vegetatie soortnaam"	"Complex datatype voor de soortnaam van een begroeiing."	""	"Vegetatie soortnaam"	"Complex datatype voor de soortnaam van een begroeiing."	""	""	"true"	"https://wegenenverkeer-test.data.vlaanderen.be/ns/onderdeel#"	"DtcVegetatieSoortnaam"	"http://www.w3.org/2000/01/rdf-schema#Class"	""	""	""	""	""
"DATATYPE"	"OSLO-Onderdeel"	"DtcBeschermingVraatschade"	"{852CFCB4-6F63-4a45-BA17-A81FFA8CB97D}"	""	""	""	""	"Bescherming vraatschade"	"Complex datatype voor bescherming van de stam tegen knaagdieren."	""	"Bescherming vraatschade"	"Complex datatype voor bescherming van de stam tegen knaagdieren."	""	""	"true"	"https://wegenenverkeer-test.data.vlaanderen.be/ns/onderdeel#"	"DtcBeschermingVraatschade"	"http://www.w3.org/2000/01/rdf-schema#Class"	""	""	""	""	""
"DATATYPE"	"OSLO-Onderdeel"	"DtcHoutigeAanleg"	"{AB52DD46-644F-4a06-889D-BB1592EA73E4}"	""	""	""	""	"Houtige aanleg"	"Complex datatype dat de aanleg van houtige vegetatie beschrijft."	""	"Houtige aanleg"	"Complex datatype dat de aanleg van houtige vegetatie beschrijft."	""	""	"true"	"https://wegenenverkeer-test.data.vlaanderen.be/ns/onderdeel#"	"DtcHoutigeAanleg"	"http://www.w3.org/2000/01/rdf-schema#Class"	""	""	""	""	""
"DATATYPE"	"OSLO-Onderdeel"	"DtcAanlegBoomvorm"	"{D3CE333C-01B0-4ba5-A26A-535D5ADA25B9}"	""	""	""	""	"aanleg boomvorm"	"Complex datatype om alle eigenschappen van de aanleg van een opgaande boom onder 1 noemer te houden."	""	"aanleg boomvorm"	"Complex datatype om alle eigenschappen van de aanleg van een opgaande boom onder 1 noemer te houden."	""	""	"true"	"https://wegenenverkeer-test.data.vlaanderen.be/ns/onderdeel#"	"DtcAanlegBoomvorm"	"http://www.w3.org/2000/01/rdf-schema#Class"	""	""	""	""	""
"DATATYPE"	"OSLO-Onderdeel"	"DtcSierbeplAanleg"	"{00518551-A7B9-4354-81A6-336D7E8316CD}"	""	""	""	""	"Sierbeplanting aanleg"	"Complex datatype voor dat de aanleg van sierbeplanting beschrijft."	""	"Sierbeplanting aanleg"	"Complex datatype voor dat de aanleg van sierbeplanting beschrijft."	""	""	"true"	"https://wegenenverkeer-test.data.vlaanderen.be/ns/onderdeel#"	"DtcSierbeplAanleg"	"http://www.w3.org/2000/01/rdf-schema#Class"	""	""	""	""	""
"DATATYPE"	"OSLO-Onderdeel"	"DtcBSSRandafwerking"	"{59375941-F9D8-405e-A015-DAC781E0E7A4}"	""	""	""	""	"Betonstraatsteenafwerking"	"Complex datatype voor de afwerking van de rand van een betonstraatsteenverharding."	""	"Betonstraatsteenafwerking"	"Complex datatype voor de afwerking van de rand van een betonstraatsteenverharding."	""	""	"true"	"https://wegenenverkeer-test.data.vlaanderen.be/ns/onderdeel#"	"DtcBSSRandafwerking"	"http://www.w3.org/2000/01/rdf-schema#Class"	""	""	""	""	""
"DATATYPE"	"OSLO-Onderdeel"	"DtcProfileerlaag"	"{67677197-37CF-437a-84D3-AE6971162B1D}"	""	""	""	""	"Profileerlaag"	"Complex datatype om extra informatie te capteren van de profilerende laag."	""	"Profileerlaag"	"Complex datatype om extra informatie te capteren van de profilerende laag."	""	""	"true"	"https://wegenenverkeer-test.data.vlaanderen.be/ns/onderdeel#"	"DtcProfileerlaag"	"http://www.w3.org/2000/01/rdf-schema#Class"	""	""	""	""	""
"DATATYPE"	"OSLO-Onderdeel"	"DtcSupplementenCBV"	"{A7620C41-97F0-46a4-87A6-AE1063AC91AF}"	""	""	""	""	"Supplementen CBV"	"Complex datatype voor de supplementen van de CBV."	""	"Supplementen CBV"	"Complex datatype voor de supplementen van de CBV."	""	""	"true"	"https://wegenenverkeer-test.data.vlaanderen.be/ns/onderdeel#"	"DtcSupplementenCBV"	"http://www.w3.org/2000/01/rdf-schema#Class"	""	""	""	""	""
"DATATYPE"	"OSLO-Onderdeel"	"DtcKrimpvoeg"	"{E46A6C31-23C9-49ab-8D25-C9E8CA0CC018}"	""	""	""	""	"Krimpvoeg"	"Complex datatype voor de informatie van de krimpvoegen."	""	"Krimpvoeg"	"Complex datatype voor de informatie van de krimpvoegen."	""	""	"true"	"https://wegenenverkeer-test.data.vlaanderen.be/ns/onderdeel#"	"DtcKrimpvoeg"	"http://www.w3.org/2000/01/rdf-schema#Class"	""	""	""	""	""
"DATATYPE"	"OSLO-Onderdeel"	"DtcSoftwarePoortconfiguratie"	"{46047B6A-3822-4f74-838B-FF2A6F23229D}"	""	""	""	""	"Software poortconfiguratie"	"Complex datatype dat beschrijft welke poort voor welke service gebruikt wordt."	""	"Software poortconfiguratie"	"Complex datatype dat beschrijft welke poort voor welke service gebruikt wordt."	""	""	"true"	"https://wegenenverkeer-test.data.vlaanderen.be/ns/onderdeel#"	"DtcSoftwarePoortconfiguratie"	"http://www.w3.org/2000/01/rdf-schema#Class"	""	""	""	""	""
"DATATYPE"	"OSLO-Onderdeel"	"DtcExterneReferentie"	"{DD672C59-8533-47d5-AC8B-7A80D7B82030}"	""	""	""	""	"Externe referentie"	"Complex datatype waarmee een referentienummer zoals gekend bij de externe partij bv. aannemer,VLCC,... kan toegevoegd worden aan object."	""	"Externe referentie"	"Complex datatype waarmee een referentienummer zoals gekend bij de externe partij bv. aannemer,VLCC,... kan toegevoegd worden aan object."	""	""	"true"	"https://wegenenverkeer-test.data.vlaanderen.be/ns/onderdeel#"	"DtcExterneReferentie"	"http://www.w3.org/2000/01/rdf-schema#Class"	""	""	""	""	""
"DATATYPE"	"OSLO-Proefenmeting"	"DtcGeluidstestRapport"	"{9D74DFE6-8927-4458-810F-FE75E95A6804}"	""	""	""	""	"Geluidstest rapport"	"Complex datatype voor een verslag dat de resultaten van de geluidsmetingen weergeeft."	""	"Geluidstest rapport"	"Complex datatype voor een verslag dat de resultaten van de geluidsmetingen weergeeft."	""	""	"true"	"https://wegenenverkeer-test.data.vlaanderen.be/ns/proefenmeting#"	"DtcGeluidstestRapport"	"http://www.w3.org/2000/01/rdf-schema#Class"	""	""	""	""	""
"DATATYPE"	"W3-XML-Schema"	"String"	"{46000FD5-B812-4509-A95A-0E70BC519F47}"	""	""	""	""	"String"	"Beschrijft een tekstregel volgens http://www.w3.org/2001/XMLSchema#string"	"https://www.w3.org/TR/xmlschema-2/#string"	"String"	"Beschrijft een tekstregel volgens http://www.w3.org/2001/XMLSchema#string"	""	""	"true"	"http://www.w3.org/2001/XMLSchema#"	"string"	"http://www.w3.org/2000/01/rdf-schema#Class"	""	""	""	""	""
"DATATYPE"	"W3-XML-Schema"	"Time"	"{A5D654DC-BF0D-4a24-84A3-FC2DF5B9F871}"	""	""	""	""	"Tijd"	"Beschrijft een tijd volgens http://www.w3.org/2001/XMLSchema#time"	"https://www.w3.org/TR/xmlschema-2/#time"	"Tijd"	"Beschrijft een tijd volgens http://www.w3.org/2001/XMLSchema#time"	""	""	"true"	"http://www.w3.org/2001/XMLSchema#"	"time"	"http://www.w3.org/2000/01/rdf-schema#Class"	""	""	""	""	""
"DATATYPE"	"OSLO-Implementatieelement"	"KwantWrdInMinuut"	"{C595BD04-3C2C-4a0e-BF66-A80BD4D84F3E}"	""	""	""	""	"Kwantitatieve waarde in minuten"	"Een kwantitatieve waarde die een getal in minuten uitdrukt."	""	"Kwantitatieve waarde in minuten"	"Een kwantitatieve waarde die een getal in minuten uitdrukt."	""	""	"true"	"https://wegenenverkeer-test.data.vlaanderen.be/ns/implementatieelement#"	"KwantWrdInMinuut"	"http://www.w3.org/2000/01/rdf-schema#Class"	""	""	""	""	""
"DATATYPE"	"W3-RDF-Schema"	"Literal"	"{77B0B6CB-5141-4d3a-BCB5-92EA7382CD6B}"	""	""	""	""	"Literal"	"Beschrijft een constante."	"http://www.w3.org/2000/01/rdf-schema#Literal"	"Literal"	"Beschrijft een constante."	""	""	"true"	"http://www.w3.org/2000/01/rdf-schema#"	"Literal"	"http://www.w3.org/2000/01/rdf-schema#Class"	""	""	""	""	""
"DATATYPE"	"W3-XML-Schema"	"NonNegativeInteger"	"{3532F13B-04F5-41ee-BCA4-23F5AD65130C}"	""	""	""	""	"Natuurlijk getal"	"Beschrijft een natuurlijk getal volgens http://www.w3.org/2001/XMLSchema#nonNegativeInteger"	"https://www.w3.org/TR/xmlschema-2/#nonNegativeInteger"	"Natuurlijk getal"	"Beschrijft een natuurlijk getal volgens http://www.w3.org/2001/XMLSchema#nonNegativeInteger"	""	""	"true"	"http://www.w3.org/2001/XMLSchema#"	"nonNegativeInteger"	"http://www.w3.org/2000/01/rdf-schema#Class"	""	""	""	""	""
"DATATYPE"	"OSLO-Implementatieelement"	"KwantWrdInSeconde"	"{B095AEEA-8DB5-410b-B214-C98A885F3A31}"	""	""	""	""	"Kwantitatieve waarde in seconde"	"Een kwantitatieve waarde die een getal in seconde uitdrukt."	""	"Kwantitatieve waarde in seconde"	"Een kwantitatieve waarde die een getal in seconde uitdrukt."	""	""	"true"	"https://wegenenverkeer-test.data.vlaanderen.be/ns/implementatieelement#"	"KwantWrdInSeconde"	"http://www.w3.org/2000/01/rdf-schema#Class"	""	""	""	""	""
"DATATYPE"	"OSLO-Implementatieelement"	"KwantWrdInUur"	"{9B00F8A5-D717-4bf3-BD50-5B6B8A8B6488}"	""	""	""	""	"Kwantitatieve waarde in uur"	"Een kwantitatieve waarde die een getal in uur uitdrukt."	""	"Kwantitatieve waarde in uur"	"Een kwantitatieve waarde die een getal in uur uitdrukt."	""	""	"true"	"https://wegenenverkeer-test.data.vlaanderen.be/ns/implementatieelement#"	"KwantWrdInUur"	"http://www.w3.org/2000/01/rdf-schema#Class"	""	""	""	""	""
"DATATYPE"	"OSLO-Implementatieelement"	"DteTekstblok"	"{5E0F1078-64D7-41e6-AB33-41BD4C95F570}"	""	""	""	""	"Tekstblok"	"Een tekst welke uit meerdere zinnen bestaat,en ook regeleindes kan bevatten. Een tekstblok bevat maximaal 65.000 karakters."	""	"Tekstblok"	"Een tekst welke uit meerdere zinnen bestaat,en ook regeleindes kan bevatten. Een tekstblok bevat maximaal 65.000 karakters."	""	""	"true"	"https://wegenenverkeer-test.data.vlaanderen.be/ns/implementatieelement#"	"DteTekstblok"	"http://www.w3.org/2000/01/rdf-schema#Class"	""	""	""	""	""
"DATATYPE"	"W3-XML-Schema"	"AnyURI"	"{7D2306ED-5ECE-451a-9FC0-38E7E6A9D69D}"	""	""	""	""	"URI"	"Een tekstwaarde die een verwijzing naar meer informatie van het element bevat volgens http://www.w3.org/2001/XMLSchema#anyURI ."	"https://www.w3.org/TR/xmlschema-2/#anyURI"	"URI"	"Een tekstwaarde die een verwijzing naar meer informatie van het element bevat volgens http://www.w3.org/2001/XMLSchema#anyURI ."	""	""	"true"	"http://www.w3.org/2001/XMLSchema#"	"anyURI"	"http://www.w3.org/2000/01/rdf-schema#Class"	""	""	""	""	""
"DATATYPE"	"OSLO-Implementatieelement"	"KwantWrdInMeter"	"{CD137DF1-65D5-4347-9D31-F6E4BD49A2D1}"	""	""	""	""	"Kwantitatieve waarde in meter"	"Een kwantitatieve waarde die een getal in meter uitdrukt."	""	"Kwantitatieve waarde in meter"	"Een kwantitatieve waarde die een getal in meter uitdrukt."	""	""	"true"	"https://wegenenverkeer-test.data.vlaanderen.be/ns/implementatieelement#"	"KwantWrdInMeter"	"http://www.w3.org/2000/01/rdf-schema#Class"	""	""	""	""	""
"DATATYPE"	"W3-XML-Schema"	"Decimal"	"{199E318E-2D42-40c6-B228-32B2E490B640}"	""	""	""	""	"Decimaal getal"	"Beschrijft een decimaal getal volgens http://www.w3.org/2001/XMLSchema#decimal"	"https://www.w3.org/TR/xmlschema-2/#decimal"	"Decimaal getal"	"Beschrijft een decimaal getal volgens http://www.w3.org/2001/XMLSchema#decimal"	""	""	"true"	"http://www.w3.org/2001/XMLSchema#"	"decimal"	"http://www.w3.org/2000/01/rdf-schema#Class"	""	""	""	""	""
"DATATYPE"	"OSLO-Implementatieelement"	"KwantWrdInMillimeter"	"{05FF4D5B-B5A2-4909-9657-572035B89026}"	""	""	""	""	"Kwantitatieve waarde in millimeter"	"Een kwantitatieve waarde die een getal in millimeter uitdrukt."	""	"Kwantitatieve waarde in millimeter"	"Een kwantitatieve waarde die een getal in millimeter uitdrukt."	""	""	"true"	"https://wegenenverkeer-test.data.vlaanderen.be/ns/implementatieelement#"	"KwantWrdInMillimeter"	"http://www.w3.org/2000/01/rdf-schema#Class"	""	""	""	""	""
"DATATYPE"	"OSLO-Implementatieelement"	"KwantWrdInCentimeter"	"{76912443-08C5-4ba4-8012-1714B200B3F1}"	""	""	""	""	"Kwantitatieve waarde in centimeter"	"Een kwantitatieve waarde die een getal in centimeter uitdrukt."	""	"Kwantitatieve waarde in centimeter"	"Een kwantitatieve waarde die een getal in centimeter uitdrukt."	""	""	"true"	"https://wegenenverkeer-test.data.vlaanderen.be/ns/implementatieelement#"	"KwantWrdInCentimeter"	"http://www.w3.org/2000/01/rdf-schema#Class"	""	""	""	""	""
"DATATYPE"	"W3-XML-Schema"	"Boolean"	"{0544FFC3-F3A6-418d-AE01-A297FBC08BFF}"	""	""	""	""	"Boolean"	"Beschrijft een boolean volgens http://www.w3.org/2001/XMLSchema#boolean"	"https://www.w3.org/TR/xmlschema-2/#boolean"	"Boolean"	"Beschrijft een boolean volgens http://www.w3.org/2001/XMLSchema#boolean"	""	""	"true"	"http://www.w3.org/2001/XMLSchema#"	"boolean"	"http://www.w3.org/2000/01/rdf-schema#Class"	""	""	""	""	""
"DATATYPE"	"OSLO-Implementatieelement"	"KwantWrdInTon"	"{1E4348CD-C54C-43e7-A8F6-18198DCAF1DE}"	""	""	""	""	"Kwantitatieve waarde in ton"	"Een kwantitatieve waarde die een getal in ton uitdrukt."	""	"Kwantitatieve waarde in ton"	"Een kwantitatieve waarde die een getal in ton uitdrukt."	""	""	"true"	"https://wegenenverkeer-test.data.vlaanderen.be/ns/implementatieelement#"	"KwantWrdInTon"	"http://www.w3.org/2000/01/rdf-schema#Class"	""	""	""	""	""
"DATATYPE"	"W3-XML-Schema"	"Integer"	"{C927C962-4676-4c73-ADE9-1AAE6048F361}"	""	""	""	""	"Geheel getal"	"Beschrijft een geheel getal volgens http://www.w3.org/2001/XMLSchema#integer"	"https://www.w3.org/TR/xmlschema-2/#integer"	"Geheel getal"	"Beschrijft een geheel getal volgens http://www.w3.org/2001/XMLSchema#integer"	""	""	"true"	"http://www.w3.org/2001/XMLSchema#"	"integer"	"http://www.w3.org/2000/01/rdf-schema#Class"	""	""	""	""	""
"ENUMERATION"	"OSLO-Implementatieelement"	"KlAlgGemeente"	"{8DE3D0DB-1B0F-4bea-857C-1EBD5593949B}"	""	""	""	""	"Gemeente"	"Lijst van gemeentes in Vlaanderen."	""	"Gemeente"	"Lijst van gemeentes in Vlaanderen."	""	"https://wegenenverkeer-test.data.vlaanderen.be/id/conceptscheme/KlAlgGemeente"	"true"	"http://www.w3.org/2004/02/skos/core#"	"Concept"	"http://www.w3.org/2000/01/rdf-schema#Class"	""	""	""	""	""
"ENUMERATION"	"OSLO-Implementatieelement"	"KlAlgProvincie"	"{07D81896-D25F-44a2-AD4E-49601B294C90}"	""	""	""	""	"Provincie"	"Lijst van provincies in Vlaanderen"	""	"Provincie"	"Lijst van provincies in Vlaanderen"	""	"https://wegenenverkeer-test.data.vlaanderen.be/id/conceptscheme/KlAlgProvincie"	"true"	"http://www.w3.org/2004/02/skos/core#"	"Concept"	"http://www.w3.org/2000/01/rdf-schema#Class"	""	""	""	""	""
"ENUMERATION"	"OSLO-Implementatieelement"	"KlAlgWeekdagen"	"{401FBED4-8E98-414b-9D45-DD82DFF30162}"	""	""	""	""	"Weekdagen"	"Lijst van de verschillende weekdagen"	""	"Weekdagen"	"Lijst van de verschillende weekdagen"	""	"https://wegenenverkeer-test.data.vlaanderen.be/id/conceptscheme/KlAlgWeekdagen"	"true"	"https://schema.org/"	"DayOfWeek"	"http://www.w3.org/2000/01/rdf-schema#Class"	""	""	""	""	""
"ENUMERATION"	"OSLO-Implementatieelement"	"KlAlgMimeType"	"{1FA47C69-7BE3-4e29-A849-316B2A07E1F6}"	""	""	""	""	"Mimetype"	"De mime types van bestanden (AWVDocument) beperkt tot mime types voor toegelaten bestandstypen."	""	"Mimetype"	"De mime types van bestanden (AWVDocument) beperkt tot mime types voor toegelaten bestandstypen."	""	"https://wegenenverkeer-test.data.vlaanderen.be/id/conceptscheme/KlAlgMimeType"	"true"	"http://www.w3.org/2004/02/skos/core#"	"Concept"	"http://www.w3.org/2000/01/rdf-schema#Class"	""	""	""	""	""
