"EA-Type"	"EA-Package"	"EA-Name"	"EA-GUID"	"EA-Parent"	"EA-Domain"	"EA-Domain-GUID"	"EA-Range"	"label"	"definition"	"usage"	"ap-label-nl"	"ap-definition-nl"	"ap-usageNote-nl"	"ap-codelist"	"external term"	"namespace"	"localname"	"type"	"domain"	"range"	"parent"	"min card"	"max card"
"attribute"	"OSLO-Levenscyclus"	"isVeiligheidsmaaien"	"{D16527CA-5A6D-4f6a-8F65-0663AE823A93}"	""	"DtcMaaien"	"{9D960712-5666-40de-AA1D-89AF3AA70C53}"	"Boolean"	"Is veiligheidsmaaien"	"Aanduiding of er een maaistrook aanwezig is voor het vrijwaren van de zichtbaarheid en voor het vrijhouden van de bebakening en signalisatie."	""	"Is veiligheidsmaaien"	"Aanduiding of er een maaistrook aanwezig is voor het vrijwaren van de zichtbaarheid en voor het vrijhouden van de bebakening en signalisatie."	""	""	"true"	"https://wegenenverkeer-test.data.vlaanderen.be/ns/levenscyclus#"	"DtcMaaien.isVeiligheidsmaaien"	"http://www.w3.org/2002/07/owl#DatatypeProperty"	"https://wegenenverkeer-test.data.vlaanderen.be/ns/levenscyclus#DtcMaaien"	"http://www.w3.org/2001/XMLSchema#boolean"	""	"1"	"1"
"attribute"	"OSLO-Levenscyclus"	"klepelmaaierToegelaten"	"{21DEEB8A-1020-4a3c-964A-CA240DDE1869}"	""	"DtcMaaien"	"{9D960712-5666-40de-AA1D-89AF3AA70C53}"	"Boolean"	"Klepelmaaier toegelaten"	"Aanduiding of er gemaaid mag worden met een klepelmaaier."	""	"Klepelmaaier toegelaten"	"Aanduiding of er gemaaid mag worden met een klepelmaaier."	""	""	"true"	"https://wegenenverkeer-test.data.vlaanderen.be/ns/levenscyclus#"	"DtcMaaien.klepelmaaierToegelaten"	"http://www.w3.org/2002/07/owl#DatatypeProperty"	"https://wegenenverkeer-test.data.vlaanderen.be/ns/levenscyclus#DtcMaaien"	"http://www.w3.org/2001/XMLSchema#boolean"	""	"1"	"1"
"attribute"	"OSLO-Levenscyclus"	"periode"	"{F91F937C-4113-4f8b-85DC-421DA56D68FC}"	""	"DtcMaaien"	"{9D960712-5666-40de-AA1D-89AF3AA70C53}"	"KlMaaiPeriode"	"Periode"	"De maand waarin het maaien wordt uitgevoerd."	""	"Periode"	"De maand waarin het maaien wordt uitgevoerd."	""	""	"true"	"https://wegenenverkeer-test.data.vlaanderen.be/ns/levenscyclus#"	"DtcMaaien.periode"	"http://www.w3.org/2002/07/owl#ObjectProperty"	"https://wegenenverkeer-test.data.vlaanderen.be/ns/levenscyclus#DtcMaaien"	"http://www.w3.org/2004/02/skos/core#Concept"	""	"1"	"*"
"attribute"	"OSLO-Onderdeel"	"bijkomendeParameter"	"{7A1A8A72-539D-478d-A7AF-EDB2753E00C7}"	""	"DtcLENorm"	"{D84A22F4-D42E-4313-AFBC-7B25EE37EFC5}"	"KlLEKantopsluitingBijkomendeParameter"	"bijkomende parameter"	"Het gedetailleerder typeren van de kantopsluiting."	""	"bijkomende parameter"	"Het gedetailleerder typeren van de kantopsluiting."	""	""	"true"	"https://wegenenverkeer-test.data.vlaanderen.be/ns/onderdeel#"	"DtcLENorm.bijkomendeParameter"	"http://www.w3.org/2002/07/owl#ObjectProperty"	"https://wegenenverkeer-test.data.vlaanderen.be/ns/onderdeel#DtcLENorm"	"http://www.w3.org/2004/02/skos/core#Concept"	""	"1"	"1"
"attribute"	"OSLO-Onderdeel"	"norm"	"{8279253F-A784-4f38-9D88-115DF91F6DF1}"	""	"DtcLENorm"	"{D84A22F4-D42E-4313-AFBC-7B25EE37EFC5}"	"String"	"norm"	"De opgelegde en beschreven standaard van de kantopsluiting ."	""	"norm"	"De opgelegde en beschreven standaard van de kantopsluiting ."	""	""	"true"	"https://wegenenverkeer-test.data.vlaanderen.be/ns/onderdeel#"	"DtcLENorm.norm"	"http://www.w3.org/2002/07/owl#DatatypeProperty"	"https://wegenenverkeer-test.data.vlaanderen.be/ns/onderdeel#DtcLENorm"	"http://www.w3.org/2001/XMLSchema#string"	""	"1"	"1"
"attribute"	"OSLO-Onderdeel"	"breedte"	"{1D14D92D-7BB3-4d3e-ADEA-AC6B6AE01111}"	""	"DtcTrottoirbandVorm"	"{7A6A2172-E0E0-47ae-8096-AA0EABBC8388}"	"KwantWrdInCentimeter"	"breedte"	"De breedte van de trottoirband."	""	"breedte"	"De breedte van de trottoirband."	""	""	"true"	"https://wegenenverkeer-test.data.vlaanderen.be/ns/onderdeel#"	"DtcTrottoirbandVorm.breedte"	"http://www.w3.org/2002/07/owl#ObjectProperty"	"https://wegenenverkeer-test.data.vlaanderen.be/ns/onderdeel#DtcTrottoirbandVorm"	"https://wegenenverkeer-test.data.vlaanderen.be/ns/implementatieelement#KwantWrdInCentimeter"	""	"1"	"1"
"attribute"	"OSLO-Onderdeel"	"dikte"	"{1A0DF0D4-E982-4ae8-8500-1C2897046045}"	""	"DtcTrottoirbandVorm"	"{7A6A2172-E0E0-47ae-8096-AA0EABBC8388}"	"KwantWrdInCentimeter"	"dikte"	"De dikte van de trottoirband."	""	"dikte"	"De dikte van de trottoirband."	""	""	"true"	"https://wegenenverkeer-test.data.vlaanderen.be/ns/onderdeel#"	"DtcTrottoirbandVorm.dikte"	"http://www.w3.org/2002/07/owl#ObjectProperty"	"https://wegenenverkeer-test.data.vlaanderen.be/ns/onderdeel#DtcTrottoirbandVorm"	"https://wegenenverkeer-test.data.vlaanderen.be/ns/implementatieelement#KwantWrdInCentimeter"	""	"1"	"1"
"attribute"	"OSLO-Onderdeel"	"vorm"	"{068AB7F9-2F9B-40fc-ABFA-B841EEA33E7C}"	""	"DtcTrottoirbandVorm"	"{7A6A2172-E0E0-47ae-8096-AA0EABBC8388}"	"KlLETrottoirbandVorm"	"vorm"	"De vorm van de trottoirband."	""	"vorm"	"De vorm van de trottoirband."	""	""	"true"	"https://wegenenverkeer-test.data.vlaanderen.be/ns/onderdeel#"	"DtcTrottoirbandVorm.vorm"	"http://www.w3.org/2002/07/owl#ObjectProperty"	"https://wegenenverkeer-test.data.vlaanderen.be/ns/onderdeel#DtcTrottoirbandVorm"	"http://www.w3.org/2004/02/skos/core#Concept"	""	"1"	"1"
"attribute"	"OSLO-Onderdeel"	"geluidskarakteristiek"	"{8544AA3C-5C52-4676-BB13-1DA62A266CEF}"	""	"DtcGCMateriaalKarakteristiek"	"{5DF403AA-F73D-4013-94EC-E0A969BC2B8E}"	"KlLEGCGeluidskarakteristiek"	"geluidskarakteristiek"	"Het kenmerkend gedrag inzake geluid van de geluidswerende constructie."	""	"geluidskarakteristiek"	"Het kenmerkend gedrag inzake geluid van de geluidswerende constructie."	""	""	"true"	"https://wegenenverkeer-test.data.vlaanderen.be/ns/onderdeel#"	"DtcGCMateriaalKarakteristiek.geluidskarakteristiek"	"http://www.w3.org/2002/07/owl#ObjectProperty"	"https://wegenenverkeer-test.data.vlaanderen.be/ns/onderdeel#DtcGCMateriaalKarakteristiek"	"http://www.w3.org/2004/02/skos/core#Concept"	""	"1"	"1"
"attribute"	"OSLO-Onderdeel"	"materiaal"	"{3860E5F2-C9CB-4de1-8D1B-0E9D9D38CC16}"	""	"DtcGCMateriaalKarakteristiek"	"{5DF403AA-F73D-4013-94EC-E0A969BC2B8E}"	"KlLEGCMateriaal"	"materiaal"	"Het materiaal van de geluidswerende constructie."	""	"materiaal"	"Het materiaal van de geluidswerende constructie."	""	""	"true"	"https://wegenenverkeer-test.data.vlaanderen.be/ns/onderdeel#"	"DtcGCMateriaalKarakteristiek.materiaal"	"http://www.w3.org/2002/07/owl#ObjectProperty"	"https://wegenenverkeer-test.data.vlaanderen.be/ns/onderdeel#DtcGCMateriaalKarakteristiek"	"http://www.w3.org/2004/02/skos/core#Concept"	""	"1"	"1"
"attribute"	"OSLO-Onderdeel"	"opvatting"	"{73F70808-2E7B-4b64-832A-46F977347B6D}"	""	"DtcMarkeringOpvatting"	"{F669B3DB-480D-4b3d-B86D-FC5ACFEE67D3}"	"KlSignalisatieMarkeringOpvatting"	"opvatting"	"De opvatting van de markering, zijnde middelenverbintenis of resultaatsverbintenis."	""	"opvatting"	"De opvatting van de markering, zijnde middelenverbintenis of resultaatsverbintenis."	""	""	"true"	"https://wegenenverkeer-test.data.vlaanderen.be/ns/onderdeel#"	"DtcMarkeringOpvatting.opvatting"	"http://www.w3.org/2002/07/owl#ObjectProperty"	"https://wegenenverkeer-test.data.vlaanderen.be/ns/onderdeel#DtcMarkeringOpvatting"	"http://www.w3.org/2004/02/skos/core#Concept"	""	"1"	"1"
"attribute"	"OSLO-Onderdeel"	"waarborgperiode"	"{EF146084-057C-42af-A93E-E4D9892CDE38}"	""	"DtcMarkeringOpvatting"	"{F669B3DB-480D-4b3d-B86D-FC5ACFEE67D3}"	"KlMarkeringWaarborgperiode"	"waarborgperiode"	"De periode waarin de markering moet voldoen aan de resultaatseisen."	""	"waarborgperiode"	"De periode waarin de markering moet voldoen aan de resultaatseisen."	""	""	"true"	"https://wegenenverkeer-test.data.vlaanderen.be/ns/onderdeel#"	"DtcMarkeringOpvatting.waarborgperiode"	"http://www.w3.org/2002/07/owl#ObjectProperty"	"https://wegenenverkeer-test.data.vlaanderen.be/ns/onderdeel#DtcMarkeringOpvatting"	"http://www.w3.org/2004/02/skos/core#Concept"	""	"1"	"1"
"attribute"	"OSLO-Onderdeel"	"code"	"{5CA250A5-7F75-4d06-B222-7A554A2ED557}"	""	"DtcVegetatieSoortnaam"	"{8A57F63A-44EE-421e-915A-AC0B49ACFE3E}"	"String"	"code"	"De GBIF key, een unieke identificator voor de soort van het vegetatie-element."	""	"code"	"De GBIF key, een unieke identificator voor de soort van het vegetatie-element."	""	""	"true"	"https://wegenenverkeer-test.data.vlaanderen.be/ns/onderdeel#"	"DtcVegetatieSoortnaam.code"	"http://www.w3.org/2002/07/owl#DatatypeProperty"	"https://wegenenverkeer-test.data.vlaanderen.be/ns/onderdeel#DtcVegetatieSoortnaam"	"http://www.w3.org/2001/XMLSchema#string"	""	"1"	"1"
"attribute"	"OSLO-Onderdeel"	"soortnaamNederlands"	"{13DD0ADD-07DC-468e-9416-709DEF97388D}"	""	"DtcVegetatieSoortnaam"	"{8A57F63A-44EE-421e-915A-AC0B49ACFE3E}"	"String"	"soortnaam nederlands"	"De Nederlandse soortnaam van de beplanting."	""	"soortnaam nederlands"	"De Nederlandse soortnaam van de beplanting."	""	""	"true"	"https://wegenenverkeer-test.data.vlaanderen.be/ns/onderdeel#"	"DtcVegetatieSoortnaam.soortnaamNederlands"	"http://www.w3.org/2002/07/owl#DatatypeProperty"	"https://wegenenverkeer-test.data.vlaanderen.be/ns/onderdeel#DtcVegetatieSoortnaam"	"http://www.w3.org/2001/XMLSchema#string"	""	"1"	"1"
"attribute"	"OSLO-Onderdeel"	"soortnaamWetenschappelijk"	"{95BC2D20-5773-4f64-AA9F-A3B88BF08046}"	""	"DtcVegetatieSoortnaam"	"{8A57F63A-44EE-421e-915A-AC0B49ACFE3E}"	"String"	"soortnaam wetenschappelijk"	"De wetenschappelijke soortnaam van de beplanting."	""	"soortnaam wetenschappelijk"	"De wetenschappelijke soortnaam van de beplanting."	""	""	"true"	"https://wegenenverkeer-test.data.vlaanderen.be/ns/onderdeel#"	"DtcVegetatieSoortnaam.soortnaamWetenschappelijk"	"http://www.w3.org/2002/07/owl#DatatypeProperty"	"https://wegenenverkeer-test.data.vlaanderen.be/ns/onderdeel#DtcVegetatieSoortnaam"	"http://www.w3.org/2001/XMLSchema#string"	""	"1"	"1"
"attribute"	"OSLO-Onderdeel"	"materiaal"	"{22996420-BE0D-4401-9915-F4D1B7F5DF14}"	""	"DtcBeschermingVraatschade"	"{852CFCB4-6F63-4a45-BA17-A81FFA8CB97D}"	"KlMateriaalBeschermingVraatschade"	"materiaal"	"De middelen als bescherming tegen vraatschade."	""	"materiaal"	"De middelen als bescherming tegen vraatschade."	""	""	"true"	"https://wegenenverkeer-test.data.vlaanderen.be/ns/onderdeel#"	"DtcBeschermingVraatschade.materiaal"	"http://www.w3.org/2002/07/owl#ObjectProperty"	"https://wegenenverkeer-test.data.vlaanderen.be/ns/onderdeel#DtcBeschermingVraatschade"	"http://www.w3.org/2004/02/skos/core#Concept"	""	"1"	"1"
"attribute"	"OSLO-Onderdeel"	"tegenMaaischade"	"{8EC6E966-2F4A-428e-9640-3C40CFB82209}"	""	"DtcBeschermingVraatschade"	"{852CFCB4-6F63-4a45-BA17-A81FFA8CB97D}"	"Boolean"	"tegen maaischade"	"Aanduiding of er bescherming tegen maaischade aanwezig is."	""	"tegen maaischade"	"Aanduiding of er bescherming tegen maaischade aanwezig is."	""	""	"true"	"https://wegenenverkeer-test.data.vlaanderen.be/ns/onderdeel#"	"DtcBeschermingVraatschade.tegenMaaischade"	"http://www.w3.org/2002/07/owl#DatatypeProperty"	"https://wegenenverkeer-test.data.vlaanderen.be/ns/onderdeel#DtcBeschermingVraatschade"	"http://www.w3.org/2001/XMLSchema#boolean"	""	"1"	"1"
"attribute"	"OSLO-Onderdeel"	"beschermingVraatschade"	"{1DBBA7A8-7A4B-41d4-9ADD-25CF192DB468}"	""	"DtcHoutigeAanleg"	"{AB52DD46-644F-4a06-889D-BB1592EA73E4}"	"DtcBeschermingVraatschade"	"Bescherming vraatschade"	"Bescherming van de stam tegen knaagdieren."	""	"Bescherming vraatschade"	"Bescherming van de stam tegen knaagdieren."	""	""	"true"	"https://wegenenverkeer-test.data.vlaanderen.be/ns/onderdeel#"	"DtcHoutigeAanleg.beschermingVraatschade"	"http://www.w3.org/2002/07/owl#ObjectProperty"	"https://wegenenverkeer-test.data.vlaanderen.be/ns/onderdeel#DtcHoutigeAanleg"	"https://wegenenverkeer-test.data.vlaanderen.be/ns/onderdeel#DtcBeschermingVraatschade"	""	"1"	"1"
"attribute"	"OSLO-Onderdeel"	"heeftBoomplaat"	"{09D76F3E-9818-43ba-AB2F-51F6652371F7}"	""	"DtcHoutigeAanleg"	"{AB52DD46-644F-4a06-889D-BB1592EA73E4}"	"Boolean"	"heeft boomplaat"	"Boomplaten worden aangebracht rond de stam van bomen, bosgoed en heesters en eventueel vastgezet met piketten. Ze hebben een centrale opening en een rechte snede, zodat ze op eenvoudige wijze rond de planten kunnen aangebracht worden."	""	"heeft boomplaat"	"Boomplaten worden aangebracht rond de stam van bomen, bosgoed en heesters en eventueel vastgezet met piketten. Ze hebben een centrale opening en een rechte snede, zodat ze op eenvoudige wijze rond de planten kunnen aangebracht worden."	""	""	"true"	"https://wegenenverkeer-test.data.vlaanderen.be/ns/onderdeel#"	"DtcHoutigeAanleg.heeftBoomplaat"	"http://www.w3.org/2002/07/owl#DatatypeProperty"	"https://wegenenverkeer-test.data.vlaanderen.be/ns/onderdeel#DtcHoutigeAanleg"	"http://www.w3.org/2001/XMLSchema#boolean"	""	"1"	"1"
"attribute"	"OSLO-Onderdeel"	"heeftHaagsteun"	"{B724716B-F95C-4023-9262-9C527EEF26D9}"	""	"DtcHoutigeAanleg"	"{AB52DD46-644F-4a06-889D-BB1592EA73E4}"	"Boolean"	"heeft haagsteun"	"Duidt op de aanezigheid van een constructie van palen en bedrading die haagbeplanting ondersteunt."	""	"heeft haagsteun"	"Duidt op de aanezigheid van een constructie van palen en bedrading die haagbeplanting ondersteunt."	""	""	"true"	"https://wegenenverkeer-test.data.vlaanderen.be/ns/onderdeel#"	"DtcHoutigeAanleg.heeftHaagsteun"	"http://www.w3.org/2002/07/owl#DatatypeProperty"	"https://wegenenverkeer-test.data.vlaanderen.be/ns/onderdeel#DtcHoutigeAanleg"	"http://www.w3.org/2001/XMLSchema#boolean"	""	"1"	"1"
"attribute"	"OSLO-Onderdeel"	"heeftWortelgeleidingwortelwering"	"{82DC75D2-720E-4dfd-B505-4185C9835539}"	""	"DtcHoutigeAanleg"	"{AB52DD46-644F-4a06-889D-BB1592EA73E4}"	"Boolean"	"heeft wortelgeleiding-wortelwering"	"Wortelgeleiding en wering moet voorkomen dat boomwortels het trottoir, de middenberm, het fietspad, de rijweg, andere wegverhardingen en leidingstelsels beschadigen. Het heeft als doel om boomwortels naar beneden te leiden, waar ze onder een obstakel verder kunnen groeien."	""	"heeft wortelgeleiding-wortelwering"	"Wortelgeleiding en wering moet voorkomen dat boomwortels het trottoir, de middenberm, het fietspad, de rijweg, andere wegverhardingen en leidingstelsels beschadigen. Het heeft als doel om boomwortels naar beneden te leiden, waar ze onder een obstakel verder kunnen groeien."	""	""	"true"	"https://wegenenverkeer-test.data.vlaanderen.be/ns/onderdeel#"	"DtcHoutigeAanleg.heeftWortelgeleidingwortelwering"	"http://www.w3.org/2002/07/owl#DatatypeProperty"	"https://wegenenverkeer-test.data.vlaanderen.be/ns/onderdeel#DtcHoutigeAanleg"	"http://www.w3.org/2001/XMLSchema#boolean"	""	"1"	"1"
"attribute"	"OSLO-Onderdeel"	"plantafstand"	"{EE40BF51-BE6E-4cad-B482-AA9203EE262C}"	""	"DtcHoutigeAanleg"	"{AB52DD46-644F-4a06-889D-BB1592EA73E4}"	"NonNegativeInteger"	"plantafstand"	"Aantal planten per lopende meter."	""	"plantafstand"	"Aantal planten per lopende meter."	""	""	"true"	"https://wegenenverkeer-test.data.vlaanderen.be/ns/onderdeel#"	"DtcHoutigeAanleg.plantafstand"	"http://www.w3.org/2002/07/owl#ObjectProperty"	"https://wegenenverkeer-test.data.vlaanderen.be/ns/onderdeel#DtcHoutigeAanleg"	"http://www.w3.org/2001/XMLSchema#nonNegativeInteger"	""	"1"	"1"
"attribute"	"OSLO-Onderdeel"	"plantdichtheid"	"{B7B03842-FB66-4f6e-BC3B-93AF65869D73}"	""	"DtcHoutigeAanleg"	"{AB52DD46-644F-4a06-889D-BB1592EA73E4}"	"NonNegativeInteger"	"plantdichtheid"	"Aantal planten per vierkante meter."	""	"plantdichtheid"	"Aantal planten per vierkante meter."	""	""	"true"	"https://wegenenverkeer-test.data.vlaanderen.be/ns/onderdeel#"	"DtcHoutigeAanleg.plantdichtheid"	"http://www.w3.org/2002/07/owl#ObjectProperty"	"https://wegenenverkeer-test.data.vlaanderen.be/ns/onderdeel#DtcHoutigeAanleg"	"http://www.w3.org/2001/XMLSchema#nonNegativeInteger"	""	"1"	"1"
"attribute"	"OSLO-Onderdeel"	"plantmaatHoogte"	"{07715ED5-3E66-4ad3-865D-B00490492BB0}"	""	"DtcHoutigeAanleg"	"{AB52DD46-644F-4a06-889D-BB1592EA73E4}"	"KlPlantmaatHoogte"	"plantmaat hoogte"	"De hoogte van de plant in cm gemeten tussen een minimum en maximum waarde."	""	"plantmaat hoogte"	"De hoogte van de plant in cm gemeten tussen een minimum en maximum waarde."	""	""	"true"	"https://wegenenverkeer-test.data.vlaanderen.be/ns/onderdeel#"	"DtcHoutigeAanleg.plantmaatHoogte"	"http://www.w3.org/2002/07/owl#ObjectProperty"	"https://wegenenverkeer-test.data.vlaanderen.be/ns/onderdeel#DtcHoutigeAanleg"	"http://www.w3.org/2004/02/skos/core#Concept"	""	"1"	"1"
"attribute"	"OSLO-Onderdeel"	"plantmaatOmtrek"	"{912F8366-51C7-4d49-A04C-F68D490AE611}"	""	"DtcHoutigeAanleg"	"{AB52DD46-644F-4a06-889D-BB1592EA73E4}"	"KlPlantmaatOmtrek"	"Plantmaat omtrek"	"De stamomtrek in centimeter  (gemeten op 1 m boven het maaiveld) met een minimum en maximum waarde."	""	"Plantmaat omtrek"	"De stamomtrek in centimeter  (gemeten op 1 m boven het maaiveld) met een minimum en maximum waarde."	""	""	"true"	"https://wegenenverkeer-test.data.vlaanderen.be/ns/onderdeel#"	"DtcHoutigeAanleg.plantmaatOmtrek"	"http://www.w3.org/2002/07/owl#ObjectProperty"	"https://wegenenverkeer-test.data.vlaanderen.be/ns/onderdeel#DtcHoutigeAanleg"	"http://www.w3.org/2004/02/skos/core#Concept"	""	"1"	"1"
"attribute"	"OSLO-Onderdeel"	"plantverband"	"{0E6DDAEE-E222-4fbf-9F0B-B8BB8C0CCD14}"	""	"DtcHoutigeAanleg"	"{AB52DD46-644F-4a06-889D-BB1592EA73E4}"	"KlVegetatiePlantverband"	"plantverband"	"De wijze waarop de planten zijn geschikt."	""	"plantverband"	"De wijze waarop de planten zijn geschikt."	""	""	"true"	"https://wegenenverkeer-test.data.vlaanderen.be/ns/onderdeel#"	"DtcHoutigeAanleg.plantverband"	"http://www.w3.org/2002/07/owl#ObjectProperty"	"https://wegenenverkeer-test.data.vlaanderen.be/ns/onderdeel#DtcHoutigeAanleg"	"http://www.w3.org/2004/02/skos/core#Concept"	""	"1"	"1"
"attribute"	"OSLO-Onderdeel"	"vormAanlevering"	"{BD5D8BFF-1F22-4d34-8B75-BF1718033A20}"	""	"DtcHoutigeAanleg"	"{AB52DD46-644F-4a06-889D-BB1592EA73E4}"	"KlVormAanleveringHoutigeVegetatie"	"vorm aanlevering"	"De wijze waarop het plantgoed wordt aangeleverd."	""	"vorm aanlevering"	"De wijze waarop het plantgoed wordt aangeleverd."	""	""	"true"	"https://wegenenverkeer-test.data.vlaanderen.be/ns/onderdeel#"	"DtcHoutigeAanleg.vormAanlevering"	"http://www.w3.org/2002/07/owl#ObjectProperty"	"https://wegenenverkeer-test.data.vlaanderen.be/ns/onderdeel#DtcHoutigeAanleg"	"http://www.w3.org/2004/02/skos/core#Concept"	""	"1"	"1"
"attribute"	"OSLO-Onderdeel"	"wortel"	"{D0ED42C2-3FE7-4241-A2D1-367EE8A43B78}"	""	"DtcHoutigeAanleg"	"{AB52DD46-644F-4a06-889D-BB1592EA73E4}"	"KlVegetatieWortel"	"wortel"	"De manier van levering en aanplanting van het wortelgestel van de boom of plant."	""	"wortel"	"De manier van levering en aanplanting van het wortelgestel van de boom of plant."	""	""	"true"	"https://wegenenverkeer-test.data.vlaanderen.be/ns/onderdeel#"	"DtcHoutigeAanleg.wortel"	"http://www.w3.org/2002/07/owl#ObjectProperty"	"https://wegenenverkeer-test.data.vlaanderen.be/ns/onderdeel#DtcHoutigeAanleg"	"http://www.w3.org/2004/02/skos/core#Concept"	""	"1"	"1"
"attribute"	"OSLO-Onderdeel"	"beschermingVraatschade"	"{389A5526-17AA-48b8-87C9-2E7288C706CA}"	""	"DtcAanlegBoomvorm"	"{D3CE333C-01B0-4ba5-A26A-535D5ADA25B9}"	"DtcBeschermingVraatschade"	"Bescherming vraatschade"	"Bescherming van de stam tegen knaagdieren."	""	"Bescherming vraatschade"	"Bescherming van de stam tegen knaagdieren."	""	""	"true"	"https://wegenenverkeer-test.data.vlaanderen.be/ns/onderdeel#"	"DtcAanlegBoomvorm.beschermingVraatschade"	"http://www.w3.org/2002/07/owl#ObjectProperty"	"https://wegenenverkeer-test.data.vlaanderen.be/ns/onderdeel#DtcAanlegBoomvorm"	"https://wegenenverkeer-test.data.vlaanderen.be/ns/onderdeel#DtcBeschermingVraatschade"	""	"1"	"1"
"attribute"	"OSLO-Onderdeel"	"boompaalconstructie"	"{22B9C447-A0CD-4ff0-BF34-0F29749EBB69}"	""	"DtcAanlegBoomvorm"	"{D3CE333C-01B0-4ba5-A26A-535D5ADA25B9}"	"KlAantalBoompalen"	"Boompaalconstructie"	"Een constructie om de wortels van de aangeplante boom vast te zetten of te fixeren met oa. palen."	""	"Boompaalconstructie"	"Een constructie om de wortels van de aangeplante boom vast te zetten of te fixeren met oa. palen."	""	""	"true"	"https://wegenenverkeer-test.data.vlaanderen.be/ns/onderdeel#"	"DtcAanlegBoomvorm.boompaalconstructie"	"http://www.w3.org/2002/07/owl#ObjectProperty"	"https://wegenenverkeer-test.data.vlaanderen.be/ns/onderdeel#DtcAanlegBoomvorm"	"http://www.w3.org/2004/02/skos/core#Concept"	""	"1"	"1"
"attribute"	"OSLO-Onderdeel"	"groeiplaatsverbetering"	"{4F54F09B-8350-4815-B2E4-052EC69F6CE1}"	""	"DtcAanlegBoomvorm"	"{D3CE333C-01B0-4ba5-A26A-535D5ADA25B9}"	"KlGroeiplaatsverbetering"	"Groeiplaatsverbetering"	"De techniek waarmee de groeiplaats wordt verbeterd met als doel de levensverwachting en de conditie van de vegetatie te verbeteren."	""	"Groeiplaatsverbetering"	"De techniek waarmee de groeiplaats wordt verbeterd met als doel de levensverwachting en de conditie van de vegetatie te verbeteren."	""	""	"true"	"https://wegenenverkeer-test.data.vlaanderen.be/ns/onderdeel#"	"DtcAanlegBoomvorm.groeiplaatsverbetering"	"http://www.w3.org/2002/07/owl#ObjectProperty"	"https://wegenenverkeer-test.data.vlaanderen.be/ns/onderdeel#DtcAanlegBoomvorm"	"http://www.w3.org/2004/02/skos/core#Concept"	""	"1"	"1"
"attribute"	"OSLO-Onderdeel"	"heeftBoomplaat"	"{F6E88765-D155-46fc-AB1E-A5FCB0BB58F2}"	""	"DtcAanlegBoomvorm"	"{D3CE333C-01B0-4ba5-A26A-535D5ADA25B9}"	"Boolean"	"heeft boomplaat"	"Boomplaten worden aangebracht rond de stam van bomen, bosgoed en heesters en eventueel vastgezet met piketten. Ze hebben een centrale opening en een rechte snede, zodat ze op eenvoudige wijze rond de planten kunnen aangebracht worden."	""	"heeft boomplaat"	"Boomplaten worden aangebracht rond de stam van bomen, bosgoed en heesters en eventueel vastgezet met piketten. Ze hebben een centrale opening en een rechte snede, zodat ze op eenvoudige wijze rond de planten kunnen aangebracht worden."	""	""	"true"	"https://wegenenverkeer-test.data.vlaanderen.be/ns/onderdeel#"	"DtcAanlegBoomvorm.heeftBoomplaat"	"http://www.w3.org/2002/07/owl#DatatypeProperty"	"https://wegenenverkeer-test.data.vlaanderen.be/ns/onderdeel#DtcAanlegBoomvorm"	"http://www.w3.org/2001/XMLSchema#boolean"	""	"1"	"1"
"attribute"	"OSLO-Onderdeel"	"heeftWortelgeleidingwortelwering"	"{0E6EB283-B82F-41b3-83BE-C7AADD705373}"	""	"DtcAanlegBoomvorm"	"{D3CE333C-01B0-4ba5-A26A-535D5ADA25B9}"	"Boolean"	"heeft wortelgeleiding wortelwering"	"Aanduiding of de boom wortelwering heeft. Wortelgeleiding en wering moet voorkomen dat boomwortels het trottoir, de middenberm, het fietspad, de rijweg, andere wegverhardingen en leidingstelsels beschadigen."	""	"heeft wortelgeleiding wortelwering"	"Aanduiding of de boom wortelwering heeft. Wortelgeleiding en wering moet voorkomen dat boomwortels het trottoir, de middenberm, het fietspad, de rijweg, andere wegverhardingen en leidingstelsels beschadigen."	""	""	"true"	"https://wegenenverkeer-test.data.vlaanderen.be/ns/onderdeel#"	"DtcAanlegBoomvorm.heeftWortelgeleidingwortelwering"	"http://www.w3.org/2002/07/owl#DatatypeProperty"	"https://wegenenverkeer-test.data.vlaanderen.be/ns/onderdeel#DtcAanlegBoomvorm"	"http://www.w3.org/2001/XMLSchema#boolean"	""	"1"	"1"
"attribute"	"OSLO-Onderdeel"	"plantmaatHoogte"	"{7FD3F046-F7F5-4e3b-8F5D-478982E34921}"	""	"DtcAanlegBoomvorm"	"{D3CE333C-01B0-4ba5-A26A-535D5ADA25B9}"	"KlPlantmaatHoogte"	"Plantmaat hoogte"	"De hoogte in meter gemeten van de stamvoet tot de top met een minimum en maximum waarde."	""	"Plantmaat hoogte"	"De hoogte in meter gemeten van de stamvoet tot de top met een minimum en maximum waarde."	""	""	"true"	"https://wegenenverkeer-test.data.vlaanderen.be/ns/onderdeel#"	"DtcAanlegBoomvorm.plantmaatHoogte"	"http://www.w3.org/2002/07/owl#ObjectProperty"	"https://wegenenverkeer-test.data.vlaanderen.be/ns/onderdeel#DtcAanlegBoomvorm"	"http://www.w3.org/2004/02/skos/core#Concept"	""	"1"	"1"
"attribute"	"OSLO-Onderdeel"	"plantmaatOmtrek"	"{A7051D6E-EC93-4bbb-B516-BA5C0C63EAEC}"	""	"DtcAanlegBoomvorm"	"{D3CE333C-01B0-4ba5-A26A-535D5ADA25B9}"	"KlPlantmaatOmtrek"	"Plantmaat omtrek"	"De stamomtrek in centimeter  (gemeten op 1 m boven het maaiveld) met een minimum en maximum waarde."	""	"Plantmaat omtrek"	"De stamomtrek in centimeter  (gemeten op 1 m boven het maaiveld) met een minimum en maximum waarde."	""	""	"true"	"https://wegenenverkeer-test.data.vlaanderen.be/ns/onderdeel#"	"DtcAanlegBoomvorm.plantmaatOmtrek"	"http://www.w3.org/2002/07/owl#ObjectProperty"	"https://wegenenverkeer-test.data.vlaanderen.be/ns/onderdeel#DtcAanlegBoomvorm"	"http://www.w3.org/2004/02/skos/core#Concept"	""	"1"	"1"
"attribute"	"OSLO-Onderdeel"	"verankering"	"{A5CA9AFC-9A73-442d-8BB1-AB65331261F0}"	""	"DtcAanlegBoomvorm"	"{D3CE333C-01B0-4ba5-A26A-535D5ADA25B9}"	"KlBoomVerankering"	"verankering"	"Aanduiding of de boom onder- of bovengronds gefixeerd wordt."	""	"verankering"	"Aanduiding of de boom onder- of bovengronds gefixeerd wordt."	""	""	"true"	"https://wegenenverkeer-test.data.vlaanderen.be/ns/onderdeel#"	"DtcAanlegBoomvorm.verankering"	"http://www.w3.org/2002/07/owl#ObjectProperty"	"https://wegenenverkeer-test.data.vlaanderen.be/ns/onderdeel#DtcAanlegBoomvorm"	"http://www.w3.org/2004/02/skos/core#Concept"	""	"1"	"1"
"attribute"	"OSLO-Onderdeel"	"verankeringstype"	"{AEE4CA83-AEA1-4948-9A31-708F76B9840F}"	""	"DtcAanlegBoomvorm"	"{D3CE333C-01B0-4ba5-A26A-535D5ADA25B9}"	"KlBoomVerankeringtype"	"verankeringstype"	"Het materiaal van de fixering of verankering."	""	"verankeringstype"	"Het materiaal van de fixering of verankering."	""	""	"true"	"https://wegenenverkeer-test.data.vlaanderen.be/ns/onderdeel#"	"DtcAanlegBoomvorm.verankeringstype"	"http://www.w3.org/2002/07/owl#ObjectProperty"	"https://wegenenverkeer-test.data.vlaanderen.be/ns/onderdeel#DtcAanlegBoomvorm"	"http://www.w3.org/2004/02/skos/core#Concept"	""	"1"	"1"
